No.     Time        Source                Destination           Protocol Info
      1 0.000000    127.0.0.1             127.0.0.1             TCP      16312 > commplex-main [SYN] Seq=1 Win=65535 Len=0 TSV=1322146316 TSER=0
      2 0.019135    127.0.0.1             127.0.0.1             TCP      16312 > commplex-main [SYN] Seq=1 Win=65535 Len=0 TSV=1322146316 TSER=0
      3 0.039376    127.0.0.1             127.0.0.1             TCP      commplex-main > 16312 [SYN, ACK] Seq=1 Ack=2 Win=65535 Len=0 TSV=1322185719 TSER=1322146316
      4 0.058473    127.0.0.1             127.0.0.1             TCP      commplex-main > 16312 [SYN, ACK] Seq=1 Ack=2 Win=65535 Len=0 TSV=1322185719 TSER=1322146316
      5 0.078613    127.0.0.1             127.0.0.1             TCP      16312 > commplex-main [ACK] Seq=2 Ack=2 Win=65535 Len=0 TSV=1322224963 TSER=1322185719
      6 0.097930    127.0.0.1             127.0.0.1             TCP      16312 > commplex-main [ACK] Seq=2 Ack=2 Win=65535 Len=0 TSV=1322224963 TSER=1322185719
      7 0.098749    127.0.0.1             127.0.0.1             TCP      16312 > commplex-main [ACK] Seq=2 Ack=2 Win=65535 Len=1448 TSV=1322225176 TSER=1322185719
      8 0.117920    127.0.0.1             127.0.0.1             TCP      16312 > commplex-main [ACK] Seq=2 Ack=2 Win=65535 Len=1448 TSV=1322225176 TSER=1322185719
      9 0.138138    127.0.0.1             127.0.0.1             TCP      commplex-main > 16312 [ACK] Seq=2 Ack=1450 Win=65535 Len=0 TSV=1322284420 TSER=1322225176
     10 0.157299    127.0.0.1             127.0.0.1             TCP      commplex-main > 16312 [ACK] Seq=2 Ack=1450 Win=65535 Len=0 TSV=1322284420 TSER=1322225176
     11 0.177610    127.0.0.1             127.0.0.1             TCP      16312 > commplex-main [ACK] Seq=1450 Ack=2 Win=65535 Len=1448 TSV=1322323883 TSER=1322284420
     12 0.196718    127.0.0.1             127.0.0.1             TCP      16312 > commplex-main [ACK] Seq=1450 Ack=2 Win=65535 Len=1448 TSV=1322323883 TSER=1322284420
     13 0.197688    127.0.0.1             127.0.0.1             TCP      16312 > commplex-main [ACK] Seq=2898 Ack=2 Win=65535 Len=1448 TSV=1322323887 TSER=1322284420
     14 0.216859    127.0.0.1             127.0.0.1             TCP      16312 > commplex-main [ACK] Seq=2898 Ack=2 Win=65535 Len=1448 TSV=1322323887 TSER=1322284420
     15 0.217760    127.0.0.1             127.0.0.1             TCP      commplex-main > 16312 [ACK] Seq=2 Ack=2898 Win=65535 Len=0 TSV=1322363204 TSER=1322323883
     16 0.236916    127.0.0.1             127.0.0.1             TCP      commplex-main > 16312 [ACK] Seq=2 Ack=2898 Win=65535 Len=0 TSV=1322363204 TSER=1322323883
     17 0.237840    127.0.0.1             127.0.0.1             TCP      commplex-main > 16312 [ACK] Seq=2 Ack=4346 Win=65535 Len=0 TSV=1322383337 TSER=1322323887
     18 0.256960    127.0.0.1             127.0.0.1             TCP      commplex-main > 16312 [ACK] Seq=2 Ack=4346 Win=65535 Len=0 TSV=1322383337 TSER=1322323887
     19 0.257975    127.0.0.1             127.0.0.1             TCP      16312 > commplex-main [ACK] Seq=4346 Ack=2 Win=65535 Len=1448 TSV=1322403501 TSER=1322363204
     20 0.277142    127.0.0.1             127.0.0.1             TCP      16312 > commplex-main [ACK] Seq=4346 Ack=2 Win=65535 Len=1448 TSV=1322403501 TSER=1322363204
     21 0.278054    127.0.0.1             127.0.0.1             TCP      16312 > commplex-main [ACK] Seq=5794 Ack=2 Win=65535 Len=1448 TSV=1322403505 TSER=1322363204
     22 0.297221    127.0.0.1             127.0.0.1             TCP      16312 > commplex-main [ACK] Seq=5794 Ack=2 Win=65535 Len=1448 TSV=1322403505 TSER=1322363204
     23 0.298130    127.0.0.1             127.0.0.1             TCP      16312 > commplex-main [ACK] Seq=7242 Ack=2 Win=65535 Len=1448 TSV=1322423503 TSER=1322383337
     24 0.317296    127.0.0.1             127.0.0.1             TCP      16312 > commplex-main [ACK] Seq=7242 Ack=2 Win=65535 Len=1448 TSV=1322423503 TSER=1322383337
     25 0.318263    127.0.0.1             127.0.0.1             TCP      16312 > commplex-main [ACK] Seq=8690 Ack=2 Win=65535 Len=1448 TSV=1322423509 TSER=1322383337
     26 0.337426    127.0.0.1             127.0.0.1             TCP      16312 > commplex-main [ACK] Seq=8690 Ack=2 Win=65535 Len=1448 TSV=1322423509 TSER=1322383337
     27 0.338348    127.0.0.1             127.0.0.1             TCP      commplex-main > 16312 [ACK] Seq=2 Ack=5794 Win=65535 Len=0 TSV=1322443632 TSER=1322403501
     28 0.357464    127.0.0.1             127.0.0.1             TCP      commplex-main > 16312 [ACK] Seq=2 Ack=5794 Win=65535 Len=0 TSV=1322443632 TSER=1322403501
     29 0.358425    127.0.0.1             127.0.0.1             TCP      commplex-main > 16312 [ACK] Seq=2 Ack=7242 Win=65535 Len=0 TSV=1322463702 TSER=1322403505
     30 0.377587    127.0.0.1             127.0.0.1             TCP      commplex-main > 16312 [ACK] Seq=2 Ack=7242 Win=65535 Len=0 TSV=1322463702 TSER=1322403505
     31 0.378500    127.0.0.1             127.0.0.1             TCP      commplex-main > 16312 [ACK] Seq=2 Ack=8690 Win=65535 Len=0 TSV=1322483783 TSER=1322423503
     32 0.397677    127.0.0.1             127.0.0.1             TCP      commplex-main > 16312 [ACK] Seq=2 Ack=8690 Win=65535 Len=0 TSV=1322483783 TSER=1322423503
     33 0.398576    127.0.0.1             127.0.0.1             TCP      commplex-main > 16312 [ACK] Seq=2 Ack=10138 Win=65535 Len=0 TSV=1322503994 TSER=1322423509
     34 0.417740    127.0.0.1             127.0.0.1             TCP      commplex-main > 16312 [ACK] Seq=2 Ack=10138 Win=65535 Len=0 TSV=1322503994 TSER=1322423509
     35 0.418652    127.0.0.1             127.0.0.1             TCP      16312 > commplex-main [ACK] Seq=10138 Ack=2 Win=65535 Len=1448 TSV=1322524042 TSER=1322443632
     36 0.438723    127.0.0.1             127.0.0.1             TCP      16312 > commplex-main [ACK] Seq=11586 Ack=2 Win=65535 Len=1448 TSV=1322524048 TSER=1322443632
     37 0.458860    127.0.0.1             127.0.0.1             TCP      16312 > commplex-main [ACK] Seq=13034 Ack=2 Win=65535 Len=1448 TSV=1322544120 TSER=1322463702
     38 0.478972    127.0.0.1             127.0.0.1             TCP      16312 > commplex-main [ACK] Seq=14482 Ack=2 Win=65535 Len=1448 TSV=1322544124 TSER=1322463702
     39 0.499106    127.0.0.1             127.0.0.1             TCP      16312 > commplex-main [ACK] Seq=15930 Ack=2 Win=65535 Len=1448 TSV=1322564227 TSER=1322483783
     40 0.519242    127.0.0.1             127.0.0.1             TCP      16312 > commplex-main [ACK] Seq=17378 Ack=2 Win=65535 Len=1448 TSV=1322564231 TSER=1322483783
     41 0.539376    127.0.0.1             127.0.0.1             TCP      16312 > commplex-main [ACK] Seq=18826 Ack=2 Win=65535 Len=1448 TSV=1322584271 TSER=1322503994
     42 0.559509    127.0.0.1             127.0.0.1             TCP      16312 > commplex-main [ACK] Seq=20274 Ack=2 Win=65535 Len=1448 TSV=1322584275 TSER=1322503994
     43 1.438249    127.0.0.1             127.0.0.1             TCP      16312 > commplex-main [ACK] Seq=10138 Ack=2 Win=65535 Len=1448 TSV=1323584542 TSER=1322503994
     44 3.438582    127.0.0.1             127.0.0.1             TCP      16312 > commplex-main [ACK] Seq=10138 Ack=2 Win=65535 Len=1448 TSV=1325584898 TSER=1322503994
     45 3.457713    127.0.0.1             127.0.0.1             TCP      16312 > commplex-main [ACK] Seq=10138 Ack=2 Win=65535 Len=1448 TSV=1325584898 TSER=1322503994
     46 3.477925    127.0.0.1             127.0.0.1             TCP      commplex-main > 16312 [ACK] Seq=2 Ack=11586 Win=65535 Len=0 TSV=1325624208 TSER=1325584898
     47 3.497094    127.0.0.1             127.0.0.1             TCP      commplex-main > 16312 [ACK] Seq=2 Ack=11586 Win=65535 Len=0 TSV=1325624208 TSER=1325584898
     48 3.517396    127.0.0.1             127.0.0.1             TCP      16312 > commplex-main [ACK] Seq=11586 Ack=2 Win=65535 Len=1448 TSV=1325663649 TSER=1325624208
     49 3.536552    127.0.0.1             127.0.0.1             TCP      16312 > commplex-main [ACK] Seq=11586 Ack=2 Win=65535 Len=1448 TSV=1325663649 TSER=1325624208
     50 3.537440    127.0.0.1             127.0.0.1             TCP      16312 > commplex-main [ACK] Seq=13034 Ack=2 Win=65535 Len=1448 TSV=1325663653 TSER=1325624208
     51 3.556597    127.0.0.1             127.0.0.1             TCP      16312 > commplex-main [ACK] Seq=13034 Ack=2 Win=65535 Len=1448 TSV=1325663653 TSER=1325624208
     52 3.557517    127.0.0.1             127.0.0.1             TCP      commplex-main > 16312 [ACK] Seq=2 Ack=13034 Win=65535 Len=0 TSV=1325703060 TSER=1325663649
     53 3.576680    127.0.0.1             127.0.0.1             TCP      commplex-main > 16312 [ACK] Seq=2 Ack=13034 Win=65535 Len=0 TSV=1325703060 TSER=1325663649
     54 3.577593    127.0.0.1             127.0.0.1             TCP      commplex-main > 16312 [ACK] Seq=2 Ack=14482 Win=65535 Len=0 TSV=1325723097 TSER=1325663653
     55 3.596707    127.0.0.1             127.0.0.1             TCP      commplex-main > 16312 [ACK] Seq=2 Ack=14482 Win=65535 Len=0 TSV=1325723097 TSER=1325663653
     56 3.597733    127.0.0.1             127.0.0.1             TCP      16312 > commplex-main [ACK] Seq=14482 Ack=2 Win=65535 Len=1448 TSV=1325743252 TSER=1325703060
     57 3.616907    127.0.0.1             127.0.0.1             TCP      16312 > commplex-main [ACK] Seq=14482 Ack=2 Win=65535 Len=1448 TSV=1325743252 TSER=1325703060
     58 3.617819    127.0.0.1             127.0.0.1             TCP      16312 > commplex-main [ACK] Seq=15930 Ack=2 Win=65535 Len=1448 TSV=1325743279 TSER=1325703060
     59 3.636954    127.0.0.1             127.0.0.1             TCP      16312 > commplex-main [ACK] Seq=15930 Ack=2 Win=65535 Len=1448 TSV=1325743279 TSER=1325703060
     60 3.637894    127.0.0.1             127.0.0.1             TCP      16312 > commplex-main [ACK] Seq=17378 Ack=2 Win=65535 Len=1448 TSV=1325763253 TSER=1325723097
     61 3.657006    127.0.0.1             127.0.0.1             TCP      16312 > commplex-main [ACK] Seq=17378 Ack=2 Win=65535 Len=1448 TSV=1325763253 TSER=1325723097
     62 3.657970    127.0.0.1             127.0.0.1             TCP      commplex-main > 16312 [ACK] Seq=2 Ack=15930 Win=65535 Len=0 TSV=1325783397 TSER=1325743252
     63 3.677133    127.0.0.1             127.0.0.1             TCP      commplex-main > 16312 [ACK] Seq=2 Ack=15930 Win=65535 Len=0 TSV=1325783397 TSER=1325743252
     64 3.678102    127.0.0.1             127.0.0.1             TCP      commplex-main > 16312 [ACK] Seq=2 Ack=17378 Win=65535 Len=0 TSV=1325803442 TSER=1325743279
     65 3.697270    127.0.0.1             127.0.0.1             TCP      commplex-main > 16312 [ACK] Seq=2 Ack=17378 Win=65535 Len=0 TSV=1325803442 TSER=1325743279
     66 3.698178    127.0.0.1             127.0.0.1             TCP      commplex-main > 16312 [ACK] Seq=2 Ack=18826 Win=65535 Len=0 TSV=1325823494 TSER=1325763253
     67 3.717275    127.0.0.1             127.0.0.1             TCP      commplex-main > 16312 [ACK] Seq=2 Ack=18826 Win=65535 Len=0 TSV=1325823494 TSER=1325763253
     68 3.718250    127.0.0.1             127.0.0.1             TCP      16312 > commplex-main [ACK] Seq=18826 Ack=2 Win=65535 Len=1448 TSV=1325843665 TSER=1325783397
     69 3.737401    127.0.0.1             127.0.0.1             TCP      16312 > commplex-main [ACK] Seq=18826 Ack=2 Win=65535 Len=1448 TSV=1325843665 TSER=1325783397
     70 3.738323    127.0.0.1             127.0.0.1             TCP      16312 > commplex-main [ACK] Seq=20274 Ack=2 Win=65535 Len=1448 TSV=1325863818 TSER=1325803442
     71 3.757378    127.0.0.1             127.0.0.1             TCP      16312 > commplex-main [ACK] Seq=20274 Ack=2 Win=65535 Len=1448 TSV=1325863818 TSER=1325803442
     72 3.758408    127.0.0.1             127.0.0.1             TCP      16312 > commplex-main [ACK] Seq=21722 Ack=2 Win=65535 Len=1448 TSV=1325883815 TSER=1325823494
     73 3.777511    127.0.0.1             127.0.0.1             TCP      16312 > commplex-main [ACK] Seq=21722 Ack=2 Win=65535 Len=1448 TSV=1325883815 TSER=1325823494
     74 3.778505    127.0.0.1             127.0.0.1             TCP      16312 > commplex-main [ACK] Seq=23170 Ack=2 Win=65535 Len=1448 TSV=1325883831 TSER=1325823494
     75 3.797611    127.0.0.1             127.0.0.1             TCP      16312 > commplex-main [ACK] Seq=23170 Ack=2 Win=65535 Len=1448 TSV=1325883831 TSER=1325823494
     76 3.798586    127.0.0.1             127.0.0.1             TCP      commplex-main > 16312 [ACK] Seq=2 Ack=20274 Win=65535 Len=0 TSV=1325903911 TSER=1325843665
     77 3.817745    127.0.0.1             127.0.0.1             TCP      commplex-main > 16312 [ACK] Seq=2 Ack=20274 Win=65535 Len=0 TSV=1325903911 TSER=1325843665
     78 3.818664    127.0.0.1             127.0.0.1             TCP      commplex-main > 16312 [ACK] Seq=2 Ack=21722 Win=65535 Len=0 TSV=1325923905 TSER=1325863818
     79 3.837771    127.0.0.1             127.0.0.1             TCP      commplex-main > 16312 [ACK] Seq=2 Ack=21722 Win=65535 Len=0 TSV=1325923905 TSER=1325863818
     80 3.838799    127.0.0.1             127.0.0.1             TCP      commplex-main > 16312 [ACK] Seq=2 Ack=23170 Win=65535 Len=0 TSV=1325944042 TSER=1325883815
     81 3.857954    127.0.0.1             127.0.0.1             TCP      commplex-main > 16312 [ACK] Seq=2 Ack=23170 Win=65535 Len=0 TSV=1325944042 TSER=1325883815
     82 3.858935    127.0.0.1             127.0.0.1             TCP      commplex-main > 16312 [ACK] Seq=2 Ack=24618 Win=65535 Len=0 TSV=1325964113 TSER=1325883831
     83 3.878094    127.0.0.1             127.0.0.1             TCP      commplex-main > 16312 [ACK] Seq=2 Ack=24618 Win=65535 Len=0 TSV=1325964113 TSER=1325883831
     84 3.879020    127.0.0.1             127.0.0.1             TCP      16312 > commplex-main [ACK] Seq=24618 Ack=2 Win=65535 Len=1448 TSV=1325984343 TSER=1325903911
     85 3.898190    127.0.0.1             127.0.0.1             TCP      16312 > commplex-main [ACK] Seq=24618 Ack=2 Win=65535 Len=1448 TSV=1325984343 TSER=1325903911
     86 3.899099    127.0.0.1             127.0.0.1             TCP      16312 > commplex-main [ACK] Seq=26066 Ack=2 Win=65535 Len=1448 TSV=1326004300 TSER=1325923905
     87 3.918265    127.0.0.1             127.0.0.1             TCP      16312 > commplex-main [ACK] Seq=26066 Ack=2 Win=65535 Len=1448 TSV=1326004300 TSER=1325923905
     88 3.919176    127.0.0.1             127.0.0.1             TCP      16312 > commplex-main [ACK] Seq=27514 Ack=2 Win=65535 Len=1448 TSV=1326024490 TSER=1325944042
     89 3.938346    127.0.0.1             127.0.0.1             TCP      16312 > commplex-main [ACK] Seq=27514 Ack=2 Win=65535 Len=1448 TSV=1326024490 TSER=1325944042
     90 3.939266    127.0.0.1             127.0.0.1             TCP      16312 > commplex-main [ACK] Seq=28962 Ack=2 Win=65535 Len=1448 TSV=1326044647 TSER=1325964113
     91 3.958443    127.0.0.1             127.0.0.1             TCP      16312 > commplex-main [ACK] Seq=28962 Ack=2 Win=65535 Len=1448 TSV=1326044647 TSER=1325964113
     92 3.959354    127.0.0.1             127.0.0.1             TCP      16312 > commplex-main [ACK] Seq=30410 Ack=2 Win=65535 Len=1448 TSV=1326044651 TSER=1325964113
     93 3.978523    127.0.0.1             127.0.0.1             TCP      16312 > commplex-main [ACK] Seq=30410 Ack=2 Win=65535 Len=1448 TSV=1326044651 TSER=1325964113
     94 3.979486    127.0.0.1             127.0.0.1             TCP      commplex-main > 16312 [ACK] Seq=2 Ack=26066 Win=65535 Len=0 TSV=1326064678 TSER=1325984343
     95 3.998651    127.0.0.1             127.0.0.1             TCP      commplex-main > 16312 [ACK] Seq=2 Ack=26066 Win=65535 Len=0 TSV=1326064678 TSER=1325984343
     96 3.999562    127.0.0.1             127.0.0.1             TCP      commplex-main > 16312 [ACK] Seq=2 Ack=27514 Win=65535 Len=0 TSV=1326084750 TSER=1326004300
     97 4.018680    127.0.0.1             127.0.0.1             TCP      commplex-main > 16312 [ACK] Seq=2 Ack=27514 Win=65535 Len=0 TSV=1326084750 TSER=1326004300
     98 4.019648    127.0.0.1             127.0.0.1             TCP      commplex-main > 16312 [ACK] Seq=2 Ack=28962 Win=65535 Len=0 TSV=1326104860 TSER=1326024490
     99 4.038751    127.0.0.1             127.0.0.1             TCP      commplex-main > 16312 [ACK] Seq=2 Ack=28962 Win=65535 Len=0 TSV=1326104860 TSER=1326024490
    100 4.039722    127.0.0.1             127.0.0.1             TCP      commplex-main > 16312 [ACK] Seq=2 Ack=30410 Win=65535 Len=0 TSV=1326124946 TSER=1326044647
    101 4.058825    127.0.0.1             127.0.0.1             TCP      commplex-main > 16312 [ACK] Seq=2 Ack=30410 Win=65535 Len=0 TSV=1326124946 TSER=1326044647
    102 4.059865    127.0.0.1             127.0.0.1             TCP      commplex-main > 16312 [ACK] Seq=2 Ack=31858 Win=65535 Len=0 TSV=1326145011 TSER=1326044651
    103 4.079032    127.0.0.1             127.0.0.1             TCP      commplex-main > 16312 [ACK] Seq=2 Ack=31858 Win=65535 Len=0 TSV=1326145011 TSER=1326044651
    104 4.079959    127.0.0.1             127.0.0.1             TCP      16312 > commplex-main [ACK] Seq=31858 Ack=2 Win=65535 Len=1448 TSV=1326165228 TSER=1326064678
    105 4.099117    127.0.0.1             127.0.0.1             TCP      16312 > commplex-main [ACK] Seq=31858 Ack=2 Win=65535 Len=1448 TSV=1326165228 TSER=1326064678
    106 4.100045    127.0.0.1             127.0.0.1             TCP      16312 > commplex-main [ACK] Seq=33306 Ack=2 Win=65535 Len=1448 TSV=1326185257 TSER=1326084750
    107 4.119212    127.0.0.1             127.0.0.1             TCP      16312 > commplex-main [ACK] Seq=33306 Ack=2 Win=65535 Len=1448 TSV=1326185257 TSER=1326084750
    108 4.120128    127.0.0.1             127.0.0.1             TCP      16312 > commplex-main [ACK] Seq=34754 Ack=2 Win=65535 Len=1448 TSV=1326205282 TSER=1326104860
    109 4.139244    127.0.0.1             127.0.0.1             TCP      16312 > commplex-main [ACK] Seq=34754 Ack=2 Win=65535 Len=1448 TSV=1326205282 TSER=1326104860
    110 4.140216    127.0.0.1             127.0.0.1             TCP      16312 > commplex-main [ACK] Seq=36202 Ack=2 Win=65535 Len=1448 TSV=1326225359 TSER=1326124946
    111 4.159386    127.0.0.1             127.0.0.1             TCP      16312 > commplex-main [ACK] Seq=36202 Ack=2 Win=65535 Len=1448 TSV=1326225359 TSER=1326124946
    112 4.160353    127.0.0.1             127.0.0.1             TCP      16312 > commplex-main [ACK] Seq=37650 Ack=2 Win=65535 Len=1448 TSV=1326245567 TSER=1326145011
    113 4.179520    127.0.0.1             127.0.0.1             TCP      16312 > commplex-main [ACK] Seq=37650 Ack=2 Win=65535 Len=1448 TSV=1326245567 TSER=1326145011
    114 4.180434    127.0.0.1             127.0.0.1             TCP      commplex-main > 16312 [ACK] Seq=2 Ack=33306 Win=65535 Len=0 TSV=1326265613 TSER=1326165228
    115 4.199600    127.0.0.1             127.0.0.1             TCP      commplex-main > 16312 [ACK] Seq=2 Ack=33306 Win=65535 Len=0 TSV=1326265613 TSER=1326165228
    116 4.200512    127.0.0.1             127.0.0.1             TCP      commplex-main > 16312 [ACK] Seq=2 Ack=34754 Win=65535 Len=0 TSV=1326285703 TSER=1326185257
    117 4.219678    127.0.0.1             127.0.0.1             TCP      commplex-main > 16312 [ACK] Seq=2 Ack=34754 Win=65535 Len=0 TSV=1326285703 TSER=1326185257
    118 4.220647    127.0.0.1             127.0.0.1             TCP      commplex-main > 16312 [ACK] Seq=2 Ack=36202 Win=65535 Len=0 TSV=1326305738 TSER=1326205282
    119 4.239809    127.0.0.1             127.0.0.1             TCP      commplex-main > 16312 [ACK] Seq=2 Ack=36202 Win=65535 Len=0 TSV=1326305738 TSER=1326205282
    120 4.240797    127.0.0.1             127.0.0.1             TCP      commplex-main > 16312 [ACK] Seq=2 Ack=37650 Win=65535 Len=0 TSV=1326325872 TSER=1326225359
    121 4.259948    127.0.0.1             127.0.0.1             TCP      commplex-main > 16312 [ACK] Seq=2 Ack=37650 Win=65535 Len=0 TSV=1326325872 TSER=1326225359
    122 4.260930    127.0.0.1             127.0.0.1             TCP      commplex-main > 16312 [ACK] Seq=2 Ack=39098 Win=65535 Len=0 TSV=1326346010 TSER=1326245567
    123 4.280087    127.0.0.1             127.0.0.1             TCP      commplex-main > 16312 [ACK] Seq=2 Ack=39098 Win=65535 Len=0 TSV=1326346010 TSER=1326245567
    124 4.281016    127.0.0.1             127.0.0.1             TCP      16312 > commplex-main [ACK] Seq=39098 Ack=2 Win=65535 Len=1448 TSV=1326366182 TSER=1326265613
    125 4.300178    127.0.0.1             127.0.0.1             TCP      16312 > commplex-main [ACK] Seq=39098 Ack=2 Win=65535 Len=1448 TSV=1326366182 TSER=1326265613
    126 4.301093    127.0.0.1             127.0.0.1             TCP      16312 > commplex-main [ACK] Seq=40546 Ack=2 Win=65535 Len=1448 TSV=1326366214 TSER=1326265613
    127 4.320256    127.0.0.1             127.0.0.1             TCP      16312 > commplex-main [ACK] Seq=40546 Ack=2 Win=65535 Len=1448 TSV=1326366214 TSER=1326265613
    128 4.321166    127.0.0.1             127.0.0.1             TCP      16312 > commplex-main [ACK] Seq=41994 Ack=2 Win=65535 Len=1448 TSV=1326386214 TSER=1326285703
    129 4.340321    127.0.0.1             127.0.0.1             TCP      16312 > commplex-main [ACK] Seq=41994 Ack=2 Win=65535 Len=1448 TSV=1326386214 TSER=1326285703
    130 4.341242    127.0.0.1             127.0.0.1             TCP      16312 > commplex-main [ACK] Seq=43442 Ack=2 Win=65535 Len=1448 TSV=1326406343 TSER=1326305738
    131 4.360400    127.0.0.1             127.0.0.1             TCP      16312 > commplex-main [ACK] Seq=43442 Ack=2 Win=65535 Len=1448 TSV=1326406343 TSER=1326305738
    132 4.361378    127.0.0.1             127.0.0.1             TCP      16312 > commplex-main [ACK] Seq=44890 Ack=2 Win=65535 Len=1448 TSV=1326426484 TSER=1326325872
    133 4.380539    127.0.0.1             127.0.0.1             TCP      16312 > commplex-main [ACK] Seq=44890 Ack=2 Win=65535 Len=1448 TSV=1326426484 TSER=1326325872
    134 4.381510    127.0.0.1             127.0.0.1             TCP      16312 > commplex-main [ACK] Seq=46338 Ack=2 Win=65535 Len=1448 TSV=1326446632 TSER=1326346010
    135 4.400666    127.0.0.1             127.0.0.1             TCP      16312 > commplex-main [ACK] Seq=46338 Ack=2 Win=65535 Len=1448 TSV=1326446632 TSER=1326346010
    136 4.401647    127.0.0.1             127.0.0.1             TCP      commplex-main > 16312 [ACK] Seq=2 Ack=40546 Win=65535 Len=0 TSV=1326466675 TSER=1326366182
    137 4.420812    127.0.0.1             127.0.0.1             TCP      commplex-main > 16312 [ACK] Seq=2 Ack=40546 Win=65535 Len=0 TSV=1326466675 TSER=1326366182
    138 4.421782    127.0.0.1             127.0.0.1             TCP      commplex-main > 16312 [ACK] Seq=2 Ack=41994 Win=65535 Len=0 TSV=1326486749 TSER=1326366214
    139 4.440941    127.0.0.1             127.0.0.1             TCP      commplex-main > 16312 [ACK] Seq=2 Ack=41994 Win=65535 Len=0 TSV=1326486749 TSER=1326366214
    140 4.441916    127.0.0.1             127.0.0.1             TCP      commplex-main > 16312 [ACK] Seq=2 Ack=43442 Win=65535 Len=0 TSV=1326506812 TSER=1326386214
    141 4.461082    127.0.0.1             127.0.0.1             TCP      commplex-main > 16312 [ACK] Seq=2 Ack=43442 Win=65535 Len=0 TSV=1326506812 TSER=1326386214
    142 4.462000    127.0.0.1             127.0.0.1             TCP      commplex-main > 16312 [ACK] Seq=2 Ack=44890 Win=65535 Len=0 TSV=1326526893 TSER=1326406343
    143 4.481167    127.0.0.1             127.0.0.1             TCP      commplex-main > 16312 [ACK] Seq=2 Ack=44890 Win=65535 Len=0 TSV=1326526893 TSER=1326406343
    144 4.482132    127.0.0.1             127.0.0.1             TCP      commplex-main > 16312 [ACK] Seq=2 Ack=46338 Win=65535 Len=0 TSV=1326547028 TSER=1326426484
    145 4.501292    127.0.0.1             127.0.0.1             TCP      commplex-main > 16312 [ACK] Seq=2 Ack=46338 Win=65535 Len=0 TSV=1326547028 TSER=1326426484
    146 4.502207    127.0.0.1             127.0.0.1             TCP      commplex-main > 16312 [ACK] Seq=2 Ack=47786 Win=65535 Len=0 TSV=1326567163 TSER=1326446632
    147 4.521373    127.0.0.1             127.0.0.1             TCP      commplex-main > 16312 [ACK] Seq=2 Ack=47786 Win=65535 Len=0 TSV=1326567163 TSER=1326446632
    148 4.522343    127.0.0.1             127.0.0.1             TCP      16312 > commplex-main [ACK] Seq=47786 Ack=2 Win=65535 Len=1448 TSV=1326587371 TSER=1326466675
    149 4.541396    127.0.0.1             127.0.0.1             TCP      16312 > commplex-main [ACK] Seq=47786 Ack=2 Win=65535 Len=1448 TSV=1326587371 TSER=1326466675
    150 4.542485    127.0.0.1             127.0.0.1             TCP      16312 > commplex-main [ACK] Seq=49234 Ack=2 Win=65535 Len=1448 TSV=1326607489 TSER=1326486749
    151 4.561651    127.0.0.1             127.0.0.1             TCP      16312 > commplex-main [ACK] Seq=49234 Ack=2 Win=65535 Len=1448 TSV=1326607489 TSER=1326486749
    152 4.562558    127.0.0.1             127.0.0.1             TCP      16312 > commplex-main [ACK] Seq=50682 Ack=2 Win=65535 Len=1448 TSV=1326607495 TSER=1326486749
    153 4.581716    127.0.0.1             127.0.0.1             TCP      16312 > commplex-main [ACK] Seq=50682 Ack=2 Win=65535 Len=1448 TSV=1326607495 TSER=1326486749
    154 4.582631    127.0.0.1             127.0.0.1             TCP      16312 > commplex-main [ACK] Seq=52130 Ack=2 Win=65535 Len=1448 TSV=1326627612 TSER=1326506812
    155 4.601791    127.0.0.1             127.0.0.1             TCP      16312 > commplex-main [ACK] Seq=52130 Ack=2 Win=65535 Len=1448 TSV=1326627612 TSER=1326506812
    156 4.602708    127.0.0.1             127.0.0.1             TCP      16312 > commplex-main [ACK] Seq=53578 Ack=2 Win=65535 Len=1448 TSV=1326647695 TSER=1326526893
    157 4.621879    127.0.0.1             127.0.0.1             TCP      16312 > commplex-main [ACK] Seq=53578 Ack=2 Win=65535 Len=1448 TSV=1326647695 TSER=1326526893
    158 4.622786    127.0.0.1             127.0.0.1             TCP      16312 > commplex-main [ACK] Seq=55026 Ack=2 Win=65535 Len=1448 TSV=1326667817 TSER=1326547028
    159 4.641891    127.0.0.1             127.0.0.1             TCP      16312 > commplex-main [ACK] Seq=55026 Ack=2 Win=65535 Len=1448 TSV=1326667817 TSER=1326547028
    160 4.642918    127.0.0.1             127.0.0.1             TCP      16312 > commplex-main [ACK] Seq=56474 Ack=2 Win=65535 Len=1448 TSV=1326687900 TSER=1326567163
    161 4.662029    127.0.0.1             127.0.0.1             TCP      16312 > commplex-main [ACK] Seq=56474 Ack=2 Win=65535 Len=1448 TSV=1326687900 TSER=1326567163
    162 4.663003    127.0.0.1             127.0.0.1             TCP      commplex-main > 16312 [ACK] Seq=2 Ack=49234 Win=65535 Len=0 TSV=1326707881 TSER=1326587371
    163 4.682186    127.0.0.1             127.0.0.1             TCP      commplex-main > 16312 [ACK] Seq=2 Ack=49234 Win=65535 Len=0 TSV=1326707881 TSER=1326587371
    164 4.683078    127.0.0.1             127.0.0.1             TCP      commplex-main > 16312 [ACK] Seq=2 Ack=50682 Win=65535 Len=0 TSV=1326728134 TSER=1326607489
    165 4.702239    127.0.0.1             127.0.0.1             TCP      commplex-main > 16312 [ACK] Seq=2 Ack=50682 Win=65535 Len=0 TSV=1326728134 TSER=1326607489
    166 4.703210    127.0.0.1             127.0.0.1             TCP      commplex-main > 16312 [ACK] Seq=2 Ack=52130 Win=65535 Len=0 TSV=1326748198 TSER=1326607495
    167 4.722371    127.0.0.1             127.0.0.1             TCP      commplex-main > 16312 [ACK] Seq=2 Ack=52130 Win=65535 Len=0 TSV=1326748198 TSER=1326607495
    168 4.723289    127.0.0.1             127.0.0.1             TCP      commplex-main > 16312 [ACK] Seq=2 Ack=53578 Win=65535 Len=0 TSV=1326768285 TSER=1326627612
    169 4.742462    127.0.0.1             127.0.0.1             TCP      commplex-main > 16312 [ACK] Seq=2 Ack=53578 Win=65535 Len=0 TSV=1326768285 TSER=1326627612
    170 4.743424    127.0.0.1             127.0.0.1             TCP      commplex-main > 16312 [ACK] Seq=2 Ack=55026 Win=65535 Len=0 TSV=1326788365 TSER=1326647695
    171 4.762582    127.0.0.1             127.0.0.1             TCP      commplex-main > 16312 [ACK] Seq=2 Ack=55026 Win=65535 Len=0 TSV=1326788365 TSER=1326647695
    172 4.763559    127.0.0.1             127.0.0.1             TCP      commplex-main > 16312 [ACK] Seq=2 Ack=56474 Win=65535 Len=0 TSV=1326808376 TSER=1326667817
    173 4.782665    127.0.0.1             127.0.0.1             TCP      commplex-main > 16312 [ACK] Seq=2 Ack=56474 Win=65535 Len=0 TSV=1326808376 TSER=1326667817
    174 4.783637    127.0.0.1             127.0.0.1             TCP      commplex-main > 16312 [ACK] Seq=2 Ack=57922 Win=65535 Len=0 TSV=1326828543 TSER=1326687900
    175 4.802738    127.0.0.1             127.0.0.1             TCP      commplex-main > 16312 [ACK] Seq=2 Ack=57922 Win=65535 Len=0 TSV=1326828543 TSER=1326687900
    176 4.803714    127.0.0.1             127.0.0.1             TCP      16312 > commplex-main [ACK] Seq=57922 Ack=2 Win=65535 Len=1448 TSV=1326848758 TSER=1326707881
    177 4.822808    127.0.0.1             127.0.0.1             TCP      16312 > commplex-main [ACK] Seq=57922 Ack=2 Win=65535 Len=1448 TSV=1326848758 TSER=1326707881
    178 4.823790    127.0.0.1             127.0.0.1             TCP      16312 > commplex-main [ACK] Seq=59370 Ack=2 Win=65535 Len=1448 TSV=1326868770 TSER=1326728134
    179 4.842889    127.0.0.1             127.0.0.1             TCP      16312 > commplex-main [ACK] Seq=59370 Ack=2 Win=65535 Len=1448 TSV=1326868770 TSER=1326728134
    180 4.843866    127.0.0.1             127.0.0.1             TCP      16312 > commplex-main [ACK] Seq=60818 Ack=2 Win=65535 Len=1448 TSV=1326888924 TSER=1326748198
    181 4.862967    127.0.0.1             127.0.0.1             TCP      16312 > commplex-main [ACK] Seq=60818 Ack=2 Win=65535 Len=1448 TSV=1326888924 TSER=1326748198
    182 4.863949    127.0.0.1             127.0.0.1             TCP      16312 > commplex-main [ACK] Seq=62266 Ack=2 Win=65535 Len=1448 TSV=1326908995 TSER=1326768285
    183 4.883046    127.0.0.1             127.0.0.1             TCP      16312 > commplex-main [ACK] Seq=62266 Ack=2 Win=65535 Len=1448 TSV=1326908995 TSER=1326768285
    184 4.884031    127.0.0.1             127.0.0.1             TCP      16312 > commplex-main [ACK] Seq=63714 Ack=2 Win=65535 Len=1448 TSV=1326909025 TSER=1326768285
    185 4.903140    127.0.0.1             127.0.0.1             TCP      16312 > commplex-main [ACK] Seq=63714 Ack=2 Win=65535 Len=1448 TSV=1326909025 TSER=1326768285
    186 4.904117    127.0.0.1             127.0.0.1             TCP      16312 > commplex-main [ACK] Seq=65162 Ack=2 Win=65535 Len=1448 TSV=1326929118 TSER=1326788365
    187 4.923199    127.0.0.1             127.0.0.1             TCP      16312 > commplex-main [ACK] Seq=65162 Ack=2 Win=65535 Len=1448 TSV=1326929118 TSER=1326788365
    188 4.924191    127.0.0.1             127.0.0.1             TCP      16312 > commplex-main [ACK] Seq=66610 Ack=2 Win=65535 Len=1448 TSV=1326949235 TSER=1326808376
    189 4.943285    127.0.0.1             127.0.0.1             TCP      16312 > commplex-main [ACK] Seq=66610 Ack=2 Win=65535 Len=1448 TSV=1326949235 TSER=1326808376
    190 4.944266    127.0.0.1             127.0.0.1             TCP      16312 > commplex-main [ACK] Seq=68058 Ack=2 Win=65535 Len=1448 TSV=1326969284 TSER=1326828543
    191 4.963356    127.0.0.1             127.0.0.1             TCP      16312 > commplex-main [ACK] Seq=68058 Ack=2 Win=65535 Len=1448 TSV=1326969284 TSER=1326828543
    192 4.964341    127.0.0.1             127.0.0.1             TCP      commplex-main > 16312 [ACK] Seq=2 Ack=59370 Win=65535 Len=0 TSV=1326989299 TSER=1326848758
    193 4.983439    127.0.0.1             127.0.0.1             TCP      commplex-main > 16312 [ACK] Seq=2 Ack=59370 Win=65535 Len=0 TSV=1326989299 TSER=1326848758
    194 4.984419    127.0.0.1             127.0.0.1             TCP      commplex-main > 16312 [ACK] Seq=2 Ack=60818 Win=65535 Len=0 TSV=1327009378 TSER=1326868770
    195 5.003515    127.0.0.1             127.0.0.1             TCP      commplex-main > 16312 [ACK] Seq=2 Ack=60818 Win=65535 Len=0 TSV=1327009378 TSER=1326868770
    196 5.004494    127.0.0.1             127.0.0.1             TCP      commplex-main > 16312 [ACK] Seq=2 Ack=62266 Win=65535 Len=0 TSV=1327029464 TSER=1326888924
    197 5.023580    127.0.0.1             127.0.0.1             TCP      commplex-main > 16312 [ACK] Seq=2 Ack=62266 Win=65535 Len=0 TSV=1327029464 TSER=1326888924
    198 5.024577    127.0.0.1             127.0.0.1             TCP      commplex-main > 16312 [ACK] Seq=2 Ack=63714 Win=65535 Len=0 TSV=1327049539 TSER=1326908995
    199 5.043671    127.0.0.1             127.0.0.1             TCP      commplex-main > 16312 [ACK] Seq=2 Ack=63714 Win=65535 Len=0 TSV=1327049539 TSER=1326908995
    200 5.044650    127.0.0.1             127.0.0.1             TCP      commplex-main > 16312 [ACK] Seq=2 Ack=65162 Win=65535 Len=0 TSV=1327069624 TSER=1326909025
    201 5.063735    127.0.0.1             127.0.0.1             TCP      commplex-main > 16312 [ACK] Seq=2 Ack=65162 Win=65535 Len=0 TSV=1327069624 TSER=1326909025
    202 5.064727    127.0.0.1             127.0.0.1             TCP      commplex-main > 16312 [ACK] Seq=2 Ack=66610 Win=65535 Len=0 TSV=1327089686 TSER=1326929118
    203 5.083820    127.0.0.1             127.0.0.1             TCP      commplex-main > 16312 [ACK] Seq=2 Ack=66610 Win=65535 Len=0 TSV=1327089686 TSER=1326929118
    204 5.084809    127.0.0.1             127.0.0.1             TCP      commplex-main > 16312 [ACK] Seq=2 Ack=68058 Win=65535 Len=0 TSV=1327109770 TSER=1326949235
    205 5.103913    127.0.0.1             127.0.0.1             TCP      commplex-main > 16312 [ACK] Seq=2 Ack=68058 Win=65535 Len=0 TSV=1327109770 TSER=1326949235
    206 5.104893    127.0.0.1             127.0.0.1             TCP      commplex-main > 16312 [ACK] Seq=2 Ack=69506 Win=65535 Len=0 TSV=1327129842 TSER=1326969284
    207 5.123991    127.0.0.1             127.0.0.1             TCP      commplex-main > 16312 [ACK] Seq=2 Ack=69506 Win=65535 Len=0 TSV=1327129842 TSER=1326969284
    208 5.124982    127.0.0.1             127.0.0.1             TCP      16312 > commplex-main [ACK] Seq=69506 Ack=2 Win=65535 Len=1448 TSV=1327149984 TSER=1326989299
    209 5.144088    127.0.0.1             127.0.0.1             TCP      16312 > commplex-main [ACK] Seq=69506 Ack=2 Win=65535 Len=1448 TSV=1327149984 TSER=1326989299
    210 5.145058    127.0.0.1             127.0.0.1             TCP      16312 > commplex-main [ACK] Seq=70954 Ack=2 Win=65535 Len=1448 TSV=1327170058 TSER=1327009378
    211 5.164157    127.0.0.1             127.0.0.1             TCP      16312 > commplex-main [ACK] Seq=70954 Ack=2 Win=65535 Len=1448 TSV=1327170058 TSER=1327009378
    212 5.165145    127.0.0.1             127.0.0.1             TCP      16312 > commplex-main [ACK] Seq=72402 Ack=2 Win=65535 Len=1448 TSV=1327190109 TSER=1327029464
    213 5.184263    127.0.0.1             127.0.0.1             TCP      16312 > commplex-main [ACK] Seq=72402 Ack=2 Win=65535 Len=1448 TSV=1327190109 TSER=1327029464
    214 5.185238    127.0.0.1             127.0.0.1             TCP      16312 > commplex-main [ACK] Seq=73850 Ack=2 Win=65535 Len=1448 TSV=1327210194 TSER=1327049539
    215 5.204360    127.0.0.1             127.0.0.1             TCP      16312 > commplex-main [ACK] Seq=73850 Ack=2 Win=65535 Len=1448 TSV=1327210194 TSER=1327049539
    216 5.205322    127.0.0.1             127.0.0.1             TCP      16312 > commplex-main [ACK] Seq=75298 Ack=2 Win=65535 Len=1448 TSV=1327230260 TSER=1327069624
    217 5.224431    127.0.0.1             127.0.0.1             TCP      16312 > commplex-main [ACK] Seq=75298 Ack=2 Win=65535 Len=1448 TSV=1327230260 TSER=1327069624
    218 5.225406    127.0.0.1             127.0.0.1             TCP      16312 > commplex-main [ACK] Seq=76746 Ack=2 Win=65535 Len=1448 TSV=1327230264 TSER=1327069624
    219 5.244518    127.0.0.1             127.0.0.1             TCP      16312 > commplex-main [ACK] Seq=76746 Ack=2 Win=65535 Len=1448 TSV=1327230264 TSER=1327069624
    220 5.245484    127.0.0.1             127.0.0.1             TCP      16312 > commplex-main [ACK] Seq=78194 Ack=2 Win=65535 Len=1448 TSV=1327250386 TSER=1327089686
    221 5.264593    127.0.0.1             127.0.0.1             TCP      16312 > commplex-main [ACK] Seq=78194 Ack=2 Win=65535 Len=1448 TSV=1327250386 TSER=1327089686
    222 5.265569    127.0.0.1             127.0.0.1             TCP      16312 > commplex-main [ACK] Seq=79642 Ack=2 Win=65535 Len=1448 TSV=1327270443 TSER=1327109770
    223 5.284674    127.0.0.1             127.0.0.1             TCP      16312 > commplex-main [ACK] Seq=79642 Ack=2 Win=65535 Len=1448 TSV=1327270443 TSER=1327109770
    224 5.285646    127.0.0.1             127.0.0.1             TCP      16312 > commplex-main [ACK] Seq=81090 Ack=2 Win=65535 Len=1448 TSV=1327290568 TSER=1327129842
    225 5.304804    127.0.0.1             127.0.0.1             TCP      16312 > commplex-main [ACK] Seq=81090 Ack=2 Win=65535 Len=1448 TSV=1327290568 TSER=1327129842
    226 5.305723    127.0.0.1             127.0.0.1             TCP      commplex-main > 16312 [ACK] Seq=2 Ack=70954 Win=65535 Len=0 TSV=1327310565 TSER=1327149984
    227 5.324879    127.0.0.1             127.0.0.1             TCP      commplex-main > 16312 [ACK] Seq=2 Ack=70954 Win=65535 Len=0 TSV=1327310565 TSER=1327149984
    228 5.325805    127.0.0.1             127.0.0.1             TCP      commplex-main > 16312 [ACK] Seq=2 Ack=72402 Win=65535 Len=0 TSV=1327330664 TSER=1327170058
    229 5.344912    127.0.0.1             127.0.0.1             TCP      commplex-main > 16312 [ACK] Seq=2 Ack=72402 Win=65535 Len=0 TSV=1327330664 TSER=1327170058
    230 5.345888    127.0.0.1             127.0.0.1             TCP      commplex-main > 16312 [ACK] Seq=2 Ack=73850 Win=65535 Len=0 TSV=1327350766 TSER=1327190109
    231 5.365001    127.0.0.1             127.0.0.1             TCP      commplex-main > 16312 [ACK] Seq=2 Ack=73850 Win=65535 Len=0 TSV=1327350766 TSER=1327190109
    232 5.365970    127.0.0.1             127.0.0.1             TCP      commplex-main > 16312 [ACK] Seq=2 Ack=75298 Win=65535 Len=0 TSV=1327370861 TSER=1327210194
    233 5.385134    127.0.0.1             127.0.0.1             TCP      commplex-main > 16312 [ACK] Seq=2 Ack=75298 Win=65535 Len=0 TSV=1327370861 TSER=1327210194
    234 5.386113    127.0.0.1             127.0.0.1             TCP      commplex-main > 16312 [ACK] Seq=2 Ack=76746 Win=65535 Len=0 TSV=1327390928 TSER=1327230260
    235 5.405238    127.0.0.1             127.0.0.1             TCP      commplex-main > 16312 [ACK] Seq=2 Ack=76746 Win=65535 Len=0 TSV=1327390928 TSER=1327230260
    236 5.406251    127.0.0.1             127.0.0.1             TCP      commplex-main > 16312 [ACK] Seq=2 Ack=78194 Win=65535 Len=0 TSV=1327411009 TSER=1327230264
    237 5.425420    127.0.0.1             127.0.0.1             TCP      commplex-main > 16312 [ACK] Seq=2 Ack=78194 Win=65535 Len=0 TSV=1327411009 TSER=1327230264
    238 5.426385    127.0.0.1             127.0.0.1             TCP      commplex-main > 16312 [ACK] Seq=2 Ack=79642 Win=65535 Len=0 TSV=1327431089 TSER=1327250386
    239 5.445546    127.0.0.1             127.0.0.1             TCP      commplex-main > 16312 [ACK] Seq=2 Ack=79642 Win=65535 Len=0 TSV=1327431089 TSER=1327250386
    240 5.446519    127.0.0.1             127.0.0.1             TCP      commplex-main > 16312 [ACK] Seq=2 Ack=81090 Win=65535 Len=0 TSV=1327451157 TSER=1327270443
    241 5.465682    127.0.0.1             127.0.0.1             TCP      commplex-main > 16312 [ACK] Seq=2 Ack=81090 Win=65535 Len=0 TSV=1327451157 TSER=1327270443
    242 5.466653    127.0.0.1             127.0.0.1             TCP      commplex-main > 16312 [ACK] Seq=2 Ack=82538 Win=65535 Len=0 TSV=1327471289 TSER=1327290568
    243 5.485813    127.0.0.1             127.0.0.1             TCP      commplex-main > 16312 [ACK] Seq=2 Ack=82538 Win=65535 Len=0 TSV=1327471289 TSER=1327290568
    244 5.486789    127.0.0.1             127.0.0.1             TCP      16312 > commplex-main [ACK] Seq=82538 Ack=2 Win=65535 Len=1448 TSV=1327491453 TSER=1327310565
    245 5.505950    127.0.0.1             127.0.0.1             TCP      16312 > commplex-main [ACK] Seq=82538 Ack=2 Win=65535 Len=1448 TSV=1327491453 TSER=1327310565
    246 5.506926    127.0.0.1             127.0.0.1             TCP      16312 > commplex-main [ACK] Seq=83986 Ack=2 Win=65535 Len=1448 TSV=1327511438 TSER=1327330664
    247 5.526036    127.0.0.1             127.0.0.1             TCP      16312 > commplex-main [ACK] Seq=83986 Ack=2 Win=65535 Len=1448 TSV=1327511438 TSER=1327330664
    248 5.527014    127.0.0.1             127.0.0.1             TCP      16312 > commplex-main [ACK] Seq=85434 Ack=2 Win=65535 Len=1448 TSV=1327531524 TSER=1327350766
    249 5.546170    127.0.0.1             127.0.0.1             TCP      16312 > commplex-main [ACK] Seq=85434 Ack=2 Win=65535 Len=1448 TSV=1327531524 TSER=1327350766
    250 5.547096    127.0.0.1             127.0.0.1             TCP      16312 > commplex-main [ACK] Seq=86882 Ack=2 Win=65535 Len=1448 TSV=1327551709 TSER=1327370861
    251 5.566252    127.0.0.1             127.0.0.1             TCP      16312 > commplex-main [ACK] Seq=86882 Ack=2 Win=65535 Len=1448 TSV=1327551709 TSER=1327370861
    252 5.567175    127.0.0.1             127.0.0.1             TCP      16312 > commplex-main [ACK] Seq=88330 Ack=2 Win=65535 Len=1448 TSV=1327571756 TSER=1327390928
    253 5.586341    127.0.0.1             127.0.0.1             TCP      16312 > commplex-main [ACK] Seq=88330 Ack=2 Win=65535 Len=1448 TSV=1327571756 TSER=1327390928
    254 5.587311    127.0.0.1             127.0.0.1             TCP      16312 > commplex-main [ACK] Seq=89778 Ack=2 Win=65535 Len=1448 TSV=1327591954 TSER=1327411009
    255 5.606471    127.0.0.1             127.0.0.1             TCP      16312 > commplex-main [ACK] Seq=89778 Ack=2 Win=65535 Len=1448 TSV=1327591954 TSER=1327411009
    256 5.607448    127.0.0.1             127.0.0.1             TCP      16312 > commplex-main [ACK] Seq=91226 Ack=2 Win=65535 Len=1448 TSV=1327591960 TSER=1327411009
    257 5.626611    127.0.0.1             127.0.0.1             TCP      16312 > commplex-main [ACK] Seq=91226 Ack=2 Win=65535 Len=1448 TSV=1327591960 TSER=1327411009
    258 5.627593    127.0.0.1             127.0.0.1             TCP      16312 > commplex-main [ACK] Seq=92674 Ack=2 Win=65535 Len=1448 TSV=1327612080 TSER=1327431089
    259 5.646752    127.0.0.1             127.0.0.1             TCP      16312 > commplex-main [ACK] Seq=92674 Ack=2 Win=65535 Len=1448 TSV=1327612080 TSER=1327431089
    260 5.647730    127.0.0.1             127.0.0.1             TCP      16312 > commplex-main [ACK] Seq=94122 Ack=2 Win=65535 Len=1448 TSV=1327632212 TSER=1327451157
    261 5.666840    127.0.0.1             127.0.0.1             TCP      16312 > commplex-main [ACK] Seq=94122 Ack=2 Win=65535 Len=1448 TSV=1327632212 TSER=1327451157
    262 5.667808    127.0.0.1             127.0.0.1             TCP      16312 > commplex-main [ACK] Seq=95570 Ack=2 Win=65535 Len=1448 TSV=1327652352 TSER=1327471289
    263 5.686952    127.0.0.1             127.0.0.1             TCP      16312 > commplex-main [ACK] Seq=95570 Ack=2 Win=65535 Len=1448 TSV=1327652352 TSER=1327471289
    264 5.687941    127.0.0.1             127.0.0.1             TCP      commplex-main > 16312 [ACK] Seq=2 Ack=83986 Win=65535 Len=0 TSV=1327672451 TSER=1327491453
    265 5.707100    127.0.0.1             127.0.0.1             TCP      commplex-main > 16312 [ACK] Seq=2 Ack=83986 Win=65535 Len=0 TSV=1327672451 TSER=1327491453
    266 5.708026    127.0.0.1             127.0.0.1             TCP      commplex-main > 16312 [ACK] Seq=2 Ack=85434 Win=65535 Len=0 TSV=1327692538 TSER=1327511438
    267 5.727189    127.0.0.1             127.0.0.1             TCP      commplex-main > 16312 [ACK] Seq=2 Ack=85434 Win=65535 Len=0 TSV=1327692538 TSER=1327511438
    268 5.728161    127.0.0.1             127.0.0.1             TCP      commplex-main > 16312 [ACK] Seq=2 Ack=86882 Win=65535 Len=0 TSV=1327712661 TSER=1327531524
    269 5.747322    127.0.0.1             127.0.0.1             TCP      commplex-main > 16312 [ACK] Seq=2 Ack=86882 Win=65535 Len=0 TSV=1327712661 TSER=1327531524
    270 5.748294    127.0.0.1             127.0.0.1             TCP      commplex-main > 16312 [ACK] Seq=2 Ack=88330 Win=65535 Len=0 TSV=1327732746 TSER=1327551709
    271 5.767453    127.0.0.1             127.0.0.1             TCP      commplex-main > 16312 [ACK] Seq=2 Ack=88330 Win=65535 Len=0 TSV=1327732746 TSER=1327551709
    272 5.768375    127.0.0.1             127.0.0.1             TCP      commplex-main > 16312 [ACK] Seq=2 Ack=89778 Win=65535 Len=0 TSV=1327752842 TSER=1327571756
    273 5.787430    127.0.0.1             127.0.0.1             TCP      commplex-main > 16312 [ACK] Seq=2 Ack=89778 Win=65535 Len=0 TSV=1327752842 TSER=1327571756
    274 5.788509    127.0.0.1             127.0.0.1             TCP      commplex-main > 16312 [ACK] Seq=2 Ack=91226 Win=65535 Len=0 TSV=1327772968 TSER=1327591954
    275 5.807670    127.0.0.1             127.0.0.1             TCP      commplex-main > 16312 [ACK] Seq=2 Ack=91226 Win=65535 Len=0 TSV=1327772968 TSER=1327591954
    276 5.808643    127.0.0.1             127.0.0.1             TCP      commplex-main > 16312 [ACK] Seq=2 Ack=92674 Win=65535 Len=0 TSV=1327793106 TSER=1327591960
    277 5.827799    127.0.0.1             127.0.0.1             TCP      commplex-main > 16312 [ACK] Seq=2 Ack=92674 Win=65535 Len=0 TSV=1327793106 TSER=1327591960
    278 5.828776    127.0.0.1             127.0.0.1             TCP      commplex-main > 16312 [ACK] Seq=2 Ack=94122 Win=65535 Len=0 TSV=1327813252 TSER=1327612080
    279 5.847934    127.0.0.1             127.0.0.1             TCP      commplex-main > 16312 [ACK] Seq=2 Ack=94122 Win=65535 Len=0 TSV=1327813252 TSER=1327612080
    280 5.848909    127.0.0.1             127.0.0.1             TCP      commplex-main > 16312 [ACK] Seq=2 Ack=95570 Win=65535 Len=0 TSV=1327833327 TSER=1327632212
    281 5.868030    127.0.0.1             127.0.0.1             TCP      commplex-main > 16312 [ACK] Seq=2 Ack=95570 Win=65535 Len=0 TSV=1327833327 TSER=1327632212
    282 5.868990    127.0.0.1             127.0.0.1             TCP      commplex-main > 16312 [ACK] Seq=2 Ack=97018 Win=65535 Len=0 TSV=1327853453 TSER=1327652352
    283 5.888153    127.0.0.1             127.0.0.1             TCP      commplex-main > 16312 [ACK] Seq=2 Ack=97018 Win=65535 Len=0 TSV=1327853453 TSER=1327652352
    284 5.889124    127.0.0.1             127.0.0.1             TCP      16312 > commplex-main [ACK] Seq=97018 Ack=2 Win=65535 Len=1448 TSV=1327873673 TSER=1327672451
    285 5.908284    127.0.0.1             127.0.0.1             TCP      16312 > commplex-main [ACK] Seq=97018 Ack=2 Win=65535 Len=1448 TSV=1327873673 TSER=1327672451
    286 5.909205    127.0.0.1             127.0.0.1             TCP      16312 > commplex-main [ACK] Seq=98466 Ack=2 Win=65535 Len=1448 TSV=1327893723 TSER=1327692538
    287 5.928375    127.0.0.1             127.0.0.1             TCP      16312 > commplex-main [ACK] Seq=98466 Ack=2 Win=65535 Len=1448 TSV=1327893723 TSER=1327692538
    288 5.929344    127.0.0.1             127.0.0.1             TCP      16312 > commplex-main [ACK] Seq=99914 Ack=2 Win=65535 Len=1448 TSV=1327913853 TSER=1327712661
    289 5.948509    127.0.0.1             127.0.0.1             TCP      16312 > commplex-main [ACK] Seq=99914 Ack=2 Win=65535 Len=1448 TSV=1327913853 TSER=1327712661
    290 5.949481    127.0.0.1             127.0.0.1             TCP      16312 > commplex-main [ACK] Seq=101362 Ack=2 Win=65535 Len=1448 TSV=1327933979 TSER=1327732746
    291 5.968645    127.0.0.1             127.0.0.1             TCP      16312 > commplex-main [ACK] Seq=101362 Ack=2 Win=65535 Len=1448 TSV=1327933979 TSER=1327732746
    292 5.969559    127.0.0.1             127.0.0.1             TCP      16312 > commplex-main [ACK] Seq=102810 Ack=2 Win=65535 Len=1448 TSV=1327953977 TSER=1327752842
    293 5.988675    127.0.0.1             127.0.0.1             TCP      16312 > commplex-main [ACK] Seq=102810 Ack=2 Win=65535 Len=1448 TSV=1327953977 TSER=1327752842
    294 5.989638    127.0.0.1             127.0.0.1             TCP      16312 > commplex-main [ACK] Seq=104258 Ack=2 Win=65535 Len=1448 TSV=1327974200 TSER=1327772968
    295 6.008756    127.0.0.1             127.0.0.1             TCP      16312 > commplex-main [ACK] Seq=104258 Ack=2 Win=65535 Len=1448 TSV=1327974200 TSER=1327772968
    296 6.009774    127.0.0.1             127.0.0.1             TCP      16312 > commplex-main [ACK] Seq=105706 Ack=2 Win=65535 Len=1448 TSV=1327994328 TSER=1327793106
    297 6.028940    127.0.0.1             127.0.0.1             TCP      16312 > commplex-main [ACK] Seq=105706 Ack=2 Win=65535 Len=1448 TSV=1327994328 TSER=1327793106
    298 6.029911    127.0.0.1             127.0.0.1             TCP      16312 > commplex-main [ACK] Seq=107154 Ack=2 Win=65535 Len=1448 TSV=1328014465 TSER=1327813252
    299 6.049018    127.0.0.1             127.0.0.1             TCP      16312 > commplex-main [ACK] Seq=107154 Ack=2 Win=65535 Len=1448 TSV=1328014465 TSER=1327813252
    300 6.049990    127.0.0.1             127.0.0.1             TCP      16312 > commplex-main [ACK] Seq=108602 Ack=2 Win=65535 Len=1448 TSV=1328014472 TSER=1327813252
    301 6.069154    127.0.0.1             127.0.0.1             TCP      16312 > commplex-main [ACK] Seq=108602 Ack=2 Win=65535 Len=1448 TSV=1328014472 TSER=1327813252
    302 6.070130    127.0.0.1             127.0.0.1             TCP      16312 > commplex-main [ACK] Seq=110050 Ack=2 Win=65535 Len=1448 TSV=1328034551 TSER=1327833327
    303 6.089304    127.0.0.1             127.0.0.1             TCP      16312 > commplex-main [ACK] Seq=110050 Ack=2 Win=65535 Len=1448 TSV=1328034551 TSER=1327833327
    304 6.090222    127.0.0.1             127.0.0.1             TCP      16312 > commplex-main [ACK] Seq=111498 Ack=2 Win=65535 Len=1448 TSV=1328054679 TSER=1327853453
    305 6.109398    127.0.0.1             127.0.0.1             TCP      16312 > commplex-main [ACK] Seq=111498 Ack=2 Win=65535 Len=1448 TSV=1328054679 TSER=1327853453
    306 6.110357    127.0.0.1             127.0.0.1             TCP      commplex-main > 16312 [ACK] Seq=2 Ack=98466 Win=65535 Len=0 TSV=1328074771 TSER=1327873673
    307 6.129523    127.0.0.1             127.0.0.1             TCP      commplex-main > 16312 [ACK] Seq=2 Ack=98466 Win=65535 Len=0 TSV=1328074771 TSER=1327873673
    308 6.130493    127.0.0.1             127.0.0.1             TCP      commplex-main > 16312 [ACK] Seq=2 Ack=99914 Win=65535 Len=0 TSV=1328094865 TSER=1327893723
    309 6.149660    127.0.0.1             127.0.0.1             TCP      commplex-main > 16312 [ACK] Seq=2 Ack=99914 Win=65535 Len=0 TSV=1328094865 TSER=1327893723
    310 6.150628    127.0.0.1             127.0.0.1             TCP      commplex-main > 16312 [ACK] Seq=2 Ack=101362 Win=65535 Len=0 TSV=1328114994 TSER=1327913853
    311 6.169738    127.0.0.1             127.0.0.1             TCP      commplex-main > 16312 [ACK] Seq=2 Ack=101362 Win=65535 Len=0 TSV=1328114994 TSER=1327913853
    312 6.170711    127.0.0.1             127.0.0.1             TCP      commplex-main > 16312 [ACK] Seq=2 Ack=102810 Win=65535 Len=0 TSV=1328135133 TSER=1327933979
    313 6.189828    127.0.0.1             127.0.0.1             TCP      commplex-main > 16312 [ACK] Seq=2 Ack=102810 Win=65535 Len=0 TSV=1328135133 TSER=1327933979
    314 6.190788    127.0.0.1             127.0.0.1             TCP      commplex-main > 16312 [ACK] Seq=2 Ack=104258 Win=65535 Len=0 TSV=1328155164 TSER=1327953977
    315 6.209895    127.0.0.1             127.0.0.1             TCP      commplex-main > 16312 [ACK] Seq=2 Ack=104258 Win=65535 Len=0 TSV=1328155164 TSER=1327953977
    316 6.210872    127.0.0.1             127.0.0.1             TCP      commplex-main > 16312 [ACK] Seq=2 Ack=105706 Win=65535 Len=0 TSV=1328175234 TSER=1327974200
    317 6.229987    127.0.0.1             127.0.0.1             TCP      commplex-main > 16312 [ACK] Seq=2 Ack=105706 Win=65535 Len=0 TSV=1328175234 TSER=1327974200
    318 6.230952    127.0.0.1             127.0.0.1             TCP      commplex-main > 16312 [ACK] Seq=2 Ack=107154 Win=65535 Len=0 TSV=1328195427 TSER=1327994328
    319 6.250008    127.0.0.1             127.0.0.1             TCP      commplex-main > 16312 [ACK] Seq=2 Ack=107154 Win=65535 Len=0 TSV=1328195427 TSER=1327994328
    320 6.251028    127.0.0.1             127.0.0.1             TCP      commplex-main > 16312 [ACK] Seq=2 Ack=108602 Win=65535 Len=0 TSV=1328215510 TSER=1328014465
    321 6.270178    127.0.0.1             127.0.0.1             TCP      commplex-main > 16312 [ACK] Seq=2 Ack=108602 Win=65535 Len=0 TSV=1328215510 TSER=1328014465
    322 6.271104    127.0.0.1             127.0.0.1             TCP      commplex-main > 16312 [ACK] Seq=2 Ack=110050 Win=65535 Len=0 TSV=1328235662 TSER=1328014472
    323 6.290261    127.0.0.1             127.0.0.1             TCP      commplex-main > 16312 [ACK] Seq=2 Ack=110050 Win=65535 Len=0 TSV=1328235662 TSER=1328014472
    324 6.291180    127.0.0.1             127.0.0.1             TCP      commplex-main > 16312 [ACK] Seq=2 Ack=111498 Win=65535 Len=0 TSV=1328255811 TSER=1328034551
    325 6.310336    127.0.0.1             127.0.0.1             TCP      commplex-main > 16312 [ACK] Seq=2 Ack=111498 Win=65535 Len=0 TSV=1328255811 TSER=1328034551
    326 6.311315    127.0.0.1             127.0.0.1             TCP      commplex-main > 16312 [ACK] Seq=2 Ack=112946 Win=65535 Len=0 TSV=1328275894 TSER=1328054679
    327 6.330470    127.0.0.1             127.0.0.1             TCP      commplex-main > 16312 [ACK] Seq=2 Ack=112946 Win=65535 Len=0 TSV=1328275894 TSER=1328054679
    328 6.331450    127.0.0.1             127.0.0.1             TCP      16312 > commplex-main [ACK] Seq=112946 Ack=2 Win=65535 Len=1448 TSV=1328296090 TSER=1328074771
    329 6.350606    127.0.0.1             127.0.0.1             TCP      16312 > commplex-main [ACK] Seq=112946 Ack=2 Win=65535 Len=1448 TSV=1328296090 TSER=1328074771
    330 6.351585    127.0.0.1             127.0.0.1             TCP      16312 > commplex-main [ACK] Seq=114394 Ack=2 Win=65535 Len=1448 TSV=1328316196 TSER=1328094865
    331 6.370740    127.0.0.1             127.0.0.1             TCP      16312 > commplex-main [ACK] Seq=114394 Ack=2 Win=65535 Len=1448 TSV=1328316196 TSER=1328094865
    332 6.371721    127.0.0.1             127.0.0.1             TCP      16312 > commplex-main [ACK] Seq=115842 Ack=2 Win=65535 Len=1448 TSV=1328336293 TSER=1328114994
    333 6.390882    127.0.0.1             127.0.0.1             TCP      16312 > commplex-main [ACK] Seq=115842 Ack=2 Win=65535 Len=1448 TSV=1328336293 TSER=1328114994
    334 6.391802    127.0.0.1             127.0.0.1             TCP      16312 > commplex-main [ACK] Seq=117290 Ack=2 Win=65535 Len=1448 TSV=1328356348 TSER=1328135133
    335 6.410948    127.0.0.1             127.0.0.1             TCP      16312 > commplex-main [ACK] Seq=117290 Ack=2 Win=65535 Len=1448 TSV=1328356348 TSER=1328135133
    336 6.411879    127.0.0.1             127.0.0.1             TCP      16312 > commplex-main [ACK] Seq=118738 Ack=2 Win=65535 Len=1448 TSV=1328376456 TSER=1328155164
    337 6.430990    127.0.0.1             127.0.0.1             TCP      16312 > commplex-main [ACK] Seq=118738 Ack=2 Win=65535 Len=1448 TSV=1328376456 TSER=1328155164
    338 6.431954    127.0.0.1             127.0.0.1             TCP      16312 > commplex-main [ACK] Seq=120186 Ack=2 Win=65535 Len=1448 TSV=1328396517 TSER=1328175234
    339 6.451106    127.0.0.1             127.0.0.1             TCP      16312 > commplex-main [ACK] Seq=120186 Ack=2 Win=65535 Len=1448 TSV=1328396517 TSER=1328175234
    340 6.452038    127.0.0.1             127.0.0.1             TCP      16312 > commplex-main [ACK] Seq=121634 Ack=2 Win=65535 Len=1448 TSV=1328416527 TSER=1328195427
    341 6.471202    127.0.0.1             127.0.0.1             TCP      16312 > commplex-main [ACK] Seq=121634 Ack=2 Win=65535 Len=1448 TSV=1328416527 TSER=1328195427
    342 6.472116    127.0.0.1             127.0.0.1             TCP      16312 > commplex-main [ACK] Seq=123082 Ack=2 Win=65535 Len=1448 TSV=1328436715 TSER=1328215510
    343 6.491272    127.0.0.1             127.0.0.1             TCP      16312 > commplex-main [ACK] Seq=123082 Ack=2 Win=65535 Len=1448 TSV=1328436715 TSER=1328215510
    344 6.492193    127.0.0.1             127.0.0.1             TCP      16312 > commplex-main [ACK] Seq=124530 Ack=2 Win=65535 Len=1448 TSV=1328456800 TSER=1328235662
    345 6.511351    127.0.0.1             127.0.0.1             TCP      16312 > commplex-main [ACK] Seq=124530 Ack=2 Win=65535 Len=1448 TSV=1328456800 TSER=1328235662
    346 6.512271    127.0.0.1             127.0.0.1             TCP      16312 > commplex-main [ACK] Seq=125978 Ack=2 Win=65535 Len=1448 TSV=1328456806 TSER=1328235662
    347 6.531430    127.0.0.1             127.0.0.1             TCP      16312 > commplex-main [ACK] Seq=125978 Ack=2 Win=65535 Len=1448 TSV=1328456806 TSER=1328235662
    348 6.532404    127.0.0.1             127.0.0.1             TCP      16312 > commplex-main [ACK] Seq=127426 Ack=2 Win=65535 Len=1448 TSV=1328476872 TSER=1328255811
    349 6.551556    127.0.0.1             127.0.0.1             TCP      16312 > commplex-main [ACK] Seq=127426 Ack=2 Win=65535 Len=1448 TSV=1328476872 TSER=1328255811
    350 6.552537    127.0.0.1             127.0.0.1             TCP      16312 > commplex-main [ACK] Seq=128874 Ack=2 Win=65535 Len=1448 TSV=1328496994 TSER=1328275894
    351 6.571691    127.0.0.1             127.0.0.1             TCP      16312 > commplex-main [ACK] Seq=128874 Ack=2 Win=65535 Len=1448 TSV=1328496994 TSER=1328275894
    352 6.572611    127.0.0.1             127.0.0.1             TCP      commplex-main > 16312 [ACK] Seq=2 Ack=114394 Win=65535 Len=0 TSV=1328517108 TSER=1328296090
    353 6.591764    127.0.0.1             127.0.0.1             TCP      commplex-main > 16312 [ACK] Seq=2 Ack=114394 Win=65535 Len=0 TSV=1328517108 TSER=1328296090
    354 6.592746    127.0.0.1             127.0.0.1             TCP      commplex-main > 16312 [ACK] Seq=2 Ack=115842 Win=65535 Len=0 TSV=1328537234 TSER=1328316196
    355 6.611906    127.0.0.1             127.0.0.1             TCP      commplex-main > 16312 [ACK] Seq=2 Ack=115842 Win=65535 Len=0 TSV=1328537234 TSER=1328316196
    356 6.612879    127.0.0.1             127.0.0.1             TCP      commplex-main > 16312 [ACK] Seq=2 Ack=117290 Win=65535 Len=0 TSV=1328557384 TSER=1328336293
    357 6.631989    127.0.0.1             127.0.0.1             TCP      commplex-main > 16312 [ACK] Seq=2 Ack=117290 Win=65535 Len=0 TSV=1328557384 TSER=1328336293
    358 6.632960    127.0.0.1             127.0.0.1             TCP      commplex-main > 16312 [ACK] Seq=2 Ack=118738 Win=65535 Len=0 TSV=1328577448 TSER=1328356348
    359 6.652068    127.0.0.1             127.0.0.1             TCP      commplex-main > 16312 [ACK] Seq=2 Ack=118738 Win=65535 Len=0 TSV=1328577448 TSER=1328356348
    360 6.653093    127.0.0.1             127.0.0.1             TCP      commplex-main > 16312 [ACK] Seq=2 Ack=120186 Win=65535 Len=0 TSV=1328597482 TSER=1328376456
    361 6.672247    127.0.0.1             127.0.0.1             TCP      commplex-main > 16312 [ACK] Seq=2 Ack=120186 Win=65535 Len=0 TSV=1328597482 TSER=1328376456
    362 6.673233    127.0.0.1             127.0.0.1             TCP      commplex-main > 16312 [ACK] Seq=2 Ack=121634 Win=65535 Len=0 TSV=1328617606 TSER=1328396517
    363 6.692343    127.0.0.1             127.0.0.1             TCP      commplex-main > 16312 [ACK] Seq=2 Ack=121634 Win=65535 Len=0 TSV=1328617606 TSER=1328396517
    364 6.693367    127.0.0.1             127.0.0.1             TCP      commplex-main > 16312 [ACK] Seq=2 Ack=123082 Win=65535 Len=0 TSV=1328637692 TSER=1328416527
    365 6.712522    127.0.0.1             127.0.0.1             TCP      commplex-main > 16312 [ACK] Seq=2 Ack=123082 Win=65535 Len=0 TSV=1328637692 TSER=1328416527
    366 6.713500    127.0.0.1             127.0.0.1             TCP      commplex-main > 16312 [ACK] Seq=2 Ack=124530 Win=65535 Len=0 TSV=1328657763 TSER=1328436715
    367 6.732654    127.0.0.1             127.0.0.1             TCP      commplex-main > 16312 [ACK] Seq=2 Ack=124530 Win=65535 Len=0 TSV=1328657763 TSER=1328436715
    368 6.733633    127.0.0.1             127.0.0.1             TCP      commplex-main > 16312 [ACK] Seq=2 Ack=125978 Win=65535 Len=0 TSV=1328677844 TSER=1328456800
    369 6.752793    127.0.0.1             127.0.0.1             TCP      commplex-main > 16312 [ACK] Seq=2 Ack=125978 Win=65535 Len=0 TSV=1328677844 TSER=1328456800
    370 6.753766    127.0.0.1             127.0.0.1             TCP      commplex-main > 16312 [ACK] Seq=2 Ack=127426 Win=65535 Len=0 TSV=1328697923 TSER=1328456806
    371 6.772928    127.0.0.1             127.0.0.1             TCP      commplex-main > 16312 [ACK] Seq=2 Ack=127426 Win=65535 Len=0 TSV=1328697923 TSER=1328456806
    372 6.773899    127.0.0.1             127.0.0.1             TCP      commplex-main > 16312 [ACK] Seq=2 Ack=128874 Win=65535 Len=0 TSV=1328718048 TSER=1328476872
    373 6.793008    127.0.0.1             127.0.0.1             TCP      commplex-main > 16312 [ACK] Seq=2 Ack=128874 Win=65535 Len=0 TSV=1328718048 TSER=1328476872
    374 6.793984    127.0.0.1             127.0.0.1             TCP      commplex-main > 16312 [ACK] Seq=2 Ack=130322 Win=65535 Len=0 TSV=1328738184 TSER=1328496994
    375 6.813151    127.0.0.1             127.0.0.1             TCP      commplex-main > 16312 [ACK] Seq=2 Ack=130322 Win=65535 Len=0 TSV=1328738184 TSER=1328496994
    376 6.814119    127.0.0.1             127.0.0.1             TCP      16312 > commplex-main [ACK] Seq=130322 Ack=2 Win=65535 Len=1448 TSV=1328758332 TSER=1328517108
    377 6.833285    127.0.0.1             127.0.0.1             TCP      16312 > commplex-main [ACK] Seq=130322 Ack=2 Win=65535 Len=1448 TSV=1328758332 TSER=1328517108
    378 6.834255    127.0.0.1             127.0.0.1             TCP      16312 > commplex-main [ACK] Seq=131770 Ack=2 Win=65535 Len=1448 TSV=1328778434 TSER=1328537234
    379 6.853421    127.0.0.1             127.0.0.1             TCP      16312 > commplex-main [ACK] Seq=131770 Ack=2 Win=65535 Len=1448 TSV=1328778434 TSER=1328537234
    380 6.854338    127.0.0.1             127.0.0.1             TCP      16312 > commplex-main [ACK] Seq=133218 Ack=2 Win=65535 Len=1448 TSV=1328798512 TSER=1328557384
    381 6.873492    127.0.0.1             127.0.0.1             TCP      16312 > commplex-main [ACK] Seq=133218 Ack=2 Win=65535 Len=1448 TSV=1328798512 TSER=1328557384
    382 6.874420    127.0.0.1             127.0.0.1             TCP      16312 > commplex-main [ACK] Seq=134666 Ack=2 Win=65535 Len=1448 TSV=1328818594 TSER=1328577448
    383 6.893572    127.0.0.1             127.0.0.1             TCP      16312 > commplex-main [ACK] Seq=134666 Ack=2 Win=65535 Len=1448 TSV=1328818594 TSER=1328577448
    384 6.894496    127.0.0.1             127.0.0.1             TCP      16312 > commplex-main [ACK] Seq=136114 Ack=2 Win=65535 Len=1448 TSV=1328838800 TSER=1328597482
    385 6.913650    127.0.0.1             127.0.0.1             TCP      16312 > commplex-main [ACK] Seq=136114 Ack=2 Win=65535 Len=1448 TSV=1328838800 TSER=1328597482
    386 6.914573    127.0.0.1             127.0.0.1             TCP      16312 > commplex-main [ACK] Seq=137562 Ack=2 Win=65535 Len=1448 TSV=1328858865 TSER=1328617606
    387 6.933738    127.0.0.1             127.0.0.1             TCP      16312 > commplex-main [ACK] Seq=137562 Ack=2 Win=65535 Len=1448 TSV=1328858865 TSER=1328617606
    388 6.934650    127.0.0.1             127.0.0.1             TCP      16312 > commplex-main [ACK] Seq=139010 Ack=2 Win=65535 Len=1448 TSV=1328879043 TSER=1328637692
    389 6.953807    127.0.0.1             127.0.0.1             TCP      16312 > commplex-main [ACK] Seq=139010 Ack=2 Win=65535 Len=1448 TSV=1328879043 TSER=1328637692
    390 6.954730    127.0.0.1             127.0.0.1             TCP      16312 > commplex-main [ACK] Seq=140458 Ack=2 Win=65535 Len=1448 TSV=1328899182 TSER=1328657763
    391 6.973843    127.0.0.1             127.0.0.1             TCP      16312 > commplex-main [ACK] Seq=140458 Ack=2 Win=65535 Len=1448 TSV=1328899182 TSER=1328657763
    392 6.974807    127.0.0.1             127.0.0.1             TCP      16312 > commplex-main [ACK] Seq=141906 Ack=2 Win=65535 Len=1448 TSV=1328919318 TSER=1328677844
    393 6.993979    127.0.0.1             127.0.0.1             TCP      16312 > commplex-main [ACK] Seq=141906 Ack=2 Win=65535 Len=1448 TSV=1328919318 TSER=1328677844
    394 6.994898    127.0.0.1             127.0.0.1             TCP      16312 > commplex-main [ACK] Seq=143354 Ack=2 Win=65535 Len=1448 TSV=1328939452 TSER=1328697923
    395 7.014017    127.0.0.1             127.0.0.1             TCP      16312 > commplex-main [ACK] Seq=143354 Ack=2 Win=65535 Len=1448 TSV=1328939452 TSER=1328697923
    396 7.014985    127.0.0.1             127.0.0.1             TCP      16312 > commplex-main [ACK] Seq=144802 Ack=2 Win=65535 Len=1448 TSV=1328959547 TSER=1328718048
    397 7.034154    127.0.0.1             127.0.0.1             TCP      16312 > commplex-main [ACK] Seq=144802 Ack=2 Win=65535 Len=1448 TSV=1328959547 TSER=1328718048
    398 7.035073    127.0.0.1             127.0.0.1             TCP      16312 > commplex-main [ACK] Seq=146250 Ack=2 Win=65535 Len=1448 TSV=1328959554 TSER=1328718048
    399 7.054237    127.0.0.1             127.0.0.1             TCP      16312 > commplex-main [ACK] Seq=146250 Ack=2 Win=65535 Len=1448 TSV=1328959554 TSER=1328718048
    400 7.055152    127.0.0.1             127.0.0.1             TCP      16312 > commplex-main [ACK] Seq=147698 Ack=2 Win=65535 Len=1448 TSV=1328979671 TSER=1328738184
    401 7.074315    127.0.0.1             127.0.0.1             TCP      16312 > commplex-main [ACK] Seq=147698 Ack=2 Win=65535 Len=1448 TSV=1328979671 TSER=1328738184
    402 7.075232    127.0.0.1             127.0.0.1             TCP      commplex-main > 16312 [ACK] Seq=2 Ack=131770 Win=65535 Len=0 TSV=1328999775 TSER=1328758332
    403 7.094384    127.0.0.1             127.0.0.1             TCP      commplex-main > 16312 [ACK] Seq=2 Ack=131770 Win=65535 Len=0 TSV=1328999775 TSER=1328758332
    404 7.095371    127.0.0.1             127.0.0.1             TCP      commplex-main > 16312 [ACK] Seq=2 Ack=133218 Win=65535 Len=0 TSV=1329019910 TSER=1328778434
    405 7.114544    127.0.0.1             127.0.0.1             TCP      commplex-main > 16312 [ACK] Seq=2 Ack=133218 Win=65535 Len=0 TSV=1329019910 TSER=1328778434
    406 7.115519    127.0.0.1             127.0.0.1             TCP      commplex-main > 16312 [ACK] Seq=2 Ack=134666 Win=65535 Len=0 TSV=1329039977 TSER=1328798512
    407 7.134625    127.0.0.1             127.0.0.1             TCP      commplex-main > 16312 [ACK] Seq=2 Ack=134666 Win=65535 Len=0 TSV=1329039977 TSER=1328798512
    408 7.135595    127.0.0.1             127.0.0.1             TCP      commplex-main > 16312 [ACK] Seq=2 Ack=136114 Win=65535 Len=0 TSV=1329060058 TSER=1328818594
    409 7.154696    127.0.0.1             127.0.0.1             TCP      commplex-main > 16312 [ACK] Seq=2 Ack=136114 Win=65535 Len=0 TSV=1329060058 TSER=1328818594
    410 7.155675    127.0.0.1             127.0.0.1             TCP      commplex-main > 16312 [ACK] Seq=2 Ack=137562 Win=65535 Len=0 TSV=1329080136 TSER=1328838800
    411 7.174768    127.0.0.1             127.0.0.1             TCP      commplex-main > 16312 [ACK] Seq=2 Ack=137562 Win=65535 Len=0 TSV=1329080136 TSER=1328838800
    412 7.175755    127.0.0.1             127.0.0.1             TCP      commplex-main > 16312 [ACK] Seq=2 Ack=139010 Win=65535 Len=0 TSV=1329100235 TSER=1328858865
    413 7.194857    127.0.0.1             127.0.0.1             TCP      commplex-main > 16312 [ACK] Seq=2 Ack=139010 Win=65535 Len=0 TSV=1329100235 TSER=1328858865
    414 7.195838    127.0.0.1             127.0.0.1             TCP      commplex-main > 16312 [ACK] Seq=2 Ack=140458 Win=65535 Len=0 TSV=1329120294 TSER=1328879043
    415 7.214935    127.0.0.1             127.0.0.1             TCP      commplex-main > 16312 [ACK] Seq=2 Ack=140458 Win=65535 Len=0 TSV=1329120294 TSER=1328879043
    416 7.215921    127.0.0.1             127.0.0.1             TCP      commplex-main > 16312 [ACK] Seq=2 Ack=141906 Win=65535 Len=0 TSV=1329140320 TSER=1328899182
    417 7.235018    127.0.0.1             127.0.0.1             TCP      commplex-main > 16312 [ACK] Seq=2 Ack=141906 Win=65535 Len=0 TSV=1329140320 TSER=1328899182
    418 7.236005    127.0.0.1             127.0.0.1             TCP      commplex-main > 16312 [ACK] Seq=2 Ack=143354 Win=65535 Len=0 TSV=1329160495 TSER=1328919318
    419 7.255096    127.0.0.1             127.0.0.1             TCP      commplex-main > 16312 [ACK] Seq=2 Ack=143354 Win=65535 Len=0 TSV=1329160495 TSER=1328919318
    420 7.256081    127.0.0.1             127.0.0.1             TCP      commplex-main > 16312 [ACK] Seq=2 Ack=144802 Win=65535 Len=0 TSV=1329180508 TSER=1328939452
    421 7.275175    127.0.0.1             127.0.0.1             TCP      commplex-main > 16312 [ACK] Seq=2 Ack=144802 Win=65535 Len=0 TSV=1329180508 TSER=1328939452
    422 7.276159    127.0.0.1             127.0.0.1             TCP      commplex-main > 16312 [ACK] Seq=2 Ack=146250 Win=65535 Len=0 TSV=1329200642 TSER=1328959547
    423 7.295302    127.0.0.1             127.0.0.1             TCP      commplex-main > 16312 [ACK] Seq=2 Ack=146250 Win=65535 Len=0 TSV=1329200642 TSER=1328959547
    424 7.296233    127.0.0.1             127.0.0.1             TCP      commplex-main > 16312 [ACK] Seq=2 Ack=147698 Win=65535 Len=0 TSV=1329220724 TSER=1328959554
    425 7.315326    127.0.0.1             127.0.0.1             TCP      commplex-main > 16312 [ACK] Seq=2 Ack=147698 Win=65535 Len=0 TSV=1329220724 TSER=1328959554
    426 7.316315    127.0.0.1             127.0.0.1             TCP      commplex-main > 16312 [ACK] Seq=2 Ack=149146 Win=65535 Len=0 TSV=1329240799 TSER=1328979671
    427 7.335407    127.0.0.1             127.0.0.1             TCP      commplex-main > 16312 [ACK] Seq=2 Ack=149146 Win=65535 Len=0 TSV=1329240799 TSER=1328979671
    428 7.336393    127.0.0.1             127.0.0.1             TCP      16312 > commplex-main [ACK] Seq=149146 Ack=2 Win=65535 Len=1448 TSV=1329260963 TSER=1328999775
    429 7.355480    127.0.0.1             127.0.0.1             TCP      16312 > commplex-main [ACK] Seq=149146 Ack=2 Win=65535 Len=1448 TSV=1329260963 TSER=1328999775
    430 7.356470    127.0.0.1             127.0.0.1             TCP      16312 > commplex-main [ACK] Seq=150594 Ack=2 Win=65535 Len=1448 TSV=1329281089 TSER=1329019910
    431 7.375558    127.0.0.1             127.0.0.1             TCP      16312 > commplex-main [ACK] Seq=150594 Ack=2 Win=65535 Len=1448 TSV=1329281089 TSER=1329019910
    432 7.376549    127.0.0.1             127.0.0.1             TCP      16312 > commplex-main [ACK] Seq=152042 Ack=2 Win=65535 Len=1448 TSV=1329301150 TSER=1329039977
    433 7.395637    127.0.0.1             127.0.0.1             TCP      16312 > commplex-main [ACK] Seq=152042 Ack=2 Win=65535 Len=1448 TSV=1329301150 TSER=1329039977
    434 7.396625    127.0.0.1             127.0.0.1             TCP      16312 > commplex-main [ACK] Seq=153490 Ack=2 Win=65535 Len=1448 TSV=1329321204 TSER=1329060058
    435 7.415713    127.0.0.1             127.0.0.1             TCP      16312 > commplex-main [ACK] Seq=153490 Ack=2 Win=65535 Len=1448 TSV=1329321204 TSER=1329060058
    436 7.416702    127.0.0.1             127.0.0.1             TCP      16312 > commplex-main [ACK] Seq=154938 Ack=2 Win=65535 Len=1448 TSV=1329341305 TSER=1329080136
    437 7.435787    127.0.0.1             127.0.0.1             TCP      16312 > commplex-main [ACK] Seq=154938 Ack=2 Win=65535 Len=1448 TSV=1329341305 TSER=1329080136
    438 7.436782    127.0.0.1             127.0.0.1             TCP      16312 > commplex-main [ACK] Seq=156386 Ack=2 Win=65535 Len=1448 TSV=1329361382 TSER=1329100235
    439 7.455875    127.0.0.1             127.0.0.1             TCP      16312 > commplex-main [ACK] Seq=156386 Ack=2 Win=65535 Len=1448 TSV=1329361382 TSER=1329100235
    440 7.456864    127.0.0.1             127.0.0.1             TCP      16312 > commplex-main [ACK] Seq=157834 Ack=2 Win=65535 Len=1448 TSV=1329381446 TSER=1329120294
    441 7.475948    127.0.0.1             127.0.0.1             TCP      16312 > commplex-main [ACK] Seq=157834 Ack=2 Win=65535 Len=1448 TSV=1329381446 TSER=1329120294
    442 7.476945    127.0.0.1             127.0.0.1             TCP      16312 > commplex-main [ACK] Seq=159282 Ack=2 Win=65535 Len=1448 TSV=1329401526 TSER=1329140320
    443 7.496036    127.0.0.1             127.0.0.1             TCP      16312 > commplex-main [ACK] Seq=159282 Ack=2 Win=65535 Len=1448 TSV=1329401526 TSER=1329140320
    444 7.497026    127.0.0.1             127.0.0.1             TCP      16312 > commplex-main [ACK] Seq=160730 Ack=2 Win=65535 Len=1448 TSV=1329421608 TSER=1329160495
    445 7.516133    127.0.0.1             127.0.0.1             TCP      16312 > commplex-main [ACK] Seq=160730 Ack=2 Win=65535 Len=1448 TSV=1329421608 TSER=1329160495
    446 7.517109    127.0.0.1             127.0.0.1             TCP      16312 > commplex-main [ACK] Seq=162178 Ack=2 Win=65535 Len=1448 TSV=1329441681 TSER=1329180508
    447 7.536212    127.0.0.1             127.0.0.1             TCP      16312 > commplex-main [ACK] Seq=162178 Ack=2 Win=65535 Len=1448 TSV=1329441681 TSER=1329180508
    448 7.537193    127.0.0.1             127.0.0.1             TCP      16312 > commplex-main [ACK] Seq=163626 Ack=2 Win=65535 Len=1448 TSV=1329461810 TSER=1329200642
    449 7.556295    127.0.0.1             127.0.0.1             TCP      16312 > commplex-main [ACK] Seq=163626 Ack=2 Win=65535 Len=1448 TSV=1329461810 TSER=1329200642
    450 7.557273    127.0.0.1             127.0.0.1             TCP      16312 > commplex-main [ACK] Seq=165074 Ack=2 Win=65535 Len=1448 TSV=1329481831 TSER=1329220724
    451 7.576379    127.0.0.1             127.0.0.1             TCP      16312 > commplex-main [ACK] Seq=165074 Ack=2 Win=65535 Len=1448 TSV=1329481831 TSER=1329220724
    452 7.577355    127.0.0.1             127.0.0.1             TCP      16312 > commplex-main [ACK] Seq=166522 Ack=2 Win=65535 Len=1448 TSV=1329501919 TSER=1329240799
    453 7.596453    127.0.0.1             127.0.0.1             TCP      16312 > commplex-main [ACK] Seq=166522 Ack=2 Win=65535 Len=1448 TSV=1329501919 TSER=1329240799
    454 7.597439    127.0.0.1             127.0.0.1             TCP      16312 > commplex-main [ACK] Seq=167970 Ack=2 Win=65535 Len=1448 TSV=1329501925 TSER=1329240799
    455 7.616540    127.0.0.1             127.0.0.1             TCP      16312 > commplex-main [ACK] Seq=167970 Ack=2 Win=65535 Len=1448 TSV=1329501925 TSER=1329240799
    456 7.617512    127.0.0.1             127.0.0.1             TCP      commplex-main > 16312 [ACK] Seq=2 Ack=150594 Win=65535 Len=0 TSV=1329521962 TSER=1329260963
    457 7.636598    127.0.0.1             127.0.0.1             TCP      commplex-main > 16312 [ACK] Seq=2 Ack=150594 Win=65535 Len=0 TSV=1329521962 TSER=1329260963
    458 7.637587    127.0.0.1             127.0.0.1             TCP      commplex-main > 16312 [ACK] Seq=2 Ack=152042 Win=65535 Len=0 TSV=1329542045 TSER=1329281089
    459 7.656687    127.0.0.1             127.0.0.1             TCP      commplex-main > 16312 [ACK] Seq=2 Ack=152042 Win=65535 Len=0 TSV=1329542045 TSER=1329281089
    460 7.657668    127.0.0.1             127.0.0.1             TCP      commplex-main > 16312 [ACK] Seq=2 Ack=153490 Win=65535 Len=0 TSV=1329562117 TSER=1329301150
    461 7.676773    127.0.0.1             127.0.0.1             TCP      commplex-main > 16312 [ACK] Seq=2 Ack=153490 Win=65535 Len=0 TSV=1329562117 TSER=1329301150
    462 7.677747    127.0.0.1             127.0.0.1             TCP      commplex-main > 16312 [ACK] Seq=2 Ack=154938 Win=65535 Len=0 TSV=1329582195 TSER=1329321204
    463 7.696909    127.0.0.1             127.0.0.1             TCP      commplex-main > 16312 [ACK] Seq=2 Ack=154938 Win=65535 Len=0 TSV=1329582195 TSER=1329321204
    464 7.697822    127.0.0.1             127.0.0.1             TCP      commplex-main > 16312 [ACK] Seq=2 Ack=156386 Win=65535 Len=0 TSV=1329602273 TSER=1329341305
    465 7.716946    127.0.0.1             127.0.0.1             TCP      commplex-main > 16312 [ACK] Seq=2 Ack=156386 Win=65535 Len=0 TSV=1329602273 TSER=1329341305
    466 7.717908    127.0.0.1             127.0.0.1             TCP      commplex-main > 16312 [ACK] Seq=2 Ack=157834 Win=65535 Len=0 TSV=1329622359 TSER=1329361382
    467 7.737075    127.0.0.1             127.0.0.1             TCP      commplex-main > 16312 [ACK] Seq=2 Ack=157834 Win=65535 Len=0 TSV=1329622359 TSER=1329361382
    468 7.737989    127.0.0.1             127.0.0.1             TCP      commplex-main > 16312 [ACK] Seq=2 Ack=159282 Win=65535 Len=0 TSV=1329642437 TSER=1329381446
    469 7.757138    127.0.0.1             127.0.0.1             TCP      commplex-main > 16312 [ACK] Seq=2 Ack=159282 Win=65535 Len=0 TSV=1329642437 TSER=1329381446
    470 7.758125    127.0.0.1             127.0.0.1             TCP      commplex-main > 16312 [ACK] Seq=2 Ack=160730 Win=65535 Len=0 TSV=1329662528 TSER=1329401526
    471 7.777285    127.0.0.1             127.0.0.1             TCP      commplex-main > 16312 [ACK] Seq=2 Ack=160730 Win=65535 Len=0 TSV=1329662528 TSER=1329401526
    472 7.778354    127.0.0.1             127.0.0.1             TCP      commplex-main > 16312 [ACK] Seq=2 Ack=162178 Win=65535 Len=0 TSV=1329682647 TSER=1329421608
    473 7.797427    127.0.0.1             127.0.0.1             TCP      commplex-main > 16312 [ACK] Seq=2 Ack=162178 Win=65535 Len=0 TSV=1329682647 TSER=1329421608
    474 7.798438    127.0.0.1             127.0.0.1             TCP      commplex-main > 16312 [ACK] Seq=2 Ack=163626 Win=65535 Len=0 TSV=1329702723 TSER=1329441681
    475 7.817527    127.0.0.1             127.0.0.1             TCP      commplex-main > 16312 [ACK] Seq=2 Ack=163626 Win=65535 Len=0 TSV=1329702723 TSER=1329441681
    476 7.818571    127.0.0.1             127.0.0.1             TCP      commplex-main > 16312 [ACK] Seq=2 Ack=165074 Win=65535 Len=0 TSV=1329722806 TSER=1329461810
    477 7.837726    127.0.0.1             127.0.0.1             TCP      commplex-main > 16312 [ACK] Seq=2 Ack=165074 Win=65535 Len=0 TSV=1329722806 TSER=1329461810
    478 7.838646    127.0.0.1             127.0.0.1             TCP      commplex-main > 16312 [ACK] Seq=2 Ack=166522 Win=65535 Len=0 TSV=1329742888 TSER=1329481831
    479 7.857802    127.0.0.1             127.0.0.1             TCP      commplex-main > 16312 [ACK] Seq=2 Ack=166522 Win=65535 Len=0 TSV=1329742888 TSER=1329481831
    480 7.858729    127.0.0.1             127.0.0.1             TCP      commplex-main > 16312 [ACK] Seq=2 Ack=167970 Win=65535 Len=0 TSV=1329762953 TSER=1329501919
    481 7.877888    127.0.0.1             127.0.0.1             TCP      commplex-main > 16312 [ACK] Seq=2 Ack=167970 Win=65535 Len=0 TSV=1329762953 TSER=1329501919
    482 7.878864    127.0.0.1             127.0.0.1             TCP      commplex-main > 16312 [ACK] Seq=2 Ack=169418 Win=65535 Len=0 TSV=1329783030 TSER=1329501925
    483 7.897973    127.0.0.1             127.0.0.1             TCP      commplex-main > 16312 [ACK] Seq=2 Ack=169418 Win=65535 Len=0 TSV=1329783030 TSER=1329501925
    484 7.898958    127.0.0.1             127.0.0.1             TCP      16312 > commplex-main [ACK] Seq=169418 Ack=2 Win=65535 Len=1448 TSV=1329803157 TSER=1329521962
    485 7.918120    127.0.0.1             127.0.0.1             TCP      16312 > commplex-main [ACK] Seq=169418 Ack=2 Win=65535 Len=1448 TSV=1329803157 TSER=1329521962
    486 7.919095    127.0.0.1             127.0.0.1             TCP      16312 > commplex-main [ACK] Seq=170866 Ack=2 Win=65535 Len=1448 TSV=1329823222 TSER=1329542045
    487 7.938261    127.0.0.1             127.0.0.1             TCP      16312 > commplex-main [ACK] Seq=170866 Ack=2 Win=65535 Len=1448 TSV=1329823222 TSER=1329542045
    488 7.939175    127.0.0.1             127.0.0.1             TCP      16312 > commplex-main [ACK] Seq=172314 Ack=2 Win=65535 Len=1448 TSV=1329843297 TSER=1329562117
    489 7.958336    127.0.0.1             127.0.0.1             TCP      16312 > commplex-main [ACK] Seq=172314 Ack=2 Win=65535 Len=1448 TSV=1329843297 TSER=1329562117
    490 7.959309    127.0.0.1             127.0.0.1             TCP      16312 > commplex-main [ACK] Seq=173762 Ack=2 Win=65535 Len=1448 TSV=1329863424 TSER=1329582195
    491 7.978412    127.0.0.1             127.0.0.1             TCP      16312 > commplex-main [ACK] Seq=173762 Ack=2 Win=65535 Len=1448 TSV=1329863424 TSER=1329582195
    492 7.979386    127.0.0.1             127.0.0.1             TCP      16312 > commplex-main [ACK] Seq=175210 Ack=2 Win=65535 Len=1448 TSV=1329883472 TSER=1329602273
    493 7.998484    127.0.0.1             127.0.0.1             TCP      16312 > commplex-main [ACK] Seq=175210 Ack=2 Win=65535 Len=1448 TSV=1329883472 TSER=1329602273
    494 7.999522    127.0.0.1             127.0.0.1             TCP      16312 > commplex-main [ACK] Seq=176658 Ack=2 Win=65535 Len=1448 TSV=1329903606 TSER=1329622359
    495 8.018688    127.0.0.1             127.0.0.1             TCP      16312 > commplex-main [ACK] Seq=176658 Ack=2 Win=65535 Len=1448 TSV=1329903606 TSER=1329622359
    496 8.019659    127.0.0.1             127.0.0.1             TCP      16312 > commplex-main [ACK] Seq=178106 Ack=2 Win=65535 Len=1448 TSV=1329923666 TSER=1329642437
    497 8.038828    127.0.0.1             127.0.0.1             TCP      16312 > commplex-main [ACK] Seq=178106 Ack=2 Win=65535 Len=1448 TSV=1329923666 TSER=1329642437
    498 8.039795    127.0.0.1             127.0.0.1             TCP      16312 > commplex-main [ACK] Seq=179554 Ack=2 Win=65535 Len=1448 TSV=1329943809 TSER=1329662528
    499 8.058945    127.0.0.1             127.0.0.1             TCP      16312 > commplex-main [ACK] Seq=179554 Ack=2 Win=65535 Len=1448 TSV=1329943809 TSER=1329662528
    500 8.059931    127.0.0.1             127.0.0.1             TCP      16312 > commplex-main [ACK] Seq=181002 Ack=2 Win=65535 Len=1448 TSV=1329963968 TSER=1329682647
    501 8.079038    127.0.0.1             127.0.0.1             TCP      16312 > commplex-main [ACK] Seq=181002 Ack=2 Win=65535 Len=1448 TSV=1329963968 TSER=1329682647
    502 8.080021    127.0.0.1             127.0.0.1             TCP      16312 > commplex-main [ACK] Seq=182450 Ack=2 Win=65535 Len=1448 TSV=1329984046 TSER=1329702723
    503 8.099193    127.0.0.1             127.0.0.1             TCP      16312 > commplex-main [ACK] Seq=182450 Ack=2 Win=65535 Len=1448 TSV=1329984046 TSER=1329702723
    504 8.100109    127.0.0.1             127.0.0.1             TCP      16312 > commplex-main [ACK] Seq=183898 Ack=2 Win=65535 Len=1448 TSV=1330004240 TSER=1329722806
    505 8.119281    127.0.0.1             127.0.0.1             TCP      16312 > commplex-main [ACK] Seq=183898 Ack=2 Win=65535 Len=1448 TSV=1330004240 TSER=1329722806
    506 8.120246    127.0.0.1             127.0.0.1             TCP      16312 > commplex-main [ACK] Seq=185346 Ack=2 Win=65535 Len=1448 TSV=1330024327 TSER=1329742888
    507 8.139354    127.0.0.1             127.0.0.1             TCP      16312 > commplex-main [ACK] Seq=185346 Ack=2 Win=65535 Len=1448 TSV=1330024327 TSER=1329742888
    508 8.140385    127.0.0.1             127.0.0.1             TCP      16312 > commplex-main [ACK] Seq=186794 Ack=2 Win=65535 Len=1448 TSV=1330044413 TSER=1329762953
    509 8.159552    127.0.0.1             127.0.0.1             TCP      16312 > commplex-main [ACK] Seq=186794 Ack=2 Win=65535 Len=1448 TSV=1330044413 TSER=1329762953
    510 8.160466    127.0.0.1             127.0.0.1             TCP      16312 > commplex-main [ACK] Seq=188242 Ack=2 Win=65535 Len=1448 TSV=1330064489 TSER=1329783030
    511 8.179574    127.0.0.1             127.0.0.1             TCP      16312 > commplex-main [ACK] Seq=188242 Ack=2 Win=65535 Len=1448 TSV=1330064489 TSER=1329783030
    512 8.180547    127.0.0.1             127.0.0.1             TCP      16312 > commplex-main [ACK] Seq=189690 Ack=2 Win=65535 Len=1448 TSV=1330064495 TSER=1329783030
    513 8.199743    127.0.0.1             127.0.0.1             TCP      16312 > commplex-main [ACK] Seq=189690 Ack=2 Win=65535 Len=1448 TSV=1330064495 TSER=1329783030
    514 8.200623    127.0.0.1             127.0.0.1             TCP      commplex-main > 16312 [ACK] Seq=2 Ack=170866 Win=65535 Len=0 TSV=1330084610 TSER=1329803157
    515 8.219785    127.0.0.1             127.0.0.1             TCP      commplex-main > 16312 [ACK] Seq=2 Ack=170866 Win=65535 Len=0 TSV=1330084610 TSER=1329803157
    516 8.220760    127.0.0.1             127.0.0.1             TCP      commplex-main > 16312 [ACK] Seq=2 Ack=172314 Win=65535 Len=0 TSV=1330104748 TSER=1329823222
    517 8.239925    127.0.0.1             127.0.0.1             TCP      commplex-main > 16312 [ACK] Seq=2 Ack=172314 Win=65535 Len=0 TSV=1330104748 TSER=1329823222
    518 8.240894    127.0.0.1             127.0.0.1             TCP      commplex-main > 16312 [ACK] Seq=2 Ack=173762 Win=65535 Len=0 TSV=1330124823 TSER=1329843297
    519 8.260007    127.0.0.1             127.0.0.1             TCP      commplex-main > 16312 [ACK] Seq=2 Ack=173762 Win=65535 Len=0 TSV=1330124823 TSER=1329843297
    520 8.260976    127.0.0.1             127.0.0.1             TCP      commplex-main > 16312 [ACK] Seq=2 Ack=175210 Win=65535 Len=0 TSV=1330145283 TSER=1329863424
    521 8.280145    127.0.0.1             127.0.0.1             TCP      commplex-main > 16312 [ACK] Seq=2 Ack=175210 Win=65535 Len=0 TSV=1330145283 TSER=1329863424
    522 8.281110    127.0.0.1             127.0.0.1             TCP      commplex-main > 16312 [ACK] Seq=2 Ack=176658 Win=65535 Len=0 TSV=1330164976 TSER=1329883472
    523 8.300271    127.0.0.1             127.0.0.1             TCP      commplex-main > 16312 [ACK] Seq=2 Ack=176658 Win=65535 Len=0 TSV=1330164976 TSER=1329883472
    524 8.301245    127.0.0.1             127.0.0.1             TCP      commplex-main > 16312 [ACK] Seq=2 Ack=178106 Win=65535 Len=0 TSV=1330185178 TSER=1329903606
    525 8.320400    127.0.0.1             127.0.0.1             TCP      commplex-main > 16312 [ACK] Seq=2 Ack=178106 Win=65535 Len=0 TSV=1330185178 TSER=1329903606
    526 8.321380    127.0.0.1             127.0.0.1             TCP      commplex-main > 16312 [ACK] Seq=2 Ack=179554 Win=65535 Len=0 TSV=1330205319 TSER=1329923666
    527 8.340486    127.0.0.1             127.0.0.1             TCP      commplex-main > 16312 [ACK] Seq=2 Ack=179554 Win=65535 Len=0 TSV=1330205319 TSER=1329923666
    528 8.341470    127.0.0.1             127.0.0.1             TCP      commplex-main > 16312 [ACK] Seq=2 Ack=181002 Win=65535 Len=0 TSV=1330225431 TSER=1329943809
    529 8.360581    127.0.0.1             127.0.0.1             TCP      commplex-main > 16312 [ACK] Seq=2 Ack=181002 Win=65535 Len=0 TSV=1330225431 TSER=1329943809
    530 8.361608    127.0.0.1             127.0.0.1             TCP      commplex-main > 16312 [ACK] Seq=2 Ack=182450 Win=65535 Len=0 TSV=1330245541 TSER=1329963968
    531 8.380765    127.0.0.1             127.0.0.1             TCP      commplex-main > 16312 [ACK] Seq=2 Ack=182450 Win=65535 Len=0 TSV=1330245541 TSER=1329963968
    532 8.381694    127.0.0.1             127.0.0.1             TCP      commplex-main > 16312 [ACK] Seq=2 Ack=183898 Win=65535 Len=0 TSV=1330265693 TSER=1329984046
    533 8.400814    127.0.0.1             127.0.0.1             TCP      commplex-main > 16312 [ACK] Seq=2 Ack=183898 Win=65535 Len=0 TSV=1330265693 TSER=1329984046
    534 8.401778    127.0.0.1             127.0.0.1             TCP      commplex-main > 16312 [ACK] Seq=2 Ack=185346 Win=65535 Len=0 TSV=1330285776 TSER=1330004240
    535 8.420885    127.0.0.1             127.0.0.1             TCP      commplex-main > 16312 [ACK] Seq=2 Ack=185346 Win=65535 Len=0 TSV=1330285776 TSER=1330004240
    536 8.421859    127.0.0.1             127.0.0.1             TCP      commplex-main > 16312 [ACK] Seq=2 Ack=186794 Win=65535 Len=0 TSV=1330305845 TSER=1330024327
    537 8.440974    127.0.0.1             127.0.0.1             TCP      commplex-main > 16312 [ACK] Seq=2 Ack=186794 Win=65535 Len=0 TSV=1330305845 TSER=1330024327
    538 8.441942    127.0.0.1             127.0.0.1             TCP      commplex-main > 16312 [ACK] Seq=2 Ack=188242 Win=65535 Len=0 TSV=1330326040 TSER=1330044413
    539 8.461100    127.0.0.1             127.0.0.1             TCP      commplex-main > 16312 [ACK] Seq=2 Ack=188242 Win=65535 Len=0 TSV=1330326040 TSER=1330044413
    540 8.462033    127.0.0.1             127.0.0.1             TCP      commplex-main > 16312 [ACK] Seq=2 Ack=189690 Win=65535 Len=0 TSV=1330346064 TSER=1330064489
    541 8.481156    127.0.0.1             127.0.0.1             TCP      commplex-main > 16312 [ACK] Seq=2 Ack=189690 Win=65535 Len=0 TSV=1330346064 TSER=1330064489
    542 8.482120    127.0.0.1             127.0.0.1             TCP      commplex-main > 16312 [ACK] Seq=2 Ack=191138 Win=65535 Len=0 TSV=1330366231 TSER=1330064495
    543 8.501307    127.0.0.1             127.0.0.1             TCP      commplex-main > 16312 [ACK] Seq=2 Ack=191138 Win=65535 Len=0 TSV=1330366231 TSER=1330064495
    544 8.502232    127.0.0.1             127.0.0.1             TCP      16312 > commplex-main [ACK] Seq=191138 Ack=2 Win=65535 Len=1448 TSV=1330386342 TSER=1330084610
    545 8.521339    127.0.0.1             127.0.0.1             TCP      16312 > commplex-main [ACK] Seq=191138 Ack=2 Win=65535 Len=1448 TSV=1330386342 TSER=1330084610
    546 8.522319    127.0.0.1             127.0.0.1             TCP      16312 > commplex-main [ACK] Seq=192586 Ack=2 Win=65535 Len=1448 TSV=1330406440 TSER=1330104748
    547 8.541469    127.0.0.1             127.0.0.1             TCP      16312 > commplex-main [ACK] Seq=192586 Ack=2 Win=65535 Len=1448 TSV=1330406440 TSER=1330104748
    548 8.542462    127.0.0.1             127.0.0.1             TCP      16312 > commplex-main [ACK] Seq=194034 Ack=2 Win=65535 Len=1448 TSV=1330426526 TSER=1330124823
    549 8.561571    127.0.0.1             127.0.0.1             TCP      16312 > commplex-main [ACK] Seq=194034 Ack=2 Win=65535 Len=1448 TSV=1330426526 TSER=1330124823
    550 8.562540    127.0.0.1             127.0.0.1             TCP      16312 > commplex-main [ACK] Seq=195482 Ack=2 Win=65535 Len=1448 TSV=1330446664 TSER=1330145283
    551 8.581708    127.0.0.1             127.0.0.1             TCP      16312 > commplex-main [ACK] Seq=195482 Ack=2 Win=65535 Len=1448 TSV=1330446664 TSER=1330145283
    552 8.582678    127.0.0.1             127.0.0.1             TCP      16312 > commplex-main [ACK] Seq=196930 Ack=2 Win=65535 Len=1448 TSV=1330466786 TSER=1330164976
    553 8.601848    127.0.0.1             127.0.0.1             TCP      16312 > commplex-main [ACK] Seq=196930 Ack=2 Win=65535 Len=1448 TSV=1330466786 TSER=1330164976
    554 8.602757    127.0.0.1             127.0.0.1             TCP      16312 > commplex-main [ACK] Seq=198378 Ack=2 Win=65535 Len=1448 TSV=1330486914 TSER=1330185178
    555 8.621921    127.0.0.1             127.0.0.1             TCP      16312 > commplex-main [ACK] Seq=198378 Ack=2 Win=65535 Len=1448 TSV=1330486914 TSER=1330185178
    556 8.622836    127.0.0.1             127.0.0.1             TCP      16312 > commplex-main [ACK] Seq=199826 Ack=2 Win=65535 Len=176 TSV=1330507067 TSER=1330205319
    557 8.641953    127.0.0.1             127.0.0.1             TCP      16312 > commplex-main [ACK] Seq=199826 Ack=2 Win=65535 Len=176 TSV=1330507067 TSER=1330205319
    558 8.642916    127.0.0.1             127.0.0.1             TCP      commplex-main > 16312 [ACK] Seq=2 Ack=192586 Win=65535 Len=0 TSV=1330687846 TSER=1330386342
    559 8.662079    127.0.0.1             127.0.0.1             TCP      commplex-main > 16312 [ACK] Seq=2 Ack=192586 Win=65535 Len=0 TSV=1330687846 TSER=1330386342
    560 8.663007    127.0.0.1             127.0.0.1             TCP      commplex-main > 16312 [ACK] Seq=2 Ack=194034 Win=65535 Len=0 TSV=1330707964 TSER=1330406440
    561 8.682119    127.0.0.1             127.0.0.1             TCP      commplex-main > 16312 [ACK] Seq=2 Ack=194034 Win=65535 Len=0 TSV=1330707964 TSER=1330406440
    562 8.683097    127.0.0.1             127.0.0.1             TCP      commplex-main > 16312 [ACK] Seq=2 Ack=195482 Win=65535 Len=0 TSV=1330728070 TSER=1330426526
    563 8.702264    127.0.0.1             127.0.0.1             TCP      commplex-main > 16312 [ACK] Seq=2 Ack=195482 Win=65535 Len=0 TSV=1330728070 TSER=1330426526
    564 8.703236    127.0.0.1             127.0.0.1             TCP      commplex-main > 16312 [ACK] Seq=2 Ack=196930 Win=65535 Len=0 TSV=1330748210 TSER=1330446664
    565 8.722395    127.0.0.1             127.0.0.1             TCP      commplex-main > 16312 [ACK] Seq=2 Ack=196930 Win=65535 Len=0 TSV=1330748210 TSER=1330446664
    566 8.723377    127.0.0.1             127.0.0.1             TCP      commplex-main > 16312 [ACK] Seq=2 Ack=198378 Win=65535 Len=0 TSV=1330768350 TSER=1330466786
    567 8.742545    127.0.0.1             127.0.0.1             TCP      commplex-main > 16312 [ACK] Seq=2 Ack=198378 Win=65535 Len=0 TSV=1330768350 TSER=1330466786
    568 8.743513    127.0.0.1             127.0.0.1             TCP      commplex-main > 16312 [ACK] Seq=2 Ack=199826 Win=65535 Len=0 TSV=1330788424 TSER=1330486914
    569 8.762622    127.0.0.1             127.0.0.1             TCP      commplex-main > 16312 [ACK] Seq=2 Ack=199826 Win=65535 Len=0 TSV=1330788424 TSER=1330486914
    570 8.763601    127.0.0.1             127.0.0.1             TCP      commplex-main > 16312 [ACK] Seq=2 Ack=200002 Win=65535 Len=0 TSV=1330808442 TSER=1330507067
    571 8.782710    127.0.0.1             127.0.0.1             TCP      commplex-main > 16312 [ACK] Seq=2 Ack=200002 Win=65535 Len=0 TSV=1330808442 TSER=1330507067
    572 8.802899    127.0.0.1             127.0.0.1             TCP      16312 > commplex-main [FIN, ACK] Seq=200002 Ack=2 Win=65535 Len=0 TSV=1330949247 TSER=1330808442
    573 8.822038    127.0.0.1             127.0.0.1             TCP      16312 > commplex-main [FIN, ACK] Seq=200002 Ack=2 Win=65535 Len=0 TSV=1330949247 TSER=1330808442
    574 8.842240    127.0.0.1             127.0.0.1             TCP      commplex-main > 16312 [ACK] Seq=2 Ack=200003 Win=65535 Len=0 TSV=1330988526 TSER=1330949247
    575 8.861340    127.0.0.1             127.0.0.1             TCP      commplex-main > 16312 [ACK] Seq=2 Ack=200003 Win=65535 Len=0 TSV=1330988526 TSER=1330949247
    576 8.862323    127.0.0.1             127.0.0.1             TCP      commplex-main > 16312 [FIN, ACK] Seq=2 Ack=200003 Win=65535 Len=0 TSV=1330988656 TSER=1330949247
    577 8.881436    127.0.0.1             127.0.0.1             TCP      commplex-main > 16312 [FIN, ACK] Seq=2 Ack=200003 Win=65535 Len=0 TSV=1330988656 TSER=1330949247
    578 8.901578    127.0.0.1             127.0.0.1             TCP      16312 > commplex-main [ACK] Seq=200003 Ack=3 Win=65535 Len=0 TSV=1331047909 TSER=1330988656
    579 8.920673    127.0.0.1             127.0.0.1             TCP      16312 > commplex-main [ACK] Seq=200003 Ack=3 Win=65535 Len=0 TSV=1331047909 TSER=1330988656
