No.     Time        Source                Destination           Protocol Info
      1 0.000000    127.0.0.1             127.0.0.1             TCP      29810 > commplex-main [SYN] Seq=1 Win=65535 Len=0 TSV=3885388710 TSER=0
      2 0.000059    127.0.0.1             127.0.0.1             TCP      29810 > commplex-main [SYN] Seq=1 Win=65535 Len=0 TSV=3885388710 TSER=0
      3 0.000151    127.0.0.1             127.0.0.1             TCP      commplex-main > 29810 [SYN, ACK] Seq=1 Ack=2 Win=65535 Len=0 TSV=3885388882 TSER=3885388710
      4 0.000165    127.0.0.1             127.0.0.1             TCP      commplex-main > 29810 [SYN, ACK] Seq=1 Ack=2 Win=65535 Len=0 TSV=3885388882 TSER=3885388710
      5 0.000212    127.0.0.1             127.0.0.1             TCP      29810 > commplex-main [ACK] Seq=2 Ack=2 Win=65535 Len=0 TSV=3885388946 TSER=3885388882
      6 0.000226    127.0.0.1             127.0.0.1             TCP      29810 > commplex-main [ACK] Seq=2 Ack=2 Win=65535 Len=0 TSV=3885388946 TSER=3885388882
      7 0.000537    127.0.0.1             127.0.0.1             TCP      29810 > commplex-main [ACK] Seq=2 Ack=2 Win=65535 Len=1448 TSV=3885389267 TSER=3885388882
      8 0.000553    127.0.0.1             127.0.0.1             TCP      29810 > commplex-main [ACK] Seq=2 Ack=2 Win=65535 Len=1448 TSV=3885389267 TSER=3885388882
      9 0.000595    127.0.0.1             127.0.0.1             TCP      commplex-main > 29810 [ACK] Seq=2 Ack=1450 Win=65535 Len=0 TSV=3885389330 TSER=3885389267
     10 0.000608    127.0.0.1             127.0.0.1             TCP      commplex-main > 29810 [ACK] Seq=2 Ack=1450 Win=65535 Len=0 TSV=3885389330 TSER=3885389267
     11 0.000680    127.0.0.1             127.0.0.1             TCP      29810 > commplex-main [ACK] Seq=1450 Ack=2 Win=65535 Len=1448 TSV=3885389413 TSER=3885389330
     12 0.000686    127.0.0.1             127.0.0.1             TCP      29810 > commplex-main [ACK] Seq=2898 Ack=2 Win=65535 Len=1448 TSV=3885389415 TSER=3885389330
     13 0.000707    127.0.0.1             127.0.0.1             TCP      29810 > commplex-main [ACK] Seq=1450 Ack=2 Win=65535 Len=1448 TSV=3885389413 TSER=3885389330
     14 0.000785    127.0.0.1             127.0.0.1             TCP      commplex-main > 29810 [ACK] Seq=2 Ack=2898 Win=65535 Len=0 TSV=3885389496 TSER=3885389413
     15 0.000797    127.0.0.1             127.0.0.1             TCP      29810 > commplex-main [ACK] Seq=2898 Ack=2 Win=65535 Len=1448 TSV=3885389415 TSER=3885389330
     16 0.000827    127.0.0.1             127.0.0.1             TCP      commplex-main > 29810 [ACK] Seq=2 Ack=2898 Win=65535 Len=0 TSV=3885389496 TSER=3885389413
     17 0.000845    127.0.0.1             127.0.0.1             TCP      commplex-main > 29810 [ACK] Seq=2 Ack=4346 Win=65535 Len=0 TSV=3885389579 TSER=3885389415
     18 0.000868    127.0.0.1             127.0.0.1             TCP      commplex-main > 29810 [ACK] Seq=2 Ack=4346 Win=65535 Len=0 TSV=3885389579 TSER=3885389415
     19 0.000936    127.0.0.1             127.0.0.1             TCP      29810 > commplex-main [ACK] Seq=4346 Ack=2 Win=65535 Len=1448 TSV=3885389669 TSER=3885389496
     20 0.000942    127.0.0.1             127.0.0.1             TCP      29810 > commplex-main [ACK] Seq=5794 Ack=2 Win=65535 Len=1448 TSV=3885389673 TSER=3885389496
     21 0.000972    127.0.0.1             127.0.0.1             TCP      29810 > commplex-main [ACK] Seq=7242 Ack=2 Win=65535 Len=1448 TSV=3885389707 TSER=3885389579
     22 0.000978    127.0.0.1             127.0.0.1             TCP      29810 > commplex-main [ACK] Seq=8690 Ack=2 Win=65535 Len=1448 TSV=3885389711 TSER=3885389579
     23 0.001002    127.0.0.1             127.0.0.1             TCP      29810 > commplex-main [ACK] Seq=4346 Ack=2 Win=65535 Len=1448 TSV=3885389669 TSER=3885389496
     24 0.001025    127.0.0.1             127.0.0.1             TCP      29810 > commplex-main [ACK] Seq=5794 Ack=2 Win=65535 Len=1448 TSV=3885389673 TSER=3885389496
     25 0.001050    127.0.0.1             127.0.0.1             TCP      29810 > commplex-main [ACK] Seq=7242 Ack=2 Win=65535 Len=1448 TSV=3885389707 TSER=3885389579
     26 0.001083    127.0.0.1             127.0.0.1             TCP      commplex-main > 29810 [ACK] Seq=2 Ack=5794 Win=65535 Len=0 TSV=3885389808 TSER=3885389669
     27 0.001096    127.0.0.1             127.0.0.1             TCP      commplex-main > 29810 [ACK] Seq=2 Ack=7242 Win=64087 Len=0 TSV=3885389817 TSER=3885389673
     28 0.001111    127.0.0.1             127.0.0.1             TCP      commplex-main > 29810 [ACK] Seq=2 Ack=8690 Win=62639 Len=0 TSV=3885389825 TSER=3885389707
     29 0.001118    127.0.0.1             127.0.0.1             TCP      29810 > commplex-main [ACK] Seq=8690 Ack=2 Win=65535 Len=1448 TSV=3885389711 TSER=3885389579
     30 0.001149    127.0.0.1             127.0.0.1             TCP      commplex-main > 29810 [ACK] Seq=2 Ack=10138 Win=64087 Len=0 TSV=3885389887 TSER=3885389711
     31 0.001150    127.0.0.1             127.0.0.1             TCP      commplex-main > 29810 [ACK] Seq=2 Ack=5794 Win=65535 Len=0 TSV=3885389808 TSER=3885389669
     32 0.001194    127.0.0.1             127.0.0.1             TCP      commplex-main > 29810 [ACK] Seq=2 Ack=7242 Win=64087 Len=0 TSV=3885389817 TSER=3885389673
     33 0.001215    127.0.0.1             127.0.0.1             TCP      commplex-main > 29810 [ACK] Seq=2 Ack=8690 Win=62639 Len=0 TSV=3885389825 TSER=3885389707
     34 0.001226    127.0.0.1             127.0.0.1             TCP      29810 > commplex-main [ACK] Seq=10138 Ack=2 Win=65535 Len=1448 TSV=3885389949 TSER=3885389808
     35 0.001232    127.0.0.1             127.0.0.1             TCP      29810 > commplex-main [ACK] Seq=11586 Ack=2 Win=65535 Len=1448 TSV=3885389951 TSER=3885389808
     36 0.001245    127.0.0.1             127.0.0.1             TCP      commplex-main > 29810 [ACK] Seq=2 Ack=10138 Win=64087 Len=0 TSV=3885389887 TSER=3885389711
     37 0.001272    127.0.0.1             127.0.0.1             TCP      29810 > commplex-main [ACK] Seq=10138 Ack=2 Win=65535 Len=1448 TSV=3885389949 TSER=3885389808
     38 0.001291    127.0.0.1             127.0.0.1             TCP      29810 > commplex-main [ACK] Seq=11586 Ack=2 Win=65535 Len=1448 TSV=3885389951 TSER=3885389808
     39 0.001333    127.0.0.1             127.0.0.1             TCP      29810 > commplex-main [ACK] Seq=13034 Ack=2 Win=65535 Len=1448 TSV=3885390024 TSER=3885389817
     40 0.001339    127.0.0.1             127.0.0.1             TCP      29810 > commplex-main [ACK] Seq=14482 Ack=2 Win=65535 Len=1448 TSV=3885390027 TSER=3885389817
     41 0.001355    127.0.0.1             127.0.0.1             TCP      29810 > commplex-main [ACK] Seq=15930 Ack=2 Win=65535 Len=1448 TSV=3885390059 TSER=3885389825
     42 0.001361    127.0.0.1             127.0.0.1             TCP      29810 > commplex-main [ACK] Seq=17378 Ack=2 Win=65535 Len=1448 TSV=3885390062 TSER=3885389825
     43 0.001437    127.0.0.1             127.0.0.1             TCP      29810 > commplex-main [ACK] Seq=18826 Ack=2 Win=65535 Len=1448 TSV=3885390149 TSER=3885389887
     44 0.001444    127.0.0.1             127.0.0.1             TCP      29810 > commplex-main [ACK] Seq=20274 Ack=2 Win=65535 Len=1448 TSV=3885390153 TSER=3885389887
     45 0.001448    127.0.0.1             127.0.0.1             TCP      commplex-main > 29810 [ACK] Seq=2 Ack=11586 Win=65535 Len=0 TSV=3885390166 TSER=3885389949
     46 0.001453    127.0.0.1             127.0.0.1             TCP      commplex-main > 29810 [ACK] Seq=2 Ack=13034 Win=64087 Len=0 TSV=3885390175 TSER=3885389951
     47 0.001484    127.0.0.1             127.0.0.1             TCP      29810 > commplex-main [ACK] Seq=13034 Ack=2 Win=65535 Len=1448 TSV=3885390024 TSER=3885389817
     48 0.001530    127.0.0.1             127.0.0.1             TCP      commplex-main > 29810 [ACK] Seq=2 Ack=14482 Win=64087 Len=0 TSV=3885390266 TSER=3885390024
     49 0.001547    127.0.0.1             127.0.0.1             TCP      29810 > commplex-main [ACK] Seq=14482 Ack=2 Win=65535 Len=1448 TSV=3885390027 TSER=3885389817
     50 0.001576    127.0.0.1             127.0.0.1             TCP      commplex-main > 29810 [ACK] Seq=2 Ack=15930 Win=65535 Len=0 TSV=3885390315 TSER=3885390027
     51 0.001593    127.0.0.1             127.0.0.1             TCP      29810 > commplex-main [ACK] Seq=15930 Ack=2 Win=65535 Len=1448 TSV=3885390059 TSER=3885389825
     52 0.001627    127.0.0.1             127.0.0.1             TCP      commplex-main > 29810 [ACK] Seq=2 Ack=17378 Win=65535 Len=0 TSV=3885390361 TSER=3885390059
     53 0.001646    127.0.0.1             127.0.0.1             TCP      29810 > commplex-main [ACK] Seq=17378 Ack=2 Win=65535 Len=1448 TSV=3885390062 TSER=3885389825
     54 0.001674    127.0.0.1             127.0.0.1             TCP      commplex-main > 29810 [ACK] Seq=2 Ack=18826 Win=65535 Len=0 TSV=3885390416 TSER=3885390062
     55 0.001697    127.0.0.1             127.0.0.1             TCP      29810 > commplex-main [ACK] Seq=18826 Ack=2 Win=65535 Len=1448 TSV=3885390149 TSER=3885389887
     56 0.001711    127.0.0.1             127.0.0.1             TCP      commplex-main > 29810 [ACK] Seq=2 Ack=11586 Win=65535 Len=0 TSV=3885390166 TSER=3885389949
     57 0.001785    127.0.0.1             127.0.0.1             TCP      commplex-main > 29810 [ACK] Seq=2 Ack=20274 Win=65535 Len=0 TSV=3885390483 TSER=3885390149
     58 0.001791    127.0.0.1             127.0.0.1             TCP      29810 > commplex-main [ACK] Seq=21722 Ack=2 Win=65535 Len=1448 TSV=3885390522 TSER=3885390166
     59 0.001797    127.0.0.1             127.0.0.1             TCP      29810 > commplex-main [ACK] Seq=23170 Ack=2 Win=65535 Len=1448 TSV=3885390525 TSER=3885390166
     60 0.001811    127.0.0.1             127.0.0.1             TCP      commplex-main > 29810 [ACK] Seq=2 Ack=13034 Win=64087 Len=0 TSV=3885390175 TSER=3885389951
     61 0.001880    127.0.0.1             127.0.0.1             TCP      29810 > commplex-main [ACK] Seq=24618 Ack=2 Win=65535 Len=1448 TSV=3885390606 TSER=3885390175
     62 0.001886    127.0.0.1             127.0.0.1             TCP      29810 > commplex-main [ACK] Seq=26066 Ack=2 Win=65535 Len=1448 TSV=3885390608 TSER=3885390175
     63 0.001904    127.0.0.1             127.0.0.1             TCP      commplex-main > 29810 [ACK] Seq=2 Ack=14482 Win=64087 Len=0 TSV=3885390266 TSER=3885390024
     64 0.001973    127.0.0.1             127.0.0.1             TCP      29810 > commplex-main [ACK] Seq=27514 Ack=2 Win=65535 Len=1448 TSV=3885390700 TSER=3885390266
     65 0.001979    127.0.0.1             127.0.0.1             TCP      29810 > commplex-main [ACK] Seq=28962 Ack=2 Win=65535 Len=1448 TSV=3885390702 TSER=3885390266
     66 0.001993    127.0.0.1             127.0.0.1             TCP      commplex-main > 29810 [ACK] Seq=2 Ack=15930 Win=65535 Len=0 TSV=3885390315 TSER=3885390027
     67 0.002068    127.0.0.1             127.0.0.1             TCP      29810 > commplex-main [ACK] Seq=30410 Ack=2 Win=65535 Len=1448 TSV=3885390803 TSER=3885390315
     68 0.002075    127.0.0.1             127.0.0.1             TCP      29810 > commplex-main [ACK] Seq=31858 Ack=2 Win=65535 Len=1448 TSV=3885390807 TSER=3885390315
     69 0.002092    127.0.0.1             127.0.0.1             TCP      commplex-main > 29810 [ACK] Seq=2 Ack=17378 Win=65535 Len=0 TSV=3885390361 TSER=3885390059
     70 0.002156    127.0.0.1             127.0.0.1             TCP      29810 > commplex-main [ACK] Seq=33306 Ack=2 Win=65535 Len=1448 TSV=3885390891 TSER=3885390361
     71 0.002163    127.0.0.1             127.0.0.1             TCP      29810 > commplex-main [ACK] Seq=34754 Ack=2 Win=65535 Len=1448 TSV=3885390895 TSER=3885390361
     72 0.002178    127.0.0.1             127.0.0.1             TCP      commplex-main > 29810 [ACK] Seq=2 Ack=18826 Win=65535 Len=0 TSV=3885390416 TSER=3885390062
     73 0.002246    127.0.0.1             127.0.0.1             TCP      29810 > commplex-main [ACK] Seq=36202 Ack=2 Win=65535 Len=1448 TSV=3885390972 TSER=3885390416
     74 0.002252    127.0.0.1             127.0.0.1             TCP      29810 > commplex-main [ACK] Seq=37650 Ack=2 Win=65535 Len=1448 TSV=3885390975 TSER=3885390416
     75 0.002271    127.0.0.1             127.0.0.1             TCP      commplex-main > 29810 [ACK] Seq=2 Ack=20274 Win=65535 Len=0 TSV=3885390483 TSER=3885390149
     76 0.002298    127.0.0.1             127.0.0.1             TCP      29810 > commplex-main [ACK] Seq=21722 Ack=2 Win=65535 Len=1448 TSV=3885390522 TSER=3885390166
     77 0.002332    127.0.0.1             127.0.0.1             TCP      29810 > commplex-main [ACK] Seq=23170 Ack=2 Win=65535 Len=1448 TSV=3885390525 TSER=3885390166
     78 0.002357    127.0.0.1             127.0.0.1             TCP      29810 > commplex-main [ACK] Seq=39098 Ack=2 Win=65535 Len=1448 TSV=3885391088 TSER=3885390483
     79 0.002377    127.0.0.1             127.0.0.1             TCP      29810 > commplex-main [ACK] Seq=40546 Ack=2 Win=65535 Len=1448 TSV=3885391090 TSER=3885390483
     80 0.002382    127.0.0.1             127.0.0.1             TCP      commplex-main > 29810 [ACK] Seq=2 Ack=20274 Win=64087 Len=0 TSV=3885391105 TSER=3885390522
     81 0.002391    127.0.0.1             127.0.0.1             TCP      commplex-main > 29810 [ACK] Seq=2 Ack=20274 Win=62639 Len=0 TSV=3885391125 TSER=3885390525
     82 0.002407    127.0.0.1             127.0.0.1             TCP      29810 > commplex-main [ACK] Seq=24618 Ack=2 Win=65535 Len=1448 TSV=3885390606 TSER=3885390175
     83 0.002430    127.0.0.1             127.0.0.1             TCP      29810 > commplex-main [ACK] Seq=26066 Ack=2 Win=65535 Len=1448 TSV=3885390608 TSER=3885390175
     84 0.002453    127.0.0.1             127.0.0.1             TCP      commplex-main > 29810 [ACK] Seq=2 Ack=20274 Win=61191 Len=0 TSV=3885391178 TSER=3885390606
     85 0.002466    127.0.0.1             127.0.0.1             TCP      commplex-main > 29810 [ACK] Seq=2 Ack=20274 Win=59743 Len=0 TSV=3885391204 TSER=3885390608
     86 0.002477    127.0.0.1             127.0.0.1             TCP      29810 > commplex-main [ACK] Seq=27514 Ack=2 Win=65535 Len=1448 TSV=3885390700 TSER=3885390266
     87 0.002499    127.0.0.1             127.0.0.1             TCP      29810 > commplex-main [ACK] Seq=28962 Ack=2 Win=65535 Len=1448 TSV=3885390702 TSER=3885390266
     88 0.002517    127.0.0.1             127.0.0.1             TCP      commplex-main > 29810 [ACK] Seq=2 Ack=20274 Win=58295 Len=0 TSV=3885391250 TSER=3885390700
     89 0.002531    127.0.0.1             127.0.0.1             TCP      commplex-main > 29810 [ACK] Seq=2 Ack=20274 Win=56847 Len=0 TSV=3885391270 TSER=3885390702
     90 0.002543    127.0.0.1             127.0.0.1             TCP      29810 > commplex-main [ACK] Seq=30410 Ack=2 Win=65535 Len=1448 TSV=3885390803 TSER=3885390315
     91 0.002564    127.0.0.1             127.0.0.1             TCP      29810 > commplex-main [ACK] Seq=31858 Ack=2 Win=65535 Len=1448 TSV=3885390807 TSER=3885390315
     92 0.002580    127.0.0.1             127.0.0.1             TCP      commplex-main > 29810 [ACK] Seq=2 Ack=20274 Win=55399 Len=0 TSV=3885391313 TSER=3885390803
     93 0.002600    127.0.0.1             127.0.0.1             TCP      commplex-main > 29810 [ACK] Seq=2 Ack=20274 Win=53951 Len=0 TSV=3885391337 TSER=3885390807
     94 0.002604    127.0.0.1             127.0.0.1             TCP      29810 > commplex-main [ACK] Seq=33306 Ack=2 Win=65535 Len=1448 TSV=3885390891 TSER=3885390361
     95 0.002626    127.0.0.1             127.0.0.1             TCP      29810 > commplex-main [ACK] Seq=34754 Ack=2 Win=65535 Len=1448 TSV=3885390895 TSER=3885390361
     96 0.002643    127.0.0.1             127.0.0.1             TCP      commplex-main > 29810 [ACK] Seq=2 Ack=20274 Win=52503 Len=0 TSV=3885391374 TSER=3885390891
     97 0.002656    127.0.0.1             127.0.0.1             TCP      commplex-main > 29810 [ACK] Seq=2 Ack=20274 Win=51055 Len=0 TSV=3885391395 TSER=3885390895
     98 0.002669    127.0.0.1             127.0.0.1             TCP      29810 > commplex-main [ACK] Seq=36202 Ack=2 Win=65535 Len=1448 TSV=3885390972 TSER=3885390416
     99 0.002693    127.0.0.1             127.0.0.1             TCP      29810 > commplex-main [ACK] Seq=39098 Ack=2 Win=65535 Len=1448 TSV=3885391088 TSER=3885390483
    100 0.002711    127.0.0.1             127.0.0.1             TCP      commplex-main > 29810 [ACK] Seq=2 Ack=20274 Win=49607 Len=0 TSV=3885391439 TSER=3885390972
    101 0.002723    127.0.0.1             127.0.0.1             TCP      commplex-main > 29810 [ACK] Seq=2 Ack=20274 Win=48159 Len=0 TSV=3885391463 TSER=3885391088
    102 0.002738    127.0.0.1             127.0.0.1             TCP      commplex-main > 29810 [ACK] Seq=2 Ack=20274 Win=64087 Len=0 TSV=3885391105 TSER=3885390522
    103 0.002773    127.0.0.1             127.0.0.1             TCP      commplex-main > 29810 [ACK] Seq=2 Ack=20274 Win=62639 Len=0 TSV=3885391125 TSER=3885390525
    104 0.002794    127.0.0.1             127.0.0.1             TCP      commplex-main > 29810 [ACK] Seq=2 Ack=20274 Win=61191 Len=0 TSV=3885391178 TSER=3885390606
    105 0.002819    127.0.0.1             127.0.0.1             TCP      commplex-main > 29810 [ACK] Seq=2 Ack=20274 Win=59743 Len=0 TSV=3885391204 TSER=3885390608
    106 0.002840    127.0.0.1             127.0.0.1             TCP      commplex-main > 29810 [ACK] Seq=2 Ack=20274 Win=58295 Len=0 TSV=3885391250 TSER=3885390700
    107 0.002863    127.0.0.1             127.0.0.1             TCP      commplex-main > 29810 [ACK] Seq=2 Ack=20274 Win=56847 Len=0 TSV=3885391270 TSER=3885390702
    108 0.002884    127.0.0.1             127.0.0.1             TCP      29810 > commplex-main [ACK] Seq=20274 Ack=2 Win=65535 Len=1448 TSV=3885391622 TSER=3885391204
    109 0.002899    127.0.0.1             127.0.0.1             TCP      commplex-main > 29810 [ACK] Seq=2 Ack=20274 Win=55399 Len=0 TSV=3885391313 TSER=3885390803
    110 0.002919    127.0.0.1             127.0.0.1             TCP      commplex-main > 29810 [ACK] Seq=2 Ack=20274 Win=53951 Len=0 TSV=3885391337 TSER=3885390807
    111 0.002944    127.0.0.1             127.0.0.1             TCP      commplex-main > 29810 [ACK] Seq=2 Ack=20274 Win=52503 Len=0 TSV=3885391374 TSER=3885390891
    112 0.002965    127.0.0.1             127.0.0.1             TCP      commplex-main > 29810 [ACK] Seq=2 Ack=20274 Win=51055 Len=0 TSV=3885391395 TSER=3885390895
    113 0.002988    127.0.0.1             127.0.0.1             TCP      commplex-main > 29810 [ACK] Seq=2 Ack=20274 Win=49607 Len=0 TSV=3885391439 TSER=3885390972
    114 0.003009    127.0.0.1             127.0.0.1             TCP      commplex-main > 29810 [ACK] Seq=2 Ack=20274 Win=48159 Len=0 TSV=3885391463 TSER=3885391088
    115 0.003032    127.0.0.1             127.0.0.1             TCP      29810 > commplex-main [ACK] Seq=20274 Ack=2 Win=65535 Len=1448 TSV=3885391622 TSER=3885391204
    116 0.003081    127.0.0.1             127.0.0.1             TCP      commplex-main > 29810 [ACK] Seq=2 Ack=37650 Win=64087 Len=0 TSV=3885391816 TSER=3885391622
    117 0.003098    127.0.0.1             127.0.0.1             TCP      commplex-main > 29810 [ACK] Seq=2 Ack=37650 Win=64087 Len=0 TSV=3885391816 TSER=3885391622
    118 0.003188    127.0.0.1             127.0.0.1             TCP      29810 > commplex-main [ACK] Seq=37650 Ack=2 Win=65535 Len=1448 TSV=3885391918 TSER=3885391816
    119 0.003194    127.0.0.1             127.0.0.1             TCP      29810 > commplex-main [ACK] Seq=39098 Ack=2 Win=65535 Len=1448 TSV=3885391921 TSER=3885391816
    120 0.003208    127.0.0.1             127.0.0.1             TCP      29810 > commplex-main [ACK] Seq=37650 Ack=2 Win=65535 Len=1448 TSV=3885391918 TSER=3885391816
    121 0.003229    127.0.0.1             127.0.0.1             TCP      29810 > commplex-main [ACK] Seq=39098 Ack=2 Win=65535 Len=1448 TSV=3885391921 TSER=3885391816
    122 0.003327    127.0.0.1             127.0.0.1             TCP      commplex-main > 29810 [ACK] Seq=2 Ack=40546 Win=65535 Len=0 TSV=3885391983 TSER=3885391918
    123 0.003332    127.0.0.1             127.0.0.1             TCP      commplex-main > 29810 [ACK] Seq=2 Ack=40546 Win=65535 Len=0 TSV=3885392067 TSER=3885391918
    124 0.003353    127.0.0.1             127.0.0.1             TCP      commplex-main > 29810 [ACK] Seq=2 Ack=40546 Win=65535 Len=0 TSV=3885391983 TSER=3885391918
    125 0.003378    127.0.0.1             127.0.0.1             TCP      commplex-main > 29810 [ACK] Seq=2 Ack=40546 Win=65535 Len=0 TSV=3885392067 TSER=3885391918
    126 0.003424    127.0.0.1             127.0.0.1             TCP      29810 > commplex-main [ACK] Seq=40546 Ack=2 Win=65535 Len=1448 TSV=3885392154 TSER=3885391983
    127 0.003430    127.0.0.1             127.0.0.1             TCP      29810 > commplex-main [ACK] Seq=41994 Ack=2 Win=65535 Len=1448 TSV=3885392157 TSER=3885391983
    128 0.003436    127.0.0.1             127.0.0.1             TCP      29810 > commplex-main [ACK] Seq=43442 Ack=2 Win=65535 Len=1448 TSV=3885392159 TSER=3885391983
    129 0.003456    127.0.0.1             127.0.0.1             TCP      29810 > commplex-main [ACK] Seq=40546 Ack=2 Win=65535 Len=1448 TSV=3885392154 TSER=3885391983
    130 0.003484    127.0.0.1             127.0.0.1             TCP      29810 > commplex-main [ACK] Seq=41994 Ack=2 Win=65535 Len=1448 TSV=3885392157 TSER=3885391983
    131 0.003512    127.0.0.1             127.0.0.1             TCP      commplex-main > 29810 [ACK] Seq=2 Ack=41994 Win=65535 Len=0 TSV=3885392249 TSER=3885392154
    132 0.003523    127.0.0.1             127.0.0.1             TCP      29810 > commplex-main [ACK] Seq=43442 Ack=2 Win=65535 Len=1448 TSV=3885392159 TSER=3885391983
    133 0.003542    127.0.0.1             127.0.0.1             TCP      commplex-main > 29810 [ACK] Seq=2 Ack=43442 Win=64087 Len=0 TSV=3885392262 TSER=3885392157
    134 0.003545    127.0.0.1             127.0.0.1             TCP      commplex-main > 29810 [ACK] Seq=2 Ack=41994 Win=65535 Len=0 TSV=3885392249 TSER=3885392154
    135 0.003568    127.0.0.1             127.0.0.1             TCP      commplex-main > 29810 [ACK] Seq=2 Ack=43442 Win=64087 Len=0 TSV=3885392262 TSER=3885392157
    136 0.003658    127.0.0.1             127.0.0.1             TCP      commplex-main > 29810 [ACK] Seq=2 Ack=44890 Win=64087 Len=0 TSV=3885392307 TSER=3885392159
    137 0.003668    127.0.0.1             127.0.0.1             TCP      commplex-main > 29810 [ACK] Seq=2 Ack=44890 Win=64087 Len=0 TSV=3885392307 TSER=3885392159
    138 0.003717    127.0.0.1             127.0.0.1             TCP      29810 > commplex-main [ACK] Seq=44890 Ack=2 Win=65535 Len=1448 TSV=3885392451 TSER=3885392249
    139 0.003723    127.0.0.1             127.0.0.1             TCP      29810 > commplex-main [ACK] Seq=46338 Ack=2 Win=65535 Len=1448 TSV=3885392455 TSER=3885392249
    140 0.003743    127.0.0.1             127.0.0.1             TCP      29810 > commplex-main [ACK] Seq=44890 Ack=2 Win=65535 Len=1448 TSV=3885392451 TSER=3885392249
    141 0.003764    127.0.0.1             127.0.0.1             TCP      29810 > commplex-main [ACK] Seq=47786 Ack=2 Win=65535 Len=1448 TSV=3885392489 TSER=3885392262
    142 0.003771    127.0.0.1             127.0.0.1             TCP      29810 > commplex-main [ACK] Seq=49234 Ack=2 Win=65535 Len=1448 TSV=3885392493 TSER=3885392262
    143 0.003797    127.0.0.1             127.0.0.1             TCP      29810 > commplex-main [ACK] Seq=50682 Ack=2 Win=65535 Len=1448 TSV=3885392531 TSER=3885392307
    144 0.003803    127.0.0.1             127.0.0.1             TCP      29810 > commplex-main [ACK] Seq=52130 Ack=2 Win=65535 Len=1448 TSV=3885392535 TSER=3885392307
    145 0.003812    127.0.0.1             127.0.0.1             TCP      commplex-main > 29810 [ACK] Seq=2 Ack=46338 Win=65535 Len=0 TSV=3885392547 TSER=3885392451
    146 0.003833    127.0.0.1             127.0.0.1             TCP      29810 > commplex-main [ACK] Seq=46338 Ack=2 Win=65535 Len=1448 TSV=3885392455 TSER=3885392249
    147 0.003854    127.0.0.1             127.0.0.1             TCP      29810 > commplex-main [ACK] Seq=47786 Ack=2 Win=65535 Len=1448 TSV=3885392489 TSER=3885392262
    148 0.003871    127.0.0.1             127.0.0.1             TCP      commplex-main > 29810 [ACK] Seq=2 Ack=47786 Win=65535 Len=0 TSV=3885392608 TSER=3885392455
    149 0.003903    127.0.0.1             127.0.0.1             TCP      commplex-main > 29810 [ACK] Seq=2 Ack=49234 Win=64087 Len=0 TSV=3885392639 TSER=3885392489
    150 0.003908    127.0.0.1             127.0.0.1             TCP      29810 > commplex-main [ACK] Seq=49234 Ack=2 Win=65535 Len=1448 TSV=3885392493 TSER=3885392262
    151 0.003934    127.0.0.1             127.0.0.1             TCP      29810 > commplex-main [ACK] Seq=50682 Ack=2 Win=65535 Len=1448 TSV=3885392531 TSER=3885392307
    152 0.003955    127.0.0.1             127.0.0.1             TCP      commplex-main > 29810 [ACK] Seq=2 Ack=50682 Win=64087 Len=0 TSV=3885392682 TSER=3885392493
    153 0.003983    127.0.0.1             127.0.0.1             TCP      29810 > commplex-main [ACK] Seq=52130 Ack=2 Win=65535 Len=1448 TSV=3885392535 TSER=3885392307
    154 0.004000    127.0.0.1             127.0.0.1             TCP      commplex-main > 29810 [ACK] Seq=2 Ack=52130 Win=64087 Len=0 TSV=3885392732 TSER=3885392531
    155 0.004026    127.0.0.1             127.0.0.1             TCP      commplex-main > 29810 [ACK] Seq=2 Ack=46338 Win=65535 Len=0 TSV=3885392547 TSER=3885392451
    156 0.004044    127.0.0.1             127.0.0.1             TCP      commplex-main > 29810 [ACK] Seq=2 Ack=53578 Win=64087 Len=0 TSV=3885392778 TSER=3885392535
    157 0.004067    127.0.0.1             127.0.0.1             TCP      commplex-main > 29810 [ACK] Seq=2 Ack=47786 Win=65535 Len=0 TSV=3885392608 TSER=3885392455
    158 0.004101    127.0.0.1             127.0.0.1             TCP      29810 > commplex-main [ACK] Seq=53578 Ack=2 Win=65535 Len=1448 TSV=3885392837 TSER=3885392547
    159 0.004107    127.0.0.1             127.0.0.1             TCP      29810 > commplex-main [ACK] Seq=55026 Ack=2 Win=65535 Len=1448 TSV=3885392841 TSER=3885392547
    160 0.004129    127.0.0.1             127.0.0.1             TCP      commplex-main > 29810 [ACK] Seq=2 Ack=49234 Win=64087 Len=0 TSV=3885392639 TSER=3885392489
    161 0.004147    127.0.0.1             127.0.0.1             TCP      29810 > commplex-main [ACK] Seq=56474 Ack=2 Win=65535 Len=1448 TSV=3885392875 TSER=3885392608
    162 0.004154    127.0.0.1             127.0.0.1             TCP      29810 > commplex-main [ACK] Seq=57922 Ack=2 Win=65535 Len=1448 TSV=3885392880 TSER=3885392608
    163 0.004177    127.0.0.1             127.0.0.1             TCP      commplex-main > 29810 [ACK] Seq=2 Ack=50682 Win=64087 Len=0 TSV=3885392682 TSER=3885392493
    164 0.004194    127.0.0.1             127.0.0.1             TCP      29810 > commplex-main [ACK] Seq=59370 Ack=2 Win=65535 Len=1448 TSV=3885392925 TSER=3885392639
    165 0.004219    127.0.0.1             127.0.0.1             TCP      commplex-main > 29810 [ACK] Seq=2 Ack=52130 Win=64087 Len=0 TSV=3885392732 TSER=3885392531
    166 0.004236    127.0.0.1             127.0.0.1             TCP      29810 > commplex-main [ACK] Seq=60818 Ack=2 Win=65535 Len=1448 TSV=3885392970 TSER=3885392682
    167 0.004254    127.0.0.1             127.0.0.1             TCP      commplex-main > 29810 [ACK] Seq=2 Ack=53578 Win=64087 Len=0 TSV=3885392778 TSER=3885392535
    168 0.004290    127.0.0.1             127.0.0.1             TCP      29810 > commplex-main [ACK] Seq=62266 Ack=2 Win=65535 Len=1448 TSV=3885393024 TSER=3885392732
    169 0.004315    127.0.0.1             127.0.0.1             TCP      29810 > commplex-main [ACK] Seq=53578 Ack=2 Win=65535 Len=1448 TSV=3885392837 TSER=3885392547
    170 0.004333    127.0.0.1             127.0.0.1             TCP      29810 > commplex-main [ACK] Seq=63714 Ack=2 Win=65535 Len=1448 TSV=3885393061 TSER=3885392778
    171 0.004354    127.0.0.1             127.0.0.1             TCP      commplex-main > 29810 [ACK] Seq=2 Ack=55026 Win=65535 Len=0 TSV=3885393089 TSER=3885392837
    172 0.004373    127.0.0.1             127.0.0.1             TCP      29810 > commplex-main [ACK] Seq=55026 Ack=2 Win=65535 Len=1448 TSV=3885392841 TSER=3885392547
    173 0.004398    127.0.0.1             127.0.0.1             TCP      29810 > commplex-main [ACK] Seq=56474 Ack=2 Win=65535 Len=1448 TSV=3885392875 TSER=3885392608
    174 0.004416    127.0.0.1             127.0.0.1             TCP      commplex-main > 29810 [ACK] Seq=2 Ack=56474 Win=65535 Len=0 TSV=3885393152 TSER=3885392841
    175 0.004456    127.0.0.1             127.0.0.1             TCP      commplex-main > 29810 [ACK] Seq=2 Ack=57922 Win=65535 Len=0 TSV=3885393192 TSER=3885392875
    176 0.004461    127.0.0.1             127.0.0.1             TCP      29810 > commplex-main [ACK] Seq=57922 Ack=2 Win=65535 Len=1448 TSV=3885392880 TSER=3885392608
    177 0.004503    127.0.0.1             127.0.0.1             TCP      commplex-main > 29810 [ACK] Seq=2 Ack=59370 Win=65535 Len=0 TSV=3885393238 TSER=3885392880
    178 0.004506    127.0.0.1             127.0.0.1             TCP      29810 > commplex-main [ACK] Seq=59370 Ack=2 Win=65535 Len=1448 TSV=3885392925 TSER=3885392639
    179 0.004547    127.0.0.1             127.0.0.1             TCP      commplex-main > 29810 [ACK] Seq=2 Ack=60818 Win=65535 Len=0 TSV=3885393282 TSER=3885392925
    180 0.004550    127.0.0.1             127.0.0.1             TCP      29810 > commplex-main [ACK] Seq=60818 Ack=2 Win=65535 Len=1448 TSV=3885392970 TSER=3885392682
    181 0.004591    127.0.0.1             127.0.0.1             TCP      commplex-main > 29810 [ACK] Seq=2 Ack=62266 Win=65535 Len=0 TSV=3885393327 TSER=3885392970
    182 0.004600    127.0.0.1             127.0.0.1             TCP      29810 > commplex-main [ACK] Seq=62266 Ack=2 Win=65535 Len=1448 TSV=3885393024 TSER=3885392732
    183 0.004638    127.0.0.1             127.0.0.1             TCP      commplex-main > 29810 [ACK] Seq=2 Ack=63714 Win=65535 Len=0 TSV=3885393373 TSER=3885393024
    184 0.004641    127.0.0.1             127.0.0.1             TCP      29810 > commplex-main [ACK] Seq=63714 Ack=2 Win=65535 Len=1448 TSV=3885393061 TSER=3885392778
    185 0.004682    127.0.0.1             127.0.0.1             TCP      commplex-main > 29810 [ACK] Seq=2 Ack=65162 Win=65535 Len=0 TSV=3885393418 TSER=3885393061
    186 0.004685    127.0.0.1             127.0.0.1             TCP      commplex-main > 29810 [ACK] Seq=2 Ack=55026 Win=65535 Len=0 TSV=3885393089 TSER=3885392837
    187 0.004721    127.0.0.1             127.0.0.1             TCP      commplex-main > 29810 [ACK] Seq=2 Ack=56474 Win=65535 Len=0 TSV=3885393152 TSER=3885392841
    188 0.004747    127.0.0.1             127.0.0.1             TCP      29810 > commplex-main [ACK] Seq=65162 Ack=2 Win=65535 Len=1448 TSV=3885393479 TSER=3885393089
    189 0.004770    127.0.0.1             127.0.0.1             TCP      commplex-main > 29810 [ACK] Seq=2 Ack=57922 Win=65535 Len=0 TSV=3885393192 TSER=3885392875
    190 0.004786    127.0.0.1             127.0.0.1             TCP      29810 > commplex-main [ACK] Seq=66610 Ack=2 Win=65535 Len=1448 TSV=3885393518 TSER=3885393152
    191 0.004811    127.0.0.1             127.0.0.1             TCP      commplex-main > 29810 [ACK] Seq=2 Ack=59370 Win=65535 Len=0 TSV=3885393238 TSER=3885392880
    192 0.004832    127.0.0.1             127.0.0.1             TCP      29810 > commplex-main [ACK] Seq=68058 Ack=2 Win=65535 Len=1448 TSV=3885393565 TSER=3885393192
    193 0.004857    127.0.0.1             127.0.0.1             TCP      commplex-main > 29810 [ACK] Seq=2 Ack=60818 Win=65535 Len=0 TSV=3885393282 TSER=3885392925
    194 0.004875    127.0.0.1             127.0.0.1             TCP      29810 > commplex-main [ACK] Seq=69506 Ack=2 Win=65535 Len=1448 TSV=3885393608 TSER=3885393238
    195 0.004899    127.0.0.1             127.0.0.1             TCP      commplex-main > 29810 [ACK] Seq=2 Ack=62266 Win=65535 Len=0 TSV=3885393327 TSER=3885392970
    196 0.004928    127.0.0.1             127.0.0.1             TCP      29810 > commplex-main [ACK] Seq=70954 Ack=2 Win=65535 Len=1448 TSV=3885393665 TSER=3885393282
    197 0.004934    127.0.0.1             127.0.0.1             TCP      29810 > commplex-main [ACK] Seq=72402 Ack=2 Win=65535 Len=1448 TSV=3885393669 TSER=3885393282
    198 0.004947    127.0.0.1             127.0.0.1             TCP      commplex-main > 29810 [ACK] Seq=2 Ack=63714 Win=65535 Len=0 TSV=3885393373 TSER=3885393024
    199 0.004961    127.0.0.1             127.0.0.1             TCP      commplex-main > 29810 [ACK] Seq=2 Ack=65162 Win=65535 Len=0 TSV=3885393418 TSER=3885393061
    200 0.004987    127.0.0.1             127.0.0.1             TCP      29810 > commplex-main [ACK] Seq=73850 Ack=2 Win=65535 Len=1448 TSV=3885393725 TSER=3885393327
    201 0.005011    127.0.0.1             127.0.0.1             TCP      29810 > commplex-main [ACK] Seq=65162 Ack=2 Win=65535 Len=1448 TSV=3885393479 TSER=3885393089
    202 0.005042    127.0.0.1             127.0.0.1             TCP      29810 > commplex-main [ACK] Seq=75298 Ack=2 Win=65535 Len=1448 TSV=3885393757 TSER=3885393373
    203 0.005055    127.0.0.1             127.0.0.1             TCP      29810 > commplex-main [ACK] Seq=76746 Ack=2 Win=65535 Len=1448 TSV=3885393791 TSER=3885393418
    204 0.005072    127.0.0.1             127.0.0.1             TCP      commplex-main > 29810 [ACK] Seq=2 Ack=66610 Win=65535 Len=0 TSV=3885393801 TSER=3885393479
    205 0.005093    127.0.0.1             127.0.0.1             TCP      29810 > commplex-main [ACK] Seq=66610 Ack=2 Win=65535 Len=1448 TSV=3885393518 TSER=3885393152
    206 0.005130    127.0.0.1             127.0.0.1             TCP      commplex-main > 29810 [ACK] Seq=2 Ack=68058 Win=65535 Len=0 TSV=3885393863 TSER=3885393518
    207 0.005139    127.0.0.1             127.0.0.1             TCP      29810 > commplex-main [ACK] Seq=68058 Ack=2 Win=65535 Len=1448 TSV=3885393565 TSER=3885393192
    208 0.005175    127.0.0.1             127.0.0.1             TCP      commplex-main > 29810 [ACK] Seq=2 Ack=69506 Win=65535 Len=0 TSV=3885393909 TSER=3885393565
    209 0.005189    127.0.0.1             127.0.0.1             TCP      29810 > commplex-main [ACK] Seq=69506 Ack=2 Win=65535 Len=1448 TSV=3885393608 TSER=3885393238
    210 0.005226    127.0.0.1             127.0.0.1             TCP      commplex-main > 29810 [ACK] Seq=2 Ack=70954 Win=65535 Len=0 TSV=3885393958 TSER=3885393608
    211 0.005240    127.0.0.1             127.0.0.1             TCP      29810 > commplex-main [ACK] Seq=70954 Ack=2 Win=65535 Len=1448 TSV=3885393665 TSER=3885393282
    212 0.005276    127.0.0.1             127.0.0.1             TCP      commplex-main > 29810 [ACK] Seq=2 Ack=72402 Win=65535 Len=0 TSV=3885394008 TSER=3885393665
    213 0.005290    127.0.0.1             127.0.0.1             TCP      29810 > commplex-main [ACK] Seq=72402 Ack=2 Win=65535 Len=1448 TSV=3885393669 TSER=3885393282
    214 0.005328    127.0.0.1             127.0.0.1             TCP      commplex-main > 29810 [ACK] Seq=2 Ack=73850 Win=65535 Len=0 TSV=3885394061 TSER=3885393669
    215 0.005344    127.0.0.1             127.0.0.1             TCP      29810 > commplex-main [ACK] Seq=73850 Ack=2 Win=65535 Len=1448 TSV=3885393725 TSER=3885393327
    216 0.005379    127.0.0.1             127.0.0.1             TCP      commplex-main > 29810 [ACK] Seq=2 Ack=75298 Win=65535 Len=0 TSV=3885394113 TSER=3885393725
    217 0.005392    127.0.0.1             127.0.0.1             TCP      29810 > commplex-main [ACK] Seq=75298 Ack=2 Win=65535 Len=1448 TSV=3885393757 TSER=3885393373
    218 0.005428    127.0.0.1             127.0.0.1             TCP      commplex-main > 29810 [ACK] Seq=2 Ack=76746 Win=65535 Len=0 TSV=3885394160 TSER=3885393757
    219 0.005442    127.0.0.1             127.0.0.1             TCP      29810 > commplex-main [ACK] Seq=76746 Ack=2 Win=65535 Len=1448 TSV=3885393791 TSER=3885393418
    220 0.005499    127.0.0.1             127.0.0.1             TCP      commplex-main > 29810 [ACK] Seq=2 Ack=78194 Win=65535 Len=0 TSV=3885394210 TSER=3885393791
    221 0.005507    127.0.0.1             127.0.0.1             TCP      commplex-main > 29810 [ACK] Seq=2 Ack=66610 Win=65535 Len=0 TSV=3885393801 TSER=3885393479
    222 0.005542    127.0.0.1             127.0.0.1             TCP      commplex-main > 29810 [ACK] Seq=2 Ack=68058 Win=65535 Len=0 TSV=3885393863 TSER=3885393518
    223 0.005577    127.0.0.1             127.0.0.1             TCP      29810 > commplex-main [ACK] Seq=78194 Ack=2 Win=65535 Len=1448 TSV=3885394304 TSER=3885393801
    224 0.005600    127.0.0.1             127.0.0.1             TCP      29810 > commplex-main [ACK] Seq=79642 Ack=2 Win=65535 Len=1448 TSV=3885394337 TSER=3885393863
    225 0.005616    127.0.0.1             127.0.0.1             TCP      commplex-main > 29810 [ACK] Seq=2 Ack=69506 Win=65535 Len=0 TSV=3885393909 TSER=3885393565
    226 0.005638    127.0.0.1             127.0.0.1             TCP      commplex-main > 29810 [ACK] Seq=2 Ack=70954 Win=65535 Len=0 TSV=3885393958 TSER=3885393608
    227 0.005674    127.0.0.1             127.0.0.1             TCP      29810 > commplex-main [ACK] Seq=81090 Ack=2 Win=65535 Len=1448 TSV=3885394411 TSER=3885393909
    228 0.005695    127.0.0.1             127.0.0.1             TCP      commplex-main > 29810 [ACK] Seq=2 Ack=72402 Win=65535 Len=0 TSV=3885394008 TSER=3885393665
    229 0.005712    127.0.0.1             127.0.0.1             TCP      29810 > commplex-main [ACK] Seq=82538 Ack=2 Win=65535 Len=1448 TSV=3885394447 TSER=3885393958
    230 0.005742    127.0.0.1             127.0.0.1             TCP      commplex-main > 29810 [ACK] Seq=2 Ack=73850 Win=65535 Len=0 TSV=3885394061 TSER=3885393669
    231 0.005759    127.0.0.1             127.0.0.1             TCP      29810 > commplex-main [ACK] Seq=83986 Ack=2 Win=65535 Len=1448 TSV=3885394483 TSER=3885394008
    232 0.005785    127.0.0.1             127.0.0.1             TCP      commplex-main > 29810 [ACK] Seq=2 Ack=75298 Win=65535 Len=0 TSV=3885394113 TSER=3885393725
    233 0.005809    127.0.0.1             127.0.0.1             TCP      29810 > commplex-main [ACK] Seq=85434 Ack=2 Win=65535 Len=1448 TSV=3885394536 TSER=3885394061
    234 0.005830    127.0.0.1             127.0.0.1             TCP      29810 > commplex-main [ACK] Seq=86882 Ack=2 Win=65535 Len=1448 TSV=3885394552 TSER=3885394061
    235 0.005846    127.0.0.1             127.0.0.1             TCP      29810 > commplex-main [ACK] Seq=88330 Ack=2 Win=65535 Len=1448 TSV=3885394584 TSER=3885394113
    236 0.005857    127.0.0.1             127.0.0.1             TCP      commplex-main > 29810 [ACK] Seq=2 Ack=76746 Win=65535 Len=0 TSV=3885394160 TSER=3885393757
    237 0.005883    127.0.0.1             127.0.0.1             TCP      commplex-main > 29810 [ACK] Seq=2 Ack=78194 Win=65535 Len=0 TSV=3885394210 TSER=3885393791
    238 0.005912    127.0.0.1             127.0.0.1             TCP      29810 > commplex-main [ACK] Seq=89778 Ack=2 Win=65535 Len=1448 TSV=3885394649 TSER=3885394160
    239 0.005948    127.0.0.1             127.0.0.1             TCP      29810 > commplex-main [ACK] Seq=91226 Ack=2 Win=65535 Len=1448 TSV=3885394682 TSER=3885394210
    240 0.005954    127.0.0.1             127.0.0.1             TCP      29810 > commplex-main [ACK] Seq=78194 Ack=2 Win=65535 Len=1448 TSV=3885394304 TSER=3885393801
    241 0.005975    127.0.0.1             127.0.0.1             TCP      29810 > commplex-main [ACK] Seq=79642 Ack=2 Win=65535 Len=1448 TSV=3885394337 TSER=3885393863
    242 0.005998    127.0.0.1             127.0.0.1             TCP      commplex-main > 29810 [ACK] Seq=2 Ack=79642 Win=65535 Len=0 TSV=3885394728 TSER=3885394304
    243 0.006015    127.0.0.1             127.0.0.1             TCP      29810 > commplex-main [ACK] Seq=81090 Ack=2 Win=65535 Len=1448 TSV=3885394411 TSER=3885393909
    244 0.006038    127.0.0.1             127.0.0.1             TCP      commplex-main > 29810 [ACK] Seq=2 Ack=81090 Win=64087 Len=0 TSV=3885394765 TSER=3885394337
    245 0.006055    127.0.0.1             127.0.0.1             TCP      29810 > commplex-main [ACK] Seq=82538 Ack=2 Win=65535 Len=1448 TSV=3885394447 TSER=3885393958
    246 0.006079    127.0.0.1             127.0.0.1             TCP      commplex-main > 29810 [ACK] Seq=2 Ack=82538 Win=64087 Len=0 TSV=3885394804 TSER=3885394411
    247 0.006097    127.0.0.1             127.0.0.1             TCP      29810 > commplex-main [ACK] Seq=83986 Ack=2 Win=65535 Len=1448 TSV=3885394483 TSER=3885394008
    248 0.006120    127.0.0.1             127.0.0.1             TCP      commplex-main > 29810 [ACK] Seq=2 Ack=83986 Win=64087 Len=0 TSV=3885394845 TSER=3885394447
    249 0.006137    127.0.0.1             127.0.0.1             TCP      29810 > commplex-main [ACK] Seq=85434 Ack=2 Win=65535 Len=1448 TSV=3885394536 TSER=3885394061
    250 0.006160    127.0.0.1             127.0.0.1             TCP      commplex-main > 29810 [ACK] Seq=2 Ack=85434 Win=64087 Len=0 TSV=3885394888 TSER=3885394483
    251 0.006178    127.0.0.1             127.0.0.1             TCP      29810 > commplex-main [ACK] Seq=86882 Ack=2 Win=65535 Len=1448 TSV=3885394552 TSER=3885394061
    252 0.006201    127.0.0.1             127.0.0.1             TCP      commplex-main > 29810 [ACK] Seq=2 Ack=86882 Win=64087 Len=0 TSV=3885394928 TSER=3885394536
    253 0.006218    127.0.0.1             127.0.0.1             TCP      29810 > commplex-main [ACK] Seq=88330 Ack=2 Win=65535 Len=1448 TSV=3885394584 TSER=3885394113
    254 0.006242    127.0.0.1             127.0.0.1             TCP      commplex-main > 29810 [ACK] Seq=2 Ack=88330 Win=64087 Len=0 TSV=3885394970 TSER=3885394552
    255 0.006259    127.0.0.1             127.0.0.1             TCP      29810 > commplex-main [ACK] Seq=89778 Ack=2 Win=65535 Len=1448 TSV=3885394649 TSER=3885394160
    256 0.006283    127.0.0.1             127.0.0.1             TCP      commplex-main > 29810 [ACK] Seq=2 Ack=89778 Win=64087 Len=0 TSV=3885395007 TSER=3885394584
    257 0.006300    127.0.0.1             127.0.0.1             TCP      29810 > commplex-main [ACK] Seq=91226 Ack=2 Win=65535 Len=1448 TSV=3885394682 TSER=3885394210
    258 0.006324    127.0.0.1             127.0.0.1             TCP      commplex-main > 29810 [ACK] Seq=2 Ack=91226 Win=64087 Len=0 TSV=3885395052 TSER=3885394649
    259 0.006341    127.0.0.1             127.0.0.1             TCP      commplex-main > 29810 [ACK] Seq=2 Ack=79642 Win=65535 Len=0 TSV=3885394728 TSER=3885394304
    260 0.006364    127.0.0.1             127.0.0.1             TCP      commplex-main > 29810 [ACK] Seq=2 Ack=92674 Win=64087 Len=0 TSV=3885395093 TSER=3885394682
    261 0.006385    127.0.0.1             127.0.0.1             TCP      commplex-main > 29810 [ACK] Seq=2 Ack=81090 Win=64087 Len=0 TSV=3885394765 TSER=3885394337
    262 0.006422    127.0.0.1             127.0.0.1             TCP      29810 > commplex-main [ACK] Seq=92674 Ack=2 Win=65535 Len=1448 TSV=3885395158 TSER=3885394728
    263 0.006445    127.0.0.1             127.0.0.1             TCP      commplex-main > 29810 [ACK] Seq=2 Ack=82538 Win=64087 Len=0 TSV=3885394804 TSER=3885394411
    264 0.006461    127.0.0.1             127.0.0.1             TCP      29810 > commplex-main [ACK] Seq=94122 Ack=2 Win=65535 Len=1448 TSV=3885395193 TSER=3885394765
    265 0.006487    127.0.0.1             127.0.0.1             TCP      commplex-main > 29810 [ACK] Seq=2 Ack=83986 Win=64087 Len=0 TSV=3885394845 TSER=3885394447
    266 0.006504    127.0.0.1             127.0.0.1             TCP      29810 > commplex-main [ACK] Seq=95570 Ack=2 Win=65535 Len=1448 TSV=3885395238 TSER=3885394804
    267 0.006529    127.0.0.1             127.0.0.1             TCP      commplex-main > 29810 [ACK] Seq=2 Ack=85434 Win=64087 Len=0 TSV=3885394888 TSER=3885394483
    268 0.006548    127.0.0.1             127.0.0.1             TCP      29810 > commplex-main [ACK] Seq=97018 Ack=2 Win=65535 Len=1448 TSV=3885395279 TSER=3885394845
    269 0.006573    127.0.0.1             127.0.0.1             TCP      commplex-main > 29810 [ACK] Seq=2 Ack=86882 Win=64087 Len=0 TSV=3885394928 TSER=3885394536
    270 0.006590    127.0.0.1             127.0.0.1             TCP      29810 > commplex-main [ACK] Seq=98466 Ack=2 Win=65535 Len=1448 TSV=3885395322 TSER=3885394888
    271 0.006615    127.0.0.1             127.0.0.1             TCP      commplex-main > 29810 [ACK] Seq=2 Ack=88330 Win=64087 Len=0 TSV=3885394970 TSER=3885394552
    272 0.006633    127.0.0.1             127.0.0.1             TCP      29810 > commplex-main [ACK] Seq=99914 Ack=2 Win=65535 Len=1448 TSV=3885395365 TSER=3885394928
    273 0.006658    127.0.0.1             127.0.0.1             TCP      commplex-main > 29810 [ACK] Seq=2 Ack=89778 Win=64087 Len=0 TSV=3885395007 TSER=3885394584
    274 0.006669    127.0.0.1             127.0.0.1             TCP      29810 > commplex-main [ACK] Seq=101362 Ack=2 Win=65535 Len=1448 TSV=3885395407 TSER=3885394970
    275 0.006706    127.0.0.1             127.0.0.1             TCP      commplex-main > 29810 [ACK] Seq=2 Ack=91226 Win=64087 Len=0 TSV=3885395052 TSER=3885394649
    276 0.006740    127.0.0.1             127.0.0.1             TCP      29810 > commplex-main [ACK] Seq=102810 Ack=2 Win=65535 Len=1448 TSV=3885395467 TSER=3885395007
    277 0.006748    127.0.0.1             127.0.0.1             TCP      29810 > commplex-main [ACK] Seq=104258 Ack=2 Win=65535 Len=1448 TSV=3885395471 TSER=3885395007
    278 0.006764    127.0.0.1             127.0.0.1             TCP      commplex-main > 29810 [ACK] Seq=2 Ack=92674 Win=64087 Len=0 TSV=3885395093 TSER=3885394682
    279 0.006787    127.0.0.1             127.0.0.1             TCP      29810 > commplex-main [ACK] Seq=105706 Ack=2 Win=65535 Len=1448 TSV=3885395525 TSER=3885395052
    280 0.006830    127.0.0.1             127.0.0.1             TCP      29810 > commplex-main [ACK] Seq=107154 Ack=2 Win=65535 Len=1448 TSV=3885395567 TSER=3885395093
    281 0.006839    127.0.0.1             127.0.0.1             TCP      29810 > commplex-main [ACK] Seq=92674 Ack=2 Win=65535 Len=1448 TSV=3885395158 TSER=3885394728
    282 0.006876    127.0.0.1             127.0.0.1             TCP      commplex-main > 29810 [ACK] Seq=2 Ack=94122 Win=65535 Len=0 TSV=3885395610 TSER=3885395158
    283 0.006887    127.0.0.1             127.0.0.1             TCP      29810 > commplex-main [ACK] Seq=94122 Ack=2 Win=65535 Len=1448 TSV=3885395193 TSER=3885394765
    284 0.006926    127.0.0.1             127.0.0.1             TCP      commplex-main > 29810 [ACK] Seq=2 Ack=95570 Win=65535 Len=0 TSV=3885395660 TSER=3885395193
    285 0.006942    127.0.0.1             127.0.0.1             TCP      29810 > commplex-main [ACK] Seq=95570 Ack=2 Win=65535 Len=1448 TSV=3885395238 TSER=3885394804
    286 0.006977    127.0.0.1             127.0.0.1             TCP      commplex-main > 29810 [ACK] Seq=2 Ack=97018 Win=65535 Len=0 TSV=3885395712 TSER=3885395238
    287 0.006991    127.0.0.1             127.0.0.1             TCP      29810 > commplex-main [ACK] Seq=97018 Ack=2 Win=65535 Len=1448 TSV=3885395279 TSER=3885394845
    288 0.007026    127.0.0.1             127.0.0.1             TCP      commplex-main > 29810 [ACK] Seq=2 Ack=98466 Win=65535 Len=0 TSV=3885395760 TSER=3885395279
    289 0.007041    127.0.0.1             127.0.0.1             TCP      29810 > commplex-main [ACK] Seq=98466 Ack=2 Win=65535 Len=1448 TSV=3885395322 TSER=3885394888
    290 0.007076    127.0.0.1             127.0.0.1             TCP      commplex-main > 29810 [ACK] Seq=2 Ack=99914 Win=65535 Len=0 TSV=3885395810 TSER=3885395322
    291 0.007091    127.0.0.1             127.0.0.1             TCP      29810 > commplex-main [ACK] Seq=99914 Ack=2 Win=65535 Len=1448 TSV=3885395365 TSER=3885394928
    292 0.007126    127.0.0.1             127.0.0.1             TCP      commplex-main > 29810 [ACK] Seq=2 Ack=101362 Win=65535 Len=0 TSV=3885395860 TSER=3885395365
    293 0.007140    127.0.0.1             127.0.0.1             TCP      29810 > commplex-main [ACK] Seq=101362 Ack=2 Win=65535 Len=1448 TSV=3885395407 TSER=3885394970
    294 0.007175    127.0.0.1             127.0.0.1             TCP      commplex-main > 29810 [ACK] Seq=2 Ack=102810 Win=65535 Len=0 TSV=3885395909 TSER=3885395407
    295 0.007189    127.0.0.1             127.0.0.1             TCP      29810 > commplex-main [ACK] Seq=102810 Ack=2 Win=65535 Len=1448 TSV=3885395467 TSER=3885395007
    296 0.007225    127.0.0.1             127.0.0.1             TCP      commplex-main > 29810 [ACK] Seq=2 Ack=104258 Win=65535 Len=0 TSV=3885395958 TSER=3885395467
    297 0.007239    127.0.0.1             127.0.0.1             TCP      29810 > commplex-main [ACK] Seq=104258 Ack=2 Win=65535 Len=1448 TSV=3885395471 TSER=3885395007
    298 0.007274    127.0.0.1             127.0.0.1             TCP      commplex-main > 29810 [ACK] Seq=2 Ack=105706 Win=65535 Len=0 TSV=3885396008 TSER=3885395471
    299 0.007289    127.0.0.1             127.0.0.1             TCP      29810 > commplex-main [ACK] Seq=105706 Ack=2 Win=65535 Len=1448 TSV=3885395525 TSER=3885395052
    300 0.007325    127.0.0.1             127.0.0.1             TCP      commplex-main > 29810 [ACK] Seq=2 Ack=107154 Win=65535 Len=0 TSV=3885396058 TSER=3885395525
    301 0.007341    127.0.0.1             127.0.0.1             TCP      29810 > commplex-main [ACK] Seq=107154 Ack=2 Win=65535 Len=1448 TSV=3885395567 TSER=3885395093
    302 0.007376    127.0.0.1             127.0.0.1             TCP      commplex-main > 29810 [ACK] Seq=2 Ack=108602 Win=65535 Len=0 TSV=3885396110 TSER=3885395567
    303 0.007390    127.0.0.1             127.0.0.1             TCP      commplex-main > 29810 [ACK] Seq=2 Ack=94122 Win=65535 Len=0 TSV=3885395610 TSER=3885395158
    304 0.007412    127.0.0.1             127.0.0.1             TCP      commplex-main > 29810 [ACK] Seq=2 Ack=95570 Win=65535 Len=0 TSV=3885395660 TSER=3885395193
    305 0.007458    127.0.0.1             127.0.0.1             TCP      29810 > commplex-main [ACK] Seq=108602 Ack=2 Win=65535 Len=1448 TSV=3885396195 TSER=3885395610
    306 0.007471    127.0.0.1             127.0.0.1             TCP      commplex-main > 29810 [ACK] Seq=2 Ack=97018 Win=65535 Len=0 TSV=3885395712 TSER=3885395238
    307 0.007494    127.0.0.1             127.0.0.1             TCP      commplex-main > 29810 [ACK] Seq=2 Ack=98466 Win=65535 Len=0 TSV=3885395760 TSER=3885395279
    308 0.007509    127.0.0.1             127.0.0.1             TCP      29810 > commplex-main [ACK] Seq=110050 Ack=2 Win=65535 Len=1448 TSV=3885396244 TSER=3885395660
    309 0.007536    127.0.0.1             127.0.0.1             TCP      commplex-main > 29810 [ACK] Seq=2 Ack=99914 Win=65535 Len=0 TSV=3885395810 TSER=3885395322
    310 0.007549    127.0.0.1             127.0.0.1             TCP      29810 > commplex-main [ACK] Seq=111498 Ack=2 Win=65535 Len=1448 TSV=3885396288 TSER=3885395712
    311 0.007576    127.0.0.1             127.0.0.1             TCP      commplex-main > 29810 [ACK] Seq=2 Ack=101362 Win=65535 Len=0 TSV=3885395860 TSER=3885395365
    312 0.007593    127.0.0.1             127.0.0.1             TCP      29810 > commplex-main [ACK] Seq=112946 Ack=2 Win=65535 Len=1448 TSV=3885396329 TSER=3885395760
    313 0.007618    127.0.0.1             127.0.0.1             TCP      commplex-main > 29810 [ACK] Seq=2 Ack=102810 Win=65535 Len=0 TSV=3885395909 TSER=3885395407
    314 0.007634    127.0.0.1             127.0.0.1             TCP      29810 > commplex-main [ACK] Seq=114394 Ack=2 Win=65535 Len=1448 TSV=3885396371 TSER=3885395810
    315 0.007660    127.0.0.1             127.0.0.1             TCP      commplex-main > 29810 [ACK] Seq=2 Ack=104258 Win=65535 Len=0 TSV=3885395958 TSER=3885395467
    316 0.007677    127.0.0.1             127.0.0.1             TCP      29810 > commplex-main [ACK] Seq=115842 Ack=2 Win=65535 Len=1448 TSV=3885396413 TSER=3885395860
    317 0.007702    127.0.0.1             127.0.0.1             TCP      commplex-main > 29810 [ACK] Seq=2 Ack=105706 Win=65535 Len=0 TSV=3885396008 TSER=3885395471
    318 0.007718    127.0.0.1             127.0.0.1             TCP      29810 > commplex-main [ACK] Seq=117290 Ack=2 Win=65535 Len=1448 TSV=3885396455 TSER=3885395909
    319 0.007744    127.0.0.1             127.0.0.1             TCP      commplex-main > 29810 [ACK] Seq=2 Ack=107154 Win=65535 Len=0 TSV=3885396058 TSER=3885395525
    320 0.007761    127.0.0.1             127.0.0.1             TCP      29810 > commplex-main [ACK] Seq=118738 Ack=2 Win=65535 Len=1448 TSV=3885396497 TSER=3885395958
    321 0.007786    127.0.0.1             127.0.0.1             TCP      commplex-main > 29810 [ACK] Seq=2 Ack=108602 Win=65535 Len=0 TSV=3885396110 TSER=3885395567
    322 0.007805    127.0.0.1             127.0.0.1             TCP      29810 > commplex-main [ACK] Seq=120186 Ack=2 Win=65535 Len=1448 TSV=3885396545 TSER=3885396008
    323 0.007812    127.0.0.1             127.0.0.1             TCP      29810 > commplex-main [ACK] Seq=121634 Ack=2 Win=65535 Len=1448 TSV=3885396552 TSER=3885396008
    324 0.007833    127.0.0.1             127.0.0.1             TCP      29810 > commplex-main [ACK] Seq=108602 Ack=2 Win=65535 Len=1448 TSV=3885396195 TSER=3885395610
    325 0.007858    127.0.0.1             127.0.0.1             TCP      29810 > commplex-main [ACK] Seq=123082 Ack=2 Win=65535 Len=1448 TSV=3885396595 TSER=3885396058
    326 0.007872    127.0.0.1             127.0.0.1             TCP      29810 > commplex-main [ACK] Seq=110050 Ack=2 Win=65535 Len=1448 TSV=3885396244 TSER=3885395660
    327 0.007897    127.0.0.1             127.0.0.1             TCP      29810 > commplex-main [ACK] Seq=111498 Ack=2 Win=65535 Len=1448 TSV=3885396288 TSER=3885395712
    328 0.007911    127.0.0.1             127.0.0.1             TCP      29810 > commplex-main [ACK] Seq=124530 Ack=2 Win=65535 Len=1448 TSV=3885396644 TSER=3885396110
    329 0.007935    127.0.0.1             127.0.0.1             TCP      29810 > commplex-main [ACK] Seq=112946 Ack=2 Win=65535 Len=1448 TSV=3885396329 TSER=3885395760
    330 0.007949    127.0.0.1             127.0.0.1             TCP      commplex-main > 29810 [ACK] Seq=2 Ack=110050 Win=65535 Len=0 TSV=3885396687 TSER=3885396195
    331 0.007973    127.0.0.1             127.0.0.1             TCP      commplex-main > 29810 [ACK] Seq=2 Ack=111498 Win=64087 Len=0 TSV=3885396703 TSER=3885396244
    332 0.007979    127.0.0.1             127.0.0.1             TCP      commplex-main > 29810 [ACK] Seq=2 Ack=112946 Win=62639 Len=0 TSV=3885396712 TSER=3885396288
    333 0.007990    127.0.0.1             127.0.0.1             TCP      29810 > commplex-main [ACK] Seq=114394 Ack=2 Win=65535 Len=1448 TSV=3885396371 TSER=3885395810
    334 0.008021    127.0.0.1             127.0.0.1             TCP      29810 > commplex-main [ACK] Seq=115842 Ack=2 Win=65535 Len=1448 TSV=3885396413 TSER=3885395860
    335 0.008033    127.0.0.1             127.0.0.1             TCP      commplex-main > 29810 [ACK] Seq=2 Ack=114394 Win=64087 Len=0 TSV=3885396763 TSER=3885396329
    336 0.008055    127.0.0.1             127.0.0.1             TCP      29810 > commplex-main [ACK] Seq=117290 Ack=2 Win=65535 Len=1448 TSV=3885396455 TSER=3885395909
    337 0.008069    127.0.0.1             127.0.0.1             TCP      commplex-main > 29810 [ACK] Seq=2 Ack=115842 Win=64087 Len=0 TSV=3885396807 TSER=3885396371
    338 0.008074    127.0.0.1             127.0.0.1             TCP      commplex-main > 29810 [ACK] Seq=2 Ack=117290 Win=62639 Len=0 TSV=3885396818 TSER=3885396413
    339 0.008092    127.0.0.1             127.0.0.1             TCP      29810 > commplex-main [ACK] Seq=118738 Ack=2 Win=65535 Len=1448 TSV=3885396497 TSER=3885395958
    340 0.008116    127.0.0.1             127.0.0.1             TCP      commplex-main > 29810 [ACK] Seq=2 Ack=118738 Win=64087 Len=0 TSV=3885396853 TSER=3885396455
    341 0.008125    127.0.0.1             127.0.0.1             TCP      29810 > commplex-main [ACK] Seq=120186 Ack=2 Win=65535 Len=1448 TSV=3885396545 TSER=3885396008
    342 0.008149    127.0.0.1             127.0.0.1             TCP      commplex-main > 29810 [ACK] Seq=2 Ack=120186 Win=64087 Len=0 TSV=3885396887 TSER=3885396497
    343 0.008158    127.0.0.1             127.0.0.1             TCP      29810 > commplex-main [ACK] Seq=121634 Ack=2 Win=65535 Len=1448 TSV=3885396552 TSER=3885396008
    344 0.008181    127.0.0.1             127.0.0.1             TCP      29810 > commplex-main [ACK] Seq=123082 Ack=2 Win=65535 Len=1448 TSV=3885396595 TSER=3885396058
    345 0.008193    127.0.0.1             127.0.0.1             TCP      commplex-main > 29810 [ACK] Seq=2 Ack=121634 Win=64087 Len=0 TSV=3885396924 TSER=3885396545
    346 0.008214    127.0.0.1             127.0.0.1             TCP      29810 > commplex-main [ACK] Seq=124530 Ack=2 Win=65535 Len=1448 TSV=3885396644 TSER=3885396110
    347 0.008228    127.0.0.1             127.0.0.1             TCP      commplex-main > 29810 [ACK] Seq=2 Ack=123082 Win=64087 Len=0 TSV=3885396957 TSER=3885396552
    348 0.008234    127.0.0.1             127.0.0.1             TCP      commplex-main > 29810 [ACK] Seq=2 Ack=124530 Win=62639 Len=0 TSV=3885396968 TSER=3885396595
    349 0.008252    127.0.0.1             127.0.0.1             TCP      commplex-main > 29810 [ACK] Seq=2 Ack=110050 Win=65535 Len=0 TSV=3885396687 TSER=3885396195
    350 0.008266    127.0.0.1             127.0.0.1             TCP      commplex-main > 29810 [ACK] Seq=2 Ack=125978 Win=64087 Len=0 TSV=3885397003 TSER=3885396644
    351 0.008283    127.0.0.1             127.0.0.1             TCP      commplex-main > 29810 [ACK] Seq=2 Ack=111498 Win=64087 Len=0 TSV=3885396703 TSER=3885396244
    352 0.008312    127.0.0.1             127.0.0.1             TCP      commplex-main > 29810 [ACK] Seq=2 Ack=112946 Win=62639 Len=0 TSV=3885396712 TSER=3885396288
    353 0.008342    127.0.0.1             127.0.0.1             TCP      29810 > commplex-main [ACK] Seq=125978 Ack=2 Win=65535 Len=1448 TSV=3885397075 TSER=3885396687
    354 0.008348    127.0.0.1             127.0.0.1             TCP      commplex-main > 29810 [ACK] Seq=2 Ack=114394 Win=64087 Len=0 TSV=3885396763 TSER=3885396329
    355 0.008374    127.0.0.1             127.0.0.1             TCP      commplex-main > 29810 [ACK] Seq=2 Ack=115842 Win=64087 Len=0 TSV=3885396807 TSER=3885396371
    356 0.008390    127.0.0.1             127.0.0.1             TCP      29810 > commplex-main [ACK] Seq=127426 Ack=2 Win=65535 Len=1448 TSV=3885397128 TSER=3885396703
    357 0.008416    127.0.0.1             127.0.0.1             TCP      commplex-main > 29810 [ACK] Seq=2 Ack=117290 Win=62639 Len=0 TSV=3885396818 TSER=3885396413
    358 0.008434    127.0.0.1             127.0.0.1             TCP      29810 > commplex-main [ACK] Seq=128874 Ack=2 Win=65535 Len=1448 TSV=3885397170 TSER=3885396712
    359 0.008458    127.0.0.1             127.0.0.1             TCP      commplex-main > 29810 [ACK] Seq=2 Ack=118738 Win=64087 Len=0 TSV=3885396853 TSER=3885396455
    360 0.008472    127.0.0.1             127.0.0.1             TCP      29810 > commplex-main [ACK] Seq=130322 Ack=2 Win=65535 Len=1448 TSV=3885397211 TSER=3885396763
    361 0.008499    127.0.0.1             127.0.0.1             TCP      commplex-main > 29810 [ACK] Seq=2 Ack=120186 Win=64087 Len=0 TSV=3885396887 TSER=3885396497
    362 0.008514    127.0.0.1             127.0.0.1             TCP      29810 > commplex-main [ACK] Seq=131770 Ack=2 Win=65535 Len=1448 TSV=3885397252 TSER=3885396807
    363 0.008540    127.0.0.1             127.0.0.1             TCP      commplex-main > 29810 [ACK] Seq=2 Ack=121634 Win=64087 Len=0 TSV=3885396924 TSER=3885396545
    364 0.008553    127.0.0.1             127.0.0.1             TCP      29810 > commplex-main [ACK] Seq=133218 Ack=2 Win=65535 Len=1448 TSV=3885397292 TSER=3885396818
    365 0.008580    127.0.0.1             127.0.0.1             TCP      commplex-main > 29810 [ACK] Seq=2 Ack=123082 Win=64087 Len=0 TSV=3885396957 TSER=3885396552
    366 0.008594    127.0.0.1             127.0.0.1             TCP      29810 > commplex-main [ACK] Seq=134666 Ack=2 Win=65535 Len=1448 TSV=3885397333 TSER=3885396853
    367 0.008617    127.0.0.1             127.0.0.1             TCP      commplex-main > 29810 [ACK] Seq=2 Ack=124530 Win=62639 Len=0 TSV=3885396968 TSER=3885396595
    368 0.008644    127.0.0.1             127.0.0.1             TCP      29810 > commplex-main [ACK] Seq=136114 Ack=2 Win=65535 Len=1448 TSV=3885397382 TSER=3885396887
    369 0.008655    127.0.0.1             127.0.0.1             TCP      commplex-main > 29810 [ACK] Seq=2 Ack=125978 Win=64087 Len=0 TSV=3885397003 TSER=3885396644
    370 0.008674    127.0.0.1             127.0.0.1             TCP      29810 > commplex-main [ACK] Seq=125978 Ack=2 Win=65535 Len=1448 TSV=3885397075 TSER=3885396687
    371 0.008694    127.0.0.1             127.0.0.1             TCP      29810 > commplex-main [ACK] Seq=127426 Ack=2 Win=65535 Len=1448 TSV=3885397128 TSER=3885396703
    372 0.008707    127.0.0.1             127.0.0.1             TCP      29810 > commplex-main [ACK] Seq=137562 Ack=2 Win=65535 Len=1448 TSV=3885397446 TSER=3885396924
    373 0.008726    127.0.0.1             127.0.0.1             TCP      29810 > commplex-main [ACK] Seq=128874 Ack=2 Win=65535 Len=1448 TSV=3885397170 TSER=3885396712
    374 0.008751    127.0.0.1             127.0.0.1             TCP      29810 > commplex-main [ACK] Seq=130322 Ack=2 Win=65535 Len=1448 TSV=3885397211 TSER=3885396763
    375 0.008764    127.0.0.1             127.0.0.1             TCP      29810 > commplex-main [ACK] Seq=139010 Ack=2 Win=65535 Len=1448 TSV=3885397503 TSER=3885396957
    376 0.008779    127.0.0.1             127.0.0.1             TCP      29810 > commplex-main [ACK] Seq=131770 Ack=2 Win=65535 Len=1448 TSV=3885397252 TSER=3885396807
    377 0.008805    127.0.0.1             127.0.0.1             TCP      29810 > commplex-main [ACK] Seq=133218 Ack=2 Win=65535 Len=1448 TSV=3885397292 TSER=3885396818
    378 0.008821    127.0.0.1             127.0.0.1             TCP      29810 > commplex-main [ACK] Seq=140458 Ack=2 Win=65535 Len=1448 TSV=3885397560 TSER=3885396968
    379 0.008827    127.0.0.1             127.0.0.1             TCP      29810 > commplex-main [ACK] Seq=141906 Ack=2 Win=65535 Len=1448 TSV=3885397567 TSER=3885396968
    380 0.008838    127.0.0.1             127.0.0.1             TCP      29810 > commplex-main [ACK] Seq=134666 Ack=2 Win=65535 Len=1448 TSV=3885397333 TSER=3885396853
    381 0.008862    127.0.0.1             127.0.0.1             TCP      29810 > commplex-main [ACK] Seq=136114 Ack=2 Win=65535 Len=1448 TSV=3885397382 TSER=3885396887
    382 0.008875    127.0.0.1             127.0.0.1             TCP      29810 > commplex-main [ACK] Seq=143354 Ack=2 Win=65535 Len=1448 TSV=3885397614 TSER=3885397003
    383 0.008890    127.0.0.1             127.0.0.1             TCP      29810 > commplex-main [ACK] Seq=137562 Ack=2 Win=65535 Len=1448 TSV=3885397446 TSER=3885396924
    384 0.008914    127.0.0.1             127.0.0.1             TCP      29810 > commplex-main [ACK] Seq=139010 Ack=2 Win=65535 Len=1448 TSV=3885397503 TSER=3885396957
    385 0.008938    127.0.0.1             127.0.0.1             TCP      commplex-main > 29810 [ACK] Seq=2 Ack=127426 Win=65535 Len=0 TSV=3885397653 TSER=3885397075
    386 0.008944    127.0.0.1             127.0.0.1             TCP      commplex-main > 29810 [ACK] Seq=2 Ack=128874 Win=64087 Len=0 TSV=3885397669 TSER=3885397128
    387 0.008949    127.0.0.1             127.0.0.1             TCP      commplex-main > 29810 [ACK] Seq=2 Ack=130322 Win=62639 Len=0 TSV=3885397686 TSER=3885397170
    388 0.008955    127.0.0.1             127.0.0.1             TCP      commplex-main > 29810 [ACK] Seq=2 Ack=131770 Win=61191 Len=0 TSV=3885397694 TSER=3885397211
    389 0.008965    127.0.0.1             127.0.0.1             TCP      commplex-main > 29810 [ACK] Seq=2 Ack=133218 Win=59743 Len=0 TSV=3885397705 TSER=3885397252
    390 0.008970    127.0.0.1             127.0.0.1             TCP      commplex-main > 29810 [ACK] Seq=2 Ack=134666 Win=58295 Len=0 TSV=3885397715 TSER=3885397292
    391 0.008987    127.0.0.1             127.0.0.1             TCP      commplex-main > 29810 [ACK] Seq=2 Ack=136114 Win=56847 Len=0 TSV=3885397726 TSER=3885397333
    392 0.008993    127.0.0.1             127.0.0.1             TCP      commplex-main > 29810 [ACK] Seq=2 Ack=137562 Win=55399 Len=0 TSV=3885397735 TSER=3885397382
    393 0.008998    127.0.0.1             127.0.0.1             TCP      29810 > commplex-main [ACK] Seq=140458 Ack=2 Win=65535 Len=1448 TSV=3885397560 TSER=3885396968
    394 0.009011    127.0.0.1             127.0.0.1             TCP      commplex-main > 29810 [ACK] Seq=2 Ack=139010 Win=53951 Len=0 TSV=3885397750 TSER=3885397446
    395 0.009029    127.0.0.1             127.0.0.1             TCP      29810 > commplex-main [ACK] Seq=141906 Ack=2 Win=65535 Len=1448 TSV=3885397567 TSER=3885396968
    396 0.009051    127.0.0.1             127.0.0.1             TCP      29810 > commplex-main [ACK] Seq=143354 Ack=2 Win=65535 Len=1448 TSV=3885397614 TSER=3885397003
    397 0.009064    127.0.0.1             127.0.0.1             TCP      commplex-main > 29810 [ACK] Seq=2 Ack=140458 Win=64087 Len=0 TSV=3885397796 TSER=3885397503
    398 0.009069    127.0.0.1             127.0.0.1             TCP      commplex-main > 29810 [ACK] Seq=2 Ack=141906 Win=62639 Len=0 TSV=3885397805 TSER=3885397560
    399 0.009073    127.0.0.1             127.0.0.1             TCP      commplex-main > 29810 [ACK] Seq=2 Ack=143354 Win=61191 Len=0 TSV=3885397817 TSER=3885397567
    400 0.009087    127.0.0.1             127.0.0.1             TCP      commplex-main > 29810 [ACK] Seq=2 Ack=127426 Win=65535 Len=0 TSV=3885397653 TSER=3885397075
    401 0.009105    127.0.0.1             127.0.0.1             TCP      commplex-main > 29810 [ACK] Seq=2 Ack=128874 Win=64087 Len=0 TSV=3885397669 TSER=3885397128
    402 0.009122    127.0.0.1             127.0.0.1             TCP      commplex-main > 29810 [ACK] Seq=2 Ack=144802 Win=64087 Len=0 TSV=3885397857 TSER=3885397614
    403 0.009142    127.0.0.1             127.0.0.1             TCP      commplex-main > 29810 [ACK] Seq=2 Ack=130322 Win=62639 Len=0 TSV=3885397686 TSER=3885397170
    404 0.009160    127.0.0.1             127.0.0.1             TCP      commplex-main > 29810 [ACK] Seq=2 Ack=131770 Win=61191 Len=0 TSV=3885397694 TSER=3885397211
    405 0.009184    127.0.0.1             127.0.0.1             TCP      commplex-main > 29810 [ACK] Seq=2 Ack=133218 Win=59743 Len=0 TSV=3885397705 TSER=3885397252
    406 0.009197    127.0.0.1             127.0.0.1             TCP      29810 > commplex-main [ACK] Seq=144802 Ack=2 Win=65535 Len=1448 TSV=3885397936 TSER=3885397653
    407 0.009214    127.0.0.1             127.0.0.1             TCP      commplex-main > 29810 [ACK] Seq=2 Ack=134666 Win=58295 Len=0 TSV=3885397715 TSER=3885397292
    408 0.009233    127.0.0.1             127.0.0.1             TCP      commplex-main > 29810 [ACK] Seq=2 Ack=136114 Win=56847 Len=0 TSV=3885397726 TSER=3885397333
    409 0.009260    127.0.0.1             127.0.0.1             TCP      29810 > commplex-main [ACK] Seq=146250 Ack=2 Win=65535 Len=1448 TSV=3885397992 TSER=3885397669
    410 0.009265    127.0.0.1             127.0.0.1             TCP      commplex-main > 29810 [ACK] Seq=2 Ack=137562 Win=55399 Len=0 TSV=3885397735 TSER=3885397382
    411 0.009287    127.0.0.1             127.0.0.1             TCP      commplex-main > 29810 [ACK] Seq=2 Ack=139010 Win=53951 Len=0 TSV=3885397750 TSER=3885397446
    412 0.009304    127.0.0.1             127.0.0.1             TCP      29810 > commplex-main [ACK] Seq=147698 Ack=2 Win=65535 Len=1448 TSV=3885398041 TSER=3885397686
    413 0.009324    127.0.0.1             127.0.0.1             TCP      commplex-main > 29810 [ACK] Seq=2 Ack=140458 Win=64087 Len=0 TSV=3885397796 TSER=3885397503
    414 0.009347    127.0.0.1             127.0.0.1             TCP      commplex-main > 29810 [ACK] Seq=2 Ack=141906 Win=62639 Len=0 TSV=3885397805 TSER=3885397560
    415 0.009361    127.0.0.1             127.0.0.1             TCP      29810 > commplex-main [ACK] Seq=149146 Ack=2 Win=65535 Len=1448 TSV=3885398093 TSER=3885397694
    416 0.009375    127.0.0.1             127.0.0.1             TCP      commplex-main > 29810 [ACK] Seq=2 Ack=143354 Win=61191 Len=0 TSV=3885397817 TSER=3885397567
    417 0.009393    127.0.0.1             127.0.0.1             TCP      commplex-main > 29810 [ACK] Seq=2 Ack=144802 Win=64087 Len=0 TSV=3885397857 TSER=3885397614
    418 0.009407    127.0.0.1             127.0.0.1             TCP      29810 > commplex-main [ACK] Seq=150594 Ack=2 Win=65535 Len=1448 TSV=3885398146 TSER=3885397705
    419 0.009426    127.0.0.1             127.0.0.1             TCP      29810 > commplex-main [ACK] Seq=144802 Ack=2 Win=65535 Len=1448 TSV=3885397936 TSER=3885397653
    420 0.009451    127.0.0.1             127.0.0.1             TCP      29810 > commplex-main [ACK] Seq=146250 Ack=2 Win=65535 Len=1448 TSV=3885397992 TSER=3885397669
    421 0.009464    127.0.0.1             127.0.0.1             TCP      29810 > commplex-main [ACK] Seq=152042 Ack=2 Win=65535 Len=1448 TSV=3885398204 TSER=3885397715
    422 0.009479    127.0.0.1             127.0.0.1             TCP      29810 > commplex-main [ACK] Seq=147698 Ack=2 Win=65535 Len=1448 TSV=3885398041 TSER=3885397686
    423 0.009505    127.0.0.1             127.0.0.1             TCP      29810 > commplex-main [ACK] Seq=149146 Ack=2 Win=65535 Len=1448 TSV=3885398093 TSER=3885397694
    424 0.009518    127.0.0.1             127.0.0.1             TCP      29810 > commplex-main [ACK] Seq=153490 Ack=2 Win=65535 Len=1448 TSV=3885398257 TSER=3885397726
    425 0.009534    127.0.0.1             127.0.0.1             TCP      29810 > commplex-main [ACK] Seq=150594 Ack=2 Win=65535 Len=1448 TSV=3885398146 TSER=3885397705
    426 0.009557    127.0.0.1             127.0.0.1             TCP      29810 > commplex-main [ACK] Seq=152042 Ack=2 Win=65535 Len=1448 TSV=3885398204 TSER=3885397715
    427 0.009571    127.0.0.1             127.0.0.1             TCP      29810 > commplex-main [ACK] Seq=154938 Ack=2 Win=65535 Len=1448 TSV=3885398304 TSER=3885397735
    428 0.009585    127.0.0.1             127.0.0.1             TCP      29810 > commplex-main [ACK] Seq=153490 Ack=2 Win=65535 Len=1448 TSV=3885398257 TSER=3885397726
    429 0.009610    127.0.0.1             127.0.0.1             TCP      29810 > commplex-main [ACK] Seq=154938 Ack=2 Win=65535 Len=1448 TSV=3885398304 TSER=3885397735
    430 0.009626    127.0.0.1             127.0.0.1             TCP      29810 > commplex-main [ACK] Seq=156386 Ack=2 Win=65535 Len=1448 TSV=3885398362 TSER=3885397750
    431 0.009645    127.0.0.1             127.0.0.1             TCP      29810 > commplex-main [ACK] Seq=156386 Ack=2 Win=65535 Len=1448 TSV=3885398362 TSER=3885397750
    432 0.009680    127.0.0.1             127.0.0.1             TCP      29810 > commplex-main [ACK] Seq=157834 Ack=2 Win=65535 Len=1448 TSV=3885398415 TSER=3885397796
    433 0.009700    127.0.0.1             127.0.0.1             TCP      29810 > commplex-main [ACK] Seq=157834 Ack=2 Win=65535 Len=1448 TSV=3885398415 TSER=3885397796
    434 0.009740    127.0.0.1             127.0.0.1             TCP      29810 > commplex-main [ACK] Seq=159282 Ack=2 Win=65535 Len=1448 TSV=3885398476 TSER=3885397805
    435 0.009787    127.0.0.1             127.0.0.1             TCP      29810 > commplex-main [ACK] Seq=160730 Ack=2 Win=65535 Len=1448 TSV=3885398524 TSER=3885397817
    436 0.009793    127.0.0.1             127.0.0.1             TCP      29810 > commplex-main [ACK] Seq=162178 Ack=2 Win=65535 Len=1448 TSV=3885398532 TSER=3885397817
    437 0.009842    127.0.0.1             127.0.0.1             TCP      29810 > commplex-main [ACK] Seq=163626 Ack=2 Win=65535 Len=1448 TSV=3885398578 TSER=3885397857
    438 0.009874    127.0.0.1             127.0.0.1             TCP      commplex-main > 29810 [ACK] Seq=2 Ack=146250 Win=65535 Len=0 TSV=3885398614 TSER=3885397936
    439 0.009887    127.0.0.1             127.0.0.1             TCP      commplex-main > 29810 [ACK] Seq=2 Ack=147698 Win=64087 Len=0 TSV=3885398627 TSER=3885397992
    440 0.009893    127.0.0.1             127.0.0.1             TCP      commplex-main > 29810 [ACK] Seq=2 Ack=149146 Win=62639 Len=0 TSV=3885398637 TSER=3885398041
    441 0.009908    127.0.0.1             127.0.0.1             TCP      commplex-main > 29810 [ACK] Seq=2 Ack=150594 Win=61191 Len=0 TSV=3885398648 TSER=3885398093
    442 0.009913    127.0.0.1             127.0.0.1             TCP      commplex-main > 29810 [ACK] Seq=2 Ack=152042 Win=59743 Len=0 TSV=3885398657 TSER=3885398146
    443 0.009927    127.0.0.1             127.0.0.1             TCP      commplex-main > 29810 [ACK] Seq=2 Ack=153490 Win=58295 Len=0 TSV=3885398668 TSER=3885398204
    444 0.009933    127.0.0.1             127.0.0.1             TCP      commplex-main > 29810 [ACK] Seq=2 Ack=154938 Win=56847 Len=0 TSV=3885398677 TSER=3885398257
    445 0.009947    127.0.0.1             127.0.0.1             TCP      commplex-main > 29810 [ACK] Seq=2 Ack=156386 Win=55399 Len=0 TSV=3885398688 TSER=3885398304
    446 0.009953    127.0.0.1             127.0.0.1             TCP      commplex-main > 29810 [ACK] Seq=2 Ack=157834 Win=53951 Len=0 TSV=3885398697 TSER=3885398362
    447 0.010599    127.0.0.1             127.0.0.1             TCP      commplex-main > 29810 [ACK] Seq=2 Ack=159282 Win=52503 Len=0 TSV=3885398729 TSER=3885398415
    448 0.011869    127.0.0.1             127.0.0.1             TCP      29810 > commplex-main [ACK] Seq=159282 Ack=2 Win=65535 Len=1448 TSV=3885398476 TSER=3885397805
    449 0.011909    127.0.0.1             127.0.0.1             TCP      29810 > commplex-main [ACK] Seq=160730 Ack=2 Win=65535 Len=1448 TSV=3885398524 TSER=3885397817
    450 0.011933    127.0.0.1             127.0.0.1             TCP      29810 > commplex-main [ACK] Seq=162178 Ack=2 Win=65535 Len=1448 TSV=3885398532 TSER=3885397817
    451 0.011953    127.0.0.1             127.0.0.1             TCP      29810 > commplex-main [ACK] Seq=163626 Ack=2 Win=65535 Len=1448 TSV=3885398578 TSER=3885397857
    452 0.011967    127.0.0.1             127.0.0.1             TCP      commplex-main > 29810 [ACK] Seq=2 Ack=160730 Win=65535 Len=0 TSV=3885400699 TSER=3885398476
    453 0.011986    127.0.0.1             127.0.0.1             TCP      commplex-main > 29810 [ACK] Seq=2 Ack=162178 Win=64087 Len=0 TSV=3885400724 TSER=3885398524
    454 0.011992    127.0.0.1             127.0.0.1             TCP      commplex-main > 29810 [ACK] Seq=2 Ack=163626 Win=62639 Len=0 TSV=3885400734 TSER=3885398532
    455 0.012001    127.0.0.1             127.0.0.1             TCP      commplex-main > 29810 [ACK] Seq=2 Ack=146250 Win=65535 Len=0 TSV=3885398614 TSER=3885397936
    456 0.012023    127.0.0.1             127.0.0.1             TCP      commplex-main > 29810 [ACK] Seq=2 Ack=147698 Win=64087 Len=0 TSV=3885398627 TSER=3885397992
    457 0.012038    127.0.0.1             127.0.0.1             TCP      commplex-main > 29810 [ACK] Seq=2 Ack=165074 Win=64087 Len=0 TSV=3885400767 TSER=3885398578
    458 0.012053    127.0.0.1             127.0.0.1             TCP      commplex-main > 29810 [ACK] Seq=2 Ack=149146 Win=62639 Len=0 TSV=3885398637 TSER=3885398041
    459 0.012076    127.0.0.1             127.0.0.1             TCP      commplex-main > 29810 [ACK] Seq=2 Ack=150594 Win=61191 Len=0 TSV=3885398648 TSER=3885398093
    460 0.012101    127.0.0.1             127.0.0.1             TCP      commplex-main > 29810 [ACK] Seq=2 Ack=152042 Win=59743 Len=0 TSV=3885398657 TSER=3885398146
    461 0.012114    127.0.0.1             127.0.0.1             TCP      29810 > commplex-main [ACK] Seq=165074 Ack=2 Win=65535 Len=1448 TSV=3885400853 TSER=3885398614
    462 0.012129    127.0.0.1             127.0.0.1             TCP      commplex-main > 29810 [ACK] Seq=2 Ack=153490 Win=58295 Len=0 TSV=3885398668 TSER=3885398204
    463 0.012156    127.0.0.1             127.0.0.1             TCP      commplex-main > 29810 [ACK] Seq=2 Ack=154938 Win=56847 Len=0 TSV=3885398677 TSER=3885398257
    464 0.012174    127.0.0.1             127.0.0.1             TCP      commplex-main > 29810 [ACK] Seq=2 Ack=156386 Win=55399 Len=0 TSV=3885398688 TSER=3885398304
    465 0.012194    127.0.0.1             127.0.0.1             TCP      commplex-main > 29810 [ACK] Seq=2 Ack=157834 Win=53951 Len=0 TSV=3885398697 TSER=3885398362
    466 0.012209    127.0.0.1             127.0.0.1             TCP      29810 > commplex-main [ACK] Seq=166522 Ack=2 Win=65535 Len=1448 TSV=3885400942 TSER=3885398627
    467 0.012226    127.0.0.1             127.0.0.1             TCP      commplex-main > 29810 [ACK] Seq=2 Ack=159282 Win=52503 Len=0 TSV=3885398729 TSER=3885398415
    468 0.012250    127.0.0.1             127.0.0.1             TCP      commplex-main > 29810 [ACK] Seq=2 Ack=160730 Win=65535 Len=0 TSV=3885400699 TSER=3885398476
    469 0.012263    127.0.0.1             127.0.0.1             TCP      29810 > commplex-main [ACK] Seq=167970 Ack=2 Win=65535 Len=1448 TSV=3885400992 TSER=3885398637
    470 0.012277    127.0.0.1             127.0.0.1             TCP      commplex-main > 29810 [ACK] Seq=2 Ack=162178 Win=64087 Len=0 TSV=3885400724 TSER=3885398524
    471 0.012296    127.0.0.1             127.0.0.1             TCP      commplex-main > 29810 [ACK] Seq=2 Ack=163626 Win=62639 Len=0 TSV=3885400734 TSER=3885398532
    472 0.012315    127.0.0.1             127.0.0.1             TCP      29810 > commplex-main [ACK] Seq=169418 Ack=2 Win=65535 Len=1448 TSV=3885401045 TSER=3885398648
    473 0.012333    127.0.0.1             127.0.0.1             TCP      commplex-main > 29810 [ACK] Seq=2 Ack=165074 Win=64087 Len=0 TSV=3885400767 TSER=3885398578
    474 0.012358    127.0.0.1             127.0.0.1             TCP      29810 > commplex-main [ACK] Seq=170866 Ack=2 Win=65535 Len=1448 TSV=3885401090 TSER=3885398657
    475 0.012370    127.0.0.1             127.0.0.1             TCP      29810 > commplex-main [ACK] Seq=165074 Ack=2 Win=65535 Len=1448 TSV=3885400853 TSER=3885398614
    476 0.012395    127.0.0.1             127.0.0.1             TCP      29810 > commplex-main [ACK] Seq=166522 Ack=2 Win=65535 Len=1448 TSV=3885400942 TSER=3885398627
    477 0.012409    127.0.0.1             127.0.0.1             TCP      29810 > commplex-main [ACK] Seq=172314 Ack=2 Win=65535 Len=1448 TSV=3885401141 TSER=3885398668
    478 0.012424    127.0.0.1             127.0.0.1             TCP      29810 > commplex-main [ACK] Seq=167970 Ack=2 Win=65535 Len=1448 TSV=3885400992 TSER=3885398637
    479 0.012444    127.0.0.1             127.0.0.1             TCP      29810 > commplex-main [ACK] Seq=169418 Ack=2 Win=65535 Len=1448 TSV=3885401045 TSER=3885398648
    480 0.012460    127.0.0.1             127.0.0.1             TCP      29810 > commplex-main [ACK] Seq=173762 Ack=2 Win=65535 Len=1448 TSV=3885401196 TSER=3885398677
    481 0.012479    127.0.0.1             127.0.0.1             TCP      29810 > commplex-main [ACK] Seq=170866 Ack=2 Win=65535 Len=1448 TSV=3885401090 TSER=3885398657
    482 0.012503    127.0.0.1             127.0.0.1             TCP      29810 > commplex-main [ACK] Seq=172314 Ack=2 Win=65535 Len=1448 TSV=3885401141 TSER=3885398668
    483 0.012517    127.0.0.1             127.0.0.1             TCP      29810 > commplex-main [ACK] Seq=175210 Ack=2 Win=65535 Len=1448 TSV=3885401249 TSER=3885398688
    484 0.012532    127.0.0.1             127.0.0.1             TCP      29810 > commplex-main [ACK] Seq=173762 Ack=2 Win=65535 Len=1448 TSV=3885401196 TSER=3885398677
    485 0.012552    127.0.0.1             127.0.0.1             TCP      29810 > commplex-main [ACK] Seq=175210 Ack=2 Win=65535 Len=1448 TSV=3885401249 TSER=3885398688
    486 0.012567    127.0.0.1             127.0.0.1             TCP      29810 > commplex-main [ACK] Seq=176658 Ack=2 Win=65535 Len=1448 TSV=3885401301 TSER=3885398697
    487 0.012585    127.0.0.1             127.0.0.1             TCP      29810 > commplex-main [ACK] Seq=176658 Ack=2 Win=65535 Len=1448 TSV=3885401301 TSER=3885398697
    488 0.012612    127.0.0.1             127.0.0.1             TCP      29810 > commplex-main [ACK] Seq=178106 Ack=2 Win=65535 Len=1448 TSV=3885401350 TSER=3885398729
    489 0.012632    127.0.0.1             127.0.0.1             TCP      29810 > commplex-main [ACK] Seq=178106 Ack=2 Win=65535 Len=1448 TSV=3885401350 TSER=3885398729
    490 0.012672    127.0.0.1             127.0.0.1             TCP      29810 > commplex-main [ACK] Seq=179554 Ack=2 Win=65535 Len=1448 TSV=3885401409 TSER=3885400699
    491 0.012690    127.0.0.1             127.0.0.1             TCP      29810 > commplex-main [ACK] Seq=179554 Ack=2 Win=65535 Len=1448 TSV=3885401409 TSER=3885400699
    492 0.012814    127.0.0.1             127.0.0.1             TCP      29810 > commplex-main [ACK] Seq=181002 Ack=2 Win=65535 Len=1448 TSV=3885401549 TSER=3885400724
    493 0.012834    127.0.0.1             127.0.0.1             TCP      29810 > commplex-main [ACK] Seq=181002 Ack=2 Win=65535 Len=1448 TSV=3885401549 TSER=3885400724
    494 0.012861    127.0.0.1             127.0.0.1             TCP      29810 > commplex-main [ACK] Seq=182450 Ack=2 Win=65535 Len=1448 TSV=3885401598 TSER=3885400734
    495 0.012879    127.0.0.1             127.0.0.1             TCP      29810 > commplex-main [ACK] Seq=182450 Ack=2 Win=65535 Len=1448 TSV=3885401598 TSER=3885400734
    496 0.012912    127.0.0.1             127.0.0.1             TCP      29810 > commplex-main [ACK] Seq=183898 Ack=2 Win=65535 Len=1448 TSV=3885401649 TSER=3885400767
    497 0.012920    127.0.0.1             127.0.0.1             TCP      29810 > commplex-main [ACK] Seq=185346 Ack=2 Win=65535 Len=1448 TSV=3885401656 TSER=3885400767
    498 0.012950    127.0.0.1             127.0.0.1             TCP      29810 > commplex-main [ACK] Seq=183898 Ack=2 Win=65535 Len=1448 TSV=3885401649 TSER=3885400767
    499 0.012964    127.0.0.1             127.0.0.1             TCP      commplex-main > 29810 [ACK] Seq=2 Ack=166522 Win=65535 Len=0 TSV=3885401687 TSER=3885400853
    500 0.012970    127.0.0.1             127.0.0.1             TCP      commplex-main > 29810 [ACK] Seq=2 Ack=167970 Win=64087 Len=0 TSV=3885401707 TSER=3885400942
    501 0.012980    127.0.0.1             127.0.0.1             TCP      commplex-main > 29810 [ACK] Seq=2 Ack=169418 Win=62639 Len=0 TSV=3885401719 TSER=3885400992
    502 0.012986    127.0.0.1             127.0.0.1             TCP      commplex-main > 29810 [ACK] Seq=2 Ack=170866 Win=61191 Len=0 TSV=3885401730 TSER=3885401045
    503 0.013004    127.0.0.1             127.0.0.1             TCP      commplex-main > 29810 [ACK] Seq=2 Ack=172314 Win=59743 Len=0 TSV=3885401741 TSER=3885401090
    504 0.013011    127.0.0.1             127.0.0.1             TCP      commplex-main > 29810 [ACK] Seq=2 Ack=173762 Win=58295 Len=0 TSV=3885401751 TSER=3885401141
    505 0.013017    127.0.0.1             127.0.0.1             TCP      29810 > commplex-main [ACK] Seq=185346 Ack=2 Win=65535 Len=1448 TSV=3885401656 TSER=3885400767
    506 0.013036    127.0.0.1             127.0.0.1             TCP      commplex-main > 29810 [ACK] Seq=2 Ack=175210 Win=56847 Len=0 TSV=3885401767 TSER=3885401196
    507 0.013042    127.0.0.1             127.0.0.1             TCP      commplex-main > 29810 [ACK] Seq=2 Ack=176658 Win=55399 Len=0 TSV=3885401784 TSER=3885401249
    508 0.013048    127.0.0.1             127.0.0.1             TCP      commplex-main > 29810 [ACK] Seq=2 Ack=178106 Win=53951 Len=0 TSV=3885401792 TSER=3885401301
    509 0.013065    127.0.0.1             127.0.0.1             TCP      commplex-main > 29810 [ACK] Seq=2 Ack=179554 Win=52503 Len=0 TSV=3885401804 TSER=3885401350
    510 0.013071    127.0.0.1             127.0.0.1             TCP      commplex-main > 29810 [ACK] Seq=2 Ack=166522 Win=65535 Len=0 TSV=3885401687 TSER=3885400853
    511 0.013088    127.0.0.1             127.0.0.1             TCP      commplex-main > 29810 [ACK] Seq=2 Ack=181002 Win=51055 Len=0 TSV=3885401828 TSER=3885401409
    512 0.013094    127.0.0.1             127.0.0.1             TCP      commplex-main > 29810 [ACK] Seq=2 Ack=182450 Win=49607 Len=0 TSV=3885401838 TSER=3885401549
    513 0.013107    127.0.0.1             127.0.0.1             TCP      commplex-main > 29810 [ACK] Seq=2 Ack=167970 Win=64087 Len=0 TSV=3885401707 TSER=3885400942
    514 0.013120    127.0.0.1             127.0.0.1             TCP      commplex-main > 29810 [ACK] Seq=2 Ack=183898 Win=48159 Len=0 TSV=3885401853 TSER=3885401598
    515 0.013138    127.0.0.1             127.0.0.1             TCP      commplex-main > 29810 [ACK] Seq=2 Ack=169418 Win=62639 Len=0 TSV=3885401719 TSER=3885400992
    516 0.013171    127.0.0.1             127.0.0.1             TCP      commplex-main > 29810 [ACK] Seq=2 Ack=170866 Win=61191 Len=0 TSV=3885401730 TSER=3885401045
    517 0.013195    127.0.0.1             127.0.0.1             TCP      commplex-main > 29810 [ACK] Seq=2 Ack=185346 Win=64087 Len=0 TSV=3885401916 TSER=3885401649
    518 0.013201    127.0.0.1             127.0.0.1             TCP      commplex-main > 29810 [ACK] Seq=2 Ack=186794 Win=62639 Len=0 TSV=3885401925 TSER=3885401656
    519 0.013215    127.0.0.1             127.0.0.1             TCP      commplex-main > 29810 [ACK] Seq=2 Ack=172314 Win=59743 Len=0 TSV=3885401741 TSER=3885401090
    520 0.013242    127.0.0.1             127.0.0.1             TCP      29810 > commplex-main [ACK] Seq=186794 Ack=2 Win=65535 Len=1448 TSV=3885401961 TSER=3885401687
    521 0.013271    127.0.0.1             127.0.0.1             TCP      29810 > commplex-main [ACK] Seq=188242 Ack=2 Win=65535 Len=1448 TSV=3885401998 TSER=3885401707
    522 0.013277    127.0.0.1             127.0.0.1             TCP      commplex-main > 29810 [ACK] Seq=2 Ack=173762 Win=58295 Len=0 TSV=3885401751 TSER=3885401141
    523 0.013294    127.0.0.1             127.0.0.1             TCP      29810 > commplex-main [ACK] Seq=189690 Ack=2 Win=65535 Len=1448 TSV=3885402033 TSER=3885401719
    524 0.013322    127.0.0.1             127.0.0.1             TCP      commplex-main > 29810 [ACK] Seq=2 Ack=175210 Win=56847 Len=0 TSV=3885401767 TSER=3885401196
    525 0.013344    127.0.0.1             127.0.0.1             TCP      commplex-main > 29810 [ACK] Seq=2 Ack=176658 Win=55399 Len=0 TSV=3885401784 TSER=3885401249
    526 0.013384    127.0.0.1             127.0.0.1             TCP      29810 > commplex-main [ACK] Seq=191138 Ack=2 Win=65535 Len=1448 TSV=3885402090 TSER=3885401730
    527 0.013403    127.0.0.1             127.0.0.1             TCP      29810 > commplex-main [ACK] Seq=192586 Ack=2 Win=65535 Len=1448 TSV=3885402131 TSER=3885401741
    528 0.013409    127.0.0.1             127.0.0.1             TCP      commplex-main > 29810 [ACK] Seq=2 Ack=178106 Win=53951 Len=0 TSV=3885401792 TSER=3885401301
    529 0.013425    127.0.0.1             127.0.0.1             TCP      29810 > commplex-main [ACK] Seq=194034 Ack=2 Win=65535 Len=1448 TSV=3885402165 TSER=3885401751
    530 0.013451    127.0.0.1             127.0.0.1             TCP      29810 > commplex-main [ACK] Seq=195482 Ack=2 Win=65535 Len=1448 TSV=3885402188 TSER=3885401767
    531 0.013490    127.0.0.1             127.0.0.1             TCP      29810 > commplex-main [ACK] Seq=196930 Ack=2 Win=65535 Len=1448 TSV=3885402215 TSER=3885401784
    532 0.013501    127.0.0.1             127.0.0.1             TCP      29810 > commplex-main [ACK] Seq=198378 Ack=2 Win=65535 Len=1448 TSV=3885402237 TSER=3885401792
    533 0.013511    127.0.0.1             127.0.0.1             TCP      commplex-main > 29810 [ACK] Seq=2 Ack=179554 Win=52503 Len=0 TSV=3885401804 TSER=3885401350
    534 0.013551    127.0.0.1             127.0.0.1             TCP      commplex-main > 29810 [ACK] Seq=2 Ack=181002 Win=51055 Len=0 TSV=3885401828 TSER=3885401409
    535 0.013562    127.0.0.1             127.0.0.1             TCP      29810 > commplex-main [ACK] Seq=199826 Ack=2 Win=65535 Len=176 TSV=3885402302 TSER=3885401804
    536 0.013596    127.0.0.1             127.0.0.1             TCP      commplex-main > 29810 [ACK] Seq=2 Ack=182450 Win=49607 Len=0 TSV=3885401838 TSER=3885401549
    537 0.013633    127.0.0.1             127.0.0.1             TCP      commplex-main > 29810 [ACK] Seq=2 Ack=183898 Win=48159 Len=0 TSV=3885401853 TSER=3885401598
    538 0.013666    127.0.0.1             127.0.0.1             TCP      commplex-main > 29810 [ACK] Seq=2 Ack=185346 Win=64087 Len=0 TSV=3885401916 TSER=3885401649
    539 0.013703    127.0.0.1             127.0.0.1             TCP      commplex-main > 29810 [ACK] Seq=2 Ack=186794 Win=62639 Len=0 TSV=3885401925 TSER=3885401656
    540 0.013736    127.0.0.1             127.0.0.1             TCP      29810 > commplex-main [ACK] Seq=186794 Ack=2 Win=65535 Len=1448 TSV=3885401961 TSER=3885401687
    541 0.013759    127.0.0.1             127.0.0.1             TCP      29810 > commplex-main [ACK] Seq=188242 Ack=2 Win=65535 Len=1448 TSV=3885401998 TSER=3885401707
    542 0.013780    127.0.0.1             127.0.0.1             TCP      commplex-main > 29810 [ACK] Seq=2 Ack=188242 Win=65535 Len=0 TSV=3885402512 TSER=3885401961
    543 0.013799    127.0.0.1             127.0.0.1             TCP      29810 > commplex-main [ACK] Seq=189690 Ack=2 Win=65535 Len=1448 TSV=3885402033 TSER=3885401719
    544 0.013820    127.0.0.1             127.0.0.1             TCP      commplex-main > 29810 [ACK] Seq=2 Ack=189690 Win=64087 Len=0 TSV=3885402548 TSER=3885401998
    545 0.013848    127.0.0.1             127.0.0.1             TCP      commplex-main > 29810 [ACK] Seq=2 Ack=191138 Win=64087 Len=0 TSV=3885402585 TSER=3885402033
    546 0.013853    127.0.0.1             127.0.0.1             TCP      29810 > commplex-main [ACK] Seq=191138 Ack=2 Win=65535 Len=1448 TSV=3885402090 TSER=3885401730
    547 0.013886    127.0.0.1             127.0.0.1             TCP      commplex-main > 29810 [ACK] Seq=2 Ack=192586 Win=64087 Len=0 TSV=3885402623 TSER=3885402090
    548 0.013890    127.0.0.1             127.0.0.1             TCP      29810 > commplex-main [ACK] Seq=192586 Ack=2 Win=65535 Len=1448 TSV=3885402131 TSER=3885401741
    549 0.013923    127.0.0.1             127.0.0.1             TCP      commplex-main > 29810 [ACK] Seq=2 Ack=194034 Win=64087 Len=0 TSV=3885402660 TSER=3885402131
    550 0.013927    127.0.0.1             127.0.0.1             TCP      29810 > commplex-main [ACK] Seq=194034 Ack=2 Win=65535 Len=1448 TSV=3885402165 TSER=3885401751
    551 0.013960    127.0.0.1             127.0.0.1             TCP      commplex-main > 29810 [ACK] Seq=2 Ack=195482 Win=64087 Len=0 TSV=3885402697 TSER=3885402165
    552 0.013964    127.0.0.1             127.0.0.1             TCP      29810 > commplex-main [ACK] Seq=195482 Ack=2 Win=65535 Len=1448 TSV=3885402188 TSER=3885401767
    553 0.013999    127.0.0.1             127.0.0.1             TCP      commplex-main > 29810 [ACK] Seq=2 Ack=196930 Win=65535 Len=0 TSV=3885402739 TSER=3885402188
    554 0.014003    127.0.0.1             127.0.0.1             TCP      29810 > commplex-main [ACK] Seq=196930 Ack=2 Win=65535 Len=1448 TSV=3885402215 TSER=3885401784
    555 0.014037    127.0.0.1             127.0.0.1             TCP      commplex-main > 29810 [ACK] Seq=2 Ack=198378 Win=64087 Len=0 TSV=3885402773 TSER=3885402215
    556 0.014041    127.0.0.1             127.0.0.1             TCP      29810 > commplex-main [ACK] Seq=198378 Ack=2 Win=65535 Len=1448 TSV=3885402237 TSER=3885401792
    557 0.014082    127.0.0.1             127.0.0.1             TCP      commplex-main > 29810 [ACK] Seq=2 Ack=199826 Win=65535 Len=0 TSV=3885402822 TSER=3885402237
    558 0.014086    127.0.0.1             127.0.0.1             TCP      29810 > commplex-main [ACK] Seq=199826 Ack=2 Win=65535 Len=176 TSV=3885402302 TSER=3885401804
    559 0.014118    127.0.0.1             127.0.0.1             TCP      commplex-main > 29810 [ACK] Seq=2 Ack=200002 Win=65359 Len=0 TSV=3885402855 TSER=3885402302
    560 0.014123    127.0.0.1             127.0.0.1             TCP      commplex-main > 29810 [ACK] Seq=2 Ack=188242 Win=65535 Len=0 TSV=3885402512 TSER=3885401961
    561 0.014162    127.0.0.1             127.0.0.1             TCP      commplex-main > 29810 [ACK] Seq=2 Ack=189690 Win=64087 Len=0 TSV=3885402548 TSER=3885401998
    562 0.014195    127.0.0.1             127.0.0.1             TCP      commplex-main > 29810 [ACK] Seq=2 Ack=191138 Win=64087 Len=0 TSV=3885402585 TSER=3885402033
    563 0.014235    127.0.0.1             127.0.0.1             TCP      commplex-main > 29810 [ACK] Seq=2 Ack=192586 Win=64087 Len=0 TSV=3885402623 TSER=3885402090
    564 0.014268    127.0.0.1             127.0.0.1             TCP      commplex-main > 29810 [ACK] Seq=2 Ack=194034 Win=64087 Len=0 TSV=3885402660 TSER=3885402131
    565 0.014304    127.0.0.1             127.0.0.1             TCP      commplex-main > 29810 [ACK] Seq=2 Ack=195482 Win=64087 Len=0 TSV=3885402697 TSER=3885402165
    566 0.014337    127.0.0.1             127.0.0.1             TCP      commplex-main > 29810 [ACK] Seq=2 Ack=196930 Win=65535 Len=0 TSV=3885402739 TSER=3885402188
    567 0.014373    127.0.0.1             127.0.0.1             TCP      commplex-main > 29810 [ACK] Seq=2 Ack=198378 Win=64087 Len=0 TSV=3885402773 TSER=3885402215
    568 0.014414    127.0.0.1             127.0.0.1             TCP      commplex-main > 29810 [ACK] Seq=2 Ack=199826 Win=65535 Len=0 TSV=3885402822 TSER=3885402237
    569 0.014450    127.0.0.1             127.0.0.1             TCP      commplex-main > 29810 [ACK] Seq=2 Ack=200002 Win=65359 Len=0 TSV=3885402855 TSER=3885402302
    570 0.014505    127.0.0.1             127.0.0.1             TCP      29810 > commplex-main [FIN, ACK] Seq=200002 Ack=2 Win=65535 Len=0 TSV=3885403240 TSER=3885402855
    571 0.014523    127.0.0.1             127.0.0.1             TCP      29810 > commplex-main [FIN, ACK] Seq=200002 Ack=2 Win=65535 Len=0 TSV=3885403240 TSER=3885402855
    572 0.014553    127.0.0.1             127.0.0.1             TCP      commplex-main > 29810 [ACK] Seq=2 Ack=200003 Win=65535 Len=0 TSV=3885403293 TSER=3885403240
    573 0.014576    127.0.0.1             127.0.0.1             TCP      commplex-main > 29810 [ACK] Seq=2 Ack=200003 Win=65535 Len=0 TSV=3885403293 TSER=3885403240
    574 0.014621    127.0.0.1             127.0.0.1             TCP      commplex-main > 29810 [FIN, ACK] Seq=2 Ack=200003 Win=65535 Len=0 TSV=3885403333 TSER=3885403240
    575 0.014701    127.0.0.1             127.0.0.1             TCP      commplex-main > 29810 [FIN, ACK] Seq=2 Ack=200003 Win=65535 Len=0 TSV=3885403333 TSER=3885403240
    576 0.014747    127.0.0.1             127.0.0.1             TCP      29810 > commplex-main [ACK] Seq=200003 Ack=3 Win=65535 Len=0 TSV=3885403481 TSER=3885403333
    577 0.014765    127.0.0.1             127.0.0.1             TCP      29810 > commplex-main [ACK] Seq=200003 Ack=3 Win=65535 Len=0 TSV=3885403481 TSER=3885403333
