No.     Time        Source                Destination           Protocol Info
      1 0.000000    127.0.0.1             127.0.0.1             TCP      40731 > commplex-main [SYN] Seq=1 Win=65535 Len=0 TSV=3746905017 TSER=0
      2 0.000054    127.0.0.1             127.0.0.1             TCP      40731 > commplex-main [SYN] Seq=1 Win=65535 Len=0 TSV=3746905017 TSER=0
      3 0.000136    127.0.0.1             127.0.0.1             TCP      commplex-main > 40731 [SYN, ACK] Seq=1 Ack=2 Win=65535 Len=0 TSV=3746905174 TSER=3746905017
      4 0.000151    127.0.0.1             127.0.0.1             TCP      commplex-main > 40731 [SYN, ACK] Seq=1 Ack=2 Win=65535 Len=0 TSV=3746905174 TSER=3746905017
      5 0.000203    127.0.0.1             127.0.0.1             TCP      40731 > commplex-main [ACK] Seq=2 Ack=2 Win=65535 Len=0 TSV=3746905236 TSER=3746905174
      6 0.000216    127.0.0.1             127.0.0.1             TCP      40731 > commplex-main [ACK] Seq=2 Ack=2 Win=65535 Len=0 TSV=3746905236 TSER=3746905174
      7 0.000392    127.0.0.1             127.0.0.1             TCP      40731 > commplex-main [ACK] Seq=2 Ack=2 Win=65535 Len=1448 TSV=3746905433 TSER=3746905174
      8 0.000406    127.0.0.1             127.0.0.1             TCP      40731 > commplex-main [ACK] Seq=2 Ack=2 Win=65535 Len=1448 TSV=3746905433 TSER=3746905174
      9 0.000504    127.0.0.1             127.0.0.1             TCP      commplex-main > 40731 [ACK] Seq=2 Ack=1450 Win=65535 Len=0 TSV=3746905490 TSER=3746905433
     10 0.000517    127.0.0.1             127.0.0.1             TCP      commplex-main > 40731 [ACK] Seq=2 Ack=1450 Win=65535 Len=0 TSV=3746905490 TSER=3746905433
     11 0.000604    127.0.0.1             127.0.0.1             TCP      40731 > commplex-main [ACK] Seq=1450 Ack=2 Win=65535 Len=1448 TSV=3746905633 TSER=3746905490
     12 0.000609    127.0.0.1             127.0.0.1             TCP      40731 > commplex-main [ACK] Seq=2898 Ack=2 Win=65535 Len=1448 TSV=3746905636 TSER=3746905490
     13 0.000621    127.0.0.1             127.0.0.1             TCP      40731 > commplex-main [ACK] Seq=1450 Ack=2 Win=65535 Len=1448 TSV=3746905633 TSER=3746905490
     14 0.000650    127.0.0.1             127.0.0.1             TCP      40731 > commplex-main [ACK] Seq=2898 Ack=2 Win=65535 Len=1448 TSV=3746905636 TSER=3746905490
     15 0.000674    127.0.0.1             127.0.0.1             TCP      commplex-main > 40731 [ACK] Seq=2 Ack=2898 Win=65535 Len=0 TSV=3746905710 TSER=3746905633
     16 0.000685    127.0.0.1             127.0.0.1             TCP      commplex-main > 40731 [ACK] Seq=2 Ack=2898 Win=65535 Len=0 TSV=3746905710 TSER=3746905633
     17 0.000710    127.0.0.1             127.0.0.1             TCP      commplex-main > 40731 [ACK] Seq=2 Ack=4346 Win=64087 Len=0 TSV=3746905755 TSER=3746905636
     18 0.000792    127.0.0.1             127.0.0.1             TCP      40731 > commplex-main [ACK] Seq=4346 Ack=2 Win=65535 Len=1448 TSV=3746905807 TSER=3746905710
     19 0.000798    127.0.0.1             127.0.0.1             TCP      40731 > commplex-main [ACK] Seq=5794 Ack=2 Win=65535 Len=1448 TSV=3746905810 TSER=3746905710
     20 0.000843    127.0.0.1             127.0.0.1             TCP      commplex-main > 40731 [ACK] Seq=2 Ack=4346 Win=64087 Len=0 TSV=3746905755 TSER=3746905636
     21 0.000855    127.0.0.1             127.0.0.1             TCP      40731 > commplex-main [ACK] Seq=4346 Ack=2 Win=65535 Len=1448 TSV=3746905807 TSER=3746905710
     22 0.000862    127.0.0.1             127.0.0.1             TCP      40731 > commplex-main [ACK] Seq=5794 Ack=2 Win=65535 Len=1448 TSV=3746905810 TSER=3746905710
     23 0.000951    127.0.0.1             127.0.0.1             TCP      40731 > commplex-main [ACK] Seq=7242 Ack=2 Win=65535 Len=1448 TSV=3746905967 TSER=3746905755
     24 0.000957    127.0.0.1             127.0.0.1             TCP      40731 > commplex-main [ACK] Seq=8690 Ack=2 Win=65535 Len=1448 TSV=3746905970 TSER=3746905755
     25 0.000962    127.0.0.1             127.0.0.1             TCP      commplex-main > 40731 [ACK] Seq=2 Ack=5794 Win=65535 Len=0 TSV=3746905981 TSER=3746905807
     26 0.000966    127.0.0.1             127.0.0.1             TCP      commplex-main > 40731 [ACK] Seq=2 Ack=7242 Win=64087 Len=0 TSV=3746905986 TSER=3746905810
     27 0.001021    127.0.0.1             127.0.0.1             TCP      40731 > commplex-main [ACK] Seq=7242 Ack=2 Win=65535 Len=1448 TSV=3746905967 TSER=3746905755
     28 0.001051    127.0.0.1             127.0.0.1             TCP      commplex-main > 40731 [ACK] Seq=2 Ack=8690 Win=64087 Len=0 TSV=3746906096 TSER=3746905967
     29 0.001078    127.0.0.1             127.0.0.1             TCP      40731 > commplex-main [ACK] Seq=8690 Ack=2 Win=65535 Len=1448 TSV=3746905970 TSER=3746905755
     30 0.001103    127.0.0.1             127.0.0.1             TCP      commplex-main > 40731 [ACK] Seq=2 Ack=5794 Win=65535 Len=0 TSV=3746905981 TSER=3746905807
     31 0.001127    127.0.0.1             127.0.0.1             TCP      commplex-main > 40731 [ACK] Seq=2 Ack=10138 Win=65535 Len=0 TSV=3746906163 TSER=3746905970
     32 0.001139    127.0.0.1             127.0.0.1             TCP      commplex-main > 40731 [ACK] Seq=2 Ack=7242 Win=64087 Len=0 TSV=3746905986 TSER=3746905810
     33 0.001162    127.0.0.1             127.0.0.1             TCP      commplex-main > 40731 [ACK] Seq=2 Ack=8690 Win=64087 Len=0 TSV=3746906096 TSER=3746905967
     34 0.001186    127.0.0.1             127.0.0.1             TCP      commplex-main > 40731 [ACK] Seq=2 Ack=10138 Win=65535 Len=0 TSV=3746906163 TSER=3746905970
     35 0.001231    127.0.0.1             127.0.0.1             TCP      40731 > commplex-main [ACK] Seq=10138 Ack=2 Win=65535 Len=1448 TSV=3746906232 TSER=3746905981
     36 0.001236    127.0.0.1             127.0.0.1             TCP      40731 > commplex-main [ACK] Seq=11586 Ack=2 Win=65535 Len=1448 TSV=3746906234 TSER=3746905981
     37 0.001242    127.0.0.1             127.0.0.1             TCP      40731 > commplex-main [ACK] Seq=13034 Ack=2 Win=65535 Len=1448 TSV=3746906269 TSER=3746905986
     38 0.001249    127.0.0.1             127.0.0.1             TCP      40731 > commplex-main [ACK] Seq=14482 Ack=2 Win=65535 Len=1448 TSV=3746906271 TSER=3746905986
     39 0.001272    127.0.0.1             127.0.0.1             TCP      40731 > commplex-main [ACK] Seq=10138 Ack=2 Win=65535 Len=1448 TSV=3746906232 TSER=3746905981
     40 0.001355    127.0.0.1             127.0.0.1             TCP      40731 > commplex-main [ACK] Seq=15930 Ack=2 Win=65535 Len=1448 TSV=3746906347 TSER=3746906096
     41 0.001361    127.0.0.1             127.0.0.1             TCP      40731 > commplex-main [ACK] Seq=17378 Ack=2 Win=65535 Len=1448 TSV=3746906351 TSER=3746906096
     42 0.001367    127.0.0.1             127.0.0.1             TCP      40731 > commplex-main [ACK] Seq=18826 Ack=2 Win=65535 Len=1448 TSV=3746906388 TSER=3746906163
     43 0.001381    127.0.0.1             127.0.0.1             TCP      40731 > commplex-main [ACK] Seq=20274 Ack=2 Win=65535 Len=1448 TSV=3746906390 TSER=3746906163
     44 0.001391    127.0.0.1             127.0.0.1             TCP      commplex-main > 40731 [ACK] Seq=2 Ack=11586 Win=65535 Len=0 TSV=3746906398 TSER=3746906232
     45 0.001401    127.0.0.1             127.0.0.1             TCP      40731 > commplex-main [ACK] Seq=11586 Ack=2 Win=65535 Len=1448 TSV=3746906234 TSER=3746905981
     46 0.001458    127.0.0.1             127.0.0.1             TCP      commplex-main > 40731 [ACK] Seq=2 Ack=13034 Win=64087 Len=0 TSV=3746906504 TSER=3746906234
     47 0.001483    127.0.0.1             127.0.0.1             TCP      40731 > commplex-main [ACK] Seq=13034 Ack=2 Win=65535 Len=1448 TSV=3746906269 TSER=3746905986
     48 0.001512    127.0.0.1             127.0.0.1             TCP      commplex-main > 40731 [ACK] Seq=2 Ack=14482 Win=65535 Len=0 TSV=3746906558 TSER=3746906269
     49 0.001534    127.0.0.1             127.0.0.1             TCP      40731 > commplex-main [ACK] Seq=14482 Ack=2 Win=65535 Len=1448 TSV=3746906271 TSER=3746905986
     50 0.001562    127.0.0.1             127.0.0.1             TCP      commplex-main > 40731 [ACK] Seq=2 Ack=15930 Win=65535 Len=0 TSV=3746906609 TSER=3746906271
     51 0.001585    127.0.0.1             127.0.0.1             TCP      40731 > commplex-main [ACK] Seq=15930 Ack=2 Win=65535 Len=1448 TSV=3746906347 TSER=3746906096
     52 0.001618    127.0.0.1             127.0.0.1             TCP      commplex-main > 40731 [ACK] Seq=2 Ack=17378 Win=65535 Len=0 TSV=3746906659 TSER=3746906347
     53 0.001652    127.0.0.1             127.0.0.1             TCP      40731 > commplex-main [ACK] Seq=17378 Ack=2 Win=65535 Len=1448 TSV=3746906351 TSER=3746906096
     54 0.001682    127.0.0.1             127.0.0.1             TCP      commplex-main > 40731 [ACK] Seq=2 Ack=18826 Win=65535 Len=0 TSV=3746906728 TSER=3746906351
     55 0.001705    127.0.0.1             127.0.0.1             TCP      40731 > commplex-main [ACK] Seq=18826 Ack=2 Win=65535 Len=1448 TSV=3746906388 TSER=3746906163
     56 0.001733    127.0.0.1             127.0.0.1             TCP      commplex-main > 40731 [ACK] Seq=2 Ack=20274 Win=65535 Len=0 TSV=3746906780 TSER=3746906388
     57 0.001771    127.0.0.1             127.0.0.1             TCP      commplex-main > 40731 [ACK] Seq=2 Ack=11586 Win=65535 Len=0 TSV=3746906398 TSER=3746906232
     58 0.001837    127.0.0.1             127.0.0.1             TCP      40731 > commplex-main [ACK] Seq=21722 Ack=2 Win=65535 Len=1448 TSV=3746906878 TSER=3746906398
     59 0.001843    127.0.0.1             127.0.0.1             TCP      40731 > commplex-main [ACK] Seq=23170 Ack=2 Win=65535 Len=1448 TSV=3746906882 TSER=3746906398
     60 0.001854    127.0.0.1             127.0.0.1             TCP      commplex-main > 40731 [ACK] Seq=2 Ack=13034 Win=64087 Len=0 TSV=3746906504 TSER=3746906234
     61 0.001941    127.0.0.1             127.0.0.1             TCP      40731 > commplex-main [ACK] Seq=24618 Ack=2 Win=65535 Len=1448 TSV=3746906981 TSER=3746906504
     62 0.001948    127.0.0.1             127.0.0.1             TCP      40731 > commplex-main [ACK] Seq=26066 Ack=2 Win=65535 Len=1448 TSV=3746906985 TSER=3746906504
     63 0.001965    127.0.0.1             127.0.0.1             TCP      commplex-main > 40731 [ACK] Seq=2 Ack=14482 Win=65535 Len=0 TSV=3746906558 TSER=3746906269
     64 0.002049    127.0.0.1             127.0.0.1             TCP      40731 > commplex-main [ACK] Seq=27514 Ack=2 Win=65535 Len=1448 TSV=3746907090 TSER=3746906558
     65 0.002056    127.0.0.1             127.0.0.1             TCP      40731 > commplex-main [ACK] Seq=28962 Ack=2 Win=65535 Len=1448 TSV=3746907094 TSER=3746906558
     66 0.002070    127.0.0.1             127.0.0.1             TCP      commplex-main > 40731 [ACK] Seq=2 Ack=15930 Win=65535 Len=0 TSV=3746906609 TSER=3746906271
     67 0.002149    127.0.0.1             127.0.0.1             TCP      40731 > commplex-main [ACK] Seq=30410 Ack=2 Win=65535 Len=1448 TSV=3746907189 TSER=3746906609
     68 0.002155    127.0.0.1             127.0.0.1             TCP      40731 > commplex-main [ACK] Seq=31858 Ack=2 Win=65535 Len=1448 TSV=3746907194 TSER=3746906609
     69 0.002172    127.0.0.1             127.0.0.1             TCP      commplex-main > 40731 [ACK] Seq=2 Ack=17378 Win=65535 Len=0 TSV=3746906659 TSER=3746906347
     70 0.002255    127.0.0.1             127.0.0.1             TCP      commplex-main > 40731 [ACK] Seq=2 Ack=18826 Win=65535 Len=0 TSV=3746906728 TSER=3746906351
     71 0.002276    127.0.0.1             127.0.0.1             TCP      commplex-main > 40731 [ACK] Seq=2 Ack=20274 Win=65535 Len=0 TSV=3746906780 TSER=3746906388
     72 0.002289    127.0.0.1             127.0.0.1             TCP      40731 > commplex-main [ACK] Seq=33306 Ack=2 Win=65535 Len=1448 TSV=3746907293 TSER=3746906659
     73 0.002296    127.0.0.1             127.0.0.1             TCP      40731 > commplex-main [ACK] Seq=34754 Ack=2 Win=65535 Len=1448 TSV=3746907295 TSER=3746906659
     74 0.002403    127.0.0.1             127.0.0.1             TCP      40731 > commplex-main [ACK] Seq=36202 Ack=2 Win=65535 Len=1448 TSV=3746907392 TSER=3746906728
     75 0.002409    127.0.0.1             127.0.0.1             TCP      40731 > commplex-main [ACK] Seq=37650 Ack=2 Win=65535 Len=1448 TSV=3746907395 TSER=3746906728
     76 0.002415    127.0.0.1             127.0.0.1             TCP      40731 > commplex-main [ACK] Seq=39098 Ack=2 Win=65535 Len=1448 TSV=3746907427 TSER=3746906780
     77 0.002421    127.0.0.1             127.0.0.1             TCP      40731 > commplex-main [ACK] Seq=40546 Ack=2 Win=65535 Len=1448 TSV=3746907429 TSER=3746906780
     78 0.002443    127.0.0.1             127.0.0.1             TCP      40731 > commplex-main [ACK] Seq=21722 Ack=2 Win=65535 Len=1448 TSV=3746906878 TSER=3746906398
     79 0.002473    127.0.0.1             127.0.0.1             TCP      commplex-main > 40731 [ACK] Seq=2 Ack=20274 Win=64087 Len=0 TSV=3746907520 TSER=3746906878
     80 0.002492    127.0.0.1             127.0.0.1             TCP      40731 > commplex-main [ACK] Seq=23170 Ack=2 Win=65535 Len=1448 TSV=3746906882 TSER=3746906398
     81 0.002521    127.0.0.1             127.0.0.1             TCP      commplex-main > 40731 [ACK] Seq=2 Ack=20274 Win=62639 Len=0 TSV=3746907568 TSER=3746906882
     82 0.002536    127.0.0.1             127.0.0.1             TCP      40731 > commplex-main [ACK] Seq=24618 Ack=2 Win=65535 Len=1448 TSV=3746906981 TSER=3746906504
     83 0.002564    127.0.0.1             127.0.0.1             TCP      commplex-main > 40731 [ACK] Seq=2 Ack=20274 Win=61191 Len=0 TSV=3746907612 TSER=3746906981
     84 0.002579    127.0.0.1             127.0.0.1             TCP      40731 > commplex-main [ACK] Seq=26066 Ack=2 Win=65535 Len=1448 TSV=3746906985 TSER=3746906504
     85 0.002608    127.0.0.1             127.0.0.1             TCP      commplex-main > 40731 [ACK] Seq=2 Ack=20274 Win=59743 Len=0 TSV=3746907655 TSER=3746906985
     86 0.002622    127.0.0.1             127.0.0.1             TCP      40731 > commplex-main [ACK] Seq=27514 Ack=2 Win=65535 Len=1448 TSV=3746907090 TSER=3746906558
     87 0.002658    127.0.0.1             127.0.0.1             TCP      commplex-main > 40731 [ACK] Seq=2 Ack=20274 Win=58295 Len=0 TSV=3746907705 TSER=3746907090
     88 0.002674    127.0.0.1             127.0.0.1             TCP      40731 > commplex-main [ACK] Seq=28962 Ack=2 Win=65535 Len=1448 TSV=3746907094 TSER=3746906558
     89 0.002703    127.0.0.1             127.0.0.1             TCP      commplex-main > 40731 [ACK] Seq=2 Ack=20274 Win=56847 Len=0 TSV=3746907750 TSER=3746907094
     90 0.002718    127.0.0.1             127.0.0.1             TCP      40731 > commplex-main [ACK] Seq=30410 Ack=2 Win=65535 Len=1448 TSV=3746907189 TSER=3746906609
     91 0.002748    127.0.0.1             127.0.0.1             TCP      commplex-main > 40731 [ACK] Seq=2 Ack=20274 Win=55399 Len=0 TSV=3746907795 TSER=3746907189
     92 0.002763    127.0.0.1             127.0.0.1             TCP      40731 > commplex-main [ACK] Seq=31858 Ack=2 Win=65535 Len=1448 TSV=3746907194 TSER=3746906609
     93 0.002794    127.0.0.1             127.0.0.1             TCP      commplex-main > 40731 [ACK] Seq=2 Ack=20274 Win=53951 Len=0 TSV=3746907841 TSER=3746907194
     94 0.002809    127.0.0.1             127.0.0.1             TCP      40731 > commplex-main [ACK] Seq=33306 Ack=2 Win=65535 Len=1448 TSV=3746907293 TSER=3746906659
     95 0.002838    127.0.0.1             127.0.0.1             TCP      commplex-main > 40731 [ACK] Seq=2 Ack=20274 Win=52503 Len=0 TSV=3746907886 TSER=3746907293
     96 0.002853    127.0.0.1             127.0.0.1             TCP      40731 > commplex-main [ACK] Seq=34754 Ack=2 Win=65535 Len=1448 TSV=3746907295 TSER=3746906659
     97 0.002885    127.0.0.1             127.0.0.1             TCP      commplex-main > 40731 [ACK] Seq=2 Ack=20274 Win=51055 Len=0 TSV=3746907933 TSER=3746907295
     98 0.002901    127.0.0.1             127.0.0.1             TCP      40731 > commplex-main [ACK] Seq=36202 Ack=2 Win=65535 Len=1448 TSV=3746907392 TSER=3746906728
     99 0.002936    127.0.0.1             127.0.0.1             TCP      commplex-main > 40731 [ACK] Seq=2 Ack=20274 Win=49607 Len=0 TSV=3746907978 TSER=3746907392
    100 0.002951    127.0.0.1             127.0.0.1             TCP      40731 > commplex-main [ACK] Seq=37650 Ack=2 Win=65535 Len=1448 TSV=3746907395 TSER=3746906728
    101 0.002981    127.0.0.1             127.0.0.1             TCP      commplex-main > 40731 [ACK] Seq=2 Ack=20274 Win=48159 Len=0 TSV=3746908029 TSER=3746907395
    102 0.002997    127.0.0.1             127.0.0.1             TCP      40731 > commplex-main [ACK] Seq=39098 Ack=2 Win=65535 Len=1448 TSV=3746907427 TSER=3746906780
    103 0.003027    127.0.0.1             127.0.0.1             TCP      commplex-main > 40731 [ACK] Seq=2 Ack=20274 Win=46711 Len=0 TSV=3746908074 TSER=3746907427
    104 0.003046    127.0.0.1             127.0.0.1             TCP      commplex-main > 40731 [ACK] Seq=2 Ack=20274 Win=64087 Len=0 TSV=3746907520 TSER=3746906878
    105 0.003084    127.0.0.1             127.0.0.1             TCP      commplex-main > 40731 [ACK] Seq=2 Ack=20274 Win=62639 Len=0 TSV=3746907568 TSER=3746906882
    106 0.003108    127.0.0.1             127.0.0.1             TCP      commplex-main > 40731 [ACK] Seq=2 Ack=20274 Win=61191 Len=0 TSV=3746907612 TSER=3746906981
    107 0.003136    127.0.0.1             127.0.0.1             TCP      commplex-main > 40731 [ACK] Seq=2 Ack=20274 Win=59743 Len=0 TSV=3746907655 TSER=3746906985
    108 0.003202    127.0.0.1             127.0.0.1             TCP      40731 > commplex-main [ACK] Seq=20274 Ack=2 Win=65535 Len=1448 TSV=3746908247 TSER=3746907655
    109 0.003221    127.0.0.1             127.0.0.1             TCP      commplex-main > 40731 [ACK] Seq=2 Ack=20274 Win=58295 Len=0 TSV=3746907705 TSER=3746907090
    110 0.003246    127.0.0.1             127.0.0.1             TCP      commplex-main > 40731 [ACK] Seq=2 Ack=20274 Win=56847 Len=0 TSV=3746907750 TSER=3746907094
    111 0.003275    127.0.0.1             127.0.0.1             TCP      commplex-main > 40731 [ACK] Seq=2 Ack=20274 Win=55399 Len=0 TSV=3746907795 TSER=3746907189
    112 0.003300    127.0.0.1             127.0.0.1             TCP      commplex-main > 40731 [ACK] Seq=2 Ack=20274 Win=53951 Len=0 TSV=3746907841 TSER=3746907194
    113 0.003328    127.0.0.1             127.0.0.1             TCP      commplex-main > 40731 [ACK] Seq=2 Ack=20274 Win=52503 Len=0 TSV=3746907886 TSER=3746907293
    114 0.003352    127.0.0.1             127.0.0.1             TCP      commplex-main > 40731 [ACK] Seq=2 Ack=20274 Win=51055 Len=0 TSV=3746907933 TSER=3746907295
    115 0.003379    127.0.0.1             127.0.0.1             TCP      commplex-main > 40731 [ACK] Seq=2 Ack=20274 Win=49607 Len=0 TSV=3746907978 TSER=3746907392
    116 0.003403    127.0.0.1             127.0.0.1             TCP      commplex-main > 40731 [ACK] Seq=2 Ack=20274 Win=48159 Len=0 TSV=3746908029 TSER=3746907395
    117 0.003430    127.0.0.1             127.0.0.1             TCP      commplex-main > 40731 [ACK] Seq=2 Ack=20274 Win=46711 Len=0 TSV=3746908074 TSER=3746907427
    118 0.003455    127.0.0.1             127.0.0.1             TCP      40731 > commplex-main [ACK] Seq=20274 Ack=2 Win=65535 Len=1448 TSV=3746908247 TSER=3746907655
    119 0.003514    127.0.0.1             127.0.0.1             TCP      commplex-main > 40731 [ACK] Seq=2 Ack=40546 Win=65535 Len=0 TSV=3746908559 TSER=3746908247
    120 0.003530    127.0.0.1             127.0.0.1             TCP      commplex-main > 40731 [ACK] Seq=2 Ack=40546 Win=65535 Len=0 TSV=3746908559 TSER=3746908247
    121 0.003640    127.0.0.1             127.0.0.1             TCP      40731 > commplex-main [ACK] Seq=40546 Ack=2 Win=65535 Len=1448 TSV=3746908670 TSER=3746908559
    122 0.003645    127.0.0.1             127.0.0.1             TCP      40731 > commplex-main [ACK] Seq=41994 Ack=2 Win=65535 Len=1448 TSV=3746908673 TSER=3746908559
    123 0.003668    127.0.0.1             127.0.0.1             TCP      40731 > commplex-main [ACK] Seq=40546 Ack=2 Win=65535 Len=1448 TSV=3746908670 TSER=3746908559
    124 0.003699    127.0.0.1             127.0.0.1             TCP      commplex-main > 40731 [ACK] Seq=2 Ack=41994 Win=65535 Len=0 TSV=3746908748 TSER=3746908670
    125 0.003732    127.0.0.1             127.0.0.1             TCP      40731 > commplex-main [ACK] Seq=41994 Ack=2 Win=65535 Len=1448 TSV=3746908673 TSER=3746908559
    126 0.003762    127.0.0.1             127.0.0.1             TCP      commplex-main > 40731 [ACK] Seq=2 Ack=43442 Win=65535 Len=0 TSV=3746908810 TSER=3746908673
    127 0.003795    127.0.0.1             127.0.0.1             TCP      commplex-main > 40731 [ACK] Seq=2 Ack=41994 Win=65535 Len=0 TSV=3746908748 TSER=3746908670
    128 0.003875    127.0.0.1             127.0.0.1             TCP      40731 > commplex-main [ACK] Seq=43442 Ack=2 Win=65535 Len=1448 TSV=3746908921 TSER=3746908748
    129 0.003890    127.0.0.1             127.0.0.1             TCP      40731 > commplex-main [ACK] Seq=44890 Ack=2 Win=65535 Len=1448 TSV=3746908937 TSER=3746908748
    130 0.003905    127.0.0.1             127.0.0.1             TCP      commplex-main > 40731 [ACK] Seq=2 Ack=43442 Win=65535 Len=0 TSV=3746908810 TSER=3746908673
    131 0.003974    127.0.0.1             127.0.0.1             TCP      40731 > commplex-main [ACK] Seq=46338 Ack=2 Win=65535 Len=1448 TSV=3746909020 TSER=3746908810
    132 0.003990    127.0.0.1             127.0.0.1             TCP      40731 > commplex-main [ACK] Seq=47786 Ack=2 Win=65535 Len=1448 TSV=3746909036 TSER=3746908810
    133 0.004010    127.0.0.1             127.0.0.1             TCP      40731 > commplex-main [ACK] Seq=43442 Ack=2 Win=65535 Len=1448 TSV=3746908921 TSER=3746908748
    134 0.004041    127.0.0.1             127.0.0.1             TCP      commplex-main > 40731 [ACK] Seq=2 Ack=44890 Win=65535 Len=0 TSV=3746909089 TSER=3746908921
    135 0.004075    127.0.0.1             127.0.0.1             TCP      40731 > commplex-main [ACK] Seq=44890 Ack=2 Win=65535 Len=1448 TSV=3746908937 TSER=3746908748
    136 0.004112    127.0.0.1             127.0.0.1             TCP      commplex-main > 40731 [ACK] Seq=2 Ack=46338 Win=65535 Len=0 TSV=3746909155 TSER=3746908937
    137 0.004144    127.0.0.1             127.0.0.1             TCP      40731 > commplex-main [ACK] Seq=46338 Ack=2 Win=65535 Len=1448 TSV=3746909020 TSER=3746908810
    138 0.004175    127.0.0.1             127.0.0.1             TCP      commplex-main > 40731 [ACK] Seq=2 Ack=47786 Win=65535 Len=0 TSV=3746909223 TSER=3746909020
    139 0.004194    127.0.0.1             127.0.0.1             TCP      40731 > commplex-main [ACK] Seq=47786 Ack=2 Win=65535 Len=1448 TSV=3746909036 TSER=3746908810
    140 0.004219    127.0.0.1             127.0.0.1             TCP      commplex-main > 40731 [ACK] Seq=2 Ack=49234 Win=64087 Len=0 TSV=3746909268 TSER=3746909036
    141 0.004237    127.0.0.1             127.0.0.1             TCP      commplex-main > 40731 [ACK] Seq=2 Ack=44890 Win=65535 Len=0 TSV=3746909089 TSER=3746908921
    142 0.004310    127.0.0.1             127.0.0.1             TCP      40731 > commplex-main [ACK] Seq=49234 Ack=2 Win=65535 Len=1448 TSV=3746909352 TSER=3746909089
    143 0.004316    127.0.0.1             127.0.0.1             TCP      40731 > commplex-main [ACK] Seq=50682 Ack=2 Win=65535 Len=1448 TSV=3746909356 TSER=3746909089
    144 0.004329    127.0.0.1             127.0.0.1             TCP      commplex-main > 40731 [ACK] Seq=2 Ack=46338 Win=65535 Len=0 TSV=3746909155 TSER=3746908937
    145 0.004396    127.0.0.1             127.0.0.1             TCP      40731 > commplex-main [ACK] Seq=52130 Ack=2 Win=65535 Len=1448 TSV=3746909430 TSER=3746909155
    146 0.004402    127.0.0.1             127.0.0.1             TCP      40731 > commplex-main [ACK] Seq=53578 Ack=2 Win=65535 Len=1448 TSV=3746909433 TSER=3746909155
    147 0.004421    127.0.0.1             127.0.0.1             TCP      commplex-main > 40731 [ACK] Seq=2 Ack=47786 Win=65535 Len=0 TSV=3746909223 TSER=3746909020
    148 0.004487    127.0.0.1             127.0.0.1             TCP      40731 > commplex-main [ACK] Seq=55026 Ack=2 Win=65535 Len=1448 TSV=3746909526 TSER=3746909223
    149 0.004492    127.0.0.1             127.0.0.1             TCP      40731 > commplex-main [ACK] Seq=56474 Ack=2 Win=65535 Len=1448 TSV=3746909529 TSER=3746909223
    150 0.004506    127.0.0.1             127.0.0.1             TCP      commplex-main > 40731 [ACK] Seq=2 Ack=49234 Win=64087 Len=0 TSV=3746909268 TSER=3746909036
    151 0.004573    127.0.0.1             127.0.0.1             TCP      40731 > commplex-main [ACK] Seq=57922 Ack=2 Win=65535 Len=1448 TSV=3746909607 TSER=3746909268
    152 0.004579    127.0.0.1             127.0.0.1             TCP      40731 > commplex-main [ACK] Seq=59370 Ack=2 Win=65535 Len=1448 TSV=3746909610 TSER=3746909268
    153 0.004597    127.0.0.1             127.0.0.1             TCP      40731 > commplex-main [ACK] Seq=49234 Ack=2 Win=65535 Len=1448 TSV=3746909352 TSER=3746909089
    154 0.004623    127.0.0.1             127.0.0.1             TCP      commplex-main > 40731 [ACK] Seq=2 Ack=50682 Win=62639 Len=0 TSV=3746909671 TSER=3746909352
    155 0.004641    127.0.0.1             127.0.0.1             TCP      40731 > commplex-main [ACK] Seq=50682 Ack=2 Win=65535 Len=1448 TSV=3746909356 TSER=3746909089
    156 0.004666    127.0.0.1             127.0.0.1             TCP      commplex-main > 40731 [ACK] Seq=2 Ack=52130 Win=61191 Len=0 TSV=3746909714 TSER=3746909356
    157 0.004686    127.0.0.1             127.0.0.1             TCP      40731 > commplex-main [ACK] Seq=52130 Ack=2 Win=65535 Len=1448 TSV=3746909430 TSER=3746909155
    158 0.004710    127.0.0.1             127.0.0.1             TCP      commplex-main > 40731 [ACK] Seq=2 Ack=53578 Win=59743 Len=0 TSV=3746909759 TSER=3746909430
    159 0.004729    127.0.0.1             127.0.0.1             TCP      40731 > commplex-main [ACK] Seq=53578 Ack=2 Win=65535 Len=1448 TSV=3746909433 TSER=3746909155
    160 0.004754    127.0.0.1             127.0.0.1             TCP      commplex-main > 40731 [ACK] Seq=2 Ack=55026 Win=58295 Len=0 TSV=3746909803 TSER=3746909433
    161 0.004773    127.0.0.1             127.0.0.1             TCP      40731 > commplex-main [ACK] Seq=55026 Ack=2 Win=65535 Len=1448 TSV=3746909526 TSER=3746909223
    162 0.004798    127.0.0.1             127.0.0.1             TCP      commplex-main > 40731 [ACK] Seq=2 Ack=56474 Win=56847 Len=0 TSV=3746909846 TSER=3746909526
    163 0.004818    127.0.0.1             127.0.0.1             TCP      40731 > commplex-main [ACK] Seq=56474 Ack=2 Win=65535 Len=1448 TSV=3746909529 TSER=3746909223
    164 0.004843    127.0.0.1             127.0.0.1             TCP      commplex-main > 40731 [ACK] Seq=2 Ack=57922 Win=55399 Len=0 TSV=3746909891 TSER=3746909529
    165 0.004861    127.0.0.1             127.0.0.1             TCP      40731 > commplex-main [ACK] Seq=57922 Ack=2 Win=65535 Len=1448 TSV=3746909607 TSER=3746909268
    166 0.004887    127.0.0.1             127.0.0.1             TCP      commplex-main > 40731 [ACK] Seq=2 Ack=59370 Win=53951 Len=0 TSV=3746909935 TSER=3746909607
    167 0.004905    127.0.0.1             127.0.0.1             TCP      40731 > commplex-main [ACK] Seq=59370 Ack=2 Win=65535 Len=1448 TSV=3746909610 TSER=3746909268
    168 0.004930    127.0.0.1             127.0.0.1             TCP      commplex-main > 40731 [ACK] Seq=2 Ack=60818 Win=52503 Len=0 TSV=3746909979 TSER=3746909610
    169 0.004948    127.0.0.1             127.0.0.1             TCP      commplex-main > 40731 [ACK] Seq=2 Ack=50682 Win=62639 Len=0 TSV=3746909671 TSER=3746909352
    170 0.005008    127.0.0.1             127.0.0.1             TCP      40731 > commplex-main [ACK] Seq=60818 Ack=2 Win=65535 Len=1448 TSV=3746910049 TSER=3746909671
    171 0.005026    127.0.0.1             127.0.0.1             TCP      commplex-main > 40731 [ACK] Seq=2 Ack=52130 Win=61191 Len=0 TSV=3746909714 TSER=3746909356
    172 0.005086    127.0.0.1             127.0.0.1             TCP      40731 > commplex-main [ACK] Seq=62266 Ack=2 Win=65535 Len=1448 TSV=3746910126 TSER=3746909714
    173 0.005111    127.0.0.1             127.0.0.1             TCP      commplex-main > 40731 [ACK] Seq=2 Ack=53578 Win=59743 Len=0 TSV=3746909759 TSER=3746909430
    174 0.005191    127.0.0.1             127.0.0.1             TCP      40731 > commplex-main [ACK] Seq=63714 Ack=2 Win=65535 Len=1448 TSV=3746910235 TSER=3746909759
    175 0.005212    127.0.0.1             127.0.0.1             TCP      commplex-main > 40731 [ACK] Seq=2 Ack=55026 Win=58295 Len=0 TSV=3746909803 TSER=3746909433
    176 0.005269    127.0.0.1             127.0.0.1             TCP      40731 > commplex-main [ACK] Seq=65162 Ack=2 Win=65535 Len=1448 TSV=3746910307 TSER=3746909803
    177 0.005291    127.0.0.1             127.0.0.1             TCP      commplex-main > 40731 [ACK] Seq=2 Ack=56474 Win=56847 Len=0 TSV=3746909846 TSER=3746909526
    178 0.005352    127.0.0.1             127.0.0.1             TCP      40731 > commplex-main [ACK] Seq=66610 Ack=2 Win=65535 Len=1448 TSV=3746910398 TSER=3746909846
    179 0.005371    127.0.0.1             127.0.0.1             TCP      commplex-main > 40731 [ACK] Seq=2 Ack=57922 Win=55399 Len=0 TSV=3746909891 TSER=3746909529
    180 0.005432    127.0.0.1             127.0.0.1             TCP      40731 > commplex-main [ACK] Seq=68058 Ack=2 Win=65535 Len=1448 TSV=3746910477 TSER=3746909891
    181 0.005451    127.0.0.1             127.0.0.1             TCP      commplex-main > 40731 [ACK] Seq=2 Ack=59370 Win=53951 Len=0 TSV=3746909935 TSER=3746909607
    182 0.005512    127.0.0.1             127.0.0.1             TCP      40731 > commplex-main [ACK] Seq=69506 Ack=2 Win=65535 Len=1448 TSV=3746910558 TSER=3746909935
    183 0.005533    127.0.0.1             127.0.0.1             TCP      commplex-main > 40731 [ACK] Seq=2 Ack=60818 Win=52503 Len=0 TSV=3746909979 TSER=3746909610
    184 0.005595    127.0.0.1             127.0.0.1             TCP      40731 > commplex-main [ACK] Seq=70954 Ack=2 Win=65535 Len=1448 TSV=3746910639 TSER=3746909979
    185 0.005615    127.0.0.1             127.0.0.1             TCP      40731 > commplex-main [ACK] Seq=60818 Ack=2 Win=65535 Len=1448 TSV=3746910049 TSER=3746909671
    186 0.005658    127.0.0.1             127.0.0.1             TCP      commplex-main > 40731 [ACK] Seq=2 Ack=62266 Win=65535 Len=0 TSV=3746910698 TSER=3746910049
    187 0.005681    127.0.0.1             127.0.0.1             TCP      40731 > commplex-main [ACK] Seq=62266 Ack=2 Win=65535 Len=1448 TSV=3746910126 TSER=3746909714
    188 0.005710    127.0.0.1             127.0.0.1             TCP      commplex-main > 40731 [ACK] Seq=2 Ack=63714 Win=65535 Len=0 TSV=3746910757 TSER=3746910126
    189 0.005750    127.0.0.1             127.0.0.1             TCP      40731 > commplex-main [ACK] Seq=63714 Ack=2 Win=65535 Len=1448 TSV=3746910235 TSER=3746909759
    190 0.005794    127.0.0.1             127.0.0.1             TCP      commplex-main > 40731 [ACK] Seq=2 Ack=65162 Win=65535 Len=0 TSV=3746910829 TSER=3746910235
    191 0.005814    127.0.0.1             127.0.0.1             TCP      40731 > commplex-main [ACK] Seq=65162 Ack=2 Win=65535 Len=1448 TSV=3746910307 TSER=3746909803
    192 0.005843    127.0.0.1             127.0.0.1             TCP      commplex-main > 40731 [ACK] Seq=2 Ack=66610 Win=65535 Len=0 TSV=3746910889 TSER=3746910307
    193 0.005876    127.0.0.1             127.0.0.1             TCP      40731 > commplex-main [ACK] Seq=66610 Ack=2 Win=65535 Len=1448 TSV=3746910398 TSER=3746909846
    194 0.005919    127.0.0.1             127.0.0.1             TCP      commplex-main > 40731 [ACK] Seq=2 Ack=68058 Win=65535 Len=0 TSV=3746910955 TSER=3746910398
    195 0.005939    127.0.0.1             127.0.0.1             TCP      40731 > commplex-main [ACK] Seq=68058 Ack=2 Win=65535 Len=1448 TSV=3746910477 TSER=3746909891
    196 0.005967    127.0.0.1             127.0.0.1             TCP      commplex-main > 40731 [ACK] Seq=2 Ack=69506 Win=65535 Len=0 TSV=3746911013 TSER=3746910477
    197 0.005998    127.0.0.1             127.0.0.1             TCP      40731 > commplex-main [ACK] Seq=69506 Ack=2 Win=65535 Len=1448 TSV=3746910558 TSER=3746909935
    198 0.006041    127.0.0.1             127.0.0.1             TCP      commplex-main > 40731 [ACK] Seq=2 Ack=70954 Win=65535 Len=0 TSV=3746911076 TSER=3746910558
    199 0.006061    127.0.0.1             127.0.0.1             TCP      40731 > commplex-main [ACK] Seq=70954 Ack=2 Win=65535 Len=1448 TSV=3746910639 TSER=3746909979
    200 0.006090    127.0.0.1             127.0.0.1             TCP      commplex-main > 40731 [ACK] Seq=2 Ack=72402 Win=65535 Len=0 TSV=3746911136 TSER=3746910639
    201 0.006123    127.0.0.1             127.0.0.1             TCP      commplex-main > 40731 [ACK] Seq=2 Ack=62266 Win=65535 Len=0 TSV=3746910698 TSER=3746910049
    202 0.006192    127.0.0.1             127.0.0.1             TCP      40731 > commplex-main [ACK] Seq=72402 Ack=2 Win=65535 Len=1448 TSV=3746911237 TSER=3746910698
    203 0.006207    127.0.0.1             127.0.0.1             TCP      40731 > commplex-main [ACK] Seq=73850 Ack=2 Win=65535 Len=1448 TSV=3746911253 TSER=3746910698
    204 0.006223    127.0.0.1             127.0.0.1             TCP      commplex-main > 40731 [ACK] Seq=2 Ack=63714 Win=65535 Len=0 TSV=3746910757 TSER=3746910126
    205 0.006289    127.0.0.1             127.0.0.1             TCP      40731 > commplex-main [ACK] Seq=75298 Ack=2 Win=65535 Len=1448 TSV=3746911334 TSER=3746910757
    206 0.006304    127.0.0.1             127.0.0.1             TCP      commplex-main > 40731 [ACK] Seq=2 Ack=65162 Win=65535 Len=0 TSV=3746910829 TSER=3746910235
    207 0.006390    127.0.0.1             127.0.0.1             TCP      40731 > commplex-main [ACK] Seq=76746 Ack=2 Win=65535 Len=1448 TSV=3746911429 TSER=3746910829
    208 0.006405    127.0.0.1             127.0.0.1             TCP      commplex-main > 40731 [ACK] Seq=2 Ack=66610 Win=65535 Len=0 TSV=3746910889 TSER=3746910307
    209 0.006490    127.0.0.1             127.0.0.1             TCP      40731 > commplex-main [ACK] Seq=78194 Ack=2 Win=65535 Len=1448 TSV=3746911526 TSER=3746910889
    210 0.006495    127.0.0.1             127.0.0.1             TCP      commplex-main > 40731 [ACK] Seq=2 Ack=68058 Win=65535 Len=0 TSV=3746910955 TSER=3746910398
    211 0.006560    127.0.0.1             127.0.0.1             TCP      40731 > commplex-main [ACK] Seq=79642 Ack=2 Win=65535 Len=1448 TSV=3746911600 TSER=3746910955
    212 0.006573    127.0.0.1             127.0.0.1             TCP      commplex-main > 40731 [ACK] Seq=2 Ack=69506 Win=65535 Len=0 TSV=3746911013 TSER=3746910477
    213 0.006592    127.0.0.1             127.0.0.1             TCP      commplex-main > 40731 [ACK] Seq=2 Ack=70954 Win=65535 Len=0 TSV=3746911076 TSER=3746910558
    214 0.006603    127.0.0.1             127.0.0.1             TCP      commplex-main > 40731 [ACK] Seq=2 Ack=72402 Win=65535 Len=0 TSV=3746911136 TSER=3746910639
    215 0.006663    127.0.0.1             127.0.0.1             TCP      40731 > commplex-main [ACK] Seq=81090 Ack=2 Win=65535 Len=1448 TSV=3746911693 TSER=3746911013
    216 0.006729    127.0.0.1             127.0.0.1             TCP      40731 > commplex-main [ACK] Seq=82538 Ack=2 Win=65535 Len=1448 TSV=3746911741 TSER=3746911076
    217 0.006736    127.0.0.1             127.0.0.1             TCP      40731 > commplex-main [ACK] Seq=83986 Ack=2 Win=65535 Len=1448 TSV=3746911774 TSER=3746911136
    218 0.006750    127.0.0.1             127.0.0.1             TCP      40731 > commplex-main [ACK] Seq=72402 Ack=2 Win=65535 Len=1448 TSV=3746911237 TSER=3746910698
    219 0.006794    127.0.0.1             127.0.0.1             TCP      commplex-main > 40731 [ACK] Seq=2 Ack=73850 Win=65535 Len=0 TSV=3746911834 TSER=3746911237
    220 0.006814    127.0.0.1             127.0.0.1             TCP      40731 > commplex-main [ACK] Seq=73850 Ack=2 Win=65535 Len=1448 TSV=3746911253 TSER=3746910698
    221 0.006863    127.0.0.1             127.0.0.1             TCP      40731 > commplex-main [ACK] Seq=75298 Ack=2 Win=65535 Len=1448 TSV=3746911334 TSER=3746910757
    222 0.006869    127.0.0.1             127.0.0.1             TCP      commplex-main > 40731 [ACK] Seq=2 Ack=75298 Win=65535 Len=0 TSV=3746911893 TSER=3746911253
    223 0.006908    127.0.0.1             127.0.0.1             TCP      40731 > commplex-main [ACK] Seq=76746 Ack=2 Win=65535 Len=1448 TSV=3746911429 TSER=3746910829
    224 0.006914    127.0.0.1             127.0.0.1             TCP      commplex-main > 40731 [ACK] Seq=2 Ack=76746 Win=65535 Len=0 TSV=3746911944 TSER=3746911334
    225 0.006950    127.0.0.1             127.0.0.1             TCP      40731 > commplex-main [ACK] Seq=78194 Ack=2 Win=65535 Len=1448 TSV=3746911526 TSER=3746910889
    226 0.006957    127.0.0.1             127.0.0.1             TCP      commplex-main > 40731 [ACK] Seq=2 Ack=78194 Win=65535 Len=0 TSV=3746911986 TSER=3746911429
    227 0.006994    127.0.0.1             127.0.0.1             TCP      40731 > commplex-main [ACK] Seq=79642 Ack=2 Win=65535 Len=1448 TSV=3746911600 TSER=3746910955
    228 0.007001    127.0.0.1             127.0.0.1             TCP      commplex-main > 40731 [ACK] Seq=2 Ack=79642 Win=65535 Len=0 TSV=3746912032 TSER=3746911526
    229 0.007038    127.0.0.1             127.0.0.1             TCP      40731 > commplex-main [ACK] Seq=81090 Ack=2 Win=65535 Len=1448 TSV=3746911693 TSER=3746911013
    230 0.007045    127.0.0.1             127.0.0.1             TCP      commplex-main > 40731 [ACK] Seq=2 Ack=81090 Win=65535 Len=0 TSV=3746912076 TSER=3746911600
    231 0.007089    127.0.0.1             127.0.0.1             TCP      commplex-main > 40731 [ACK] Seq=2 Ack=82538 Win=65535 Len=0 TSV=3746912121 TSER=3746911693
    232 0.007093    127.0.0.1             127.0.0.1             TCP      40731 > commplex-main [ACK] Seq=82538 Ack=2 Win=65535 Len=1448 TSV=3746911741 TSER=3746911076
    233 0.007133    127.0.0.1             127.0.0.1             TCP      40731 > commplex-main [ACK] Seq=83986 Ack=2 Win=65535 Len=1448 TSV=3746911774 TSER=3746911136
    234 0.007135    127.0.0.1             127.0.0.1             TCP      commplex-main > 40731 [ACK] Seq=2 Ack=83986 Win=65535 Len=0 TSV=3746912172 TSER=3746911741
    235 0.007177    127.0.0.1             127.0.0.1             TCP      commplex-main > 40731 [ACK] Seq=2 Ack=73850 Win=65535 Len=0 TSV=3746911834 TSER=3746911237
    236 0.007187    127.0.0.1             127.0.0.1             TCP      commplex-main > 40731 [ACK] Seq=2 Ack=85434 Win=64087 Len=0 TSV=3746912212 TSER=3746911774
    237 0.007240    127.0.0.1             127.0.0.1             TCP      40731 > commplex-main [ACK] Seq=85434 Ack=2 Win=65535 Len=1448 TSV=3746912283 TSER=3746911834
    238 0.007242    127.0.0.1             127.0.0.1             TCP      commplex-main > 40731 [ACK] Seq=2 Ack=75298 Win=65535 Len=0 TSV=3746911893 TSER=3746911253
    239 0.007309    127.0.0.1             127.0.0.1             TCP      40731 > commplex-main [ACK] Seq=86882 Ack=2 Win=65535 Len=1448 TSV=3746912345 TSER=3746911893
    240 0.007313    127.0.0.1             127.0.0.1             TCP      commplex-main > 40731 [ACK] Seq=2 Ack=76746 Win=65535 Len=0 TSV=3746911944 TSER=3746911334
    241 0.007318    127.0.0.1             127.0.0.1             TCP      40731 > commplex-main [ACK] Seq=88330 Ack=2 Win=65535 Len=1448 TSV=3746912349 TSER=3746911893
    242 0.007333    127.0.0.1             127.0.0.1             TCP      commplex-main > 40731 [ACK] Seq=2 Ack=78194 Win=65535 Len=0 TSV=3746911986 TSER=3746911429
    243 0.007377    127.0.0.1             127.0.0.1             TCP      40731 > commplex-main [ACK] Seq=89778 Ack=2 Win=65535 Len=1448 TSV=3746912420 TSER=3746911944
    244 0.007407    127.0.0.1             127.0.0.1             TCP      40731 > commplex-main [ACK] Seq=91226 Ack=2 Win=65535 Len=1448 TSV=3746912450 TSER=3746911986
    245 0.007418    127.0.0.1             127.0.0.1             TCP      commplex-main > 40731 [ACK] Seq=2 Ack=79642 Win=65535 Len=0 TSV=3746912032 TSER=3746911526
    246 0.007437    127.0.0.1             127.0.0.1             TCP      commplex-main > 40731 [ACK] Seq=2 Ack=81090 Win=65535 Len=0 TSV=3746912076 TSER=3746911600
    247 0.007482    127.0.0.1             127.0.0.1             TCP      40731 > commplex-main [ACK] Seq=92674 Ack=2 Win=65535 Len=1448 TSV=3746912525 TSER=3746912032
    248 0.007511    127.0.0.1             127.0.0.1             TCP      40731 > commplex-main [ACK] Seq=94122 Ack=2 Win=65535 Len=1448 TSV=3746912554 TSER=3746912076
    249 0.007522    127.0.0.1             127.0.0.1             TCP      commplex-main > 40731 [ACK] Seq=2 Ack=82538 Win=65535 Len=0 TSV=3746912121 TSER=3746911693
    250 0.007541    127.0.0.1             127.0.0.1             TCP      commplex-main > 40731 [ACK] Seq=2 Ack=83986 Win=65535 Len=0 TSV=3746912172 TSER=3746911741
    251 0.007584    127.0.0.1             127.0.0.1             TCP      40731 > commplex-main [ACK] Seq=95570 Ack=2 Win=65535 Len=1448 TSV=3746912627 TSER=3746912121
    252 0.007613    127.0.0.1             127.0.0.1             TCP      40731 > commplex-main [ACK] Seq=97018 Ack=2 Win=65535 Len=1448 TSV=3746912657 TSER=3746912172
    253 0.007619    127.0.0.1             127.0.0.1             TCP      commplex-main > 40731 [ACK] Seq=2 Ack=85434 Win=64087 Len=0 TSV=3746912212 TSER=3746911774
    254 0.007674    127.0.0.1             127.0.0.1             TCP      40731 > commplex-main [ACK] Seq=98466 Ack=2 Win=65535 Len=1448 TSV=3746912718 TSER=3746912212
    255 0.007679    127.0.0.1             127.0.0.1             TCP      40731 > commplex-main [ACK] Seq=85434 Ack=2 Win=65535 Len=1448 TSV=3746912283 TSER=3746911834
    256 0.007728    127.0.0.1             127.0.0.1             TCP      40731 > commplex-main [ACK] Seq=86882 Ack=2 Win=65535 Len=1448 TSV=3746912345 TSER=3746911893
    257 0.007734    127.0.0.1             127.0.0.1             TCP      commplex-main > 40731 [ACK] Seq=2 Ack=86882 Win=65535 Len=0 TSV=3746912761 TSER=3746912283
    258 0.007766    127.0.0.1             127.0.0.1             TCP      commplex-main > 40731 [ACK] Seq=2 Ack=88330 Win=65535 Len=0 TSV=3746912803 TSER=3746912345
    259 0.007780    127.0.0.1             127.0.0.1             TCP      40731 > commplex-main [ACK] Seq=88330 Ack=2 Win=65535 Len=1448 TSV=3746912349 TSER=3746911893
    260 0.007799    127.0.0.1             127.0.0.1             TCP      40731 > commplex-main [ACK] Seq=89778 Ack=2 Win=65535 Len=1448 TSV=3746912420 TSER=3746911944
    261 0.007843    127.0.0.1             127.0.0.1             TCP      commplex-main > 40731 [ACK] Seq=2 Ack=89778 Win=65535 Len=0 TSV=3746912877 TSER=3746912349
    262 0.007848    127.0.0.1             127.0.0.1             TCP      40731 > commplex-main [ACK] Seq=91226 Ack=2 Win=65535 Len=1448 TSV=3746912450 TSER=3746911986
    263 0.007871    127.0.0.1             127.0.0.1             TCP      40731 > commplex-main [ACK] Seq=92674 Ack=2 Win=65535 Len=1448 TSV=3746912525 TSER=3746912032
    264 0.007900    127.0.0.1             127.0.0.1             TCP      commplex-main > 40731 [ACK] Seq=2 Ack=91226 Win=64087 Len=0 TSV=3746912918 TSER=3746912420
    265 0.007905    127.0.0.1             127.0.0.1             TCP      40731 > commplex-main [ACK] Seq=94122 Ack=2 Win=65535 Len=1448 TSV=3746912554 TSER=3746912076
    266 0.007908    127.0.0.1             127.0.0.1             TCP      commplex-main > 40731 [ACK] Seq=2 Ack=92674 Win=64087 Len=0 TSV=3746912933 TSER=3746912450
    267 0.007939    127.0.0.1             127.0.0.1             TCP      40731 > commplex-main [ACK] Seq=95570 Ack=2 Win=65535 Len=1448 TSV=3746912627 TSER=3746912121
    268 0.007953    127.0.0.1             127.0.0.1             TCP      40731 > commplex-main [ACK] Seq=97018 Ack=2 Win=65535 Len=1448 TSV=3746912657 TSER=3746912172
    269 0.007964    127.0.0.1             127.0.0.1             TCP      40731 > commplex-main [ACK] Seq=98466 Ack=2 Win=65535 Len=1448 TSV=3746912718 TSER=3746912212
    270 0.007984    127.0.0.1             127.0.0.1             TCP      commplex-main > 40731 [ACK] Seq=2 Ack=94122 Win=62639 Len=0 TSV=3746912994 TSER=3746912525
    271 0.007990    127.0.0.1             127.0.0.1             TCP      commplex-main > 40731 [ACK] Seq=2 Ack=95570 Win=64087 Len=0 TSV=3746913008 TSER=3746912554
    272 0.007994    127.0.0.1             127.0.0.1             TCP      commplex-main > 40731 [ACK] Seq=2 Ack=86882 Win=65535 Len=0 TSV=3746912761 TSER=3746912283
    273 0.008020    127.0.0.1             127.0.0.1             TCP      commplex-main > 40731 [ACK] Seq=2 Ack=88330 Win=65535 Len=0 TSV=3746912803 TSER=3746912345
    274 0.008093    127.0.0.1             127.0.0.1             TCP      commplex-main > 40731 [ACK] Seq=2 Ack=89778 Win=65535 Len=0 TSV=3746912877 TSER=3746912349
    275 0.008097    127.0.0.1             127.0.0.1             TCP      commplex-main > 40731 [ACK] Seq=2 Ack=97018 Win=62639 Len=0 TSV=3746913059 TSER=3746912627
    276 0.008103    127.0.0.1             127.0.0.1             TCP      commplex-main > 40731 [ACK] Seq=2 Ack=98466 Win=61191 Len=0 TSV=3746913065 TSER=3746912657
    277 0.008107    127.0.0.1             127.0.0.1             TCP      commplex-main > 40731 [ACK] Seq=2 Ack=99914 Win=59743 Len=0 TSV=3746913074 TSER=3746912718
    278 0.008112    127.0.0.1             127.0.0.1             TCP      40731 > commplex-main [ACK] Seq=99914 Ack=2 Win=65535 Len=1448 TSV=3746913112 TSER=3746912761
    279 0.008114    127.0.0.1             127.0.0.1             TCP      commplex-main > 40731 [ACK] Seq=2 Ack=91226 Win=64087 Len=0 TSV=3746912918 TSER=3746912420
    280 0.008117    127.0.0.1             127.0.0.1             TCP      40731 > commplex-main [ACK] Seq=101362 Ack=2 Win=65535 Len=1448 TSV=3746913142 TSER=3746912803
    281 0.008140    127.0.0.1             127.0.0.1             TCP      commplex-main > 40731 [ACK] Seq=2 Ack=92674 Win=64087 Len=0 TSV=3746912933 TSER=3746912450
    282 0.008190    127.0.0.1             127.0.0.1             TCP      commplex-main > 40731 [ACK] Seq=2 Ack=94122 Win=62639 Len=0 TSV=3746912994 TSER=3746912525
    283 0.008227    127.0.0.1             127.0.0.1             TCP      commplex-main > 40731 [ACK] Seq=2 Ack=95570 Win=64087 Len=0 TSV=3746913008 TSER=3746912554
    284 0.008263    127.0.0.1             127.0.0.1             TCP      commplex-main > 40731 [ACK] Seq=2 Ack=97018 Win=62639 Len=0 TSV=3746913059 TSER=3746912627
    285 0.008285    127.0.0.1             127.0.0.1             TCP      commplex-main > 40731 [ACK] Seq=2 Ack=98466 Win=61191 Len=0 TSV=3746913065 TSER=3746912657
    286 0.008313    127.0.0.1             127.0.0.1             TCP      commplex-main > 40731 [ACK] Seq=2 Ack=99914 Win=59743 Len=0 TSV=3746913074 TSER=3746912718
    287 0.008342    127.0.0.1             127.0.0.1             TCP      40731 > commplex-main [ACK] Seq=99914 Ack=2 Win=65535 Len=1448 TSV=3746913112 TSER=3746912761
    288 0.008373    127.0.0.1             127.0.0.1             TCP      40731 > commplex-main [ACK] Seq=101362 Ack=2 Win=65535 Len=1448 TSV=3746913142 TSER=3746912803
    289 0.008433    127.0.0.1             127.0.0.1             TCP      40731 > commplex-main [ACK] Seq=102810 Ack=2 Win=65535 Len=1448 TSV=3746913213 TSER=3746912877
    290 0.008439    127.0.0.1             127.0.0.1             TCP      40731 > commplex-main [ACK] Seq=104258 Ack=2 Win=65535 Len=1448 TSV=3746913251 TSER=3746912918
    291 0.008444    127.0.0.1             127.0.0.1             TCP      40731 > commplex-main [ACK] Seq=105706 Ack=2 Win=65535 Len=1448 TSV=3746913255 TSER=3746912918
    292 0.008449    127.0.0.1             127.0.0.1             TCP      40731 > commplex-main [ACK] Seq=107154 Ack=2 Win=65535 Len=1448 TSV=3746913294 TSER=3746912933
    293 0.008455    127.0.0.1             127.0.0.1             TCP      40731 > commplex-main [ACK] Seq=108602 Ack=2 Win=65535 Len=1448 TSV=3746913334 TSER=3746912994
    294 0.008460    127.0.0.1             127.0.0.1             TCP      40731 > commplex-main [ACK] Seq=110050 Ack=2 Win=65535 Len=1448 TSV=3746913367 TSER=3746913008
    295 0.008465    127.0.0.1             127.0.0.1             TCP      40731 > commplex-main [ACK] Seq=111498 Ack=2 Win=65535 Len=1448 TSV=3746913398 TSER=3746913059
    296 0.008470    127.0.0.1             127.0.0.1             TCP      40731 > commplex-main [ACK] Seq=112946 Ack=2 Win=65535 Len=1448 TSV=3746913430 TSER=3746913065
    297 0.008475    127.0.0.1             127.0.0.1             TCP      40731 > commplex-main [ACK] Seq=114394 Ack=2 Win=65535 Len=1448 TSV=3746913464 TSER=3746913074
    298 0.008480    127.0.0.1             127.0.0.1             TCP      commplex-main > 40731 [ACK] Seq=2 Ack=101362 Win=65535 Len=0 TSV=3746913472 TSER=3746913112
    299 0.008484    127.0.0.1             127.0.0.1             TCP      commplex-main > 40731 [ACK] Seq=2 Ack=102810 Win=64087 Len=0 TSV=3746913480 TSER=3746913142
    300 0.008505    127.0.0.1             127.0.0.1             TCP      40731 > commplex-main [ACK] Seq=102810 Ack=2 Win=65535 Len=1448 TSV=3746913213 TSER=3746912877
    301 0.008543    127.0.0.1             127.0.0.1             TCP      40731 > commplex-main [ACK] Seq=104258 Ack=2 Win=65535 Len=1448 TSV=3746913251 TSER=3746912918
    302 0.008558    127.0.0.1             127.0.0.1             TCP      commplex-main > 40731 [ACK] Seq=2 Ack=104258 Win=65535 Len=0 TSV=3746913586 TSER=3746913213
    303 0.008587    127.0.0.1             127.0.0.1             TCP      40731 > commplex-main [ACK] Seq=105706 Ack=2 Win=65535 Len=1448 TSV=3746913255 TSER=3746912918
    304 0.008603    127.0.0.1             127.0.0.1             TCP      commplex-main > 40731 [ACK] Seq=2 Ack=105706 Win=65535 Len=0 TSV=3746913631 TSER=3746913251
    305 0.008632    127.0.0.1             127.0.0.1             TCP      40731 > commplex-main [ACK] Seq=107154 Ack=2 Win=65535 Len=1448 TSV=3746913294 TSER=3746912933
    306 0.008644    127.0.0.1             127.0.0.1             TCP      commplex-main > 40731 [ACK] Seq=2 Ack=107154 Win=65535 Len=0 TSV=3746913676 TSER=3746913255
    307 0.008674    127.0.0.1             127.0.0.1             TCP      40731 > commplex-main [ACK] Seq=108602 Ack=2 Win=65535 Len=1448 TSV=3746913334 TSER=3746912994
    308 0.008686    127.0.0.1             127.0.0.1             TCP      commplex-main > 40731 [ACK] Seq=2 Ack=108602 Win=65535 Len=0 TSV=3746913717 TSER=3746913294
    309 0.008719    127.0.0.1             127.0.0.1             TCP      40731 > commplex-main [ACK] Seq=110050 Ack=2 Win=65535 Len=1448 TSV=3746913367 TSER=3746913008
    310 0.008732    127.0.0.1             127.0.0.1             TCP      commplex-main > 40731 [ACK] Seq=2 Ack=110050 Win=65535 Len=0 TSV=3746913762 TSER=3746913334
    311 0.008751    127.0.0.1             127.0.0.1             TCP      40731 > commplex-main [ACK] Seq=111498 Ack=2 Win=65535 Len=1448 TSV=3746913398 TSER=3746913059
    312 0.008775    127.0.0.1             127.0.0.1             TCP      40731 > commplex-main [ACK] Seq=112946 Ack=2 Win=65535 Len=1448 TSV=3746913430 TSER=3746913065
    313 0.008788    127.0.0.1             127.0.0.1             TCP      commplex-main > 40731 [ACK] Seq=2 Ack=111498 Win=65535 Len=0 TSV=3746913835 TSER=3746913367
    314 0.008799    127.0.0.1             127.0.0.1             TCP      commplex-main > 40731 [ACK] Seq=2 Ack=112946 Win=64087 Len=0 TSV=3746913846 TSER=3746913398
    315 0.008816    127.0.0.1             127.0.0.1             TCP      40731 > commplex-main [ACK] Seq=114394 Ack=2 Win=65535 Len=1448 TSV=3746913464 TSER=3746913074
    316 0.008839    127.0.0.1             127.0.0.1             TCP      commplex-main > 40731 [ACK] Seq=2 Ack=114394 Win=64087 Len=0 TSV=3746913882 TSER=3746913430
    317 0.008850    127.0.0.1             127.0.0.1             TCP      commplex-main > 40731 [ACK] Seq=2 Ack=101362 Win=65535 Len=0 TSV=3746913472 TSER=3746913112
    318 0.008874    127.0.0.1             127.0.0.1             TCP      commplex-main > 40731 [ACK] Seq=2 Ack=115842 Win=64087 Len=0 TSV=3746913920 TSER=3746913464
    319 0.008887    127.0.0.1             127.0.0.1             TCP      commplex-main > 40731 [ACK] Seq=2 Ack=102810 Win=64087 Len=0 TSV=3746913480 TSER=3746913142
    320 0.008907    127.0.0.1             127.0.0.1             TCP      commplex-main > 40731 [ACK] Seq=2 Ack=104258 Win=65535 Len=0 TSV=3746913586 TSER=3746913213
    321 0.008928    127.0.0.1             127.0.0.1             TCP      commplex-main > 40731 [ACK] Seq=2 Ack=105706 Win=65535 Len=0 TSV=3746913631 TSER=3746913251
    322 0.008950    127.0.0.1             127.0.0.1             TCP      commplex-main > 40731 [ACK] Seq=2 Ack=107154 Win=65535 Len=0 TSV=3746913676 TSER=3746913255
    323 0.008965    127.0.0.1             127.0.0.1             TCP      40731 > commplex-main [ACK] Seq=115842 Ack=2 Win=65535 Len=1448 TSV=3746914000 TSER=3746913472
    324 0.008979    127.0.0.1             127.0.0.1             TCP      commplex-main > 40731 [ACK] Seq=2 Ack=108602 Win=65535 Len=0 TSV=3746913717 TSER=3746913294
    325 0.008997    127.0.0.1             127.0.0.1             TCP      commplex-main > 40731 [ACK] Seq=2 Ack=110050 Win=65535 Len=0 TSV=3746913762 TSER=3746913334
    326 0.009013    127.0.0.1             127.0.0.1             TCP      40731 > commplex-main [ACK] Seq=117290 Ack=2 Win=65535 Len=1448 TSV=3746914057 TSER=3746913480
    327 0.009030    127.0.0.1             127.0.0.1             TCP      commplex-main > 40731 [ACK] Seq=2 Ack=111498 Win=65535 Len=0 TSV=3746913835 TSER=3746913367
    328 0.009057    127.0.0.1             127.0.0.1             TCP      commplex-main > 40731 [ACK] Seq=2 Ack=112946 Win=64087 Len=0 TSV=3746913846 TSER=3746913398
    329 0.009074    127.0.0.1             127.0.0.1             TCP      40731 > commplex-main [ACK] Seq=118738 Ack=2 Win=65535 Len=1448 TSV=3746914116 TSER=3746913586
    330 0.009088    127.0.0.1             127.0.0.1             TCP      commplex-main > 40731 [ACK] Seq=2 Ack=114394 Win=64087 Len=0 TSV=3746913882 TSER=3746913430
    331 0.009115    127.0.0.1             127.0.0.1             TCP      commplex-main > 40731 [ACK] Seq=2 Ack=115842 Win=64087 Len=0 TSV=3746913920 TSER=3746913464
    332 0.009132    127.0.0.1             127.0.0.1             TCP      40731 > commplex-main [ACK] Seq=120186 Ack=2 Win=65535 Len=1448 TSV=3746914176 TSER=3746913631
    333 0.009149    127.0.0.1             127.0.0.1             TCP      40731 > commplex-main [ACK] Seq=115842 Ack=2 Win=65535 Len=1448 TSV=3746914000 TSER=3746913472
    334 0.009173    127.0.0.1             127.0.0.1             TCP      40731 > commplex-main [ACK] Seq=117290 Ack=2 Win=65535 Len=1448 TSV=3746914057 TSER=3746913480
    335 0.009197    127.0.0.1             127.0.0.1             TCP      40731 > commplex-main [ACK] Seq=121634 Ack=2 Win=65535 Len=1448 TSV=3746914236 TSER=3746913676
    336 0.009204    127.0.0.1             127.0.0.1             TCP      40731 > commplex-main [ACK] Seq=123082 Ack=2 Win=65535 Len=1448 TSV=3746914249 TSER=3746913676
    337 0.009214    127.0.0.1             127.0.0.1             TCP      40731 > commplex-main [ACK] Seq=118738 Ack=2 Win=65535 Len=1448 TSV=3746914116 TSER=3746913586
    338 0.009232    127.0.0.1             127.0.0.1             TCP      40731 > commplex-main [ACK] Seq=120186 Ack=2 Win=65535 Len=1448 TSV=3746914176 TSER=3746913631
    339 0.009252    127.0.0.1             127.0.0.1             TCP      40731 > commplex-main [ACK] Seq=121634 Ack=2 Win=65535 Len=1448 TSV=3746914236 TSER=3746913676
    340 0.009266    127.0.0.1             127.0.0.1             TCP      40731 > commplex-main [ACK] Seq=124530 Ack=2 Win=65535 Len=1448 TSV=3746914306 TSER=3746913717
    341 0.009288    127.0.0.1             127.0.0.1             TCP      40731 > commplex-main [ACK] Seq=123082 Ack=2 Win=65535 Len=1448 TSV=3746914249 TSER=3746913676
    342 0.009314    127.0.0.1             127.0.0.1             TCP      40731 > commplex-main [ACK] Seq=124530 Ack=2 Win=65535 Len=1448 TSV=3746914306 TSER=3746913717
    343 0.009328    127.0.0.1             127.0.0.1             TCP      40731 > commplex-main [ACK] Seq=125978 Ack=2 Win=65535 Len=1448 TSV=3746914374 TSER=3746913762
    344 0.009343    127.0.0.1             127.0.0.1             TCP      40731 > commplex-main [ACK] Seq=125978 Ack=2 Win=65535 Len=1448 TSV=3746914374 TSER=3746913762
    345 0.009388    127.0.0.1             127.0.0.1             TCP      40731 > commplex-main [ACK] Seq=127426 Ack=2 Win=65535 Len=1448 TSV=3746914430 TSER=3746913835
    346 0.009414    127.0.0.1             127.0.0.1             TCP      40731 > commplex-main [ACK] Seq=127426 Ack=2 Win=65535 Len=1448 TSV=3746914430 TSER=3746913835
    347 0.009438    127.0.0.1             127.0.0.1             TCP      40731 > commplex-main [ACK] Seq=128874 Ack=2 Win=65535 Len=1448 TSV=3746914466 TSER=3746913846
    348 0.009458    127.0.0.1             127.0.0.1             TCP      40731 > commplex-main [ACK] Seq=130322 Ack=2 Win=65535 Len=1448 TSV=3746914501 TSER=3746913882
    349 0.009467    127.0.0.1             127.0.0.1             TCP      40731 > commplex-main [ACK] Seq=128874 Ack=2 Win=65535 Len=1448 TSV=3746914466 TSER=3746913846
    350 0.009487    127.0.0.1             127.0.0.1             TCP      40731 > commplex-main [ACK] Seq=130322 Ack=2 Win=65535 Len=1448 TSV=3746914501 TSER=3746913882
    351 0.009514    127.0.0.1             127.0.0.1             TCP      40731 > commplex-main [ACK] Seq=131770 Ack=2 Win=65535 Len=1448 TSV=3746914557 TSER=3746913920
    352 0.009537    127.0.0.1             127.0.0.1             TCP      commplex-main > 40731 [ACK] Seq=2 Ack=117290 Win=65535 Len=0 TSV=3746914571 TSER=3746914000
    353 0.009543    127.0.0.1             127.0.0.1             TCP      commplex-main > 40731 [ACK] Seq=2 Ack=118738 Win=64087 Len=0 TSV=3746914580 TSER=3746914057
    354 0.009562    127.0.0.1             127.0.0.1             TCP      40731 > commplex-main [ACK] Seq=131770 Ack=2 Win=65535 Len=1448 TSV=3746914557 TSER=3746913920
    355 0.009575    127.0.0.1             127.0.0.1             TCP      commplex-main > 40731 [ACK] Seq=2 Ack=120186 Win=62639 Len=0 TSV=3746914603 TSER=3746914116
    356 0.009581    127.0.0.1             127.0.0.1             TCP      commplex-main > 40731 [ACK] Seq=2 Ack=121634 Win=61191 Len=0 TSV=3746914621 TSER=3746914176
    357 0.009586    127.0.0.1             127.0.0.1             TCP      commplex-main > 40731 [ACK] Seq=2 Ack=123082 Win=59743 Len=0 TSV=3746914635 TSER=3746914236
    358 0.009602    127.0.0.1             127.0.0.1             TCP      commplex-main > 40731 [ACK] Seq=2 Ack=124530 Win=58295 Len=0 TSV=3746914643 TSER=3746914249
    359 0.009608    127.0.0.1             127.0.0.1             TCP      commplex-main > 40731 [ACK] Seq=2 Ack=125978 Win=56847 Len=0 TSV=3746914658 TSER=3746914306
    360 0.009618    127.0.0.1             127.0.0.1             TCP      commplex-main > 40731 [ACK] Seq=2 Ack=127426 Win=55399 Len=0 TSV=3746914666 TSER=3746914374
    361 0.009632    127.0.0.1             127.0.0.1             TCP      commplex-main > 40731 [ACK] Seq=2 Ack=128874 Win=53951 Len=0 TSV=3746914678 TSER=3746914430
    362 0.009637    127.0.0.1             127.0.0.1             TCP      commplex-main > 40731 [ACK] Seq=2 Ack=130322 Win=52503 Len=0 TSV=3746914688 TSER=3746914466
    363 0.009642    127.0.0.1             127.0.0.1             TCP      commplex-main > 40731 [ACK] Seq=2 Ack=117290 Win=65535 Len=0 TSV=3746914571 TSER=3746914000
    364 0.009655    127.0.0.1             127.0.0.1             TCP      commplex-main > 40731 [ACK] Seq=2 Ack=131770 Win=51055 Len=0 TSV=3746914699 TSER=3746914501
    365 0.009684    127.0.0.1             127.0.0.1             TCP      commplex-main > 40731 [ACK] Seq=2 Ack=133218 Win=64087 Len=0 TSV=3746914722 TSER=3746914557
    366 0.009698    127.0.0.1             127.0.0.1             TCP      commplex-main > 40731 [ACK] Seq=2 Ack=118738 Win=64087 Len=0 TSV=3746914580 TSER=3746914057
    367 0.009719    127.0.0.1             127.0.0.1             TCP      commplex-main > 40731 [ACK] Seq=2 Ack=120186 Win=62639 Len=0 TSV=3746914603 TSER=3746914116
    368 0.009749    127.0.0.1             127.0.0.1             TCP      40731 > commplex-main [ACK] Seq=133218 Ack=2 Win=65535 Len=1448 TSV=3746914783 TSER=3746914571
    369 0.009769    127.0.0.1             127.0.0.1             TCP      commplex-main > 40731 [ACK] Seq=2 Ack=121634 Win=61191 Len=0 TSV=3746914621 TSER=3746914176
    370 0.009787    127.0.0.1             127.0.0.1             TCP      commplex-main > 40731 [ACK] Seq=2 Ack=123082 Win=59743 Len=0 TSV=3746914635 TSER=3746914236
    371 0.009813    127.0.0.1             127.0.0.1             TCP      40731 > commplex-main [ACK] Seq=134666 Ack=2 Win=65535 Len=1448 TSV=3746914854 TSER=3746914580
    372 0.009818    127.0.0.1             127.0.0.1             TCP      commplex-main > 40731 [ACK] Seq=2 Ack=124530 Win=58295 Len=0 TSV=3746914643 TSER=3746914249
    373 0.009838    127.0.0.1             127.0.0.1             TCP      commplex-main > 40731 [ACK] Seq=2 Ack=125978 Win=56847 Len=0 TSV=3746914658 TSER=3746914306
    374 0.009863    127.0.0.1             127.0.0.1             TCP      40731 > commplex-main [ACK] Seq=136114 Ack=2 Win=65535 Len=1448 TSV=3746914903 TSER=3746914603
    375 0.009872    127.0.0.1             127.0.0.1             TCP      commplex-main > 40731 [ACK] Seq=2 Ack=127426 Win=55399 Len=0 TSV=3746914666 TSER=3746914374
    376 0.009889    127.0.0.1             127.0.0.1             TCP      commplex-main > 40731 [ACK] Seq=2 Ack=128874 Win=53951 Len=0 TSV=3746914678 TSER=3746914430
    377 0.009907    127.0.0.1             127.0.0.1             TCP      commplex-main > 40731 [ACK] Seq=2 Ack=130322 Win=52503 Len=0 TSV=3746914688 TSER=3746914466
    378 0.009922    127.0.0.1             127.0.0.1             TCP      40731 > commplex-main [ACK] Seq=137562 Ack=2 Win=65535 Len=1448 TSV=3746914962 TSER=3746914621
    379 0.009939    127.0.0.1             127.0.0.1             TCP      commplex-main > 40731 [ACK] Seq=2 Ack=131770 Win=51055 Len=0 TSV=3746914699 TSER=3746914501
    380 0.009964    127.0.0.1             127.0.0.1             TCP      commplex-main > 40731 [ACK] Seq=2 Ack=133218 Win=64087 Len=0 TSV=3746914722 TSER=3746914557
    381 0.009981    127.0.0.1             127.0.0.1             TCP      40731 > commplex-main [ACK] Seq=139010 Ack=2 Win=65535 Len=1448 TSV=3746915026 TSER=3746914635
    382 0.009994    127.0.0.1             127.0.0.1             TCP      40731 > commplex-main [ACK] Seq=133218 Ack=2 Win=65535 Len=1448 TSV=3746914783 TSER=3746914571
    383 0.010017    127.0.0.1             127.0.0.1             TCP      40731 > commplex-main [ACK] Seq=134666 Ack=2 Win=65535 Len=1448 TSV=3746914854 TSER=3746914580
    384 0.010035    127.0.0.1             127.0.0.1             TCP      40731 > commplex-main [ACK] Seq=140458 Ack=2 Win=65535 Len=1448 TSV=3746915077 TSER=3746914643
    385 0.010056    127.0.0.1             127.0.0.1             TCP      40731 > commplex-main [ACK] Seq=136114 Ack=2 Win=65535 Len=1448 TSV=3746914903 TSER=3746914603
    386 0.010078    127.0.0.1             127.0.0.1             TCP      40731 > commplex-main [ACK] Seq=137562 Ack=2 Win=65535 Len=1448 TSV=3746914962 TSER=3746914621
    387 0.010090    127.0.0.1             127.0.0.1             TCP      40731 > commplex-main [ACK] Seq=141906 Ack=2 Win=65535 Len=1448 TSV=3746915136 TSER=3746914658
    388 0.010096    127.0.0.1             127.0.0.1             TCP      40731 > commplex-main [ACK] Seq=143354 Ack=2 Win=65535 Len=1448 TSV=3746915143 TSER=3746914658
    389 0.010121    127.0.0.1             127.0.0.1             TCP      40731 > commplex-main [ACK] Seq=139010 Ack=2 Win=65535 Len=1448 TSV=3746915026 TSER=3746914635
    390 0.010144    127.0.0.1             127.0.0.1             TCP      40731 > commplex-main [ACK] Seq=140458 Ack=2 Win=65535 Len=1448 TSV=3746915077 TSER=3746914643
    391 0.010158    127.0.0.1             127.0.0.1             TCP      40731 > commplex-main [ACK] Seq=144802 Ack=2 Win=65535 Len=1448 TSV=3746915195 TSER=3746914666
    392 0.010172    127.0.0.1             127.0.0.1             TCP      40731 > commplex-main [ACK] Seq=141906 Ack=2 Win=65535 Len=1448 TSV=3746915136 TSER=3746914658
    393 0.010191    127.0.0.1             127.0.0.1             TCP      40731 > commplex-main [ACK] Seq=143354 Ack=2 Win=65535 Len=1448 TSV=3746915143 TSER=3746914658
    394 0.010205    127.0.0.1             127.0.0.1             TCP      40731 > commplex-main [ACK] Seq=146250 Ack=2 Win=65535 Len=1448 TSV=3746915248 TSER=3746914678
    395 0.010222    127.0.0.1             127.0.0.1             TCP      40731 > commplex-main [ACK] Seq=144802 Ack=2 Win=65535 Len=1448 TSV=3746915195 TSER=3746914666
    396 0.010248    127.0.0.1             127.0.0.1             TCP      40731 > commplex-main [ACK] Seq=146250 Ack=2 Win=65535 Len=1448 TSV=3746915248 TSER=3746914678
    397 0.010265    127.0.0.1             127.0.0.1             TCP      40731 > commplex-main [ACK] Seq=147698 Ack=2 Win=65535 Len=1448 TSV=3746915309 TSER=3746914688
    398 0.010279    127.0.0.1             127.0.0.1             TCP      40731 > commplex-main [ACK] Seq=147698 Ack=2 Win=65535 Len=1448 TSV=3746915309 TSER=3746914688
    399 0.010320    127.0.0.1             127.0.0.1             TCP      40731 > commplex-main [ACK] Seq=149146 Ack=2 Win=65535 Len=1448 TSV=3746915364 TSER=3746914699
    400 0.010346    127.0.0.1             127.0.0.1             TCP      40731 > commplex-main [ACK] Seq=149146 Ack=2 Win=65535 Len=1448 TSV=3746915364 TSER=3746914699
    401 0.010375    127.0.0.1             127.0.0.1             TCP      40731 > commplex-main [ACK] Seq=150594 Ack=2 Win=65535 Len=1448 TSV=3746915398 TSER=3746914722
    402 0.010380    127.0.0.1             127.0.0.1             TCP      commplex-main > 40731 [ACK] Seq=2 Ack=134666 Win=65535 Len=0 TSV=3746915408 TSER=3746914783
    403 0.010385    127.0.0.1             127.0.0.1             TCP      commplex-main > 40731 [ACK] Seq=2 Ack=136114 Win=64087 Len=0 TSV=3746915417 TSER=3746914854
    404 0.010390    127.0.0.1             127.0.0.1             TCP      commplex-main > 40731 [ACK] Seq=2 Ack=137562 Win=62639 Len=0 TSV=3746915441 TSER=3746914903
    405 0.010407    127.0.0.1             127.0.0.1             TCP      commplex-main > 40731 [ACK] Seq=2 Ack=139010 Win=61191 Len=0 TSV=3746915453 TSER=3746914962
    406 0.010412    127.0.0.1             127.0.0.1             TCP      commplex-main > 40731 [ACK] Seq=2 Ack=140458 Win=59743 Len=0 TSV=3746915462 TSER=3746915026
    407 0.010418    127.0.0.1             127.0.0.1             TCP      40731 > commplex-main [ACK] Seq=150594 Ack=2 Win=65535 Len=1448 TSV=3746915398 TSER=3746914722
    408 0.010443    127.0.0.1             127.0.0.1             TCP      commplex-main > 40731 [ACK] Seq=2 Ack=141906 Win=58295 Len=0 TSV=3746915476 TSER=3746915077
    409 0.010449    127.0.0.1             127.0.0.1             TCP      commplex-main > 40731 [ACK] Seq=2 Ack=143354 Win=56847 Len=0 TSV=3746915500 TSER=3746915136
    410 0.010459    127.0.0.1             127.0.0.1             TCP      commplex-main > 40731 [ACK] Seq=2 Ack=144802 Win=55399 Len=0 TSV=3746915508 TSER=3746915143
    411 0.010474    127.0.0.1             127.0.0.1             TCP      commplex-main > 40731 [ACK] Seq=2 Ack=146250 Win=53951 Len=0 TSV=3746915520 TSER=3746915195
    412 0.010479    127.0.0.1             127.0.0.1             TCP      commplex-main > 40731 [ACK] Seq=2 Ack=147698 Win=52503 Len=0 TSV=3746915529 TSER=3746915248
    413 0.010484    127.0.0.1             127.0.0.1             TCP      commplex-main > 40731 [ACK] Seq=2 Ack=134666 Win=65535 Len=0 TSV=3746915408 TSER=3746914783
    414 0.010500    127.0.0.1             127.0.0.1             TCP      commplex-main > 40731 [ACK] Seq=2 Ack=149146 Win=51055 Len=0 TSV=3746915540 TSER=3746915309
    415 0.010506    127.0.0.1             127.0.0.1             TCP      commplex-main > 40731 [ACK] Seq=2 Ack=150594 Win=49607 Len=0 TSV=3746915555 TSER=3746915364
    416 0.010541    127.0.0.1             127.0.0.1             TCP      commplex-main > 40731 [ACK] Seq=2 Ack=152042 Win=64087 Len=0 TSV=3746915571 TSER=3746915398
    417 0.010559    127.0.0.1             127.0.0.1             TCP      commplex-main > 40731 [ACK] Seq=2 Ack=136114 Win=64087 Len=0 TSV=3746915417 TSER=3746914854
    418 0.010582    127.0.0.1             127.0.0.1             TCP      commplex-main > 40731 [ACK] Seq=2 Ack=137562 Win=62639 Len=0 TSV=3746915441 TSER=3746914903
    419 0.010604    127.0.0.1             127.0.0.1             TCP      40731 > commplex-main [ACK] Seq=152042 Ack=2 Win=65535 Len=1448 TSV=3746915633 TSER=3746915408
    420 0.010623    127.0.0.1             127.0.0.1             TCP      commplex-main > 40731 [ACK] Seq=2 Ack=139010 Win=61191 Len=0 TSV=3746915453 TSER=3746914962
    421 0.010644    127.0.0.1             127.0.0.1             TCP      commplex-main > 40731 [ACK] Seq=2 Ack=140458 Win=59743 Len=0 TSV=3746915462 TSER=3746915026
    422 0.010660    127.0.0.1             127.0.0.1             TCP      40731 > commplex-main [ACK] Seq=153490 Ack=2 Win=65535 Len=1448 TSV=3746915704 TSER=3746915417
    423 0.010677    127.0.0.1             127.0.0.1             TCP      commplex-main > 40731 [ACK] Seq=2 Ack=141906 Win=58295 Len=0 TSV=3746915476 TSER=3746915077
    424 0.010702    127.0.0.1             127.0.0.1             TCP      commplex-main > 40731 [ACK] Seq=2 Ack=143354 Win=56847 Len=0 TSV=3746915500 TSER=3746915136
    425 0.010717    127.0.0.1             127.0.0.1             TCP      40731 > commplex-main [ACK] Seq=154938 Ack=2 Win=65535 Len=1448 TSV=3746915762 TSER=3746915441
    426 0.010731    127.0.0.1             127.0.0.1             TCP      commplex-main > 40731 [ACK] Seq=2 Ack=144802 Win=55399 Len=0 TSV=3746915508 TSER=3746915143
    427 0.010754    127.0.0.1             127.0.0.1             TCP      commplex-main > 40731 [ACK] Seq=2 Ack=146250 Win=53951 Len=0 TSV=3746915520 TSER=3746915195
    428 0.010772    127.0.0.1             127.0.0.1             TCP      40731 > commplex-main [ACK] Seq=156386 Ack=2 Win=65535 Len=1448 TSV=3746915814 TSER=3746915453
    429 0.010791    127.0.0.1             127.0.0.1             TCP      commplex-main > 40731 [ACK] Seq=2 Ack=147698 Win=52503 Len=0 TSV=3746915529 TSER=3746915248
    430 0.010816    127.0.0.1             127.0.0.1             TCP      commplex-main > 40731 [ACK] Seq=2 Ack=149146 Win=51055 Len=0 TSV=3746915540 TSER=3746915309
    431 0.010832    127.0.0.1             127.0.0.1             TCP      40731 > commplex-main [ACK] Seq=157834 Ack=2 Win=65535 Len=1448 TSV=3746915868 TSER=3746915462
    432 0.010846    127.0.0.1             127.0.0.1             TCP      commplex-main > 40731 [ACK] Seq=2 Ack=150594 Win=49607 Len=0 TSV=3746915555 TSER=3746915364
    433 0.010867    127.0.0.1             127.0.0.1             TCP      commplex-main > 40731 [ACK] Seq=2 Ack=152042 Win=64087 Len=0 TSV=3746915571 TSER=3746915398
    434 0.010881    127.0.0.1             127.0.0.1             TCP      40731 > commplex-main [ACK] Seq=159282 Ack=2 Win=65535 Len=1448 TSV=3746915926 TSER=3746915476
    435 0.010899    127.0.0.1             127.0.0.1             TCP      40731 > commplex-main [ACK] Seq=152042 Ack=2 Win=65535 Len=1448 TSV=3746915633 TSER=3746915408
    436 0.010925    127.0.0.1             127.0.0.1             TCP      40731 > commplex-main [ACK] Seq=153490 Ack=2 Win=65535 Len=1448 TSV=3746915704 TSER=3746915417
    437 0.010939    127.0.0.1             127.0.0.1             TCP      40731 > commplex-main [ACK] Seq=160730 Ack=2 Win=65535 Len=1448 TSV=3746915985 TSER=3746915500
    438 0.010953    127.0.0.1             127.0.0.1             TCP      40731 > commplex-main [ACK] Seq=154938 Ack=2 Win=65535 Len=1448 TSV=3746915762 TSER=3746915441
    439 0.010980    127.0.0.1             127.0.0.1             TCP      40731 > commplex-main [ACK] Seq=156386 Ack=2 Win=65535 Len=1448 TSV=3746915814 TSER=3746915453
    440 0.010996    127.0.0.1             127.0.0.1             TCP      40731 > commplex-main [ACK] Seq=162178 Ack=2 Win=65535 Len=1448 TSV=3746916041 TSER=3746915508
    441 0.011002    127.0.0.1             127.0.0.1             TCP      40731 > commplex-main [ACK] Seq=163626 Ack=2 Win=65535 Len=1448 TSV=3746916049 TSER=3746915508
    442 0.011013    127.0.0.1             127.0.0.1             TCP      40731 > commplex-main [ACK] Seq=157834 Ack=2 Win=65535 Len=1448 TSV=3746915868 TSER=3746915462
    443 0.011036    127.0.0.1             127.0.0.1             TCP      40731 > commplex-main [ACK] Seq=159282 Ack=2 Win=65535 Len=1448 TSV=3746915926 TSER=3746915476
    444 0.011053    127.0.0.1             127.0.0.1             TCP      40731 > commplex-main [ACK] Seq=165074 Ack=2 Win=65535 Len=1448 TSV=3746916096 TSER=3746915520
    445 0.011070    127.0.0.1             127.0.0.1             TCP      40731 > commplex-main [ACK] Seq=160730 Ack=2 Win=65535 Len=1448 TSV=3746915985 TSER=3746915500
    446 0.011096    127.0.0.1             127.0.0.1             TCP      40731 > commplex-main [ACK] Seq=162178 Ack=2 Win=65535 Len=1448 TSV=3746916041 TSER=3746915508
    447 0.011111    127.0.0.1             127.0.0.1             TCP      40731 > commplex-main [ACK] Seq=166522 Ack=2 Win=65535 Len=1448 TSV=3746916155 TSER=3746915529
    448 0.011125    127.0.0.1             127.0.0.1             TCP      40731 > commplex-main [ACK] Seq=163626 Ack=2 Win=65535 Len=1448 TSV=3746916049 TSER=3746915508
    449 0.011150    127.0.0.1             127.0.0.1             TCP      40731 > commplex-main [ACK] Seq=165074 Ack=2 Win=65535 Len=1448 TSV=3746916096 TSER=3746915520
    450 0.011167    127.0.0.1             127.0.0.1             TCP      40731 > commplex-main [ACK] Seq=167970 Ack=2 Win=65535 Len=1448 TSV=3746916211 TSER=3746915540
    451 0.011184    127.0.0.1             127.0.0.1             TCP      40731 > commplex-main [ACK] Seq=166522 Ack=2 Win=65535 Len=1448 TSV=3746916155 TSER=3746915529
    452 0.011209    127.0.0.1             127.0.0.1             TCP      40731 > commplex-main [ACK] Seq=167970 Ack=2 Win=65535 Len=1448 TSV=3746916211 TSER=3746915540
    453 0.011222    127.0.0.1             127.0.0.1             TCP      40731 > commplex-main [ACK] Seq=169418 Ack=2 Win=65535 Len=1448 TSV=3746916268 TSER=3746915555
    454 0.011236    127.0.0.1             127.0.0.1             TCP      40731 > commplex-main [ACK] Seq=169418 Ack=2 Win=65535 Len=1448 TSV=3746916268 TSER=3746915555
    455 0.011277    127.0.0.1             127.0.0.1             TCP      40731 > commplex-main [ACK] Seq=170866 Ack=2 Win=65535 Len=1448 TSV=3746916320 TSER=3746915571
    456 0.011314    127.0.0.1             127.0.0.1             TCP      commplex-main > 40731 [ACK] Seq=2 Ack=153490 Win=65535 Len=0 TSV=3746916331 TSER=3746915633
    457 0.011326    127.0.0.1             127.0.0.1             TCP      commplex-main > 40731 [ACK] Seq=2 Ack=154938 Win=64087 Len=0 TSV=3746916339 TSER=3746915704
    458 0.011332    127.0.0.1             127.0.0.1             TCP      commplex-main > 40731 [ACK] Seq=2 Ack=156386 Win=62639 Len=0 TSV=3746916343 TSER=3746915762
    459 0.011337    127.0.0.1             127.0.0.1             TCP      commplex-main > 40731 [ACK] Seq=2 Ack=157834 Win=61191 Len=0 TSV=3746916366 TSER=3746915814
    460 0.011341    127.0.0.1             127.0.0.1             TCP      commplex-main > 40731 [ACK] Seq=2 Ack=159282 Win=59743 Len=0 TSV=3746916378 TSER=3746915868
    461 0.011346    127.0.0.1             127.0.0.1             TCP      commplex-main > 40731 [ACK] Seq=2 Ack=160730 Win=58295 Len=0 TSV=3746916389 TSER=3746915926
    462 0.011351    127.0.0.1             127.0.0.1             TCP      commplex-main > 40731 [ACK] Seq=2 Ack=162178 Win=56847 Len=0 TSV=3746916397 TSER=3746915985
    463 0.011435    127.0.0.1             127.0.0.1             TCP      commplex-main > 40731 [ACK] Seq=2 Ack=163626 Win=55399 Len=0 TSV=3746916408 TSER=3746916041
    464 0.011441    127.0.0.1             127.0.0.1             TCP      commplex-main > 40731 [ACK] Seq=2 Ack=165074 Win=53951 Len=0 TSV=3746916418 TSER=3746916049
    465 0.011446    127.0.0.1             127.0.0.1             TCP      commplex-main > 40731 [ACK] Seq=2 Ack=166522 Win=52503 Len=0 TSV=3746916430 TSER=3746916096
    466 0.011450    127.0.0.1             127.0.0.1             TCP      commplex-main > 40731 [ACK] Seq=2 Ack=167970 Win=51055 Len=0 TSV=3746916438 TSER=3746916155
    467 0.011455    127.0.0.1             127.0.0.1             TCP      commplex-main > 40731 [ACK] Seq=2 Ack=169418 Win=49607 Len=0 TSV=3746916453 TSER=3746916211
    468 0.011459    127.0.0.1             127.0.0.1             TCP      commplex-main > 40731 [ACK] Seq=2 Ack=170866 Win=48159 Len=0 TSV=3746916461 TSER=3746916268
    469 0.011472    127.0.0.1             127.0.0.1             TCP      40731 > commplex-main [ACK] Seq=170866 Ack=2 Win=65535 Len=1448 TSV=3746916320 TSER=3746915571
    470 0.011510    127.0.0.1             127.0.0.1             TCP      commplex-main > 40731 [ACK] Seq=2 Ack=172314 Win=65535 Len=0 TSV=3746916551 TSER=3746916320
    471 0.011592    127.0.0.1             127.0.0.1             TCP      commplex-main > 40731 [ACK] Seq=2 Ack=153490 Win=65535 Len=0 TSV=3746916331 TSER=3746915633
    472 0.011602    127.0.0.1             127.0.0.1             TCP      commplex-main > 40731 [ACK] Seq=2 Ack=154938 Win=64087 Len=0 TSV=3746916339 TSER=3746915704
    473 0.011612    127.0.0.1             127.0.0.1             TCP      commplex-main > 40731 [ACK] Seq=2 Ack=156386 Win=62639 Len=0 TSV=3746916343 TSER=3746915762
    474 0.011618    127.0.0.1             127.0.0.1             TCP      commplex-main > 40731 [ACK] Seq=2 Ack=157834 Win=61191 Len=0 TSV=3746916366 TSER=3746915814
    475 0.011627    127.0.0.1             127.0.0.1             TCP      commplex-main > 40731 [ACK] Seq=2 Ack=159282 Win=59743 Len=0 TSV=3746916378 TSER=3746915868
    476 0.011634    127.0.0.1             127.0.0.1             TCP      commplex-main > 40731 [ACK] Seq=2 Ack=160730 Win=58295 Len=0 TSV=3746916389 TSER=3746915926
    477 0.011643    127.0.0.1             127.0.0.1             TCP      commplex-main > 40731 [ACK] Seq=2 Ack=162178 Win=56847 Len=0 TSV=3746916397 TSER=3746915985
    478 0.011649    127.0.0.1             127.0.0.1             TCP      commplex-main > 40731 [ACK] Seq=2 Ack=163626 Win=55399 Len=0 TSV=3746916408 TSER=3746916041
    479 0.011658    127.0.0.1             127.0.0.1             TCP      commplex-main > 40731 [ACK] Seq=2 Ack=165074 Win=53951 Len=0 TSV=3746916418 TSER=3746916049
    480 0.011664    127.0.0.1             127.0.0.1             TCP      commplex-main > 40731 [ACK] Seq=2 Ack=166522 Win=52503 Len=0 TSV=3746916430 TSER=3746916096
    481 0.011672    127.0.0.1             127.0.0.1             TCP      commplex-main > 40731 [ACK] Seq=2 Ack=167970 Win=51055 Len=0 TSV=3746916438 TSER=3746916155
    482 0.011678    127.0.0.1             127.0.0.1             TCP      commplex-main > 40731 [ACK] Seq=2 Ack=169418 Win=49607 Len=0 TSV=3746916453 TSER=3746916211
    483 0.011687    127.0.0.1             127.0.0.1             TCP      commplex-main > 40731 [ACK] Seq=2 Ack=170866 Win=48159 Len=0 TSV=3746916461 TSER=3746916268
    484 0.011694    127.0.0.1             127.0.0.1             TCP      commplex-main > 40731 [ACK] Seq=2 Ack=172314 Win=65535 Len=0 TSV=3746916551 TSER=3746916320
    485 0.011753    127.0.0.1             127.0.0.1             TCP      40731 > commplex-main [ACK] Seq=172314 Ack=2 Win=65535 Len=1448 TSV=3746916795 TSER=3746916331
    486 0.011785    127.0.0.1             127.0.0.1             TCP      40731 > commplex-main [ACK] Seq=172314 Ack=2 Win=65535 Len=1448 TSV=3746916795 TSER=3746916331
    487 0.011804    127.0.0.1             127.0.0.1             TCP      40731 > commplex-main [ACK] Seq=173762 Ack=2 Win=65535 Len=1448 TSV=3746916845 TSER=3746916339
    488 0.011831    127.0.0.1             127.0.0.1             TCP      40731 > commplex-main [ACK] Seq=173762 Ack=2 Win=65535 Len=1448 TSV=3746916845 TSER=3746916339
    489 0.011849    127.0.0.1             127.0.0.1             TCP      40731 > commplex-main [ACK] Seq=175210 Ack=2 Win=65535 Len=1448 TSV=3746916884 TSER=3746916343
    490 0.011862    127.0.0.1             127.0.0.1             TCP      40731 > commplex-main [ACK] Seq=175210 Ack=2 Win=65535 Len=1448 TSV=3746916884 TSER=3746916343
    491 0.011881    127.0.0.1             127.0.0.1             TCP      40731 > commplex-main [ACK] Seq=176658 Ack=2 Win=65535 Len=1448 TSV=3746916926 TSER=3746916366
    492 0.011905    127.0.0.1             127.0.0.1             TCP      40731 > commplex-main [ACK] Seq=176658 Ack=2 Win=65535 Len=1448 TSV=3746916926 TSER=3746916366
    493 0.011925    127.0.0.1             127.0.0.1             TCP      40731 > commplex-main [ACK] Seq=178106 Ack=2 Win=65535 Len=1448 TSV=3746916968 TSER=3746916378
    494 0.011951    127.0.0.1             127.0.0.1             TCP      40731 > commplex-main [ACK] Seq=178106 Ack=2 Win=65535 Len=1448 TSV=3746916968 TSER=3746916378
    495 0.011965    127.0.0.1             127.0.0.1             TCP      40731 > commplex-main [ACK] Seq=179554 Ack=2 Win=65535 Len=1448 TSV=3746917009 TSER=3746916389
    496 0.011994    127.0.0.1             127.0.0.1             TCP      40731 > commplex-main [ACK] Seq=179554 Ack=2 Win=65535 Len=1448 TSV=3746917009 TSER=3746916389
    497 0.012012    127.0.0.1             127.0.0.1             TCP      40731 > commplex-main [ACK] Seq=181002 Ack=2 Win=65535 Len=1448 TSV=3746917047 TSER=3746916397
    498 0.012031    127.0.0.1             127.0.0.1             TCP      40731 > commplex-main [ACK] Seq=181002 Ack=2 Win=65535 Len=1448 TSV=3746917047 TSER=3746916397
    499 0.012048    127.0.0.1             127.0.0.1             TCP      40731 > commplex-main [ACK] Seq=182450 Ack=2 Win=65535 Len=1448 TSV=3746917091 TSER=3746916408
    500 0.012069    127.0.0.1             127.0.0.1             TCP      40731 > commplex-main [ACK] Seq=182450 Ack=2 Win=65535 Len=1448 TSV=3746917091 TSER=3746916408
    501 0.012090    127.0.0.1             127.0.0.1             TCP      40731 > commplex-main [ACK] Seq=183898 Ack=2 Win=65535 Len=1448 TSV=3746917134 TSER=3746916418
    502 0.012113    127.0.0.1             127.0.0.1             TCP      40731 > commplex-main [ACK] Seq=183898 Ack=2 Win=65535 Len=1448 TSV=3746917134 TSER=3746916418
    503 0.012132    127.0.0.1             127.0.0.1             TCP      40731 > commplex-main [ACK] Seq=185346 Ack=2 Win=65535 Len=1448 TSV=3746917177 TSER=3746916430
    504 0.012151    127.0.0.1             127.0.0.1             TCP      40731 > commplex-main [ACK] Seq=186794 Ack=2 Win=65535 Len=1448 TSV=3746917180 TSER=3746916430
    505 0.012174    127.0.0.1             127.0.0.1             TCP      40731 > commplex-main [ACK] Seq=185346 Ack=2 Win=65535 Len=1448 TSV=3746917177 TSER=3746916430
    506 0.012187    127.0.0.1             127.0.0.1             TCP      40731 > commplex-main [ACK] Seq=188242 Ack=2 Win=65535 Len=1448 TSV=3746917230 TSER=3746916438
    507 0.012213    127.0.0.1             127.0.0.1             TCP      40731 > commplex-main [ACK] Seq=186794 Ack=2 Win=65535 Len=1448 TSV=3746917180 TSER=3746916430
    508 0.012237    127.0.0.1             127.0.0.1             TCP      40731 > commplex-main [ACK] Seq=189690 Ack=2 Win=65535 Len=1448 TSV=3746917272 TSER=3746916453
    509 0.012245    127.0.0.1             127.0.0.1             TCP      40731 > commplex-main [ACK] Seq=188242 Ack=2 Win=65535 Len=1448 TSV=3746917230 TSER=3746916438
    510 0.012272    127.0.0.1             127.0.0.1             TCP      40731 > commplex-main [ACK] Seq=191138 Ack=2 Win=65535 Len=1448 TSV=3746917318 TSER=3746916461
    511 0.012290    127.0.0.1             127.0.0.1             TCP      40731 > commplex-main [ACK] Seq=189690 Ack=2 Win=65535 Len=1448 TSV=3746917272 TSER=3746916453
    512 0.012327    127.0.0.1             127.0.0.1             TCP      40731 > commplex-main [ACK] Seq=191138 Ack=2 Win=65535 Len=1448 TSV=3746917318 TSER=3746916461
    513 0.012340    127.0.0.1             127.0.0.1             TCP      40731 > commplex-main [ACK] Seq=192586 Ack=2 Win=65535 Len=1448 TSV=3746917354 TSER=3746916551
    514 0.012358    127.0.0.1             127.0.0.1             TCP      commplex-main > 40731 [ACK] Seq=2 Ack=173762 Win=65535 Len=0 TSV=3746917403 TSER=3746916795
    515 0.012368    127.0.0.1             127.0.0.1             TCP      40731 > commplex-main [ACK] Seq=192586 Ack=2 Win=65535 Len=1448 TSV=3746917354 TSER=3746916551
    516 0.012384    127.0.0.1             127.0.0.1             TCP      commplex-main > 40731 [ACK] Seq=2 Ack=175210 Win=64087 Len=0 TSV=3746917432 TSER=3746916845
    517 0.012391    127.0.0.1             127.0.0.1             TCP      commplex-main > 40731 [ACK] Seq=2 Ack=173762 Win=65535 Len=0 TSV=3746917403 TSER=3746916795
    518 0.012404    127.0.0.1             127.0.0.1             TCP      commplex-main > 40731 [ACK] Seq=2 Ack=176658 Win=62639 Len=0 TSV=3746917452 TSER=3746916884
    519 0.012416    127.0.0.1             127.0.0.1             TCP      commplex-main > 40731 [ACK] Seq=2 Ack=175210 Win=64087 Len=0 TSV=3746917432 TSER=3746916845
    520 0.012432    127.0.0.1             127.0.0.1             TCP      commplex-main > 40731 [ACK] Seq=2 Ack=178106 Win=61191 Len=0 TSV=3746917479 TSER=3746916926
    521 0.012440    127.0.0.1             127.0.0.1             TCP      commplex-main > 40731 [ACK] Seq=2 Ack=176658 Win=62639 Len=0 TSV=3746917452 TSER=3746916884
    522 0.012452    127.0.0.1             127.0.0.1             TCP      commplex-main > 40731 [ACK] Seq=2 Ack=179554 Win=59743 Len=0 TSV=3746917500 TSER=3746916968
    523 0.012461    127.0.0.1             127.0.0.1             TCP      commplex-main > 40731 [ACK] Seq=2 Ack=178106 Win=61191 Len=0 TSV=3746917479 TSER=3746916926
    524 0.012477    127.0.0.1             127.0.0.1             TCP      commplex-main > 40731 [ACK] Seq=2 Ack=181002 Win=58295 Len=0 TSV=3746917524 TSER=3746917009
    525 0.012484    127.0.0.1             127.0.0.1             TCP      commplex-main > 40731 [ACK] Seq=2 Ack=179554 Win=59743 Len=0 TSV=3746917500 TSER=3746916968
    526 0.012497    127.0.0.1             127.0.0.1             TCP      commplex-main > 40731 [ACK] Seq=2 Ack=182450 Win=56847 Len=0 TSV=3746917546 TSER=3746917047
    527 0.012507    127.0.0.1             127.0.0.1             TCP      commplex-main > 40731 [ACK] Seq=2 Ack=181002 Win=58295 Len=0 TSV=3746917524 TSER=3746917009
    528 0.012523    127.0.0.1             127.0.0.1             TCP      commplex-main > 40731 [ACK] Seq=2 Ack=183898 Win=55399 Len=0 TSV=3746917570 TSER=3746917091
    529 0.012530    127.0.0.1             127.0.0.1             TCP      commplex-main > 40731 [ACK] Seq=2 Ack=182450 Win=56847 Len=0 TSV=3746917546 TSER=3746917047
    530 0.012543    127.0.0.1             127.0.0.1             TCP      commplex-main > 40731 [ACK] Seq=2 Ack=185346 Win=53951 Len=0 TSV=3746917591 TSER=3746917134
    531 0.012553    127.0.0.1             127.0.0.1             TCP      commplex-main > 40731 [ACK] Seq=2 Ack=183898 Win=55399 Len=0 TSV=3746917570 TSER=3746917091
    532 0.012568    127.0.0.1             127.0.0.1             TCP      commplex-main > 40731 [ACK] Seq=2 Ack=186794 Win=52503 Len=0 TSV=3746917616 TSER=3746917177
    533 0.012575    127.0.0.1             127.0.0.1             TCP      commplex-main > 40731 [ACK] Seq=2 Ack=185346 Win=53951 Len=0 TSV=3746917591 TSER=3746917134
    534 0.012589    127.0.0.1             127.0.0.1             TCP      commplex-main > 40731 [ACK] Seq=2 Ack=188242 Win=51055 Len=0 TSV=3746917637 TSER=3746917180
    535 0.012598    127.0.0.1             127.0.0.1             TCP      commplex-main > 40731 [ACK] Seq=2 Ack=186794 Win=52503 Len=0 TSV=3746917616 TSER=3746917177
    536 0.012614    127.0.0.1             127.0.0.1             TCP      commplex-main > 40731 [ACK] Seq=2 Ack=189690 Win=49607 Len=0 TSV=3746917662 TSER=3746917230
    537 0.012627    127.0.0.1             127.0.0.1             TCP      commplex-main > 40731 [ACK] Seq=2 Ack=188242 Win=51055 Len=0 TSV=3746917637 TSER=3746917180
    538 0.012643    127.0.0.1             127.0.0.1             TCP      commplex-main > 40731 [ACK] Seq=2 Ack=191138 Win=48159 Len=0 TSV=3746917691 TSER=3746917272
    539 0.012649    127.0.0.1             127.0.0.1             TCP      commplex-main > 40731 [ACK] Seq=2 Ack=189690 Win=49607 Len=0 TSV=3746917662 TSER=3746917230
    540 0.012667    127.0.0.1             127.0.0.1             TCP      commplex-main > 40731 [ACK] Seq=2 Ack=191138 Win=48159 Len=0 TSV=3746917691 TSER=3746917272
    541 0.012701    127.0.0.1             127.0.0.1             TCP      commplex-main > 40731 [ACK] Seq=2 Ack=192586 Win=64087 Len=0 TSV=3746917746 TSER=3746917318
    542 0.012716    127.0.0.1             127.0.0.1             TCP      commplex-main > 40731 [ACK] Seq=2 Ack=192586 Win=64087 Len=0 TSV=3746917746 TSER=3746917318
    543 0.012719    127.0.0.1             127.0.0.1             TCP      commplex-main > 40731 [ACK] Seq=2 Ack=194034 Win=62639 Len=0 TSV=3746917768 TSER=3746917354
    544 0.012738    127.0.0.1             127.0.0.1             TCP      commplex-main > 40731 [ACK] Seq=2 Ack=194034 Win=62639 Len=0 TSV=3746917768 TSER=3746917354
    545 0.012788    127.0.0.1             127.0.0.1             TCP      40731 > commplex-main [ACK] Seq=194034 Ack=2 Win=65535 Len=1448 TSV=3746917830 TSER=3746917403
    546 0.012816    127.0.0.1             127.0.0.1             TCP      40731 > commplex-main [ACK] Seq=194034 Ack=2 Win=65535 Len=1448 TSV=3746917830 TSER=3746917403
    547 0.012833    127.0.0.1             127.0.0.1             TCP      40731 > commplex-main [ACK] Seq=195482 Ack=2 Win=65535 Len=1448 TSV=3746917876 TSER=3746917432
    548 0.012853    127.0.0.1             127.0.0.1             TCP      40731 > commplex-main [ACK] Seq=195482 Ack=2 Win=65535 Len=1448 TSV=3746917876 TSER=3746917432
    549 0.012871    127.0.0.1             127.0.0.1             TCP      40731 > commplex-main [ACK] Seq=196930 Ack=2 Win=65535 Len=1448 TSV=3746917916 TSER=3746917452
    550 0.012901    127.0.0.1             127.0.0.1             TCP      40731 > commplex-main [ACK] Seq=196930 Ack=2 Win=65535 Len=1448 TSV=3746917916 TSER=3746917452
    551 0.012920    127.0.0.1             127.0.0.1             TCP      40731 > commplex-main [ACK] Seq=198378 Ack=2 Win=65535 Len=1448 TSV=3746917962 TSER=3746917479
    552 0.012948    127.0.0.1             127.0.0.1             TCP      40731 > commplex-main [ACK] Seq=198378 Ack=2 Win=65535 Len=1448 TSV=3746917962 TSER=3746917479
    553 0.012962    127.0.0.1             127.0.0.1             TCP      40731 > commplex-main [ACK] Seq=199826 Ack=2 Win=65535 Len=176 TSV=3746918007 TSER=3746917500
    554 0.012983    127.0.0.1             127.0.0.1             TCP      40731 > commplex-main [ACK] Seq=199826 Ack=2 Win=65535 Len=176 TSV=3746918007 TSER=3746917500
    555 0.013178    127.0.0.1             127.0.0.1             TCP      commplex-main > 40731 [ACK] Seq=2 Ack=195482 Win=64087 Len=0 TSV=3746918221 TSER=3746917830
    556 0.013206    127.0.0.1             127.0.0.1             TCP      commplex-main > 40731 [ACK] Seq=2 Ack=195482 Win=64087 Len=0 TSV=3746918221 TSER=3746917830
    557 0.013209    127.0.0.1             127.0.0.1             TCP      commplex-main > 40731 [ACK] Seq=2 Ack=196930 Win=62639 Len=0 TSV=3746918240 TSER=3746917876
    558 0.013215    127.0.0.1             127.0.0.1             TCP      commplex-main > 40731 [ACK] Seq=2 Ack=198378 Win=61191 Len=0 TSV=3746918258 TSER=3746917916
    559 0.013239    127.0.0.1             127.0.0.1             TCP      commplex-main > 40731 [ACK] Seq=2 Ack=199826 Win=59743 Len=0 TSV=3746918284 TSER=3746917962
    560 0.013254    127.0.0.1             127.0.0.1             TCP      commplex-main > 40731 [ACK] Seq=2 Ack=200002 Win=59567 Len=0 TSV=3746918290 TSER=3746918007
    561 0.013293    127.0.0.1             127.0.0.1             TCP      commplex-main > 40731 [ACK] Seq=2 Ack=196930 Win=62639 Len=0 TSV=3746918240 TSER=3746917876
    562 0.013306    127.0.0.1             127.0.0.1             TCP      commplex-main > 40731 [ACK] Seq=2 Ack=198378 Win=61191 Len=0 TSV=3746918258 TSER=3746917916
    563 0.013334    127.0.0.1             127.0.0.1             TCP      commplex-main > 40731 [ACK] Seq=2 Ack=199826 Win=59743 Len=0 TSV=3746918284 TSER=3746917962
    564 0.013380    127.0.0.1             127.0.0.1             TCP      commplex-main > 40731 [ACK] Seq=2 Ack=200002 Win=59567 Len=0 TSV=3746918290 TSER=3746918007
    565 0.013447    127.0.0.1             127.0.0.1             TCP      40731 > commplex-main [FIN, ACK] Seq=200002 Ack=2 Win=65535 Len=0 TSV=3746918488 TSER=3746918290
    566 0.013459    127.0.0.1             127.0.0.1             TCP      40731 > commplex-main [FIN, ACK] Seq=200002 Ack=2 Win=65535 Len=0 TSV=3746918488 TSER=3746918290
    567 0.013506    127.0.0.1             127.0.0.1             TCP      commplex-main > 40731 [ACK] Seq=2 Ack=200003 Win=65535 Len=0 TSV=3746918541 TSER=3746918488
    568 0.013553    127.0.0.1             127.0.0.1             TCP      commplex-main > 40731 [FIN, ACK] Seq=2 Ack=200003 Win=65535 Len=0 TSV=3746918574 TSER=3746918488
    569 0.013574    127.0.0.1             127.0.0.1             TCP      commplex-main > 40731 [ACK] Seq=2 Ack=200003 Win=65535 Len=0 TSV=3746918541 TSER=3746918488
    570 0.013681    127.0.0.1             127.0.0.1             TCP      commplex-main > 40731 [FIN, ACK] Seq=2 Ack=200003 Win=65535 Len=0 TSV=3746918574 TSER=3746918488
    571 0.013723    127.0.0.1             127.0.0.1             TCP      40731 > commplex-main [ACK] Seq=200003 Ack=3 Win=65535 Len=0 TSV=3746918764 TSER=3746918574
    572 0.013735    127.0.0.1             127.0.0.1             TCP      40731 > commplex-main [ACK] Seq=200003 Ack=3 Win=65535 Len=0 TSV=3746918764 TSER=3746918574
