No.     Time        Source                Destination           Protocol Info
      1 0.000000    127.0.0.1             127.0.0.1             TCP      59394 > commplex-main [SYN] Seq=1 Win=65535 Len=0 TSV=3229367696 TSER=0
      2 0.000004    127.0.0.1             127.0.0.1             TCP      59394 > commplex-main [SYN] Seq=1 Win=65535 Len=0 TSV=3229367696 TSER=0
      3 0.000096    127.0.0.1             127.0.0.1             TCP      commplex-main > 59394 [SYN, ACK] Seq=1 Ack=2 Win=65535 Len=0 TSV=3229367815 TSER=3229367696
      4 0.000099    127.0.0.1             127.0.0.1             TCP      commplex-main > 59394 [SYN, ACK] Seq=1 Ack=2 Win=65535 Len=0 TSV=3229367815 TSER=3229367696
      5 0.000148    127.0.0.1             127.0.0.1             TCP      59394 > commplex-main [ACK] Seq=2 Ack=2 Win=65535 Len=0 TSV=3229367876 TSER=3229367815
      6 0.000152    127.0.0.1             127.0.0.1             TCP      59394 > commplex-main [ACK] Seq=2 Ack=2 Win=65535 Len=0 TSV=3229367876 TSER=3229367815
      7 0.000323    127.0.0.1             127.0.0.1             TCP      59394 > commplex-main [ACK] Seq=2 Ack=2 Win=65535 Len=1448 TSV=3229368047 TSER=3229367815
      8 0.000327    127.0.0.1             127.0.0.1             TCP      59394 > commplex-main [ACK] Seq=2 Ack=2 Win=65535 Len=1448 TSV=3229368047 TSER=3229367815
      9 0.000383    127.0.0.1             127.0.0.1             TCP      commplex-main > 59394 [ACK] Seq=2 Ack=1450 Win=65535 Len=0 TSV=3229368097 TSER=3229368047
     10 0.000387    127.0.0.1             127.0.0.1             TCP      commplex-main > 59394 [ACK] Seq=2 Ack=1450 Win=65535 Len=0 TSV=3229368097 TSER=3229368047
     11 0.000502    127.0.0.1             127.0.0.1             TCP      59394 > commplex-main [ACK] Seq=1450 Ack=2 Win=65535 Len=1448 TSV=3229368183 TSER=3229368097
     12 0.000510    127.0.0.1             127.0.0.1             TCP      59394 > commplex-main [ACK] Seq=2898 Ack=2 Win=65535 Len=1448 TSV=3229368186 TSER=3229368097
     13 0.000520    127.0.0.1             127.0.0.1             TCP      59394 > commplex-main [ACK] Seq=1450 Ack=2 Win=65535 Len=1448 TSV=3229368183 TSER=3229368097
     14 0.000529    127.0.0.1             127.0.0.1             TCP      59394 > commplex-main [ACK] Seq=2898 Ack=2 Win=65535 Len=1448 TSV=3229368186 TSER=3229368097
     15 0.000608    127.0.0.1             127.0.0.1             TCP      commplex-main > 59394 [ACK] Seq=2 Ack=2898 Win=65535 Len=0 TSV=3229368316 TSER=3229368183
     16 0.000615    127.0.0.1             127.0.0.1             TCP      commplex-main > 59394 [ACK] Seq=2 Ack=4346 Win=64087 Len=0 TSV=3229368321 TSER=3229368186
     17 0.000623    127.0.0.1             127.0.0.1             TCP      commplex-main > 59394 [ACK] Seq=2 Ack=2898 Win=65535 Len=0 TSV=3229368316 TSER=3229368183
     18 0.000631    127.0.0.1             127.0.0.1             TCP      commplex-main > 59394 [ACK] Seq=2 Ack=4346 Win=64087 Len=0 TSV=3229368321 TSER=3229368186
     19 0.000742    127.0.0.1             127.0.0.1             TCP      59394 > commplex-main [ACK] Seq=4346 Ack=2 Win=65535 Len=1448 TSV=3229368423 TSER=3229368316
     20 0.000749    127.0.0.1             127.0.0.1             TCP      59394 > commplex-main [ACK] Seq=5794 Ack=2 Win=65535 Len=1448 TSV=3229368427 TSER=3229368316
     21 0.000756    127.0.0.1             127.0.0.1             TCP      59394 > commplex-main [ACK] Seq=7242 Ack=2 Win=65535 Len=1448 TSV=3229368461 TSER=3229368321
     22 0.000762    127.0.0.1             127.0.0.1             TCP      59394 > commplex-main [ACK] Seq=8690 Ack=2 Win=65535 Len=1448 TSV=3229368465 TSER=3229368321
     23 0.000770    127.0.0.1             127.0.0.1             TCP      59394 > commplex-main [ACK] Seq=4346 Ack=2 Win=65535 Len=1448 TSV=3229368423 TSER=3229368316
     24 0.000780    127.0.0.1             127.0.0.1             TCP      59394 > commplex-main [ACK] Seq=5794 Ack=2 Win=65535 Len=1448 TSV=3229368427 TSER=3229368316
     25 0.000788    127.0.0.1             127.0.0.1             TCP      59394 > commplex-main [ACK] Seq=7242 Ack=2 Win=65535 Len=1448 TSV=3229368461 TSER=3229368321
     26 0.000795    127.0.0.1             127.0.0.1             TCP      59394 > commplex-main [ACK] Seq=8690 Ack=2 Win=65535 Len=1448 TSV=3229368465 TSER=3229368321
     27 0.000854    127.0.0.1             127.0.0.1             TCP      commplex-main > 59394 [ACK] Seq=2 Ack=5794 Win=65535 Len=0 TSV=3229368559 TSER=3229368423
     28 0.000861    127.0.0.1             127.0.0.1             TCP      commplex-main > 59394 [ACK] Seq=2 Ack=7242 Win=64087 Len=0 TSV=3229368565 TSER=3229368427
     29 0.000867    127.0.0.1             127.0.0.1             TCP      commplex-main > 59394 [ACK] Seq=2 Ack=8690 Win=62639 Len=0 TSV=3229368572 TSER=3229368461
     30 0.000873    127.0.0.1             127.0.0.1             TCP      commplex-main > 59394 [ACK] Seq=2 Ack=10138 Win=61191 Len=0 TSV=3229368582 TSER=3229368465
     31 0.000881    127.0.0.1             127.0.0.1             TCP      commplex-main > 59394 [ACK] Seq=2 Ack=5794 Win=65535 Len=0 TSV=3229368559 TSER=3229368423
     32 0.000889    127.0.0.1             127.0.0.1             TCP      commplex-main > 59394 [ACK] Seq=2 Ack=7242 Win=64087 Len=0 TSV=3229368565 TSER=3229368427
     33 0.000898    127.0.0.1             127.0.0.1             TCP      commplex-main > 59394 [ACK] Seq=2 Ack=8690 Win=62639 Len=0 TSV=3229368572 TSER=3229368461
     34 0.000905    127.0.0.1             127.0.0.1             TCP      commplex-main > 59394 [ACK] Seq=2 Ack=10138 Win=61191 Len=0 TSV=3229368582 TSER=3229368465
     35 0.001010    127.0.0.1             127.0.0.1             TCP      59394 > commplex-main [ACK] Seq=10138 Ack=2 Win=65535 Len=1448 TSV=3229368682 TSER=3229368559
     36 0.001018    127.0.0.1             127.0.0.1             TCP      59394 > commplex-main [ACK] Seq=11586 Ack=2 Win=65535 Len=1448 TSV=3229368684 TSER=3229368559
     37 0.001025    127.0.0.1             127.0.0.1             TCP      59394 > commplex-main [ACK] Seq=13034 Ack=2 Win=65535 Len=1448 TSV=3229368717 TSER=3229368565
     38 0.001032    127.0.0.1             127.0.0.1             TCP      59394 > commplex-main [ACK] Seq=14482 Ack=2 Win=65535 Len=1448 TSV=3229368720 TSER=3229368565
     39 0.001058    127.0.0.1             127.0.0.1             TCP      59394 > commplex-main [ACK] Seq=15930 Ack=2 Win=65535 Len=1448 TSV=3229368784 TSER=3229368572
     40 0.001066    127.0.0.1             127.0.0.1             TCP      59394 > commplex-main [ACK] Seq=17378 Ack=2 Win=65535 Len=1448 TSV=3229368789 TSER=3229368572
     41 0.001095    127.0.0.1             127.0.0.1             TCP      59394 > commplex-main [ACK] Seq=18826 Ack=2 Win=65535 Len=1448 TSV=3229368821 TSER=3229368582
     42 0.001101    127.0.0.1             127.0.0.1             TCP      59394 > commplex-main [ACK] Seq=10138 Ack=2 Win=65535 Len=1448 TSV=3229368682 TSER=3229368559
     43 0.001106    127.0.0.1             127.0.0.1             TCP      59394 > commplex-main [ACK] Seq=20274 Ack=2 Win=65535 Len=1448 TSV=3229368826 TSER=3229368582
     44 0.001110    127.0.0.1             127.0.0.1             TCP      59394 > commplex-main [ACK] Seq=11586 Ack=2 Win=65535 Len=1448 TSV=3229368684 TSER=3229368559
     45 0.001123    127.0.0.1             127.0.0.1             TCP      59394 > commplex-main [ACK] Seq=13034 Ack=2 Win=65535 Len=1448 TSV=3229368717 TSER=3229368565
     46 0.001130    127.0.0.1             127.0.0.1             TCP      59394 > commplex-main [ACK] Seq=14482 Ack=2 Win=65535 Len=1448 TSV=3229368720 TSER=3229368565
     47 0.001141    127.0.0.1             127.0.0.1             TCP      59394 > commplex-main [ACK] Seq=15930 Ack=2 Win=65535 Len=1448 TSV=3229368784 TSER=3229368572
     48 0.001147    127.0.0.1             127.0.0.1             TCP      59394 > commplex-main [ACK] Seq=17378 Ack=2 Win=65535 Len=1448 TSV=3229368789 TSER=3229368572
     49 0.001155    127.0.0.1             127.0.0.1             TCP      59394 > commplex-main [ACK] Seq=18826 Ack=2 Win=65535 Len=1448 TSV=3229368821 TSER=3229368582
     50 0.001161    127.0.0.1             127.0.0.1             TCP      59394 > commplex-main [ACK] Seq=20274 Ack=2 Win=65535 Len=1448 TSV=3229368826 TSER=3229368582
     51 0.001257    127.0.0.1             127.0.0.1             TCP      commplex-main > 59394 [ACK] Seq=2 Ack=11586 Win=65535 Len=0 TSV=3229368930 TSER=3229368682
     52 0.001264    127.0.0.1             127.0.0.1             TCP      commplex-main > 59394 [ACK] Seq=2 Ack=13034 Win=64087 Len=0 TSV=3229368936 TSER=3229368684
     53 0.001269    127.0.0.1             127.0.0.1             TCP      commplex-main > 59394 [ACK] Seq=2 Ack=11586 Win=65535 Len=0 TSV=3229368930 TSER=3229368682
     54 0.001273    127.0.0.1             127.0.0.1             TCP      commplex-main > 59394 [ACK] Seq=2 Ack=14482 Win=62639 Len=0 TSV=3229368944 TSER=3229368717
     55 0.001277    127.0.0.1             127.0.0.1             TCP      commplex-main > 59394 [ACK] Seq=2 Ack=13034 Win=64087 Len=0 TSV=3229368936 TSER=3229368684
     56 0.001279    127.0.0.1             127.0.0.1             TCP      commplex-main > 59394 [ACK] Seq=2 Ack=15930 Win=61191 Len=0 TSV=3229368949 TSER=3229368720
     57 0.001286    127.0.0.1             127.0.0.1             TCP      commplex-main > 59394 [ACK] Seq=2 Ack=17378 Win=59743 Len=0 TSV=3229368958 TSER=3229368784
     58 0.001287    127.0.0.1             127.0.0.1             TCP      commplex-main > 59394 [ACK] Seq=2 Ack=14482 Win=62639 Len=0 TSV=3229368944 TSER=3229368717
     59 0.001291    127.0.0.1             127.0.0.1             TCP      commplex-main > 59394 [ACK] Seq=2 Ack=18826 Win=58295 Len=0 TSV=3229368965 TSER=3229368789
     60 0.001293    127.0.0.1             127.0.0.1             TCP      commplex-main > 59394 [ACK] Seq=2 Ack=15930 Win=61191 Len=0 TSV=3229368949 TSER=3229368720
     61 0.001297    127.0.0.1             127.0.0.1             TCP      commplex-main > 59394 [ACK] Seq=2 Ack=20274 Win=56847 Len=0 TSV=3229368975 TSER=3229368821
     62 0.001322    127.0.0.1             127.0.0.1             TCP      commplex-main > 59394 [ACK] Seq=2 Ack=21722 Win=55399 Len=0 TSV=3229368980 TSER=3229368826
     63 0.001472    127.0.0.1             127.0.0.1             TCP      59394 > commplex-main [ACK] Seq=21722 Ack=2 Win=65535 Len=1448 TSV=3229369086 TSER=3229368930
     64 0.001479    127.0.0.1             127.0.0.1             TCP      commplex-main > 59394 [ACK] Seq=2 Ack=17378 Win=59743 Len=0 TSV=3229368958 TSER=3229368784
     65 0.001480    127.0.0.1             127.0.0.1             TCP      59394 > commplex-main [ACK] Seq=23170 Ack=2 Win=65535 Len=1448 TSV=3229369089 TSER=3229368930
     66 0.001487    127.0.0.1             127.0.0.1             TCP      59394 > commplex-main [ACK] Seq=24618 Ack=2 Win=65535 Len=1448 TSV=3229369121 TSER=3229368936
     67 0.001488    127.0.0.1             127.0.0.1             TCP      commplex-main > 59394 [ACK] Seq=2 Ack=18826 Win=58295 Len=0 TSV=3229368965 TSER=3229368789
     68 0.001500    127.0.0.1             127.0.0.1             TCP      59394 > commplex-main [ACK] Seq=26066 Ack=2 Win=65535 Len=1448 TSV=3229369124 TSER=3229368936
     69 0.001511    127.0.0.1             127.0.0.1             TCP      59394 > commplex-main [ACK] Seq=27514 Ack=2 Win=65535 Len=1448 TSV=3229369155 TSER=3229368944
     70 0.001520    127.0.0.1             127.0.0.1             TCP      59394 > commplex-main [ACK] Seq=28962 Ack=2 Win=65535 Len=1448 TSV=3229369158 TSER=3229368944
     71 0.001526    127.0.0.1             127.0.0.1             TCP      59394 > commplex-main [ACK] Seq=30410 Ack=2 Win=65535 Len=1448 TSV=3229369188 TSER=3229368949
     72 0.001533    127.0.0.1             127.0.0.1             TCP      59394 > commplex-main [ACK] Seq=31858 Ack=2 Win=65535 Len=1448 TSV=3229369191 TSER=3229368949
     73 0.001536    127.0.0.1             127.0.0.1             TCP      commplex-main > 59394 [ACK] Seq=2 Ack=20274 Win=56847 Len=0 TSV=3229368975 TSER=3229368821
     74 0.001551    127.0.0.1             127.0.0.1             TCP      commplex-main > 59394 [ACK] Seq=2 Ack=21722 Win=55399 Len=0 TSV=3229368980 TSER=3229368826
     75 0.001565    127.0.0.1             127.0.0.1             TCP      59394 > commplex-main [ACK] Seq=21722 Ack=2 Win=65535 Len=1448 TSV=3229369086 TSER=3229368930
     76 0.001571    127.0.0.1             127.0.0.1             TCP      59394 > commplex-main [ACK] Seq=23170 Ack=2 Win=65535 Len=1448 TSV=3229369089 TSER=3229368930
     77 0.001580    127.0.0.1             127.0.0.1             TCP      59394 > commplex-main [ACK] Seq=24618 Ack=2 Win=65535 Len=1448 TSV=3229369121 TSER=3229368936
     78 0.001593    127.0.0.1             127.0.0.1             TCP      59394 > commplex-main [ACK] Seq=26066 Ack=2 Win=65535 Len=1448 TSV=3229369124 TSER=3229368936
     79 0.001602    127.0.0.1             127.0.0.1             TCP      59394 > commplex-main [ACK] Seq=27514 Ack=2 Win=65535 Len=1448 TSV=3229369155 TSER=3229368944
     80 0.001608    127.0.0.1             127.0.0.1             TCP      59394 > commplex-main [ACK] Seq=28962 Ack=2 Win=65535 Len=1448 TSV=3229369158 TSER=3229368944
     81 0.001619    127.0.0.1             127.0.0.1             TCP      59394 > commplex-main [ACK] Seq=30410 Ack=2 Win=65535 Len=1448 TSV=3229369188 TSER=3229368949
     82 0.001624    127.0.0.1             127.0.0.1             TCP      59394 > commplex-main [ACK] Seq=31858 Ack=2 Win=65535 Len=1448 TSV=3229369191 TSER=3229368949
     83 0.001638    127.0.0.1             127.0.0.1             TCP      59394 > commplex-main [ACK] Seq=33306 Ack=2 Win=65535 Len=1448 TSV=3229369290 TSER=3229368958
     84 0.001645    127.0.0.1             127.0.0.1             TCP      59394 > commplex-main [ACK] Seq=34754 Ack=2 Win=65535 Len=1448 TSV=3229369293 TSER=3229368958
     85 0.001651    127.0.0.1             127.0.0.1             TCP      59394 > commplex-main [ACK] Seq=36202 Ack=2 Win=65535 Len=1448 TSV=3229369332 TSER=3229368965
     86 0.001658    127.0.0.1             127.0.0.1             TCP      59394 > commplex-main [ACK] Seq=37650 Ack=2 Win=65535 Len=1448 TSV=3229369334 TSER=3229368965
     87 0.001666    127.0.0.1             127.0.0.1             TCP      59394 > commplex-main [ACK] Seq=33306 Ack=2 Win=65535 Len=1448 TSV=3229369290 TSER=3229368958
     88 0.001672    127.0.0.1             127.0.0.1             TCP      59394 > commplex-main [ACK] Seq=34754 Ack=2 Win=65535 Len=1448 TSV=3229369293 TSER=3229368958
     89 0.001679    127.0.0.1             127.0.0.1             TCP      59394 > commplex-main [ACK] Seq=36202 Ack=2 Win=65535 Len=1448 TSV=3229369332 TSER=3229368965
     90 0.001685    127.0.0.1             127.0.0.1             TCP      59394 > commplex-main [ACK] Seq=37650 Ack=2 Win=65535 Len=1448 TSV=3229369334 TSER=3229368965
     91 0.001757    127.0.0.1             127.0.0.1             TCP      59394 > commplex-main [ACK] Seq=39098 Ack=2 Win=65535 Len=1448 TSV=3229369482 TSER=3229368975
     92 0.001765    127.0.0.1             127.0.0.1             TCP      59394 > commplex-main [ACK] Seq=40546 Ack=2 Win=65535 Len=1448 TSV=3229369486 TSER=3229368975
     93 0.001776    127.0.0.1             127.0.0.1             TCP      59394 > commplex-main [ACK] Seq=39098 Ack=2 Win=65535 Len=1448 TSV=3229369482 TSER=3229368975
     94 0.001805    127.0.0.1             127.0.0.1             TCP      59394 > commplex-main [ACK] Seq=40546 Ack=2 Win=65535 Len=1448 TSV=3229369486 TSER=3229368975
     95 0.001817    127.0.0.1             127.0.0.1             TCP      59394 > commplex-main [ACK] Seq=41994 Ack=2 Win=65535 Len=1448 TSV=3229369528 TSER=3229368980
     96 0.001833    127.0.0.1             127.0.0.1             TCP      59394 > commplex-main [ACK] Seq=43442 Ack=2 Win=65535 Len=1448 TSV=3229369530 TSER=3229368980
     97 0.001847    127.0.0.1             127.0.0.1             TCP      59394 > commplex-main [ACK] Seq=41994 Ack=2 Win=65535 Len=1448 TSV=3229369528 TSER=3229368980
     98 0.001859    127.0.0.1             127.0.0.1             TCP      59394 > commplex-main [ACK] Seq=43442 Ack=2 Win=65535 Len=1448 TSV=3229369530 TSER=3229368980
     99 0.001911    127.0.0.1             127.0.0.1             TCP      commplex-main > 59394 [ACK] Seq=2 Ack=23170 Win=64087 Len=0 TSV=3229369541 TSER=3229369086
    100 0.001918    127.0.0.1             127.0.0.1             TCP      commplex-main > 59394 [ACK] Seq=2 Ack=24618 Win=62639 Len=0 TSV=3229369557 TSER=3229369089
    101 0.001929    127.0.0.1             127.0.0.1             TCP      commplex-main > 59394 [ACK] Seq=2 Ack=26066 Win=61191 Len=0 TSV=3229369569 TSER=3229369121
    102 0.001935    127.0.0.1             127.0.0.1             TCP      commplex-main > 59394 [ACK] Seq=2 Ack=27514 Win=59743 Len=0 TSV=3229369574 TSER=3229369124
    103 0.001943    127.0.0.1             127.0.0.1             TCP      commplex-main > 59394 [ACK] Seq=2 Ack=28962 Win=58295 Len=0 TSV=3229369584 TSER=3229369155
    104 0.001949    127.0.0.1             127.0.0.1             TCP      commplex-main > 59394 [ACK] Seq=2 Ack=30410 Win=56847 Len=0 TSV=3229369592 TSER=3229369158
    105 0.001958    127.0.0.1             127.0.0.1             TCP      commplex-main > 59394 [ACK] Seq=2 Ack=31858 Win=55399 Len=0 TSV=3229369603 TSER=3229369188
    106 0.001965    127.0.0.1             127.0.0.1             TCP      commplex-main > 59394 [ACK] Seq=2 Ack=33306 Win=53951 Len=0 TSV=3229369608 TSER=3229369191
    107 0.001972    127.0.0.1             127.0.0.1             TCP      commplex-main > 59394 [ACK] Seq=2 Ack=34754 Win=64087 Len=0 TSV=3229369621 TSER=3229369290
    108 0.001979    127.0.0.1             127.0.0.1             TCP      commplex-main > 59394 [ACK] Seq=2 Ack=36202 Win=62639 Len=0 TSV=3229369625 TSER=3229369293
    109 0.001986    127.0.0.1             127.0.0.1             TCP      commplex-main > 59394 [ACK] Seq=2 Ack=37650 Win=61191 Len=0 TSV=3229369633 TSER=3229369332
    110 0.001992    127.0.0.1             127.0.0.1             TCP      commplex-main > 59394 [ACK] Seq=2 Ack=39098 Win=59743 Len=0 TSV=3229369638 TSER=3229369334
    111 0.001998    127.0.0.1             127.0.0.1             TCP      commplex-main > 59394 [ACK] Seq=2 Ack=40546 Win=58295 Len=0 TSV=3229369689 TSER=3229369482
    112 0.002004    127.0.0.1             127.0.0.1             TCP      commplex-main > 59394 [ACK] Seq=2 Ack=41994 Win=56847 Len=0 TSV=3229369695 TSER=3229369486
    113 0.002011    127.0.0.1             127.0.0.1             TCP      commplex-main > 59394 [ACK] Seq=2 Ack=43442 Win=55399 Len=0 TSV=3229369702 TSER=3229369528
    114 0.002018    127.0.0.1             127.0.0.1             TCP      commplex-main > 59394 [ACK] Seq=2 Ack=44890 Win=53951 Len=0 TSV=3229369707 TSER=3229369530
    115 0.002026    127.0.0.1             127.0.0.1             TCP      commplex-main > 59394 [ACK] Seq=2 Ack=23170 Win=64087 Len=0 TSV=3229369541 TSER=3229369086
    116 0.002038    127.0.0.1             127.0.0.1             TCP      commplex-main > 59394 [ACK] Seq=2 Ack=24618 Win=62639 Len=0 TSV=3229369557 TSER=3229369089
    117 0.002046    127.0.0.1             127.0.0.1             TCP      commplex-main > 59394 [ACK] Seq=2 Ack=26066 Win=61191 Len=0 TSV=3229369569 TSER=3229369121
    118 0.002053    127.0.0.1             127.0.0.1             TCP      commplex-main > 59394 [ACK] Seq=2 Ack=27514 Win=59743 Len=0 TSV=3229369574 TSER=3229369124
    119 0.002061    127.0.0.1             127.0.0.1             TCP      commplex-main > 59394 [ACK] Seq=2 Ack=28962 Win=58295 Len=0 TSV=3229369584 TSER=3229369155
    120 0.002066    127.0.0.1             127.0.0.1             TCP      commplex-main > 59394 [ACK] Seq=2 Ack=30410 Win=56847 Len=0 TSV=3229369592 TSER=3229369158
    121 0.002074    127.0.0.1             127.0.0.1             TCP      commplex-main > 59394 [ACK] Seq=2 Ack=31858 Win=55399 Len=0 TSV=3229369603 TSER=3229369188
    122 0.002079    127.0.0.1             127.0.0.1             TCP      commplex-main > 59394 [ACK] Seq=2 Ack=33306 Win=53951 Len=0 TSV=3229369608 TSER=3229369191
    123 0.002087    127.0.0.1             127.0.0.1             TCP      commplex-main > 59394 [ACK] Seq=2 Ack=34754 Win=64087 Len=0 TSV=3229369621 TSER=3229369290
    124 0.002092    127.0.0.1             127.0.0.1             TCP      commplex-main > 59394 [ACK] Seq=2 Ack=36202 Win=62639 Len=0 TSV=3229369625 TSER=3229369293
    125 0.002102    127.0.0.1             127.0.0.1             TCP      commplex-main > 59394 [ACK] Seq=2 Ack=37650 Win=61191 Len=0 TSV=3229369633 TSER=3229369332
    126 0.002107    127.0.0.1             127.0.0.1             TCP      commplex-main > 59394 [ACK] Seq=2 Ack=39098 Win=59743 Len=0 TSV=3229369638 TSER=3229369334
    127 0.002119    127.0.0.1             127.0.0.1             TCP      commplex-main > 59394 [ACK] Seq=2 Ack=40546 Win=58295 Len=0 TSV=3229369689 TSER=3229369482
    128 0.002125    127.0.0.1             127.0.0.1             TCP      commplex-main > 59394 [ACK] Seq=2 Ack=41994 Win=56847 Len=0 TSV=3229369695 TSER=3229369486
    129 0.002134    127.0.0.1             127.0.0.1             TCP      commplex-main > 59394 [ACK] Seq=2 Ack=43442 Win=55399 Len=0 TSV=3229369702 TSER=3229369528
    130 0.002140    127.0.0.1             127.0.0.1             TCP      commplex-main > 59394 [ACK] Seq=2 Ack=44890 Win=53951 Len=0 TSV=3229369707 TSER=3229369530
    131 0.002212    127.0.0.1             127.0.0.1             TCP      59394 > commplex-main [ACK] Seq=44890 Ack=2 Win=65535 Len=1448 TSV=3229369930 TSER=3229369541
    132 0.002220    127.0.0.1             127.0.0.1             TCP      59394 > commplex-main [ACK] Seq=46338 Ack=2 Win=65535 Len=1448 TSV=3229369934 TSER=3229369541
    133 0.002228    127.0.0.1             127.0.0.1             TCP      59394 > commplex-main [ACK] Seq=44890 Ack=2 Win=65535 Len=1448 TSV=3229369930 TSER=3229369541
    134 0.002235    127.0.0.1             127.0.0.1             TCP      59394 > commplex-main [ACK] Seq=46338 Ack=2 Win=65535 Len=1448 TSV=3229369934 TSER=3229369541
    135 0.002267    127.0.0.1             127.0.0.1             TCP      59394 > commplex-main [ACK] Seq=47786 Ack=2 Win=65535 Len=1448 TSV=3229369967 TSER=3229369557
    136 0.002275    127.0.0.1             127.0.0.1             TCP      59394 > commplex-main [ACK] Seq=49234 Ack=2 Win=65535 Len=1448 TSV=3229369970 TSER=3229369557
    137 0.002285    127.0.0.1             127.0.0.1             TCP      59394 > commplex-main [ACK] Seq=47786 Ack=2 Win=65535 Len=1448 TSV=3229369967 TSER=3229369557
    138 0.002292    127.0.0.1             127.0.0.1             TCP      59394 > commplex-main [ACK] Seq=49234 Ack=2 Win=65535 Len=1448 TSV=3229369970 TSER=3229369557
    139 0.002315    127.0.0.1             127.0.0.1             TCP      59394 > commplex-main [ACK] Seq=50682 Ack=2 Win=65535 Len=1448 TSV=3229370013 TSER=3229369569
    140 0.002323    127.0.0.1             127.0.0.1             TCP      59394 > commplex-main [ACK] Seq=52130 Ack=2 Win=65535 Len=1448 TSV=3229370017 TSER=3229369569
    141 0.002342    127.0.0.1             127.0.0.1             TCP      59394 > commplex-main [ACK] Seq=50682 Ack=2 Win=65535 Len=1448 TSV=3229370013 TSER=3229369569
    142 0.002356    127.0.0.1             127.0.0.1             TCP      59394 > commplex-main [ACK] Seq=52130 Ack=2 Win=65535 Len=1448 TSV=3229370017 TSER=3229369569
    143 0.002372    127.0.0.1             127.0.0.1             TCP      59394 > commplex-main [ACK] Seq=53578 Ack=2 Win=65535 Len=1448 TSV=3229370054 TSER=3229369574
    144 0.002379    127.0.0.1             127.0.0.1             TCP      59394 > commplex-main [ACK] Seq=55026 Ack=2 Win=65535 Len=1448 TSV=3229370056 TSER=3229369574
    145 0.002411    127.0.0.1             127.0.0.1             TCP      59394 > commplex-main [ACK] Seq=56474 Ack=2 Win=65535 Len=1448 TSV=3229370094 TSER=3229369584
    146 0.002418    127.0.0.1             127.0.0.1             TCP      59394 > commplex-main [ACK] Seq=57922 Ack=2 Win=65535 Len=1448 TSV=3229370097 TSER=3229369584
    147 0.002433    127.0.0.1             127.0.0.1             TCP      59394 > commplex-main [ACK] Seq=59370 Ack=2 Win=65535 Len=1448 TSV=3229370132 TSER=3229369592
    148 0.002442    127.0.0.1             127.0.0.1             TCP      59394 > commplex-main [ACK] Seq=60818 Ack=2 Win=65535 Len=1448 TSV=3229370135 TSER=3229369592
    149 0.002445    127.0.0.1             127.0.0.1             TCP      59394 > commplex-main [ACK] Seq=53578 Ack=2 Win=65535 Len=1448 TSV=3229370054 TSER=3229369574
    150 0.002452    127.0.0.1             127.0.0.1             TCP      59394 > commplex-main [ACK] Seq=55026 Ack=2 Win=65535 Len=1448 TSV=3229370056 TSER=3229369574
    151 0.002461    127.0.0.1             127.0.0.1             TCP      59394 > commplex-main [ACK] Seq=56474 Ack=2 Win=65535 Len=1448 TSV=3229370094 TSER=3229369584
    152 0.002475    127.0.0.1             127.0.0.1             TCP      59394 > commplex-main [ACK] Seq=57922 Ack=2 Win=65535 Len=1448 TSV=3229370097 TSER=3229369584
    153 0.002485    127.0.0.1             127.0.0.1             TCP      59394 > commplex-main [ACK] Seq=59370 Ack=2 Win=65535 Len=1448 TSV=3229370132 TSER=3229369592
    154 0.002491    127.0.0.1             127.0.0.1             TCP      59394 > commplex-main [ACK] Seq=60818 Ack=2 Win=65535 Len=1448 TSV=3229370135 TSER=3229369592
    155 0.002805    127.0.0.1             127.0.0.1             TCP      59394 > commplex-main [ACK] Seq=62266 Ack=2 Win=65535 Len=1448 TSV=3229370177 TSER=3229369603
    156 0.002812    127.0.0.1             127.0.0.1             TCP      59394 > commplex-main [ACK] Seq=63714 Ack=2 Win=65535 Len=1448 TSV=3229370179 TSER=3229369603
    157 0.002819    127.0.0.1             127.0.0.1             TCP      59394 > commplex-main [ACK] Seq=65162 Ack=2 Win=65535 Len=1448 TSV=3229370212 TSER=3229369608
    158 0.002826    127.0.0.1             127.0.0.1             TCP      59394 > commplex-main [ACK] Seq=66610 Ack=2 Win=65535 Len=1448 TSV=3229370215 TSER=3229369608
    159 0.002834    127.0.0.1             127.0.0.1             TCP      59394 > commplex-main [ACK] Seq=68058 Ack=2 Win=65535 Len=1448 TSV=3229370248 TSER=3229369621
    160 0.002841    127.0.0.1             127.0.0.1             TCP      59394 > commplex-main [ACK] Seq=69506 Ack=2 Win=65535 Len=1448 TSV=3229370250 TSER=3229369621
    161 0.002848    127.0.0.1             127.0.0.1             TCP      59394 > commplex-main [ACK] Seq=70954 Ack=2 Win=65535 Len=1448 TSV=3229370280 TSER=3229369625
    162 0.002873    127.0.0.1             127.0.0.1             TCP      59394 > commplex-main [ACK] Seq=72402 Ack=2 Win=65535 Len=1448 TSV=3229370283 TSER=3229369625
    163 0.002883    127.0.0.1             127.0.0.1             TCP      59394 > commplex-main [ACK] Seq=73850 Ack=2 Win=65535 Len=1448 TSV=3229370314 TSER=3229369633
    164 0.002906    127.0.0.1             127.0.0.1             TCP      59394 > commplex-main [ACK] Seq=75298 Ack=2 Win=65535 Len=1448 TSV=3229370316 TSER=3229369633
    165 0.002916    127.0.0.1             127.0.0.1             TCP      59394 > commplex-main [ACK] Seq=76746 Ack=2 Win=65535 Len=1448 TSV=3229370346 TSER=3229369638
    166 0.002923    127.0.0.1             127.0.0.1             TCP      59394 > commplex-main [ACK] Seq=78194 Ack=2 Win=65535 Len=1448 TSV=3229370349 TSER=3229369638
    167 0.002929    127.0.0.1             127.0.0.1             TCP      59394 > commplex-main [ACK] Seq=79642 Ack=2 Win=65535 Len=1448 TSV=3229370377 TSER=3229369689
    168 0.002936    127.0.0.1             127.0.0.1             TCP      59394 > commplex-main [ACK] Seq=81090 Ack=2 Win=65535 Len=1448 TSV=3229370380 TSER=3229369689
    169 0.002942    127.0.0.1             127.0.0.1             TCP      59394 > commplex-main [ACK] Seq=82538 Ack=2 Win=65535 Len=1448 TSV=3229370410 TSER=3229369695
    170 0.002948    127.0.0.1             127.0.0.1             TCP      59394 > commplex-main [ACK] Seq=83986 Ack=2 Win=65535 Len=1448 TSV=3229370412 TSER=3229369695
    171 0.002956    127.0.0.1             127.0.0.1             TCP      59394 > commplex-main [ACK] Seq=85434 Ack=2 Win=65535 Len=1448 TSV=3229370442 TSER=3229369702
    172 0.002963    127.0.0.1             127.0.0.1             TCP      59394 > commplex-main [ACK] Seq=86882 Ack=2 Win=65535 Len=1448 TSV=3229370445 TSER=3229369702
    173 0.002970    127.0.0.1             127.0.0.1             TCP      59394 > commplex-main [ACK] Seq=88330 Ack=2 Win=65535 Len=1448 TSV=3229370474 TSER=3229369707
    174 0.002976    127.0.0.1             127.0.0.1             TCP      59394 > commplex-main [ACK] Seq=89778 Ack=2 Win=65535 Len=1448 TSV=3229370476 TSER=3229369707
    175 0.002983    127.0.0.1             127.0.0.1             TCP      commplex-main > 59394 [ACK] Seq=2 Ack=46338 Win=65535 Len=0 TSV=3229370487 TSER=3229369930
    176 0.002990    127.0.0.1             127.0.0.1             TCP      commplex-main > 59394 [ACK] Seq=2 Ack=47786 Win=64087 Len=0 TSV=3229370491 TSER=3229369934
    177 0.002997    127.0.0.1             127.0.0.1             TCP      commplex-main > 59394 [ACK] Seq=2 Ack=49234 Win=62639 Len=0 TSV=3229370499 TSER=3229369967
    178 0.003004    127.0.0.1             127.0.0.1             TCP      commplex-main > 59394 [ACK] Seq=2 Ack=50682 Win=61191 Len=0 TSV=3229370503 TSER=3229369970
    179 0.003010    127.0.0.1             127.0.0.1             TCP      commplex-main > 59394 [ACK] Seq=2 Ack=52130 Win=59743 Len=0 TSV=3229370519 TSER=3229370013
    180 0.003017    127.0.0.1             127.0.0.1             TCP      commplex-main > 59394 [ACK] Seq=2 Ack=53578 Win=58295 Len=0 TSV=3229370523 TSER=3229370017
    181 0.003024    127.0.0.1             127.0.0.1             TCP      commplex-main > 59394 [ACK] Seq=2 Ack=55026 Win=56847 Len=0 TSV=3229370605 TSER=3229370054
    182 0.003031    127.0.0.1             127.0.0.1             TCP      commplex-main > 59394 [ACK] Seq=2 Ack=56474 Win=55399 Len=0 TSV=3229370616 TSER=3229370056
    183 0.003037    127.0.0.1             127.0.0.1             TCP      commplex-main > 59394 [ACK] Seq=2 Ack=57922 Win=53951 Len=0 TSV=3229370621 TSER=3229370094
    184 0.003043    127.0.0.1             127.0.0.1             TCP      commplex-main > 59394 [ACK] Seq=2 Ack=59370 Win=52503 Len=0 TSV=3229370634 TSER=3229370097
    185 0.003050    127.0.0.1             127.0.0.1             TCP      commplex-main > 59394 [ACK] Seq=2 Ack=60818 Win=51055 Len=0 TSV=3229370639 TSER=3229370132
    186 0.003057    127.0.0.1             127.0.0.1             TCP      commplex-main > 59394 [ACK] Seq=2 Ack=62266 Win=49607 Len=0 TSV=3229370650 TSER=3229370135
    187 0.003060    127.0.0.1             127.0.0.1             TCP      59394 > commplex-main [ACK] Seq=62266 Ack=2 Win=65535 Len=1448 TSV=3229370177 TSER=3229369603
    188 0.003068    127.0.0.1             127.0.0.1             TCP      59394 > commplex-main [ACK] Seq=63714 Ack=2 Win=65535 Len=1448 TSV=3229370179 TSER=3229369603
    189 0.003085    127.0.0.1             127.0.0.1             TCP      59394 > commplex-main [ACK] Seq=65162 Ack=2 Win=65535 Len=1448 TSV=3229370212 TSER=3229369608
    190 0.003097    127.0.0.1             127.0.0.1             TCP      59394 > commplex-main [ACK] Seq=66610 Ack=2 Win=65535 Len=1448 TSV=3229370215 TSER=3229369608
    191 0.003103    127.0.0.1             127.0.0.1             TCP      59394 > commplex-main [ACK] Seq=68058 Ack=2 Win=65535 Len=1448 TSV=3229370248 TSER=3229369621
    192 0.003122    127.0.0.1             127.0.0.1             TCP      59394 > commplex-main [ACK] Seq=69506 Ack=2 Win=65535 Len=1448 TSV=3229370250 TSER=3229369621
    193 0.003134    127.0.0.1             127.0.0.1             TCP      59394 > commplex-main [ACK] Seq=70954 Ack=2 Win=65535 Len=1448 TSV=3229370280 TSER=3229369625
    194 0.003140    127.0.0.1             127.0.0.1             TCP      59394 > commplex-main [ACK] Seq=72402 Ack=2 Win=65535 Len=1448 TSV=3229370283 TSER=3229369625
    195 0.003150    127.0.0.1             127.0.0.1             TCP      59394 > commplex-main [ACK] Seq=73850 Ack=2 Win=65535 Len=1448 TSV=3229370314 TSER=3229369633
    196 0.003164    127.0.0.1             127.0.0.1             TCP      commplex-main > 59394 [ACK] Seq=2 Ack=63714 Win=65535 Len=0 TSV=3229370841 TSER=3229370177
    197 0.003172    127.0.0.1             127.0.0.1             TCP      commplex-main > 59394 [ACK] Seq=2 Ack=65162 Win=64087 Len=0 TSV=3229370859 TSER=3229370179
    198 0.003185    127.0.0.1             127.0.0.1             TCP      59394 > commplex-main [ACK] Seq=75298 Ack=2 Win=65535 Len=1448 TSV=3229370316 TSER=3229369633
    199 0.003191    127.0.0.1             127.0.0.1             TCP      59394 > commplex-main [ACK] Seq=76746 Ack=2 Win=65535 Len=1448 TSV=3229370346 TSER=3229369638
    200 0.003202    127.0.0.1             127.0.0.1             TCP      59394 > commplex-main [ACK] Seq=78194 Ack=2 Win=65535 Len=1448 TSV=3229370349 TSER=3229369638
    201 0.003213    127.0.0.1             127.0.0.1             TCP      59394 > commplex-main [ACK] Seq=79642 Ack=2 Win=65535 Len=1448 TSV=3229370377 TSER=3229369689
    202 0.003225    127.0.0.1             127.0.0.1             TCP      59394 > commplex-main [ACK] Seq=81090 Ack=2 Win=65535 Len=1448 TSV=3229370380 TSER=3229369689
    203 0.003239    127.0.0.1             127.0.0.1             TCP      commplex-main > 59394 [ACK] Seq=2 Ack=66610 Win=62639 Len=0 TSV=3229370894 TSER=3229370212
    204 0.003245    127.0.0.1             127.0.0.1             TCP      commplex-main > 59394 [ACK] Seq=2 Ack=68058 Win=61191 Len=0 TSV=3229370904 TSER=3229370215
    205 0.003254    127.0.0.1             127.0.0.1             TCP      commplex-main > 59394 [ACK] Seq=2 Ack=69506 Win=59743 Len=0 TSV=3229370909 TSER=3229370248
    206 0.003261    127.0.0.1             127.0.0.1             TCP      commplex-main > 59394 [ACK] Seq=2 Ack=70954 Win=58295 Len=0 TSV=3229370916 TSER=3229370250
    207 0.003267    127.0.0.1             127.0.0.1             TCP      commplex-main > 59394 [ACK] Seq=2 Ack=72402 Win=56847 Len=0 TSV=3229370930 TSER=3229370280
    208 0.003273    127.0.0.1             127.0.0.1             TCP      commplex-main > 59394 [ACK] Seq=2 Ack=73850 Win=55399 Len=0 TSV=3229370946 TSER=3229370283
    209 0.003279    127.0.0.1             127.0.0.1             TCP      commplex-main > 59394 [ACK] Seq=2 Ack=75298 Win=53951 Len=0 TSV=3229370957 TSER=3229370314
    210 0.003285    127.0.0.1             127.0.0.1             TCP      commplex-main > 59394 [ACK] Seq=2 Ack=76746 Win=52503 Len=0 TSV=3229370968 TSER=3229370316
    211 0.003291    127.0.0.1             127.0.0.1             TCP      commplex-main > 59394 [ACK] Seq=2 Ack=78194 Win=51055 Len=0 TSV=3229370979 TSER=3229370346
    212 0.003297    127.0.0.1             127.0.0.1             TCP      commplex-main > 59394 [ACK] Seq=2 Ack=79642 Win=49607 Len=0 TSV=3229370983 TSER=3229370349
    213 0.003303    127.0.0.1             127.0.0.1             TCP      commplex-main > 59394 [ACK] Seq=2 Ack=81090 Win=48159 Len=0 TSV=3229370994 TSER=3229370377
    214 0.003312    127.0.0.1             127.0.0.1             TCP      59394 > commplex-main [ACK] Seq=82538 Ack=2 Win=65535 Len=1448 TSV=3229370410 TSER=3229369695
    215 0.003328    127.0.0.1             127.0.0.1             TCP      59394 > commplex-main [ACK] Seq=83986 Ack=2 Win=65535 Len=1448 TSV=3229370412 TSER=3229369695
    216 0.003339    127.0.0.1             127.0.0.1             TCP      59394 > commplex-main [ACK] Seq=85434 Ack=2 Win=65535 Len=1448 TSV=3229370442 TSER=3229369702
    217 0.003350    127.0.0.1             127.0.0.1             TCP      59394 > commplex-main [ACK] Seq=86882 Ack=2 Win=65535 Len=1448 TSV=3229370445 TSER=3229369702
    218 0.003359    127.0.0.1             127.0.0.1             TCP      59394 > commplex-main [ACK] Seq=88330 Ack=2 Win=65535 Len=1448 TSV=3229370474 TSER=3229369707
    219 0.003368    127.0.0.1             127.0.0.1             TCP      59394 > commplex-main [ACK] Seq=89778 Ack=2 Win=65535 Len=1448 TSV=3229370476 TSER=3229369707
    220 0.003380    127.0.0.1             127.0.0.1             TCP      commplex-main > 59394 [ACK] Seq=2 Ack=46338 Win=65535 Len=0 TSV=3229370487 TSER=3229369930
    221 0.003390    127.0.0.1             127.0.0.1             TCP      commplex-main > 59394 [ACK] Seq=2 Ack=47786 Win=64087 Len=0 TSV=3229370491 TSER=3229369934
    222 0.003400    127.0.0.1             127.0.0.1             TCP      commplex-main > 59394 [ACK] Seq=2 Ack=49234 Win=62639 Len=0 TSV=3229370499 TSER=3229369967
    223 0.003407    127.0.0.1             127.0.0.1             TCP      commplex-main > 59394 [ACK] Seq=2 Ack=50682 Win=61191 Len=0 TSV=3229370503 TSER=3229369970
    224 0.003418    127.0.0.1             127.0.0.1             TCP      commplex-main > 59394 [ACK] Seq=2 Ack=52130 Win=59743 Len=0 TSV=3229370519 TSER=3229370013
    225 0.003424    127.0.0.1             127.0.0.1             TCP      commplex-main > 59394 [ACK] Seq=2 Ack=53578 Win=58295 Len=0 TSV=3229370523 TSER=3229370017
    226 0.003435    127.0.0.1             127.0.0.1             TCP      commplex-main > 59394 [ACK] Seq=2 Ack=55026 Win=56847 Len=0 TSV=3229370605 TSER=3229370054
    227 0.003440    127.0.0.1             127.0.0.1             TCP      commplex-main > 59394 [ACK] Seq=2 Ack=56474 Win=55399 Len=0 TSV=3229370616 TSER=3229370056
    228 0.003451    127.0.0.1             127.0.0.1             TCP      commplex-main > 59394 [ACK] Seq=2 Ack=57922 Win=53951 Len=0 TSV=3229370621 TSER=3229370094
    229 0.003465    127.0.0.1             127.0.0.1             TCP      commplex-main > 59394 [ACK] Seq=2 Ack=82538 Win=46711 Len=0 TSV=3229371067 TSER=3229370380
    230 0.003470    127.0.0.1             127.0.0.1             TCP      commplex-main > 59394 [ACK] Seq=2 Ack=59370 Win=52503 Len=0 TSV=3229370634 TSER=3229370097
    231 0.003475    127.0.0.1             127.0.0.1             TCP      commplex-main > 59394 [ACK] Seq=2 Ack=83986 Win=64087 Len=0 TSV=3229371086 TSER=3229370410
    232 0.003481    127.0.0.1             127.0.0.1             TCP      commplex-main > 59394 [ACK] Seq=2 Ack=85434 Win=62639 Len=0 TSV=3229371093 TSER=3229370412
    233 0.003482    127.0.0.1             127.0.0.1             TCP      commplex-main > 59394 [ACK] Seq=2 Ack=60818 Win=51055 Len=0 TSV=3229370639 TSER=3229370132
    234 0.003487    127.0.0.1             127.0.0.1             TCP      commplex-main > 59394 [ACK] Seq=2 Ack=86882 Win=61191 Len=0 TSV=3229371105 TSER=3229370442
    235 0.003489    127.0.0.1             127.0.0.1             TCP      commplex-main > 59394 [ACK] Seq=2 Ack=62266 Win=49607 Len=0 TSV=3229370650 TSER=3229370135
    236 0.003509    127.0.0.1             127.0.0.1             TCP      commplex-main > 59394 [ACK] Seq=2 Ack=88330 Win=59743 Len=0 TSV=3229371112 TSER=3229370445
    237 0.003513    127.0.0.1             127.0.0.1             TCP      commplex-main > 59394 [ACK] Seq=2 Ack=63714 Win=65535 Len=0 TSV=3229370841 TSER=3229370177
    238 0.003519    127.0.0.1             127.0.0.1             TCP      commplex-main > 59394 [ACK] Seq=2 Ack=89778 Win=58295 Len=0 TSV=3229371129 TSER=3229370474
    239 0.003520    127.0.0.1             127.0.0.1             TCP      commplex-main > 59394 [ACK] Seq=2 Ack=65162 Win=64087 Len=0 TSV=3229370859 TSER=3229370179
    240 0.003535    127.0.0.1             127.0.0.1             TCP      commplex-main > 59394 [ACK] Seq=2 Ack=66610 Win=62639 Len=0 TSV=3229370894 TSER=3229370212
    241 0.003542    127.0.0.1             127.0.0.1             TCP      commplex-main > 59394 [ACK] Seq=2 Ack=68058 Win=61191 Len=0 TSV=3229370904 TSER=3229370215
    242 0.003552    127.0.0.1             127.0.0.1             TCP      commplex-main > 59394 [ACK] Seq=2 Ack=69506 Win=59743 Len=0 TSV=3229370909 TSER=3229370248
    243 0.003557    127.0.0.1             127.0.0.1             TCP      commplex-main > 59394 [ACK] Seq=2 Ack=91226 Win=56847 Len=0 TSV=3229371136 TSER=3229370476
    244 0.003559    127.0.0.1             127.0.0.1             TCP      commplex-main > 59394 [ACK] Seq=2 Ack=70954 Win=58295 Len=0 TSV=3229370916 TSER=3229370250
    245 0.003567    127.0.0.1             127.0.0.1             TCP      commplex-main > 59394 [ACK] Seq=2 Ack=72402 Win=56847 Len=0 TSV=3229370930 TSER=3229370280
    246 0.003573    127.0.0.1             127.0.0.1             TCP      commplex-main > 59394 [ACK] Seq=2 Ack=73850 Win=55399 Len=0 TSV=3229370946 TSER=3229370283
    247 0.003583    127.0.0.1             127.0.0.1             TCP      commplex-main > 59394 [ACK] Seq=2 Ack=75298 Win=53951 Len=0 TSV=3229370957 TSER=3229370314
    248 0.003589    127.0.0.1             127.0.0.1             TCP      commplex-main > 59394 [ACK] Seq=2 Ack=76746 Win=52503 Len=0 TSV=3229370968 TSER=3229370316
    249 0.003597    127.0.0.1             127.0.0.1             TCP      commplex-main > 59394 [ACK] Seq=2 Ack=78194 Win=51055 Len=0 TSV=3229370979 TSER=3229370346
    250 0.003605    127.0.0.1             127.0.0.1             TCP      commplex-main > 59394 [ACK] Seq=2 Ack=79642 Win=49607 Len=0 TSV=3229370983 TSER=3229370349
    251 0.003615    127.0.0.1             127.0.0.1             TCP      commplex-main > 59394 [ACK] Seq=2 Ack=81090 Win=48159 Len=0 TSV=3229370994 TSER=3229370377
    252 0.003620    127.0.0.1             127.0.0.1             TCP      commplex-main > 59394 [ACK] Seq=2 Ack=82538 Win=46711 Len=0 TSV=3229371067 TSER=3229370380
    253 0.003631    127.0.0.1             127.0.0.1             TCP      commplex-main > 59394 [ACK] Seq=2 Ack=83986 Win=64087 Len=0 TSV=3229371086 TSER=3229370410
    254 0.003637    127.0.0.1             127.0.0.1             TCP      commplex-main > 59394 [ACK] Seq=2 Ack=85434 Win=62639 Len=0 TSV=3229371093 TSER=3229370412
    255 0.003645    127.0.0.1             127.0.0.1             TCP      commplex-main > 59394 [ACK] Seq=2 Ack=86882 Win=61191 Len=0 TSV=3229371105 TSER=3229370442
    256 0.003651    127.0.0.1             127.0.0.1             TCP      commplex-main > 59394 [ACK] Seq=2 Ack=88330 Win=59743 Len=0 TSV=3229371112 TSER=3229370445
    257 0.003659    127.0.0.1             127.0.0.1             TCP      commplex-main > 59394 [ACK] Seq=2 Ack=89778 Win=58295 Len=0 TSV=3229371129 TSER=3229370474
    258 0.003665    127.0.0.1             127.0.0.1             TCP      commplex-main > 59394 [ACK] Seq=2 Ack=91226 Win=56847 Len=0 TSV=3229371136 TSER=3229370476
    259 0.003692    127.0.0.1             127.0.0.1             TCP      59394 > commplex-main [ACK] Seq=91226 Ack=2 Win=65535 Len=1448 TSV=3229371250 TSER=3229370487
    260 0.003706    127.0.0.1             127.0.0.1             TCP      59394 > commplex-main [ACK] Seq=91226 Ack=2 Win=65535 Len=1448 TSV=3229371250 TSER=3229370487
    261 0.003712    127.0.0.1             127.0.0.1             TCP      59394 > commplex-main [ACK] Seq=92674 Ack=2 Win=65535 Len=1448 TSV=3229371253 TSER=3229370487
    262 0.003714    127.0.0.1             127.0.0.1             TCP      59394 > commplex-main [ACK] Seq=92674 Ack=2 Win=65535 Len=1448 TSV=3229371253 TSER=3229370487
    263 0.004630    127.0.0.1             127.0.0.1             TCP      59394 > commplex-main [ACK] Seq=94122 Ack=2 Win=65535 Len=1448 TSV=3229371495 TSER=3229370491
    264 0.004638    127.0.0.1             127.0.0.1             TCP      59394 > commplex-main [ACK] Seq=95570 Ack=2 Win=65535 Len=1448 TSV=3229371497 TSER=3229370491
    265 0.004645    127.0.0.1             127.0.0.1             TCP      59394 > commplex-main [ACK] Seq=97018 Ack=2 Win=65535 Len=1448 TSV=3229371534 TSER=3229370499
    266 0.004651    127.0.0.1             127.0.0.1             TCP      59394 > commplex-main [ACK] Seq=98466 Ack=2 Win=65535 Len=1448 TSV=3229371536 TSER=3229370499
    267 0.004659    127.0.0.1             127.0.0.1             TCP      59394 > commplex-main [ACK] Seq=99914 Ack=2 Win=65535 Len=1448 TSV=3229371568 TSER=3229370503
    268 0.004665    127.0.0.1             127.0.0.1             TCP      59394 > commplex-main [ACK] Seq=101362 Ack=2 Win=65535 Len=1448 TSV=3229371571 TSER=3229370503
    269 0.004672    127.0.0.1             127.0.0.1             TCP      59394 > commplex-main [ACK] Seq=102810 Ack=2 Win=65535 Len=1448 TSV=3229371602 TSER=3229370519
    270 0.004679    127.0.0.1             127.0.0.1             TCP      59394 > commplex-main [ACK] Seq=104258 Ack=2 Win=65535 Len=1448 TSV=3229371604 TSER=3229370519
    271 0.004686    127.0.0.1             127.0.0.1             TCP      59394 > commplex-main [ACK] Seq=105706 Ack=2 Win=65535 Len=1448 TSV=3229371635 TSER=3229370523
    272 0.004693    127.0.0.1             127.0.0.1             TCP      59394 > commplex-main [ACK] Seq=107154 Ack=2 Win=65535 Len=1448 TSV=3229371638 TSER=3229370523
    273 0.004705    127.0.0.1             127.0.0.1             TCP      59394 > commplex-main [ACK] Seq=108602 Ack=2 Win=65535 Len=1448 TSV=3229371668 TSER=3229370605
    274 0.004713    127.0.0.1             127.0.0.1             TCP      59394 > commplex-main [ACK] Seq=110050 Ack=2 Win=65535 Len=1448 TSV=3229371671 TSER=3229370605
    275 0.004720    127.0.0.1             127.0.0.1             TCP      59394 > commplex-main [ACK] Seq=111498 Ack=2 Win=65535 Len=1448 TSV=3229371836 TSER=3229370841
    276 0.004727    127.0.0.1             127.0.0.1             TCP      59394 > commplex-main [ACK] Seq=112946 Ack=2 Win=65535 Len=1448 TSV=3229371839 TSER=3229370841
    277 0.004734    127.0.0.1             127.0.0.1             TCP      59394 > commplex-main [ACK] Seq=114394 Ack=2 Win=65535 Len=1448 TSV=3229371841 TSER=3229370841
    278 0.004741    127.0.0.1             127.0.0.1             TCP      59394 > commplex-main [ACK] Seq=115842 Ack=2 Win=65535 Len=1448 TSV=3229371843 TSER=3229370841
    279 0.004748    127.0.0.1             127.0.0.1             TCP      59394 > commplex-main [ACK] Seq=117290 Ack=2 Win=65535 Len=1448 TSV=3229371845 TSER=3229370841
    280 0.004756    127.0.0.1             127.0.0.1             TCP      59394 > commplex-main [ACK] Seq=118738 Ack=2 Win=65535 Len=1448 TSV=3229371847 TSER=3229370841
    281 0.004763    127.0.0.1             127.0.0.1             TCP      59394 > commplex-main [ACK] Seq=120186 Ack=2 Win=65535 Len=1448 TSV=3229371849 TSER=3229370841
    282 0.004770    127.0.0.1             127.0.0.1             TCP      59394 > commplex-main [ACK] Seq=121634 Ack=2 Win=65535 Len=1448 TSV=3229371851 TSER=3229370841
    283 0.004778    127.0.0.1             127.0.0.1             TCP      59394 > commplex-main [ACK] Seq=123082 Ack=2 Win=65535 Len=1448 TSV=3229371853 TSER=3229370841
    284 0.004785    127.0.0.1             127.0.0.1             TCP      59394 > commplex-main [ACK] Seq=124530 Ack=2 Win=65535 Len=1448 TSV=3229371855 TSER=3229370841
    285 0.004793    127.0.0.1             127.0.0.1             TCP      59394 > commplex-main [ACK] Seq=125978 Ack=2 Win=65535 Len=1448 TSV=3229371858 TSER=3229370841
    286 0.004800    127.0.0.1             127.0.0.1             TCP      59394 > commplex-main [ACK] Seq=127426 Ack=2 Win=65535 Len=1448 TSV=3229371860 TSER=3229370841
    287 0.004808    127.0.0.1             127.0.0.1             TCP      59394 > commplex-main [ACK] Seq=128874 Ack=2 Win=65535 Len=1448 TSV=3229372199 TSER=3229371086
    288 0.004814    127.0.0.1             127.0.0.1             TCP      59394 > commplex-main [ACK] Seq=130322 Ack=2 Win=65535 Len=1448 TSV=3229372202 TSER=3229371086
    289 0.004821    127.0.0.1             127.0.0.1             TCP      59394 > commplex-main [ACK] Seq=131770 Ack=2 Win=65535 Len=1448 TSV=3229372204 TSER=3229371086
    290 0.004828    127.0.0.1             127.0.0.1             TCP      59394 > commplex-main [ACK] Seq=133218 Ack=2 Win=65535 Len=1448 TSV=3229372206 TSER=3229371086
    291 0.004839    127.0.0.1             127.0.0.1             TCP      59394 > commplex-main [ACK] Seq=134666 Ack=2 Win=65535 Len=1448 TSV=3229372208 TSER=3229371086
    292 0.004847    127.0.0.1             127.0.0.1             TCP      59394 > commplex-main [ACK] Seq=136114 Ack=2 Win=65535 Len=1448 TSV=3229372210 TSER=3229371086
    293 0.004855    127.0.0.1             127.0.0.1             TCP      59394 > commplex-main [ACK] Seq=137562 Ack=2 Win=65535 Len=1448 TSV=3229372212 TSER=3229371086
    294 0.004869    127.0.0.1             127.0.0.1             TCP      59394 > commplex-main [ACK] Seq=139010 Ack=2 Win=65535 Len=1448 TSV=3229372214 TSER=3229371086
    295 0.004877    127.0.0.1             127.0.0.1             TCP      59394 > commplex-main [ACK] Seq=140458 Ack=2 Win=65535 Len=1448 TSV=3229372216 TSER=3229371086
    296 0.004888    127.0.0.1             127.0.0.1             TCP      59394 > commplex-main [ACK] Seq=141906 Ack=2 Win=65535 Len=1448 TSV=3229372218 TSER=3229371086
    297 0.004896    127.0.0.1             127.0.0.1             TCP      59394 > commplex-main [ACK] Seq=143354 Ack=2 Win=65535 Len=1448 TSV=3229372221 TSER=3229371086
    298 0.004903    127.0.0.1             127.0.0.1             TCP      59394 > commplex-main [ACK] Seq=144802 Ack=2 Win=65535 Len=1448 TSV=3229372223 TSER=3229371086
    299 0.004910    127.0.0.1             127.0.0.1             TCP      59394 > commplex-main [ACK] Seq=146250 Ack=2 Win=65535 Len=1448 TSV=3229372225 TSER=3229371086
    300 0.004916    127.0.0.1             127.0.0.1             TCP      commplex-main > 59394 [ACK] Seq=2 Ack=92674 Win=64087 Len=0 TSV=3229372333 TSER=3229371250
    301 0.004923    127.0.0.1             127.0.0.1             TCP      commplex-main > 59394 [ACK] Seq=2 Ack=94122 Win=62639 Len=0 TSV=3229372341 TSER=3229371253
    302 0.004928    127.0.0.1             127.0.0.1             TCP      59394 > commplex-main [ACK] Seq=94122 Ack=2 Win=65535 Len=1448 TSV=3229371495 TSER=3229370491
    303 0.004941    127.0.0.1             127.0.0.1             TCP      59394 > commplex-main [ACK] Seq=95570 Ack=2 Win=65535 Len=1448 TSV=3229371497 TSER=3229370491
    304 0.004949    127.0.0.1             127.0.0.1             TCP      59394 > commplex-main [ACK] Seq=97018 Ack=2 Win=65535 Len=1448 TSV=3229371534 TSER=3229370499
    305 0.004959    127.0.0.1             127.0.0.1             TCP      59394 > commplex-main [ACK] Seq=98466 Ack=2 Win=65535 Len=1448 TSV=3229371536 TSER=3229370499
    306 0.004965    127.0.0.1             127.0.0.1             TCP      59394 > commplex-main [ACK] Seq=99914 Ack=2 Win=65535 Len=1448 TSV=3229371568 TSER=3229370503
    307 0.004974    127.0.0.1             127.0.0.1             TCP      59394 > commplex-main [ACK] Seq=101362 Ack=2 Win=65535 Len=1448 TSV=3229371571 TSER=3229370503
    308 0.004980    127.0.0.1             127.0.0.1             TCP      59394 > commplex-main [ACK] Seq=102810 Ack=2 Win=65535 Len=1448 TSV=3229371602 TSER=3229370519
    309 0.004990    127.0.0.1             127.0.0.1             TCP      59394 > commplex-main [ACK] Seq=104258 Ack=2 Win=65535 Len=1448 TSV=3229371604 TSER=3229370519
    310 0.004996    127.0.0.1             127.0.0.1             TCP      59394 > commplex-main [ACK] Seq=105706 Ack=2 Win=65535 Len=1448 TSV=3229371635 TSER=3229370523
    311 0.005005    127.0.0.1             127.0.0.1             TCP      59394 > commplex-main [ACK] Seq=107154 Ack=2 Win=65535 Len=1448 TSV=3229371638 TSER=3229370523
    312 0.005011    127.0.0.1             127.0.0.1             TCP      59394 > commplex-main [ACK] Seq=108602 Ack=2 Win=65535 Len=1448 TSV=3229371668 TSER=3229370605
    313 0.005025    127.0.0.1             127.0.0.1             TCP      59394 > commplex-main [ACK] Seq=110050 Ack=2 Win=65535 Len=1448 TSV=3229371671 TSER=3229370605
    314 0.005035    127.0.0.1             127.0.0.1             TCP      59394 > commplex-main [ACK] Seq=111498 Ack=2 Win=65535 Len=1448 TSV=3229371836 TSER=3229370841
    315 0.005041    127.0.0.1             127.0.0.1             TCP      59394 > commplex-main [ACK] Seq=112946 Ack=2 Win=65535 Len=1448 TSV=3229371839 TSER=3229370841
    316 0.005051    127.0.0.1             127.0.0.1             TCP      59394 > commplex-main [ACK] Seq=114394 Ack=2 Win=65535 Len=1448 TSV=3229371841 TSER=3229370841
    317 0.005062    127.0.0.1             127.0.0.1             TCP      59394 > commplex-main [ACK] Seq=115842 Ack=2 Win=65535 Len=1448 TSV=3229371843 TSER=3229370841
    318 0.005079    127.0.0.1             127.0.0.1             TCP      59394 > commplex-main [ACK] Seq=117290 Ack=2 Win=65535 Len=1448 TSV=3229371845 TSER=3229370841
    319 0.005093    127.0.0.1             127.0.0.1             TCP      59394 > commplex-main [ACK] Seq=118738 Ack=2 Win=65535 Len=1448 TSV=3229371847 TSER=3229370841
    320 0.005104    127.0.0.1             127.0.0.1             TCP      59394 > commplex-main [ACK] Seq=120186 Ack=2 Win=65535 Len=1448 TSV=3229371849 TSER=3229370841
    321 0.005116    127.0.0.1             127.0.0.1             TCP      59394 > commplex-main [ACK] Seq=121634 Ack=2 Win=65535 Len=1448 TSV=3229371851 TSER=3229370841
    322 0.005127    127.0.0.1             127.0.0.1             TCP      59394 > commplex-main [ACK] Seq=123082 Ack=2 Win=65535 Len=1448 TSV=3229371853 TSER=3229370841
    323 0.005138    127.0.0.1             127.0.0.1             TCP      59394 > commplex-main [ACK] Seq=124530 Ack=2 Win=65535 Len=1448 TSV=3229371855 TSER=3229370841
    324 0.005149    127.0.0.1             127.0.0.1             TCP      59394 > commplex-main [ACK] Seq=125978 Ack=2 Win=65535 Len=1448 TSV=3229371858 TSER=3229370841
    325 0.005157    127.0.0.1             127.0.0.1             TCP      59394 > commplex-main [ACK] Seq=127426 Ack=2 Win=65535 Len=1448 TSV=3229371860 TSER=3229370841
    326 0.005170    127.0.0.1             127.0.0.1             TCP      commplex-main > 59394 [ACK] Seq=2 Ack=95570 Win=65535 Len=0 TSV=3229372789 TSER=3229371495
    327 0.005176    127.0.0.1             127.0.0.1             TCP      commplex-main > 59394 [ACK] Seq=2 Ack=97018 Win=64087 Len=0 TSV=3229372805 TSER=3229371497
    328 0.005183    127.0.0.1             127.0.0.1             TCP      commplex-main > 59394 [ACK] Seq=2 Ack=98466 Win=62639 Len=0 TSV=3229372813 TSER=3229371534
    329 0.005189    127.0.0.1             127.0.0.1             TCP      commplex-main > 59394 [ACK] Seq=2 Ack=99914 Win=61191 Len=0 TSV=3229372825 TSER=3229371536
    330 0.005195    127.0.0.1             127.0.0.1             TCP      commplex-main > 59394 [ACK] Seq=2 Ack=101362 Win=59743 Len=0 TSV=3229372847 TSER=3229371568
    331 0.005201    127.0.0.1             127.0.0.1             TCP      commplex-main > 59394 [ACK] Seq=2 Ack=102810 Win=58295 Len=0 TSV=3229372858 TSER=3229371571
    332 0.005207    127.0.0.1             127.0.0.1             TCP      commplex-main > 59394 [ACK] Seq=2 Ack=104258 Win=56847 Len=0 TSV=3229372869 TSER=3229371602
    333 0.005214    127.0.0.1             127.0.0.1             TCP      commplex-main > 59394 [ACK] Seq=2 Ack=105706 Win=55399 Len=0 TSV=3229372881 TSER=3229371604
    334 0.005220    127.0.0.1             127.0.0.1             TCP      commplex-main > 59394 [ACK] Seq=2 Ack=107154 Win=53951 Len=0 TSV=3229372893 TSER=3229371635
    335 0.005227    127.0.0.1             127.0.0.1             TCP      commplex-main > 59394 [ACK] Seq=2 Ack=108602 Win=52503 Len=0 TSV=3229372910 TSER=3229371638
    336 0.005233    127.0.0.1             127.0.0.1             TCP      commplex-main > 59394 [ACK] Seq=2 Ack=110050 Win=51055 Len=0 TSV=3229372918 TSER=3229371668
    337 0.005240    127.0.0.1             127.0.0.1             TCP      commplex-main > 59394 [ACK] Seq=2 Ack=111498 Win=49607 Len=0 TSV=3229372930 TSER=3229371671
    338 0.005245    127.0.0.1             127.0.0.1             TCP      commplex-main > 59394 [ACK] Seq=2 Ack=112946 Win=48159 Len=0 TSV=3229372937 TSER=3229371836
    339 0.005257    127.0.0.1             127.0.0.1             TCP      59394 > commplex-main [ACK] Seq=128874 Ack=2 Win=65535 Len=1448 TSV=3229372199 TSER=3229371086
    340 0.005265    127.0.0.1             127.0.0.1             TCP      59394 > commplex-main [ACK] Seq=130322 Ack=2 Win=65535 Len=1448 TSV=3229372202 TSER=3229371086
    341 0.005276    127.0.0.1             127.0.0.1             TCP      59394 > commplex-main [ACK] Seq=131770 Ack=2 Win=65535 Len=1448 TSV=3229372204 TSER=3229371086
    342 0.005283    127.0.0.1             127.0.0.1             TCP      59394 > commplex-main [ACK] Seq=133218 Ack=2 Win=65535 Len=1448 TSV=3229372206 TSER=3229371086
    343 0.005292    127.0.0.1             127.0.0.1             TCP      59394 > commplex-main [ACK] Seq=134666 Ack=2 Win=65535 Len=1448 TSV=3229372208 TSER=3229371086
    344 0.005298    127.0.0.1             127.0.0.1             TCP      59394 > commplex-main [ACK] Seq=136114 Ack=2 Win=65535 Len=1448 TSV=3229372210 TSER=3229371086
    345 0.005307    127.0.0.1             127.0.0.1             TCP      59394 > commplex-main [ACK] Seq=137562 Ack=2 Win=65535 Len=1448 TSV=3229372212 TSER=3229371086
    346 0.005313    127.0.0.1             127.0.0.1             TCP      59394 > commplex-main [ACK] Seq=139010 Ack=2 Win=65535 Len=1448 TSV=3229372214 TSER=3229371086
    347 0.005327    127.0.0.1             127.0.0.1             TCP      59394 > commplex-main [ACK] Seq=140458 Ack=2 Win=65535 Len=1448 TSV=3229372216 TSER=3229371086
    348 0.005337    127.0.0.1             127.0.0.1             TCP      59394 > commplex-main [ACK] Seq=141906 Ack=2 Win=65535 Len=1448 TSV=3229372218 TSER=3229371086
    349 0.005347    127.0.0.1             127.0.0.1             TCP      59394 > commplex-main [ACK] Seq=143354 Ack=2 Win=65535 Len=1448 TSV=3229372221 TSER=3229371086
    350 0.005361    127.0.0.1             127.0.0.1             TCP      59394 > commplex-main [ACK] Seq=144802 Ack=2 Win=65535 Len=1448 TSV=3229372223 TSER=3229371086
    351 0.005373    127.0.0.1             127.0.0.1             TCP      59394 > commplex-main [ACK] Seq=146250 Ack=2 Win=65535 Len=1448 TSV=3229372225 TSER=3229371086
    352 0.005385    127.0.0.1             127.0.0.1             TCP      commplex-main > 59394 [ACK] Seq=2 Ack=92674 Win=64087 Len=0 TSV=3229372333 TSER=3229371250
    353 0.005396    127.0.0.1             127.0.0.1             TCP      commplex-main > 59394 [ACK] Seq=2 Ack=94122 Win=62639 Len=0 TSV=3229372341 TSER=3229371253
    354 0.005417    127.0.0.1             127.0.0.1             TCP      commplex-main > 59394 [ACK] Seq=2 Ack=114394 Win=64087 Len=0 TSV=3229373072 TSER=3229371839
    355 0.005424    127.0.0.1             127.0.0.1             TCP      commplex-main > 59394 [ACK] Seq=2 Ack=115842 Win=62639 Len=0 TSV=3229373083 TSER=3229371841
    356 0.005430    127.0.0.1             127.0.0.1             TCP      commplex-main > 59394 [ACK] Seq=2 Ack=117290 Win=61191 Len=0 TSV=3229373093 TSER=3229371843
    357 0.005437    127.0.0.1             127.0.0.1             TCP      commplex-main > 59394 [ACK] Seq=2 Ack=118738 Win=59743 Len=0 TSV=3229373109 TSER=3229371845
    358 0.005444    127.0.0.1             127.0.0.1             TCP      commplex-main > 59394 [ACK] Seq=2 Ack=120186 Win=58295 Len=0 TSV=3229373118 TSER=3229371847
    359 0.005450    127.0.0.1             127.0.0.1             TCP      commplex-main > 59394 [ACK] Seq=2 Ack=121634 Win=56847 Len=0 TSV=3229373129 TSER=3229371849
    360 0.005457    127.0.0.1             127.0.0.1             TCP      commplex-main > 59394 [ACK] Seq=2 Ack=123082 Win=55399 Len=0 TSV=3229373150 TSER=3229371851
    361 0.005463    127.0.0.1             127.0.0.1             TCP      commplex-main > 59394 [ACK] Seq=2 Ack=124530 Win=53951 Len=0 TSV=3229373163 TSER=3229371853
    362 0.005469    127.0.0.1             127.0.0.1             TCP      commplex-main > 59394 [ACK] Seq=2 Ack=125978 Win=52503 Len=0 TSV=3229373171 TSER=3229371855
    363 0.005476    127.0.0.1             127.0.0.1             TCP      commplex-main > 59394 [ACK] Seq=2 Ack=127426 Win=51055 Len=0 TSV=3229373182 TSER=3229371858
    364 0.005489    127.0.0.1             127.0.0.1             TCP      commplex-main > 59394 [ACK] Seq=2 Ack=95570 Win=65535 Len=0 TSV=3229372789 TSER=3229371495
    365 0.005497    127.0.0.1             127.0.0.1             TCP      commplex-main > 59394 [ACK] Seq=2 Ack=97018 Win=64087 Len=0 TSV=3229372805 TSER=3229371497
    366 0.005506    127.0.0.1             127.0.0.1             TCP      commplex-main > 59394 [ACK] Seq=2 Ack=98466 Win=62639 Len=0 TSV=3229372813 TSER=3229371534
    367 0.005520    127.0.0.1             127.0.0.1             TCP      commplex-main > 59394 [ACK] Seq=2 Ack=128874 Win=64087 Len=0 TSV=3229373231 TSER=3229371860
    368 0.005528    127.0.0.1             127.0.0.1             TCP      commplex-main > 59394 [ACK] Seq=2 Ack=130322 Win=62639 Len=0 TSV=3229373247 TSER=3229372199
    369 0.005534    127.0.0.1             127.0.0.1             TCP      commplex-main > 59394 [ACK] Seq=2 Ack=131770 Win=61191 Len=0 TSV=3229373260 TSER=3229372202
    370 0.005540    127.0.0.1             127.0.0.1             TCP      commplex-main > 59394 [ACK] Seq=2 Ack=133218 Win=59743 Len=0 TSV=3229373268 TSER=3229372204
    371 0.005555    127.0.0.1             127.0.0.1             TCP      commplex-main > 59394 [ACK] Seq=2 Ack=134666 Win=58295 Len=0 TSV=3229373280 TSER=3229372206
    372 0.005564    127.0.0.1             127.0.0.1             TCP      commplex-main > 59394 [ACK] Seq=2 Ack=99914 Win=61191 Len=0 TSV=3229372825 TSER=3229371536
    373 0.005576    127.0.0.1             127.0.0.1             TCP      commplex-main > 59394 [ACK] Seq=2 Ack=101362 Win=59743 Len=0 TSV=3229372847 TSER=3229371568
    374 0.005588    127.0.0.1             127.0.0.1             TCP      commplex-main > 59394 [ACK] Seq=2 Ack=102810 Win=58295 Len=0 TSV=3229372858 TSER=3229371571
    375 0.005597    127.0.0.1             127.0.0.1             TCP      commplex-main > 59394 [ACK] Seq=2 Ack=104258 Win=56847 Len=0 TSV=3229372869 TSER=3229371602
    376 0.005607    127.0.0.1             127.0.0.1             TCP      commplex-main > 59394 [ACK] Seq=2 Ack=105706 Win=55399 Len=0 TSV=3229372881 TSER=3229371604
    377 0.005616    127.0.0.1             127.0.0.1             TCP      commplex-main > 59394 [ACK] Seq=2 Ack=107154 Win=53951 Len=0 TSV=3229372893 TSER=3229371635
    378 0.005626    127.0.0.1             127.0.0.1             TCP      commplex-main > 59394 [ACK] Seq=2 Ack=108602 Win=52503 Len=0 TSV=3229372910 TSER=3229371638
    379 0.005647    127.0.0.1             127.0.0.1             TCP      commplex-main > 59394 [ACK] Seq=2 Ack=136114 Win=56847 Len=0 TSV=3229373297 TSER=3229372208
    380 0.005655    127.0.0.1             127.0.0.1             TCP      commplex-main > 59394 [ACK] Seq=2 Ack=137562 Win=55399 Len=0 TSV=3229373314 TSER=3229372210
    381 0.005661    127.0.0.1             127.0.0.1             TCP      commplex-main > 59394 [ACK] Seq=2 Ack=139010 Win=53951 Len=0 TSV=3229373324 TSER=3229372212
    382 0.005668    127.0.0.1             127.0.0.1             TCP      commplex-main > 59394 [ACK] Seq=2 Ack=140458 Win=52503 Len=0 TSV=3229373333 TSER=3229372214
    383 0.005674    127.0.0.1             127.0.0.1             TCP      commplex-main > 59394 [ACK] Seq=2 Ack=141906 Win=51055 Len=0 TSV=3229373343 TSER=3229372216
    384 0.005682    127.0.0.1             127.0.0.1             TCP      commplex-main > 59394 [ACK] Seq=2 Ack=143354 Win=49607 Len=0 TSV=3229373352 TSER=3229372218
    385 0.005688    127.0.0.1             127.0.0.1             TCP      commplex-main > 59394 [ACK] Seq=2 Ack=144802 Win=48159 Len=0 TSV=3229373362 TSER=3229372221
    386 0.005694    127.0.0.1             127.0.0.1             TCP      commplex-main > 59394 [ACK] Seq=2 Ack=146250 Win=46711 Len=0 TSV=3229373371 TSER=3229372223
    387 0.005701    127.0.0.1             127.0.0.1             TCP      commplex-main > 59394 [ACK] Seq=2 Ack=147698 Win=45263 Len=0 TSV=3229373387 TSER=3229372225
    388 0.005705    127.0.0.1             127.0.0.1             TCP      commplex-main > 59394 [ACK] Seq=2 Ack=110050 Win=51055 Len=0 TSV=3229372918 TSER=3229371668
    389 0.005749    127.0.0.1             127.0.0.1             TCP      59394 > commplex-main [ACK] Seq=147698 Ack=2 Win=65535 Len=1448 TSV=3229373476 TSER=3229372333
    390 0.005756    127.0.0.1             127.0.0.1             TCP      59394 > commplex-main [ACK] Seq=149146 Ack=2 Win=65535 Len=1448 TSV=3229373483 TSER=3229372333
    391 0.005763    127.0.0.1             127.0.0.1             TCP      59394 > commplex-main [ACK] Seq=150594 Ack=2 Win=65535 Len=1448 TSV=3229373488 TSER=3229372333
    392 0.005770    127.0.0.1             127.0.0.1             TCP      59394 > commplex-main [ACK] Seq=152042 Ack=2 Win=65535 Len=1448 TSV=3229373492 TSER=3229372333
    393 0.005777    127.0.0.1             127.0.0.1             TCP      59394 > commplex-main [ACK] Seq=153490 Ack=2 Win=65535 Len=1448 TSV=3229373497 TSER=3229372333
    394 0.005784    127.0.0.1             127.0.0.1             TCP      59394 > commplex-main [ACK] Seq=154938 Ack=2 Win=65535 Len=1448 TSV=3229373501 TSER=3229372333
    395 0.005797    127.0.0.1             127.0.0.1             TCP      commplex-main > 59394 [ACK] Seq=2 Ack=111498 Win=49607 Len=0 TSV=3229372930 TSER=3229371671
    396 0.005803    127.0.0.1             127.0.0.1             TCP      commplex-main > 59394 [ACK] Seq=2 Ack=112946 Win=48159 Len=0 TSV=3229372937 TSER=3229371836
    397 0.005814    127.0.0.1             127.0.0.1             TCP      commplex-main > 59394 [ACK] Seq=2 Ack=114394 Win=64087 Len=0 TSV=3229373072 TSER=3229371839
    398 0.005822    127.0.0.1             127.0.0.1             TCP      commplex-main > 59394 [ACK] Seq=2 Ack=115842 Win=62639 Len=0 TSV=3229373083 TSER=3229371841
    399 0.005836    127.0.0.1             127.0.0.1             TCP      commplex-main > 59394 [ACK] Seq=2 Ack=117290 Win=61191 Len=0 TSV=3229373093 TSER=3229371843
    400 0.005842    127.0.0.1             127.0.0.1             TCP      commplex-main > 59394 [ACK] Seq=2 Ack=118738 Win=59743 Len=0 TSV=3229373109 TSER=3229371845
    401 0.005851    127.0.0.1             127.0.0.1             TCP      commplex-main > 59394 [ACK] Seq=2 Ack=120186 Win=58295 Len=0 TSV=3229373118 TSER=3229371847
    402 0.005858    127.0.0.1             127.0.0.1             TCP      commplex-main > 59394 [ACK] Seq=2 Ack=121634 Win=56847 Len=0 TSV=3229373129 TSER=3229371849
    403 0.005868    127.0.0.1             127.0.0.1             TCP      commplex-main > 59394 [ACK] Seq=2 Ack=123082 Win=55399 Len=0 TSV=3229373150 TSER=3229371851
    404 0.005881    127.0.0.1             127.0.0.1             TCP      commplex-main > 59394 [ACK] Seq=2 Ack=124530 Win=53951 Len=0 TSV=3229373163 TSER=3229371853
    405 0.005888    127.0.0.1             127.0.0.1             TCP      commplex-main > 59394 [ACK] Seq=2 Ack=125978 Win=52503 Len=0 TSV=3229373171 TSER=3229371855
    406 0.005897    127.0.0.1             127.0.0.1             TCP      commplex-main > 59394 [ACK] Seq=2 Ack=127426 Win=51055 Len=0 TSV=3229373182 TSER=3229371858
    407 0.005903    127.0.0.1             127.0.0.1             TCP      commplex-main > 59394 [ACK] Seq=2 Ack=128874 Win=64087 Len=0 TSV=3229373231 TSER=3229371860
    408 0.005912    127.0.0.1             127.0.0.1             TCP      commplex-main > 59394 [ACK] Seq=2 Ack=130322 Win=62639 Len=0 TSV=3229373247 TSER=3229372199
    409 0.005921    127.0.0.1             127.0.0.1             TCP      commplex-main > 59394 [ACK] Seq=2 Ack=131770 Win=61191 Len=0 TSV=3229373260 TSER=3229372202
    410 0.005930    127.0.0.1             127.0.0.1             TCP      commplex-main > 59394 [ACK] Seq=2 Ack=133218 Win=59743 Len=0 TSV=3229373268 TSER=3229372204
    411 0.005936    127.0.0.1             127.0.0.1             TCP      commplex-main > 59394 [ACK] Seq=2 Ack=134666 Win=58295 Len=0 TSV=3229373280 TSER=3229372206
    412 0.005945    127.0.0.1             127.0.0.1             TCP      commplex-main > 59394 [ACK] Seq=2 Ack=136114 Win=56847 Len=0 TSV=3229373297 TSER=3229372208
    413 0.005951    127.0.0.1             127.0.0.1             TCP      commplex-main > 59394 [ACK] Seq=2 Ack=137562 Win=55399 Len=0 TSV=3229373314 TSER=3229372210
    414 0.005960    127.0.0.1             127.0.0.1             TCP      commplex-main > 59394 [ACK] Seq=2 Ack=139010 Win=53951 Len=0 TSV=3229373324 TSER=3229372212
    415 0.005966    127.0.0.1             127.0.0.1             TCP      commplex-main > 59394 [ACK] Seq=2 Ack=140458 Win=52503 Len=0 TSV=3229373333 TSER=3229372214
    416 0.005975    127.0.0.1             127.0.0.1             TCP      commplex-main > 59394 [ACK] Seq=2 Ack=141906 Win=51055 Len=0 TSV=3229373343 TSER=3229372216
    417 0.005981    127.0.0.1             127.0.0.1             TCP      commplex-main > 59394 [ACK] Seq=2 Ack=143354 Win=49607 Len=0 TSV=3229373352 TSER=3229372218
    418 0.005991    127.0.0.1             127.0.0.1             TCP      commplex-main > 59394 [ACK] Seq=2 Ack=144802 Win=48159 Len=0 TSV=3229373362 TSER=3229372221
    419 0.005998    127.0.0.1             127.0.0.1             TCP      commplex-main > 59394 [ACK] Seq=2 Ack=146250 Win=46711 Len=0 TSV=3229373371 TSER=3229372223
    420 0.006007    127.0.0.1             127.0.0.1             TCP      commplex-main > 59394 [ACK] Seq=2 Ack=147698 Win=45263 Len=0 TSV=3229373387 TSER=3229372225
    421 0.006013    127.0.0.1             127.0.0.1             TCP      59394 > commplex-main [ACK] Seq=147698 Ack=2 Win=65535 Len=1448 TSV=3229373476 TSER=3229372333
    422 0.006023    127.0.0.1             127.0.0.1             TCP      59394 > commplex-main [ACK] Seq=149146 Ack=2 Win=65535 Len=1448 TSV=3229373483 TSER=3229372333
    423 0.006029    127.0.0.1             127.0.0.1             TCP      59394 > commplex-main [ACK] Seq=150594 Ack=2 Win=65535 Len=1448 TSV=3229373488 TSER=3229372333
    424 0.006038    127.0.0.1             127.0.0.1             TCP      59394 > commplex-main [ACK] Seq=152042 Ack=2 Win=65535 Len=1448 TSV=3229373492 TSER=3229372333
    425 0.006044    127.0.0.1             127.0.0.1             TCP      59394 > commplex-main [ACK] Seq=153490 Ack=2 Win=65535 Len=1448 TSV=3229373497 TSER=3229372333
    426 0.006055    127.0.0.1             127.0.0.1             TCP      59394 > commplex-main [ACK] Seq=154938 Ack=2 Win=65535 Len=1448 TSV=3229373501 TSER=3229372333
    427 0.006138    127.0.0.1             127.0.0.1             TCP      59394 > commplex-main [ACK] Seq=156386 Ack=2 Win=65535 Len=1448 TSV=3229373619 TSER=3229372789
    428 0.006146    127.0.0.1             127.0.0.1             TCP      59394 > commplex-main [ACK] Seq=157834 Ack=2 Win=65535 Len=1448 TSV=3229373623 TSER=3229372789
    429 0.006153    127.0.0.1             127.0.0.1             TCP      59394 > commplex-main [ACK] Seq=159282 Ack=2 Win=65535 Len=1448 TSV=3229373625 TSER=3229372789
    430 0.006189    127.0.0.1             127.0.0.1             TCP      59394 > commplex-main [ACK] Seq=156386 Ack=2 Win=65535 Len=1448 TSV=3229373619 TSER=3229372789
    431 0.006200    127.0.0.1             127.0.0.1             TCP      59394 > commplex-main [ACK] Seq=157834 Ack=2 Win=65535 Len=1448 TSV=3229373623 TSER=3229372789
    432 0.006207    127.0.0.1             127.0.0.1             TCP      59394 > commplex-main [ACK] Seq=159282 Ack=2 Win=65535 Len=1448 TSV=3229373625 TSER=3229372789
    433 0.006305    127.0.0.1             127.0.0.1             TCP      59394 > commplex-main [ACK] Seq=160730 Ack=2 Win=65535 Len=1448 TSV=3229374026 TSER=3229373072
    434 0.006313    127.0.0.1             127.0.0.1             TCP      59394 > commplex-main [ACK] Seq=162178 Ack=2 Win=65535 Len=1448 TSV=3229374035 TSER=3229373072
    435 0.006328    127.0.0.1             127.0.0.1             TCP      59394 > commplex-main [ACK] Seq=163626 Ack=2 Win=65535 Len=1448 TSV=3229374037 TSER=3229373072
    436 0.006336    127.0.0.1             127.0.0.1             TCP      59394 > commplex-main [ACK] Seq=165074 Ack=2 Win=65535 Len=1448 TSV=3229374040 TSER=3229373072
    437 0.006343    127.0.0.1             127.0.0.1             TCP      59394 > commplex-main [ACK] Seq=166522 Ack=2 Win=65535 Len=1448 TSV=3229374042 TSER=3229373072
    438 0.006351    127.0.0.1             127.0.0.1             TCP      59394 > commplex-main [ACK] Seq=167970 Ack=2 Win=65535 Len=1448 TSV=3229374044 TSER=3229373072
    439 0.006358    127.0.0.1             127.0.0.1             TCP      59394 > commplex-main [ACK] Seq=169418 Ack=2 Win=65535 Len=1448 TSV=3229374046 TSER=3229373072
    440 0.006365    127.0.0.1             127.0.0.1             TCP      59394 > commplex-main [ACK] Seq=170866 Ack=2 Win=65535 Len=1448 TSV=3229374049 TSER=3229373072
    441 0.006372    127.0.0.1             127.0.0.1             TCP      59394 > commplex-main [ACK] Seq=172314 Ack=2 Win=65535 Len=1448 TSV=3229374051 TSER=3229373072
    442 0.006380    127.0.0.1             127.0.0.1             TCP      59394 > commplex-main [ACK] Seq=173762 Ack=2 Win=65535 Len=1448 TSV=3229374053 TSER=3229373072
    443 0.006387    127.0.0.1             127.0.0.1             TCP      59394 > commplex-main [ACK] Seq=175210 Ack=2 Win=65535 Len=1448 TSV=3229374055 TSER=3229373072
    444 0.006394    127.0.0.1             127.0.0.1             TCP      59394 > commplex-main [ACK] Seq=176658 Ack=2 Win=65535 Len=1448 TSV=3229374057 TSER=3229373072
    445 0.006403    127.0.0.1             127.0.0.1             TCP      59394 > commplex-main [ACK] Seq=160730 Ack=2 Win=65535 Len=1448 TSV=3229374026 TSER=3229373072
    446 0.006413    127.0.0.1             127.0.0.1             TCP      59394 > commplex-main [ACK] Seq=162178 Ack=2 Win=65535 Len=1448 TSV=3229374035 TSER=3229373072
    447 0.006422    127.0.0.1             127.0.0.1             TCP      59394 > commplex-main [ACK] Seq=163626 Ack=2 Win=65535 Len=1448 TSV=3229374037 TSER=3229373072
    448 0.006429    127.0.0.1             127.0.0.1             TCP      59394 > commplex-main [ACK] Seq=165074 Ack=2 Win=65535 Len=1448 TSV=3229374040 TSER=3229373072
    449 0.006439    127.0.0.1             127.0.0.1             TCP      59394 > commplex-main [ACK] Seq=166522 Ack=2 Win=65535 Len=1448 TSV=3229374042 TSER=3229373072
    450 0.006446    127.0.0.1             127.0.0.1             TCP      59394 > commplex-main [ACK] Seq=167970 Ack=2 Win=65535 Len=1448 TSV=3229374044 TSER=3229373072
    451 0.006455    127.0.0.1             127.0.0.1             TCP      59394 > commplex-main [ACK] Seq=169418 Ack=2 Win=65535 Len=1448 TSV=3229374046 TSER=3229373072
    452 0.006462    127.0.0.1             127.0.0.1             TCP      59394 > commplex-main [ACK] Seq=170866 Ack=2 Win=65535 Len=1448 TSV=3229374049 TSER=3229373072
    453 0.006473    127.0.0.1             127.0.0.1             TCP      59394 > commplex-main [ACK] Seq=172314 Ack=2 Win=65535 Len=1448 TSV=3229374051 TSER=3229373072
    454 0.006480    127.0.0.1             127.0.0.1             TCP      59394 > commplex-main [ACK] Seq=173762 Ack=2 Win=65535 Len=1448 TSV=3229374053 TSER=3229373072
    455 0.006501    127.0.0.1             127.0.0.1             TCP      59394 > commplex-main [ACK] Seq=175210 Ack=2 Win=65535 Len=1448 TSV=3229374055 TSER=3229373072
    456 0.006508    127.0.0.1             127.0.0.1             TCP      59394 > commplex-main [ACK] Seq=176658 Ack=2 Win=65535 Len=1448 TSV=3229374057 TSER=3229373072
    457 0.006707    127.0.0.1             127.0.0.1             TCP      59394 > commplex-main [ACK] Seq=178106 Ack=2 Win=65535 Len=1448 TSV=3229374433 TSER=3229373231
    458 0.006715    127.0.0.1             127.0.0.1             TCP      59394 > commplex-main [ACK] Seq=179554 Ack=2 Win=65535 Len=1448 TSV=3229374437 TSER=3229373231
    459 0.006737    127.0.0.1             127.0.0.1             TCP      59394 > commplex-main [ACK] Seq=181002 Ack=2 Win=65535 Len=1448 TSV=3229374439 TSER=3229373231
    460 0.006745    127.0.0.1             127.0.0.1             TCP      59394 > commplex-main [ACK] Seq=182450 Ack=2 Win=65535 Len=1448 TSV=3229374442 TSER=3229373231
    461 0.006752    127.0.0.1             127.0.0.1             TCP      59394 > commplex-main [ACK] Seq=183898 Ack=2 Win=65535 Len=1448 TSV=3229374445 TSER=3229373231
    462 0.006760    127.0.0.1             127.0.0.1             TCP      59394 > commplex-main [ACK] Seq=185346 Ack=2 Win=65535 Len=1448 TSV=3229374447 TSER=3229373231
    463 0.006768    127.0.0.1             127.0.0.1             TCP      59394 > commplex-main [ACK] Seq=186794 Ack=2 Win=65535 Len=1448 TSV=3229374449 TSER=3229373231
    464 0.006781    127.0.0.1             127.0.0.1             TCP      59394 > commplex-main [ACK] Seq=188242 Ack=2 Win=65535 Len=1448 TSV=3229374451 TSER=3229373231
    465 0.006789    127.0.0.1             127.0.0.1             TCP      59394 > commplex-main [ACK] Seq=189690 Ack=2 Win=65535 Len=1448 TSV=3229374453 TSER=3229373231
    466 0.006796    127.0.0.1             127.0.0.1             TCP      59394 > commplex-main [ACK] Seq=191138 Ack=2 Win=65535 Len=1448 TSV=3229374456 TSER=3229373231
    467 0.006807    127.0.0.1             127.0.0.1             TCP      59394 > commplex-main [ACK] Seq=178106 Ack=2 Win=65535 Len=1448 TSV=3229374433 TSER=3229373231
    468 0.006819    127.0.0.1             127.0.0.1             TCP      59394 > commplex-main [ACK] Seq=179554 Ack=2 Win=65535 Len=1448 TSV=3229374437 TSER=3229373231
    469 0.006829    127.0.0.1             127.0.0.1             TCP      59394 > commplex-main [ACK] Seq=181002 Ack=2 Win=65535 Len=1448 TSV=3229374439 TSER=3229373231
    470 0.006836    127.0.0.1             127.0.0.1             TCP      59394 > commplex-main [ACK] Seq=182450 Ack=2 Win=65535 Len=1448 TSV=3229374442 TSER=3229373231
    471 0.006847    127.0.0.1             127.0.0.1             TCP      59394 > commplex-main [ACK] Seq=183898 Ack=2 Win=65535 Len=1448 TSV=3229374445 TSER=3229373231
    472 0.006854    127.0.0.1             127.0.0.1             TCP      59394 > commplex-main [ACK] Seq=185346 Ack=2 Win=65535 Len=1448 TSV=3229374447 TSER=3229373231
    473 0.006863    127.0.0.1             127.0.0.1             TCP      59394 > commplex-main [ACK] Seq=186794 Ack=2 Win=65535 Len=1448 TSV=3229374449 TSER=3229373231
    474 0.006869    127.0.0.1             127.0.0.1             TCP      59394 > commplex-main [ACK] Seq=188242 Ack=2 Win=65535 Len=1448 TSV=3229374451 TSER=3229373231
    475 0.006882    127.0.0.1             127.0.0.1             TCP      59394 > commplex-main [ACK] Seq=189690 Ack=2 Win=65535 Len=1448 TSV=3229374453 TSER=3229373231
    476 0.006889    127.0.0.1             127.0.0.1             TCP      59394 > commplex-main [ACK] Seq=191138 Ack=2 Win=65535 Len=1448 TSV=3229374456 TSER=3229373231
    477 0.007120    127.0.0.1             127.0.0.1             TCP      commplex-main > 59394 [ACK] Seq=2 Ack=149146 Win=65535 Len=0 TSV=3229374850 TSER=3229373476
    478 0.007126    127.0.0.1             127.0.0.1             TCP      commplex-main > 59394 [ACK] Seq=2 Ack=149146 Win=65535 Len=0 TSV=3229374850 TSER=3229373476
    479 0.007153    127.0.0.1             127.0.0.1             TCP      commplex-main > 59394 [ACK] Seq=2 Ack=150594 Win=64087 Len=0 TSV=3229374881 TSER=3229373483
    480 0.007158    127.0.0.1             127.0.0.1             TCP      commplex-main > 59394 [ACK] Seq=2 Ack=150594 Win=64087 Len=0 TSV=3229374881 TSER=3229373483
    481 0.007178    127.0.0.1             127.0.0.1             TCP      commplex-main > 59394 [ACK] Seq=2 Ack=152042 Win=62639 Len=0 TSV=3229374888 TSER=3229373488
    482 0.007185    127.0.0.1             127.0.0.1             TCP      commplex-main > 59394 [ACK] Seq=2 Ack=153490 Win=61191 Len=0 TSV=3229374901 TSER=3229373492
    483 0.007192    127.0.0.1             127.0.0.1             TCP      commplex-main > 59394 [ACK] Seq=2 Ack=154938 Win=59743 Len=0 TSV=3229374911 TSER=3229373497
    484 0.007198    127.0.0.1             127.0.0.1             TCP      commplex-main > 59394 [ACK] Seq=2 Ack=156386 Win=58295 Len=0 TSV=3229374920 TSER=3229373501
    485 0.007205    127.0.0.1             127.0.0.1             TCP      commplex-main > 59394 [ACK] Seq=2 Ack=157834 Win=56847 Len=0 TSV=3229374931 TSER=3229373619
    486 0.007212    127.0.0.1             127.0.0.1             TCP      commplex-main > 59394 [ACK] Seq=2 Ack=159282 Win=55399 Len=0 TSV=3229374939 TSER=3229373623
    487 0.007219    127.0.0.1             127.0.0.1             TCP      commplex-main > 59394 [ACK] Seq=2 Ack=160730 Win=53951 Len=0 TSV=3229374950 TSER=3229373625
    488 0.007228    127.0.0.1             127.0.0.1             TCP      commplex-main > 59394 [ACK] Seq=2 Ack=152042 Win=62639 Len=0 TSV=3229374888 TSER=3229373488
    489 0.007240    127.0.0.1             127.0.0.1             TCP      commplex-main > 59394 [ACK] Seq=2 Ack=153490 Win=61191 Len=0 TSV=3229374901 TSER=3229373492
    490 0.007251    127.0.0.1             127.0.0.1             TCP      commplex-main > 59394 [ACK] Seq=2 Ack=154938 Win=59743 Len=0 TSV=3229374911 TSER=3229373497
    491 0.007263    127.0.0.1             127.0.0.1             TCP      commplex-main > 59394 [ACK] Seq=2 Ack=156386 Win=58295 Len=0 TSV=3229374920 TSER=3229373501
    492 0.007274    127.0.0.1             127.0.0.1             TCP      commplex-main > 59394 [ACK] Seq=2 Ack=157834 Win=56847 Len=0 TSV=3229374931 TSER=3229373619
    493 0.007287    127.0.0.1             127.0.0.1             TCP      commplex-main > 59394 [ACK] Seq=2 Ack=159282 Win=55399 Len=0 TSV=3229374939 TSER=3229373623
    494 0.007298    127.0.0.1             127.0.0.1             TCP      commplex-main > 59394 [ACK] Seq=2 Ack=160730 Win=53951 Len=0 TSV=3229374950 TSER=3229373625
    495 0.007312    127.0.0.1             127.0.0.1             TCP      commplex-main > 59394 [ACK] Seq=2 Ack=162178 Win=52503 Len=0 TSV=3229374959 TSER=3229374026
    496 0.007320    127.0.0.1             127.0.0.1             TCP      commplex-main > 59394 [ACK] Seq=2 Ack=163626 Win=51055 Len=0 TSV=3229374971 TSER=3229374035
    497 0.007328    127.0.0.1             127.0.0.1             TCP      commplex-main > 59394 [ACK] Seq=2 Ack=165074 Win=49607 Len=0 TSV=3229374984 TSER=3229374037
    498 0.007336    127.0.0.1             127.0.0.1             TCP      commplex-main > 59394 [ACK] Seq=2 Ack=166522 Win=48159 Len=0 TSV=3229374996 TSER=3229374040
    499 0.007344    127.0.0.1             127.0.0.1             TCP      commplex-main > 59394 [ACK] Seq=2 Ack=167970 Win=46711 Len=0 TSV=3229375007 TSER=3229374042
    500 0.007351    127.0.0.1             127.0.0.1             TCP      commplex-main > 59394 [ACK] Seq=2 Ack=169418 Win=45263 Len=0 TSV=3229375018 TSER=3229374044
    501 0.007359    127.0.0.1             127.0.0.1             TCP      commplex-main > 59394 [ACK] Seq=2 Ack=162178 Win=52503 Len=0 TSV=3229374959 TSER=3229374026
    502 0.007371    127.0.0.1             127.0.0.1             TCP      commplex-main > 59394 [ACK] Seq=2 Ack=163626 Win=51055 Len=0 TSV=3229374971 TSER=3229374035
    503 0.007382    127.0.0.1             127.0.0.1             TCP      commplex-main > 59394 [ACK] Seq=2 Ack=165074 Win=49607 Len=0 TSV=3229374984 TSER=3229374037
    504 0.007396    127.0.0.1             127.0.0.1             TCP      commplex-main > 59394 [ACK] Seq=2 Ack=166522 Win=48159 Len=0 TSV=3229374996 TSER=3229374040
    505 0.007408    127.0.0.1             127.0.0.1             TCP      commplex-main > 59394 [ACK] Seq=2 Ack=167970 Win=46711 Len=0 TSV=3229375007 TSER=3229374042
    506 0.007418    127.0.0.1             127.0.0.1             TCP      commplex-main > 59394 [ACK] Seq=2 Ack=169418 Win=45263 Len=0 TSV=3229375018 TSER=3229374044
    507 0.007431    127.0.0.1             127.0.0.1             TCP      commplex-main > 59394 [ACK] Seq=2 Ack=170866 Win=43815 Len=0 TSV=3229375031 TSER=3229374046
    508 0.007443    127.0.0.1             127.0.0.1             TCP      commplex-main > 59394 [ACK] Seq=2 Ack=170866 Win=43815 Len=0 TSV=3229375031 TSER=3229374046
    509 0.007457    127.0.0.1             127.0.0.1             TCP      commplex-main > 59394 [ACK] Seq=2 Ack=172314 Win=42367 Len=0 TSV=3229375043 TSER=3229374049
    510 0.007465    127.0.0.1             127.0.0.1             TCP      commplex-main > 59394 [ACK] Seq=2 Ack=173762 Win=40919 Len=0 TSV=3229375060 TSER=3229374051
    511 0.007472    127.0.0.1             127.0.0.1             TCP      commplex-main > 59394 [ACK] Seq=2 Ack=175210 Win=39471 Len=0 TSV=3229375069 TSER=3229374053
    512 0.007482    127.0.0.1             127.0.0.1             TCP      commplex-main > 59394 [ACK] Seq=2 Ack=176658 Win=38023 Len=0 TSV=3229375080 TSER=3229374055
    513 0.007490    127.0.0.1             127.0.0.1             TCP      commplex-main > 59394 [ACK] Seq=2 Ack=178106 Win=36575 Len=0 TSV=3229375090 TSER=3229374057
    514 0.007498    127.0.0.1             127.0.0.1             TCP      commplex-main > 59394 [ACK] Seq=2 Ack=179554 Win=35127 Len=0 TSV=3229375103 TSER=3229374433
    515 0.007505    127.0.0.1             127.0.0.1             TCP      commplex-main > 59394 [ACK] Seq=2 Ack=181002 Win=33679 Len=0 TSV=3229375115 TSER=3229374437
    516 0.007512    127.0.0.1             127.0.0.1             TCP      commplex-main > 59394 [ACK] Seq=2 Ack=182450 Win=32231 Len=0 TSV=3229375128 TSER=3229374439
    517 0.007520    127.0.0.1             127.0.0.1             TCP      commplex-main > 59394 [ACK] Seq=2 Ack=183898 Win=30783 Len=0 TSV=3229375144 TSER=3229374442
    518 0.007527    127.0.0.1             127.0.0.1             TCP      commplex-main > 59394 [ACK] Seq=2 Ack=185346 Win=29335 Len=0 TSV=3229375155 TSER=3229374445
    519 0.007533    127.0.0.1             127.0.0.1             TCP      commplex-main > 59394 [ACK] Seq=2 Ack=186794 Win=27887 Len=0 TSV=3229375171 TSER=3229374447
    520 0.007540    127.0.0.1             127.0.0.1             TCP      commplex-main > 59394 [ACK] Seq=2 Ack=188242 Win=26439 Len=0 TSV=3229375184 TSER=3229374449
    521 0.007548    127.0.0.1             127.0.0.1             TCP      commplex-main > 59394 [ACK] Seq=2 Ack=189690 Win=24991 Len=0 TSV=3229375200 TSER=3229374451
    522 0.007555    127.0.0.1             127.0.0.1             TCP      commplex-main > 59394 [ACK] Seq=2 Ack=191138 Win=23543 Len=0 TSV=3229375210 TSER=3229374453
    523 0.007562    127.0.0.1             127.0.0.1             TCP      commplex-main > 59394 [ACK] Seq=2 Ack=192586 Win=22095 Len=0 TSV=3229375222 TSER=3229374456
    524 0.007573    127.0.0.1             127.0.0.1             TCP      commplex-main > 59394 [ACK] Seq=2 Ack=172314 Win=42367 Len=0 TSV=3229375043 TSER=3229374049
    525 0.007580    127.0.0.1             127.0.0.1             TCP      commplex-main > 59394 [ACK] Seq=2 Ack=173762 Win=40919 Len=0 TSV=3229375060 TSER=3229374051
    526 0.007590    127.0.0.1             127.0.0.1             TCP      commplex-main > 59394 [ACK] Seq=2 Ack=175210 Win=39471 Len=0 TSV=3229375069 TSER=3229374053
    527 0.007597    127.0.0.1             127.0.0.1             TCP      commplex-main > 59394 [ACK] Seq=2 Ack=176658 Win=38023 Len=0 TSV=3229375080 TSER=3229374055
    528 0.007608    127.0.0.1             127.0.0.1             TCP      commplex-main > 59394 [ACK] Seq=2 Ack=178106 Win=36575 Len=0 TSV=3229375090 TSER=3229374057
    529 0.007620    127.0.0.1             127.0.0.1             TCP      commplex-main > 59394 [ACK] Seq=2 Ack=179554 Win=35127 Len=0 TSV=3229375103 TSER=3229374433
    530 0.007631    127.0.0.1             127.0.0.1             TCP      commplex-main > 59394 [ACK] Seq=2 Ack=181002 Win=33679 Len=0 TSV=3229375115 TSER=3229374437
    531 0.007638    127.0.0.1             127.0.0.1             TCP      commplex-main > 59394 [ACK] Seq=2 Ack=182450 Win=32231 Len=0 TSV=3229375128 TSER=3229374439
    532 0.007655    127.0.0.1             127.0.0.1             TCP      commplex-main > 59394 [ACK] Seq=2 Ack=192586 Win=65535 Len=0 TSV=3229375325 TSER=3229374456
    533 0.007669    127.0.0.1             127.0.0.1             TCP      commplex-main > 59394 [ACK] Seq=2 Ack=183898 Win=30783 Len=0 TSV=3229375144 TSER=3229374442
    534 0.007681    127.0.0.1             127.0.0.1             TCP      commplex-main > 59394 [ACK] Seq=2 Ack=185346 Win=29335 Len=0 TSV=3229375155 TSER=3229374445
    535 0.007692    127.0.0.1             127.0.0.1             TCP      commplex-main > 59394 [ACK] Seq=2 Ack=186794 Win=27887 Len=0 TSV=3229375171 TSER=3229374447
    536 0.007706    127.0.0.1             127.0.0.1             TCP      commplex-main > 59394 [ACK] Seq=2 Ack=188242 Win=26439 Len=0 TSV=3229375184 TSER=3229374449
    537 0.007717    127.0.0.1             127.0.0.1             TCP      commplex-main > 59394 [ACK] Seq=2 Ack=189690 Win=24991 Len=0 TSV=3229375200 TSER=3229374451
    538 0.007725    127.0.0.1             127.0.0.1             TCP      commplex-main > 59394 [ACK] Seq=2 Ack=191138 Win=23543 Len=0 TSV=3229375210 TSER=3229374453
    539 0.007735    127.0.0.1             127.0.0.1             TCP      commplex-main > 59394 [ACK] Seq=2 Ack=192586 Win=22095 Len=0 TSV=3229375222 TSER=3229374456
    540 0.007743    127.0.0.1             127.0.0.1             TCP      commplex-main > 59394 [ACK] Seq=2 Ack=192586 Win=65535 Len=0 TSV=3229375325 TSER=3229374456
    541 0.007758    127.0.0.1             127.0.0.1             TCP      59394 > commplex-main [ACK] Seq=192586 Ack=2 Win=65535 Len=1448 TSV=3229375420 TSER=3229374850
    542 0.007767    127.0.0.1             127.0.0.1             TCP      59394 > commplex-main [ACK] Seq=194034 Ack=2 Win=65535 Len=1448 TSV=3229375427 TSER=3229374850
    543 0.007775    127.0.0.1             127.0.0.1             TCP      59394 > commplex-main [ACK] Seq=195482 Ack=2 Win=65535 Len=1448 TSV=3229375434 TSER=3229374850
    544 0.007783    127.0.0.1             127.0.0.1             TCP      59394 > commplex-main [ACK] Seq=196930 Ack=2 Win=65535 Len=1448 TSV=3229375447 TSER=3229374850
    545 0.007790    127.0.0.1             127.0.0.1             TCP      59394 > commplex-main [ACK] Seq=198378 Ack=2 Win=65535 Len=1448 TSV=3229375454 TSER=3229374850
    546 0.007797    127.0.0.1             127.0.0.1             TCP      59394 > commplex-main [ACK] Seq=199826 Ack=2 Win=65535 Len=176 TSV=3229375462 TSER=3229374850
    547 0.007809    127.0.0.1             127.0.0.1             TCP      59394 > commplex-main [ACK] Seq=192586 Ack=2 Win=65535 Len=1448 TSV=3229375420 TSER=3229374850
    548 0.007818    127.0.0.1             127.0.0.1             TCP      59394 > commplex-main [ACK] Seq=194034 Ack=2 Win=65535 Len=1448 TSV=3229375427 TSER=3229374850
    549 0.007829    127.0.0.1             127.0.0.1             TCP      59394 > commplex-main [ACK] Seq=195482 Ack=2 Win=65535 Len=1448 TSV=3229375434 TSER=3229374850
    550 0.007836    127.0.0.1             127.0.0.1             TCP      59394 > commplex-main [ACK] Seq=196930 Ack=2 Win=65535 Len=1448 TSV=3229375447 TSER=3229374850
    551 0.007845    127.0.0.1             127.0.0.1             TCP      59394 > commplex-main [ACK] Seq=198378 Ack=2 Win=65535 Len=1448 TSV=3229375454 TSER=3229374850
    552 0.007852    127.0.0.1             127.0.0.1             TCP      59394 > commplex-main [ACK] Seq=199826 Ack=2 Win=65535 Len=176 TSV=3229375462 TSER=3229374850
    553 0.008631    127.0.0.1             127.0.0.1             TCP      commplex-main > 59394 [ACK] Seq=2 Ack=194034 Win=65535 Len=0 TSV=3229376359 TSER=3229375420
    554 0.008638    127.0.0.1             127.0.0.1             TCP      commplex-main > 59394 [ACK] Seq=2 Ack=194034 Win=65535 Len=0 TSV=3229376359 TSER=3229375420
    555 0.008660    127.0.0.1             127.0.0.1             TCP      commplex-main > 59394 [ACK] Seq=2 Ack=195482 Win=64087 Len=0 TSV=3229376393 TSER=3229375427
    556 0.008675    127.0.0.1             127.0.0.1             TCP      commplex-main > 59394 [ACK] Seq=2 Ack=195482 Win=64087 Len=0 TSV=3229376393 TSER=3229375427
    557 0.008689    127.0.0.1             127.0.0.1             TCP      commplex-main > 59394 [ACK] Seq=2 Ack=196930 Win=62639 Len=0 TSV=3229376397 TSER=3229375434
    558 0.008697    127.0.0.1             127.0.0.1             TCP      commplex-main > 59394 [ACK] Seq=2 Ack=198378 Win=61191 Len=0 TSV=3229376407 TSER=3229375447
    559 0.008704    127.0.0.1             127.0.0.1             TCP      commplex-main > 59394 [ACK] Seq=2 Ack=199826 Win=59743 Len=0 TSV=3229376419 TSER=3229375454
    560 0.008711    127.0.0.1             127.0.0.1             TCP      commplex-main > 59394 [ACK] Seq=2 Ack=200002 Win=59567 Len=0 TSV=3229376429 TSER=3229375462
    561 0.008720    127.0.0.1             127.0.0.1             TCP      commplex-main > 59394 [ACK] Seq=2 Ack=196930 Win=62639 Len=0 TSV=3229376397 TSER=3229375434
    562 0.008727    127.0.0.1             127.0.0.1             TCP      commplex-main > 59394 [ACK] Seq=2 Ack=198378 Win=61191 Len=0 TSV=3229376407 TSER=3229375447
    563 0.008738    127.0.0.1             127.0.0.1             TCP      commplex-main > 59394 [ACK] Seq=2 Ack=199826 Win=59743 Len=0 TSV=3229376419 TSER=3229375454
    564 0.008746    127.0.0.1             127.0.0.1             TCP      commplex-main > 59394 [ACK] Seq=2 Ack=200002 Win=59567 Len=0 TSV=3229376429 TSER=3229375462
    565 0.008955    127.0.0.1             127.0.0.1             TCP      59394 > commplex-main [FIN, ACK] Seq=200002 Ack=2 Win=65535 Len=0 TSV=3229376681 TSER=3229376429
    566 0.008958    127.0.0.1             127.0.0.1             TCP      59394 > commplex-main [FIN, ACK] Seq=200002 Ack=2 Win=65535 Len=0 TSV=3229376681 TSER=3229376429
    567 0.009017    127.0.0.1             127.0.0.1             TCP      commplex-main > 59394 [ACK] Seq=2 Ack=200003 Win=65535 Len=0 TSV=3229376745 TSER=3229376681
    568 0.009028    127.0.0.1             127.0.0.1             TCP      commplex-main > 59394 [ACK] Seq=2 Ack=200003 Win=65535 Len=0 TSV=3229376745 TSER=3229376681
    569 0.009105    127.0.0.1             127.0.0.1             TCP      commplex-main > 59394 [FIN, ACK] Seq=2 Ack=200003 Win=65535 Len=0 TSV=3229376831 TSER=3229376681
    570 0.009111    127.0.0.1             127.0.0.1             TCP      commplex-main > 59394 [FIN, ACK] Seq=2 Ack=200003 Win=65535 Len=0 TSV=3229376831 TSER=3229376681
    571 0.009243    127.0.0.1             127.0.0.1             TCP      59394 > commplex-main [ACK] Seq=200003 Ack=3 Win=65535 Len=0 TSV=3229376966 TSER=3229376831
    572 0.009246    127.0.0.1             127.0.0.1             TCP      59394 > commplex-main [ACK] Seq=200003 Ack=3 Win=65535 Len=0 TSV=3229376966 TSER=3229376831
