No.     Time        Source                Destination           Protocol Info
      1 0.000000    127.0.0.1             127.0.0.1             TCP      56255 > commplex-main [SYN] Seq=1 Win=65535 Len=0 TSV=2777156605 TSER=0
      2 0.000057    127.0.0.1             127.0.0.1             TCP      56255 > commplex-main [SYN] Seq=1 Win=65535 Len=0 TSV=2777156605 TSER=0
      3 0.000141    127.0.0.1             127.0.0.1             TCP      commplex-main > 56255 [SYN, ACK] Seq=1 Ack=2 Win=65535 Len=0 TSV=2777156758 TSER=2777156605
      4 0.000160    127.0.0.1             127.0.0.1             TCP      commplex-main > 56255 [SYN, ACK] Seq=1 Ack=2 Win=65535 Len=0 TSV=2777156758 TSER=2777156605
      5 0.000209    127.0.0.1             127.0.0.1             TCP      56255 > commplex-main [ACK] Seq=2 Ack=2 Win=65535 Len=0 TSV=2777156832 TSER=2777156758
      6 0.000222    127.0.0.1             127.0.0.1             TCP      56255 > commplex-main [ACK] Seq=2 Ack=2 Win=65535 Len=0 TSV=2777156832 TSER=2777156758
      7 0.000396    127.0.0.1             127.0.0.1             TCP      56255 > commplex-main [ACK] Seq=2 Ack=2 Win=65535 Len=1448 TSV=2777157015 TSER=2777156758
      8 0.000420    127.0.0.1             127.0.0.1             TCP      56255 > commplex-main [ACK] Seq=2 Ack=2 Win=65535 Len=1448 TSV=2777157015 TSER=2777156758
      9 0.000491    127.0.0.1             127.0.0.1             TCP      commplex-main > 56255 [ACK] Seq=2 Ack=1450 Win=65535 Len=0 TSV=2777157117 TSER=2777157015
     10 0.000505    127.0.0.1             127.0.0.1             TCP      commplex-main > 56255 [ACK] Seq=2 Ack=1450 Win=65535 Len=0 TSV=2777157117 TSER=2777157015
     11 0.000584    127.0.0.1             127.0.0.1             TCP      56255 > commplex-main [ACK] Seq=1450 Ack=2 Win=65535 Len=1448 TSV=2777157195 TSER=2777157117
     12 0.000591    127.0.0.1             127.0.0.1             TCP      56255 > commplex-main [ACK] Seq=2898 Ack=2 Win=65535 Len=1448 TSV=2777157197 TSER=2777157117
     13 0.000631    127.0.0.1             127.0.0.1             TCP      56255 > commplex-main [ACK] Seq=1450 Ack=2 Win=65535 Len=1448 TSV=2777157195 TSER=2777157117
     14 0.000653    127.0.0.1             127.0.0.1             TCP      56255 > commplex-main [ACK] Seq=2898 Ack=2 Win=65535 Len=1448 TSV=2777157197 TSER=2777157117
     15 0.000696    127.0.0.1             127.0.0.1             TCP      commplex-main > 56255 [ACK] Seq=2 Ack=2898 Win=65535 Len=0 TSV=2777157311 TSER=2777157195
     16 0.000701    127.0.0.1             127.0.0.1             TCP      commplex-main > 56255 [ACK] Seq=2 Ack=4346 Win=64087 Len=0 TSV=2777157322 TSER=2777157197
     17 0.000723    127.0.0.1             127.0.0.1             TCP      commplex-main > 56255 [ACK] Seq=2 Ack=2898 Win=65535 Len=0 TSV=2777157311 TSER=2777157195
     18 0.000789    127.0.0.1             127.0.0.1             TCP      56255 > commplex-main [ACK] Seq=4346 Ack=2 Win=65535 Len=1448 TSV=2777157409 TSER=2777157311
     19 0.000795    127.0.0.1             127.0.0.1             TCP      56255 > commplex-main [ACK] Seq=5794 Ack=2 Win=65535 Len=1448 TSV=2777157411 TSER=2777157311
     20 0.000807    127.0.0.1             127.0.0.1             TCP      commplex-main > 56255 [ACK] Seq=2 Ack=4346 Win=64087 Len=0 TSV=2777157322 TSER=2777157197
     21 0.000877    127.0.0.1             127.0.0.1             TCP      56255 > commplex-main [ACK] Seq=7242 Ack=2 Win=65535 Len=1448 TSV=2777157490 TSER=2777157322
     22 0.000883    127.0.0.1             127.0.0.1             TCP      56255 > commplex-main [ACK] Seq=8690 Ack=2 Win=65535 Len=1448 TSV=2777157493 TSER=2777157322
     23 0.000902    127.0.0.1             127.0.0.1             TCP      56255 > commplex-main [ACK] Seq=4346 Ack=2 Win=65535 Len=1448 TSV=2777157409 TSER=2777157311
     24 0.000943    127.0.0.1             127.0.0.1             TCP      56255 > commplex-main [ACK] Seq=5794 Ack=2 Win=65535 Len=1448 TSV=2777157411 TSER=2777157311
     25 0.000948    127.0.0.1             127.0.0.1             TCP      commplex-main > 56255 [ACK] Seq=2 Ack=5794 Win=65535 Len=0 TSV=2777157559 TSER=2777157409
     26 0.000968    127.0.0.1             127.0.0.1             TCP      56255 > commplex-main [ACK] Seq=7242 Ack=2 Win=65535 Len=1448 TSV=2777157490 TSER=2777157322
     27 0.001000    127.0.0.1             127.0.0.1             TCP      commplex-main > 56255 [ACK] Seq=2 Ack=7242 Win=64087 Len=0 TSV=2777157598 TSER=2777157411
     28 0.001008    127.0.0.1             127.0.0.1             TCP      56255 > commplex-main [ACK] Seq=8690 Ack=2 Win=65535 Len=1448 TSV=2777157493 TSER=2777157322
     29 0.001015    127.0.0.1             127.0.0.1             TCP      commplex-main > 56255 [ACK] Seq=2 Ack=8690 Win=64087 Len=0 TSV=2777157625 TSER=2777157490
     30 0.001038    127.0.0.1             127.0.0.1             TCP      commplex-main > 56255 [ACK] Seq=2 Ack=5794 Win=65535 Len=0 TSV=2777157559 TSER=2777157409
     31 0.001053    127.0.0.1             127.0.0.1             TCP      commplex-main > 56255 [ACK] Seq=2 Ack=10138 Win=64087 Len=0 TSV=2777157666 TSER=2777157493
     32 0.001117    127.0.0.1             127.0.0.1             TCP      56255 > commplex-main [ACK] Seq=10138 Ack=2 Win=65535 Len=1448 TSV=2777157724 TSER=2777157559
     33 0.001123    127.0.0.1             127.0.0.1             TCP      56255 > commplex-main [ACK] Seq=11586 Ack=2 Win=65535 Len=1448 TSV=2777157726 TSER=2777157559
     34 0.001126    127.0.0.1             127.0.0.1             TCP      commplex-main > 56255 [ACK] Seq=2 Ack=7242 Win=64087 Len=0 TSV=2777157598 TSER=2777157411
     35 0.001155    127.0.0.1             127.0.0.1             TCP      commplex-main > 56255 [ACK] Seq=2 Ack=8690 Win=64087 Len=0 TSV=2777157625 TSER=2777157490
     36 0.001172    127.0.0.1             127.0.0.1             TCP      commplex-main > 56255 [ACK] Seq=2 Ack=10138 Win=64087 Len=0 TSV=2777157666 TSER=2777157493
     37 0.001200    127.0.0.1             127.0.0.1             TCP      56255 > commplex-main [ACK] Seq=10138 Ack=2 Win=65535 Len=1448 TSV=2777157724 TSER=2777157559
     38 0.001219    127.0.0.1             127.0.0.1             TCP      56255 > commplex-main [ACK] Seq=11586 Ack=2 Win=65535 Len=1448 TSV=2777157726 TSER=2777157559
     39 0.001309    127.0.0.1             127.0.0.1             TCP      56255 > commplex-main [ACK] Seq=13034 Ack=2 Win=65535 Len=1448 TSV=2777157825 TSER=2777157598
     40 0.001315    127.0.0.1             127.0.0.1             TCP      56255 > commplex-main [ACK] Seq=14482 Ack=2 Win=65535 Len=1448 TSV=2777157828 TSER=2777157598
     41 0.001322    127.0.0.1             127.0.0.1             TCP      56255 > commplex-main [ACK] Seq=13034 Ack=2 Win=65535 Len=1448 TSV=2777157825 TSER=2777157598
     42 0.001349    127.0.0.1             127.0.0.1             TCP      56255 > commplex-main [ACK] Seq=15930 Ack=2 Win=65535 Len=1448 TSV=2777157886 TSER=2777157625
     43 0.001354    127.0.0.1             127.0.0.1             TCP      56255 > commplex-main [ACK] Seq=17378 Ack=2 Win=65535 Len=1448 TSV=2777157889 TSER=2777157625
     44 0.001360    127.0.0.1             127.0.0.1             TCP      56255 > commplex-main [ACK] Seq=18826 Ack=2 Win=65535 Len=1448 TSV=2777157922 TSER=2777157666
     45 0.001365    127.0.0.1             127.0.0.1             TCP      56255 > commplex-main [ACK] Seq=20274 Ack=2 Win=65535 Len=1448 TSV=2777157924 TSER=2777157666
     46 0.001375    127.0.0.1             127.0.0.1             TCP      56255 > commplex-main [ACK] Seq=14482 Ack=2 Win=65535 Len=1448 TSV=2777157828 TSER=2777157598
     47 0.001411    127.0.0.1             127.0.0.1             TCP      commplex-main > 56255 [ACK] Seq=2 Ack=11586 Win=65535 Len=0 TSV=2777157935 TSER=2777157724
     48 0.001417    127.0.0.1             127.0.0.1             TCP      commplex-main > 56255 [ACK] Seq=2 Ack=13034 Win=64087 Len=0 TSV=2777158016 TSER=2777157726
     49 0.001421    127.0.0.1             127.0.0.1             TCP      commplex-main > 56255 [ACK] Seq=2 Ack=14482 Win=62639 Len=0 TSV=2777158031 TSER=2777157825
     50 0.001432    127.0.0.1             127.0.0.1             TCP      commplex-main > 56255 [ACK] Seq=2 Ack=15930 Win=64087 Len=0 TSV=2777158040 TSER=2777157828
     51 0.001436    127.0.0.1             127.0.0.1             TCP      56255 > commplex-main [ACK] Seq=15930 Ack=2 Win=65535 Len=1448 TSV=2777157886 TSER=2777157625
     52 0.001477    127.0.0.1             127.0.0.1             TCP      56255 > commplex-main [ACK] Seq=17378 Ack=2 Win=65535 Len=1448 TSV=2777157889 TSER=2777157625
     53 0.001480    127.0.0.1             127.0.0.1             TCP      commplex-main > 56255 [ACK] Seq=2 Ack=17378 Win=64087 Len=0 TSV=2777158097 TSER=2777157886
     54 0.001495    127.0.0.1             127.0.0.1             TCP      56255 > commplex-main [ACK] Seq=18826 Ack=2 Win=65535 Len=1448 TSV=2777157922 TSER=2777157666
     55 0.001523    127.0.0.1             127.0.0.1             TCP      commplex-main > 56255 [ACK] Seq=2 Ack=18826 Win=64087 Len=0 TSV=2777158148 TSER=2777157889
     56 0.001535    127.0.0.1             127.0.0.1             TCP      commplex-main > 56255 [ACK] Seq=2 Ack=11586 Win=65535 Len=0 TSV=2777157935 TSER=2777157724
     57 0.001552    127.0.0.1             127.0.0.1             TCP      commplex-main > 56255 [ACK] Seq=2 Ack=13034 Win=64087 Len=0 TSV=2777158016 TSER=2777157726
     58 0.001562    127.0.0.1             127.0.0.1             TCP      commplex-main > 56255 [ACK] Seq=2 Ack=20274 Win=62639 Len=0 TSV=2777158174 TSER=2777157922
     59 0.001584    127.0.0.1             127.0.0.1             TCP      commplex-main > 56255 [ACK] Seq=2 Ack=14482 Win=62639 Len=0 TSV=2777158031 TSER=2777157825
     60 0.001602    127.0.0.1             127.0.0.1             TCP      commplex-main > 56255 [ACK] Seq=2 Ack=15930 Win=64087 Len=0 TSV=2777158040 TSER=2777157828
     61 0.001623    127.0.0.1             127.0.0.1             TCP      commplex-main > 56255 [ACK] Seq=2 Ack=17378 Win=64087 Len=0 TSV=2777158097 TSER=2777157886
     62 0.001640    127.0.0.1             127.0.0.1             TCP      commplex-main > 56255 [ACK] Seq=2 Ack=18826 Win=64087 Len=0 TSV=2777158148 TSER=2777157889
     63 0.001662    127.0.0.1             127.0.0.1             TCP      commplex-main > 56255 [ACK] Seq=2 Ack=20274 Win=62639 Len=0 TSV=2777158174 TSER=2777157922
     64 0.001670    127.0.0.1             127.0.0.1             TCP      56255 > commplex-main [ACK] Seq=21722 Ack=2 Win=65535 Len=1448 TSV=2777158238 TSER=2777157935
     65 0.001684    127.0.0.1             127.0.0.1             TCP      56255 > commplex-main [ACK] Seq=23170 Ack=2 Win=65535 Len=1448 TSV=2777158241 TSER=2777157935
     66 0.001690    127.0.0.1             127.0.0.1             TCP      56255 > commplex-main [ACK] Seq=24618 Ack=2 Win=65535 Len=1448 TSV=2777158275 TSER=2777158016
     67 0.001692    127.0.0.1             127.0.0.1             TCP      56255 > commplex-main [ACK] Seq=21722 Ack=2 Win=65535 Len=1448 TSV=2777158238 TSER=2777157935
     68 0.001695    127.0.0.1             127.0.0.1             TCP      56255 > commplex-main [ACK] Seq=26066 Ack=2 Win=65535 Len=1448 TSV=2777158277 TSER=2777158016
     69 0.001717    127.0.0.1             127.0.0.1             TCP      56255 > commplex-main [ACK] Seq=23170 Ack=2 Win=65535 Len=1448 TSV=2777158241 TSER=2777157935
     70 0.001753    127.0.0.1             127.0.0.1             TCP      56255 > commplex-main [ACK] Seq=24618 Ack=2 Win=65535 Len=1448 TSV=2777158275 TSER=2777158016
     71 0.001765    127.0.0.1             127.0.0.1             TCP      56255 > commplex-main [ACK] Seq=26066 Ack=2 Win=65535 Len=1448 TSV=2777158277 TSER=2777158016
     72 0.001942    127.0.0.1             127.0.0.1             TCP      56255 > commplex-main [ACK] Seq=27514 Ack=2 Win=65535 Len=1448 TSV=2777158390 TSER=2777158031
     73 0.001948    127.0.0.1             127.0.0.1             TCP      56255 > commplex-main [ACK] Seq=28962 Ack=2 Win=65535 Len=1448 TSV=2777158393 TSER=2777158031
     74 0.001954    127.0.0.1             127.0.0.1             TCP      56255 > commplex-main [ACK] Seq=30410 Ack=2 Win=65535 Len=1448 TSV=2777158427 TSER=2777158040
     75 0.001959    127.0.0.1             127.0.0.1             TCP      56255 > commplex-main [ACK] Seq=31858 Ack=2 Win=65535 Len=1448 TSV=2777158429 TSER=2777158040
     76 0.001963    127.0.0.1             127.0.0.1             TCP      56255 > commplex-main [ACK] Seq=33306 Ack=2 Win=65535 Len=1448 TSV=2777158462 TSER=2777158097
     77 0.001972    127.0.0.1             127.0.0.1             TCP      56255 > commplex-main [ACK] Seq=34754 Ack=2 Win=65535 Len=1448 TSV=2777158464 TSER=2777158097
     78 0.001977    127.0.0.1             127.0.0.1             TCP      56255 > commplex-main [ACK] Seq=36202 Ack=2 Win=65535 Len=1448 TSV=2777158494 TSER=2777158148
     79 0.001983    127.0.0.1             127.0.0.1             TCP      56255 > commplex-main [ACK] Seq=37650 Ack=2 Win=65535 Len=1448 TSV=2777158497 TSER=2777158148
     80 0.001989    127.0.0.1             127.0.0.1             TCP      56255 > commplex-main [ACK] Seq=39098 Ack=2 Win=65535 Len=1448 TSV=2777158527 TSER=2777158174
     81 0.001993    127.0.0.1             127.0.0.1             TCP      56255 > commplex-main [ACK] Seq=40546 Ack=2 Win=65535 Len=1448 TSV=2777158530 TSER=2777158174
     82 0.001998    127.0.0.1             127.0.0.1             TCP      commplex-main > 56255 [ACK] Seq=2 Ack=20274 Win=64087 Len=0 TSV=2777158535 TSER=2777158238
     83 0.002002    127.0.0.1             127.0.0.1             TCP      commplex-main > 56255 [ACK] Seq=2 Ack=20274 Win=62639 Len=0 TSV=2777158563 TSER=2777158241
     84 0.002006    127.0.0.1             127.0.0.1             TCP      commplex-main > 56255 [ACK] Seq=2 Ack=20274 Win=61191 Len=0 TSV=2777158567 TSER=2777158275
     85 0.002024    127.0.0.1             127.0.0.1             TCP      commplex-main > 56255 [ACK] Seq=2 Ack=20274 Win=59743 Len=0 TSV=2777158573 TSER=2777158277
     86 0.002026    127.0.0.1             127.0.0.1             TCP      56255 > commplex-main [ACK] Seq=27514 Ack=2 Win=65535 Len=1448 TSV=2777158390 TSER=2777158031
     87 0.002059    127.0.0.1             127.0.0.1             TCP      commplex-main > 56255 [ACK] Seq=2 Ack=20274 Win=58295 Len=0 TSV=2777158686 TSER=2777158390
     88 0.002080    127.0.0.1             127.0.0.1             TCP      56255 > commplex-main [ACK] Seq=28962 Ack=2 Win=65535 Len=1448 TSV=2777158393 TSER=2777158031
     89 0.002115    127.0.0.1             127.0.0.1             TCP      56255 > commplex-main [ACK] Seq=30410 Ack=2 Win=65535 Len=1448 TSV=2777158427 TSER=2777158040
     90 0.002119    127.0.0.1             127.0.0.1             TCP      commplex-main > 56255 [ACK] Seq=2 Ack=20274 Win=56847 Len=0 TSV=2777158738 TSER=2777158393
     91 0.002148    127.0.0.1             127.0.0.1             TCP      56255 > commplex-main [ACK] Seq=31858 Ack=2 Win=65535 Len=1448 TSV=2777158429 TSER=2777158040
     92 0.002152    127.0.0.1             127.0.0.1             TCP      commplex-main > 56255 [ACK] Seq=2 Ack=20274 Win=55399 Len=0 TSV=2777158772 TSER=2777158427
     93 0.002178    127.0.0.1             127.0.0.1             TCP      commplex-main > 56255 [ACK] Seq=2 Ack=20274 Win=53951 Len=0 TSV=2777158803 TSER=2777158429
     94 0.002189    127.0.0.1             127.0.0.1             TCP      56255 > commplex-main [ACK] Seq=33306 Ack=2 Win=65535 Len=1448 TSV=2777158462 TSER=2777158097
     95 0.002205    127.0.0.1             127.0.0.1             TCP      56255 > commplex-main [ACK] Seq=34754 Ack=2 Win=65535 Len=1448 TSV=2777158464 TSER=2777158097
     96 0.002222    127.0.0.1             127.0.0.1             TCP      56255 > commplex-main [ACK] Seq=36202 Ack=2 Win=65535 Len=1448 TSV=2777158494 TSER=2777158148
     97 0.002232    127.0.0.1             127.0.0.1             TCP      commplex-main > 56255 [ACK] Seq=2 Ack=20274 Win=52503 Len=0 TSV=2777158847 TSER=2777158462
     98 0.002236    127.0.0.1             127.0.0.1             TCP      commplex-main > 56255 [ACK] Seq=2 Ack=20274 Win=51055 Len=0 TSV=2777158860 TSER=2777158464
     99 0.002260    127.0.0.1             127.0.0.1             TCP      56255 > commplex-main [ACK] Seq=37650 Ack=2 Win=65535 Len=1448 TSV=2777158497 TSER=2777158148
    100 0.002264    127.0.0.1             127.0.0.1             TCP      commplex-main > 56255 [ACK] Seq=2 Ack=20274 Win=49607 Len=0 TSV=2777158884 TSER=2777158494
    101 0.002294    127.0.0.1             127.0.0.1             TCP      56255 > commplex-main [ACK] Seq=39098 Ack=2 Win=65535 Len=1448 TSV=2777158527 TSER=2777158174
    102 0.002298    127.0.0.1             127.0.0.1             TCP      commplex-main > 56255 [ACK] Seq=2 Ack=20274 Win=48159 Len=0 TSV=2777158918 TSER=2777158497
    103 0.002324    127.0.0.1             127.0.0.1             TCP      commplex-main > 56255 [ACK] Seq=2 Ack=20274 Win=46711 Len=0 TSV=2777158950 TSER=2777158527
    104 0.002334    127.0.0.1             127.0.0.1             TCP      56255 > commplex-main [ACK] Seq=40546 Ack=2 Win=65535 Len=1448 TSV=2777158530 TSER=2777158174
    105 0.002345    127.0.0.1             127.0.0.1             TCP      commplex-main > 56255 [ACK] Seq=2 Ack=20274 Win=64087 Len=0 TSV=2777158535 TSER=2777158238
    106 0.002351    127.0.0.1             127.0.0.1             TCP      commplex-main > 56255 [ACK] Seq=2 Ack=20274 Win=62639 Len=0 TSV=2777158563 TSER=2777158241
    107 0.002361    127.0.0.1             127.0.0.1             TCP      commplex-main > 56255 [ACK] Seq=2 Ack=20274 Win=61191 Len=0 TSV=2777158567 TSER=2777158275
    108 0.002367    127.0.0.1             127.0.0.1             TCP      commplex-main > 56255 [ACK] Seq=2 Ack=20274 Win=59743 Len=0 TSV=2777158573 TSER=2777158277
    109 0.002375    127.0.0.1             127.0.0.1             TCP      commplex-main > 56255 [ACK] Seq=2 Ack=20274 Win=58295 Len=0 TSV=2777158686 TSER=2777158390
    110 0.002381    127.0.0.1             127.0.0.1             TCP      commplex-main > 56255 [ACK] Seq=2 Ack=20274 Win=56847 Len=0 TSV=2777158738 TSER=2777158393
    111 0.002389    127.0.0.1             127.0.0.1             TCP      commplex-main > 56255 [ACK] Seq=2 Ack=20274 Win=55399 Len=0 TSV=2777158772 TSER=2777158427
    112 0.002402    127.0.0.1             127.0.0.1             TCP      commplex-main > 56255 [ACK] Seq=2 Ack=20274 Win=53951 Len=0 TSV=2777158803 TSER=2777158429
    113 0.002411    127.0.0.1             127.0.0.1             TCP      commplex-main > 56255 [ACK] Seq=2 Ack=20274 Win=52503 Len=0 TSV=2777158847 TSER=2777158462
    114 0.002416    127.0.0.1             127.0.0.1             TCP      commplex-main > 56255 [ACK] Seq=2 Ack=20274 Win=51055 Len=0 TSV=2777158860 TSER=2777158464
    115 0.002424    127.0.0.1             127.0.0.1             TCP      commplex-main > 56255 [ACK] Seq=2 Ack=20274 Win=49607 Len=0 TSV=2777158884 TSER=2777158494
    116 0.002430    127.0.0.1             127.0.0.1             TCP      commplex-main > 56255 [ACK] Seq=2 Ack=20274 Win=48159 Len=0 TSV=2777158918 TSER=2777158497
    117 0.002437    127.0.0.1             127.0.0.1             TCP      commplex-main > 56255 [ACK] Seq=2 Ack=20274 Win=46711 Len=0 TSV=2777158950 TSER=2777158527
    118 0.002531    127.0.0.1             127.0.0.1             TCP      commplex-main > 56255 [ACK] Seq=2 Ack=20274 Win=45263 Len=0 TSV=2777159098 TSER=2777158530
    119 0.002536    127.0.0.1             127.0.0.1             TCP      56255 > commplex-main [ACK] Seq=20274 Ack=2 Win=65535 Len=1448 TSV=2777159150 TSER=2777158573
    120 0.002545    127.0.0.1             127.0.0.1             TCP      commplex-main > 56255 [ACK] Seq=2 Ack=20274 Win=45263 Len=0 TSV=2777159098 TSER=2777158530
    121 0.002557    127.0.0.1             127.0.0.1             TCP      56255 > commplex-main [ACK] Seq=20274 Ack=2 Win=65535 Len=1448 TSV=2777159150 TSER=2777158573
    122 0.002645    127.0.0.1             127.0.0.1             TCP      commplex-main > 56255 [ACK] Seq=2 Ack=41994 Win=65535 Len=0 TSV=2777159227 TSER=2777159150
    123 0.002664    127.0.0.1             127.0.0.1             TCP      commplex-main > 56255 [ACK] Seq=2 Ack=41994 Win=65535 Len=0 TSV=2777159227 TSER=2777159150
    124 0.002740    127.0.0.1             127.0.0.1             TCP      56255 > commplex-main [ACK] Seq=41994 Ack=2 Win=65535 Len=1448 TSV=2777159355 TSER=2777159227
    125 0.002746    127.0.0.1             127.0.0.1             TCP      56255 > commplex-main [ACK] Seq=43442 Ack=2 Win=65535 Len=1448 TSV=2777159357 TSER=2777159227
    126 0.002760    127.0.0.1             127.0.0.1             TCP      56255 > commplex-main [ACK] Seq=41994 Ack=2 Win=65535 Len=1448 TSV=2777159355 TSER=2777159227
    127 0.002800    127.0.0.1             127.0.0.1             TCP      commplex-main > 56255 [ACK] Seq=2 Ack=43442 Win=65535 Len=0 TSV=2777159419 TSER=2777159355
    128 0.002812    127.0.0.1             127.0.0.1             TCP      56255 > commplex-main [ACK] Seq=43442 Ack=2 Win=65535 Len=1448 TSV=2777159357 TSER=2777159227
    129 0.002823    127.0.0.1             127.0.0.1             TCP      commplex-main > 56255 [ACK] Seq=2 Ack=43442 Win=65535 Len=0 TSV=2777159419 TSER=2777159355
    130 0.002861    127.0.0.1             127.0.0.1             TCP      commplex-main > 56255 [ACK] Seq=2 Ack=44890 Win=65535 Len=0 TSV=2777159481 TSER=2777159357
    131 0.002898    127.0.0.1             127.0.0.1             TCP      56255 > commplex-main [ACK] Seq=44890 Ack=2 Win=65535 Len=1448 TSV=2777159519 TSER=2777159419
    132 0.002904    127.0.0.1             127.0.0.1             TCP      56255 > commplex-main [ACK] Seq=46338 Ack=2 Win=65535 Len=1448 TSV=2777159521 TSER=2777159419
    133 0.002917    127.0.0.1             127.0.0.1             TCP      commplex-main > 56255 [ACK] Seq=2 Ack=44890 Win=65535 Len=0 TSV=2777159481 TSER=2777159357
    134 0.002937    127.0.0.1             127.0.0.1             TCP      56255 > commplex-main [ACK] Seq=44890 Ack=2 Win=65535 Len=1448 TSV=2777159519 TSER=2777159419
    135 0.002960    127.0.0.1             127.0.0.1             TCP      56255 > commplex-main [ACK] Seq=46338 Ack=2 Win=65535 Len=1448 TSV=2777159521 TSER=2777159419
    136 0.003014    127.0.0.1             127.0.0.1             TCP      56255 > commplex-main [ACK] Seq=47786 Ack=2 Win=65535 Len=1448 TSV=2777159616 TSER=2777159481
    137 0.003020    127.0.0.1             127.0.0.1             TCP      56255 > commplex-main [ACK] Seq=49234 Ack=2 Win=65535 Len=1448 TSV=2777159619 TSER=2777159481
    138 0.003024    127.0.0.1             127.0.0.1             TCP      commplex-main > 56255 [ACK] Seq=2 Ack=46338 Win=65535 Len=0 TSV=2777159627 TSER=2777159519
    139 0.003028    127.0.0.1             127.0.0.1             TCP      commplex-main > 56255 [ACK] Seq=2 Ack=47786 Win=64087 Len=0 TSV=2777159635 TSER=2777159521
    140 0.003059    127.0.0.1             127.0.0.1             TCP      56255 > commplex-main [ACK] Seq=47786 Ack=2 Win=65535 Len=1448 TSV=2777159616 TSER=2777159481
    141 0.003104    127.0.0.1             127.0.0.1             TCP      56255 > commplex-main [ACK] Seq=49234 Ack=2 Win=65535 Len=1448 TSV=2777159619 TSER=2777159481
    142 0.003116    127.0.0.1             127.0.0.1             TCP      commplex-main > 56255 [ACK] Seq=2 Ack=49234 Win=64087 Len=0 TSV=2777159741 TSER=2777159616
    143 0.003151    127.0.0.1             127.0.0.1             TCP      commplex-main > 56255 [ACK] Seq=2 Ack=46338 Win=65535 Len=0 TSV=2777159627 TSER=2777159519
    144 0.003163    127.0.0.1             127.0.0.1             TCP      commplex-main > 56255 [ACK] Seq=2 Ack=50682 Win=64087 Len=0 TSV=2777159789 TSER=2777159619
    145 0.003190    127.0.0.1             127.0.0.1             TCP      commplex-main > 56255 [ACK] Seq=2 Ack=47786 Win=64087 Len=0 TSV=2777159635 TSER=2777159521
    146 0.003207    127.0.0.1             127.0.0.1             TCP      commplex-main > 56255 [ACK] Seq=2 Ack=49234 Win=64087 Len=0 TSV=2777159741 TSER=2777159616
    147 0.003229    127.0.0.1             127.0.0.1             TCP      commplex-main > 56255 [ACK] Seq=2 Ack=50682 Win=64087 Len=0 TSV=2777159789 TSER=2777159619
    148 0.003253    127.0.0.1             127.0.0.1             TCP      56255 > commplex-main [ACK] Seq=50682 Ack=2 Win=65535 Len=1448 TSV=2777159844 TSER=2777159627
    149 0.003259    127.0.0.1             127.0.0.1             TCP      56255 > commplex-main [ACK] Seq=52130 Ack=2 Win=65535 Len=1448 TSV=2777159846 TSER=2777159627
    150 0.003272    127.0.0.1             127.0.0.1             TCP      56255 > commplex-main [ACK] Seq=50682 Ack=2 Win=65535 Len=1448 TSV=2777159844 TSER=2777159627
    151 0.003294    127.0.0.1             127.0.0.1             TCP      56255 > commplex-main [ACK] Seq=52130 Ack=2 Win=65535 Len=1448 TSV=2777159846 TSER=2777159627
    152 0.003395    127.0.0.1             127.0.0.1             TCP      56255 > commplex-main [ACK] Seq=53578 Ack=2 Win=65535 Len=1448 TSV=2777159907 TSER=2777159635
    153 0.003401    127.0.0.1             127.0.0.1             TCP      56255 > commplex-main [ACK] Seq=55026 Ack=2 Win=65535 Len=1448 TSV=2777159910 TSER=2777159635
    154 0.003407    127.0.0.1             127.0.0.1             TCP      56255 > commplex-main [ACK] Seq=56474 Ack=2 Win=65535 Len=1448 TSV=2777159945 TSER=2777159741
    155 0.003412    127.0.0.1             127.0.0.1             TCP      56255 > commplex-main [ACK] Seq=57922 Ack=2 Win=65535 Len=1448 TSV=2777159947 TSER=2777159741
    156 0.003417    127.0.0.1             127.0.0.1             TCP      56255 > commplex-main [ACK] Seq=59370 Ack=2 Win=65535 Len=1448 TSV=2777159994 TSER=2777159789
    157 0.003423    127.0.0.1             127.0.0.1             TCP      56255 > commplex-main [ACK] Seq=60818 Ack=2 Win=65535 Len=1448 TSV=2777159997 TSER=2777159789
    158 0.003427    127.0.0.1             127.0.0.1             TCP      commplex-main > 56255 [ACK] Seq=2 Ack=52130 Win=65535 Len=0 TSV=2777160007 TSER=2777159844
    159 0.003431    127.0.0.1             127.0.0.1             TCP      commplex-main > 56255 [ACK] Seq=2 Ack=53578 Win=64087 Len=0 TSV=2777160015 TSER=2777159846
    160 0.003450    127.0.0.1             127.0.0.1             TCP      56255 > commplex-main [ACK] Seq=53578 Ack=2 Win=65535 Len=1448 TSV=2777159907 TSER=2777159635
    161 0.003486    127.0.0.1             127.0.0.1             TCP      56255 > commplex-main [ACK] Seq=55026 Ack=2 Win=65535 Len=1448 TSV=2777159910 TSER=2777159635
    162 0.003498    127.0.0.1             127.0.0.1             TCP      commplex-main > 56255 [ACK] Seq=2 Ack=55026 Win=65535 Len=0 TSV=2777160111 TSER=2777159907
    163 0.003527    127.0.0.1             127.0.0.1             TCP      56255 > commplex-main [ACK] Seq=56474 Ack=2 Win=65535 Len=1448 TSV=2777159945 TSER=2777159741
    164 0.003546    127.0.0.1             127.0.0.1             TCP      commplex-main > 56255 [ACK] Seq=2 Ack=56474 Win=65535 Len=0 TSV=2777160151 TSER=2777159910
    165 0.003558    127.0.0.1             127.0.0.1             TCP      56255 > commplex-main [ACK] Seq=57922 Ack=2 Win=65535 Len=1448 TSV=2777159947 TSER=2777159741
    166 0.003580    127.0.0.1             127.0.0.1             TCP      commplex-main > 56255 [ACK] Seq=2 Ack=57922 Win=65535 Len=0 TSV=2777160186 TSER=2777159945
    167 0.003585    127.0.0.1             127.0.0.1             TCP      56255 > commplex-main [ACK] Seq=59370 Ack=2 Win=65535 Len=1448 TSV=2777159994 TSER=2777159789
    168 0.003596    127.0.0.1             127.0.0.1             TCP      commplex-main > 56255 [ACK] Seq=2 Ack=59370 Win=64087 Len=0 TSV=2777160222 TSER=2777159947
    169 0.003614    127.0.0.1             127.0.0.1             TCP      56255 > commplex-main [ACK] Seq=60818 Ack=2 Win=65535 Len=1448 TSV=2777159997 TSER=2777159789
    170 0.003637    127.0.0.1             127.0.0.1             TCP      commplex-main > 56255 [ACK] Seq=2 Ack=60818 Win=64087 Len=0 TSV=2777160261 TSER=2777159994
    171 0.003646    127.0.0.1             127.0.0.1             TCP      commplex-main > 56255 [ACK] Seq=2 Ack=52130 Win=65535 Len=0 TSV=2777160007 TSER=2777159844
    172 0.003668    127.0.0.1             127.0.0.1             TCP      commplex-main > 56255 [ACK] Seq=2 Ack=53578 Win=64087 Len=0 TSV=2777160015 TSER=2777159846
    173 0.003680    127.0.0.1             127.0.0.1             TCP      commplex-main > 56255 [ACK] Seq=2 Ack=62266 Win=64087 Len=0 TSV=2777160296 TSER=2777159997
    174 0.003694    127.0.0.1             127.0.0.1             TCP      commplex-main > 56255 [ACK] Seq=2 Ack=55026 Win=65535 Len=0 TSV=2777160111 TSER=2777159907
    175 0.003722    127.0.0.1             127.0.0.1             TCP      commplex-main > 56255 [ACK] Seq=2 Ack=56474 Win=65535 Len=0 TSV=2777160151 TSER=2777159910
    176 0.003743    127.0.0.1             127.0.0.1             TCP      commplex-main > 56255 [ACK] Seq=2 Ack=57922 Win=65535 Len=0 TSV=2777160186 TSER=2777159945
    177 0.003758    127.0.0.1             127.0.0.1             TCP      56255 > commplex-main [ACK] Seq=62266 Ack=2 Win=65535 Len=1448 TSV=2777160375 TSER=2777160007
    178 0.003771    127.0.0.1             127.0.0.1             TCP      commplex-main > 56255 [ACK] Seq=2 Ack=59370 Win=64087 Len=0 TSV=2777160222 TSER=2777159947
    179 0.003793    127.0.0.1             127.0.0.1             TCP      commplex-main > 56255 [ACK] Seq=2 Ack=60818 Win=64087 Len=0 TSV=2777160261 TSER=2777159994
    180 0.003810    127.0.0.1             127.0.0.1             TCP      commplex-main > 56255 [ACK] Seq=2 Ack=62266 Win=64087 Len=0 TSV=2777160296 TSER=2777159997
    181 0.003831    127.0.0.1             127.0.0.1             TCP      56255 > commplex-main [ACK] Seq=62266 Ack=2 Win=65535 Len=1448 TSV=2777160375 TSER=2777160007
    182 0.003890    127.0.0.1             127.0.0.1             TCP      56255 > commplex-main [ACK] Seq=63714 Ack=2 Win=65535 Len=1448 TSV=2777160417 TSER=2777160015
    183 0.003896    127.0.0.1             127.0.0.1             TCP      56255 > commplex-main [ACK] Seq=65162 Ack=2 Win=65535 Len=1448 TSV=2777160449 TSER=2777160111
    184 0.003901    127.0.0.1             127.0.0.1             TCP      56255 > commplex-main [ACK] Seq=66610 Ack=2 Win=65535 Len=1448 TSV=2777160477 TSER=2777160151
    185 0.003906    127.0.0.1             127.0.0.1             TCP      56255 > commplex-main [ACK] Seq=68058 Ack=2 Win=65535 Len=1448 TSV=2777160506 TSER=2777160186
    186 0.003960    127.0.0.1             127.0.0.1             TCP      56255 > commplex-main [ACK] Seq=69506 Ack=2 Win=65535 Len=1448 TSV=2777160582 TSER=2777160222
    187 0.003993    127.0.0.1             127.0.0.1             TCP      56255 > commplex-main [ACK] Seq=70954 Ack=2 Win=65535 Len=1448 TSV=2777160617 TSER=2777160261
    188 0.004023    127.0.0.1             127.0.0.1             TCP      56255 > commplex-main [ACK] Seq=72402 Ack=2 Win=65535 Len=1448 TSV=2777160646 TSER=2777160296
    189 0.004046    127.0.0.1             127.0.0.1             TCP      56255 > commplex-main [ACK] Seq=63714 Ack=2 Win=65535 Len=1448 TSV=2777160417 TSER=2777160015
    190 0.004058    127.0.0.1             127.0.0.1             TCP      commplex-main > 56255 [ACK] Seq=2 Ack=63714 Win=65535 Len=0 TSV=2777160660 TSER=2777160375
    191 0.004068    127.0.0.1             127.0.0.1             TCP      56255 > commplex-main [ACK] Seq=65162 Ack=2 Win=65535 Len=1448 TSV=2777160449 TSER=2777160111
    192 0.004116    127.0.0.1             127.0.0.1             TCP      56255 > commplex-main [ACK] Seq=66610 Ack=2 Win=65535 Len=1448 TSV=2777160477 TSER=2777160151
    193 0.004126    127.0.0.1             127.0.0.1             TCP      commplex-main > 56255 [ACK] Seq=2 Ack=65162 Win=65535 Len=0 TSV=2777160723 TSER=2777160417
    194 0.004131    127.0.0.1             127.0.0.1             TCP      commplex-main > 56255 [ACK] Seq=2 Ack=66610 Win=64087 Len=0 TSV=2777160734 TSER=2777160449
    195 0.004148    127.0.0.1             127.0.0.1             TCP      56255 > commplex-main [ACK] Seq=68058 Ack=2 Win=65535 Len=1448 TSV=2777160506 TSER=2777160186
    196 0.004166    127.0.0.1             127.0.0.1             TCP      commplex-main > 56255 [ACK] Seq=2 Ack=68058 Win=64087 Len=0 TSV=2777160792 TSER=2777160477
    197 0.004187    127.0.0.1             127.0.0.1             TCP      56255 > commplex-main [ACK] Seq=69506 Ack=2 Win=65535 Len=1448 TSV=2777160582 TSER=2777160222
    198 0.004203    127.0.0.1             127.0.0.1             TCP      commplex-main > 56255 [ACK] Seq=2 Ack=69506 Win=62639 Len=0 TSV=2777160828 TSER=2777160506
    199 0.004220    127.0.0.1             127.0.0.1             TCP      56255 > commplex-main [ACK] Seq=70954 Ack=2 Win=65535 Len=1448 TSV=2777160617 TSER=2777160261
    200 0.004238    127.0.0.1             127.0.0.1             TCP      commplex-main > 56255 [ACK] Seq=2 Ack=70954 Win=64087 Len=0 TSV=2777160862 TSER=2777160582
    201 0.004247    127.0.0.1             127.0.0.1             TCP      56255 > commplex-main [ACK] Seq=72402 Ack=2 Win=65535 Len=1448 TSV=2777160646 TSER=2777160296
    202 0.004272    127.0.0.1             127.0.0.1             TCP      commplex-main > 56255 [ACK] Seq=2 Ack=63714 Win=65535 Len=0 TSV=2777160660 TSER=2777160375
    203 0.004316    127.0.0.1             127.0.0.1             TCP      commplex-main > 56255 [ACK] Seq=2 Ack=72402 Win=64087 Len=0 TSV=2777160894 TSER=2777160617
    204 0.004356    127.0.0.1             127.0.0.1             TCP      commplex-main > 56255 [ACK] Seq=2 Ack=73850 Win=62639 Len=0 TSV=2777160921 TSER=2777160646
    205 0.004365    127.0.0.1             127.0.0.1             TCP      56255 > commplex-main [ACK] Seq=73850 Ack=2 Win=65535 Len=1448 TSV=2777160987 TSER=2777160660
    206 0.004370    127.0.0.1             127.0.0.1             TCP      56255 > commplex-main [ACK] Seq=75298 Ack=2 Win=65535 Len=1448 TSV=2777160989 TSER=2777160660
    207 0.004373    127.0.0.1             127.0.0.1             TCP      commplex-main > 56255 [ACK] Seq=2 Ack=65162 Win=65535 Len=0 TSV=2777160723 TSER=2777160417
    208 0.004381    127.0.0.1             127.0.0.1             TCP      commplex-main > 56255 [ACK] Seq=2 Ack=66610 Win=64087 Len=0 TSV=2777160734 TSER=2777160449
    209 0.004394    127.0.0.1             127.0.0.1             TCP      commplex-main > 56255 [ACK] Seq=2 Ack=68058 Win=64087 Len=0 TSV=2777160792 TSER=2777160477
    210 0.004401    127.0.0.1             127.0.0.1             TCP      commplex-main > 56255 [ACK] Seq=2 Ack=69506 Win=62639 Len=0 TSV=2777160828 TSER=2777160506
    211 0.004410    127.0.0.1             127.0.0.1             TCP      commplex-main > 56255 [ACK] Seq=2 Ack=70954 Win=64087 Len=0 TSV=2777160862 TSER=2777160582
    212 0.004418    127.0.0.1             127.0.0.1             TCP      commplex-main > 56255 [ACK] Seq=2 Ack=72402 Win=64087 Len=0 TSV=2777160894 TSER=2777160617
    213 0.004431    127.0.0.1             127.0.0.1             TCP      commplex-main > 56255 [ACK] Seq=2 Ack=73850 Win=62639 Len=0 TSV=2777160921 TSER=2777160646
    214 0.004438    127.0.0.1             127.0.0.1             TCP      56255 > commplex-main [ACK] Seq=75298 Ack=2 Win=65535 Len=1448 TSV=2777160989 TSER=2777160660
    215 0.004494    127.0.0.1             127.0.0.1             TCP      56255 > commplex-main [ACK] Seq=76746 Ack=2 Win=65535 Len=1448 TSV=2777161116 TSER=2777160723
    216 0.004525    127.0.0.1             127.0.0.1             TCP      56255 > commplex-main [ACK] Seq=78194 Ack=2 Win=65535 Len=1448 TSV=2777161146 TSER=2777160734
    217 0.004541    127.0.0.1             127.0.0.1             TCP      56255 > commplex-main [ACK] Seq=76746 Ack=2 Win=65535 Len=1448 TSV=2777161116 TSER=2777160723
    218 0.004557    127.0.0.1             127.0.0.1             TCP      56255 > commplex-main [ACK] Seq=79642 Ack=2 Win=65535 Len=1448 TSV=2777161180 TSER=2777160792
    219 0.004580    127.0.0.1             127.0.0.1             TCP      56255 > commplex-main [ACK] Seq=78194 Ack=2 Win=65535 Len=1448 TSV=2777161146 TSER=2777160734
    220 0.004605    127.0.0.1             127.0.0.1             TCP      56255 > commplex-main [ACK] Seq=81090 Ack=2 Win=65535 Len=1448 TSV=2777161213 TSER=2777160828
    221 0.004625    127.0.0.1             127.0.0.1             TCP      56255 > commplex-main [ACK] Seq=82538 Ack=2 Win=65535 Len=1448 TSV=2777161245 TSER=2777160862
    222 0.004643    127.0.0.1             127.0.0.1             TCP      56255 > commplex-main [ACK] Seq=79642 Ack=2 Win=65535 Len=1448 TSV=2777161180 TSER=2777160792
    223 0.004667    127.0.0.1             127.0.0.1             TCP      56255 > commplex-main [ACK] Seq=83986 Ack=2 Win=65535 Len=1448 TSV=2777161275 TSER=2777160894
    224 0.004682    127.0.0.1             127.0.0.1             TCP      56255 > commplex-main [ACK] Seq=85434 Ack=2 Win=65535 Len=1448 TSV=2777161305 TSER=2777160921
    225 0.004693    127.0.0.1             127.0.0.1             TCP      commplex-main > 56255 [ACK] Seq=2 Ack=73850 Win=64087 Len=0 TSV=2777161317 TSER=2777160989
    226 0.004698    127.0.0.1             127.0.0.1             TCP      commplex-main > 56255 [ACK] Seq=2 Ack=73850 Win=62639 Len=0 TSV=2777161322 TSER=2777161116
    227 0.004706    127.0.0.1             127.0.0.1             TCP      commplex-main > 56255 [ACK] Seq=2 Ack=73850 Win=61191 Len=0 TSV=2777161329 TSER=2777161146
    228 0.004711    127.0.0.1             127.0.0.1             TCP      commplex-main > 56255 [ACK] Seq=2 Ack=73850 Win=59743 Len=0 TSV=2777161334 TSER=2777161180
    229 0.004731    127.0.0.1             127.0.0.1             TCP      56255 > commplex-main [ACK] Seq=81090 Ack=2 Win=65535 Len=1448 TSV=2777161213 TSER=2777160828
    230 0.004746    127.0.0.1             127.0.0.1             TCP      56255 > commplex-main [ACK] Seq=82538 Ack=2 Win=65535 Len=1448 TSV=2777161245 TSER=2777160862
    231 0.004757    127.0.0.1             127.0.0.1             TCP      56255 > commplex-main [ACK] Seq=83986 Ack=2 Win=65535 Len=1448 TSV=2777161275 TSER=2777160894
    232 0.004766    127.0.0.1             127.0.0.1             TCP      56255 > commplex-main [ACK] Seq=85434 Ack=2 Win=65535 Len=1448 TSV=2777161305 TSER=2777160921
    233 0.004776    127.0.0.1             127.0.0.1             TCP      commplex-main > 56255 [ACK] Seq=2 Ack=73850 Win=64087 Len=0 TSV=2777161317 TSER=2777160989
    234 0.004784    127.0.0.1             127.0.0.1             TCP      commplex-main > 56255 [ACK] Seq=2 Ack=73850 Win=62639 Len=0 TSV=2777161322 TSER=2777161116
    235 0.004795    127.0.0.1             127.0.0.1             TCP      commplex-main > 56255 [ACK] Seq=2 Ack=73850 Win=61191 Len=0 TSV=2777161329 TSER=2777161146
    236 0.004803    127.0.0.1             127.0.0.1             TCP      commplex-main > 56255 [ACK] Seq=2 Ack=73850 Win=59743 Len=0 TSV=2777161334 TSER=2777161180
    237 0.004838    127.0.0.1             127.0.0.1             TCP      commplex-main > 56255 [ACK] Seq=2 Ack=73850 Win=58295 Len=0 TSV=2777161463 TSER=2777161213
    238 0.004848    127.0.0.1             127.0.0.1             TCP      commplex-main > 56255 [ACK] Seq=2 Ack=73850 Win=56847 Len=0 TSV=2777161469 TSER=2777161245
    239 0.005057    127.0.0.1             127.0.0.1             TCP      commplex-main > 56255 [ACK] Seq=2 Ack=73850 Win=55399 Len=0 TSV=2777161477 TSER=2777161275
    240 0.005064    127.0.0.1             127.0.0.1             TCP      commplex-main > 56255 [ACK] Seq=2 Ack=73850 Win=53951 Len=0 TSV=2777161481 TSER=2777161305
    241 0.005069    127.0.0.1             127.0.0.1             TCP      56255 > commplex-main [ACK] Seq=73850 Ack=2 Win=65535 Len=1448 TSV=2777161537 TSER=2777161334
    242 0.005084    127.0.0.1             127.0.0.1             TCP      commplex-main > 56255 [ACK] Seq=2 Ack=73850 Win=58295 Len=0 TSV=2777161463 TSER=2777161213
    243 0.005097    127.0.0.1             127.0.0.1             TCP      commplex-main > 56255 [ACK] Seq=2 Ack=73850 Win=56847 Len=0 TSV=2777161469 TSER=2777161245
    244 0.005103    127.0.0.1             127.0.0.1             TCP      commplex-main > 56255 [ACK] Seq=2 Ack=73850 Win=55399 Len=0 TSV=2777161477 TSER=2777161275
    245 0.005112    127.0.0.1             127.0.0.1             TCP      commplex-main > 56255 [ACK] Seq=2 Ack=73850 Win=53951 Len=0 TSV=2777161481 TSER=2777161305
    246 0.005118    127.0.0.1             127.0.0.1             TCP      56255 > commplex-main [ACK] Seq=73850 Ack=2 Win=65535 Len=1448 TSV=2777161537 TSER=2777161334
    247 0.005194    127.0.0.1             127.0.0.1             TCP      commplex-main > 56255 [ACK] Seq=2 Ack=86882 Win=65535 Len=0 TSV=2777161787 TSER=2777161537
    248 0.005208    127.0.0.1             127.0.0.1             TCP      commplex-main > 56255 [ACK] Seq=2 Ack=86882 Win=65535 Len=0 TSV=2777161787 TSER=2777161537
    249 0.005278    127.0.0.1             127.0.0.1             TCP      56255 > commplex-main [ACK] Seq=86882 Ack=2 Win=65535 Len=1448 TSV=2777161898 TSER=2777161787
    250 0.005284    127.0.0.1             127.0.0.1             TCP      56255 > commplex-main [ACK] Seq=88330 Ack=2 Win=65535 Len=1448 TSV=2777161901 TSER=2777161787
    251 0.005295    127.0.0.1             127.0.0.1             TCP      56255 > commplex-main [ACK] Seq=86882 Ack=2 Win=65535 Len=1448 TSV=2777161898 TSER=2777161787
    252 0.005303    127.0.0.1             127.0.0.1             TCP      56255 > commplex-main [ACK] Seq=88330 Ack=2 Win=65535 Len=1448 TSV=2777161901 TSER=2777161787
    253 0.005424    127.0.0.1             127.0.0.1             TCP      commplex-main > 56255 [ACK] Seq=2 Ack=88330 Win=65535 Len=0 TSV=2777161968 TSER=2777161898
    254 0.005429    127.0.0.1             127.0.0.1             TCP      commplex-main > 56255 [ACK] Seq=2 Ack=89778 Win=64087 Len=0 TSV=2777161973 TSER=2777161901
    255 0.005460    127.0.0.1             127.0.0.1             TCP      commplex-main > 56255 [ACK] Seq=2 Ack=88330 Win=65535 Len=0 TSV=2777161968 TSER=2777161898
    256 0.005527    127.0.0.1             127.0.0.1             TCP      56255 > commplex-main [ACK] Seq=89778 Ack=2 Win=65535 Len=1448 TSV=2777162146 TSER=2777161968
    257 0.005532    127.0.0.1             127.0.0.1             TCP      56255 > commplex-main [ACK] Seq=91226 Ack=2 Win=65535 Len=1448 TSV=2777162151 TSER=2777161968
    258 0.005547    127.0.0.1             127.0.0.1             TCP      commplex-main > 56255 [ACK] Seq=2 Ack=89778 Win=64087 Len=0 TSV=2777161973 TSER=2777161901
    259 0.005560    127.0.0.1             127.0.0.1             TCP      56255 > commplex-main [ACK] Seq=89778 Ack=2 Win=65535 Len=1448 TSV=2777162146 TSER=2777161968
    260 0.005567    127.0.0.1             127.0.0.1             TCP      56255 > commplex-main [ACK] Seq=91226 Ack=2 Win=65535 Len=1448 TSV=2777162151 TSER=2777161968
    261 0.005633    127.0.0.1             127.0.0.1             TCP      56255 > commplex-main [ACK] Seq=92674 Ack=2 Win=65535 Len=1448 TSV=2777162253 TSER=2777161973
    262 0.005639    127.0.0.1             127.0.0.1             TCP      56255 > commplex-main [ACK] Seq=94122 Ack=2 Win=65535 Len=1448 TSV=2777162257 TSER=2777161973
    263 0.005649    127.0.0.1             127.0.0.1             TCP      commplex-main > 56255 [ACK] Seq=2 Ack=91226 Win=65535 Len=0 TSV=2777162270 TSER=2777162146
    264 0.005662    127.0.0.1             127.0.0.1             TCP      commplex-main > 56255 [ACK] Seq=2 Ack=92674 Win=64087 Len=0 TSV=2777162276 TSER=2777162151
    265 0.005703    127.0.0.1             127.0.0.1             TCP      56255 > commplex-main [ACK] Seq=92674 Ack=2 Win=65535 Len=1448 TSV=2777162253 TSER=2777161973
    266 0.005712    127.0.0.1             127.0.0.1             TCP      56255 > commplex-main [ACK] Seq=94122 Ack=2 Win=65535 Len=1448 TSV=2777162257 TSER=2777161973
    267 0.005736    127.0.0.1             127.0.0.1             TCP      commplex-main > 56255 [ACK] Seq=2 Ack=91226 Win=65535 Len=0 TSV=2777162270 TSER=2777162146
    268 0.005744    127.0.0.1             127.0.0.1             TCP      commplex-main > 56255 [ACK] Seq=2 Ack=92674 Win=64087 Len=0 TSV=2777162276 TSER=2777162151
    269 0.005781    127.0.0.1             127.0.0.1             TCP      commplex-main > 56255 [ACK] Seq=2 Ack=94122 Win=65535 Len=0 TSV=2777162408 TSER=2777162253
    270 0.005802    127.0.0.1             127.0.0.1             TCP      commplex-main > 56255 [ACK] Seq=2 Ack=95570 Win=64087 Len=0 TSV=2777162428 TSER=2777162257
    271 0.005831    127.0.0.1             127.0.0.1             TCP      commplex-main > 56255 [ACK] Seq=2 Ack=94122 Win=65535 Len=0 TSV=2777162408 TSER=2777162253
    272 0.005852    127.0.0.1             127.0.0.1             TCP      56255 > commplex-main [ACK] Seq=95570 Ack=2 Win=65535 Len=1448 TSV=2777162464 TSER=2777162270
    273 0.005857    127.0.0.1             127.0.0.1             TCP      56255 > commplex-main [ACK] Seq=97018 Ack=2 Win=65535 Len=1448 TSV=2777162468 TSER=2777162270
    274 0.005869    127.0.0.1             127.0.0.1             TCP      56255 > commplex-main [ACK] Seq=98466 Ack=2 Win=65535 Len=1448 TSV=2777162494 TSER=2777162276
    275 0.005896    127.0.0.1             127.0.0.1             TCP      commplex-main > 56255 [ACK] Seq=2 Ack=95570 Win=64087 Len=0 TSV=2777162428 TSER=2777162257
    276 0.005918    127.0.0.1             127.0.0.1             TCP      56255 > commplex-main [ACK] Seq=95570 Ack=2 Win=65535 Len=1448 TSV=2777162464 TSER=2777162270
    277 0.005932    127.0.0.1             127.0.0.1             TCP      56255 > commplex-main [ACK] Seq=99914 Ack=2 Win=65535 Len=1448 TSV=2777162544 TSER=2777162408
    278 0.005946    127.0.0.1             127.0.0.1             TCP      56255 > commplex-main [ACK] Seq=97018 Ack=2 Win=65535 Len=1448 TSV=2777162468 TSER=2777162270
    279 0.005969    127.0.0.1             127.0.0.1             TCP      56255 > commplex-main [ACK] Seq=98466 Ack=2 Win=65535 Len=1448 TSV=2777162494 TSER=2777162276
    280 0.005988    127.0.0.1             127.0.0.1             TCP      56255 > commplex-main [ACK] Seq=101362 Ack=2 Win=65535 Len=1448 TSV=2777162593 TSER=2777162428
    281 0.006001    127.0.0.1             127.0.0.1             TCP      56255 > commplex-main [ACK] Seq=99914 Ack=2 Win=65535 Len=1448 TSV=2777162544 TSER=2777162408
    282 0.006029    127.0.0.1             127.0.0.1             TCP      commplex-main > 56255 [ACK] Seq=2 Ack=97018 Win=65535 Len=0 TSV=2777162625 TSER=2777162464
    283 0.006051    127.0.0.1             127.0.0.1             TCP      56255 > commplex-main [ACK] Seq=101362 Ack=2 Win=65535 Len=1448 TSV=2777162593 TSER=2777162428
    284 0.006054    127.0.0.1             127.0.0.1             TCP      commplex-main > 56255 [ACK] Seq=2 Ack=98466 Win=64087 Len=0 TSV=2777162631 TSER=2777162468
    285 0.006059    127.0.0.1             127.0.0.1             TCP      commplex-main > 56255 [ACK] Seq=2 Ack=99914 Win=62639 Len=0 TSV=2777162640 TSER=2777162494
    286 0.006063    127.0.0.1             127.0.0.1             TCP      commplex-main > 56255 [ACK] Seq=2 Ack=97018 Win=65535 Len=0 TSV=2777162625 TSER=2777162464
    287 0.006078    127.0.0.1             127.0.0.1             TCP      commplex-main > 56255 [ACK] Seq=2 Ack=101362 Win=61191 Len=0 TSV=2777162677 TSER=2777162544
    288 0.006132    127.0.0.1             127.0.0.1             TCP      commplex-main > 56255 [ACK] Seq=2 Ack=102810 Win=64087 Len=0 TSV=2777162727 TSER=2777162593
    289 0.006137    127.0.0.1             127.0.0.1             TCP      56255 > commplex-main [ACK] Seq=102810 Ack=2 Win=65535 Len=1448 TSV=2777162757 TSER=2777162625
    290 0.006148    127.0.0.1             127.0.0.1             TCP      commplex-main > 56255 [ACK] Seq=2 Ack=98466 Win=64087 Len=0 TSV=2777162631 TSER=2777162468
    291 0.006173    127.0.0.1             127.0.0.1             TCP      commplex-main > 56255 [ACK] Seq=2 Ack=99914 Win=62639 Len=0 TSV=2777162640 TSER=2777162494
    292 0.006182    127.0.0.1             127.0.0.1             TCP      commplex-main > 56255 [ACK] Seq=2 Ack=101362 Win=61191 Len=0 TSV=2777162677 TSER=2777162544
    293 0.006223    127.0.0.1             127.0.0.1             TCP      56255 > commplex-main [ACK] Seq=104258 Ack=2 Win=65535 Len=1448 TSV=2777162839 TSER=2777162631
    294 0.006248    127.0.0.1             127.0.0.1             TCP      commplex-main > 56255 [ACK] Seq=2 Ack=102810 Win=64087 Len=0 TSV=2777162727 TSER=2777162593
    295 0.006265    127.0.0.1             127.0.0.1             TCP      56255 > commplex-main [ACK] Seq=105706 Ack=2 Win=65535 Len=1448 TSV=2777162885 TSER=2777162640
    296 0.006271    127.0.0.1             127.0.0.1             TCP      56255 > commplex-main [ACK] Seq=107154 Ack=2 Win=65535 Len=1448 TSV=2777162889 TSER=2777162640
    297 0.006294    127.0.0.1             127.0.0.1             TCP      56255 > commplex-main [ACK] Seq=108602 Ack=2 Win=65535 Len=1448 TSV=2777162919 TSER=2777162677
    298 0.006305    127.0.0.1             127.0.0.1             TCP      56255 > commplex-main [ACK] Seq=102810 Ack=2 Win=65535 Len=1448 TSV=2777162757 TSER=2777162625
    299 0.006326    127.0.0.1             127.0.0.1             TCP      56255 > commplex-main [ACK] Seq=104258 Ack=2 Win=65535 Len=1448 TSV=2777162839 TSER=2777162631
    300 0.006351    127.0.0.1             127.0.0.1             TCP      56255 > commplex-main [ACK] Seq=110050 Ack=2 Win=65535 Len=1448 TSV=2777162960 TSER=2777162727
    301 0.006362    127.0.0.1             127.0.0.1             TCP      commplex-main > 56255 [ACK] Seq=2 Ack=104258 Win=65535 Len=0 TSV=2777162973 TSER=2777162757
    302 0.006376    127.0.0.1             127.0.0.1             TCP      commplex-main > 56255 [ACK] Seq=2 Ack=105706 Win=64087 Len=0 TSV=2777163000 TSER=2777162839
    303 0.006394    127.0.0.1             127.0.0.1             TCP      56255 > commplex-main [ACK] Seq=105706 Ack=2 Win=65535 Len=1448 TSV=2777162885 TSER=2777162640
    304 0.006423    127.0.0.1             127.0.0.1             TCP      commplex-main > 56255 [ACK] Seq=2 Ack=107154 Win=65535 Len=0 TSV=2777163052 TSER=2777162885
    305 0.006434    127.0.0.1             127.0.0.1             TCP      56255 > commplex-main [ACK] Seq=107154 Ack=2 Win=65535 Len=1448 TSV=2777162889 TSER=2777162640
    306 0.006467    127.0.0.1             127.0.0.1             TCP      56255 > commplex-main [ACK] Seq=108602 Ack=2 Win=65535 Len=1448 TSV=2777162919 TSER=2777162677
    307 0.006481    127.0.0.1             127.0.0.1             TCP      commplex-main > 56255 [ACK] Seq=2 Ack=108602 Win=65535 Len=0 TSV=2777163091 TSER=2777162889
    308 0.006495    127.0.0.1             127.0.0.1             TCP      56255 > commplex-main [ACK] Seq=110050 Ack=2 Win=65535 Len=1448 TSV=2777162960 TSER=2777162727
    309 0.006530    127.0.0.1             127.0.0.1             TCP      commplex-main > 56255 [ACK] Seq=2 Ack=110050 Win=64087 Len=0 TSV=2777163135 TSER=2777162919
    310 0.006536    127.0.0.1             127.0.0.1             TCP      commplex-main > 56255 [ACK] Seq=2 Ack=104258 Win=65535 Len=0 TSV=2777162973 TSER=2777162757
    311 0.006555    127.0.0.1             127.0.0.1             TCP      commplex-main > 56255 [ACK] Seq=2 Ack=111498 Win=64087 Len=0 TSV=2777163151 TSER=2777162960
    312 0.006603    127.0.0.1             127.0.0.1             TCP      56255 > commplex-main [ACK] Seq=111498 Ack=2 Win=65535 Len=1448 TSV=2777163220 TSER=2777162973
    313 0.006621    127.0.0.1             127.0.0.1             TCP      commplex-main > 56255 [ACK] Seq=2 Ack=105706 Win=64087 Len=0 TSV=2777163000 TSER=2777162839
    314 0.006631    127.0.0.1             127.0.0.1             TCP      commplex-main > 56255 [ACK] Seq=2 Ack=107154 Win=65535 Len=0 TSV=2777163052 TSER=2777162885
    315 0.006683    127.0.0.1             127.0.0.1             TCP      56255 > commplex-main [ACK] Seq=112946 Ack=2 Win=65535 Len=1448 TSV=2777163301 TSER=2777163000
    316 0.006710    127.0.0.1             127.0.0.1             TCP      commplex-main > 56255 [ACK] Seq=2 Ack=108602 Win=65535 Len=0 TSV=2777163091 TSER=2777162889
    317 0.006794    127.0.0.1             127.0.0.1             TCP      commplex-main > 56255 [ACK] Seq=2 Ack=110050 Win=64087 Len=0 TSV=2777163135 TSER=2777162919
    318 0.006798    127.0.0.1             127.0.0.1             TCP      56255 > commplex-main [ACK] Seq=114394 Ack=2 Win=65535 Len=1448 TSV=2777163423 TSER=2777163052
    319 0.006851    127.0.0.1             127.0.0.1             TCP      commplex-main > 56255 [ACK] Seq=2 Ack=111498 Win=64087 Len=0 TSV=2777163151 TSER=2777162960
    320 0.006890    127.0.0.1             127.0.0.1             TCP      56255 > commplex-main [ACK] Seq=111498 Ack=2 Win=65535 Len=1448 TSV=2777163220 TSER=2777162973
    321 0.006892    127.0.0.1             127.0.0.1             TCP      56255 > commplex-main [ACK] Seq=115842 Ack=2 Win=65535 Len=1448 TSV=2777163480 TSER=2777163091
    322 0.006898    127.0.0.1             127.0.0.1             TCP      56255 > commplex-main [ACK] Seq=117290 Ack=2 Win=65535 Len=1448 TSV=2777163490 TSER=2777163091
    323 0.006926    127.0.0.1             127.0.0.1             TCP      56255 > commplex-main [ACK] Seq=112946 Ack=2 Win=65535 Len=1448 TSV=2777163301 TSER=2777163000
    324 0.006968    127.0.0.1             127.0.0.1             TCP      56255 > commplex-main [ACK] Seq=114394 Ack=2 Win=65535 Len=1448 TSV=2777163423 TSER=2777163052
    325 0.006984    127.0.0.1             127.0.0.1             TCP      56255 > commplex-main [ACK] Seq=118738 Ack=2 Win=65535 Len=1448 TSV=2777163516 TSER=2777163135
    326 0.006991    127.0.0.1             127.0.0.1             TCP      56255 > commplex-main [ACK] Seq=120186 Ack=2 Win=65535 Len=1448 TSV=2777163570 TSER=2777163151
    327 0.006994    127.0.0.1             127.0.0.1             TCP      56255 > commplex-main [ACK] Seq=115842 Ack=2 Win=65535 Len=1448 TSV=2777163480 TSER=2777163091
    328 0.006996    127.0.0.1             127.0.0.1             TCP      commplex-main > 56255 [ACK] Seq=2 Ack=112946 Win=65535 Len=0 TSV=2777163580 TSER=2777163220
    329 0.007007    127.0.0.1             127.0.0.1             TCP      commplex-main > 56255 [ACK] Seq=2 Ack=114394 Win=64087 Len=0 TSV=2777163588 TSER=2777163301
    330 0.007036    127.0.0.1             127.0.0.1             TCP      56255 > commplex-main [ACK] Seq=117290 Ack=2 Win=65535 Len=1448 TSV=2777163490 TSER=2777163091
    331 0.007048    127.0.0.1             127.0.0.1             TCP      commplex-main > 56255 [ACK] Seq=2 Ack=115842 Win=64087 Len=0 TSV=2777163657 TSER=2777163423
    332 0.007053    127.0.0.1             127.0.0.1             TCP      commplex-main > 56255 [ACK] Seq=2 Ack=117290 Win=62639 Len=0 TSV=2777163665 TSER=2777163480
    333 0.007078    127.0.0.1             127.0.0.1             TCP      56255 > commplex-main [ACK] Seq=118738 Ack=2 Win=65535 Len=1448 TSV=2777163516 TSER=2777163135
    334 0.007103    127.0.0.1             127.0.0.1             TCP      56255 > commplex-main [ACK] Seq=120186 Ack=2 Win=65535 Len=1448 TSV=2777163570 TSER=2777163151
    335 0.007124    127.0.0.1             127.0.0.1             TCP      commplex-main > 56255 [ACK] Seq=2 Ack=118738 Win=64087 Len=0 TSV=2777163727 TSER=2777163490
    336 0.007137    127.0.0.1             127.0.0.1             TCP      commplex-main > 56255 [ACK] Seq=2 Ack=112946 Win=65535 Len=0 TSV=2777163580 TSER=2777163220
    337 0.007154    127.0.0.1             127.0.0.1             TCP      commplex-main > 56255 [ACK] Seq=2 Ack=120186 Win=64087 Len=0 TSV=2777163767 TSER=2777163516
    338 0.007172    127.0.0.1             127.0.0.1             TCP      commplex-main > 56255 [ACK] Seq=2 Ack=121634 Win=62639 Len=0 TSV=2777163781 TSER=2777163570
    339 0.007183    127.0.0.1             127.0.0.1             TCP      commplex-main > 56255 [ACK] Seq=2 Ack=114394 Win=64087 Len=0 TSV=2777163588 TSER=2777163301
    340 0.007227    127.0.0.1             127.0.0.1             TCP      commplex-main > 56255 [ACK] Seq=2 Ack=115842 Win=64087 Len=0 TSV=2777163657 TSER=2777163423
    341 0.007272    127.0.0.1             127.0.0.1             TCP      commplex-main > 56255 [ACK] Seq=2 Ack=117290 Win=62639 Len=0 TSV=2777163665 TSER=2777163480
    342 0.007285    127.0.0.1             127.0.0.1             TCP      56255 > commplex-main [ACK] Seq=121634 Ack=2 Win=65535 Len=1448 TSV=2777163850 TSER=2777163580
    343 0.007290    127.0.0.1             127.0.0.1             TCP      56255 > commplex-main [ACK] Seq=123082 Ack=2 Win=65535 Len=1448 TSV=2777163882 TSER=2777163588
    344 0.007299    127.0.0.1             127.0.0.1             TCP      commplex-main > 56255 [ACK] Seq=2 Ack=118738 Win=64087 Len=0 TSV=2777163727 TSER=2777163490
    345 0.007333    127.0.0.1             127.0.0.1             TCP      commplex-main > 56255 [ACK] Seq=2 Ack=120186 Win=64087 Len=0 TSV=2777163767 TSER=2777163516
    346 0.007382    127.0.0.1             127.0.0.1             TCP      commplex-main > 56255 [ACK] Seq=2 Ack=121634 Win=62639 Len=0 TSV=2777163781 TSER=2777163570
    347 0.007397    127.0.0.1             127.0.0.1             TCP      56255 > commplex-main [ACK] Seq=124530 Ack=2 Win=65535 Len=1448 TSV=2777163912 TSER=2777163657
    348 0.007404    127.0.0.1             127.0.0.1             TCP      56255 > commplex-main [ACK] Seq=125978 Ack=2 Win=65535 Len=1448 TSV=2777163960 TSER=2777163665
    349 0.007410    127.0.0.1             127.0.0.1             TCP      56255 > commplex-main [ACK] Seq=127426 Ack=2 Win=65535 Len=1448 TSV=2777163987 TSER=2777163727
    350 0.007415    127.0.0.1             127.0.0.1             TCP      56255 > commplex-main [ACK] Seq=128874 Ack=2 Win=65535 Len=1448 TSV=2777164023 TSER=2777163767
    351 0.007421    127.0.0.1             127.0.0.1             TCP      56255 > commplex-main [ACK] Seq=130322 Ack=2 Win=65535 Len=1448 TSV=2777164027 TSER=2777163767
    352 0.008377    127.0.0.1             127.0.0.1             TCP      56255 > commplex-main [ACK] Seq=131770 Ack=2 Win=65535 Len=1448 TSV=2777164088 TSER=2777163781
    353 0.008380    127.0.0.1             127.0.0.1             TCP      56255 > commplex-main [ACK] Seq=121634 Ack=2 Win=65535 Len=1448 TSV=2777163850 TSER=2777163580
    354 0.008417    127.0.0.1             127.0.0.1             TCP      56255 > commplex-main [ACK] Seq=123082 Ack=2 Win=65535 Len=1448 TSV=2777163882 TSER=2777163588
    355 0.008438    127.0.0.1             127.0.0.1             TCP      commplex-main > 56255 [ACK] Seq=2 Ack=123082 Win=65535 Len=0 TSV=2777165062 TSER=2777163850
    356 0.008441    127.0.0.1             127.0.0.1             TCP      56255 > commplex-main [ACK] Seq=124530 Ack=2 Win=65535 Len=1448 TSV=2777163912 TSER=2777163657
    357 0.008461    127.0.0.1             127.0.0.1             TCP      56255 > commplex-main [ACK] Seq=125978 Ack=2 Win=65535 Len=1448 TSV=2777163960 TSER=2777163665
    358 0.008466    127.0.0.1             127.0.0.1             TCP      commplex-main > 56255 [ACK] Seq=2 Ack=124530 Win=64087 Len=0 TSV=2777165094 TSER=2777163882
    359 0.008495    127.0.0.1             127.0.0.1             TCP      commplex-main > 56255 [ACK] Seq=2 Ack=125978 Win=64087 Len=0 TSV=2777165120 TSER=2777163912
    360 0.008529    127.0.0.1             127.0.0.1             TCP      56255 > commplex-main [ACK] Seq=127426 Ack=2 Win=65535 Len=1448 TSV=2777163987 TSER=2777163727
    361 0.008537    127.0.0.1             127.0.0.1             TCP      commplex-main > 56255 [ACK] Seq=2 Ack=127426 Win=62639 Len=0 TSV=2777165139 TSER=2777163960
    362 0.008567    127.0.0.1             127.0.0.1             TCP      56255 > commplex-main [ACK] Seq=128874 Ack=2 Win=65535 Len=1448 TSV=2777164023 TSER=2777163767
    363 0.008575    127.0.0.1             127.0.0.1             TCP      commplex-main > 56255 [ACK] Seq=2 Ack=128874 Win=65535 Len=0 TSV=2777165186 TSER=2777163987
    364 0.008611    127.0.0.1             127.0.0.1             TCP      56255 > commplex-main [ACK] Seq=130322 Ack=2 Win=65535 Len=1448 TSV=2777164027 TSER=2777163767
    365 0.008619    127.0.0.1             127.0.0.1             TCP      commplex-main > 56255 [ACK] Seq=2 Ack=130322 Win=64087 Len=0 TSV=2777165224 TSER=2777164023
    366 0.008641    127.0.0.1             127.0.0.1             TCP      commplex-main > 56255 [ACK] Seq=2 Ack=131770 Win=65535 Len=0 TSV=2777165269 TSER=2777164027
    367 0.008657    127.0.0.1             127.0.0.1             TCP      56255 > commplex-main [ACK] Seq=131770 Ack=2 Win=65535 Len=1448 TSV=2777164088 TSER=2777163781
    368 0.008680    127.0.0.1             127.0.0.1             TCP      commplex-main > 56255 [ACK] Seq=2 Ack=123082 Win=65535 Len=0 TSV=2777165062 TSER=2777163850
    369 0.008689    127.0.0.1             127.0.0.1             TCP      commplex-main > 56255 [ACK] Seq=2 Ack=133218 Win=65535 Len=0 TSV=2777165317 TSER=2777164088
    370 0.008710    127.0.0.1             127.0.0.1             TCP      commplex-main > 56255 [ACK] Seq=2 Ack=124530 Win=64087 Len=0 TSV=2777165094 TSER=2777163882
    371 0.008731    127.0.0.1             127.0.0.1             TCP      commplex-main > 56255 [ACK] Seq=2 Ack=125978 Win=64087 Len=0 TSV=2777165120 TSER=2777163912
    372 0.008753    127.0.0.1             127.0.0.1             TCP      commplex-main > 56255 [ACK] Seq=2 Ack=127426 Win=62639 Len=0 TSV=2777165139 TSER=2777163960
    373 0.008762    127.0.0.1             127.0.0.1             TCP      56255 > commplex-main [ACK] Seq=133218 Ack=2 Win=65535 Len=1448 TSV=2777165371 TSER=2777165062
    374 0.008774    127.0.0.1             127.0.0.1             TCP      commplex-main > 56255 [ACK] Seq=2 Ack=128874 Win=65535 Len=0 TSV=2777165186 TSER=2777163987
    375 0.008802    127.0.0.1             127.0.0.1             TCP      commplex-main > 56255 [ACK] Seq=2 Ack=130322 Win=64087 Len=0 TSV=2777165224 TSER=2777164023
    376 0.008835    127.0.0.1             127.0.0.1             TCP      commplex-main > 56255 [ACK] Seq=2 Ack=131770 Win=65535 Len=0 TSV=2777165269 TSER=2777164027
    377 0.008866    127.0.0.1             127.0.0.1             TCP      commplex-main > 56255 [ACK] Seq=2 Ack=133218 Win=65535 Len=0 TSV=2777165317 TSER=2777164088
    378 0.008896    127.0.0.1             127.0.0.1             TCP      56255 > commplex-main [ACK] Seq=133218 Ack=2 Win=65535 Len=1448 TSV=2777165371 TSER=2777165062
    379 0.009008    127.0.0.1             127.0.0.1             TCP      56255 > commplex-main [ACK] Seq=134666 Ack=2 Win=65535 Len=1448 TSV=2777165441 TSER=2777165094
    380 0.009023    127.0.0.1             127.0.0.1             TCP      56255 > commplex-main [ACK] Seq=136114 Ack=2 Win=65535 Len=1448 TSV=2777165473 TSER=2777165120
    381 0.009029    127.0.0.1             127.0.0.1             TCP      56255 > commplex-main [ACK] Seq=137562 Ack=2 Win=65535 Len=1448 TSV=2777165503 TSER=2777165139
    382 0.009034    127.0.0.1             127.0.0.1             TCP      56255 > commplex-main [ACK] Seq=139010 Ack=2 Win=65535 Len=1448 TSV=2777165532 TSER=2777165186
    383 0.009039    127.0.0.1             127.0.0.1             TCP      56255 > commplex-main [ACK] Seq=140458 Ack=2 Win=65535 Len=1448 TSV=2777165561 TSER=2777165224
    384 0.009044    127.0.0.1             127.0.0.1             TCP      56255 > commplex-main [ACK] Seq=141906 Ack=2 Win=65535 Len=1448 TSV=2777165592 TSER=2777165269
    385 0.009050    127.0.0.1             127.0.0.1             TCP      56255 > commplex-main [ACK] Seq=143354 Ack=2 Win=65535 Len=1448 TSV=2777165596 TSER=2777165269
    386 0.009056    127.0.0.1             127.0.0.1             TCP      56255 > commplex-main [ACK] Seq=144802 Ack=2 Win=65535 Len=1448 TSV=2777165620 TSER=2777165317
    387 0.009060    127.0.0.1             127.0.0.1             TCP      commplex-main > 56255 [ACK] Seq=2 Ack=134666 Win=65535 Len=0 TSV=2777165635 TSER=2777165371
    388 0.009078    127.0.0.1             127.0.0.1             TCP      56255 > commplex-main [ACK] Seq=134666 Ack=2 Win=65535 Len=1448 TSV=2777165441 TSER=2777165094
    389 0.009091    127.0.0.1             127.0.0.1             TCP      56255 > commplex-main [ACK] Seq=136114 Ack=2 Win=65535 Len=1448 TSV=2777165473 TSER=2777165120
    390 0.009098    127.0.0.1             127.0.0.1             TCP      56255 > commplex-main [ACK] Seq=137562 Ack=2 Win=65535 Len=1448 TSV=2777165503 TSER=2777165139
    391 0.009111    127.0.0.1             127.0.0.1             TCP      56255 > commplex-main [ACK] Seq=139010 Ack=2 Win=65535 Len=1448 TSV=2777165532 TSER=2777165186
    392 0.009117    127.0.0.1             127.0.0.1             TCP      56255 > commplex-main [ACK] Seq=140458 Ack=2 Win=65535 Len=1448 TSV=2777165561 TSER=2777165224
    393 0.009128    127.0.0.1             127.0.0.1             TCP      56255 > commplex-main [ACK] Seq=141906 Ack=2 Win=65535 Len=1448 TSV=2777165592 TSER=2777165269
    394 0.009134    127.0.0.1             127.0.0.1             TCP      56255 > commplex-main [ACK] Seq=143354 Ack=2 Win=65535 Len=1448 TSV=2777165596 TSER=2777165269
    395 0.009143    127.0.0.1             127.0.0.1             TCP      56255 > commplex-main [ACK] Seq=144802 Ack=2 Win=65535 Len=1448 TSV=2777165620 TSER=2777165317
    396 0.009149    127.0.0.1             127.0.0.1             TCP      commplex-main > 56255 [ACK] Seq=2 Ack=134666 Win=65535 Len=0 TSV=2777165635 TSER=2777165371
    397 0.009284    127.0.0.1             127.0.0.1             TCP      commplex-main > 56255 [ACK] Seq=2 Ack=136114 Win=65535 Len=0 TSV=2777165811 TSER=2777165441
    398 0.009290    127.0.0.1             127.0.0.1             TCP      commplex-main > 56255 [ACK] Seq=2 Ack=137562 Win=64087 Len=0 TSV=2777165816 TSER=2777165473
    399 0.009305    127.0.0.1             127.0.0.1             TCP      commplex-main > 56255 [ACK] Seq=2 Ack=139010 Win=62639 Len=0 TSV=2777165843 TSER=2777165503
    400 0.009316    127.0.0.1             127.0.0.1             TCP      commplex-main > 56255 [ACK] Seq=2 Ack=140458 Win=61191 Len=0 TSV=2777165848 TSER=2777165532
    401 0.009321    127.0.0.1             127.0.0.1             TCP      commplex-main > 56255 [ACK] Seq=2 Ack=141906 Win=59743 Len=0 TSV=2777165857 TSER=2777165561
    402 0.009325    127.0.0.1             127.0.0.1             TCP      commplex-main > 56255 [ACK] Seq=2 Ack=143354 Win=58295 Len=0 TSV=2777165863 TSER=2777165592
    403 0.009330    127.0.0.1             127.0.0.1             TCP      commplex-main > 56255 [ACK] Seq=2 Ack=144802 Win=56847 Len=0 TSV=2777165871 TSER=2777165596
    404 0.009334    127.0.0.1             127.0.0.1             TCP      commplex-main > 56255 [ACK] Seq=2 Ack=146250 Win=55399 Len=0 TSV=2777165877 TSER=2777165620
    405 0.009340    127.0.0.1             127.0.0.1             TCP      56255 > commplex-main [ACK] Seq=146250 Ack=2 Win=65535 Len=1448 TSV=2777165907 TSER=2777165635
    406 0.009357    127.0.0.1             127.0.0.1             TCP      commplex-main > 56255 [ACK] Seq=2 Ack=136114 Win=65535 Len=0 TSV=2777165811 TSER=2777165441
    407 0.009369    127.0.0.1             127.0.0.1             TCP      commplex-main > 56255 [ACK] Seq=2 Ack=137562 Win=64087 Len=0 TSV=2777165816 TSER=2777165473
    408 0.009376    127.0.0.1             127.0.0.1             TCP      commplex-main > 56255 [ACK] Seq=2 Ack=139010 Win=62639 Len=0 TSV=2777165843 TSER=2777165503
    409 0.009386    127.0.0.1             127.0.0.1             TCP      commplex-main > 56255 [ACK] Seq=2 Ack=140458 Win=61191 Len=0 TSV=2777165848 TSER=2777165532
    410 0.009393    127.0.0.1             127.0.0.1             TCP      commplex-main > 56255 [ACK] Seq=2 Ack=141906 Win=59743 Len=0 TSV=2777165857 TSER=2777165561
    411 0.009401    127.0.0.1             127.0.0.1             TCP      commplex-main > 56255 [ACK] Seq=2 Ack=143354 Win=58295 Len=0 TSV=2777165863 TSER=2777165592
    412 0.009407    127.0.0.1             127.0.0.1             TCP      commplex-main > 56255 [ACK] Seq=2 Ack=144802 Win=56847 Len=0 TSV=2777165871 TSER=2777165596
    413 0.009415    127.0.0.1             127.0.0.1             TCP      commplex-main > 56255 [ACK] Seq=2 Ack=146250 Win=55399 Len=0 TSV=2777165877 TSER=2777165620
    414 0.009422    127.0.0.1             127.0.0.1             TCP      56255 > commplex-main [ACK] Seq=146250 Ack=2 Win=65535 Len=1448 TSV=2777165907 TSER=2777165635
    415 0.009676    127.0.0.1             127.0.0.1             TCP      56255 > commplex-main [ACK] Seq=147698 Ack=2 Win=65535 Len=1448 TSV=2777166100 TSER=2777165811
    416 0.009691    127.0.0.1             127.0.0.1             TCP      56255 > commplex-main [ACK] Seq=149146 Ack=2 Win=65535 Len=1448 TSV=2777166126 TSER=2777165816
    417 0.009696    127.0.0.1             127.0.0.1             TCP      56255 > commplex-main [ACK] Seq=150594 Ack=2 Win=65535 Len=1448 TSV=2777166155 TSER=2777165843
    418 0.009702    127.0.0.1             127.0.0.1             TCP      56255 > commplex-main [ACK] Seq=152042 Ack=2 Win=65535 Len=1448 TSV=2777166180 TSER=2777165848
    419 0.009707    127.0.0.1             127.0.0.1             TCP      56255 > commplex-main [ACK] Seq=153490 Ack=2 Win=65535 Len=1448 TSV=2777166209 TSER=2777165857
    420 0.009712    127.0.0.1             127.0.0.1             TCP      56255 > commplex-main [ACK] Seq=154938 Ack=2 Win=65535 Len=1448 TSV=2777166233 TSER=2777165863
    421 0.009717    127.0.0.1             127.0.0.1             TCP      56255 > commplex-main [ACK] Seq=156386 Ack=2 Win=65535 Len=1448 TSV=2777166261 TSER=2777165871
    422 0.009723    127.0.0.1             127.0.0.1             TCP      56255 > commplex-main [ACK] Seq=157834 Ack=2 Win=65535 Len=1448 TSV=2777166291 TSER=2777165877
    423 0.009728    127.0.0.1             127.0.0.1             TCP      56255 > commplex-main [ACK] Seq=159282 Ack=2 Win=65535 Len=1448 TSV=2777166295 TSER=2777165877
    424 0.009733    127.0.0.1             127.0.0.1             TCP      commplex-main > 56255 [ACK] Seq=2 Ack=147698 Win=65535 Len=0 TSV=2777166303 TSER=2777165907
    425 0.009754    127.0.0.1             127.0.0.1             TCP      56255 > commplex-main [ACK] Seq=147698 Ack=2 Win=65535 Len=1448 TSV=2777166100 TSER=2777165811
    426 0.009763    127.0.0.1             127.0.0.1             TCP      56255 > commplex-main [ACK] Seq=149146 Ack=2 Win=65535 Len=1448 TSV=2777166126 TSER=2777165816
    427 0.009773    127.0.0.1             127.0.0.1             TCP      56255 > commplex-main [ACK] Seq=150594 Ack=2 Win=65535 Len=1448 TSV=2777166155 TSER=2777165843
    428 0.009779    127.0.0.1             127.0.0.1             TCP      56255 > commplex-main [ACK] Seq=152042 Ack=2 Win=65535 Len=1448 TSV=2777166180 TSER=2777165848
    429 0.009789    127.0.0.1             127.0.0.1             TCP      56255 > commplex-main [ACK] Seq=153490 Ack=2 Win=65535 Len=1448 TSV=2777166209 TSER=2777165857
    430 0.009795    127.0.0.1             127.0.0.1             TCP      56255 > commplex-main [ACK] Seq=154938 Ack=2 Win=65535 Len=1448 TSV=2777166233 TSER=2777165863
    431 0.009804    127.0.0.1             127.0.0.1             TCP      56255 > commplex-main [ACK] Seq=156386 Ack=2 Win=65535 Len=1448 TSV=2777166261 TSER=2777165871
    432 0.009810    127.0.0.1             127.0.0.1             TCP      56255 > commplex-main [ACK] Seq=157834 Ack=2 Win=65535 Len=1448 TSV=2777166291 TSER=2777165877
    433 0.009819    127.0.0.1             127.0.0.1             TCP      56255 > commplex-main [ACK] Seq=159282 Ack=2 Win=65535 Len=1448 TSV=2777166295 TSER=2777165877
    434 0.009825    127.0.0.1             127.0.0.1             TCP      commplex-main > 56255 [ACK] Seq=2 Ack=147698 Win=65535 Len=0 TSV=2777166303 TSER=2777165907
    435 0.009881    127.0.0.1             127.0.0.1             TCP      commplex-main > 56255 [ACK] Seq=2 Ack=149146 Win=65535 Len=0 TSV=2777166490 TSER=2777166100
    436 0.009889    127.0.0.1             127.0.0.1             TCP      commplex-main > 56255 [ACK] Seq=2 Ack=150594 Win=64087 Len=0 TSV=2777166495 TSER=2777166126
    437 0.009902    127.0.0.1             127.0.0.1             TCP      commplex-main > 56255 [ACK] Seq=2 Ack=152042 Win=62639 Len=0 TSV=2777166514 TSER=2777166155
    438 0.009906    127.0.0.1             127.0.0.1             TCP      commplex-main > 56255 [ACK] Seq=2 Ack=153490 Win=61191 Len=0 TSV=2777166518 TSER=2777166180
    439 0.009911    127.0.0.1             127.0.0.1             TCP      commplex-main > 56255 [ACK] Seq=2 Ack=154938 Win=59743 Len=0 TSV=2777166526 TSER=2777166209
    440 0.009916    127.0.0.1             127.0.0.1             TCP      commplex-main > 56255 [ACK] Seq=2 Ack=156386 Win=58295 Len=0 TSV=2777166531 TSER=2777166233
    441 0.009936    127.0.0.1             127.0.0.1             TCP      commplex-main > 56255 [ACK] Seq=2 Ack=157834 Win=56847 Len=0 TSV=2777166538 TSER=2777166261
    442 0.009941    127.0.0.1             127.0.0.1             TCP      commplex-main > 56255 [ACK] Seq=2 Ack=159282 Win=55399 Len=0 TSV=2777166544 TSER=2777166291
    443 0.009946    127.0.0.1             127.0.0.1             TCP      commplex-main > 56255 [ACK] Seq=2 Ack=160730 Win=53951 Len=0 TSV=2777166551 TSER=2777166295
    444 0.009968    127.0.0.1             127.0.0.1             TCP      56255 > commplex-main [ACK] Seq=160730 Ack=2 Win=65535 Len=1448 TSV=2777166575 TSER=2777166303
    445 0.009983    127.0.0.1             127.0.0.1             TCP      commplex-main > 56255 [ACK] Seq=2 Ack=149146 Win=65535 Len=0 TSV=2777166490 TSER=2777166100
    446 0.010003    127.0.0.1             127.0.0.1             TCP      commplex-main > 56255 [ACK] Seq=2 Ack=150594 Win=64087 Len=0 TSV=2777166495 TSER=2777166126
    447 0.010037    127.0.0.1             127.0.0.1             TCP      commplex-main > 56255 [ACK] Seq=2 Ack=152042 Win=62639 Len=0 TSV=2777166514 TSER=2777166155
    448 0.010054    127.0.0.1             127.0.0.1             TCP      56255 > commplex-main [ACK] Seq=162178 Ack=2 Win=65535 Len=1448 TSV=2777166679 TSER=2777166490
    449 0.010059    127.0.0.1             127.0.0.1             TCP      commplex-main > 56255 [ACK] Seq=2 Ack=153490 Win=61191 Len=0 TSV=2777166518 TSER=2777166180
    450 0.010087    127.0.0.1             127.0.0.1             TCP      commplex-main > 56255 [ACK] Seq=2 Ack=154938 Win=59743 Len=0 TSV=2777166526 TSER=2777166209
    451 0.010105    127.0.0.1             127.0.0.1             TCP      commplex-main > 56255 [ACK] Seq=2 Ack=156386 Win=58295 Len=0 TSV=2777166531 TSER=2777166233
    452 0.010112    127.0.0.1             127.0.0.1             TCP      56255 > commplex-main [ACK] Seq=163626 Ack=2 Win=65535 Len=1448 TSV=2777166737 TSER=2777166495
    453 0.010140    127.0.0.1             127.0.0.1             TCP      commplex-main > 56255 [ACK] Seq=2 Ack=157834 Win=56847 Len=0 TSV=2777166538 TSER=2777166261
    454 0.010158    127.0.0.1             127.0.0.1             TCP      56255 > commplex-main [ACK] Seq=165074 Ack=2 Win=65535 Len=1448 TSV=2777166780 TSER=2777166514
    455 0.010165    127.0.0.1             127.0.0.1             TCP      commplex-main > 56255 [ACK] Seq=2 Ack=159282 Win=55399 Len=0 TSV=2777166544 TSER=2777166291
    456 0.010195    127.0.0.1             127.0.0.1             TCP      56255 > commplex-main [ACK] Seq=166522 Ack=2 Win=65535 Len=1448 TSV=2777166818 TSER=2777166518
    457 0.010203    127.0.0.1             127.0.0.1             TCP      commplex-main > 56255 [ACK] Seq=2 Ack=160730 Win=53951 Len=0 TSV=2777166551 TSER=2777166295
    458 0.010234    127.0.0.1             127.0.0.1             TCP      56255 > commplex-main [ACK] Seq=167970 Ack=2 Win=65535 Len=1448 TSV=2777166857 TSER=2777166526
    459 0.010240    127.0.0.1             127.0.0.1             TCP      56255 > commplex-main [ACK] Seq=160730 Ack=2 Win=65535 Len=1448 TSV=2777166575 TSER=2777166303
    460 0.010273    127.0.0.1             127.0.0.1             TCP      56255 > commplex-main [ACK] Seq=169418 Ack=2 Win=65535 Len=1448 TSV=2777166896 TSER=2777166531
    461 0.010277    127.0.0.1             127.0.0.1             TCP      56255 > commplex-main [ACK] Seq=162178 Ack=2 Win=65535 Len=1448 TSV=2777166679 TSER=2777166490
    462 0.010310    127.0.0.1             127.0.0.1             TCP      56255 > commplex-main [ACK] Seq=170866 Ack=2 Win=65535 Len=1448 TSV=2777166934 TSER=2777166538
    463 0.010317    127.0.0.1             127.0.0.1             TCP      56255 > commplex-main [ACK] Seq=163626 Ack=2 Win=65535 Len=1448 TSV=2777166737 TSER=2777166495
    464 0.010349    127.0.0.1             127.0.0.1             TCP      56255 > commplex-main [ACK] Seq=172314 Ack=2 Win=65535 Len=1448 TSV=2777166972 TSER=2777166544
    465 0.010354    127.0.0.1             127.0.0.1             TCP      56255 > commplex-main [ACK] Seq=165074 Ack=2 Win=65535 Len=1448 TSV=2777166780 TSER=2777166514
    466 0.010388    127.0.0.1             127.0.0.1             TCP      56255 > commplex-main [ACK] Seq=166522 Ack=2 Win=65535 Len=1448 TSV=2777166818 TSER=2777166518
    467 0.010392    127.0.0.1             127.0.0.1             TCP      56255 > commplex-main [ACK] Seq=173762 Ack=2 Win=65535 Len=1448 TSV=2777167014 TSER=2777166551
    468 0.010398    127.0.0.1             127.0.0.1             TCP      56255 > commplex-main [ACK] Seq=175210 Ack=2 Win=65535 Len=1448 TSV=2777167019 TSER=2777166551
    469 0.010410    127.0.0.1             127.0.0.1             TCP      56255 > commplex-main [ACK] Seq=167970 Ack=2 Win=65535 Len=1448 TSV=2777166857 TSER=2777166526
    470 0.010438    127.0.0.1             127.0.0.1             TCP      commplex-main > 56255 [ACK] Seq=2 Ack=162178 Win=65535 Len=0 TSV=2777167050 TSER=2777166575
    471 0.010454    127.0.0.1             127.0.0.1             TCP      commplex-main > 56255 [ACK] Seq=2 Ack=163626 Win=64087 Len=0 TSV=2777167079 TSER=2777166679
    472 0.010464    127.0.0.1             127.0.0.1             TCP      commplex-main > 56255 [ACK] Seq=2 Ack=165074 Win=62639 Len=0 TSV=2777167086 TSER=2777166737
    473 0.010474    127.0.0.1             127.0.0.1             TCP      commplex-main > 56255 [ACK] Seq=2 Ack=166522 Win=61191 Len=0 TSV=2777167097 TSER=2777166780
    474 0.010480    127.0.0.1             127.0.0.1             TCP      commplex-main > 56255 [ACK] Seq=2 Ack=167970 Win=59743 Len=0 TSV=2777167103 TSER=2777166818
    475 0.010502    127.0.0.1             127.0.0.1             TCP      56255 > commplex-main [ACK] Seq=169418 Ack=2 Win=65535 Len=1448 TSV=2777166896 TSER=2777166531
    476 0.010507    127.0.0.1             127.0.0.1             TCP      commplex-main > 56255 [ACK] Seq=2 Ack=169418 Win=58295 Len=0 TSV=2777167110 TSER=2777166857
    477 0.010530    127.0.0.1             127.0.0.1             TCP      56255 > commplex-main [ACK] Seq=170866 Ack=2 Win=65535 Len=1448 TSV=2777166934 TSER=2777166538
    478 0.010560    127.0.0.1             127.0.0.1             TCP      commplex-main > 56255 [ACK] Seq=2 Ack=170866 Win=65535 Len=0 TSV=2777167181 TSER=2777166896
    479 0.010563    127.0.0.1             127.0.0.1             TCP      56255 > commplex-main [ACK] Seq=172314 Ack=2 Win=65535 Len=1448 TSV=2777166972 TSER=2777166544
    480 0.010582    127.0.0.1             127.0.0.1             TCP      commplex-main > 56255 [ACK] Seq=2 Ack=172314 Win=64087 Len=0 TSV=2777167208 TSER=2777166934
    481 0.010587    127.0.0.1             127.0.0.1             TCP      56255 > commplex-main [ACK] Seq=173762 Ack=2 Win=65535 Len=1448 TSV=2777167014 TSER=2777166551
    482 0.010620    127.0.0.1             127.0.0.1             TCP      56255 > commplex-main [ACK] Seq=175210 Ack=2 Win=65535 Len=1448 TSV=2777167019 TSER=2777166551
    483 0.010626    127.0.0.1             127.0.0.1             TCP      commplex-main > 56255 [ACK] Seq=2 Ack=173762 Win=64087 Len=0 TSV=2777167249 TSER=2777166972
    484 0.010647    127.0.0.1             127.0.0.1             TCP      commplex-main > 56255 [ACK] Seq=2 Ack=162178 Win=65535 Len=0 TSV=2777167050 TSER=2777166575
    485 0.010651    127.0.0.1             127.0.0.1             TCP      commplex-main > 56255 [ACK] Seq=2 Ack=175210 Win=62639 Len=0 TSV=2777167273 TSER=2777167014
    486 0.010672    127.0.0.1             127.0.0.1             TCP      commplex-main > 56255 [ACK] Seq=2 Ack=163626 Win=64087 Len=0 TSV=2777167079 TSER=2777166679
    487 0.010697    127.0.0.1             127.0.0.1             TCP      commplex-main > 56255 [ACK] Seq=2 Ack=176658 Win=64087 Len=0 TSV=2777167322 TSER=2777167019
    488 0.010700    127.0.0.1             127.0.0.1             TCP      commplex-main > 56255 [ACK] Seq=2 Ack=165074 Win=62639 Len=0 TSV=2777167086 TSER=2777166737
    489 0.010733    127.0.0.1             127.0.0.1             TCP      commplex-main > 56255 [ACK] Seq=2 Ack=166522 Win=61191 Len=0 TSV=2777167097 TSER=2777166780
    490 0.010750    127.0.0.1             127.0.0.1             TCP      56255 > commplex-main [ACK] Seq=176658 Ack=2 Win=65535 Len=1448 TSV=2777167374 TSER=2777167050
    491 0.010755    127.0.0.1             127.0.0.1             TCP      commplex-main > 56255 [ACK] Seq=2 Ack=167970 Win=59743 Len=0 TSV=2777167103 TSER=2777166818
    492 0.010784    127.0.0.1             127.0.0.1             TCP      commplex-main > 56255 [ACK] Seq=2 Ack=169418 Win=58295 Len=0 TSV=2777167110 TSER=2777166857
    493 0.010822    127.0.0.1             127.0.0.1             TCP      commplex-main > 56255 [ACK] Seq=2 Ack=170866 Win=65535 Len=0 TSV=2777167181 TSER=2777166896
    494 0.010832    127.0.0.1             127.0.0.1             TCP      56255 > commplex-main [ACK] Seq=178106 Ack=2 Win=65535 Len=1448 TSV=2777167458 TSER=2777167079
    495 0.010835    127.0.0.1             127.0.0.1             TCP      commplex-main > 56255 [ACK] Seq=2 Ack=172314 Win=64087 Len=0 TSV=2777167208 TSER=2777166934
    496 0.010868    127.0.0.1             127.0.0.1             TCP      commplex-main > 56255 [ACK] Seq=2 Ack=173762 Win=64087 Len=0 TSV=2777167249 TSER=2777166972
    497 0.010887    127.0.0.1             127.0.0.1             TCP      56255 > commplex-main [ACK] Seq=179554 Ack=2 Win=65535 Len=1448 TSV=2777167496 TSER=2777167086
    498 0.010898    127.0.0.1             127.0.0.1             TCP      commplex-main > 56255 [ACK] Seq=2 Ack=175210 Win=62639 Len=0 TSV=2777167273 TSER=2777167014
    499 0.010919    127.0.0.1             127.0.0.1             TCP      56255 > commplex-main [ACK] Seq=181002 Ack=2 Win=65535 Len=1448 TSV=2777167545 TSER=2777167097
    500 0.010922    127.0.0.1             127.0.0.1             TCP      commplex-main > 56255 [ACK] Seq=2 Ack=176658 Win=64087 Len=0 TSV=2777167322 TSER=2777167019
    501 0.010968    127.0.0.1             127.0.0.1             TCP      56255 > commplex-main [ACK] Seq=182450 Ack=2 Win=65535 Len=1448 TSV=2777167589 TSER=2777167103
    502 0.010973    127.0.0.1             127.0.0.1             TCP      56255 > commplex-main [ACK] Seq=176658 Ack=2 Win=65535 Len=1448 TSV=2777167374 TSER=2777167050
    503 0.010994    127.0.0.1             127.0.0.1             TCP      56255 > commplex-main [ACK] Seq=178106 Ack=2 Win=65535 Len=1448 TSV=2777167458 TSER=2777167079
    504 0.011012    127.0.0.1             127.0.0.1             TCP      56255 > commplex-main [ACK] Seq=183898 Ack=2 Win=65535 Len=1448 TSV=2777167629 TSER=2777167110
    505 0.011034    127.0.0.1             127.0.0.1             TCP      56255 > commplex-main [ACK] Seq=179554 Ack=2 Win=65535 Len=1448 TSV=2777167496 TSER=2777167086
    506 0.011052    127.0.0.1             127.0.0.1             TCP      56255 > commplex-main [ACK] Seq=185346 Ack=2 Win=65535 Len=1448 TSV=2777167676 TSER=2777167181
    507 0.011061    127.0.0.1             127.0.0.1             TCP      56255 > commplex-main [ACK] Seq=181002 Ack=2 Win=65535 Len=1448 TSV=2777167545 TSER=2777167097
    508 0.011089    127.0.0.1             127.0.0.1             TCP      56255 > commplex-main [ACK] Seq=186794 Ack=2 Win=65535 Len=1448 TSV=2777167713 TSER=2777167208
    509 0.011109    127.0.0.1             127.0.0.1             TCP      56255 > commplex-main [ACK] Seq=182450 Ack=2 Win=65535 Len=1448 TSV=2777167589 TSER=2777167103
    510 0.011127    127.0.0.1             127.0.0.1             TCP      56255 > commplex-main [ACK] Seq=188242 Ack=2 Win=65535 Len=1448 TSV=2777167751 TSER=2777167249
    511 0.011143    127.0.0.1             127.0.0.1             TCP      56255 > commplex-main [ACK] Seq=183898 Ack=2 Win=65535 Len=1448 TSV=2777167629 TSER=2777167110
    512 0.011166    127.0.0.1             127.0.0.1             TCP      56255 > commplex-main [ACK] Seq=189690 Ack=2 Win=65535 Len=1448 TSV=2777167787 TSER=2777167273
    513 0.011181    127.0.0.1             127.0.0.1             TCP      56255 > commplex-main [ACK] Seq=185346 Ack=2 Win=65535 Len=1448 TSV=2777167676 TSER=2777167181
    514 0.011203    127.0.0.1             127.0.0.1             TCP      56255 > commplex-main [ACK] Seq=186794 Ack=2 Win=65535 Len=1448 TSV=2777167713 TSER=2777167208
    515 0.011206    127.0.0.1             127.0.0.1             TCP      56255 > commplex-main [ACK] Seq=191138 Ack=2 Win=65535 Len=1448 TSV=2777167821 TSER=2777167322
    516 0.011232    127.0.0.1             127.0.0.1             TCP      commplex-main > 56255 [ACK] Seq=2 Ack=178106 Win=65535 Len=0 TSV=2777167853 TSER=2777167374
    517 0.011264    127.0.0.1             127.0.0.1             TCP      commplex-main > 56255 [ACK] Seq=2 Ack=179554 Win=64087 Len=0 TSV=2777167886 TSER=2777167458
    518 0.011270    127.0.0.1             127.0.0.1             TCP      commplex-main > 56255 [ACK] Seq=2 Ack=181002 Win=62639 Len=0 TSV=2777167892 TSER=2777167496
    519 0.011275    127.0.0.1             127.0.0.1             TCP      commplex-main > 56255 [ACK] Seq=2 Ack=182450 Win=61191 Len=0 TSV=2777167900 TSER=2777167545
    520 0.011283    127.0.0.1             127.0.0.1             TCP      56255 > commplex-main [ACK] Seq=188242 Ack=2 Win=65535 Len=1448 TSV=2777167751 TSER=2777167249
    521 0.011295    127.0.0.1             127.0.0.1             TCP      commplex-main > 56255 [ACK] Seq=2 Ack=183898 Win=59743 Len=0 TSV=2777167909 TSER=2777167589
    522 0.011301    127.0.0.1             127.0.0.1             TCP      commplex-main > 56255 [ACK] Seq=2 Ack=185346 Win=58295 Len=0 TSV=2777167922 TSER=2777167629
    523 0.011307    127.0.0.1             127.0.0.1             TCP      commplex-main > 56255 [ACK] Seq=2 Ack=186794 Win=56847 Len=0 TSV=2777167935 TSER=2777167676
    524 0.011311    127.0.0.1             127.0.0.1             TCP      commplex-main > 56255 [ACK] Seq=2 Ack=188242 Win=55399 Len=0 TSV=2777167943 TSER=2777167713
    525 0.011345    127.0.0.1             127.0.0.1             TCP      56255 > commplex-main [ACK] Seq=189690 Ack=2 Win=65535 Len=1448 TSV=2777167787 TSER=2777167273
    526 0.011375    127.0.0.1             127.0.0.1             TCP      commplex-main > 56255 [ACK] Seq=2 Ack=189690 Win=64087 Len=0 TSV=2777167984 TSER=2777167751
    527 0.011399    127.0.0.1             127.0.0.1             TCP      commplex-main > 56255 [ACK] Seq=2 Ack=191138 Win=64087 Len=0 TSV=2777168016 TSER=2777167787
    528 0.011406    127.0.0.1             127.0.0.1             TCP      56255 > commplex-main [ACK] Seq=191138 Ack=2 Win=65535 Len=1448 TSV=2777167821 TSER=2777167322
    529 0.011426    127.0.0.1             127.0.0.1             TCP      commplex-main > 56255 [ACK] Seq=2 Ack=178106 Win=65535 Len=0 TSV=2777167853 TSER=2777167374
    530 0.011453    127.0.0.1             127.0.0.1             TCP      commplex-main > 56255 [ACK] Seq=2 Ack=179554 Win=64087 Len=0 TSV=2777167886 TSER=2777167458
    531 0.011473    127.0.0.1             127.0.0.1             TCP      commplex-main > 56255 [ACK] Seq=2 Ack=192586 Win=65535 Len=0 TSV=2777168077 TSER=2777167821
    532 0.011492    127.0.0.1             127.0.0.1             TCP      commplex-main > 56255 [ACK] Seq=2 Ack=181002 Win=62639 Len=0 TSV=2777167892 TSER=2777167496
    533 0.011518    127.0.0.1             127.0.0.1             TCP      56255 > commplex-main [ACK] Seq=192586 Ack=2 Win=65535 Len=1448 TSV=2777168139 TSER=2777167853
    534 0.011525    127.0.0.1             127.0.0.1             TCP      56255 > commplex-main [ACK] Seq=194034 Ack=2 Win=65535 Len=1448 TSV=2777168149 TSER=2777167853
    535 0.011545    127.0.0.1             127.0.0.1             TCP      commplex-main > 56255 [ACK] Seq=2 Ack=182450 Win=61191 Len=0 TSV=2777167900 TSER=2777167545
    536 0.011562    127.0.0.1             127.0.0.1             TCP      56255 > commplex-main [ACK] Seq=195482 Ack=2 Win=65535 Len=1448 TSV=2777168186 TSER=2777167886
    537 0.011585    127.0.0.1             127.0.0.1             TCP      commplex-main > 56255 [ACK] Seq=2 Ack=183898 Win=59743 Len=0 TSV=2777167909 TSER=2777167589
    538 0.011598    127.0.0.1             127.0.0.1             TCP      56255 > commplex-main [ACK] Seq=196930 Ack=2 Win=65535 Len=1448 TSV=2777168224 TSER=2777167892
    539 0.011624    127.0.0.1             127.0.0.1             TCP      commplex-main > 56255 [ACK] Seq=2 Ack=185346 Win=58295 Len=0 TSV=2777167922 TSER=2777167629
    540 0.011638    127.0.0.1             127.0.0.1             TCP      56255 > commplex-main [ACK] Seq=198378 Ack=2 Win=65535 Len=1448 TSV=2777168264 TSER=2777167900
    541 0.011663    127.0.0.1             127.0.0.1             TCP      commplex-main > 56255 [ACK] Seq=2 Ack=186794 Win=56847 Len=0 TSV=2777167935 TSER=2777167676
    542 0.011675    127.0.0.1             127.0.0.1             TCP      56255 > commplex-main [ACK] Seq=199826 Ack=2 Win=65535 Len=176 TSV=2777168302 TSER=2777167909
    543 0.011704    127.0.0.1             127.0.0.1             TCP      commplex-main > 56255 [ACK] Seq=2 Ack=188242 Win=55399 Len=0 TSV=2777167943 TSER=2777167713
    544 0.011733    127.0.0.1             127.0.0.1             TCP      commplex-main > 56255 [ACK] Seq=2 Ack=189690 Win=64087 Len=0 TSV=2777167984 TSER=2777167751
    545 0.011763    127.0.0.1             127.0.0.1             TCP      commplex-main > 56255 [ACK] Seq=2 Ack=191138 Win=64087 Len=0 TSV=2777168016 TSER=2777167787
    546 0.011791    127.0.0.1             127.0.0.1             TCP      commplex-main > 56255 [ACK] Seq=2 Ack=192586 Win=65535 Len=0 TSV=2777168077 TSER=2777167821
    547 0.011824    127.0.0.1             127.0.0.1             TCP      56255 > commplex-main [ACK] Seq=192586 Ack=2 Win=65535 Len=1448 TSV=2777168139 TSER=2777167853
    548 0.011853    127.0.0.1             127.0.0.1             TCP      56255 > commplex-main [ACK] Seq=194034 Ack=2 Win=65535 Len=1448 TSV=2777168149 TSER=2777167853
    549 0.011873    127.0.0.1             127.0.0.1             TCP      56255 > commplex-main [ACK] Seq=195482 Ack=2 Win=65535 Len=1448 TSV=2777168186 TSER=2777167886
    550 0.011912    127.0.0.1             127.0.0.1             TCP      commplex-main > 56255 [ACK] Seq=2 Ack=194034 Win=65535 Len=0 TSV=2777168535 TSER=2777168139
    551 0.011924    127.0.0.1             127.0.0.1             TCP      commplex-main > 56255 [ACK] Seq=2 Ack=195482 Win=64087 Len=0 TSV=2777168546 TSER=2777168149
    552 0.011929    127.0.0.1             127.0.0.1             TCP      commplex-main > 56255 [ACK] Seq=2 Ack=196930 Win=62639 Len=0 TSV=2777168552 TSER=2777168186
    553 0.011950    127.0.0.1             127.0.0.1             TCP      56255 > commplex-main [ACK] Seq=196930 Ack=2 Win=65535 Len=1448 TSV=2777168224 TSER=2777167892
    554 0.011973    127.0.0.1             127.0.0.1             TCP      56255 > commplex-main [ACK] Seq=198378 Ack=2 Win=65535 Len=1448 TSV=2777168264 TSER=2777167900
    555 0.011992    127.0.0.1             127.0.0.1             TCP      56255 > commplex-main [ACK] Seq=199826 Ack=2 Win=65535 Len=176 TSV=2777168302 TSER=2777167909
    556 0.012007    127.0.0.1             127.0.0.1             TCP      commplex-main > 56255 [ACK] Seq=2 Ack=198378 Win=65535 Len=0 TSV=2777168634 TSER=2777168224
    557 0.012024    127.0.0.1             127.0.0.1             TCP      commplex-main > 56255 [ACK] Seq=2 Ack=199826 Win=64087 Len=0 TSV=2777168648 TSER=2777168264
    558 0.012029    127.0.0.1             127.0.0.1             TCP      commplex-main > 56255 [ACK] Seq=2 Ack=194034 Win=65535 Len=0 TSV=2777168535 TSER=2777168139
    559 0.012047    127.0.0.1             127.0.0.1             TCP      commplex-main > 56255 [ACK] Seq=2 Ack=195482 Win=64087 Len=0 TSV=2777168546 TSER=2777168149
    560 0.012059    127.0.0.1             127.0.0.1             TCP      commplex-main > 56255 [ACK] Seq=2 Ack=200002 Win=65359 Len=0 TSV=2777168684 TSER=2777168302
    561 0.012078    127.0.0.1             127.0.0.1             TCP      commplex-main > 56255 [ACK] Seq=2 Ack=196930 Win=62639 Len=0 TSV=2777168552 TSER=2777168186
    562 0.012098    127.0.0.1             127.0.0.1             TCP      commplex-main > 56255 [ACK] Seq=2 Ack=198378 Win=65535 Len=0 TSV=2777168634 TSER=2777168224
    563 0.012126    127.0.0.1             127.0.0.1             TCP      commplex-main > 56255 [ACK] Seq=2 Ack=199826 Win=64087 Len=0 TSV=2777168648 TSER=2777168264
    564 0.012154    127.0.0.1             127.0.0.1             TCP      commplex-main > 56255 [ACK] Seq=2 Ack=200002 Win=65359 Len=0 TSV=2777168684 TSER=2777168302
    565 0.012260    127.0.0.1             127.0.0.1             TCP      56255 > commplex-main [FIN, ACK] Seq=200002 Ack=2 Win=65535 Len=0 TSV=2777168885 TSER=2777168684
    566 0.012273    127.0.0.1             127.0.0.1             TCP      56255 > commplex-main [FIN, ACK] Seq=200002 Ack=2 Win=65535 Len=0 TSV=2777168885 TSER=2777168684
    567 0.012320    127.0.0.1             127.0.0.1             TCP      commplex-main > 56255 [ACK] Seq=2 Ack=200003 Win=65535 Len=0 TSV=2777168935 TSER=2777168885
    568 0.012365    127.0.0.1             127.0.0.1             TCP      commplex-main > 56255 [FIN, ACK] Seq=2 Ack=200003 Win=65535 Len=0 TSV=2777168968 TSER=2777168885
    569 0.012393    127.0.0.1             127.0.0.1             TCP      commplex-main > 56255 [ACK] Seq=2 Ack=200003 Win=65535 Len=0 TSV=2777168935 TSER=2777168885
    570 0.012519    127.0.0.1             127.0.0.1             TCP      commplex-main > 56255 [FIN, ACK] Seq=2 Ack=200003 Win=65535 Len=0 TSV=2777168968 TSER=2777168885
    571 0.012562    127.0.0.1             127.0.0.1             TCP      56255 > commplex-main [ACK] Seq=200003 Ack=3 Win=65535 Len=0 TSV=2777169182 TSER=2777168968
    572 0.012574    127.0.0.1             127.0.0.1             TCP      56255 > commplex-main [ACK] Seq=200003 Ack=3 Win=65535 Len=0 TSV=2777169182 TSER=2777168968
