No.     Time        Source                Destination           Protocol Info
      1 0.000000    127.0.0.1             127.0.0.1             TCP      18901 > commplex-main [SYN] Seq=1 Win=65535 Len=0 TSV=2263929725 TSER=0
      2 0.000056    127.0.0.1             127.0.0.1             TCP      18901 > commplex-main [SYN] Seq=1 Win=65535 Len=0 TSV=2263929725 TSER=0
      3 0.000144    127.0.0.1             127.0.0.1             TCP      commplex-main > 18901 [SYN, ACK] Seq=1 Ack=2 Win=65535 Len=0 TSV=2263929883 TSER=2263929725
      4 0.000158    127.0.0.1             127.0.0.1             TCP      commplex-main > 18901 [SYN, ACK] Seq=1 Ack=2 Win=65535 Len=0 TSV=2263929883 TSER=2263929725
      5 0.000205    127.0.0.1             127.0.0.1             TCP      18901 > commplex-main [ACK] Seq=2 Ack=2 Win=65535 Len=0 TSV=2263929950 TSER=2263929883
      6 0.000218    127.0.0.1             127.0.0.1             TCP      18901 > commplex-main [ACK] Seq=2 Ack=2 Win=65535 Len=0 TSV=2263929950 TSER=2263929883
      7 0.000361    127.0.0.1             127.0.0.1             TCP      18901 > commplex-main [ACK] Seq=2 Ack=2 Win=65535 Len=1448 TSV=2263930100 TSER=2263929883
      8 0.000375    127.0.0.1             127.0.0.1             TCP      18901 > commplex-main [ACK] Seq=2 Ack=2 Win=65535 Len=1448 TSV=2263930100 TSER=2263929883
      9 0.000422    127.0.0.1             127.0.0.1             TCP      commplex-main > 18901 [ACK] Seq=2 Ack=1450 Win=65535 Len=0 TSV=2263930159 TSER=2263930100
     10 0.000470    127.0.0.1             127.0.0.1             TCP      commplex-main > 18901 [ACK] Seq=2 Ack=1450 Win=65535 Len=0 TSV=2263930159 TSER=2263930100
     11 0.000550    127.0.0.1             127.0.0.1             TCP      18901 > commplex-main [ACK] Seq=1450 Ack=2 Win=65535 Len=1448 TSV=2263930282 TSER=2263930159
     12 0.000555    127.0.0.1             127.0.0.1             TCP      18901 > commplex-main [ACK] Seq=2898 Ack=2 Win=65535 Len=1448 TSV=2263930285 TSER=2263930159
     13 0.000577    127.0.0.1             127.0.0.1             TCP      18901 > commplex-main [ACK] Seq=1450 Ack=2 Win=65535 Len=1448 TSV=2263930282 TSER=2263930159
     14 0.000623    127.0.0.1             127.0.0.1             TCP      commplex-main > 18901 [ACK] Seq=2 Ack=2898 Win=65535 Len=0 TSV=2263930356 TSER=2263930282
     15 0.000643    127.0.0.1             127.0.0.1             TCP      18901 > commplex-main [ACK] Seq=2898 Ack=2 Win=65535 Len=1448 TSV=2263930285 TSER=2263930159
     16 0.000652    127.0.0.1             127.0.0.1             TCP      commplex-main > 18901 [ACK] Seq=2 Ack=2898 Win=65535 Len=0 TSV=2263930356 TSER=2263930282
     17 0.000697    127.0.0.1             127.0.0.1             TCP      commplex-main > 18901 [ACK] Seq=2 Ack=4346 Win=65535 Len=0 TSV=2263930430 TSER=2263930285
     18 0.000713    127.0.0.1             127.0.0.1             TCP      commplex-main > 18901 [ACK] Seq=2 Ack=4346 Win=65535 Len=0 TSV=2263930430 TSER=2263930285
     19 0.000739    127.0.0.1             127.0.0.1             TCP      18901 > commplex-main [ACK] Seq=4346 Ack=2 Win=65535 Len=1448 TSV=2263930468 TSER=2263930356
     20 0.000745    127.0.0.1             127.0.0.1             TCP      18901 > commplex-main [ACK] Seq=5794 Ack=2 Win=65535 Len=1448 TSV=2263930471 TSER=2263930356
     21 0.000822    127.0.0.1             127.0.0.1             TCP      18901 > commplex-main [ACK] Seq=7242 Ack=2 Win=65535 Len=1448 TSV=2263930542 TSER=2263930430
     22 0.000829    127.0.0.1             127.0.0.1             TCP      18901 > commplex-main [ACK] Seq=8690 Ack=2 Win=65535 Len=1448 TSV=2263930547 TSER=2263930430
     23 0.000860    127.0.0.1             127.0.0.1             TCP      18901 > commplex-main [ACK] Seq=4346 Ack=2 Win=65535 Len=1448 TSV=2263930468 TSER=2263930356
     24 0.000915    127.0.0.1             127.0.0.1             TCP      commplex-main > 18901 [ACK] Seq=2 Ack=5794 Win=65535 Len=0 TSV=2263930659 TSER=2263930468
     25 0.000938    127.0.0.1             127.0.0.1             TCP      18901 > commplex-main [ACK] Seq=5794 Ack=2 Win=65535 Len=1448 TSV=2263930471 TSER=2263930356
     26 0.000947    127.0.0.1             127.0.0.1             TCP      18901 > commplex-main [ACK] Seq=7242 Ack=2 Win=65535 Len=1448 TSV=2263930542 TSER=2263930430
     27 0.000956    127.0.0.1             127.0.0.1             TCP      18901 > commplex-main [ACK] Seq=8690 Ack=2 Win=65535 Len=1448 TSV=2263930547 TSER=2263930430
     28 0.000962    127.0.0.1             127.0.0.1             TCP      commplex-main > 18901 [ACK] Seq=2 Ack=5794 Win=65535 Len=0 TSV=2263930659 TSER=2263930468
     29 0.000998    127.0.0.1             127.0.0.1             TCP      commplex-main > 18901 [ACK] Seq=2 Ack=7242 Win=65535 Len=0 TSV=2263930743 TSER=2263930471
     30 0.001008    127.0.0.1             127.0.0.1             TCP      commplex-main > 18901 [ACK] Seq=2 Ack=8690 Win=64087 Len=0 TSV=2263930748 TSER=2263930542
     31 0.001013    127.0.0.1             127.0.0.1             TCP      commplex-main > 18901 [ACK] Seq=2 Ack=10138 Win=62639 Len=0 TSV=2263930758 TSER=2263930547
     32 0.001037    127.0.0.1             127.0.0.1             TCP      commplex-main > 18901 [ACK] Seq=2 Ack=7242 Win=65535 Len=0 TSV=2263930743 TSER=2263930471
     33 0.001055    127.0.0.1             127.0.0.1             TCP      18901 > commplex-main [ACK] Seq=10138 Ack=2 Win=65535 Len=1448 TSV=2263930796 TSER=2263930659
     34 0.001060    127.0.0.1             127.0.0.1             TCP      18901 > commplex-main [ACK] Seq=11586 Ack=2 Win=65535 Len=1448 TSV=2263930799 TSER=2263930659
     35 0.001083    127.0.0.1             127.0.0.1             TCP      commplex-main > 18901 [ACK] Seq=2 Ack=8690 Win=64087 Len=0 TSV=2263930748 TSER=2263930542
     36 0.001102    127.0.0.1             127.0.0.1             TCP      commplex-main > 18901 [ACK] Seq=2 Ack=10138 Win=62639 Len=0 TSV=2263930758 TSER=2263930547
     37 0.001126    127.0.0.1             127.0.0.1             TCP      18901 > commplex-main [ACK] Seq=10138 Ack=2 Win=65535 Len=1448 TSV=2263930796 TSER=2263930659
     38 0.001140    127.0.0.1             127.0.0.1             TCP      18901 > commplex-main [ACK] Seq=13034 Ack=2 Win=65535 Len=1448 TSV=2263930871 TSER=2263930743
     39 0.001145    127.0.0.1             127.0.0.1             TCP      18901 > commplex-main [ACK] Seq=14482 Ack=2 Win=65535 Len=1448 TSV=2263930873 TSER=2263930743
     40 0.001160    127.0.0.1             127.0.0.1             TCP      18901 > commplex-main [ACK] Seq=11586 Ack=2 Win=65535 Len=1448 TSV=2263930799 TSER=2263930659
     41 0.001183    127.0.0.1             127.0.0.1             TCP      18901 > commplex-main [ACK] Seq=13034 Ack=2 Win=65535 Len=1448 TSV=2263930871 TSER=2263930743
     42 0.001204    127.0.0.1             127.0.0.1             TCP      18901 > commplex-main [ACK] Seq=14482 Ack=2 Win=65535 Len=1448 TSV=2263930873 TSER=2263930743
     43 0.001316    127.0.0.1             127.0.0.1             TCP      18901 > commplex-main [ACK] Seq=15930 Ack=2 Win=65535 Len=1448 TSV=2263930983 TSER=2263930748
     44 0.001322    127.0.0.1             127.0.0.1             TCP      18901 > commplex-main [ACK] Seq=17378 Ack=2 Win=65535 Len=1448 TSV=2263930985 TSER=2263930748
     45 0.001327    127.0.0.1             127.0.0.1             TCP      18901 > commplex-main [ACK] Seq=18826 Ack=2 Win=65535 Len=1448 TSV=2263931017 TSER=2263930758
     46 0.001333    127.0.0.1             127.0.0.1             TCP      18901 > commplex-main [ACK] Seq=20274 Ack=2 Win=65535 Len=1448 TSV=2263931019 TSER=2263930758
     47 0.001337    127.0.0.1             127.0.0.1             TCP      commplex-main > 18901 [ACK] Seq=2 Ack=11586 Win=64087 Len=0 TSV=2263931030 TSER=2263930796
     48 0.001341    127.0.0.1             127.0.0.1             TCP      commplex-main > 18901 [ACK] Seq=2 Ack=13034 Win=62639 Len=0 TSV=2263931035 TSER=2263930799
     49 0.001346    127.0.0.1             127.0.0.1             TCP      commplex-main > 18901 [ACK] Seq=2 Ack=14482 Win=61191 Len=0 TSV=2263931055 TSER=2263930871
     50 0.001350    127.0.0.1             127.0.0.1             TCP      commplex-main > 18901 [ACK] Seq=2 Ack=15930 Win=59743 Len=0 TSV=2263931060 TSER=2263930873
     51 0.001377    127.0.0.1             127.0.0.1             TCP      18901 > commplex-main [ACK] Seq=15930 Ack=2 Win=65535 Len=1448 TSV=2263930983 TSER=2263930748
     52 0.001397    127.0.0.1             127.0.0.1             TCP      18901 > commplex-main [ACK] Seq=17378 Ack=2 Win=65535 Len=1448 TSV=2263930985 TSER=2263930748
     53 0.001449    127.0.0.1             127.0.0.1             TCP      commplex-main > 18901 [ACK] Seq=2 Ack=17378 Win=64087 Len=0 TSV=2263931177 TSER=2263930983
     54 0.001450    127.0.0.1             127.0.0.1             TCP      18901 > commplex-main [ACK] Seq=18826 Ack=2 Win=65535 Len=1448 TSV=2263931017 TSER=2263930758
     55 0.001465    127.0.0.1             127.0.0.1             TCP      commplex-main > 18901 [ACK] Seq=2 Ack=18826 Win=64087 Len=0 TSV=2263931185 TSER=2263930985
     56 0.001493    127.0.0.1             127.0.0.1             TCP      commplex-main > 18901 [ACK] Seq=2 Ack=20274 Win=64087 Len=0 TSV=2263931235 TSER=2263931017
     57 0.001506    127.0.0.1             127.0.0.1             TCP      commplex-main > 18901 [ACK] Seq=2 Ack=11586 Win=64087 Len=0 TSV=2263931030 TSER=2263930796
     58 0.001525    127.0.0.1             127.0.0.1             TCP      commplex-main > 18901 [ACK] Seq=2 Ack=13034 Win=62639 Len=0 TSV=2263931035 TSER=2263930799
     59 0.001551    127.0.0.1             127.0.0.1             TCP      commplex-main > 18901 [ACK] Seq=2 Ack=14482 Win=61191 Len=0 TSV=2263931055 TSER=2263930871
     60 0.001575    127.0.0.1             127.0.0.1             TCP      commplex-main > 18901 [ACK] Seq=2 Ack=15930 Win=59743 Len=0 TSV=2263931060 TSER=2263930873
     61 0.001602    127.0.0.1             127.0.0.1             TCP      commplex-main > 18901 [ACK] Seq=2 Ack=17378 Win=64087 Len=0 TSV=2263931177 TSER=2263930983
     62 0.001621    127.0.0.1             127.0.0.1             TCP      commplex-main > 18901 [ACK] Seq=2 Ack=18826 Win=64087 Len=0 TSV=2263931185 TSER=2263930985
     63 0.001643    127.0.0.1             127.0.0.1             TCP      commplex-main > 18901 [ACK] Seq=2 Ack=20274 Win=64087 Len=0 TSV=2263931235 TSER=2263931017
     64 0.001686    127.0.0.1             127.0.0.1             TCP      18901 > commplex-main [ACK] Seq=21722 Ack=2 Win=65535 Len=1448 TSV=2263931343 TSER=2263931030
     65 0.001692    127.0.0.1             127.0.0.1             TCP      18901 > commplex-main [ACK] Seq=23170 Ack=2 Win=65535 Len=1448 TSV=2263931346 TSER=2263931030
     66 0.001699    127.0.0.1             127.0.0.1             TCP      18901 > commplex-main [ACK] Seq=24618 Ack=2 Win=65535 Len=1448 TSV=2263931381 TSER=2263931035
     67 0.001705    127.0.0.1             127.0.0.1             TCP      18901 > commplex-main [ACK] Seq=26066 Ack=2 Win=65535 Len=1448 TSV=2263931383 TSER=2263931035
     68 0.001711    127.0.0.1             127.0.0.1             TCP      18901 > commplex-main [ACK] Seq=27514 Ack=2 Win=65535 Len=1448 TSV=2263931415 TSER=2263931055
     69 0.001716    127.0.0.1             127.0.0.1             TCP      18901 > commplex-main [ACK] Seq=28962 Ack=2 Win=65535 Len=1448 TSV=2263931417 TSER=2263931055
     70 0.001883    127.0.0.1             127.0.0.1             TCP      18901 > commplex-main [ACK] Seq=30410 Ack=2 Win=65535 Len=1448 TSV=2263931513 TSER=2263931060
     71 0.001890    127.0.0.1             127.0.0.1             TCP      18901 > commplex-main [ACK] Seq=31858 Ack=2 Win=65535 Len=1448 TSV=2263931517 TSER=2263931060
     72 0.001896    127.0.0.1             127.0.0.1             TCP      18901 > commplex-main [ACK] Seq=33306 Ack=2 Win=65535 Len=1448 TSV=2263931548 TSER=2263931177
     73 0.001901    127.0.0.1             127.0.0.1             TCP      18901 > commplex-main [ACK] Seq=34754 Ack=2 Win=65535 Len=1448 TSV=2263931552 TSER=2263931177
     74 0.001906    127.0.0.1             127.0.0.1             TCP      18901 > commplex-main [ACK] Seq=36202 Ack=2 Win=65535 Len=1448 TSV=2263931584 TSER=2263931185
     75 0.001911    127.0.0.1             127.0.0.1             TCP      18901 > commplex-main [ACK] Seq=37650 Ack=2 Win=65535 Len=1448 TSV=2263931588 TSER=2263931185
     76 0.001917    127.0.0.1             127.0.0.1             TCP      18901 > commplex-main [ACK] Seq=39098 Ack=2 Win=65535 Len=1448 TSV=2263931620 TSER=2263931235
     77 0.001922    127.0.0.1             127.0.0.1             TCP      18901 > commplex-main [ACK] Seq=40546 Ack=2 Win=65535 Len=1448 TSV=2263931624 TSER=2263931235
     78 0.001945    127.0.0.1             127.0.0.1             TCP      18901 > commplex-main [ACK] Seq=21722 Ack=2 Win=65535 Len=1448 TSV=2263931343 TSER=2263931030
     79 0.001976    127.0.0.1             127.0.0.1             TCP      commplex-main > 18901 [ACK] Seq=2 Ack=20274 Win=64087 Len=0 TSV=2263931723 TSER=2263931343
     80 0.001996    127.0.0.1             127.0.0.1             TCP      18901 > commplex-main [ACK] Seq=23170 Ack=2 Win=65535 Len=1448 TSV=2263931346 TSER=2263931030
     81 0.002009    127.0.0.1             127.0.0.1             TCP      18901 > commplex-main [ACK] Seq=24618 Ack=2 Win=65535 Len=1448 TSV=2263931381 TSER=2263931035
     82 0.002020    127.0.0.1             127.0.0.1             TCP      18901 > commplex-main [ACK] Seq=26066 Ack=2 Win=65535 Len=1448 TSV=2263931383 TSER=2263931035
     83 0.002027    127.0.0.1             127.0.0.1             TCP      commplex-main > 18901 [ACK] Seq=2 Ack=20274 Win=62639 Len=0 TSV=2263931773 TSER=2263931346
     84 0.002054    127.0.0.1             127.0.0.1             TCP      commplex-main > 18901 [ACK] Seq=2 Ack=20274 Win=61191 Len=0 TSV=2263931793 TSER=2263931381
     85 0.002058    127.0.0.1             127.0.0.1             TCP      commplex-main > 18901 [ACK] Seq=2 Ack=20274 Win=59743 Len=0 TSV=2263931804 TSER=2263931383
     86 0.002071    127.0.0.1             127.0.0.1             TCP      18901 > commplex-main [ACK] Seq=27514 Ack=2 Win=65535 Len=1448 TSV=2263931415 TSER=2263931055
     87 0.002082    127.0.0.1             127.0.0.1             TCP      18901 > commplex-main [ACK] Seq=28962 Ack=2 Win=65535 Len=1448 TSV=2263931417 TSER=2263931055
     88 0.002088    127.0.0.1             127.0.0.1             TCP      18901 > commplex-main [ACK] Seq=30410 Ack=2 Win=65535 Len=1448 TSV=2263931513 TSER=2263931060
     89 0.002097    127.0.0.1             127.0.0.1             TCP      18901 > commplex-main [ACK] Seq=31858 Ack=2 Win=65535 Len=1448 TSV=2263931517 TSER=2263931060
     90 0.002103    127.0.0.1             127.0.0.1             TCP      18901 > commplex-main [ACK] Seq=33306 Ack=2 Win=65535 Len=1448 TSV=2263931548 TSER=2263931177
     91 0.002111    127.0.0.1             127.0.0.1             TCP      18901 > commplex-main [ACK] Seq=36202 Ack=2 Win=65535 Len=1448 TSV=2263931584 TSER=2263931185
     92 0.002117    127.0.0.1             127.0.0.1             TCP      18901 > commplex-main [ACK] Seq=39098 Ack=2 Win=65535 Len=1448 TSV=2263931620 TSER=2263931235
     93 0.002127    127.0.0.1             127.0.0.1             TCP      commplex-main > 18901 [ACK] Seq=2 Ack=20274 Win=64087 Len=0 TSV=2263931723 TSER=2263931343
     94 0.002132    127.0.0.1             127.0.0.1             TCP      commplex-main > 18901 [ACK] Seq=2 Ack=20274 Win=62639 Len=0 TSV=2263931773 TSER=2263931346
     95 0.002140    127.0.0.1             127.0.0.1             TCP      commplex-main > 18901 [ACK] Seq=2 Ack=20274 Win=61191 Len=0 TSV=2263931793 TSER=2263931381
     96 0.002146    127.0.0.1             127.0.0.1             TCP      commplex-main > 18901 [ACK] Seq=2 Ack=20274 Win=59743 Len=0 TSV=2263931804 TSER=2263931383
     97 0.002266    127.0.0.1             127.0.0.1             TCP      commplex-main > 18901 [ACK] Seq=2 Ack=20274 Win=58295 Len=0 TSV=2263931926 TSER=2263931415
     98 0.002272    127.0.0.1             127.0.0.1             TCP      commplex-main > 18901 [ACK] Seq=2 Ack=20274 Win=56847 Len=0 TSV=2263931932 TSER=2263931417
     99 0.002276    127.0.0.1             127.0.0.1             TCP      commplex-main > 18901 [ACK] Seq=2 Ack=20274 Win=55399 Len=0 TSV=2263931940 TSER=2263931513
    100 0.002282    127.0.0.1             127.0.0.1             TCP      commplex-main > 18901 [ACK] Seq=2 Ack=20274 Win=53951 Len=0 TSV=2263931945 TSER=2263931517
    101 0.002283    127.0.0.1             127.0.0.1             TCP      commplex-main > 18901 [ACK] Seq=2 Ack=20274 Win=58295 Len=0 TSV=2263931926 TSER=2263931415
    102 0.002287    127.0.0.1             127.0.0.1             TCP      commplex-main > 18901 [ACK] Seq=2 Ack=20274 Win=52503 Len=0 TSV=2263931953 TSER=2263931548
    103 0.002292    127.0.0.1             127.0.0.1             TCP      commplex-main > 18901 [ACK] Seq=2 Ack=20274 Win=51055 Len=0 TSV=2263931958 TSER=2263931584
    104 0.002296    127.0.0.1             127.0.0.1             TCP      commplex-main > 18901 [ACK] Seq=2 Ack=20274 Win=49607 Len=0 TSV=2263931966 TSER=2263931620
    105 0.002301    127.0.0.1             127.0.0.1             TCP      18901 > commplex-main [ACK] Seq=20274 Ack=2 Win=65535 Len=1448 TSV=2263932009 TSER=2263931804
    106 0.002305    127.0.0.1             127.0.0.1             TCP      commplex-main > 18901 [ACK] Seq=2 Ack=20274 Win=56847 Len=0 TSV=2263931932 TSER=2263931417
    107 0.002331    127.0.0.1             127.0.0.1             TCP      commplex-main > 18901 [ACK] Seq=2 Ack=20274 Win=55399 Len=0 TSV=2263931940 TSER=2263931513
    108 0.002339    127.0.0.1             127.0.0.1             TCP      commplex-main > 18901 [ACK] Seq=2 Ack=20274 Win=53951 Len=0 TSV=2263931945 TSER=2263931517
    109 0.002349    127.0.0.1             127.0.0.1             TCP      commplex-main > 18901 [ACK] Seq=2 Ack=20274 Win=52503 Len=0 TSV=2263931953 TSER=2263931548
    110 0.002355    127.0.0.1             127.0.0.1             TCP      commplex-main > 18901 [ACK] Seq=2 Ack=20274 Win=51055 Len=0 TSV=2263931958 TSER=2263931584
    111 0.002364    127.0.0.1             127.0.0.1             TCP      commplex-main > 18901 [ACK] Seq=2 Ack=20274 Win=49607 Len=0 TSV=2263931966 TSER=2263931620
    112 0.002370    127.0.0.1             127.0.0.1             TCP      18901 > commplex-main [ACK] Seq=20274 Ack=2 Win=65535 Len=1448 TSV=2263932009 TSER=2263931804
    113 0.002421    127.0.0.1             127.0.0.1             TCP      commplex-main > 18901 [ACK] Seq=2 Ack=34754 Win=62639 Len=0 TSV=2263932164 TSER=2263932009
    114 0.002435    127.0.0.1             127.0.0.1             TCP      commplex-main > 18901 [ACK] Seq=2 Ack=34754 Win=62639 Len=0 TSV=2263932164 TSER=2263932009
    115 0.002505    127.0.0.1             127.0.0.1             TCP      18901 > commplex-main [ACK] Seq=34754 Ack=2 Win=65535 Len=1448 TSV=2263932245 TSER=2263932164
    116 0.002511    127.0.0.1             127.0.0.1             TCP      18901 > commplex-main [ACK] Seq=36202 Ack=2 Win=65535 Len=1448 TSV=2263932248 TSER=2263932164
    117 0.002529    127.0.0.1             127.0.0.1             TCP      18901 > commplex-main [ACK] Seq=34754 Ack=2 Win=65535 Len=1448 TSV=2263932245 TSER=2263932164
    118 0.002562    127.0.0.1             127.0.0.1             TCP      commplex-main > 18901 [ACK] Seq=2 Ack=37650 Win=64087 Len=0 TSV=2263932311 TSER=2263932245
    119 0.002581    127.0.0.1             127.0.0.1             TCP      18901 > commplex-main [ACK] Seq=36202 Ack=2 Win=65535 Len=1448 TSV=2263932248 TSER=2263932164
    120 0.002607    127.0.0.1             127.0.0.1             TCP      commplex-main > 18901 [ACK] Seq=2 Ack=37650 Win=64087 Len=0 TSV=2263932354 TSER=2263932245
    121 0.002623    127.0.0.1             127.0.0.1             TCP      commplex-main > 18901 [ACK] Seq=2 Ack=37650 Win=64087 Len=0 TSV=2263932311 TSER=2263932245
    122 0.002690    127.0.0.1             127.0.0.1             TCP      18901 > commplex-main [ACK] Seq=37650 Ack=2 Win=65535 Len=1448 TSV=2263932430 TSER=2263932311
    123 0.002695    127.0.0.1             127.0.0.1             TCP      18901 > commplex-main [ACK] Seq=39098 Ack=2 Win=65535 Len=1448 TSV=2263932432 TSER=2263932311
    124 0.002700    127.0.0.1             127.0.0.1             TCP      18901 > commplex-main [ACK] Seq=40546 Ack=2 Win=65535 Len=1448 TSV=2263932435 TSER=2263932311
    125 0.002715    127.0.0.1             127.0.0.1             TCP      commplex-main > 18901 [ACK] Seq=2 Ack=37650 Win=64087 Len=0 TSV=2263932354 TSER=2263932245
    126 0.002747    127.0.0.1             127.0.0.1             TCP      18901 > commplex-main [ACK] Seq=37650 Ack=2 Win=65535 Len=1448 TSV=2263932430 TSER=2263932311
    127 0.002786    127.0.0.1             127.0.0.1             TCP      commplex-main > 18901 [ACK] Seq=2 Ack=40546 Win=65535 Len=0 TSV=2263932534 TSER=2263932430
    128 0.002804    127.0.0.1             127.0.0.1             TCP      18901 > commplex-main [ACK] Seq=39098 Ack=2 Win=65535 Len=1448 TSV=2263932432 TSER=2263932311
    129 0.002833    127.0.0.1             127.0.0.1             TCP      commplex-main > 18901 [ACK] Seq=2 Ack=40546 Win=65535 Len=0 TSV=2263932580 TSER=2263932430
    130 0.002846    127.0.0.1             127.0.0.1             TCP      18901 > commplex-main [ACK] Seq=40546 Ack=2 Win=65535 Len=1448 TSV=2263932435 TSER=2263932311
    131 0.002878    127.0.0.1             127.0.0.1             TCP      commplex-main > 18901 [ACK] Seq=2 Ack=41994 Win=65535 Len=0 TSV=2263932627 TSER=2263932435
    132 0.002896    127.0.0.1             127.0.0.1             TCP      commplex-main > 18901 [ACK] Seq=2 Ack=40546 Win=65535 Len=0 TSV=2263932534 TSER=2263932430
    133 0.002968    127.0.0.1             127.0.0.1             TCP      18901 > commplex-main [ACK] Seq=41994 Ack=2 Win=65535 Len=1448 TSV=2263932706 TSER=2263932534
    134 0.002973    127.0.0.1             127.0.0.1             TCP      18901 > commplex-main [ACK] Seq=43442 Ack=2 Win=65535 Len=1448 TSV=2263932710 TSER=2263932534
    135 0.002978    127.0.0.1             127.0.0.1             TCP      18901 > commplex-main [ACK] Seq=44890 Ack=2 Win=65535 Len=1448 TSV=2263932712 TSER=2263932534
    136 0.002991    127.0.0.1             127.0.0.1             TCP      commplex-main > 18901 [ACK] Seq=2 Ack=40546 Win=65535 Len=0 TSV=2263932580 TSER=2263932430
    137 0.003028    127.0.0.1             127.0.0.1             TCP      commplex-main > 18901 [ACK] Seq=2 Ack=41994 Win=65535 Len=0 TSV=2263932627 TSER=2263932435
    138 0.003101    127.0.0.1             127.0.0.1             TCP      18901 > commplex-main [ACK] Seq=41994 Ack=2 Win=65535 Len=1448 TSV=2263932706 TSER=2263932534
    139 0.003124    127.0.0.1             127.0.0.1             TCP      18901 > commplex-main [ACK] Seq=46338 Ack=2 Win=65535 Len=1448 TSV=2263932835 TSER=2263932627
    140 0.003130    127.0.0.1             127.0.0.1             TCP      18901 > commplex-main [ACK] Seq=47786 Ack=2 Win=65535 Len=1448 TSV=2263932838 TSER=2263932627
    141 0.003138    127.0.0.1             127.0.0.1             TCP      18901 > commplex-main [ACK] Seq=43442 Ack=2 Win=65535 Len=1448 TSV=2263932710 TSER=2263932534
    142 0.003187    127.0.0.1             127.0.0.1             TCP      commplex-main > 18901 [ACK] Seq=2 Ack=43442 Win=65535 Len=0 TSV=2263932913 TSER=2263932706
    143 0.003191    127.0.0.1             127.0.0.1             TCP      commplex-main > 18901 [ACK] Seq=2 Ack=44890 Win=64087 Len=0 TSV=2263932922 TSER=2263932710
    144 0.003195    127.0.0.1             127.0.0.1             TCP      18901 > commplex-main [ACK] Seq=44890 Ack=2 Win=65535 Len=1448 TSV=2263932712 TSER=2263932534
    145 0.003233    127.0.0.1             127.0.0.1             TCP      commplex-main > 18901 [ACK] Seq=2 Ack=46338 Win=64087 Len=0 TSV=2263932974 TSER=2263932712
    146 0.003249    127.0.0.1             127.0.0.1             TCP      18901 > commplex-main [ACK] Seq=46338 Ack=2 Win=65535 Len=1448 TSV=2263932835 TSER=2263932627
    147 0.003288    127.0.0.1             127.0.0.1             TCP      commplex-main > 18901 [ACK] Seq=2 Ack=47786 Win=64087 Len=0 TSV=2263933030 TSER=2263932835
    148 0.003311    127.0.0.1             127.0.0.1             TCP      18901 > commplex-main [ACK] Seq=47786 Ack=2 Win=65535 Len=1448 TSV=2263932838 TSER=2263932627
    149 0.003347    127.0.0.1             127.0.0.1             TCP      commplex-main > 18901 [ACK] Seq=2 Ack=43442 Win=65535 Len=0 TSV=2263932913 TSER=2263932706
    150 0.003366    127.0.0.1             127.0.0.1             TCP      commplex-main > 18901 [ACK] Seq=2 Ack=49234 Win=65535 Len=0 TSV=2263933093 TSER=2263932838
    151 0.003420    127.0.0.1             127.0.0.1             TCP      18901 > commplex-main [ACK] Seq=49234 Ack=2 Win=65535 Len=1448 TSV=2263933161 TSER=2263932913
    152 0.003426    127.0.0.1             127.0.0.1             TCP      18901 > commplex-main [ACK] Seq=50682 Ack=2 Win=65535 Len=1448 TSV=2263933165 TSER=2263932913
    153 0.003443    127.0.0.1             127.0.0.1             TCP      commplex-main > 18901 [ACK] Seq=2 Ack=44890 Win=64087 Len=0 TSV=2263932922 TSER=2263932710
    154 0.003553    127.0.0.1             127.0.0.1             TCP      18901 > commplex-main [ACK] Seq=52130 Ack=2 Win=65535 Len=1448 TSV=2263933291 TSER=2263932922
    155 0.003555    127.0.0.1             127.0.0.1             TCP      commplex-main > 18901 [ACK] Seq=2 Ack=46338 Win=64087 Len=0 TSV=2263932974 TSER=2263932712
    156 0.003559    127.0.0.1             127.0.0.1             TCP      18901 > commplex-main [ACK] Seq=53578 Ack=2 Win=65535 Len=1448 TSV=2263933295 TSER=2263932922
    157 0.003618    127.0.0.1             127.0.0.1             TCP      18901 > commplex-main [ACK] Seq=55026 Ack=2 Win=65535 Len=1448 TSV=2263933362 TSER=2263932974
    158 0.003624    127.0.0.1             127.0.0.1             TCP      commplex-main > 18901 [ACK] Seq=2 Ack=47786 Win=64087 Len=0 TSV=2263933030 TSER=2263932835
    159 0.003627    127.0.0.1             127.0.0.1             TCP      18901 > commplex-main [ACK] Seq=56474 Ack=2 Win=65535 Len=1448 TSV=2263933366 TSER=2263932974
    160 0.003679    127.0.0.1             127.0.0.1             TCP      18901 > commplex-main [ACK] Seq=57922 Ack=2 Win=65535 Len=1448 TSV=2263933424 TSER=2263933030
    161 0.003691    127.0.0.1             127.0.0.1             TCP      commplex-main > 18901 [ACK] Seq=2 Ack=49234 Win=65535 Len=0 TSV=2263933093 TSER=2263932838
    162 0.003754    127.0.0.1             127.0.0.1             TCP      18901 > commplex-main [ACK] Seq=59370 Ack=2 Win=65535 Len=1448 TSV=2263933493 TSER=2263933093
    163 0.003759    127.0.0.1             127.0.0.1             TCP      18901 > commplex-main [ACK] Seq=49234 Ack=2 Win=65535 Len=1448 TSV=2263933161 TSER=2263932913
    164 0.003794    127.0.0.1             127.0.0.1             TCP      18901 > commplex-main [ACK] Seq=50682 Ack=2 Win=65535 Len=1448 TSV=2263933165 TSER=2263932913
    165 0.003797    127.0.0.1             127.0.0.1             TCP      commplex-main > 18901 [ACK] Seq=2 Ack=50682 Win=65535 Len=0 TSV=2263933538 TSER=2263933161
    166 0.003824    127.0.0.1             127.0.0.1             TCP      18901 > commplex-main [ACK] Seq=52130 Ack=2 Win=65535 Len=1448 TSV=2263933291 TSER=2263932922
    167 0.003834    127.0.0.1             127.0.0.1             TCP      commplex-main > 18901 [ACK] Seq=2 Ack=52130 Win=64087 Len=0 TSV=2263933582 TSER=2263933165
    168 0.003843    127.0.0.1             127.0.0.1             TCP      18901 > commplex-main [ACK] Seq=53578 Ack=2 Win=65535 Len=1448 TSV=2263933295 TSER=2263932922
    169 0.003867    127.0.0.1             127.0.0.1             TCP      18901 > commplex-main [ACK] Seq=55026 Ack=2 Win=65535 Len=1448 TSV=2263933362 TSER=2263932974
    170 0.003880    127.0.0.1             127.0.0.1             TCP      commplex-main > 18901 [ACK] Seq=2 Ack=53578 Win=64087 Len=0 TSV=2263933612 TSER=2263933291
    171 0.003894    127.0.0.1             127.0.0.1             TCP      18901 > commplex-main [ACK] Seq=56474 Ack=2 Win=65535 Len=1448 TSV=2263933366 TSER=2263932974
    172 0.003912    127.0.0.1             127.0.0.1             TCP      18901 > commplex-main [ACK] Seq=57922 Ack=2 Win=65535 Len=1448 TSV=2263933424 TSER=2263933030
    173 0.003936    127.0.0.1             127.0.0.1             TCP      commplex-main > 18901 [ACK] Seq=2 Ack=55026 Win=62639 Len=0 TSV=2263933653 TSER=2263933295
    174 0.003945    127.0.0.1             127.0.0.1             TCP      18901 > commplex-main [ACK] Seq=59370 Ack=2 Win=65535 Len=1448 TSV=2263933493 TSER=2263933093
    175 0.003969    127.0.0.1             127.0.0.1             TCP      commplex-main > 18901 [ACK] Seq=2 Ack=56474 Win=61191 Len=0 TSV=2263933663 TSER=2263933362
    176 0.003975    127.0.0.1             127.0.0.1             TCP      commplex-main > 18901 [ACK] Seq=2 Ack=50682 Win=65535 Len=0 TSV=2263933538 TSER=2263933161
    177 0.004001    127.0.0.1             127.0.0.1             TCP      commplex-main > 18901 [ACK] Seq=2 Ack=52130 Win=64087 Len=0 TSV=2263933582 TSER=2263933165
    178 0.004003    127.0.0.1             127.0.0.1             TCP      commplex-main > 18901 [ACK] Seq=2 Ack=57922 Win=64087 Len=0 TSV=2263933712 TSER=2263933366
    179 0.004011    127.0.0.1             127.0.0.1             TCP      commplex-main > 18901 [ACK] Seq=2 Ack=59370 Win=62639 Len=0 TSV=2263933738 TSER=2263933424
    180 0.004036    127.0.0.1             127.0.0.1             TCP      commplex-main > 18901 [ACK] Seq=2 Ack=53578 Win=64087 Len=0 TSV=2263933612 TSER=2263933291
    181 0.004076    127.0.0.1             127.0.0.1             TCP      commplex-main > 18901 [ACK] Seq=2 Ack=55026 Win=62639 Len=0 TSV=2263933653 TSER=2263933295
    182 0.004115    127.0.0.1             127.0.0.1             TCP      commplex-main > 18901 [ACK] Seq=2 Ack=56474 Win=61191 Len=0 TSV=2263933663 TSER=2263933362
    183 0.004146    127.0.0.1             127.0.0.1             TCP      commplex-main > 18901 [ACK] Seq=2 Ack=57922 Win=64087 Len=0 TSV=2263933712 TSER=2263933366
    184 0.004176    127.0.0.1             127.0.0.1             TCP      commplex-main > 18901 [ACK] Seq=2 Ack=59370 Win=62639 Len=0 TSV=2263933738 TSER=2263933424
    185 0.004273    127.0.0.1             127.0.0.1             TCP      commplex-main > 18901 [ACK] Seq=2 Ack=60818 Win=64087 Len=0 TSV=2263933776 TSER=2263933493
    186 0.004280    127.0.0.1             127.0.0.1             TCP      18901 > commplex-main [ACK] Seq=60818 Ack=2 Win=65535 Len=1448 TSV=2263933808 TSER=2263933538
    187 0.004286    127.0.0.1             127.0.0.1             TCP      18901 > commplex-main [ACK] Seq=62266 Ack=2 Win=65535 Len=1448 TSV=2263933838 TSER=2263933582
    188 0.004292    127.0.0.1             127.0.0.1             TCP      18901 > commplex-main [ACK] Seq=63714 Ack=2 Win=65535 Len=1448 TSV=2263933874 TSER=2263933612
    189 0.004297    127.0.0.1             127.0.0.1             TCP      18901 > commplex-main [ACK] Seq=65162 Ack=2 Win=65535 Len=1448 TSV=2263933906 TSER=2263933653
    190 0.004303    127.0.0.1             127.0.0.1             TCP      18901 > commplex-main [ACK] Seq=66610 Ack=2 Win=65535 Len=1448 TSV=2263933937 TSER=2263933663
    191 0.004309    127.0.0.1             127.0.0.1             TCP      18901 > commplex-main [ACK] Seq=68058 Ack=2 Win=65535 Len=1448 TSV=2263933969 TSER=2263933712
    192 0.004314    127.0.0.1             127.0.0.1             TCP      18901 > commplex-main [ACK] Seq=69506 Ack=2 Win=65535 Len=1448 TSV=2263934002 TSER=2263933738
    193 0.004320    127.0.0.1             127.0.0.1             TCP      18901 > commplex-main [ACK] Seq=70954 Ack=2 Win=65535 Len=1448 TSV=2263934007 TSER=2263933738
    194 0.004338    127.0.0.1             127.0.0.1             TCP      commplex-main > 18901 [ACK] Seq=2 Ack=60818 Win=64087 Len=0 TSV=2263933776 TSER=2263933493
    195 0.004413    127.0.0.1             127.0.0.1             TCP      18901 > commplex-main [ACK] Seq=72402 Ack=2 Win=65535 Len=1448 TSV=2263934151 TSER=2263933776
    196 0.004419    127.0.0.1             127.0.0.1             TCP      18901 > commplex-main [ACK] Seq=60818 Ack=2 Win=65535 Len=1448 TSV=2263933808 TSER=2263933538
    197 0.004488    127.0.0.1             127.0.0.1             TCP      commplex-main > 18901 [ACK] Seq=2 Ack=62266 Win=65535 Len=0 TSV=2263934217 TSER=2263933808
    198 0.004497    127.0.0.1             127.0.0.1             TCP      18901 > commplex-main [ACK] Seq=62266 Ack=2 Win=65535 Len=1448 TSV=2263933838 TSER=2263933582
    199 0.004542    127.0.0.1             127.0.0.1             TCP      commplex-main > 18901 [ACK] Seq=2 Ack=63714 Win=65535 Len=0 TSV=2263934279 TSER=2263933838
    200 0.004546    127.0.0.1             127.0.0.1             TCP      18901 > commplex-main [ACK] Seq=63714 Ack=2 Win=65535 Len=1448 TSV=2263933874 TSER=2263933612
    201 0.004587    127.0.0.1             127.0.0.1             TCP      commplex-main > 18901 [ACK] Seq=2 Ack=65162 Win=65535 Len=0 TSV=2263934326 TSER=2263933874
    202 0.004592    127.0.0.1             127.0.0.1             TCP      18901 > commplex-main [ACK] Seq=65162 Ack=2 Win=65535 Len=1448 TSV=2263933906 TSER=2263933653
    203 0.004632    127.0.0.1             127.0.0.1             TCP      18901 > commplex-main [ACK] Seq=66610 Ack=2 Win=65535 Len=1448 TSV=2263933937 TSER=2263933663
    204 0.004641    127.0.0.1             127.0.0.1             TCP      commplex-main > 18901 [ACK] Seq=2 Ack=66610 Win=65535 Len=0 TSV=2263934372 TSER=2263933906
    205 0.004672    127.0.0.1             127.0.0.1             TCP      commplex-main > 18901 [ACK] Seq=2 Ack=68058 Win=65535 Len=0 TSV=2263934412 TSER=2263933937
    206 0.004675    127.0.0.1             127.0.0.1             TCP      18901 > commplex-main [ACK] Seq=68058 Ack=2 Win=65535 Len=1448 TSV=2263933969 TSER=2263933712
    207 0.004713    127.0.0.1             127.0.0.1             TCP      commplex-main > 18901 [ACK] Seq=2 Ack=69506 Win=65535 Len=0 TSV=2263934453 TSER=2263933969
    208 0.004715    127.0.0.1             127.0.0.1             TCP      18901 > commplex-main [ACK] Seq=69506 Ack=2 Win=65535 Len=1448 TSV=2263934002 TSER=2263933738
    209 0.004755    127.0.0.1             127.0.0.1             TCP      commplex-main > 18901 [ACK] Seq=2 Ack=70954 Win=65535 Len=0 TSV=2263934494 TSER=2263934002
    210 0.004757    127.0.0.1             127.0.0.1             TCP      18901 > commplex-main [ACK] Seq=70954 Ack=2 Win=65535 Len=1448 TSV=2263934007 TSER=2263933738
    211 0.004801    127.0.0.1             127.0.0.1             TCP      commplex-main > 18901 [ACK] Seq=2 Ack=72402 Win=65535 Len=0 TSV=2263934535 TSER=2263934007
    212 0.004804    127.0.0.1             127.0.0.1             TCP      18901 > commplex-main [ACK] Seq=72402 Ack=2 Win=65535 Len=1448 TSV=2263934151 TSER=2263933776
    213 0.004828    127.0.0.1             127.0.0.1             TCP      commplex-main > 18901 [ACK] Seq=2 Ack=62266 Win=65535 Len=0 TSV=2263934217 TSER=2263933808
    214 0.004852    127.0.0.1             127.0.0.1             TCP      commplex-main > 18901 [ACK] Seq=2 Ack=73850 Win=65535 Len=0 TSV=2263934590 TSER=2263934151
    215 0.004866    127.0.0.1             127.0.0.1             TCP      commplex-main > 18901 [ACK] Seq=2 Ack=63714 Win=65535 Len=0 TSV=2263934279 TSER=2263933838
    216 0.004874    127.0.0.1             127.0.0.1             TCP      commplex-main > 18901 [ACK] Seq=2 Ack=65162 Win=65535 Len=0 TSV=2263934326 TSER=2263933874
    217 0.004937    127.0.0.1             127.0.0.1             TCP      18901 > commplex-main [ACK] Seq=73850 Ack=2 Win=65535 Len=1448 TSV=2263934676 TSER=2263934217
    218 0.004984    127.0.0.1             127.0.0.1             TCP      18901 > commplex-main [ACK] Seq=75298 Ack=2 Win=65535 Len=1448 TSV=2263934729 TSER=2263934279
    219 0.005031    127.0.0.1             127.0.0.1             TCP      commplex-main > 18901 [ACK] Seq=2 Ack=66610 Win=65535 Len=0 TSV=2263934372 TSER=2263933906
    220 0.005042    127.0.0.1             127.0.0.1             TCP      18901 > commplex-main [ACK] Seq=76746 Ack=2 Win=65535 Len=1448 TSV=2263934771 TSER=2263934326
    221 0.005112    127.0.0.1             127.0.0.1             TCP      18901 > commplex-main [ACK] Seq=78194 Ack=2 Win=65535 Len=1448 TSV=2263934845 TSER=2263934372
    222 0.005129    127.0.0.1             127.0.0.1             TCP      commplex-main > 18901 [ACK] Seq=2 Ack=68058 Win=65535 Len=0 TSV=2263934412 TSER=2263933937
    223 0.005206    127.0.0.1             127.0.0.1             TCP      18901 > commplex-main [ACK] Seq=79642 Ack=2 Win=65535 Len=1448 TSV=2263934950 TSER=2263934412
    224 0.005219    127.0.0.1             127.0.0.1             TCP      commplex-main > 18901 [ACK] Seq=2 Ack=69506 Win=65535 Len=0 TSV=2263934453 TSER=2263933969
    225 0.005292    127.0.0.1             127.0.0.1             TCP      18901 > commplex-main [ACK] Seq=81090 Ack=2 Win=65535 Len=1448 TSV=2263935029 TSER=2263934453
    226 0.005297    127.0.0.1             127.0.0.1             TCP      commplex-main > 18901 [ACK] Seq=2 Ack=70954 Win=65535 Len=0 TSV=2263934494 TSER=2263934002
    227 0.005363    127.0.0.1             127.0.0.1             TCP      18901 > commplex-main [ACK] Seq=82538 Ack=2 Win=65535 Len=1448 TSV=2263935106 TSER=2263934494
    228 0.005376    127.0.0.1             127.0.0.1             TCP      commplex-main > 18901 [ACK] Seq=2 Ack=72402 Win=65535 Len=0 TSV=2263934535 TSER=2263934007
    229 0.005401    127.0.0.1             127.0.0.1             TCP      commplex-main > 18901 [ACK] Seq=2 Ack=73850 Win=65535 Len=0 TSV=2263934590 TSER=2263934151
    230 0.005466    127.0.0.1             127.0.0.1             TCP      18901 > commplex-main [ACK] Seq=83986 Ack=2 Win=65535 Len=1448 TSV=2263935210 TSER=2263934535
    231 0.005472    127.0.0.1             127.0.0.1             TCP      18901 > commplex-main [ACK] Seq=85434 Ack=2 Win=65535 Len=1448 TSV=2263935215 TSER=2263934535
    232 0.005524    127.0.0.1             127.0.0.1             TCP      18901 > commplex-main [ACK] Seq=86882 Ack=2 Win=65535 Len=1448 TSV=2263935268 TSER=2263934590
    233 0.005542    127.0.0.1             127.0.0.1             TCP      18901 > commplex-main [ACK] Seq=73850 Ack=2 Win=65535 Len=1448 TSV=2263934676 TSER=2263934217
    234 0.005555    127.0.0.1             127.0.0.1             TCP      18901 > commplex-main [ACK] Seq=75298 Ack=2 Win=65535 Len=1448 TSV=2263934729 TSER=2263934279
    235 0.005588    127.0.0.1             127.0.0.1             TCP      18901 > commplex-main [ACK] Seq=76746 Ack=2 Win=65535 Len=1448 TSV=2263934771 TSER=2263934326
    236 0.005596    127.0.0.1             127.0.0.1             TCP      commplex-main > 18901 [ACK] Seq=2 Ack=75298 Win=65535 Len=0 TSV=2263935327 TSER=2263934676
    237 0.005611    127.0.0.1             127.0.0.1             TCP      18901 > commplex-main [ACK] Seq=78194 Ack=2 Win=65535 Len=1448 TSV=2263934845 TSER=2263934372
    238 0.005626    127.0.0.1             127.0.0.1             TCP      18901 > commplex-main [ACK] Seq=79642 Ack=2 Win=65535 Len=1448 TSV=2263934950 TSER=2263934412
    239 0.005630    127.0.0.1             127.0.0.1             TCP      commplex-main > 18901 [ACK] Seq=2 Ack=76746 Win=64087 Len=0 TSV=2263935369 TSER=2263934729
    240 0.005640    127.0.0.1             127.0.0.1             TCP      18901 > commplex-main [ACK] Seq=81090 Ack=2 Win=65535 Len=1448 TSV=2263935029 TSER=2263934453
    241 0.005664    127.0.0.1             127.0.0.1             TCP      commplex-main > 18901 [ACK] Seq=2 Ack=78194 Win=62639 Len=0 TSV=2263935400 TSER=2263934771
    242 0.005670    127.0.0.1             127.0.0.1             TCP      18901 > commplex-main [ACK] Seq=82538 Ack=2 Win=65535 Len=1448 TSV=2263935106 TSER=2263934494
    243 0.005698    127.0.0.1             127.0.0.1             TCP      commplex-main > 18901 [ACK] Seq=2 Ack=79642 Win=64087 Len=0 TSV=2263935444 TSER=2263934845
    244 0.005725    127.0.0.1             127.0.0.1             TCP      commplex-main > 18901 [ACK] Seq=2 Ack=81090 Win=62639 Len=0 TSV=2263935461 TSER=2263934950
    245 0.005757    127.0.0.1             127.0.0.1             TCP      18901 > commplex-main [ACK] Seq=83986 Ack=2 Win=65535 Len=1448 TSV=2263935210 TSER=2263934535
    246 0.005763    127.0.0.1             127.0.0.1             TCP      commplex-main > 18901 [ACK] Seq=2 Ack=82538 Win=61191 Len=0 TSV=2263935477 TSER=2263935029
    247 0.005769    127.0.0.1             127.0.0.1             TCP      commplex-main > 18901 [ACK] Seq=2 Ack=83986 Win=59743 Len=0 TSV=2263935483 TSER=2263935106
    248 0.005806    127.0.0.1             127.0.0.1             TCP      18901 > commplex-main [ACK] Seq=85434 Ack=2 Win=65535 Len=1448 TSV=2263935215 TSER=2263934535
    249 0.005812    127.0.0.1             127.0.0.1             TCP      commplex-main > 18901 [ACK] Seq=2 Ack=85434 Win=64087 Len=0 TSV=2263935533 TSER=2263935210
    250 0.005847    127.0.0.1             127.0.0.1             TCP      commplex-main > 18901 [ACK] Seq=2 Ack=86882 Win=65535 Len=0 TSV=2263935586 TSER=2263935215
    251 0.005862    127.0.0.1             127.0.0.1             TCP      18901 > commplex-main [ACK] Seq=86882 Ack=2 Win=65535 Len=1448 TSV=2263935268 TSER=2263934590
    252 0.005879    127.0.0.1             127.0.0.1             TCP      commplex-main > 18901 [ACK] Seq=2 Ack=75298 Win=65535 Len=0 TSV=2263935327 TSER=2263934676
    253 0.005910    127.0.0.1             127.0.0.1             TCP      commplex-main > 18901 [ACK] Seq=2 Ack=88330 Win=65535 Len=0 TSV=2263935648 TSER=2263935268
    254 0.005917    127.0.0.1             127.0.0.1             TCP      commplex-main > 18901 [ACK] Seq=2 Ack=76746 Win=64087 Len=0 TSV=2263935369 TSER=2263934729
    255 0.005973    127.0.0.1             127.0.0.1             TCP      18901 > commplex-main [ACK] Seq=88330 Ack=2 Win=65535 Len=1448 TSV=2263935718 TSER=2263935327
    256 0.006003    127.0.0.1             127.0.0.1             TCP      18901 > commplex-main [ACK] Seq=89778 Ack=2 Win=65535 Len=1448 TSV=2263935748 TSER=2263935369
    257 0.006025    127.0.0.1             127.0.0.1             TCP      commplex-main > 18901 [ACK] Seq=2 Ack=78194 Win=62639 Len=0 TSV=2263935400 TSER=2263934771
    258 0.006033    127.0.0.1             127.0.0.1             TCP      commplex-main > 18901 [ACK] Seq=2 Ack=79642 Win=64087 Len=0 TSV=2263935444 TSER=2263934845
    259 0.006043    127.0.0.1             127.0.0.1             TCP      commplex-main > 18901 [ACK] Seq=2 Ack=81090 Win=62639 Len=0 TSV=2263935461 TSER=2263934950
    260 0.006052    127.0.0.1             127.0.0.1             TCP      commplex-main > 18901 [ACK] Seq=2 Ack=82538 Win=61191 Len=0 TSV=2263935477 TSER=2263935029
    261 0.006061    127.0.0.1             127.0.0.1             TCP      commplex-main > 18901 [ACK] Seq=2 Ack=83986 Win=59743 Len=0 TSV=2263935483 TSER=2263935106
    262 0.006067    127.0.0.1             127.0.0.1             TCP      commplex-main > 18901 [ACK] Seq=2 Ack=85434 Win=64087 Len=0 TSV=2263935533 TSER=2263935210
    263 0.006077    127.0.0.1             127.0.0.1             TCP      commplex-main > 18901 [ACK] Seq=2 Ack=86882 Win=65535 Len=0 TSV=2263935586 TSER=2263935215
    264 0.006083    127.0.0.1             127.0.0.1             TCP      commplex-main > 18901 [ACK] Seq=2 Ack=88330 Win=65535 Len=0 TSV=2263935648 TSER=2263935268
    265 0.006091    127.0.0.1             127.0.0.1             TCP      18901 > commplex-main [ACK] Seq=88330 Ack=2 Win=65535 Len=1448 TSV=2263935718 TSER=2263935327
    266 0.006097    127.0.0.1             127.0.0.1             TCP      18901 > commplex-main [ACK] Seq=89778 Ack=2 Win=65535 Len=1448 TSV=2263935748 TSER=2263935369
    267 0.006158    127.0.0.1             127.0.0.1             TCP      18901 > commplex-main [ACK] Seq=91226 Ack=2 Win=65535 Len=1448 TSV=2263935902 TSER=2263935400
    268 0.006184    127.0.0.1             127.0.0.1             TCP      18901 > commplex-main [ACK] Seq=91226 Ack=2 Win=65535 Len=1448 TSV=2263935902 TSER=2263935400
    269 0.006200    127.0.0.1             127.0.0.1             TCP      18901 > commplex-main [ACK] Seq=92674 Ack=2 Win=65535 Len=1448 TSV=2263935932 TSER=2263935444
    270 0.006229    127.0.0.1             127.0.0.1             TCP      18901 > commplex-main [ACK] Seq=94122 Ack=2 Win=65535 Len=1448 TSV=2263935972 TSER=2263935461
    271 0.006246    127.0.0.1             127.0.0.1             TCP      18901 > commplex-main [ACK] Seq=92674 Ack=2 Win=65535 Len=1448 TSV=2263935932 TSER=2263935444
    272 0.006262    127.0.0.1             127.0.0.1             TCP      18901 > commplex-main [ACK] Seq=95570 Ack=2 Win=65535 Len=1448 TSV=2263936009 TSER=2263935477
    273 0.006283    127.0.0.1             127.0.0.1             TCP      18901 > commplex-main [ACK] Seq=94122 Ack=2 Win=65535 Len=1448 TSV=2263935972 TSER=2263935461
    274 0.006298    127.0.0.1             127.0.0.1             TCP      18901 > commplex-main [ACK] Seq=97018 Ack=2 Win=65535 Len=1448 TSV=2263936043 TSER=2263935483
    275 0.006318    127.0.0.1             127.0.0.1             TCP      18901 > commplex-main [ACK] Seq=95570 Ack=2 Win=65535 Len=1448 TSV=2263936009 TSER=2263935477
    276 0.006334    127.0.0.1             127.0.0.1             TCP      18901 > commplex-main [ACK] Seq=98466 Ack=2 Win=65535 Len=1448 TSV=2263936078 TSER=2263935533
    277 0.006354    127.0.0.1             127.0.0.1             TCP      18901 > commplex-main [ACK] Seq=97018 Ack=2 Win=65535 Len=1448 TSV=2263936043 TSER=2263935483
    278 0.006374    127.0.0.1             127.0.0.1             TCP      18901 > commplex-main [ACK] Seq=99914 Ack=2 Win=65535 Len=1448 TSV=2263936110 TSER=2263935586
    279 0.006399    127.0.0.1             127.0.0.1             TCP      18901 > commplex-main [ACK] Seq=98466 Ack=2 Win=65535 Len=1448 TSV=2263936078 TSER=2263935533
    280 0.006414    127.0.0.1             127.0.0.1             TCP      18901 > commplex-main [ACK] Seq=101362 Ack=2 Win=65535 Len=1448 TSV=2263936159 TSER=2263935648
    281 0.006449    127.0.0.1             127.0.0.1             TCP      18901 > commplex-main [ACK] Seq=99914 Ack=2 Win=65535 Len=1448 TSV=2263936110 TSER=2263935586
    282 0.006474    127.0.0.1             127.0.0.1             TCP      18901 > commplex-main [ACK] Seq=101362 Ack=2 Win=65535 Len=1448 TSV=2263936159 TSER=2263935648
    283 0.006493    127.0.0.1             127.0.0.1             TCP      18901 > commplex-main [ACK] Seq=102810 Ack=2 Win=65535 Len=1448 TSV=2263936163 TSER=2263935648
    284 0.006499    127.0.0.1             127.0.0.1             TCP      commplex-main > 18901 [ACK] Seq=2 Ack=89778 Win=65535 Len=0 TSV=2263936172 TSER=2263935718
    285 0.006504    127.0.0.1             127.0.0.1             TCP      commplex-main > 18901 [ACK] Seq=2 Ack=91226 Win=64087 Len=0 TSV=2263936183 TSER=2263935748
    286 0.006508    127.0.0.1             127.0.0.1             TCP      commplex-main > 18901 [ACK] Seq=2 Ack=92674 Win=62639 Len=0 TSV=2263936187 TSER=2263935902
    287 0.006519    127.0.0.1             127.0.0.1             TCP      commplex-main > 18901 [ACK] Seq=2 Ack=94122 Win=61191 Len=0 TSV=2263936210 TSER=2263935932
    288 0.006545    127.0.0.1             127.0.0.1             TCP      commplex-main > 18901 [ACK] Seq=2 Ack=95570 Win=59743 Len=0 TSV=2263936220 TSER=2263935972
    289 0.006550    127.0.0.1             127.0.0.1             TCP      commplex-main > 18901 [ACK] Seq=2 Ack=97018 Win=58295 Len=0 TSV=2263936225 TSER=2263936009
    290 0.006555    127.0.0.1             127.0.0.1             TCP      commplex-main > 18901 [ACK] Seq=2 Ack=98466 Win=56847 Len=0 TSV=2263936237 TSER=2263936043
    291 0.006573    127.0.0.1             127.0.0.1             TCP      commplex-main > 18901 [ACK] Seq=2 Ack=99914 Win=55399 Len=0 TSV=2263936247 TSER=2263936078
    292 0.006579    127.0.0.1             127.0.0.1             TCP      commplex-main > 18901 [ACK] Seq=2 Ack=101362 Win=53951 Len=0 TSV=2263936255 TSER=2263936110
    293 0.006583    127.0.0.1             127.0.0.1             TCP      commplex-main > 18901 [ACK] Seq=2 Ack=102810 Win=64087 Len=0 TSV=2263936276 TSER=2263936159
    294 0.006596    127.0.0.1             127.0.0.1             TCP      18901 > commplex-main [ACK] Seq=102810 Ack=2 Win=65535 Len=1448 TSV=2263936163 TSER=2263935648
    295 0.006616    127.0.0.1             127.0.0.1             TCP      commplex-main > 18901 [ACK] Seq=2 Ack=89778 Win=65535 Len=0 TSV=2263936172 TSER=2263935718
    296 0.006642    127.0.0.1             127.0.0.1             TCP      commplex-main > 18901 [ACK] Seq=2 Ack=104258 Win=65535 Len=0 TSV=2263936377 TSER=2263936163
    297 0.006659    127.0.0.1             127.0.0.1             TCP      commplex-main > 18901 [ACK] Seq=2 Ack=91226 Win=64087 Len=0 TSV=2263936183 TSER=2263935748
    298 0.006681    127.0.0.1             127.0.0.1             TCP      commplex-main > 18901 [ACK] Seq=2 Ack=92674 Win=62639 Len=0 TSV=2263936187 TSER=2263935902
    299 0.006695    127.0.0.1             127.0.0.1             TCP      18901 > commplex-main [ACK] Seq=104258 Ack=2 Win=65535 Len=1448 TSV=2263936425 TSER=2263936172
    300 0.006709    127.0.0.1             127.0.0.1             TCP      commplex-main > 18901 [ACK] Seq=2 Ack=94122 Win=61191 Len=0 TSV=2263936210 TSER=2263935932
    301 0.006726    127.0.0.1             127.0.0.1             TCP      commplex-main > 18901 [ACK] Seq=2 Ack=95570 Win=59743 Len=0 TSV=2263936220 TSER=2263935972
    302 0.006741    127.0.0.1             127.0.0.1             TCP      18901 > commplex-main [ACK] Seq=105706 Ack=2 Win=65535 Len=1448 TSV=2263936481 TSER=2263936183
    303 0.006758    127.0.0.1             127.0.0.1             TCP      commplex-main > 18901 [ACK] Seq=2 Ack=97018 Win=58295 Len=0 TSV=2263936225 TSER=2263936009
    304 0.006781    127.0.0.1             127.0.0.1             TCP      commplex-main > 18901 [ACK] Seq=2 Ack=98466 Win=56847 Len=0 TSV=2263936237 TSER=2263936043
    305 0.006802    127.0.0.1             127.0.0.1             TCP      commplex-main > 18901 [ACK] Seq=2 Ack=99914 Win=55399 Len=0 TSV=2263936247 TSER=2263936078
    306 0.006825    127.0.0.1             127.0.0.1             TCP      commplex-main > 18901 [ACK] Seq=2 Ack=101362 Win=53951 Len=0 TSV=2263936255 TSER=2263936110
    307 0.006837    127.0.0.1             127.0.0.1             TCP      18901 > commplex-main [ACK] Seq=107154 Ack=2 Win=65535 Len=1448 TSV=2263936525 TSER=2263936187
    308 0.006843    127.0.0.1             127.0.0.1             TCP      18901 > commplex-main [ACK] Seq=108602 Ack=2 Win=65535 Len=1448 TSV=2263936551 TSER=2263936210
    309 0.006848    127.0.0.1             127.0.0.1             TCP      18901 > commplex-main [ACK] Seq=110050 Ack=2 Win=65535 Len=1448 TSV=2263936576 TSER=2263936220
    310 0.006862    127.0.0.1             127.0.0.1             TCP      commplex-main > 18901 [ACK] Seq=2 Ack=102810 Win=64087 Len=0 TSV=2263936276 TSER=2263936159
    311 0.006885    127.0.0.1             127.0.0.1             TCP      commplex-main > 18901 [ACK] Seq=2 Ack=104258 Win=65535 Len=0 TSV=2263936377 TSER=2263936163
    312 0.006910    127.0.0.1             127.0.0.1             TCP      18901 > commplex-main [ACK] Seq=104258 Ack=2 Win=65535 Len=1448 TSV=2263936425 TSER=2263936172
    313 0.006931    127.0.0.1             127.0.0.1             TCP      18901 > commplex-main [ACK] Seq=105706 Ack=2 Win=65535 Len=1448 TSV=2263936481 TSER=2263936183
    314 0.006954    127.0.0.1             127.0.0.1             TCP      18901 > commplex-main [ACK] Seq=107154 Ack=2 Win=65535 Len=1448 TSV=2263936525 TSER=2263936187
    315 0.006976    127.0.0.1             127.0.0.1             TCP      18901 > commplex-main [ACK] Seq=108602 Ack=2 Win=65535 Len=1448 TSV=2263936551 TSER=2263936210
    316 0.006988    127.0.0.1             127.0.0.1             TCP      18901 > commplex-main [ACK] Seq=111498 Ack=2 Win=65535 Len=1448 TSV=2263936635 TSER=2263936225
    317 0.006994    127.0.0.1             127.0.0.1             TCP      18901 > commplex-main [ACK] Seq=112946 Ack=2 Win=65535 Len=1448 TSV=2263936669 TSER=2263936237
    318 0.007000    127.0.0.1             127.0.0.1             TCP      18901 > commplex-main [ACK] Seq=114394 Ack=2 Win=65535 Len=1448 TSV=2263936694 TSER=2263936247
    319 0.007005    127.0.0.1             127.0.0.1             TCP      18901 > commplex-main [ACK] Seq=115842 Ack=2 Win=65535 Len=1448 TSV=2263936719 TSER=2263936255
    320 0.007022    127.0.0.1             127.0.0.1             TCP      18901 > commplex-main [ACK] Seq=110050 Ack=2 Win=65535 Len=1448 TSV=2263936576 TSER=2263936220
    321 0.007041    127.0.0.1             127.0.0.1             TCP      18901 > commplex-main [ACK] Seq=111498 Ack=2 Win=65535 Len=1448 TSV=2263936635 TSER=2263936225
    322 0.007066    127.0.0.1             127.0.0.1             TCP      18901 > commplex-main [ACK] Seq=112946 Ack=2 Win=65535 Len=1448 TSV=2263936669 TSER=2263936237
    323 0.007087    127.0.0.1             127.0.0.1             TCP      18901 > commplex-main [ACK] Seq=114394 Ack=2 Win=65535 Len=1448 TSV=2263936694 TSER=2263936247
    324 0.007116    127.0.0.1             127.0.0.1             TCP      18901 > commplex-main [ACK] Seq=117290 Ack=2 Win=65535 Len=1448 TSV=2263936777 TSER=2263936276
    325 0.007141    127.0.0.1             127.0.0.1             TCP      18901 > commplex-main [ACK] Seq=118738 Ack=2 Win=65535 Len=1448 TSV=2263936809 TSER=2263936377
    326 0.007146    127.0.0.1             127.0.0.1             TCP      18901 > commplex-main [ACK] Seq=120186 Ack=2 Win=65535 Len=1448 TSV=2263936812 TSER=2263936377
    327 0.007153    127.0.0.1             127.0.0.1             TCP      commplex-main > 18901 [ACK] Seq=2 Ack=105706 Win=65535 Len=0 TSV=2263936824 TSER=2263936425
    328 0.007158    127.0.0.1             127.0.0.1             TCP      commplex-main > 18901 [ACK] Seq=2 Ack=107154 Win=64087 Len=0 TSV=2263936832 TSER=2263936481
    329 0.007163    127.0.0.1             127.0.0.1             TCP      commplex-main > 18901 [ACK] Seq=2 Ack=108602 Win=62639 Len=0 TSV=2263936837 TSER=2263936525
    330 0.007167    127.0.0.1             127.0.0.1             TCP      commplex-main > 18901 [ACK] Seq=2 Ack=110050 Win=61191 Len=0 TSV=2263936844 TSER=2263936551
    331 0.007182    127.0.0.1             127.0.0.1             TCP      commplex-main > 18901 [ACK] Seq=2 Ack=111498 Win=59743 Len=0 TSV=2263936887 TSER=2263936576
    332 0.007189    127.0.0.1             127.0.0.1             TCP      commplex-main > 18901 [ACK] Seq=2 Ack=112946 Win=58295 Len=0 TSV=2263936900 TSER=2263936635
    333 0.007202    127.0.0.1             127.0.0.1             TCP      commplex-main > 18901 [ACK] Seq=2 Ack=114394 Win=56847 Len=0 TSV=2263936909 TSER=2263936669
    334 0.007207    127.0.0.1             127.0.0.1             TCP      commplex-main > 18901 [ACK] Seq=2 Ack=115842 Win=55399 Len=0 TSV=2263936914 TSER=2263936694
    335 0.007279    127.0.0.1             127.0.0.1             TCP      18901 > commplex-main [ACK] Seq=115842 Ack=2 Win=65535 Len=1448 TSV=2263936719 TSER=2263936255
    336 0.007304    127.0.0.1             127.0.0.1             TCP      18901 > commplex-main [ACK] Seq=117290 Ack=2 Win=65535 Len=1448 TSV=2263936777 TSER=2263936276
    337 0.007319    127.0.0.1             127.0.0.1             TCP      commplex-main > 18901 [ACK] Seq=2 Ack=117290 Win=65535 Len=0 TSV=2263937059 TSER=2263936719
    338 0.007339    127.0.0.1             127.0.0.1             TCP      18901 > commplex-main [ACK] Seq=118738 Ack=2 Win=65535 Len=1448 TSV=2263936809 TSER=2263936377
    339 0.007354    127.0.0.1             127.0.0.1             TCP      commplex-main > 18901 [ACK] Seq=2 Ack=118738 Win=64087 Len=0 TSV=2263937100 TSER=2263936777
    340 0.007368    127.0.0.1             127.0.0.1             TCP      18901 > commplex-main [ACK] Seq=120186 Ack=2 Win=65535 Len=1448 TSV=2263936812 TSER=2263936377
    341 0.007396    127.0.0.1             127.0.0.1             TCP      commplex-main > 18901 [ACK] Seq=2 Ack=120186 Win=64087 Len=0 TSV=2263937138 TSER=2263936809
    342 0.007401    127.0.0.1             127.0.0.1             TCP      commplex-main > 18901 [ACK] Seq=2 Ack=105706 Win=65535 Len=0 TSV=2263936824 TSER=2263936425
    343 0.007419    127.0.0.1             127.0.0.1             TCP      commplex-main > 18901 [ACK] Seq=2 Ack=107154 Win=64087 Len=0 TSV=2263936832 TSER=2263936481
    344 0.007435    127.0.0.1             127.0.0.1             TCP      commplex-main > 18901 [ACK] Seq=2 Ack=121634 Win=64087 Len=0 TSV=2263937173 TSER=2263936812
    345 0.007456    127.0.0.1             127.0.0.1             TCP      commplex-main > 18901 [ACK] Seq=2 Ack=108602 Win=62639 Len=0 TSV=2263936837 TSER=2263936525
    346 0.007489    127.0.0.1             127.0.0.1             TCP      18901 > commplex-main [ACK] Seq=121634 Ack=2 Win=65535 Len=1448 TSV=2263937232 TSER=2263936824
    347 0.007506    127.0.0.1             127.0.0.1             TCP      commplex-main > 18901 [ACK] Seq=2 Ack=110050 Win=61191 Len=0 TSV=2263936844 TSER=2263936551
    348 0.007522    127.0.0.1             127.0.0.1             TCP      18901 > commplex-main [ACK] Seq=123082 Ack=2 Win=65535 Len=1448 TSV=2263937270 TSER=2263936832
    349 0.007546    127.0.0.1             127.0.0.1             TCP      commplex-main > 18901 [ACK] Seq=2 Ack=111498 Win=59743 Len=0 TSV=2263936887 TSER=2263936576
    350 0.007566    127.0.0.1             127.0.0.1             TCP      18901 > commplex-main [ACK] Seq=124530 Ack=2 Win=65535 Len=1448 TSV=2263937301 TSER=2263936837
    351 0.007587    127.0.0.1             127.0.0.1             TCP      18901 > commplex-main [ACK] Seq=125978 Ack=2 Win=65535 Len=1448 TSV=2263937331 TSER=2263936844
    352 0.007605    127.0.0.1             127.0.0.1             TCP      commplex-main > 18901 [ACK] Seq=2 Ack=112946 Win=58295 Len=0 TSV=2263936900 TSER=2263936635
    353 0.007623    127.0.0.1             127.0.0.1             TCP      18901 > commplex-main [ACK] Seq=127426 Ack=2 Win=65535 Len=1448 TSV=2263937367 TSER=2263936887
    354 0.007650    127.0.0.1             127.0.0.1             TCP      commplex-main > 18901 [ACK] Seq=2 Ack=114394 Win=56847 Len=0 TSV=2263936909 TSER=2263936669
    355 0.007666    127.0.0.1             127.0.0.1             TCP      18901 > commplex-main [ACK] Seq=128874 Ack=2 Win=65535 Len=1448 TSV=2263937404 TSER=2263936900
    356 0.007706    127.0.0.1             127.0.0.1             TCP      commplex-main > 18901 [ACK] Seq=2 Ack=115842 Win=55399 Len=0 TSV=2263936914 TSER=2263936694
    357 0.007721    127.0.0.1             127.0.0.1             TCP      18901 > commplex-main [ACK] Seq=130322 Ack=2 Win=65535 Len=1448 TSV=2263937447 TSER=2263936909
    358 0.007757    127.0.0.1             127.0.0.1             TCP      18901 > commplex-main [ACK] Seq=131770 Ack=2 Win=65535 Len=1448 TSV=2263937501 TSER=2263936914
    359 0.007761    127.0.0.1             127.0.0.1             TCP      commplex-main > 18901 [ACK] Seq=2 Ack=117290 Win=65535 Len=0 TSV=2263937059 TSER=2263936719
    360 0.007791    127.0.0.1             127.0.0.1             TCP      commplex-main > 18901 [ACK] Seq=2 Ack=118738 Win=64087 Len=0 TSV=2263937100 TSER=2263936777
    361 0.007816    127.0.0.1             127.0.0.1             TCP      18901 > commplex-main [ACK] Seq=133218 Ack=2 Win=65535 Len=1448 TSV=2263937562 TSER=2263937059
    362 0.007851    127.0.0.1             127.0.0.1             TCP      18901 > commplex-main [ACK] Seq=134666 Ack=2 Win=65535 Len=1448 TSV=2263937595 TSER=2263937100
    363 0.007855    127.0.0.1             127.0.0.1             TCP      commplex-main > 18901 [ACK] Seq=2 Ack=120186 Win=64087 Len=0 TSV=2263937138 TSER=2263936809
    364 0.007883    127.0.0.1             127.0.0.1             TCP      commplex-main > 18901 [ACK] Seq=2 Ack=121634 Win=64087 Len=0 TSV=2263937173 TSER=2263936812
    365 0.007907    127.0.0.1             127.0.0.1             TCP      18901 > commplex-main [ACK] Seq=136114 Ack=2 Win=65535 Len=1448 TSV=2263937654 TSER=2263937138
    366 0.007922    127.0.0.1             127.0.0.1             TCP      18901 > commplex-main [ACK] Seq=121634 Ack=2 Win=65535 Len=1448 TSV=2263937232 TSER=2263936824
    367 0.007943    127.0.0.1             127.0.0.1             TCP      18901 > commplex-main [ACK] Seq=123082 Ack=2 Win=65535 Len=1448 TSV=2263937270 TSER=2263936832
    368 0.007958    127.0.0.1             127.0.0.1             TCP      18901 > commplex-main [ACK] Seq=137562 Ack=2 Win=65535 Len=1448 TSV=2263937689 TSER=2263937173
    369 0.007975    127.0.0.1             127.0.0.1             TCP      18901 > commplex-main [ACK] Seq=124530 Ack=2 Win=65535 Len=1448 TSV=2263937301 TSER=2263936837
    370 0.007994    127.0.0.1             127.0.0.1             TCP      18901 > commplex-main [ACK] Seq=125978 Ack=2 Win=65535 Len=1448 TSV=2263937331 TSER=2263936844
    371 0.008008    127.0.0.1             127.0.0.1             TCP      commplex-main > 18901 [ACK] Seq=2 Ack=123082 Win=65535 Len=0 TSV=2263937723 TSER=2263937232
    372 0.008013    127.0.0.1             127.0.0.1             TCP      commplex-main > 18901 [ACK] Seq=2 Ack=124530 Win=64087 Len=0 TSV=2263937728 TSER=2263937270
    373 0.008017    127.0.0.1             127.0.0.1             TCP      commplex-main > 18901 [ACK] Seq=2 Ack=125978 Win=62639 Len=0 TSV=2263937766 TSER=2263937301
    374 0.008037    127.0.0.1             127.0.0.1             TCP      18901 > commplex-main [ACK] Seq=127426 Ack=2 Win=65535 Len=1448 TSV=2263937367 TSER=2263936887
    375 0.008056    127.0.0.1             127.0.0.1             TCP      commplex-main > 18901 [ACK] Seq=2 Ack=127426 Win=64087 Len=0 TSV=2263937800 TSER=2263937331
    376 0.008088    127.0.0.1             127.0.0.1             TCP      commplex-main > 18901 [ACK] Seq=2 Ack=128874 Win=64087 Len=0 TSV=2263937833 TSER=2263937367
    377 0.008144    127.0.0.1             127.0.0.1             TCP      18901 > commplex-main [ACK] Seq=128874 Ack=2 Win=65535 Len=1448 TSV=2263937404 TSER=2263936900
    378 0.008171    127.0.0.1             127.0.0.1             TCP      18901 > commplex-main [ACK] Seq=130322 Ack=2 Win=65535 Len=1448 TSV=2263937447 TSER=2263936909
    379 0.008185    127.0.0.1             127.0.0.1             TCP      commplex-main > 18901 [ACK] Seq=2 Ack=130322 Win=65535 Len=0 TSV=2263937921 TSER=2263937404
    380 0.008206    127.0.0.1             127.0.0.1             TCP      18901 > commplex-main [ACK] Seq=131770 Ack=2 Win=65535 Len=1448 TSV=2263937501 TSER=2263936914
    381 0.008219    127.0.0.1             127.0.0.1             TCP      commplex-main > 18901 [ACK] Seq=2 Ack=131770 Win=64087 Len=0 TSV=2263937957 TSER=2263937447
    382 0.008239    127.0.0.1             127.0.0.1             TCP      18901 > commplex-main [ACK] Seq=133218 Ack=2 Win=65535 Len=1448 TSV=2263937562 TSER=2263937059
    383 0.008255    127.0.0.1             127.0.0.1             TCP      commplex-main > 18901 [ACK] Seq=2 Ack=133218 Win=64087 Len=0 TSV=2263937999 TSER=2263937501
    384 0.008268    127.0.0.1             127.0.0.1             TCP      18901 > commplex-main [ACK] Seq=134666 Ack=2 Win=65535 Len=1448 TSV=2263937595 TSER=2263937100
    385 0.008294    127.0.0.1             127.0.0.1             TCP      commplex-main > 18901 [ACK] Seq=2 Ack=134666 Win=64087 Len=0 TSV=2263938034 TSER=2263937562
    386 0.008300    127.0.0.1             127.0.0.1             TCP      18901 > commplex-main [ACK] Seq=136114 Ack=2 Win=65535 Len=1448 TSV=2263937654 TSER=2263937138
    387 0.008319    127.0.0.1             127.0.0.1             TCP      18901 > commplex-main [ACK] Seq=137562 Ack=2 Win=65535 Len=1448 TSV=2263937689 TSER=2263937173
    388 0.008333    127.0.0.1             127.0.0.1             TCP      commplex-main > 18901 [ACK] Seq=2 Ack=136114 Win=64087 Len=0 TSV=2263938071 TSER=2263937595
    389 0.008347    127.0.0.1             127.0.0.1             TCP      commplex-main > 18901 [ACK] Seq=2 Ack=123082 Win=65535 Len=0 TSV=2263937723 TSER=2263937232
    390 0.008366    127.0.0.1             127.0.0.1             TCP      commplex-main > 18901 [ACK] Seq=2 Ack=137562 Win=64087 Len=0 TSV=2263938106 TSER=2263937654
    391 0.008377    127.0.0.1             127.0.0.1             TCP      commplex-main > 18901 [ACK] Seq=2 Ack=139010 Win=62639 Len=0 TSV=2263938123 TSER=2263937689
    392 0.008390    127.0.0.1             127.0.0.1             TCP      commplex-main > 18901 [ACK] Seq=2 Ack=124530 Win=64087 Len=0 TSV=2263937728 TSER=2263937270
    393 0.008413    127.0.0.1             127.0.0.1             TCP      commplex-main > 18901 [ACK] Seq=2 Ack=125978 Win=62639 Len=0 TSV=2263937766 TSER=2263937301
    394 0.008434    127.0.0.1             127.0.0.1             TCP      commplex-main > 18901 [ACK] Seq=2 Ack=127426 Win=64087 Len=0 TSV=2263937800 TSER=2263937331
    395 0.008448    127.0.0.1             127.0.0.1             TCP      18901 > commplex-main [ACK] Seq=139010 Ack=2 Win=65535 Len=1448 TSV=2263938180 TSER=2263937723
    396 0.008454    127.0.0.1             127.0.0.1             TCP      18901 > commplex-main [ACK] Seq=140458 Ack=2 Win=65535 Len=1448 TSV=2263938183 TSER=2263937723
    397 0.008473    127.0.0.1             127.0.0.1             TCP      commplex-main > 18901 [ACK] Seq=2 Ack=128874 Win=64087 Len=0 TSV=2263937833 TSER=2263937367
    398 0.008494    127.0.0.1             127.0.0.1             TCP      commplex-main > 18901 [ACK] Seq=2 Ack=130322 Win=65535 Len=0 TSV=2263937921 TSER=2263937404
    399 0.008517    127.0.0.1             127.0.0.1             TCP      commplex-main > 18901 [ACK] Seq=2 Ack=131770 Win=64087 Len=0 TSV=2263937957 TSER=2263937447
    400 0.008540    127.0.0.1             127.0.0.1             TCP      18901 > commplex-main [ACK] Seq=141906 Ack=2 Win=65535 Len=1448 TSV=2263938233 TSER=2263937728
    401 0.008546    127.0.0.1             127.0.0.1             TCP      18901 > commplex-main [ACK] Seq=143354 Ack=2 Win=65535 Len=1448 TSV=2263938257 TSER=2263937766
    402 0.008552    127.0.0.1             127.0.0.1             TCP      18901 > commplex-main [ACK] Seq=144802 Ack=2 Win=65535 Len=1448 TSV=2263938280 TSER=2263937800
    403 0.008561    127.0.0.1             127.0.0.1             TCP      commplex-main > 18901 [ACK] Seq=2 Ack=133218 Win=64087 Len=0 TSV=2263937999 TSER=2263937501
    404 0.008584    127.0.0.1             127.0.0.1             TCP      commplex-main > 18901 [ACK] Seq=2 Ack=134666 Win=64087 Len=0 TSV=2263938034 TSER=2263937562
    405 0.008606    127.0.0.1             127.0.0.1             TCP      commplex-main > 18901 [ACK] Seq=2 Ack=136114 Win=64087 Len=0 TSV=2263938071 TSER=2263937595
    406 0.008628    127.0.0.1             127.0.0.1             TCP      commplex-main > 18901 [ACK] Seq=2 Ack=137562 Win=64087 Len=0 TSV=2263938106 TSER=2263937654
    407 0.008641    127.0.0.1             127.0.0.1             TCP      18901 > commplex-main [ACK] Seq=146250 Ack=2 Win=65535 Len=1448 TSV=2263938329 TSER=2263937833
    408 0.008651    127.0.0.1             127.0.0.1             TCP      18901 > commplex-main [ACK] Seq=147698 Ack=2 Win=65535 Len=1448 TSV=2263938353 TSER=2263937921
    409 0.008657    127.0.0.1             127.0.0.1             TCP      18901 > commplex-main [ACK] Seq=149146 Ack=2 Win=65535 Len=1448 TSV=2263938376 TSER=2263937957
    410 0.008675    127.0.0.1             127.0.0.1             TCP      commplex-main > 18901 [ACK] Seq=2 Ack=139010 Win=62639 Len=0 TSV=2263938123 TSER=2263937689
    411 0.008697    127.0.0.1             127.0.0.1             TCP      18901 > commplex-main [ACK] Seq=139010 Ack=2 Win=65535 Len=1448 TSV=2263938180 TSER=2263937723
    412 0.008722    127.0.0.1             127.0.0.1             TCP      18901 > commplex-main [ACK] Seq=140458 Ack=2 Win=65535 Len=1448 TSV=2263938183 TSER=2263937723
    413 0.008746    127.0.0.1             127.0.0.1             TCP      18901 > commplex-main [ACK] Seq=141906 Ack=2 Win=65535 Len=1448 TSV=2263938233 TSER=2263937728
    414 0.008759    127.0.0.1             127.0.0.1             TCP      18901 > commplex-main [ACK] Seq=150594 Ack=2 Win=65535 Len=1448 TSV=2263938425 TSER=2263937999
    415 0.008765    127.0.0.1             127.0.0.1             TCP      18901 > commplex-main [ACK] Seq=152042 Ack=2 Win=65535 Len=1448 TSV=2263938448 TSER=2263938034
    416 0.008771    127.0.0.1             127.0.0.1             TCP      18901 > commplex-main [ACK] Seq=153490 Ack=2 Win=65535 Len=1448 TSV=2263938471 TSER=2263938071
    417 0.008776    127.0.0.1             127.0.0.1             TCP      18901 > commplex-main [ACK] Seq=154938 Ack=2 Win=65535 Len=1448 TSV=2263938494 TSER=2263938106
    418 0.008790    127.0.0.1             127.0.0.1             TCP      18901 > commplex-main [ACK] Seq=143354 Ack=2 Win=65535 Len=1448 TSV=2263938257 TSER=2263937766
    419 0.008816    127.0.0.1             127.0.0.1             TCP      18901 > commplex-main [ACK] Seq=144802 Ack=2 Win=65535 Len=1448 TSV=2263938280 TSER=2263937800
    420 0.008839    127.0.0.1             127.0.0.1             TCP      18901 > commplex-main [ACK] Seq=146250 Ack=2 Win=65535 Len=1448 TSV=2263938329 TSER=2263937833
    421 0.008853    127.0.0.1             127.0.0.1             TCP      18901 > commplex-main [ACK] Seq=156386 Ack=2 Win=65535 Len=1448 TSV=2263938556 TSER=2263938123
    422 0.008858    127.0.0.1             127.0.0.1             TCP      commplex-main > 18901 [ACK] Seq=2 Ack=140458 Win=65535 Len=0 TSV=2263938564 TSER=2263938180
    423 0.008863    127.0.0.1             127.0.0.1             TCP      commplex-main > 18901 [ACK] Seq=2 Ack=141906 Win=64087 Len=0 TSV=2263938575 TSER=2263938183
    424 0.008867    127.0.0.1             127.0.0.1             TCP      commplex-main > 18901 [ACK] Seq=2 Ack=143354 Win=62639 Len=0 TSV=2263938585 TSER=2263938233
    425 0.008885    127.0.0.1             127.0.0.1             TCP      18901 > commplex-main [ACK] Seq=147698 Ack=2 Win=65535 Len=1448 TSV=2263938353 TSER=2263937921
    426 0.008901    127.0.0.1             127.0.0.1             TCP      commplex-main > 18901 [ACK] Seq=2 Ack=144802 Win=61191 Len=0 TSV=2263938633 TSER=2263938257
    427 0.008906    127.0.0.1             127.0.0.1             TCP      commplex-main > 18901 [ACK] Seq=2 Ack=146250 Win=59743 Len=0 TSV=2263938639 TSER=2263938280
    428 0.008910    127.0.0.1             127.0.0.1             TCP      commplex-main > 18901 [ACK] Seq=2 Ack=147698 Win=58295 Len=0 TSV=2263938646 TSER=2263938329
    429 0.008934    127.0.0.1             127.0.0.1             TCP      18901 > commplex-main [ACK] Seq=149146 Ack=2 Win=65535 Len=1448 TSV=2263938376 TSER=2263937957
    430 0.008949    127.0.0.1             127.0.0.1             TCP      commplex-main > 18901 [ACK] Seq=2 Ack=149146 Win=64087 Len=0 TSV=2263938696 TSER=2263938353
    431 0.008966    127.0.0.1             127.0.0.1             TCP      18901 > commplex-main [ACK] Seq=150594 Ack=2 Win=65535 Len=1448 TSV=2263938425 TSER=2263937999
    432 0.008983    127.0.0.1             127.0.0.1             TCP      commplex-main > 18901 [ACK] Seq=2 Ack=150594 Win=64087 Len=0 TSV=2263938729 TSER=2263938376
    433 0.008999    127.0.0.1             127.0.0.1             TCP      18901 > commplex-main [ACK] Seq=152042 Ack=2 Win=65535 Len=1448 TSV=2263938448 TSER=2263938034
    434 0.009015    127.0.0.1             127.0.0.1             TCP      commplex-main > 18901 [ACK] Seq=2 Ack=152042 Win=64087 Len=0 TSV=2263938761 TSER=2263938425
    435 0.009032    127.0.0.1             127.0.0.1             TCP      18901 > commplex-main [ACK] Seq=153490 Ack=2 Win=65535 Len=1448 TSV=2263938471 TSER=2263938071
    436 0.009048    127.0.0.1             127.0.0.1             TCP      commplex-main > 18901 [ACK] Seq=2 Ack=153490 Win=64087 Len=0 TSV=2263938794 TSER=2263938448
    437 0.009066    127.0.0.1             127.0.0.1             TCP      18901 > commplex-main [ACK] Seq=154938 Ack=2 Win=65535 Len=1448 TSV=2263938494 TSER=2263938106
    438 0.009082    127.0.0.1             127.0.0.1             TCP      commplex-main > 18901 [ACK] Seq=2 Ack=154938 Win=64087 Len=0 TSV=2263938827 TSER=2263938471
    439 0.009101    127.0.0.1             127.0.0.1             TCP      18901 > commplex-main [ACK] Seq=156386 Ack=2 Win=65535 Len=1448 TSV=2263938556 TSER=2263938123
    440 0.009119    127.0.0.1             127.0.0.1             TCP      commplex-main > 18901 [ACK] Seq=2 Ack=156386 Win=64087 Len=0 TSV=2263938864 TSER=2263938494
    441 0.009135    127.0.0.1             127.0.0.1             TCP      commplex-main > 18901 [ACK] Seq=2 Ack=140458 Win=65535 Len=0 TSV=2263938564 TSER=2263938180
    442 0.009150    127.0.0.1             127.0.0.1             TCP      commplex-main > 18901 [ACK] Seq=2 Ack=157834 Win=64087 Len=0 TSV=2263938896 TSER=2263938556
    443 0.009168    127.0.0.1             127.0.0.1             TCP      commplex-main > 18901 [ACK] Seq=2 Ack=141906 Win=64087 Len=0 TSV=2263938575 TSER=2263938183
    444 0.009191    127.0.0.1             127.0.0.1             TCP      18901 > commplex-main [ACK] Seq=157834 Ack=2 Win=65535 Len=1448 TSV=2263938929 TSER=2263938564
    445 0.009203    127.0.0.1             127.0.0.1             TCP      commplex-main > 18901 [ACK] Seq=2 Ack=143354 Win=62639 Len=0 TSV=2263938585 TSER=2263938233
    446 0.009226    127.0.0.1             127.0.0.1             TCP      commplex-main > 18901 [ACK] Seq=2 Ack=144802 Win=61191 Len=0 TSV=2263938633 TSER=2263938257
    447 0.009252    127.0.0.1             127.0.0.1             TCP      commplex-main > 18901 [ACK] Seq=2 Ack=146250 Win=59743 Len=0 TSV=2263938639 TSER=2263938280
    448 0.009267    127.0.0.1             127.0.0.1             TCP      18901 > commplex-main [ACK] Seq=159282 Ack=2 Win=65535 Len=1448 TSV=2263939001 TSER=2263938575
    449 0.009273    127.0.0.1             127.0.0.1             TCP      18901 > commplex-main [ACK] Seq=160730 Ack=2 Win=65535 Len=1448 TSV=2263939003 TSER=2263938575
    450 0.009292    127.0.0.1             127.0.0.1             TCP      commplex-main > 18901 [ACK] Seq=2 Ack=147698 Win=58295 Len=0 TSV=2263938646 TSER=2263938329
    451 0.009316    127.0.0.1             127.0.0.1             TCP      commplex-main > 18901 [ACK] Seq=2 Ack=149146 Win=64087 Len=0 TSV=2263938696 TSER=2263938353
    452 0.009329    127.0.0.1             127.0.0.1             TCP      18901 > commplex-main [ACK] Seq=162178 Ack=2 Win=65535 Len=1448 TSV=2263939045 TSER=2263938585
    453 0.009343    127.0.0.1             127.0.0.1             TCP      commplex-main > 18901 [ACK] Seq=2 Ack=150594 Win=64087 Len=0 TSV=2263938729 TSER=2263938376
    454 0.009360    127.0.0.1             127.0.0.1             TCP      commplex-main > 18901 [ACK] Seq=2 Ack=152042 Win=64087 Len=0 TSV=2263938761 TSER=2263938425
    455 0.009373    127.0.0.1             127.0.0.1             TCP      18901 > commplex-main [ACK] Seq=163626 Ack=2 Win=65535 Len=1448 TSV=2263939090 TSER=2263938633
    456 0.009379    127.0.0.1             127.0.0.1             TCP      18901 > commplex-main [ACK] Seq=165074 Ack=2 Win=65535 Len=1448 TSV=2263939118 TSER=2263938639
    457 0.009397    127.0.0.1             127.0.0.1             TCP      commplex-main > 18901 [ACK] Seq=2 Ack=153490 Win=64087 Len=0 TSV=2263938794 TSER=2263938448
    458 0.009419    127.0.0.1             127.0.0.1             TCP      commplex-main > 18901 [ACK] Seq=2 Ack=154938 Win=64087 Len=0 TSV=2263938827 TSER=2263938471
    459 0.009440    127.0.0.1             127.0.0.1             TCP      commplex-main > 18901 [ACK] Seq=2 Ack=156386 Win=64087 Len=0 TSV=2263938864 TSER=2263938494
    460 0.009462    127.0.0.1             127.0.0.1             TCP      commplex-main > 18901 [ACK] Seq=2 Ack=157834 Win=64087 Len=0 TSV=2263938896 TSER=2263938556
    461 0.009486    127.0.0.1             127.0.0.1             TCP      18901 > commplex-main [ACK] Seq=166522 Ack=2 Win=65535 Len=1448 TSV=2263939158 TSER=2263938646
    462 0.009493    127.0.0.1             127.0.0.1             TCP      18901 > commplex-main [ACK] Seq=167970 Ack=2 Win=65535 Len=1448 TSV=2263939180 TSER=2263938696
    463 0.009499    127.0.0.1             127.0.0.1             TCP      18901 > commplex-main [ACK] Seq=169418 Ack=2 Win=65535 Len=1448 TSV=2263939202 TSER=2263938729
    464 0.009505    127.0.0.1             127.0.0.1             TCP      18901 > commplex-main [ACK] Seq=170866 Ack=2 Win=65535 Len=1448 TSV=2263939224 TSER=2263938761
    465 0.009515    127.0.0.1             127.0.0.1             TCP      18901 > commplex-main [ACK] Seq=157834 Ack=2 Win=65535 Len=1448 TSV=2263938929 TSER=2263938564
    466 0.009538    127.0.0.1             127.0.0.1             TCP      18901 > commplex-main [ACK] Seq=159282 Ack=2 Win=65535 Len=1448 TSV=2263939001 TSER=2263938575
    467 0.009561    127.0.0.1             127.0.0.1             TCP      18901 > commplex-main [ACK] Seq=160730 Ack=2 Win=65535 Len=1448 TSV=2263939003 TSER=2263938575
    468 0.009584    127.0.0.1             127.0.0.1             TCP      18901 > commplex-main [ACK] Seq=162178 Ack=2 Win=65535 Len=1448 TSV=2263939045 TSER=2263938585
    469 0.009606    127.0.0.1             127.0.0.1             TCP      18901 > commplex-main [ACK] Seq=172314 Ack=2 Win=65535 Len=1448 TSV=2263939276 TSER=2263938794
    470 0.009612    127.0.0.1             127.0.0.1             TCP      18901 > commplex-main [ACK] Seq=173762 Ack=2 Win=65535 Len=1448 TSV=2263939298 TSER=2263938827
    471 0.009618    127.0.0.1             127.0.0.1             TCP      18901 > commplex-main [ACK] Seq=175210 Ack=2 Win=65535 Len=1448 TSV=2263939322 TSER=2263938864
    472 0.009623    127.0.0.1             127.0.0.1             TCP      18901 > commplex-main [ACK] Seq=176658 Ack=2 Win=65535 Len=1448 TSV=2263939344 TSER=2263938896
    473 0.009629    127.0.0.1             127.0.0.1             TCP      18901 > commplex-main [ACK] Seq=163626 Ack=2 Win=65535 Len=1448 TSV=2263939090 TSER=2263938633
    474 0.009660    127.0.0.1             127.0.0.1             TCP      commplex-main > 18901 [ACK] Seq=2 Ack=159282 Win=65535 Len=0 TSV=2263939407 TSER=2263938929
    475 0.009671    127.0.0.1             127.0.0.1             TCP      18901 > commplex-main [ACK] Seq=165074 Ack=2 Win=65535 Len=1448 TSV=2263939118 TSER=2263938639
    476 0.009690    127.0.0.1             127.0.0.1             TCP      commplex-main > 18901 [ACK] Seq=2 Ack=160730 Win=64087 Len=0 TSV=2263939417 TSER=2263939001
    477 0.009696    127.0.0.1             127.0.0.1             TCP      commplex-main > 18901 [ACK] Seq=2 Ack=162178 Win=62639 Len=0 TSV=2263939423 TSER=2263939003
    478 0.009701    127.0.0.1             127.0.0.1             TCP      commplex-main > 18901 [ACK] Seq=2 Ack=163626 Win=61191 Len=0 TSV=2263939434 TSER=2263939045
    479 0.009706    127.0.0.1             127.0.0.1             TCP      commplex-main > 18901 [ACK] Seq=2 Ack=165074 Win=59743 Len=0 TSV=2263939446 TSER=2263939090
    480 0.009718    127.0.0.1             127.0.0.1             TCP      18901 > commplex-main [ACK] Seq=166522 Ack=2 Win=65535 Len=1448 TSV=2263939158 TSER=2263938646
    481 0.009744    127.0.0.1             127.0.0.1             TCP      commplex-main > 18901 [ACK] Seq=2 Ack=166522 Win=64087 Len=0 TSV=2263939485 TSER=2263939118
    482 0.009750    127.0.0.1             127.0.0.1             TCP      18901 > commplex-main [ACK] Seq=167970 Ack=2 Win=65535 Len=1448 TSV=2263939180 TSER=2263938696
    483 0.009770    127.0.0.1             127.0.0.1             TCP      18901 > commplex-main [ACK] Seq=169418 Ack=2 Win=65535 Len=1448 TSV=2263939202 TSER=2263938729
    484 0.009785    127.0.0.1             127.0.0.1             TCP      commplex-main > 18901 [ACK] Seq=2 Ack=167970 Win=64087 Len=0 TSV=2263939521 TSER=2263939158
    485 0.009812    127.0.0.1             127.0.0.1             TCP      commplex-main > 18901 [ACK] Seq=2 Ack=169418 Win=64087 Len=0 TSV=2263939559 TSER=2263939180
    486 0.009816    127.0.0.1             127.0.0.1             TCP      18901 > commplex-main [ACK] Seq=170866 Ack=2 Win=65535 Len=1448 TSV=2263939224 TSER=2263938761
    487 0.009826    127.0.0.1             127.0.0.1             TCP      commplex-main > 18901 [ACK] Seq=2 Ack=170866 Win=62639 Len=0 TSV=2263939569 TSER=2263939202
    488 0.009841    127.0.0.1             127.0.0.1             TCP      18901 > commplex-main [ACK] Seq=172314 Ack=2 Win=65535 Len=1448 TSV=2263939276 TSER=2263938794
    489 0.009865    127.0.0.1             127.0.0.1             TCP      commplex-main > 18901 [ACK] Seq=2 Ack=172314 Win=64087 Len=0 TSV=2263939605 TSER=2263939224
    490 0.009871    127.0.0.1             127.0.0.1             TCP      18901 > commplex-main [ACK] Seq=173762 Ack=2 Win=65535 Len=1448 TSV=2263939298 TSER=2263938827
    491 0.009890    127.0.0.1             127.0.0.1             TCP      18901 > commplex-main [ACK] Seq=175210 Ack=2 Win=65535 Len=1448 TSV=2263939322 TSER=2263938864
    492 0.009904    127.0.0.1             127.0.0.1             TCP      commplex-main > 18901 [ACK] Seq=2 Ack=173762 Win=64087 Len=0 TSV=2263939642 TSER=2263939276
    493 0.009918    127.0.0.1             127.0.0.1             TCP      18901 > commplex-main [ACK] Seq=176658 Ack=2 Win=65535 Len=1448 TSV=2263939344 TSER=2263938896
    494 0.009945    127.0.0.1             127.0.0.1             TCP      commplex-main > 18901 [ACK] Seq=2 Ack=175210 Win=64087 Len=0 TSV=2263939677 TSER=2263939298
    495 0.009951    127.0.0.1             127.0.0.1             TCP      commplex-main > 18901 [ACK] Seq=2 Ack=176658 Win=62639 Len=0 TSV=2263939690 TSER=2263939322
    496 0.009956    127.0.0.1             127.0.0.1             TCP      commplex-main > 18901 [ACK] Seq=2 Ack=159282 Win=65535 Len=0 TSV=2263939407 TSER=2263938929
    497 0.009974    127.0.0.1             127.0.0.1             TCP      commplex-main > 18901 [ACK] Seq=2 Ack=160730 Win=64087 Len=0 TSV=2263939417 TSER=2263939001
    498 0.009989    127.0.0.1             127.0.0.1             TCP      commplex-main > 18901 [ACK] Seq=2 Ack=178106 Win=64087 Len=0 TSV=2263939728 TSER=2263939344
    499 0.010024    127.0.0.1             127.0.0.1             TCP      commplex-main > 18901 [ACK] Seq=2 Ack=162178 Win=62639 Len=0 TSV=2263939423 TSER=2263939003
    500 0.010037    127.0.0.1             127.0.0.1             TCP      18901 > commplex-main [ACK] Seq=178106 Ack=2 Win=65535 Len=1448 TSV=2263939784 TSER=2263939407
    501 0.010066    127.0.0.1             127.0.0.1             TCP      18901 > commplex-main [ACK] Seq=179554 Ack=2 Win=65535 Len=1448 TSV=2263939815 TSER=2263939417
    502 0.010098    127.0.0.1             127.0.0.1             TCP      commplex-main > 18901 [ACK] Seq=2 Ack=163626 Win=61191 Len=0 TSV=2263939434 TSER=2263939045
    503 0.010113    127.0.0.1             127.0.0.1             TCP      18901 > commplex-main [ACK] Seq=181002 Ack=2 Win=65535 Len=1448 TSV=2263939838 TSER=2263939423
    504 0.010129    127.0.0.1             127.0.0.1             TCP      commplex-main > 18901 [ACK] Seq=2 Ack=165074 Win=59743 Len=0 TSV=2263939446 TSER=2263939090
    505 0.010151    127.0.0.1             127.0.0.1             TCP      commplex-main > 18901 [ACK] Seq=2 Ack=166522 Win=64087 Len=0 TSV=2263939485 TSER=2263939118
    506 0.010167    127.0.0.1             127.0.0.1             TCP      18901 > commplex-main [ACK] Seq=182450 Ack=2 Win=65535 Len=1448 TSV=2263939896 TSER=2263939434
    507 0.010173    127.0.0.1             127.0.0.1             TCP      18901 > commplex-main [ACK] Seq=183898 Ack=2 Win=65535 Len=1448 TSV=2263939898 TSER=2263939434
    508 0.010192    127.0.0.1             127.0.0.1             TCP      commplex-main > 18901 [ACK] Seq=2 Ack=167970 Win=64087 Len=0 TSV=2263939521 TSER=2263939158
    509 0.010206    127.0.0.1             127.0.0.1             TCP      18901 > commplex-main [ACK] Seq=185346 Ack=2 Win=65535 Len=1448 TSV=2263939935 TSER=2263939446
    510 0.010225    127.0.0.1             127.0.0.1             TCP      commplex-main > 18901 [ACK] Seq=2 Ack=169418 Win=64087 Len=0 TSV=2263939559 TSER=2263939180
    511 0.010238    127.0.0.1             127.0.0.1             TCP      18901 > commplex-main [ACK] Seq=186794 Ack=2 Win=65535 Len=1448 TSV=2263939974 TSER=2263939485
    512 0.010252    127.0.0.1             127.0.0.1             TCP      commplex-main > 18901 [ACK] Seq=2 Ack=170866 Win=62639 Len=0 TSV=2263939569 TSER=2263939202
    513 0.010277    127.0.0.1             127.0.0.1             TCP      commplex-main > 18901 [ACK] Seq=2 Ack=172314 Win=64087 Len=0 TSV=2263939605 TSER=2263939224
    514 0.010296    127.0.0.1             127.0.0.1             TCP      commplex-main > 18901 [ACK] Seq=2 Ack=173762 Win=64087 Len=0 TSV=2263939642 TSER=2263939276
    515 0.010311    127.0.0.1             127.0.0.1             TCP      18901 > commplex-main [ACK] Seq=188242 Ack=2 Win=65535 Len=1448 TSV=2263940023 TSER=2263939521
    516 0.010318    127.0.0.1             127.0.0.1             TCP      18901 > commplex-main [ACK] Seq=189690 Ack=2 Win=65535 Len=1448 TSV=2263940051 TSER=2263939559
    517 0.010336    127.0.0.1             127.0.0.1             TCP      commplex-main > 18901 [ACK] Seq=2 Ack=175210 Win=64087 Len=0 TSV=2263939677 TSER=2263939298
    518 0.010358    127.0.0.1             127.0.0.1             TCP      commplex-main > 18901 [ACK] Seq=2 Ack=176658 Win=62639 Len=0 TSV=2263939690 TSER=2263939322
    519 0.010386    127.0.0.1             127.0.0.1             TCP      commplex-main > 18901 [ACK] Seq=2 Ack=178106 Win=64087 Len=0 TSV=2263939728 TSER=2263939344
    520 0.010408    127.0.0.1             127.0.0.1             TCP      18901 > commplex-main [ACK] Seq=191138 Ack=2 Win=65535 Len=1448 TSV=2263940095 TSER=2263939569
    521 0.010414    127.0.0.1             127.0.0.1             TCP      18901 > commplex-main [ACK] Seq=192586 Ack=2 Win=65535 Len=1448 TSV=2263940118 TSER=2263939605
    522 0.010420    127.0.0.1             127.0.0.1             TCP      18901 > commplex-main [ACK] Seq=194034 Ack=2 Win=65535 Len=1448 TSV=2263940144 TSER=2263939642
    523 0.010436    127.0.0.1             127.0.0.1             TCP      18901 > commplex-main [ACK] Seq=178106 Ack=2 Win=65535 Len=1448 TSV=2263939784 TSER=2263939407
    524 0.010460    127.0.0.1             127.0.0.1             TCP      18901 > commplex-main [ACK] Seq=179554 Ack=2 Win=65535 Len=1448 TSV=2263939815 TSER=2263939417
    525 0.010483    127.0.0.1             127.0.0.1             TCP      18901 > commplex-main [ACK] Seq=181002 Ack=2 Win=65535 Len=1448 TSV=2263939838 TSER=2263939423
    526 0.010506    127.0.0.1             127.0.0.1             TCP      18901 > commplex-main [ACK] Seq=182450 Ack=2 Win=65535 Len=1448 TSV=2263939896 TSER=2263939434
    527 0.010520    127.0.0.1             127.0.0.1             TCP      18901 > commplex-main [ACK] Seq=195482 Ack=2 Win=65535 Len=1448 TSV=2263940211 TSER=2263939677
    528 0.010536    127.0.0.1             127.0.0.1             TCP      18901 > commplex-main [ACK] Seq=196930 Ack=2 Win=65535 Len=1448 TSV=2263940232 TSER=2263939690
    529 0.010542    127.0.0.1             127.0.0.1             TCP      18901 > commplex-main [ACK] Seq=198378 Ack=2 Win=65535 Len=1448 TSV=2263940252 TSER=2263939728
    530 0.010562    127.0.0.1             127.0.0.1             TCP      18901 > commplex-main [ACK] Seq=183898 Ack=2 Win=65535 Len=1448 TSV=2263939898 TSER=2263939434
    531 0.010577    127.0.0.1             127.0.0.1             TCP      commplex-main > 18901 [ACK] Seq=2 Ack=179554 Win=65535 Len=0 TSV=2263940299 TSER=2263939784
    532 0.010582    127.0.0.1             127.0.0.1             TCP      commplex-main > 18901 [ACK] Seq=2 Ack=181002 Win=64087 Len=0 TSV=2263940310 TSER=2263939815
    533 0.010586    127.0.0.1             127.0.0.1             TCP      commplex-main > 18901 [ACK] Seq=2 Ack=182450 Win=62639 Len=0 TSV=2263940314 TSER=2263939838
    534 0.010610    127.0.0.1             127.0.0.1             TCP      commplex-main > 18901 [ACK] Seq=2 Ack=183898 Win=61191 Len=0 TSV=2263940348 TSER=2263939896
    535 0.010617    127.0.0.1             127.0.0.1             TCP      commplex-main > 18901 [ACK] Seq=2 Ack=185346 Win=59743 Len=0 TSV=2263940363 TSER=2263939898
    536 0.010622    127.0.0.1             127.0.0.1             TCP      18901 > commplex-main [ACK] Seq=185346 Ack=2 Win=65535 Len=1448 TSV=2263939935 TSER=2263939446
    537 0.010642    127.0.0.1             127.0.0.1             TCP      18901 > commplex-main [ACK] Seq=186794 Ack=2 Win=65535 Len=1448 TSV=2263939974 TSER=2263939485
    538 0.010654    127.0.0.1             127.0.0.1             TCP      commplex-main > 18901 [ACK] Seq=2 Ack=186794 Win=64087 Len=0 TSV=2263940401 TSER=2263939935
    539 0.010674    127.0.0.1             127.0.0.1             TCP      18901 > commplex-main [ACK] Seq=188242 Ack=2 Win=65535 Len=1448 TSV=2263940023 TSER=2263939521
    540 0.010692    127.0.0.1             127.0.0.1             TCP      commplex-main > 18901 [ACK] Seq=2 Ack=188242 Win=64087 Len=0 TSV=2263940438 TSER=2263939974
    541 0.010710    127.0.0.1             127.0.0.1             TCP      18901 > commplex-main [ACK] Seq=189690 Ack=2 Win=65535 Len=1448 TSV=2263940051 TSER=2263939559
    542 0.010726    127.0.0.1             127.0.0.1             TCP      commplex-main > 18901 [ACK] Seq=2 Ack=189690 Win=64087 Len=0 TSV=2263940470 TSER=2263940023
    543 0.010746    127.0.0.1             127.0.0.1             TCP      18901 > commplex-main [ACK] Seq=191138 Ack=2 Win=65535 Len=1448 TSV=2263940095 TSER=2263939569
    544 0.010763    127.0.0.1             127.0.0.1             TCP      commplex-main > 18901 [ACK] Seq=2 Ack=191138 Win=64087 Len=0 TSV=2263940507 TSER=2263940051
    545 0.010780    127.0.0.1             127.0.0.1             TCP      commplex-main > 18901 [ACK] Seq=2 Ack=192586 Win=62639 Len=0 TSV=2263940525 TSER=2263940095
    546 0.010786    127.0.0.1             127.0.0.1             TCP      18901 > commplex-main [ACK] Seq=192586 Ack=2 Win=65535 Len=1448 TSV=2263940118 TSER=2263939605
    547 0.010809    127.0.0.1             127.0.0.1             TCP      18901 > commplex-main [ACK] Seq=194034 Ack=2 Win=65535 Len=1448 TSV=2263940144 TSER=2263939642
    548 0.010823    127.0.0.1             127.0.0.1             TCP      commplex-main > 18901 [ACK] Seq=2 Ack=194034 Win=64087 Len=0 TSV=2263940568 TSER=2263940118
    549 0.010847    127.0.0.1             127.0.0.1             TCP      18901 > commplex-main [ACK] Seq=195482 Ack=2 Win=65535 Len=1448 TSV=2263940211 TSER=2263939677
    550 0.010865    127.0.0.1             127.0.0.1             TCP      commplex-main > 18901 [ACK] Seq=2 Ack=195482 Win=64087 Len=0 TSV=2263940611 TSER=2263940144
    551 0.010881    127.0.0.1             127.0.0.1             TCP      18901 > commplex-main [ACK] Seq=196930 Ack=2 Win=65535 Len=1448 TSV=2263940232 TSER=2263939690
    552 0.010898    127.0.0.1             127.0.0.1             TCP      commplex-main > 18901 [ACK] Seq=2 Ack=196930 Win=64087 Len=0 TSV=2263940643 TSER=2263940211
    553 0.010916    127.0.0.1             127.0.0.1             TCP      18901 > commplex-main [ACK] Seq=198378 Ack=2 Win=65535 Len=1448 TSV=2263940252 TSER=2263939728
    554 0.010929    127.0.0.1             127.0.0.1             TCP      commplex-main > 18901 [ACK] Seq=2 Ack=198378 Win=64087 Len=0 TSV=2263940676 TSER=2263940232
    555 0.010948    127.0.0.1             127.0.0.1             TCP      commplex-main > 18901 [ACK] Seq=2 Ack=179554 Win=65535 Len=0 TSV=2263940299 TSER=2263939784
    556 0.010966    127.0.0.1             127.0.0.1             TCP      commplex-main > 18901 [ACK] Seq=2 Ack=199826 Win=64087 Len=0 TSV=2263940712 TSER=2263940252
    557 0.010984    127.0.0.1             127.0.0.1             TCP      commplex-main > 18901 [ACK] Seq=2 Ack=181002 Win=64087 Len=0 TSV=2263940310 TSER=2263939815
    558 0.011008    127.0.0.1             127.0.0.1             TCP      commplex-main > 18901 [ACK] Seq=2 Ack=182450 Win=62639 Len=0 TSV=2263940314 TSER=2263939838
    559 0.011083    127.0.0.1             127.0.0.1             TCP      18901 > commplex-main [ACK] Seq=199826 Ack=2 Win=65535 Len=176 TSV=2263940779 TSER=2263940299
    560 0.011099    127.0.0.1             127.0.0.1             TCP      commplex-main > 18901 [ACK] Seq=2 Ack=183898 Win=61191 Len=0 TSV=2263940348 TSER=2263939896
    561 0.011152    127.0.0.1             127.0.0.1             TCP      commplex-main > 18901 [ACK] Seq=2 Ack=185346 Win=59743 Len=0 TSV=2263940363 TSER=2263939898
    562 0.011196    127.0.0.1             127.0.0.1             TCP      commplex-main > 18901 [ACK] Seq=2 Ack=186794 Win=64087 Len=0 TSV=2263940401 TSER=2263939935
    563 0.011244    127.0.0.1             127.0.0.1             TCP      commplex-main > 18901 [ACK] Seq=2 Ack=188242 Win=64087 Len=0 TSV=2263940438 TSER=2263939974
    564 0.011288    127.0.0.1             127.0.0.1             TCP      commplex-main > 18901 [ACK] Seq=2 Ack=189690 Win=64087 Len=0 TSV=2263940470 TSER=2263940023
    565 0.011335    127.0.0.1             127.0.0.1             TCP      commplex-main > 18901 [ACK] Seq=2 Ack=191138 Win=64087 Len=0 TSV=2263940507 TSER=2263940051
    566 0.011378    127.0.0.1             127.0.0.1             TCP      commplex-main > 18901 [ACK] Seq=2 Ack=192586 Win=62639 Len=0 TSV=2263940525 TSER=2263940095
    567 0.011427    127.0.0.1             127.0.0.1             TCP      commplex-main > 18901 [ACK] Seq=2 Ack=194034 Win=64087 Len=0 TSV=2263940568 TSER=2263940118
    568 0.011470    127.0.0.1             127.0.0.1             TCP      commplex-main > 18901 [ACK] Seq=2 Ack=195482 Win=64087 Len=0 TSV=2263940611 TSER=2263940144
    569 0.011557    127.0.0.1             127.0.0.1             TCP      commplex-main > 18901 [ACK] Seq=2 Ack=196930 Win=64087 Len=0 TSV=2263940643 TSER=2263940211
    570 0.011600    127.0.0.1             127.0.0.1             TCP      commplex-main > 18901 [ACK] Seq=2 Ack=198378 Win=64087 Len=0 TSV=2263940676 TSER=2263940232
    571 0.011646    127.0.0.1             127.0.0.1             TCP      commplex-main > 18901 [ACK] Seq=2 Ack=199826 Win=64087 Len=0 TSV=2263940712 TSER=2263940252
    572 0.011690    127.0.0.1             127.0.0.1             TCP      18901 > commplex-main [ACK] Seq=199826 Ack=2 Win=65535 Len=176 TSV=2263940779 TSER=2263940299
    573 0.011729    127.0.0.1             127.0.0.1             TCP      commplex-main > 18901 [ACK] Seq=2 Ack=200002 Win=65535 Len=0 TSV=2263941475 TSER=2263940779
    574 0.011746    127.0.0.1             127.0.0.1             TCP      commplex-main > 18901 [ACK] Seq=2 Ack=200002 Win=65535 Len=0 TSV=2263941475 TSER=2263940779
    575 0.011808    127.0.0.1             127.0.0.1             TCP      18901 > commplex-main [FIN, ACK] Seq=200002 Ack=2 Win=65535 Len=0 TSV=2263941550 TSER=2263941475
    576 0.011822    127.0.0.1             127.0.0.1             TCP      18901 > commplex-main [FIN, ACK] Seq=200002 Ack=2 Win=65535 Len=0 TSV=2263941550 TSER=2263941475
    577 0.011857    127.0.0.1             127.0.0.1             TCP      commplex-main > 18901 [ACK] Seq=2 Ack=200003 Win=65535 Len=0 TSV=2263941606 TSER=2263941550
    578 0.011871    127.0.0.1             127.0.0.1             TCP      commplex-main > 18901 [ACK] Seq=2 Ack=200003 Win=65535 Len=0 TSV=2263941606 TSER=2263941550
    579 0.011908    127.0.0.1             127.0.0.1             TCP      commplex-main > 18901 [FIN, ACK] Seq=2 Ack=200003 Win=65535 Len=0 TSV=2263941651 TSER=2263941550
    580 0.011941    127.0.0.1             127.0.0.1             TCP      commplex-main > 18901 [FIN, ACK] Seq=2 Ack=200003 Win=65535 Len=0 TSV=2263941651 TSER=2263941550
    581 0.012052    127.0.0.1             127.0.0.1             TCP      18901 > commplex-main [ACK] Seq=200003 Ack=3 Win=65535 Len=0 TSV=2263941794 TSER=2263941651
    582 0.012067    127.0.0.1             127.0.0.1             TCP      18901 > commplex-main [ACK] Seq=200003 Ack=3 Win=65535 Len=0 TSV=2263941794 TSER=2263941651
