No.     Time        Source                Destination           Protocol Info
      1 0.000000    127.0.0.1             127.0.0.1             TCP      57586 > commplex-main [SYN] Seq=1 Win=65535 Len=0 TSV=1749512949 TSER=0
      2 0.019139    127.0.0.1             127.0.0.1             TCP      57586 > commplex-main [SYN] Seq=1 Win=65535 Len=0 TSV=1749512949 TSER=0
      3 0.039382    127.0.0.1             127.0.0.1             TCP      commplex-main > 57586 [SYN, ACK] Seq=1 Ack=2 Win=65535 Len=0 TSV=1749552349 TSER=1749512949
      4 0.058538    127.0.0.1             127.0.0.1             TCP      commplex-main > 57586 [SYN, ACK] Seq=1 Ack=2 Win=65535 Len=0 TSV=1749552349 TSER=1749512949
      5 0.078783    127.0.0.1             127.0.0.1             TCP      57586 > commplex-main [ACK] Seq=2 Ack=2 Win=65535 Len=0 TSV=1749591706 TSER=1749552349
      6 0.097958    127.0.0.1             127.0.0.1             TCP      57586 > commplex-main [ACK] Seq=2 Ack=2 Win=65535 Len=0 TSV=1749591706 TSER=1749552349
      7 0.098861    127.0.0.1             127.0.0.1             TCP      57586 > commplex-main [ACK] Seq=2 Ack=2 Win=65535 Len=1448 TSV=1749591941 TSER=1749552349
      8 0.118024    127.0.0.1             127.0.0.1             TCP      57586 > commplex-main [ACK] Seq=2 Ack=2 Win=65535 Len=1448 TSV=1749591941 TSER=1749552349
      9 0.138237    127.0.0.1             127.0.0.1             TCP      commplex-main > 57586 [ACK] Seq=2 Ack=1450 Win=65535 Len=0 TSV=1749651164 TSER=1749591941
     10 0.157403    127.0.0.1             127.0.0.1             TCP      commplex-main > 57586 [ACK] Seq=2 Ack=1450 Win=65535 Len=0 TSV=1749651164 TSER=1749591941
     11 0.177653    127.0.0.1             127.0.0.1             TCP      57586 > commplex-main [ACK] Seq=1450 Ack=2 Win=65535 Len=1448 TSV=1749690626 TSER=1749651164
     12 0.196774    127.0.0.1             127.0.0.1             TCP      57586 > commplex-main [ACK] Seq=1450 Ack=2 Win=65535 Len=1448 TSV=1749690626 TSER=1749651164
     13 0.197737    127.0.0.1             127.0.0.1             TCP      57586 > commplex-main [ACK] Seq=2898 Ack=2 Win=65535 Len=1448 TSV=1749690630 TSER=1749651164
     14 0.216902    127.0.0.1             127.0.0.1             TCP      57586 > commplex-main [ACK] Seq=2898 Ack=2 Win=65535 Len=1448 TSV=1749690630 TSER=1749651164
     15 0.217818    127.0.0.1             127.0.0.1             TCP      commplex-main > 57586 [ACK] Seq=2 Ack=2898 Win=65535 Len=0 TSV=1749730098 TSER=1749690626
     16 0.236925    127.0.0.1             127.0.0.1             TCP      commplex-main > 57586 [ACK] Seq=2 Ack=2898 Win=65535 Len=0 TSV=1749730098 TSER=1749690626
     17 0.237953    127.0.0.1             127.0.0.1             TCP      commplex-main > 57586 [ACK] Seq=2 Ack=4346 Win=65535 Len=0 TSV=1749750052 TSER=1749690630
     18 0.257060    127.0.0.1             127.0.0.1             TCP      commplex-main > 57586 [ACK] Seq=2 Ack=4346 Win=65535 Len=0 TSV=1749750052 TSER=1749690630
     19 0.258091    127.0.0.1             127.0.0.1             TCP      57586 > commplex-main [ACK] Seq=4346 Ack=2 Win=65535 Len=1448 TSV=1749770147 TSER=1749730098
     20 0.277201    127.0.0.1             127.0.0.1             TCP      57586 > commplex-main [ACK] Seq=4346 Ack=2 Win=65535 Len=1448 TSV=1749770147 TSER=1749730098
     21 0.278170    127.0.0.1             127.0.0.1             TCP      57586 > commplex-main [ACK] Seq=5794 Ack=2 Win=65535 Len=1448 TSV=1749770151 TSER=1749730098
     22 0.297301    127.0.0.1             127.0.0.1             TCP      57586 > commplex-main [ACK] Seq=5794 Ack=2 Win=65535 Len=1448 TSV=1749770151 TSER=1749730098
     23 0.298258    127.0.0.1             127.0.0.1             TCP      57586 > commplex-main [ACK] Seq=7242 Ack=2 Win=65535 Len=1448 TSV=1749790245 TSER=1749750052
     24 0.317376    127.0.0.1             127.0.0.1             TCP      57586 > commplex-main [ACK] Seq=7242 Ack=2 Win=65535 Len=1448 TSV=1749790245 TSER=1749750052
     25 0.318341    127.0.0.1             127.0.0.1             TCP      57586 > commplex-main [ACK] Seq=8690 Ack=2 Win=65535 Len=1448 TSV=1749790249 TSER=1749750052
     26 0.337447    127.0.0.1             127.0.0.1             TCP      57586 > commplex-main [ACK] Seq=8690 Ack=2 Win=65535 Len=1448 TSV=1749790249 TSER=1749750052
     27 0.338420    127.0.0.1             127.0.0.1             TCP      commplex-main > 57586 [ACK] Seq=2 Ack=5794 Win=65535 Len=0 TSV=1749810330 TSER=1749770147
     28 0.357582    127.0.0.1             127.0.0.1             TCP      commplex-main > 57586 [ACK] Seq=2 Ack=5794 Win=65535 Len=0 TSV=1749810330 TSER=1749770147
     29 0.358495    127.0.0.1             127.0.0.1             TCP      commplex-main > 57586 [ACK] Seq=2 Ack=7242 Win=65535 Len=0 TSV=1749830446 TSER=1749770151
     30 0.377626    127.0.0.1             127.0.0.1             TCP      commplex-main > 57586 [ACK] Seq=2 Ack=7242 Win=65535 Len=0 TSV=1749830446 TSER=1749770151
     31 0.378635    127.0.0.1             127.0.0.1             TCP      commplex-main > 57586 [ACK] Seq=2 Ack=8690 Win=65535 Len=0 TSV=1749850496 TSER=1749790245
     32 0.397770    127.0.0.1             127.0.0.1             TCP      commplex-main > 57586 [ACK] Seq=2 Ack=8690 Win=65535 Len=0 TSV=1749850496 TSER=1749790245
     33 0.398718    127.0.0.1             127.0.0.1             TCP      commplex-main > 57586 [ACK] Seq=2 Ack=10138 Win=65535 Len=0 TSV=1749870567 TSER=1749790249
     34 0.417886    127.0.0.1             127.0.0.1             TCP      commplex-main > 57586 [ACK] Seq=2 Ack=10138 Win=65535 Len=0 TSV=1749870567 TSER=1749790249
     35 0.418853    127.0.0.1             127.0.0.1             TCP      57586 > commplex-main [ACK] Seq=10138 Ack=2 Win=65535 Len=1448 TSV=1749890833 TSER=1749810330
     36 0.438991    127.0.0.1             127.0.0.1             TCP      57586 > commplex-main [ACK] Seq=11586 Ack=2 Win=65535 Len=1448 TSV=1749890837 TSER=1749810330
     37 0.459126    127.0.0.1             127.0.0.1             TCP      57586 > commplex-main [ACK] Seq=13034 Ack=2 Win=65535 Len=1448 TSV=1749910841 TSER=1749830446
     38 0.479265    127.0.0.1             127.0.0.1             TCP      57586 > commplex-main [ACK] Seq=14482 Ack=2 Win=65535 Len=1448 TSV=1749910845 TSER=1749830446
     39 0.499399    127.0.0.1             127.0.0.1             TCP      57586 > commplex-main [ACK] Seq=15930 Ack=2 Win=65535 Len=1448 TSV=1749931012 TSER=1749850496
     40 0.519534    127.0.0.1             127.0.0.1             TCP      57586 > commplex-main [ACK] Seq=17378 Ack=2 Win=65535 Len=1448 TSV=1749931016 TSER=1749850496
     41 0.539653    127.0.0.1             127.0.0.1             TCP      57586 > commplex-main [ACK] Seq=18826 Ack=2 Win=65535 Len=1448 TSV=1749951076 TSER=1749870567
     42 0.559791    127.0.0.1             127.0.0.1             TCP      57586 > commplex-main [ACK] Seq=20274 Ack=2 Win=65535 Len=1448 TSV=1749951079 TSER=1749870567
     43 1.438457    127.0.0.1             127.0.0.1             TCP      57586 > commplex-main [ACK] Seq=10138 Ack=2 Win=65535 Len=1448 TSV=1750951342 TSER=1749870567
     44 1.457622    127.0.0.1             127.0.0.1             TCP      57586 > commplex-main [ACK] Seq=10138 Ack=2 Win=65535 Len=1448 TSV=1750951342 TSER=1749870567
     45 1.477841    127.0.0.1             127.0.0.1             TCP      commplex-main > 57586 [ACK] Seq=2 Ack=11586 Win=65535 Len=0 TSV=1750990766 TSER=1750951342
     46 1.497000    127.0.0.1             127.0.0.1             TCP      commplex-main > 57586 [ACK] Seq=2 Ack=11586 Win=65535 Len=0 TSV=1750990766 TSER=1750951342
     47 1.517292    127.0.0.1             127.0.0.1             TCP      57586 > commplex-main [ACK] Seq=11586 Ack=2 Win=65535 Len=1448 TSV=1751030210 TSER=1750990766
     48 1.536457    127.0.0.1             127.0.0.1             TCP      57586 > commplex-main [ACK] Seq=11586 Ack=2 Win=65535 Len=1448 TSV=1751030210 TSER=1750990766
     49 1.537426    127.0.0.1             127.0.0.1             TCP      57586 > commplex-main [ACK] Seq=13034 Ack=2 Win=65535 Len=1448 TSV=1751030214 TSER=1750990766
     50 1.556588    127.0.0.1             127.0.0.1             TCP      57586 > commplex-main [ACK] Seq=13034 Ack=2 Win=65535 Len=1448 TSV=1751030214 TSER=1750990766
     51 1.557506    127.0.0.1             127.0.0.1             TCP      commplex-main > 57586 [ACK] Seq=2 Ack=13034 Win=65535 Len=0 TSV=1751069588 TSER=1751030210
     52 1.576610    127.0.0.1             127.0.0.1             TCP      commplex-main > 57586 [ACK] Seq=2 Ack=13034 Win=65535 Len=0 TSV=1751069588 TSER=1751030210
     53 1.577632    127.0.0.1             127.0.0.1             TCP      commplex-main > 57586 [ACK] Seq=2 Ack=14482 Win=65535 Len=0 TSV=1751089717 TSER=1751030214
     54 1.596734    127.0.0.1             127.0.0.1             TCP      commplex-main > 57586 [ACK] Seq=2 Ack=14482 Win=65535 Len=0 TSV=1751089717 TSER=1751030214
     55 1.597717    127.0.0.1             127.0.0.1             TCP      57586 > commplex-main [ACK] Seq=14482 Ack=2 Win=65535 Len=1448 TSV=1751109796 TSER=1751069588
     56 1.616819    127.0.0.1             127.0.0.1             TCP      57586 > commplex-main [ACK] Seq=14482 Ack=2 Win=65535 Len=1448 TSV=1751109796 TSER=1751069588
     57 1.617850    127.0.0.1             127.0.0.1             TCP      57586 > commplex-main [ACK] Seq=15930 Ack=2 Win=65535 Len=1448 TSV=1751109814 TSER=1751069588
     58 1.637011    127.0.0.1             127.0.0.1             TCP      57586 > commplex-main [ACK] Seq=15930 Ack=2 Win=65535 Len=1448 TSV=1751109814 TSER=1751069588
     59 1.637984    127.0.0.1             127.0.0.1             TCP      57586 > commplex-main [ACK] Seq=17378 Ack=2 Win=65535 Len=1448 TSV=1751129944 TSER=1751089717
     60 1.657138    127.0.0.1             127.0.0.1             TCP      57586 > commplex-main [ACK] Seq=17378 Ack=2 Win=65535 Len=1448 TSV=1751129944 TSER=1751089717
     61 1.658119    127.0.0.1             127.0.0.1             TCP      57586 > commplex-main [ACK] Seq=18826 Ack=2 Win=65535 Len=1448 TSV=1751129963 TSER=1751089717
     62 1.677286    127.0.0.1             127.0.0.1             TCP      57586 > commplex-main [ACK] Seq=18826 Ack=2 Win=65535 Len=1448 TSV=1751129963 TSER=1751089717
     63 1.678192    127.0.0.1             127.0.0.1             TCP      commplex-main > 57586 [ACK] Seq=2 Ack=15930 Win=65535 Len=0 TSV=1751149932 TSER=1751109796
     64 1.697300    127.0.0.1             127.0.0.1             TCP      commplex-main > 57586 [ACK] Seq=2 Ack=15930 Win=65535 Len=0 TSV=1751149932 TSER=1751109796
     65 1.698339    127.0.0.1             127.0.0.1             TCP      commplex-main > 57586 [ACK] Seq=2 Ack=17378 Win=65535 Len=0 TSV=1751170140 TSER=1751109814
     66 1.717505    127.0.0.1             127.0.0.1             TCP      commplex-main > 57586 [ACK] Seq=2 Ack=17378 Win=65535 Len=0 TSV=1751170140 TSER=1751109814
     67 1.718421    127.0.0.1             127.0.0.1             TCP      commplex-main > 57586 [ACK] Seq=2 Ack=18826 Win=65535 Len=0 TSV=1751190268 TSER=1751129944
     68 1.737543    127.0.0.1             127.0.0.1             TCP      commplex-main > 57586 [ACK] Seq=2 Ack=18826 Win=65535 Len=0 TSV=1751190268 TSER=1751129944
     69 1.738499    127.0.0.1             127.0.0.1             TCP      commplex-main > 57586 [ACK] Seq=2 Ack=20274 Win=65535 Len=0 TSV=1751210415 TSER=1751129963
     70 1.757620    127.0.0.1             127.0.0.1             TCP      commplex-main > 57586 [ACK] Seq=2 Ack=20274 Win=65535 Len=0 TSV=1751210415 TSER=1751129963
     71 1.758638    127.0.0.1             127.0.0.1             TCP      57586 > commplex-main [ACK] Seq=20274 Ack=2 Win=65535 Len=1448 TSV=1751230487 TSER=1751149932
     72 1.777788    127.0.0.1             127.0.0.1             TCP      57586 > commplex-main [ACK] Seq=20274 Ack=2 Win=65535 Len=1448 TSV=1751230487 TSER=1751149932
     73 1.778772    127.0.0.1             127.0.0.1             TCP      57586 > commplex-main [ACK] Seq=21722 Ack=2 Win=65535 Len=1448 TSV=1751230491 TSER=1751149932
     74 1.797873    127.0.0.1             127.0.0.1             TCP      57586 > commplex-main [ACK] Seq=21722 Ack=2 Win=65535 Len=1448 TSV=1751230491 TSER=1751149932
     75 1.798851    127.0.0.1             127.0.0.1             TCP      57586 > commplex-main [ACK] Seq=23170 Ack=2 Win=65535 Len=1448 TSV=1751250733 TSER=1751170140
     76 1.817966    127.0.0.1             127.0.0.1             TCP      57586 > commplex-main [ACK] Seq=23170 Ack=2 Win=65535 Len=1448 TSV=1751250733 TSER=1751170140
     77 1.818934    127.0.0.1             127.0.0.1             TCP      57586 > commplex-main [ACK] Seq=24618 Ack=2 Win=65535 Len=1448 TSV=1751270765 TSER=1751190268
     78 1.838034    127.0.0.1             127.0.0.1             TCP      57586 > commplex-main [ACK] Seq=24618 Ack=2 Win=65535 Len=1448 TSV=1751270765 TSER=1751190268
     79 1.839019    127.0.0.1             127.0.0.1             TCP      57586 > commplex-main [ACK] Seq=26066 Ack=2 Win=65535 Len=1448 TSV=1751290799 TSER=1751210415
     80 1.858183    127.0.0.1             127.0.0.1             TCP      57586 > commplex-main [ACK] Seq=26066 Ack=2 Win=65535 Len=1448 TSV=1751290799 TSER=1751210415
     81 1.859101    127.0.0.1             127.0.0.1             TCP      commplex-main > 57586 [ACK] Seq=2 Ack=21722 Win=65535 Len=0 TSV=1751310924 TSER=1751230487
     82 1.878214    127.0.0.1             127.0.0.1             TCP      commplex-main > 57586 [ACK] Seq=2 Ack=21722 Win=65535 Len=0 TSV=1751310924 TSER=1751230487
     83 1.879183    127.0.0.1             127.0.0.1             TCP      commplex-main > 57586 [ACK] Seq=2 Ack=23170 Win=65535 Len=0 TSV=1751331007 TSER=1751230491
     84 1.898279    127.0.0.1             127.0.0.1             TCP      commplex-main > 57586 [ACK] Seq=2 Ack=23170 Win=65535 Len=0 TSV=1751331007 TSER=1751230491
     85 1.899263    127.0.0.1             127.0.0.1             TCP      commplex-main > 57586 [ACK] Seq=2 Ack=24618 Win=65535 Len=0 TSV=1751351101 TSER=1751250733
     86 1.918358    127.0.0.1             127.0.0.1             TCP      commplex-main > 57586 [ACK] Seq=2 Ack=24618 Win=65535 Len=0 TSV=1751351101 TSER=1751250733
     87 1.919344    127.0.0.1             127.0.0.1             TCP      commplex-main > 57586 [ACK] Seq=2 Ack=26066 Win=65535 Len=0 TSV=1751371213 TSER=1751270765
     88 1.938502    127.0.0.1             127.0.0.1             TCP      commplex-main > 57586 [ACK] Seq=2 Ack=26066 Win=65535 Len=0 TSV=1751371213 TSER=1751270765
     89 1.939476    127.0.0.1             127.0.0.1             TCP      commplex-main > 57586 [ACK] Seq=2 Ack=27514 Win=65535 Len=0 TSV=1751391349 TSER=1751290799
     90 1.958620    127.0.0.1             127.0.0.1             TCP      commplex-main > 57586 [ACK] Seq=2 Ack=27514 Win=65535 Len=0 TSV=1751391349 TSER=1751290799
     91 1.959610    127.0.0.1             127.0.0.1             TCP      57586 > commplex-main [ACK] Seq=27514 Ack=2 Win=65535 Len=1448 TSV=1751411456 TSER=1751310924
     92 1.978775    127.0.0.1             127.0.0.1             TCP      57586 > commplex-main [ACK] Seq=27514 Ack=2 Win=65535 Len=1448 TSV=1751411456 TSER=1751310924
     93 1.979691    127.0.0.1             127.0.0.1             TCP      57586 > commplex-main [ACK] Seq=28962 Ack=2 Win=65535 Len=1448 TSV=1751431501 TSER=1751331007
     94 1.998850    127.0.0.1             127.0.0.1             TCP      57586 > commplex-main [ACK] Seq=28962 Ack=2 Win=65535 Len=1448 TSV=1751431501 TSER=1751331007
     95 1.999775    127.0.0.1             127.0.0.1             TCP      57586 > commplex-main [ACK] Seq=30410 Ack=2 Win=65535 Len=1448 TSV=1751451568 TSER=1751351101
     96 2.018939    127.0.0.1             127.0.0.1             TCP      57586 > commplex-main [ACK] Seq=30410 Ack=2 Win=65535 Len=1448 TSV=1751451568 TSER=1751351101
     97 2.019853    127.0.0.1             127.0.0.1             TCP      57586 > commplex-main [ACK] Seq=31858 Ack=2 Win=65535 Len=1448 TSV=1751451572 TSER=1751351101
     98 2.039020    127.0.0.1             127.0.0.1             TCP      57586 > commplex-main [ACK] Seq=31858 Ack=2 Win=65535 Len=1448 TSV=1751451572 TSER=1751351101
     99 2.039931    127.0.0.1             127.0.0.1             TCP      57586 > commplex-main [ACK] Seq=33306 Ack=2 Win=65535 Len=1448 TSV=1751471677 TSER=1751371213
    100 2.059100    127.0.0.1             127.0.0.1             TCP      57586 > commplex-main [ACK] Seq=33306 Ack=2 Win=65535 Len=1448 TSV=1751471677 TSER=1751371213
    101 2.060066    127.0.0.1             127.0.0.1             TCP      57586 > commplex-main [ACK] Seq=34754 Ack=2 Win=65535 Len=1448 TSV=1751491794 TSER=1751391349
    102 2.079235    127.0.0.1             127.0.0.1             TCP      57586 > commplex-main [ACK] Seq=34754 Ack=2 Win=65535 Len=1448 TSV=1751491794 TSER=1751391349
    103 2.080206    127.0.0.1             127.0.0.1             TCP      commplex-main > 57586 [ACK] Seq=2 Ack=28962 Win=65535 Len=0 TSV=1751511906 TSER=1751411456
    104 2.099320    127.0.0.1             127.0.0.1             TCP      commplex-main > 57586 [ACK] Seq=2 Ack=28962 Win=65535 Len=0 TSV=1751511906 TSER=1751411456
    105 2.100342    127.0.0.1             127.0.0.1             TCP      commplex-main > 57586 [ACK] Seq=2 Ack=30410 Win=65535 Len=0 TSV=1751531989 TSER=1751431501
    106 2.119509    127.0.0.1             127.0.0.1             TCP      commplex-main > 57586 [ACK] Seq=2 Ack=30410 Win=65535 Len=0 TSV=1751531989 TSER=1751431501
    107 2.120477    127.0.0.1             127.0.0.1             TCP      commplex-main > 57586 [ACK] Seq=2 Ack=31858 Win=65535 Len=0 TSV=1751552068 TSER=1751451568
    108 2.139620    127.0.0.1             127.0.0.1             TCP      commplex-main > 57586 [ACK] Seq=2 Ack=31858 Win=65535 Len=0 TSV=1751552068 TSER=1751451568
    109 2.140611    127.0.0.1             127.0.0.1             TCP      commplex-main > 57586 [ACK] Seq=2 Ack=33306 Win=65535 Len=0 TSV=1751572147 TSER=1751451572
    110 2.159720    127.0.0.1             127.0.0.1             TCP      commplex-main > 57586 [ACK] Seq=2 Ack=33306 Win=65535 Len=0 TSV=1751572147 TSER=1751451572
    111 2.160695    127.0.0.1             127.0.0.1             TCP      commplex-main > 57586 [ACK] Seq=2 Ack=34754 Win=65535 Len=0 TSV=1751592226 TSER=1751471677
    112 2.179853    127.0.0.1             127.0.0.1             TCP      commplex-main > 57586 [ACK] Seq=2 Ack=34754 Win=65535 Len=0 TSV=1751592226 TSER=1751471677
    113 2.180761    127.0.0.1             127.0.0.1             TCP      commplex-main > 57586 [ACK] Seq=2 Ack=36202 Win=65535 Len=0 TSV=1751612363 TSER=1751491794
    114 2.199922    127.0.0.1             127.0.0.1             TCP      commplex-main > 57586 [ACK] Seq=2 Ack=36202 Win=65535 Len=0 TSV=1751612363 TSER=1751491794
    115 2.200904    127.0.0.1             127.0.0.1             TCP      57586 > commplex-main [ACK] Seq=36202 Ack=2 Win=65535 Len=1448 TSV=1751632516 TSER=1751511906
    116 2.220069    127.0.0.1             127.0.0.1             TCP      57586 > commplex-main [ACK] Seq=36202 Ack=2 Win=65535 Len=1448 TSV=1751632516 TSER=1751511906
    117 2.221038    127.0.0.1             127.0.0.1             TCP      57586 > commplex-main [ACK] Seq=37650 Ack=2 Win=65535 Len=1448 TSV=1751652688 TSER=1751531989
    118 2.240196    127.0.0.1             127.0.0.1             TCP      57586 > commplex-main [ACK] Seq=37650 Ack=2 Win=65535 Len=1448 TSV=1751652688 TSER=1751531989
    119 2.241170    127.0.0.1             127.0.0.1             TCP      57586 > commplex-main [ACK] Seq=39098 Ack=2 Win=65535 Len=1448 TSV=1751672789 TSER=1751552068
    120 2.260275    127.0.0.1             127.0.0.1             TCP      57586 > commplex-main [ACK] Seq=39098 Ack=2 Win=65535 Len=1448 TSV=1751672789 TSER=1751552068
    121 2.261307    127.0.0.1             127.0.0.1             TCP      57586 > commplex-main [ACK] Seq=40546 Ack=2 Win=65535 Len=1448 TSV=1751692925 TSER=1751572147
    122 2.280466    127.0.0.1             127.0.0.1             TCP      57586 > commplex-main [ACK] Seq=40546 Ack=2 Win=65535 Len=1448 TSV=1751692925 TSER=1751572147
    123 2.281439    127.0.0.1             127.0.0.1             TCP      57586 > commplex-main [ACK] Seq=41994 Ack=2 Win=65535 Len=1448 TSV=1751692945 TSER=1751572147
    124 2.300537    127.0.0.1             127.0.0.1             TCP      57586 > commplex-main [ACK] Seq=41994 Ack=2 Win=65535 Len=1448 TSV=1751692945 TSER=1751572147
    125 2.301529    127.0.0.1             127.0.0.1             TCP      57586 > commplex-main [ACK] Seq=43442 Ack=2 Win=65535 Len=1448 TSV=1751713034 TSER=1751592226
    126 2.320623    127.0.0.1             127.0.0.1             TCP      57586 > commplex-main [ACK] Seq=43442 Ack=2 Win=65535 Len=1448 TSV=1751713034 TSER=1751592226
    127 2.321611    127.0.0.1             127.0.0.1             TCP      57586 > commplex-main [ACK] Seq=44890 Ack=2 Win=65535 Len=1448 TSV=1751733142 TSER=1751612363
    128 2.340713    127.0.0.1             127.0.0.1             TCP      57586 > commplex-main [ACK] Seq=44890 Ack=2 Win=65535 Len=1448 TSV=1751733142 TSER=1751612363
    129 2.341685    127.0.0.1             127.0.0.1             TCP      commplex-main > 57586 [ACK] Seq=2 Ack=37650 Win=65535 Len=0 TSV=1751753207 TSER=1751632516
    130 2.360779    127.0.0.1             127.0.0.1             TCP      commplex-main > 57586 [ACK] Seq=2 Ack=37650 Win=65535 Len=0 TSV=1751753207 TSER=1751632516
    131 2.361761    127.0.0.1             127.0.0.1             TCP      commplex-main > 57586 [ACK] Seq=2 Ack=39098 Win=65535 Len=0 TSV=1751773329 TSER=1751652688
    132 2.380855    127.0.0.1             127.0.0.1             TCP      commplex-main > 57586 [ACK] Seq=2 Ack=39098 Win=65535 Len=0 TSV=1751773329 TSER=1751652688
    133 2.381829    127.0.0.1             127.0.0.1             TCP      commplex-main > 57586 [ACK] Seq=2 Ack=40546 Win=65535 Len=0 TSV=1751793413 TSER=1751672789
    134 2.400987    127.0.0.1             127.0.0.1             TCP      commplex-main > 57586 [ACK] Seq=2 Ack=40546 Win=65535 Len=0 TSV=1751793413 TSER=1751672789
    135 2.401915    127.0.0.1             127.0.0.1             TCP      commplex-main > 57586 [ACK] Seq=2 Ack=41994 Win=65535 Len=0 TSV=1751813589 TSER=1751692925
    136 2.421070    127.0.0.1             127.0.0.1             TCP      commplex-main > 57586 [ACK] Seq=2 Ack=41994 Win=65535 Len=0 TSV=1751813589 TSER=1751692925
    137 2.422048    127.0.0.1             127.0.0.1             TCP      commplex-main > 57586 [ACK] Seq=2 Ack=43442 Win=65535 Len=0 TSV=1751833673 TSER=1751692945
    138 2.441210    127.0.0.1             127.0.0.1             TCP      commplex-main > 57586 [ACK] Seq=2 Ack=43442 Win=65535 Len=0 TSV=1751833673 TSER=1751692945
    139 2.442185    127.0.0.1             127.0.0.1             TCP      commplex-main > 57586 [ACK] Seq=2 Ack=44890 Win=65535 Len=0 TSV=1751853761 TSER=1751713034
    140 2.461347    127.0.0.1             127.0.0.1             TCP      commplex-main > 57586 [ACK] Seq=2 Ack=44890 Win=65535 Len=0 TSV=1751853761 TSER=1751713034
    141 2.462319    127.0.0.1             127.0.0.1             TCP      commplex-main > 57586 [ACK] Seq=2 Ack=46338 Win=65535 Len=0 TSV=1751873842 TSER=1751733142
    142 2.481432    127.0.0.1             127.0.0.1             TCP      commplex-main > 57586 [ACK] Seq=2 Ack=46338 Win=65535 Len=0 TSV=1751873842 TSER=1751733142
    143 2.482453    127.0.0.1             127.0.0.1             TCP      57586 > commplex-main [ACK] Seq=46338 Ack=2 Win=65535 Len=1448 TSV=1751893963 TSER=1751753207
    144 2.501614    127.0.0.1             127.0.0.1             TCP      57586 > commplex-main [ACK] Seq=46338 Ack=2 Win=65535 Len=1448 TSV=1751893963 TSER=1751753207
    145 2.502601    127.0.0.1             127.0.0.1             TCP      57586 > commplex-main [ACK] Seq=47786 Ack=2 Win=65535 Len=1448 TSV=1751914031 TSER=1751773329
    146 2.521719    127.0.0.1             127.0.0.1             TCP      57586 > commplex-main [ACK] Seq=47786 Ack=2 Win=65535 Len=1448 TSV=1751914031 TSER=1751773329
    147 2.522680    127.0.0.1             127.0.0.1             TCP      57586 > commplex-main [ACK] Seq=49234 Ack=2 Win=65535 Len=1448 TSV=1751934196 TSER=1751793413
    148 2.541799    127.0.0.1             127.0.0.1             TCP      57586 > commplex-main [ACK] Seq=49234 Ack=2 Win=65535 Len=1448 TSV=1751934196 TSER=1751793413
    149 2.542816    127.0.0.1             127.0.0.1             TCP      57586 > commplex-main [ACK] Seq=50682 Ack=2 Win=65535 Len=1448 TSV=1751954244 TSER=1751813589
    150 2.561981    127.0.0.1             127.0.0.1             TCP      57586 > commplex-main [ACK] Seq=50682 Ack=2 Win=65535 Len=1448 TSV=1751954244 TSER=1751813589
    151 2.562896    127.0.0.1             127.0.0.1             TCP      57586 > commplex-main [ACK] Seq=52130 Ack=2 Win=65535 Len=1448 TSV=1751974429 TSER=1751833673
    152 2.582058    127.0.0.1             127.0.0.1             TCP      57586 > commplex-main [ACK] Seq=52130 Ack=2 Win=65535 Len=1448 TSV=1751974429 TSER=1751833673
    153 2.583033    127.0.0.1             127.0.0.1             TCP      57586 > commplex-main [ACK] Seq=53578 Ack=2 Win=65535 Len=1448 TSV=1751994525 TSER=1751853761
    154 2.602199    127.0.0.1             127.0.0.1             TCP      57586 > commplex-main [ACK] Seq=53578 Ack=2 Win=65535 Len=1448 TSV=1751994525 TSER=1751853761
    155 2.603186    127.0.0.1             127.0.0.1             TCP      57586 > commplex-main [ACK] Seq=55026 Ack=2 Win=65535 Len=1448 TSV=1751994542 TSER=1751853761
    156 2.622360    127.0.0.1             127.0.0.1             TCP      57586 > commplex-main [ACK] Seq=55026 Ack=2 Win=65535 Len=1448 TSV=1751994542 TSER=1751853761
    157 2.623260    127.0.0.1             127.0.0.1             TCP      57586 > commplex-main [ACK] Seq=56474 Ack=2 Win=65535 Len=1448 TSV=1752014585 TSER=1751873842
    158 2.642421    127.0.0.1             127.0.0.1             TCP      57586 > commplex-main [ACK] Seq=56474 Ack=2 Win=65535 Len=1448 TSV=1752014585 TSER=1751873842
    159 2.643333    127.0.0.1             127.0.0.1             TCP      commplex-main > 57586 [ACK] Seq=2 Ack=47786 Win=65535 Len=0 TSV=1752034746 TSER=1751893963
    160 2.662495    127.0.0.1             127.0.0.1             TCP      commplex-main > 57586 [ACK] Seq=2 Ack=47786 Win=65535 Len=0 TSV=1752034746 TSER=1751893963
    161 2.663464    127.0.0.1             127.0.0.1             TCP      commplex-main > 57586 [ACK] Seq=2 Ack=49234 Win=65535 Len=0 TSV=1752054845 TSER=1751914031
    162 2.682619    127.0.0.1             127.0.0.1             TCP      commplex-main > 57586 [ACK] Seq=2 Ack=49234 Win=65535 Len=0 TSV=1752054845 TSER=1751914031
    163 2.683598    127.0.0.1             127.0.0.1             TCP      commplex-main > 57586 [ACK] Seq=2 Ack=50682 Win=65535 Len=0 TSV=1752074928 TSER=1751934196
    164 2.702760    127.0.0.1             127.0.0.1             TCP      commplex-main > 57586 [ACK] Seq=2 Ack=50682 Win=65535 Len=0 TSV=1752074928 TSER=1751934196
    165 2.703679    127.0.0.1             127.0.0.1             TCP      commplex-main > 57586 [ACK] Seq=2 Ack=52130 Win=65535 Len=0 TSV=1752095108 TSER=1751954244
    166 2.722840    127.0.0.1             127.0.0.1             TCP      commplex-main > 57586 [ACK] Seq=2 Ack=52130 Win=65535 Len=0 TSV=1752095108 TSER=1751954244
    167 2.723817    127.0.0.1             127.0.0.1             TCP      commplex-main > 57586 [ACK] Seq=2 Ack=53578 Win=65535 Len=0 TSV=1752115169 TSER=1751974429
    168 2.742988    127.0.0.1             127.0.0.1             TCP      commplex-main > 57586 [ACK] Seq=2 Ack=53578 Win=65535 Len=0 TSV=1752115169 TSER=1751974429
    169 2.743949    127.0.0.1             127.0.0.1             TCP      commplex-main > 57586 [ACK] Seq=2 Ack=55026 Win=65535 Len=0 TSV=1752135338 TSER=1751994525
    170 2.763112    127.0.0.1             127.0.0.1             TCP      commplex-main > 57586 [ACK] Seq=2 Ack=55026 Win=65535 Len=0 TSV=1752135338 TSER=1751994525
    171 2.764084    127.0.0.1             127.0.0.1             TCP      commplex-main > 57586 [ACK] Seq=2 Ack=56474 Win=65535 Len=0 TSV=1752155487 TSER=1751994542
    172 2.783259    127.0.0.1             127.0.0.1             TCP      commplex-main > 57586 [ACK] Seq=2 Ack=56474 Win=65535 Len=0 TSV=1752155487 TSER=1751994542
    173 2.784220    127.0.0.1             127.0.0.1             TCP      commplex-main > 57586 [ACK] Seq=2 Ack=57922 Win=65535 Len=0 TSV=1752175548 TSER=1752014585
    174 2.803376    127.0.0.1             127.0.0.1             TCP      commplex-main > 57586 [ACK] Seq=2 Ack=57922 Win=65535 Len=0 TSV=1752175548 TSER=1752014585
    175 2.804354    127.0.0.1             127.0.0.1             TCP      57586 > commplex-main [ACK] Seq=57922 Ack=2 Win=65535 Len=1448 TSV=1752195703 TSER=1752034746
    176 2.823512    127.0.0.1             127.0.0.1             TCP      57586 > commplex-main [ACK] Seq=57922 Ack=2 Win=65535 Len=1448 TSV=1752195703 TSER=1752034746
    177 2.824491    127.0.0.1             127.0.0.1             TCP      57586 > commplex-main [ACK] Seq=59370 Ack=2 Win=65535 Len=1448 TSV=1752215787 TSER=1752054845
    178 2.843619    127.0.0.1             127.0.0.1             TCP      57586 > commplex-main [ACK] Seq=59370 Ack=2 Win=65535 Len=1448 TSV=1752215787 TSER=1752054845
    179 2.844574    127.0.0.1             127.0.0.1             TCP      57586 > commplex-main [ACK] Seq=60818 Ack=2 Win=65535 Len=1448 TSV=1752235934 TSER=1752074928
    180 2.863672    127.0.0.1             127.0.0.1             TCP      57586 > commplex-main [ACK] Seq=60818 Ack=2 Win=65535 Len=1448 TSV=1752235934 TSER=1752074928
    181 2.864651    127.0.0.1             127.0.0.1             TCP      57586 > commplex-main [ACK] Seq=62266 Ack=2 Win=65535 Len=1448 TSV=1752256053 TSER=1752095108
    182 2.883811    127.0.0.1             127.0.0.1             TCP      57586 > commplex-main [ACK] Seq=62266 Ack=2 Win=65535 Len=1448 TSV=1752256053 TSER=1752095108
    183 2.884726    127.0.0.1             127.0.0.1             TCP      57586 > commplex-main [ACK] Seq=63714 Ack=2 Win=65535 Len=1448 TSV=1752276157 TSER=1752115169
    184 2.903881    127.0.0.1             127.0.0.1             TCP      57586 > commplex-main [ACK] Seq=63714 Ack=2 Win=65535 Len=1448 TSV=1752276157 TSER=1752115169
    185 2.904864    127.0.0.1             127.0.0.1             TCP      57586 > commplex-main [ACK] Seq=65162 Ack=2 Win=65535 Len=1448 TSV=1752296320 TSER=1752135338
    186 2.924028    127.0.0.1             127.0.0.1             TCP      57586 > commplex-main [ACK] Seq=65162 Ack=2 Win=65535 Len=1448 TSV=1752296320 TSER=1752135338
    187 2.924942    127.0.0.1             127.0.0.1             TCP      57586 > commplex-main [ACK] Seq=66610 Ack=2 Win=65535 Len=1448 TSV=1752316436 TSER=1752155487
    188 2.944103    127.0.0.1             127.0.0.1             TCP      57586 > commplex-main [ACK] Seq=66610 Ack=2 Win=65535 Len=1448 TSV=1752316436 TSER=1752155487
    189 2.945077    127.0.0.1             127.0.0.1             TCP      57586 > commplex-main [ACK] Seq=68058 Ack=2 Win=65535 Len=1448 TSV=1752316440 TSER=1752155487
    190 2.964236    127.0.0.1             127.0.0.1             TCP      57586 > commplex-main [ACK] Seq=68058 Ack=2 Win=65535 Len=1448 TSV=1752316440 TSER=1752155487
    191 2.965155    127.0.0.1             127.0.0.1             TCP      57586 > commplex-main [ACK] Seq=69506 Ack=2 Win=65535 Len=1448 TSV=1752336566 TSER=1752175548
    192 2.984315    127.0.0.1             127.0.0.1             TCP      57586 > commplex-main [ACK] Seq=69506 Ack=2 Win=65535 Len=1448 TSV=1752336566 TSER=1752175548
    193 2.985288    127.0.0.1             127.0.0.1             TCP      commplex-main > 57586 [ACK] Seq=2 Ack=59370 Win=65535 Len=0 TSV=1752356649 TSER=1752195703
    194 3.004447    127.0.0.1             127.0.0.1             TCP      commplex-main > 57586 [ACK] Seq=2 Ack=59370 Win=65535 Len=0 TSV=1752356649 TSER=1752195703
    195 3.005364    127.0.0.1             127.0.0.1             TCP      commplex-main > 57586 [ACK] Seq=2 Ack=60818 Win=65535 Len=0 TSV=1752376755 TSER=1752215787
    196 3.024522    127.0.0.1             127.0.0.1             TCP      commplex-main > 57586 [ACK] Seq=2 Ack=60818 Win=65535 Len=0 TSV=1752376755 TSER=1752215787
    197 3.025496    127.0.0.1             127.0.0.1             TCP      commplex-main > 57586 [ACK] Seq=2 Ack=62266 Win=65535 Len=0 TSV=1752396810 TSER=1752235934
    198 3.044595    127.0.0.1             127.0.0.1             TCP      commplex-main > 57586 [ACK] Seq=2 Ack=62266 Win=65535 Len=0 TSV=1752396810 TSER=1752235934
    199 3.045585    127.0.0.1             127.0.0.1             TCP      commplex-main > 57586 [ACK] Seq=2 Ack=63714 Win=65535 Len=0 TSV=1752416951 TSER=1752256053
    200 3.064709    127.0.0.1             127.0.0.1             TCP      commplex-main > 57586 [ACK] Seq=2 Ack=63714 Win=65535 Len=0 TSV=1752416951 TSER=1752256053
    201 3.065667    127.0.0.1             127.0.0.1             TCP      commplex-main > 57586 [ACK] Seq=2 Ack=65162 Win=65535 Len=0 TSV=1752437015 TSER=1752276157
    202 3.084772    127.0.0.1             127.0.0.1             TCP      commplex-main > 57586 [ACK] Seq=2 Ack=65162 Win=65535 Len=0 TSV=1752437015 TSER=1752276157
    203 3.085802    127.0.0.1             127.0.0.1             TCP      commplex-main > 57586 [ACK] Seq=2 Ack=66610 Win=65535 Len=0 TSV=1752457164 TSER=1752296320
    204 3.104961    127.0.0.1             127.0.0.1             TCP      commplex-main > 57586 [ACK] Seq=2 Ack=66610 Win=65535 Len=0 TSV=1752457164 TSER=1752296320
    205 3.105880    127.0.0.1             127.0.0.1             TCP      commplex-main > 57586 [ACK] Seq=2 Ack=68058 Win=65535 Len=0 TSV=1752477239 TSER=1752316436
    206 3.125046    127.0.0.1             127.0.0.1             TCP      commplex-main > 57586 [ACK] Seq=2 Ack=68058 Win=65535 Len=0 TSV=1752477239 TSER=1752316436
    207 3.125959    127.0.0.1             127.0.0.1             TCP      commplex-main > 57586 [ACK] Seq=2 Ack=69506 Win=65535 Len=0 TSV=1752497371 TSER=1752316440
    208 3.145123    127.0.0.1             127.0.0.1             TCP      commplex-main > 57586 [ACK] Seq=2 Ack=69506 Win=65535 Len=0 TSV=1752497371 TSER=1752316440
    209 3.146037    127.0.0.1             127.0.0.1             TCP      commplex-main > 57586 [ACK] Seq=2 Ack=70954 Win=65535 Len=0 TSV=1752517447 TSER=1752336566
    210 3.165196    127.0.0.1             127.0.0.1             TCP      commplex-main > 57586 [ACK] Seq=2 Ack=70954 Win=65535 Len=0 TSV=1752517447 TSER=1752336566
    211 3.166173    127.0.0.1             127.0.0.1             TCP      57586 > commplex-main [ACK] Seq=70954 Ack=2 Win=65535 Len=1448 TSV=1752537677 TSER=1752356649
    212 3.185278    127.0.0.1             127.0.0.1             TCP      57586 > commplex-main [ACK] Seq=70954 Ack=2 Win=65535 Len=1448 TSV=1752537677 TSER=1752356649
    213 3.186310    127.0.0.1             127.0.0.1             TCP      57586 > commplex-main [ACK] Seq=72402 Ack=2 Win=65535 Len=1448 TSV=1752557698 TSER=1752376755
    214 3.205477    127.0.0.1             127.0.0.1             TCP      57586 > commplex-main [ACK] Seq=72402 Ack=2 Win=65535 Len=1448 TSV=1752557698 TSER=1752376755
    215 3.206397    127.0.0.1             127.0.0.1             TCP      57586 > commplex-main [ACK] Seq=73850 Ack=2 Win=65535 Len=1448 TSV=1752577852 TSER=1752396810
    216 3.225558    127.0.0.1             127.0.0.1             TCP      57586 > commplex-main [ACK] Seq=73850 Ack=2 Win=65535 Len=1448 TSV=1752577852 TSER=1752396810
    217 3.226476    127.0.0.1             127.0.0.1             TCP      57586 > commplex-main [ACK] Seq=75298 Ack=2 Win=65535 Len=1448 TSV=1752597889 TSER=1752416951
    218 3.245618    127.0.0.1             127.0.0.1             TCP      57586 > commplex-main [ACK] Seq=75298 Ack=2 Win=65535 Len=1448 TSV=1752597889 TSER=1752416951
    219 3.246552    127.0.0.1             127.0.0.1             TCP      57586 > commplex-main [ACK] Seq=76746 Ack=2 Win=65535 Len=1448 TSV=1752617957 TSER=1752437015
    220 3.265663    127.0.0.1             127.0.0.1             TCP      57586 > commplex-main [ACK] Seq=76746 Ack=2 Win=65535 Len=1448 TSV=1752617957 TSER=1752437015
    221 3.266628    127.0.0.1             127.0.0.1             TCP      57586 > commplex-main [ACK] Seq=78194 Ack=2 Win=65535 Len=1448 TSV=1752638156 TSER=1752457164
    222 3.285792    127.0.0.1             127.0.0.1             TCP      57586 > commplex-main [ACK] Seq=78194 Ack=2 Win=65535 Len=1448 TSV=1752638156 TSER=1752457164
    223 3.286705    127.0.0.1             127.0.0.1             TCP      57586 > commplex-main [ACK] Seq=79642 Ack=2 Win=65535 Len=1448 TSV=1752658281 TSER=1752477239
    224 3.305800    127.0.0.1             127.0.0.1             TCP      57586 > commplex-main [ACK] Seq=79642 Ack=2 Win=65535 Len=1448 TSV=1752658281 TSER=1752477239
    225 3.306780    127.0.0.1             127.0.0.1             TCP      57586 > commplex-main [ACK] Seq=81090 Ack=2 Win=65535 Len=1448 TSV=1752678300 TSER=1752497371
    226 3.325889    127.0.0.1             127.0.0.1             TCP      57586 > commplex-main [ACK] Seq=81090 Ack=2 Win=65535 Len=1448 TSV=1752678300 TSER=1752497371
    227 3.326919    127.0.0.1             127.0.0.1             TCP      57586 > commplex-main [ACK] Seq=82538 Ack=2 Win=65535 Len=1448 TSV=1752698366 TSER=1752517447
    228 3.346086    127.0.0.1             127.0.0.1             TCP      57586 > commplex-main [ACK] Seq=82538 Ack=2 Win=65535 Len=1448 TSV=1752698366 TSER=1752517447
    229 3.346999    127.0.0.1             127.0.0.1             TCP      57586 > commplex-main [ACK] Seq=83986 Ack=2 Win=65535 Len=1448 TSV=1752698372 TSER=1752517447
    230 3.366166    127.0.0.1             127.0.0.1             TCP      57586 > commplex-main [ACK] Seq=83986 Ack=2 Win=65535 Len=1448 TSV=1752698372 TSER=1752517447
    231 3.367134    127.0.0.1             127.0.0.1             TCP      commplex-main > 57586 [ACK] Seq=2 Ack=72402 Win=65535 Len=0 TSV=1752718406 TSER=1752537677
    232 3.386233    127.0.0.1             127.0.0.1             TCP      commplex-main > 57586 [ACK] Seq=2 Ack=72402 Win=65535 Len=0 TSV=1752718406 TSER=1752537677
    233 3.387209    127.0.0.1             127.0.0.1             TCP      commplex-main > 57586 [ACK] Seq=2 Ack=73850 Win=65535 Len=0 TSV=1752738607 TSER=1752557698
    234 3.406376    127.0.0.1             127.0.0.1             TCP      commplex-main > 57586 [ACK] Seq=2 Ack=73850 Win=65535 Len=0 TSV=1752738607 TSER=1752557698
    235 3.407348    127.0.0.1             127.0.0.1             TCP      commplex-main > 57586 [ACK] Seq=2 Ack=75298 Win=65535 Len=0 TSV=1752758701 TSER=1752577852
    236 3.426524    127.0.0.1             127.0.0.1             TCP      commplex-main > 57586 [ACK] Seq=2 Ack=75298 Win=65535 Len=0 TSV=1752758701 TSER=1752577852
    237 3.427482    127.0.0.1             127.0.0.1             TCP      commplex-main > 57586 [ACK] Seq=2 Ack=76746 Win=65535 Len=0 TSV=1752778747 TSER=1752597889
    238 3.446619    127.0.0.1             127.0.0.1             TCP      commplex-main > 57586 [ACK] Seq=2 Ack=76746 Win=65535 Len=0 TSV=1752778747 TSER=1752597889
    239 3.447619    127.0.0.1             127.0.0.1             TCP      commplex-main > 57586 [ACK] Seq=2 Ack=78194 Win=65535 Len=0 TSV=1752798794 TSER=1752617957
    240 3.466781    127.0.0.1             127.0.0.1             TCP      commplex-main > 57586 [ACK] Seq=2 Ack=78194 Win=65535 Len=0 TSV=1752798794 TSER=1752617957
    241 3.467702    127.0.0.1             127.0.0.1             TCP      commplex-main > 57586 [ACK] Seq=2 Ack=79642 Win=65535 Len=0 TSV=1752818922 TSER=1752638156
    242 3.486866    127.0.0.1             127.0.0.1             TCP      commplex-main > 57586 [ACK] Seq=2 Ack=79642 Win=65535 Len=0 TSV=1752818922 TSER=1752638156
    243 3.487836    127.0.0.1             127.0.0.1             TCP      commplex-main > 57586 [ACK] Seq=2 Ack=81090 Win=65535 Len=0 TSV=1752838926 TSER=1752658281
    244 3.507005    127.0.0.1             127.0.0.1             TCP      commplex-main > 57586 [ACK] Seq=2 Ack=81090 Win=65535 Len=0 TSV=1752838926 TSER=1752658281
    245 3.507924    127.0.0.1             127.0.0.1             TCP      commplex-main > 57586 [ACK] Seq=2 Ack=82538 Win=65535 Len=0 TSV=1752859011 TSER=1752678300
    246 3.527034    127.0.0.1             127.0.0.1             TCP      commplex-main > 57586 [ACK] Seq=2 Ack=82538 Win=65535 Len=0 TSV=1752859011 TSER=1752678300
    247 3.528017    127.0.0.1             127.0.0.1             TCP      commplex-main > 57586 [ACK] Seq=2 Ack=83986 Win=65535 Len=0 TSV=1752879218 TSER=1752698366
    248 3.547190    127.0.0.1             127.0.0.1             TCP      commplex-main > 57586 [ACK] Seq=2 Ack=83986 Win=65535 Len=0 TSV=1752879218 TSER=1752698366
    249 3.548163    127.0.0.1             127.0.0.1             TCP      commplex-main > 57586 [ACK] Seq=2 Ack=85434 Win=65535 Len=0 TSV=1752899299 TSER=1752698372
    250 3.567291    127.0.0.1             127.0.0.1             TCP      commplex-main > 57586 [ACK] Seq=2 Ack=85434 Win=65535 Len=0 TSV=1752899299 TSER=1752698372
    251 3.568254    127.0.0.1             127.0.0.1             TCP      57586 > commplex-main [ACK] Seq=85434 Ack=2 Win=65535 Len=1448 TSV=1752919447 TSER=1752718406
    252 3.587414    127.0.0.1             127.0.0.1             TCP      57586 > commplex-main [ACK] Seq=85434 Ack=2 Win=65535 Len=1448 TSV=1752919447 TSER=1752718406
    253 3.588332    127.0.0.1             127.0.0.1             TCP      57586 > commplex-main [ACK] Seq=86882 Ack=2 Win=65535 Len=1448 TSV=1752939585 TSER=1752738607
    254 3.607482    127.0.0.1             127.0.0.1             TCP      57586 > commplex-main [ACK] Seq=86882 Ack=2 Win=65535 Len=1448 TSV=1752939585 TSER=1752738607
    255 3.608415    127.0.0.1             127.0.0.1             TCP      57586 > commplex-main [ACK] Seq=88330 Ack=2 Win=65535 Len=1448 TSV=1752959687 TSER=1752758701
    256 3.627567    127.0.0.1             127.0.0.1             TCP      57586 > commplex-main [ACK] Seq=88330 Ack=2 Win=65535 Len=1448 TSV=1752959687 TSER=1752758701
    257 3.628553    127.0.0.1             127.0.0.1             TCP      57586 > commplex-main [ACK] Seq=89778 Ack=2 Win=65535 Len=1448 TSV=1752979786 TSER=1752778747
    258 3.647663    127.0.0.1             127.0.0.1             TCP      57586 > commplex-main [ACK] Seq=89778 Ack=2 Win=65535 Len=1448 TSV=1752979786 TSER=1752778747
    259 3.648639    127.0.0.1             127.0.0.1             TCP      57586 > commplex-main [ACK] Seq=91226 Ack=2 Win=65535 Len=1448 TSV=1752999949 TSER=1752798794
    260 3.667799    127.0.0.1             127.0.0.1             TCP      57586 > commplex-main [ACK] Seq=91226 Ack=2 Win=65535 Len=1448 TSV=1752999949 TSER=1752798794
    261 3.668712    127.0.0.1             127.0.0.1             TCP      57586 > commplex-main [ACK] Seq=92674 Ack=2 Win=65535 Len=1448 TSV=1753020035 TSER=1752818922
    262 3.687867    127.0.0.1             127.0.0.1             TCP      57586 > commplex-main [ACK] Seq=92674 Ack=2 Win=65535 Len=1448 TSV=1753020035 TSER=1752818922
    263 3.688789    127.0.0.1             127.0.0.1             TCP      57586 > commplex-main [ACK] Seq=94122 Ack=2 Win=65535 Len=1448 TSV=1753040170 TSER=1752838926
    264 3.707949    127.0.0.1             127.0.0.1             TCP      57586 > commplex-main [ACK] Seq=94122 Ack=2 Win=65535 Len=1448 TSV=1753040170 TSER=1752838926
    265 3.708923    127.0.0.1             127.0.0.1             TCP      57586 > commplex-main [ACK] Seq=95570 Ack=2 Win=65535 Len=1448 TSV=1753060253 TSER=1752859011
    266 3.728081    127.0.0.1             127.0.0.1             TCP      57586 > commplex-main [ACK] Seq=95570 Ack=2 Win=65535 Len=1448 TSV=1753060253 TSER=1752859011
    267 3.729068    127.0.0.1             127.0.0.1             TCP      57586 > commplex-main [ACK] Seq=97018 Ack=2 Win=65535 Len=1448 TSV=1753080400 TSER=1752879218
    268 3.748241    127.0.0.1             127.0.0.1             TCP      57586 > commplex-main [ACK] Seq=97018 Ack=2 Win=65535 Len=1448 TSV=1753080400 TSER=1752879218
    269 3.749202    127.0.0.1             127.0.0.1             TCP      57586 > commplex-main [ACK] Seq=98466 Ack=2 Win=65535 Len=1448 TSV=1753100516 TSER=1752899299
    270 3.768357    127.0.0.1             127.0.0.1             TCP      57586 > commplex-main [ACK] Seq=98466 Ack=2 Win=65535 Len=1448 TSV=1753100516 TSER=1752899299
    271 3.769277    127.0.0.1             127.0.0.1             TCP      57586 > commplex-main [ACK] Seq=99914 Ack=2 Win=65535 Len=1448 TSV=1753100522 TSER=1752899299
    272 3.788434    127.0.0.1             127.0.0.1             TCP      57586 > commplex-main [ACK] Seq=99914 Ack=2 Win=65535 Len=1448 TSV=1753100522 TSER=1752899299
    273 3.789816    127.0.0.1             127.0.0.1             TCP      commplex-main > 57586 [ACK] Seq=2 Ack=86882 Win=65535 Len=0 TSV=1753120557 TSER=1752919447
    274 3.808960    127.0.0.1             127.0.0.1             TCP      commplex-main > 57586 [ACK] Seq=2 Ack=86882 Win=65535 Len=0 TSV=1753120557 TSER=1752919447
    275 3.809954    127.0.0.1             127.0.0.1             TCP      commplex-main > 57586 [ACK] Seq=2 Ack=88330 Win=65535 Len=0 TSV=1753140622 TSER=1752939585
    276 3.829119    127.0.0.1             127.0.0.1             TCP      commplex-main > 57586 [ACK] Seq=2 Ack=88330 Win=65535 Len=0 TSV=1753140622 TSER=1752939585
    277 3.830038    127.0.0.1             127.0.0.1             TCP      commplex-main > 57586 [ACK] Seq=2 Ack=89778 Win=65535 Len=0 TSV=1753160701 TSER=1752959687
    278 3.849184    127.0.0.1             127.0.0.1             TCP      commplex-main > 57586 [ACK] Seq=2 Ack=89778 Win=65535 Len=0 TSV=1753160701 TSER=1752959687
    279 3.850178    127.0.0.1             127.0.0.1             TCP      commplex-main > 57586 [ACK] Seq=2 Ack=91226 Win=65535 Len=0 TSV=1753180805 TSER=1752979786
    280 3.869342    127.0.0.1             127.0.0.1             TCP      commplex-main > 57586 [ACK] Seq=2 Ack=91226 Win=65535 Len=0 TSV=1753180805 TSER=1752979786
    281 3.870312    127.0.0.1             127.0.0.1             TCP      commplex-main > 57586 [ACK] Seq=2 Ack=92674 Win=65535 Len=0 TSV=1753200930 TSER=1752999949
    282 3.889469    127.0.0.1             127.0.0.1             TCP      commplex-main > 57586 [ACK] Seq=2 Ack=92674 Win=65535 Len=0 TSV=1753200930 TSER=1752999949
    283 3.890446    127.0.0.1             127.0.0.1             TCP      commplex-main > 57586 [ACK] Seq=2 Ack=94122 Win=65535 Len=0 TSV=1753221002 TSER=1753020035
    284 3.909609    127.0.0.1             127.0.0.1             TCP      commplex-main > 57586 [ACK] Seq=2 Ack=94122 Win=65535 Len=0 TSV=1753221002 TSER=1753020035
    285 3.910580    127.0.0.1             127.0.0.1             TCP      commplex-main > 57586 [ACK] Seq=2 Ack=95570 Win=65535 Len=0 TSV=1753241082 TSER=1753040170
    286 3.929689    127.0.0.1             127.0.0.1             TCP      commplex-main > 57586 [ACK] Seq=2 Ack=95570 Win=65535 Len=0 TSV=1753241082 TSER=1753040170
    287 3.930663    127.0.0.1             127.0.0.1             TCP      commplex-main > 57586 [ACK] Seq=2 Ack=97018 Win=65535 Len=0 TSV=1753261245 TSER=1753060253
    288 3.949770    127.0.0.1             127.0.0.1             TCP      commplex-main > 57586 [ACK] Seq=2 Ack=97018 Win=65535 Len=0 TSV=1753261245 TSER=1753060253
    289 3.950758    127.0.0.1             127.0.0.1             TCP      commplex-main > 57586 [ACK] Seq=2 Ack=98466 Win=65535 Len=0 TSV=1753281373 TSER=1753080400
    290 3.969912    127.0.0.1             127.0.0.1             TCP      commplex-main > 57586 [ACK] Seq=2 Ack=98466 Win=65535 Len=0 TSV=1753281373 TSER=1753080400
    291 3.970842    127.0.0.1             127.0.0.1             TCP      commplex-main > 57586 [ACK] Seq=2 Ack=99914 Win=65535 Len=0 TSV=1753301491 TSER=1753100516
    292 3.989940    127.0.0.1             127.0.0.1             TCP      commplex-main > 57586 [ACK] Seq=2 Ack=99914 Win=65535 Len=0 TSV=1753301491 TSER=1753100516
    293 3.990979    127.0.0.1             127.0.0.1             TCP      commplex-main > 57586 [ACK] Seq=2 Ack=101362 Win=65535 Len=0 TSV=1753321574 TSER=1753100522
    294 4.010140    127.0.0.1             127.0.0.1             TCP      commplex-main > 57586 [ACK] Seq=2 Ack=101362 Win=65535 Len=0 TSV=1753321574 TSER=1753100522
    295 4.011117    127.0.0.1             127.0.0.1             TCP      57586 > commplex-main [ACK] Seq=101362 Ack=2 Win=65535 Len=1448 TSV=1753342178 TSER=1753120557
    296 4.030278    127.0.0.1             127.0.0.1             TCP      57586 > commplex-main [ACK] Seq=101362 Ack=2 Win=65535 Len=1448 TSV=1753342178 TSER=1753120557
    297 4.031254    127.0.0.1             127.0.0.1             TCP      57586 > commplex-main [ACK] Seq=102810 Ack=2 Win=65535 Len=1448 TSV=1753362294 TSER=1753140622
    298 4.050414    127.0.0.1             127.0.0.1             TCP      57586 > commplex-main [ACK] Seq=102810 Ack=2 Win=65535 Len=1448 TSV=1753362294 TSER=1753140622
    299 4.051335    127.0.0.1             127.0.0.1             TCP      57586 > commplex-main [ACK] Seq=104258 Ack=2 Win=65535 Len=1448 TSV=1753382400 TSER=1753160701
    300 4.070498    127.0.0.1             127.0.0.1             TCP      57586 > commplex-main [ACK] Seq=104258 Ack=2 Win=65535 Len=1448 TSV=1753382400 TSER=1753160701
    301 4.071470    127.0.0.1             127.0.0.1             TCP      57586 > commplex-main [ACK] Seq=105706 Ack=2 Win=65535 Len=1448 TSV=1753402509 TSER=1753180805
    302 4.090617    127.0.0.1             127.0.0.1             TCP      57586 > commplex-main [ACK] Seq=105706 Ack=2 Win=65535 Len=1448 TSV=1753402509 TSER=1753180805
    303 4.091545    127.0.0.1             127.0.0.1             TCP      57586 > commplex-main [ACK] Seq=107154 Ack=2 Win=65535 Len=1448 TSV=1753422642 TSER=1753200930
    304 4.110643    127.0.0.1             127.0.0.1             TCP      57586 > commplex-main [ACK] Seq=107154 Ack=2 Win=65535 Len=1448 TSV=1753422642 TSER=1753200930
    305 4.111633    127.0.0.1             127.0.0.1             TCP      57586 > commplex-main [ACK] Seq=108602 Ack=2 Win=65535 Len=1448 TSV=1753442779 TSER=1753221002
    306 4.130737    127.0.0.1             127.0.0.1             TCP      57586 > commplex-main [ACK] Seq=108602 Ack=2 Win=65535 Len=1448 TSV=1753442779 TSER=1753221002
    307 4.131721    127.0.0.1             127.0.0.1             TCP      57586 > commplex-main [ACK] Seq=110050 Ack=2 Win=65535 Len=1448 TSV=1753462860 TSER=1753241082
    308 4.150838    127.0.0.1             127.0.0.1             TCP      57586 > commplex-main [ACK] Seq=110050 Ack=2 Win=65535 Len=1448 TSV=1753462860 TSER=1753241082
    309 4.151806    127.0.0.1             127.0.0.1             TCP      57586 > commplex-main [ACK] Seq=111498 Ack=2 Win=65535 Len=1448 TSV=1753482927 TSER=1753261245
    310 4.170907    127.0.0.1             127.0.0.1             TCP      57586 > commplex-main [ACK] Seq=111498 Ack=2 Win=65535 Len=1448 TSV=1753482927 TSER=1753261245
    311 4.171891    127.0.0.1             127.0.0.1             TCP      57586 > commplex-main [ACK] Seq=112946 Ack=2 Win=65535 Len=1448 TSV=1753503089 TSER=1753281373
    312 4.191056    127.0.0.1             127.0.0.1             TCP      57586 > commplex-main [ACK] Seq=112946 Ack=2 Win=65535 Len=1448 TSV=1753503089 TSER=1753281373
    313 4.191983    127.0.0.1             127.0.0.1             TCP      57586 > commplex-main [ACK] Seq=114394 Ack=2 Win=65535 Len=1448 TSV=1753523131 TSER=1753301491
    314 4.211130    127.0.0.1             127.0.0.1             TCP      57586 > commplex-main [ACK] Seq=114394 Ack=2 Win=65535 Len=1448 TSV=1753523131 TSER=1753301491
    315 4.212059    127.0.0.1             127.0.0.1             TCP      57586 > commplex-main [ACK] Seq=115842 Ack=2 Win=65535 Len=1448 TSV=1753543309 TSER=1753321574
    316 4.231210    127.0.0.1             127.0.0.1             TCP      57586 > commplex-main [ACK] Seq=115842 Ack=2 Win=65535 Len=1448 TSV=1753543309 TSER=1753321574
    317 4.232137    127.0.0.1             127.0.0.1             TCP      commplex-main > 57586 [ACK] Seq=2 Ack=102810 Win=65535 Len=0 TSV=1753563417 TSER=1753342178
    318 4.251299    127.0.0.1             127.0.0.1             TCP      commplex-main > 57586 [ACK] Seq=2 Ack=102810 Win=65535 Len=0 TSV=1753563417 TSER=1753342178
    319 4.252212    127.0.0.1             127.0.0.1             TCP      commplex-main > 57586 [ACK] Seq=2 Ack=104258 Win=65535 Len=0 TSV=1753583550 TSER=1753362294
    320 4.271374    127.0.0.1             127.0.0.1             TCP      commplex-main > 57586 [ACK] Seq=2 Ack=104258 Win=65535 Len=0 TSV=1753583550 TSER=1753362294
    321 4.272348    127.0.0.1             127.0.0.1             TCP      commplex-main > 57586 [ACK] Seq=2 Ack=105706 Win=65535 Len=0 TSV=1753603633 TSER=1753382400
    322 4.291513    127.0.0.1             127.0.0.1             TCP      commplex-main > 57586 [ACK] Seq=2 Ack=105706 Win=65535 Len=0 TSV=1753603633 TSER=1753382400
    323 4.292486    127.0.0.1             127.0.0.1             TCP      commplex-main > 57586 [ACK] Seq=2 Ack=107154 Win=65535 Len=0 TSV=1753623750 TSER=1753402509
    324 4.311617    127.0.0.1             127.0.0.1             TCP      commplex-main > 57586 [ACK] Seq=2 Ack=107154 Win=65535 Len=0 TSV=1753623750 TSER=1753402509
    325 4.312620    127.0.0.1             127.0.0.1             TCP      commplex-main > 57586 [ACK] Seq=2 Ack=108602 Win=65535 Len=0 TSV=1753643783 TSER=1753422642
    326 4.331784    127.0.0.1             127.0.0.1             TCP      commplex-main > 57586 [ACK] Seq=2 Ack=108602 Win=65535 Len=0 TSV=1753643783 TSER=1753422642
    327 4.332704    127.0.0.1             127.0.0.1             TCP      commplex-main > 57586 [ACK] Seq=2 Ack=110050 Win=65535 Len=0 TSV=1753663903 TSER=1753442779
    328 4.351875    127.0.0.1             127.0.0.1             TCP      commplex-main > 57586 [ACK] Seq=2 Ack=110050 Win=65535 Len=0 TSV=1753663903 TSER=1753442779
    329 4.352779    127.0.0.1             127.0.0.1             TCP      commplex-main > 57586 [ACK] Seq=2 Ack=111498 Win=65535 Len=0 TSV=1753683984 TSER=1753462860
    330 4.371882    127.0.0.1             127.0.0.1             TCP      commplex-main > 57586 [ACK] Seq=2 Ack=111498 Win=65535 Len=0 TSV=1753683984 TSER=1753462860
    331 4.372852    127.0.0.1             127.0.0.1             TCP      commplex-main > 57586 [ACK] Seq=2 Ack=112946 Win=65535 Len=0 TSV=1753704080 TSER=1753482927
    332 4.391945    127.0.0.1             127.0.0.1             TCP      commplex-main > 57586 [ACK] Seq=2 Ack=112946 Win=65535 Len=0 TSV=1753704080 TSER=1753482927
    333 4.392928    127.0.0.1             127.0.0.1             TCP      commplex-main > 57586 [ACK] Seq=2 Ack=114394 Win=65535 Len=0 TSV=1753724209 TSER=1753503089
    334 4.412038    127.0.0.1             127.0.0.1             TCP      commplex-main > 57586 [ACK] Seq=2 Ack=114394 Win=65535 Len=0 TSV=1753724209 TSER=1753503089
    335 4.413002    127.0.0.1             127.0.0.1             TCP      commplex-main > 57586 [ACK] Seq=2 Ack=115842 Win=65535 Len=0 TSV=1753744266 TSER=1753523131
    336 4.432098    127.0.0.1             127.0.0.1             TCP      commplex-main > 57586 [ACK] Seq=2 Ack=115842 Win=65535 Len=0 TSV=1753744266 TSER=1753523131
    337 4.433089    127.0.0.1             127.0.0.1             TCP      commplex-main > 57586 [ACK] Seq=2 Ack=117290 Win=65535 Len=0 TSV=1753764348 TSER=1753543309
    338 4.452198    127.0.0.1             127.0.0.1             TCP      commplex-main > 57586 [ACK] Seq=2 Ack=117290 Win=65535 Len=0 TSV=1753764348 TSER=1753543309
    339 4.453173    127.0.0.1             127.0.0.1             TCP      57586 > commplex-main [ACK] Seq=117290 Ack=2 Win=65535 Len=1448 TSV=1753784511 TSER=1753563417
    340 4.472293    127.0.0.1             127.0.0.1             TCP      57586 > commplex-main [ACK] Seq=117290 Ack=2 Win=65535 Len=1448 TSV=1753784511 TSER=1753563417
    341 4.473266    127.0.0.1             127.0.0.1             TCP      57586 > commplex-main [ACK] Seq=118738 Ack=2 Win=65535 Len=1448 TSV=1753784518 TSER=1753563417
    342 4.492442    127.0.0.1             127.0.0.1             TCP      57586 > commplex-main [ACK] Seq=118738 Ack=2 Win=65535 Len=1448 TSV=1753784518 TSER=1753563417
    343 4.493345    127.0.0.1             127.0.0.1             TCP      57586 > commplex-main [ACK] Seq=120186 Ack=2 Win=65535 Len=1448 TSV=1753804543 TSER=1753583550
    344 4.512510    127.0.0.1             127.0.0.1             TCP      57586 > commplex-main [ACK] Seq=120186 Ack=2 Win=65535 Len=1448 TSV=1753804543 TSER=1753583550
    345 4.513421    127.0.0.1             127.0.0.1             TCP      57586 > commplex-main [ACK] Seq=121634 Ack=2 Win=65535 Len=1448 TSV=1753824680 TSER=1753603633
    346 4.532585    127.0.0.1             127.0.0.1             TCP      57586 > commplex-main [ACK] Seq=121634 Ack=2 Win=65535 Len=1448 TSV=1753824680 TSER=1753603633
    347 4.533499    127.0.0.1             127.0.0.1             TCP      57586 > commplex-main [ACK] Seq=123082 Ack=2 Win=65535 Len=1448 TSV=1753844781 TSER=1753623750
    348 4.552618    127.0.0.1             127.0.0.1             TCP      57586 > commplex-main [ACK] Seq=123082 Ack=2 Win=65535 Len=1448 TSV=1753844781 TSER=1753623750
    349 4.553576    127.0.0.1             127.0.0.1             TCP      57586 > commplex-main [ACK] Seq=124530 Ack=2 Win=65535 Len=1448 TSV=1753864954 TSER=1753643783
    350 4.572692    127.0.0.1             127.0.0.1             TCP      57586 > commplex-main [ACK] Seq=124530 Ack=2 Win=65535 Len=1448 TSV=1753864954 TSER=1753643783
    351 4.573660    127.0.0.1             127.0.0.1             TCP      57586 > commplex-main [ACK] Seq=125978 Ack=2 Win=65535 Len=1448 TSV=1753885061 TSER=1753663903
    352 4.592825    127.0.0.1             127.0.0.1             TCP      57586 > commplex-main [ACK] Seq=125978 Ack=2 Win=65535 Len=1448 TSV=1753885061 TSER=1753663903
    353 4.593801    127.0.0.1             127.0.0.1             TCP      57586 > commplex-main [ACK] Seq=127426 Ack=2 Win=65535 Len=1448 TSV=1753905038 TSER=1753683984
    354 4.612977    127.0.0.1             127.0.0.1             TCP      57586 > commplex-main [ACK] Seq=127426 Ack=2 Win=65535 Len=1448 TSV=1753905038 TSER=1753683984
    355 4.613876    127.0.0.1             127.0.0.1             TCP      57586 > commplex-main [ACK] Seq=128874 Ack=2 Win=65535 Len=1448 TSV=1753925130 TSER=1753704080
    356 4.633035    127.0.0.1             127.0.0.1             TCP      57586 > commplex-main [ACK] Seq=128874 Ack=2 Win=65535 Len=1448 TSV=1753925130 TSER=1753704080
    357 4.634009    127.0.0.1             127.0.0.1             TCP      57586 > commplex-main [ACK] Seq=130322 Ack=2 Win=65535 Len=1448 TSV=1753945197 TSER=1753724209
    358 4.653171    127.0.0.1             127.0.0.1             TCP      57586 > commplex-main [ACK] Seq=130322 Ack=2 Win=65535 Len=1448 TSV=1753945197 TSER=1753724209
    359 4.654087    127.0.0.1             127.0.0.1             TCP      57586 > commplex-main [ACK] Seq=131770 Ack=2 Win=65535 Len=1448 TSV=1753965287 TSER=1753744266
    360 4.673252    127.0.0.1             127.0.0.1             TCP      57586 > commplex-main [ACK] Seq=131770 Ack=2 Win=65535 Len=1448 TSV=1753965287 TSER=1753744266
    361 4.674169    127.0.0.1             127.0.0.1             TCP      57586 > commplex-main [ACK] Seq=133218 Ack=2 Win=65535 Len=1448 TSV=1753985401 TSER=1753764348
    362 4.693333    127.0.0.1             127.0.0.1             TCP      57586 > commplex-main [ACK] Seq=133218 Ack=2 Win=65535 Len=1448 TSV=1753985401 TSER=1753764348
    363 4.694305    127.0.0.1             127.0.0.1             TCP      commplex-main > 57586 [ACK] Seq=2 Ack=118738 Win=65535 Len=0 TSV=1754005449 TSER=1753784511
    364 4.713425    127.0.0.1             127.0.0.1             TCP      commplex-main > 57586 [ACK] Seq=2 Ack=118738 Win=65535 Len=0 TSV=1754005449 TSER=1753784511
    365 4.714390    127.0.0.1             127.0.0.1             TCP      commplex-main > 57586 [ACK] Seq=2 Ack=120186 Win=65535 Len=0 TSV=1754025571 TSER=1753784518
    366 4.733565    127.0.0.1             127.0.0.1             TCP      commplex-main > 57586 [ACK] Seq=2 Ack=120186 Win=65535 Len=0 TSV=1754025571 TSER=1753784518
    367 4.734534    127.0.0.1             127.0.0.1             TCP      commplex-main > 57586 [ACK] Seq=2 Ack=121634 Win=65535 Len=0 TSV=1754045639 TSER=1753804543
    368 4.753651    127.0.0.1             127.0.0.1             TCP      commplex-main > 57586 [ACK] Seq=2 Ack=121634 Win=65535 Len=0 TSV=1754045639 TSER=1753804543
    369 4.754635    127.0.0.1             127.0.0.1             TCP      commplex-main > 57586 [ACK] Seq=2 Ack=123082 Win=65535 Len=0 TSV=1754065716 TSER=1753824680
    370 4.773758    127.0.0.1             127.0.0.1             TCP      commplex-main > 57586 [ACK] Seq=2 Ack=123082 Win=65535 Len=0 TSV=1754065716 TSER=1753824680
    371 4.774726    127.0.0.1             127.0.0.1             TCP      commplex-main > 57586 [ACK] Seq=2 Ack=124530 Win=65535 Len=0 TSV=1754085749 TSER=1753844781
    372 4.793829    127.0.0.1             127.0.0.1             TCP      commplex-main > 57586 [ACK] Seq=2 Ack=124530 Win=65535 Len=0 TSV=1754085749 TSER=1753844781
    373 4.794810    127.0.0.1             127.0.0.1             TCP      commplex-main > 57586 [ACK] Seq=2 Ack=125978 Win=65535 Len=0 TSV=1754105823 TSER=1753864954
    374 4.813914    127.0.0.1             127.0.0.1             TCP      commplex-main > 57586 [ACK] Seq=2 Ack=125978 Win=65535 Len=0 TSV=1754105823 TSER=1753864954
    375 4.814895    127.0.0.1             127.0.0.1             TCP      commplex-main > 57586 [ACK] Seq=2 Ack=127426 Win=65535 Len=0 TSV=1754125970 TSER=1753885061
    376 4.834043    127.0.0.1             127.0.0.1             TCP      commplex-main > 57586 [ACK] Seq=2 Ack=127426 Win=65535 Len=0 TSV=1754125970 TSER=1753885061
    377 4.835033    127.0.0.1             127.0.0.1             TCP      commplex-main > 57586 [ACK] Seq=2 Ack=128874 Win=65535 Len=0 TSV=1754146109 TSER=1753905038
    378 4.854196    127.0.0.1             127.0.0.1             TCP      commplex-main > 57586 [ACK] Seq=2 Ack=128874 Win=65535 Len=0 TSV=1754146109 TSER=1753905038
    379 4.855168    127.0.0.1             127.0.0.1             TCP      commplex-main > 57586 [ACK] Seq=2 Ack=130322 Win=65535 Len=0 TSV=1754166163 TSER=1753925130
    380 4.874335    127.0.0.1             127.0.0.1             TCP      commplex-main > 57586 [ACK] Seq=2 Ack=130322 Win=65535 Len=0 TSV=1754166163 TSER=1753925130
    381 4.875251    127.0.0.1             127.0.0.1             TCP      commplex-main > 57586 [ACK] Seq=2 Ack=131770 Win=65535 Len=0 TSV=1754186304 TSER=1753945197
    382 4.894359    127.0.0.1             127.0.0.1             TCP      commplex-main > 57586 [ACK] Seq=2 Ack=131770 Win=65535 Len=0 TSV=1754186304 TSER=1753945197
    383 4.895326    127.0.0.1             127.0.0.1             TCP      commplex-main > 57586 [ACK] Seq=2 Ack=133218 Win=65535 Len=0 TSV=1754206399 TSER=1753965287
    384 4.914489    127.0.0.1             127.0.0.1             TCP      commplex-main > 57586 [ACK] Seq=2 Ack=133218 Win=65535 Len=0 TSV=1754206399 TSER=1753965287
    385 4.915400    127.0.0.1             127.0.0.1             TCP      commplex-main > 57586 [ACK] Seq=2 Ack=134666 Win=65535 Len=0 TSV=1754226478 TSER=1753985401
    386 4.934504    127.0.0.1             127.0.0.1             TCP      commplex-main > 57586 [ACK] Seq=2 Ack=134666 Win=65535 Len=0 TSV=1754226478 TSER=1753985401
    387 4.935635    127.0.0.1             127.0.0.1             TCP      57586 > commplex-main [ACK] Seq=134666 Ack=2 Win=65535 Len=1448 TSV=1754246653 TSER=1754005449
    388 4.954794    127.0.0.1             127.0.0.1             TCP      57586 > commplex-main [ACK] Seq=134666 Ack=2 Win=65535 Len=1448 TSV=1754246653 TSER=1754005449
    389 4.955771    127.0.0.1             127.0.0.1             TCP      57586 > commplex-main [ACK] Seq=136114 Ack=2 Win=65535 Len=1448 TSV=1754266828 TSER=1754025571
    390 4.974928    127.0.0.1             127.0.0.1             TCP      57586 > commplex-main [ACK] Seq=136114 Ack=2 Win=65535 Len=1448 TSV=1754266828 TSER=1754025571
    391 4.975906    127.0.0.1             127.0.0.1             TCP      57586 > commplex-main [ACK] Seq=137562 Ack=2 Win=65535 Len=1448 TSV=1754266835 TSER=1754025571
    392 4.995070    127.0.0.1             127.0.0.1             TCP      57586 > commplex-main [ACK] Seq=137562 Ack=2 Win=65535 Len=1448 TSV=1754266835 TSER=1754025571
    393 4.995988    127.0.0.1             127.0.0.1             TCP      57586 > commplex-main [ACK] Seq=139010 Ack=2 Win=65535 Len=1448 TSV=1754286870 TSER=1754045639
    394 5.015153    127.0.0.1             127.0.0.1             TCP      57586 > commplex-main [ACK] Seq=139010 Ack=2 Win=65535 Len=1448 TSV=1754286870 TSER=1754045639
    395 5.016126    127.0.0.1             127.0.0.1             TCP      57586 > commplex-main [ACK] Seq=140458 Ack=2 Win=65535 Len=1448 TSV=1754306992 TSER=1754065716
    396 5.035291    127.0.0.1             127.0.0.1             TCP      57586 > commplex-main [ACK] Seq=140458 Ack=2 Win=65535 Len=1448 TSV=1754306992 TSER=1754065716
    397 5.036266    127.0.0.1             127.0.0.1             TCP      57586 > commplex-main [ACK] Seq=141906 Ack=2 Win=65535 Len=1448 TSV=1754327050 TSER=1754085749
    398 5.055433    127.0.0.1             127.0.0.1             TCP      57586 > commplex-main [ACK] Seq=141906 Ack=2 Win=65535 Len=1448 TSV=1754327050 TSER=1754085749
    399 5.056401    127.0.0.1             127.0.0.1             TCP      57586 > commplex-main [ACK] Seq=143354 Ack=2 Win=65535 Len=1448 TSV=1754347072 TSER=1754105823
    400 5.075557    127.0.0.1             127.0.0.1             TCP      57586 > commplex-main [ACK] Seq=143354 Ack=2 Win=65535 Len=1448 TSV=1754347072 TSER=1754105823
    401 5.076539    127.0.0.1             127.0.0.1             TCP      57586 > commplex-main [ACK] Seq=144802 Ack=2 Win=65535 Len=1448 TSV=1754367244 TSER=1754125970
    402 5.095642    127.0.0.1             127.0.0.1             TCP      57586 > commplex-main [ACK] Seq=144802 Ack=2 Win=65535 Len=1448 TSV=1754367244 TSER=1754125970
    403 5.096621    127.0.0.1             127.0.0.1             TCP      57586 > commplex-main [ACK] Seq=146250 Ack=2 Win=65535 Len=1448 TSV=1754387367 TSER=1754146109
    404 5.115736    127.0.0.1             127.0.0.1             TCP      57586 > commplex-main [ACK] Seq=146250 Ack=2 Win=65535 Len=1448 TSV=1754387367 TSER=1754146109
    405 5.116705    127.0.0.1             127.0.0.1             TCP      57586 > commplex-main [ACK] Seq=147698 Ack=2 Win=65535 Len=1448 TSV=1754407534 TSER=1754166163
    406 5.135865    127.0.0.1             127.0.0.1             TCP      57586 > commplex-main [ACK] Seq=147698 Ack=2 Win=65535 Len=1448 TSV=1754407534 TSER=1754166163
    407 5.136802    127.0.0.1             127.0.0.1             TCP      57586 > commplex-main [ACK] Seq=149146 Ack=2 Win=65535 Len=1448 TSV=1754427530 TSER=1754186304
    408 5.155965    127.0.0.1             127.0.0.1             TCP      57586 > commplex-main [ACK] Seq=149146 Ack=2 Win=65535 Len=1448 TSV=1754427530 TSER=1754186304
    409 5.156882    127.0.0.1             127.0.0.1             TCP      57586 > commplex-main [ACK] Seq=150594 Ack=2 Win=65535 Len=1448 TSV=1754447650 TSER=1754206399
    410 5.176045    127.0.0.1             127.0.0.1             TCP      57586 > commplex-main [ACK] Seq=150594 Ack=2 Win=65535 Len=1448 TSV=1754447650 TSER=1754206399
    411 5.176962    127.0.0.1             127.0.0.1             TCP      57586 > commplex-main [ACK] Seq=152042 Ack=2 Win=65535 Len=1448 TSV=1754467693 TSER=1754226478
    412 5.196068    127.0.0.1             127.0.0.1             TCP      57586 > commplex-main [ACK] Seq=152042 Ack=2 Win=65535 Len=1448 TSV=1754467693 TSER=1754226478
    413 5.197103    127.0.0.1             127.0.0.1             TCP      commplex-main > 57586 [ACK] Seq=2 Ack=136114 Win=65535 Len=0 TSV=1754487939 TSER=1754246653
    414 5.216270    127.0.0.1             127.0.0.1             TCP      commplex-main > 57586 [ACK] Seq=2 Ack=136114 Win=65535 Len=0 TSV=1754487939 TSER=1754246653
    415 5.217241    127.0.0.1             127.0.0.1             TCP      commplex-main > 57586 [ACK] Seq=2 Ack=137562 Win=65535 Len=0 TSV=1754508065 TSER=1754266828
    416 5.236401    127.0.0.1             127.0.0.1             TCP      commplex-main > 57586 [ACK] Seq=2 Ack=137562 Win=65535 Len=0 TSV=1754508065 TSER=1754266828
    417 5.237376    127.0.0.1             127.0.0.1             TCP      commplex-main > 57586 [ACK] Seq=2 Ack=139010 Win=65535 Len=0 TSV=1754528215 TSER=1754266835
    418 5.256532    127.0.0.1             127.0.0.1             TCP      commplex-main > 57586 [ACK] Seq=2 Ack=139010 Win=65535 Len=0 TSV=1754528215 TSER=1754266835
    419 5.257516    127.0.0.1             127.0.0.1             TCP      commplex-main > 57586 [ACK] Seq=2 Ack=140458 Win=65535 Len=0 TSV=1754548303 TSER=1754286870
    420 5.276624    127.0.0.1             127.0.0.1             TCP      commplex-main > 57586 [ACK] Seq=2 Ack=140458 Win=65535 Len=0 TSV=1754548303 TSER=1754286870
    421 5.277626    127.0.0.1             127.0.0.1             TCP      commplex-main > 57586 [ACK] Seq=2 Ack=141906 Win=65535 Len=0 TSV=1754568445 TSER=1754306992
    422 5.296734    127.0.0.1             127.0.0.1             TCP      commplex-main > 57586 [ACK] Seq=2 Ack=141906 Win=65535 Len=0 TSV=1754568445 TSER=1754306992
    423 5.297761    127.0.0.1             127.0.0.1             TCP      commplex-main > 57586 [ACK] Seq=2 Ack=143354 Win=65535 Len=0 TSV=1754588571 TSER=1754327050
    424 5.316874    127.0.0.1             127.0.0.1             TCP      commplex-main > 57586 [ACK] Seq=2 Ack=143354 Win=65535 Len=0 TSV=1754588571 TSER=1754327050
    425 5.317844    127.0.0.1             127.0.0.1             TCP      commplex-main > 57586 [ACK] Seq=2 Ack=144802 Win=65535 Len=0 TSV=1754608694 TSER=1754347072
    426 5.336952    127.0.0.1             127.0.0.1             TCP      commplex-main > 57586 [ACK] Seq=2 Ack=144802 Win=65535 Len=0 TSV=1754608694 TSER=1754347072
    427 5.337934    127.0.0.1             127.0.0.1             TCP      commplex-main > 57586 [ACK] Seq=2 Ack=146250 Win=65535 Len=0 TSV=1754628779 TSER=1754367244
    428 5.357053    127.0.0.1             127.0.0.1             TCP      commplex-main > 57586 [ACK] Seq=2 Ack=146250 Win=65535 Len=0 TSV=1754628779 TSER=1754367244
    429 5.358022    127.0.0.1             127.0.0.1             TCP      commplex-main > 57586 [ACK] Seq=2 Ack=147698 Win=65535 Len=0 TSV=1754648899 TSER=1754387367
    430 5.377199    127.0.0.1             127.0.0.1             TCP      commplex-main > 57586 [ACK] Seq=2 Ack=147698 Win=65535 Len=0 TSV=1754648899 TSER=1754387367
    431 5.378111    127.0.0.1             127.0.0.1             TCP      commplex-main > 57586 [ACK] Seq=2 Ack=149146 Win=65535 Len=0 TSV=1754669020 TSER=1754407534
    432 5.397295    127.0.0.1             127.0.0.1             TCP      commplex-main > 57586 [ACK] Seq=2 Ack=149146 Win=65535 Len=0 TSV=1754669020 TSER=1754407534
    433 5.398254    127.0.0.1             127.0.0.1             TCP      commplex-main > 57586 [ACK] Seq=2 Ack=150594 Win=65535 Len=0 TSV=1754689103 TSER=1754427530
    434 5.417431    127.0.0.1             127.0.0.1             TCP      commplex-main > 57586 [ACK] Seq=2 Ack=150594 Win=65535 Len=0 TSV=1754689103 TSER=1754427530
    435 5.418389    127.0.0.1             127.0.0.1             TCP      commplex-main > 57586 [ACK] Seq=2 Ack=152042 Win=65535 Len=0 TSV=1754709184 TSER=1754447650
    436 5.437515    127.0.0.1             127.0.0.1             TCP      commplex-main > 57586 [ACK] Seq=2 Ack=152042 Win=65535 Len=0 TSV=1754709184 TSER=1754447650
    437 5.438467    127.0.0.1             127.0.0.1             TCP      commplex-main > 57586 [ACK] Seq=2 Ack=153490 Win=65535 Len=0 TSV=1754729218 TSER=1754467693
    438 5.457616    127.0.0.1             127.0.0.1             TCP      commplex-main > 57586 [ACK] Seq=2 Ack=153490 Win=65535 Len=0 TSV=1754729218 TSER=1754467693
    439 5.458606    127.0.0.1             127.0.0.1             TCP      57586 > commplex-main [ACK] Seq=153490 Ack=2 Win=65535 Len=1448 TSV=1754749487 TSER=1754487939
    440 5.477781    127.0.0.1             127.0.0.1             TCP      57586 > commplex-main [ACK] Seq=153490 Ack=2 Win=65535 Len=1448 TSV=1754749487 TSER=1754487939
    441 5.478693    127.0.0.1             127.0.0.1             TCP      57586 > commplex-main [ACK] Seq=154938 Ack=2 Win=65535 Len=1448 TSV=1754769570 TSER=1754508065
    442 5.497805    127.0.0.1             127.0.0.1             TCP      57586 > commplex-main [ACK] Seq=154938 Ack=2 Win=65535 Len=1448 TSV=1754769570 TSER=1754508065
    443 5.498829    127.0.0.1             127.0.0.1             TCP      57586 > commplex-main [ACK] Seq=156386 Ack=2 Win=65535 Len=1448 TSV=1754789704 TSER=1754528215
    444 5.517990    127.0.0.1             127.0.0.1             TCP      57586 > commplex-main [ACK] Seq=156386 Ack=2 Win=65535 Len=1448 TSV=1754789704 TSER=1754528215
    445 5.518907    127.0.0.1             127.0.0.1             TCP      57586 > commplex-main [ACK] Seq=157834 Ack=2 Win=65535 Len=1448 TSV=1754809790 TSER=1754548303
    446 5.538011    127.0.0.1             127.0.0.1             TCP      57586 > commplex-main [ACK] Seq=157834 Ack=2 Win=65535 Len=1448 TSV=1754809790 TSER=1754548303
    447 5.538983    127.0.0.1             127.0.0.1             TCP      57586 > commplex-main [ACK] Seq=159282 Ack=2 Win=65535 Len=1448 TSV=1754809796 TSER=1754548303
    448 5.558144    127.0.0.1             127.0.0.1             TCP      57586 > commplex-main [ACK] Seq=159282 Ack=2 Win=65535 Len=1448 TSV=1754809796 TSER=1754548303
    449 5.559118    127.0.0.1             127.0.0.1             TCP      57586 > commplex-main [ACK] Seq=160730 Ack=2 Win=65535 Len=1448 TSV=1754829888 TSER=1754568445
    450 5.578218    127.0.0.1             127.0.0.1             TCP      57586 > commplex-main [ACK] Seq=160730 Ack=2 Win=65535 Len=1448 TSV=1754829888 TSER=1754568445
    451 5.579194    127.0.0.1             127.0.0.1             TCP      57586 > commplex-main [ACK] Seq=162178 Ack=2 Win=65535 Len=1448 TSV=1754851609 TSER=1754588571
    452 5.598357    127.0.0.1             127.0.0.1             TCP      57586 > commplex-main [ACK] Seq=162178 Ack=2 Win=65535 Len=1448 TSV=1754851609 TSER=1754588571
    453 5.599280    127.0.0.1             127.0.0.1             TCP      57586 > commplex-main [ACK] Seq=163626 Ack=2 Win=65535 Len=1448 TSV=1754870181 TSER=1754608694
    454 5.618451    127.0.0.1             127.0.0.1             TCP      57586 > commplex-main [ACK] Seq=163626 Ack=2 Win=65535 Len=1448 TSV=1754870181 TSER=1754608694
    455 5.619416    127.0.0.1             127.0.0.1             TCP      57586 > commplex-main [ACK] Seq=165074 Ack=2 Win=65535 Len=1448 TSV=1754890258 TSER=1754628779
    456 5.638521    127.0.0.1             127.0.0.1             TCP      57586 > commplex-main [ACK] Seq=165074 Ack=2 Win=65535 Len=1448 TSV=1754890258 TSER=1754628779
    457 5.639550    127.0.0.1             127.0.0.1             TCP      57586 > commplex-main [ACK] Seq=166522 Ack=2 Win=65535 Len=1448 TSV=1754910436 TSER=1754648899
    458 5.658661    127.0.0.1             127.0.0.1             TCP      57586 > commplex-main [ACK] Seq=166522 Ack=2 Win=65535 Len=1448 TSV=1754910436 TSER=1754648899
    459 5.659635    127.0.0.1             127.0.0.1             TCP      57586 > commplex-main [ACK] Seq=167970 Ack=2 Win=65535 Len=1448 TSV=1754930486 TSER=1754669020
    460 5.678809    127.0.0.1             127.0.0.1             TCP      57586 > commplex-main [ACK] Seq=167970 Ack=2 Win=65535 Len=1448 TSV=1754930486 TSER=1754669020
    461 5.679772    127.0.0.1             127.0.0.1             TCP      57586 > commplex-main [ACK] Seq=169418 Ack=2 Win=65535 Len=1448 TSV=1754950594 TSER=1754689103
    462 5.698942    127.0.0.1             127.0.0.1             TCP      57586 > commplex-main [ACK] Seq=169418 Ack=2 Win=65535 Len=1448 TSV=1754950594 TSER=1754689103
    463 5.699852    127.0.0.1             127.0.0.1             TCP      57586 > commplex-main [ACK] Seq=170866 Ack=2 Win=65535 Len=1448 TSV=1754970692 TSER=1754709184
    464 5.718981    127.0.0.1             127.0.0.1             TCP      57586 > commplex-main [ACK] Seq=170866 Ack=2 Win=65535 Len=1448 TSV=1754970692 TSER=1754709184
    465 5.719933    127.0.0.1             127.0.0.1             TCP      57586 > commplex-main [ACK] Seq=172314 Ack=2 Win=65535 Len=1448 TSV=1754990777 TSER=1754729218
    466 5.739103    127.0.0.1             127.0.0.1             TCP      57586 > commplex-main [ACK] Seq=172314 Ack=2 Win=65535 Len=1448 TSV=1754990777 TSER=1754729218
    467 5.740015    127.0.0.1             127.0.0.1             TCP      commplex-main > 57586 [ACK] Seq=2 Ack=154938 Win=65535 Len=0 TSV=1755010914 TSER=1754749487
    468 5.759172    127.0.0.1             127.0.0.1             TCP      commplex-main > 57586 [ACK] Seq=2 Ack=154938 Win=65535 Len=0 TSV=1755010914 TSER=1754749487
    469 5.760097    127.0.0.1             127.0.0.1             TCP      commplex-main > 57586 [ACK] Seq=2 Ack=156386 Win=65535 Len=0 TSV=1755030938 TSER=1754769570
    470 5.779257    127.0.0.1             127.0.0.1             TCP      commplex-main > 57586 [ACK] Seq=2 Ack=156386 Win=65535 Len=0 TSV=1755030938 TSER=1754769570
    471 5.780231    127.0.0.1             127.0.0.1             TCP      commplex-main > 57586 [ACK] Seq=2 Ack=157834 Win=65535 Len=0 TSV=1755051118 TSER=1754789704
    472 5.799349    127.0.0.1             127.0.0.1             TCP      commplex-main > 57586 [ACK] Seq=2 Ack=157834 Win=65535 Len=0 TSV=1755051118 TSER=1754789704
    473 5.800315    127.0.0.1             127.0.0.1             TCP      commplex-main > 57586 [ACK] Seq=2 Ack=159282 Win=65535 Len=0 TSV=1755071131 TSER=1754809790
    474 5.819485    127.0.0.1             127.0.0.1             TCP      commplex-main > 57586 [ACK] Seq=2 Ack=159282 Win=65535 Len=0 TSV=1755071131 TSER=1754809790
    475 5.820449    127.0.0.1             127.0.0.1             TCP      commplex-main > 57586 [ACK] Seq=2 Ack=160730 Win=65535 Len=0 TSV=1755091272 TSER=1754809796
    476 5.839609    127.0.0.1             127.0.0.1             TCP      commplex-main > 57586 [ACK] Seq=2 Ack=160730 Win=65535 Len=0 TSV=1755091272 TSER=1754809796
    477 5.840584    127.0.0.1             127.0.0.1             TCP      commplex-main > 57586 [ACK] Seq=2 Ack=162178 Win=65535 Len=0 TSV=1755111354 TSER=1754829888
    478 5.859742    127.0.0.1             127.0.0.1             TCP      commplex-main > 57586 [ACK] Seq=2 Ack=162178 Win=65535 Len=0 TSV=1755111354 TSER=1754829888
    479 5.860668    127.0.0.1             127.0.0.1             TCP      commplex-main > 57586 [ACK] Seq=2 Ack=163626 Win=65535 Len=0 TSV=1755131500 TSER=1754851609
    480 5.879824    127.0.0.1             127.0.0.1             TCP      commplex-main > 57586 [ACK] Seq=2 Ack=163626 Win=65535 Len=0 TSV=1755131500 TSER=1754851609
    481 5.880755    127.0.0.1             127.0.0.1             TCP      commplex-main > 57586 [ACK] Seq=2 Ack=165074 Win=65535 Len=0 TSV=1755151583 TSER=1754870181
    482 5.899915    127.0.0.1             127.0.0.1             TCP      commplex-main > 57586 [ACK] Seq=2 Ack=165074 Win=65535 Len=0 TSV=1755151583 TSER=1754870181
    483 5.900838    127.0.0.1             127.0.0.1             TCP      commplex-main > 57586 [ACK] Seq=2 Ack=166522 Win=65535 Len=0 TSV=1755171650 TSER=1754890258
    484 5.919998    127.0.0.1             127.0.0.1             TCP      commplex-main > 57586 [ACK] Seq=2 Ack=166522 Win=65535 Len=0 TSV=1755171650 TSER=1754890258
    485 5.920915    127.0.0.1             127.0.0.1             TCP      commplex-main > 57586 [ACK] Seq=2 Ack=167970 Win=65535 Len=0 TSV=1755191790 TSER=1754910436
    486 5.940021    127.0.0.1             127.0.0.1             TCP      commplex-main > 57586 [ACK] Seq=2 Ack=167970 Win=65535 Len=0 TSV=1755191790 TSER=1754910436
    487 5.941053    127.0.0.1             127.0.0.1             TCP      commplex-main > 57586 [ACK] Seq=2 Ack=169418 Win=65535 Len=0 TSV=1755211931 TSER=1754930486
    488 5.960211    127.0.0.1             127.0.0.1             TCP      commplex-main > 57586 [ACK] Seq=2 Ack=169418 Win=65535 Len=0 TSV=1755211931 TSER=1754930486
    489 5.961188    127.0.0.1             127.0.0.1             TCP      commplex-main > 57586 [ACK] Seq=2 Ack=170866 Win=65535 Len=0 TSV=1755232097 TSER=1754950594
    490 5.980347    127.0.0.1             127.0.0.1             TCP      commplex-main > 57586 [ACK] Seq=2 Ack=170866 Win=65535 Len=0 TSV=1755232097 TSER=1754950594
    491 5.981322    127.0.0.1             127.0.0.1             TCP      commplex-main > 57586 [ACK] Seq=2 Ack=172314 Win=65535 Len=0 TSV=1755252122 TSER=1754970692
    492 6.000482    127.0.0.1             127.0.0.1             TCP      commplex-main > 57586 [ACK] Seq=2 Ack=172314 Win=65535 Len=0 TSV=1755252122 TSER=1754970692
    493 6.001458    127.0.0.1             127.0.0.1             TCP      commplex-main > 57586 [ACK] Seq=2 Ack=173762 Win=65535 Len=0 TSV=1755272235 TSER=1754990777
    494 6.020615    127.0.0.1             127.0.0.1             TCP      commplex-main > 57586 [ACK] Seq=2 Ack=173762 Win=65535 Len=0 TSV=1755272235 TSER=1754990777
    495 6.021594    127.0.0.1             127.0.0.1             TCP      57586 > commplex-main [ACK] Seq=173762 Ack=2 Win=65535 Len=1448 TSV=1755292367 TSER=1755010914
    496 6.040752    127.0.0.1             127.0.0.1             TCP      57586 > commplex-main [ACK] Seq=173762 Ack=2 Win=65535 Len=1448 TSV=1755292367 TSER=1755010914
    497 6.041677    127.0.0.1             127.0.0.1             TCP      57586 > commplex-main [ACK] Seq=175210 Ack=2 Win=65535 Len=1448 TSV=1755312418 TSER=1755030938
    498 6.060776    127.0.0.1             127.0.0.1             TCP      57586 > commplex-main [ACK] Seq=175210 Ack=2 Win=65535 Len=1448 TSV=1755312418 TSER=1755030938
    499 6.061755    127.0.0.1             127.0.0.1             TCP      57586 > commplex-main [ACK] Seq=176658 Ack=2 Win=65535 Len=1448 TSV=1755332555 TSER=1755051118
    500 6.080906    127.0.0.1             127.0.0.1             TCP      57586 > commplex-main [ACK] Seq=176658 Ack=2 Win=65535 Len=1448 TSV=1755332555 TSER=1755051118
    501 6.081838    127.0.0.1             127.0.0.1             TCP      57586 > commplex-main [ACK] Seq=178106 Ack=2 Win=65535 Len=1448 TSV=1755352641 TSER=1755071131
    502 6.101000    127.0.0.1             127.0.0.1             TCP      57586 > commplex-main [ACK] Seq=178106 Ack=2 Win=65535 Len=1448 TSV=1755352641 TSER=1755071131
    503 6.101986    127.0.0.1             127.0.0.1             TCP      57586 > commplex-main [ACK] Seq=179554 Ack=2 Win=65535 Len=1448 TSV=1755372776 TSER=1755091272
    504 6.121076    127.0.0.1             127.0.0.1             TCP      57586 > commplex-main [ACK] Seq=179554 Ack=2 Win=65535 Len=1448 TSV=1755372776 TSER=1755091272
    505 6.122072    127.0.0.1             127.0.0.1             TCP      57586 > commplex-main [ACK] Seq=181002 Ack=2 Win=65535 Len=1448 TSV=1755372782 TSER=1755091272
    506 6.141226    127.0.0.1             127.0.0.1             TCP      57586 > commplex-main [ACK] Seq=181002 Ack=2 Win=65535 Len=1448 TSV=1755372782 TSER=1755091272
    507 6.142150    127.0.0.1             127.0.0.1             TCP      57586 > commplex-main [ACK] Seq=182450 Ack=2 Win=65535 Len=1448 TSV=1755392904 TSER=1755111354
    508 6.161314    127.0.0.1             127.0.0.1             TCP      57586 > commplex-main [ACK] Seq=182450 Ack=2 Win=65535 Len=1448 TSV=1755392904 TSER=1755111354
    509 6.162228    127.0.0.1             127.0.0.1             TCP      57586 > commplex-main [ACK] Seq=183898 Ack=2 Win=65535 Len=1448 TSV=1755413001 TSER=1755131500
    510 6.181338    127.0.0.1             127.0.0.1             TCP      57586 > commplex-main [ACK] Seq=183898 Ack=2 Win=65535 Len=1448 TSV=1755413001 TSER=1755131500
    511 6.182319    127.0.0.1             127.0.0.1             TCP      57586 > commplex-main [ACK] Seq=185346 Ack=2 Win=65535 Len=1448 TSV=1755433078 TSER=1755151583
    512 6.201427    127.0.0.1             127.0.0.1             TCP      57586 > commplex-main [ACK] Seq=185346 Ack=2 Win=65535 Len=1448 TSV=1755433078 TSER=1755151583
    513 6.202405    127.0.0.1             127.0.0.1             TCP      57586 > commplex-main [ACK] Seq=186794 Ack=2 Win=65535 Len=1448 TSV=1755453221 TSER=1755171650
    514 6.221499    127.0.0.1             127.0.0.1             TCP      57586 > commplex-main [ACK] Seq=186794 Ack=2 Win=65535 Len=1448 TSV=1755453221 TSER=1755171650
    515 6.222497    127.0.0.1             127.0.0.1             TCP      57586 > commplex-main [ACK] Seq=188242 Ack=2 Win=65535 Len=1448 TSV=1755473184 TSER=1755191790
    516 6.241595    127.0.0.1             127.0.0.1             TCP      57586 > commplex-main [ACK] Seq=188242 Ack=2 Win=65535 Len=1448 TSV=1755473184 TSER=1755191790
    517 6.242585    127.0.0.1             127.0.0.1             TCP      57586 > commplex-main [ACK] Seq=189690 Ack=2 Win=65535 Len=1448 TSV=1755493378 TSER=1755211931
    518 6.261685    127.0.0.1             127.0.0.1             TCP      57586 > commplex-main [ACK] Seq=189690 Ack=2 Win=65535 Len=1448 TSV=1755493378 TSER=1755211931
    519 6.262681    127.0.0.1             127.0.0.1             TCP      57586 > commplex-main [ACK] Seq=191138 Ack=2 Win=65535 Len=1448 TSV=1755513516 TSER=1755232097
    520 6.281785    127.0.0.1             127.0.0.1             TCP      57586 > commplex-main [ACK] Seq=191138 Ack=2 Win=65535 Len=1448 TSV=1755513516 TSER=1755232097
    521 6.282762    127.0.0.1             127.0.0.1             TCP      57586 > commplex-main [ACK] Seq=192586 Ack=2 Win=65535 Len=1448 TSV=1755533670 TSER=1755252122
    522 6.301861    127.0.0.1             127.0.0.1             TCP      57586 > commplex-main [ACK] Seq=192586 Ack=2 Win=65535 Len=1448 TSV=1755533670 TSER=1755252122
    523 6.302839    127.0.0.1             127.0.0.1             TCP      57586 > commplex-main [ACK] Seq=194034 Ack=2 Win=65535 Len=1448 TSV=1755553781 TSER=1755272235
    524 6.321944    127.0.0.1             127.0.0.1             TCP      57586 > commplex-main [ACK] Seq=194034 Ack=2 Win=65535 Len=1448 TSV=1755553781 TSER=1755272235
    525 6.322914    127.0.0.1             127.0.0.1             TCP      commplex-main > 57586 [ACK] Seq=2 Ack=175210 Win=65535 Len=0 TSV=1755573897 TSER=1755292367
    526 6.342018    127.0.0.1             127.0.0.1             TCP      commplex-main > 57586 [ACK] Seq=2 Ack=175210 Win=65535 Len=0 TSV=1755573897 TSER=1755292367
    527 6.342998    127.0.0.1             127.0.0.1             TCP      commplex-main > 57586 [ACK] Seq=2 Ack=176658 Win=65535 Len=0 TSV=1755593911 TSER=1755312418
    528 6.362093    127.0.0.1             127.0.0.1             TCP      commplex-main > 57586 [ACK] Seq=2 Ack=176658 Win=65535 Len=0 TSV=1755593911 TSER=1755312418
    529 6.363136    127.0.0.1             127.0.0.1             TCP      commplex-main > 57586 [ACK] Seq=2 Ack=178106 Win=65535 Len=0 TSV=1755614046 TSER=1755332555
    530 6.382296    127.0.0.1             127.0.0.1             TCP      commplex-main > 57586 [ACK] Seq=2 Ack=178106 Win=65535 Len=0 TSV=1755614046 TSER=1755332555
    531 6.383221    127.0.0.1             127.0.0.1             TCP      commplex-main > 57586 [ACK] Seq=2 Ack=179554 Win=65535 Len=0 TSV=1755634135 TSER=1755352641
    532 6.402348    127.0.0.1             127.0.0.1             TCP      commplex-main > 57586 [ACK] Seq=2 Ack=179554 Win=65535 Len=0 TSV=1755634135 TSER=1755352641
    533 6.403361    127.0.0.1             127.0.0.1             TCP      commplex-main > 57586 [ACK] Seq=2 Ack=181002 Win=65535 Len=0 TSV=1755654209 TSER=1755372776
    534 6.422461    127.0.0.1             127.0.0.1             TCP      commplex-main > 57586 [ACK] Seq=2 Ack=181002 Win=65535 Len=0 TSV=1755654209 TSER=1755372776
    535 6.423489    127.0.0.1             127.0.0.1             TCP      commplex-main > 57586 [ACK] Seq=2 Ack=182450 Win=65535 Len=0 TSV=1755674366 TSER=1755372782
    536 6.442615    127.0.0.1             127.0.0.1             TCP      commplex-main > 57586 [ACK] Seq=2 Ack=182450 Win=65535 Len=0 TSV=1755674366 TSER=1755372782
    537 6.443623    127.0.0.1             127.0.0.1             TCP      commplex-main > 57586 [ACK] Seq=2 Ack=183898 Win=65535 Len=0 TSV=1755694451 TSER=1755392904
    538 6.462779    127.0.0.1             127.0.0.1             TCP      commplex-main > 57586 [ACK] Seq=2 Ack=183898 Win=65535 Len=0 TSV=1755694451 TSER=1755392904
    539 6.463759    127.0.0.1             127.0.0.1             TCP      commplex-main > 57586 [ACK] Seq=2 Ack=185346 Win=65535 Len=0 TSV=1755714500 TSER=1755413001
    540 6.482913    127.0.0.1             127.0.0.1             TCP      commplex-main > 57586 [ACK] Seq=2 Ack=185346 Win=65535 Len=0 TSV=1755714500 TSER=1755413001
    541 6.483896    127.0.0.1             127.0.0.1             TCP      commplex-main > 57586 [ACK] Seq=2 Ack=186794 Win=65535 Len=0 TSV=1755734574 TSER=1755433078
    542 6.503053    127.0.0.1             127.0.0.1             TCP      commplex-main > 57586 [ACK] Seq=2 Ack=186794 Win=65535 Len=0 TSV=1755734574 TSER=1755433078
    543 6.504033    127.0.0.1             127.0.0.1             TCP      commplex-main > 57586 [ACK] Seq=2 Ack=188242 Win=65535 Len=0 TSV=1755754656 TSER=1755453221
    544 6.523199    127.0.0.1             127.0.0.1             TCP      commplex-main > 57586 [ACK] Seq=2 Ack=188242 Win=65535 Len=0 TSV=1755754656 TSER=1755453221
    545 6.524119    127.0.0.1             127.0.0.1             TCP      commplex-main > 57586 [ACK] Seq=2 Ack=189690 Win=65535 Len=0 TSV=1755774722 TSER=1755473184
    546 6.543269    127.0.0.1             127.0.0.1             TCP      commplex-main > 57586 [ACK] Seq=2 Ack=189690 Win=65535 Len=0 TSV=1755774722 TSER=1755473184
    547 6.544254    127.0.0.1             127.0.0.1             TCP      commplex-main > 57586 [ACK] Seq=2 Ack=191138 Win=65535 Len=0 TSV=1755794828 TSER=1755493378
    548 6.563418    127.0.0.1             127.0.0.1             TCP      commplex-main > 57586 [ACK] Seq=2 Ack=191138 Win=65535 Len=0 TSV=1755794828 TSER=1755493378
    549 6.564330    127.0.0.1             127.0.0.1             TCP      commplex-main > 57586 [ACK] Seq=2 Ack=192586 Win=65535 Len=0 TSV=1755814921 TSER=1755513516
    550 6.583419    127.0.0.1             127.0.0.1             TCP      commplex-main > 57586 [ACK] Seq=2 Ack=192586 Win=65535 Len=0 TSV=1755814921 TSER=1755513516
    551 6.584416    127.0.0.1             127.0.0.1             TCP      commplex-main > 57586 [ACK] Seq=2 Ack=194034 Win=65535 Len=0 TSV=1755834991 TSER=1755533670
    552 6.603592    127.0.0.1             127.0.0.1             TCP      commplex-main > 57586 [ACK] Seq=2 Ack=194034 Win=65535 Len=0 TSV=1755834991 TSER=1755533670
    553 6.604503    127.0.0.1             127.0.0.1             TCP      commplex-main > 57586 [ACK] Seq=2 Ack=195482 Win=65535 Len=0 TSV=1755855078 TSER=1755553781
    554 6.623613    127.0.0.1             127.0.0.1             TCP      commplex-main > 57586 [ACK] Seq=2 Ack=195482 Win=65535 Len=0 TSV=1755855078 TSER=1755553781
    555 6.624630    127.0.0.1             127.0.0.1             TCP      57586 > commplex-main [ACK] Seq=195482 Ack=2 Win=65535 Len=1448 TSV=1755875208 TSER=1755573897
    556 6.643798    127.0.0.1             127.0.0.1             TCP      57586 > commplex-main [ACK] Seq=195482 Ack=2 Win=65535 Len=1448 TSV=1755875208 TSER=1755573897
    557 6.644715    127.0.0.1             127.0.0.1             TCP      57586 > commplex-main [ACK] Seq=196930 Ack=2 Win=65535 Len=1448 TSV=1755895263 TSER=1755593911
    558 6.663876    127.0.0.1             127.0.0.1             TCP      57586 > commplex-main [ACK] Seq=196930 Ack=2 Win=65535 Len=1448 TSV=1755895263 TSER=1755593911
    559 6.664850    127.0.0.1             127.0.0.1             TCP      57586 > commplex-main [ACK] Seq=198378 Ack=2 Win=65535 Len=1448 TSV=1755915461 TSER=1755614046
    560 6.684011    127.0.0.1             127.0.0.1             TCP      57586 > commplex-main [ACK] Seq=198378 Ack=2 Win=65535 Len=1448 TSV=1755915461 TSER=1755614046
    561 6.684926    127.0.0.1             127.0.0.1             TCP      57586 > commplex-main [ACK] Seq=199826 Ack=2 Win=65535 Len=176 TSV=1755935531 TSER=1755634135
    562 6.704035    127.0.0.1             127.0.0.1             TCP      57586 > commplex-main [ACK] Seq=199826 Ack=2 Win=65535 Len=176 TSV=1755935531 TSER=1755634135
    563 6.705004    127.0.0.1             127.0.0.1             TCP      commplex-main > 57586 [ACK] Seq=2 Ack=196930 Win=65535 Len=0 TSV=1756176932 TSER=1755875208
    564 6.724164    127.0.0.1             127.0.0.1             TCP      commplex-main > 57586 [ACK] Seq=2 Ack=196930 Win=65535 Len=0 TSV=1756176932 TSER=1755875208
    565 6.725146    127.0.0.1             127.0.0.1             TCP      commplex-main > 57586 [ACK] Seq=2 Ack=198378 Win=65535 Len=0 TSV=1756197005 TSER=1755895263
    566 6.744312    127.0.0.1             127.0.0.1             TCP      commplex-main > 57586 [ACK] Seq=2 Ack=198378 Win=65535 Len=0 TSV=1756197005 TSER=1755895263
    567 6.745282    127.0.0.1             127.0.0.1             TCP      commplex-main > 57586 [ACK] Seq=2 Ack=199826 Win=65535 Len=0 TSV=1756217140 TSER=1755915461
    568 6.764447    127.0.0.1             127.0.0.1             TCP      commplex-main > 57586 [ACK] Seq=2 Ack=199826 Win=65535 Len=0 TSV=1756217140 TSER=1755915461
    569 6.765419    127.0.0.1             127.0.0.1             TCP      commplex-main > 57586 [ACK] Seq=2 Ack=200002 Win=65535 Len=0 TSV=1756237158 TSER=1755935531
    570 6.784577    127.0.0.1             127.0.0.1             TCP      commplex-main > 57586 [ACK] Seq=2 Ack=200002 Win=65535 Len=0 TSV=1756237158 TSER=1755935531
    571 6.804785    127.0.0.1             127.0.0.1             TCP      57586 > commplex-main [FIN, ACK] Seq=200002 Ack=2 Win=65535 Len=0 TSV=1756317755 TSER=1756237158
    572 6.823952    127.0.0.1             127.0.0.1             TCP      57586 > commplex-main [FIN, ACK] Seq=200002 Ack=2 Win=65535 Len=0 TSV=1756317755 TSER=1756237158
    573 6.844163    127.0.0.1             127.0.0.1             TCP      commplex-main > 57586 [ACK] Seq=2 Ack=200003 Win=65535 Len=0 TSV=1756357089 TSER=1756317755
    574 6.863325    127.0.0.1             127.0.0.1             TCP      commplex-main > 57586 [ACK] Seq=2 Ack=200003 Win=65535 Len=0 TSV=1756357089 TSER=1756317755
    575 6.864298    127.0.0.1             127.0.0.1             TCP      commplex-main > 57586 [FIN, ACK] Seq=2 Ack=200003 Win=65535 Len=0 TSV=1756357224 TSER=1756317755
    576 6.883460    127.0.0.1             127.0.0.1             TCP      commplex-main > 57586 [FIN, ACK] Seq=2 Ack=200003 Win=65535 Len=0 TSV=1756357224 TSER=1756317755
    577 6.903625    127.0.0.1             127.0.0.1             TCP      57586 > commplex-main [ACK] Seq=200003 Ack=3 Win=65535 Len=0 TSV=1756416594 TSER=1756357224
    578 6.922783    127.0.0.1             127.0.0.1             TCP      57586 > commplex-main [ACK] Seq=200003 Ack=3 Win=65535 Len=0 TSV=1756416594 TSER=1756357224
