No.     Time        Source                Destination           Protocol Info
      1 0.000000    127.0.0.1             127.0.0.1             TCP      35583 > commplex-main [SYN] Seq=1 Win=65535 Len=0 TSV=2176853388 TSER=0
      2 0.019187    127.0.0.1             127.0.0.1             TCP      35583 > commplex-main [SYN] Seq=1 Win=65535 Len=0 TSV=2176853388 TSER=0
      3 0.039482    127.0.0.1             127.0.0.1             TCP      commplex-main > 35583 [SYN, ACK] Seq=1 Ack=2 Win=65535 Len=0 TSV=2176892884 TSER=2176853388
      4 0.058648    127.0.0.1             127.0.0.1             TCP      commplex-main > 35583 [SYN, ACK] Seq=1 Ack=2 Win=65535 Len=0 TSV=2176892884 TSER=2176853388
      5 0.078879    127.0.0.1             127.0.0.1             TCP      35583 > commplex-main [ACK] Seq=2 Ack=2 Win=65535 Len=0 TSV=2176932270 TSER=2176892884
      6 0.098047    127.0.0.1             127.0.0.1             TCP      35583 > commplex-main [ACK] Seq=2 Ack=2 Win=65535 Len=0 TSV=2176932270 TSER=2176892884
      7 0.099011    127.0.0.1             127.0.0.1             TCP      35583 > commplex-main [ACK] Seq=2 Ack=2 Win=65535 Len=1448 TSV=2176932506 TSER=2176892884
      8 0.118165    127.0.0.1             127.0.0.1             TCP      35583 > commplex-main [ACK] Seq=2 Ack=2 Win=65535 Len=1448 TSV=2176932506 TSER=2176892884
      9 0.138368    127.0.0.1             127.0.0.1             TCP      commplex-main > 35583 [ACK] Seq=2 Ack=1450 Win=65535 Len=0 TSV=2176991775 TSER=2176932506
     10 0.157479    127.0.0.1             127.0.0.1             TCP      commplex-main > 35583 [ACK] Seq=2 Ack=1450 Win=65535 Len=0 TSV=2176991775 TSER=2176932506
     11 0.177754    127.0.0.1             127.0.0.1             TCP      35583 > commplex-main [ACK] Seq=1450 Ack=2 Win=65535 Len=1448 TSV=2177031153 TSER=2176991775
     12 0.196924    127.0.0.1             127.0.0.1             TCP      35583 > commplex-main [ACK] Seq=1450 Ack=2 Win=65535 Len=1448 TSV=2177031153 TSER=2176991775
     13 0.197893    127.0.0.1             127.0.0.1             TCP      35583 > commplex-main [ACK] Seq=2898 Ack=2 Win=65535 Len=1448 TSV=2177031156 TSER=2176991775
     14 0.217066    127.0.0.1             127.0.0.1             TCP      35583 > commplex-main [ACK] Seq=2898 Ack=2 Win=65535 Len=1448 TSV=2177031156 TSER=2176991775
     15 0.217965    127.0.0.1             127.0.0.1             TCP      commplex-main > 35583 [ACK] Seq=2 Ack=2898 Win=65535 Len=0 TSV=2177070543 TSER=2177031153
     16 0.237127    127.0.0.1             127.0.0.1             TCP      commplex-main > 35583 [ACK] Seq=2 Ack=2898 Win=65535 Len=0 TSV=2177070543 TSER=2177031153
     17 0.238100    127.0.0.1             127.0.0.1             TCP      commplex-main > 35583 [ACK] Seq=2 Ack=4346 Win=65535 Len=0 TSV=2177090667 TSER=2177031156
     18 0.257262    127.0.0.1             127.0.0.1             TCP      commplex-main > 35583 [ACK] Seq=2 Ack=4346 Win=65535 Len=0 TSV=2177090667 TSER=2177031156
     19 0.258235    127.0.0.1             127.0.0.1             TCP      35583 > commplex-main [ACK] Seq=4346 Ack=2 Win=65535 Len=1448 TSV=2177110823 TSER=2177070543
     20 0.277400    127.0.0.1             127.0.0.1             TCP      35583 > commplex-main [ACK] Seq=4346 Ack=2 Win=65535 Len=1448 TSV=2177110823 TSER=2177070543
     21 0.278369    127.0.0.1             127.0.0.1             TCP      35583 > commplex-main [ACK] Seq=5794 Ack=2 Win=65535 Len=1448 TSV=2177110827 TSER=2177070543
     22 0.313073    127.0.0.1             127.0.0.1             TCP      35583 > commplex-main [ACK] Seq=7242 Ack=2 Win=65535 Len=1448 TSV=2177130917 TSER=2177090667
     23 0.313077    127.0.0.1             127.0.0.1             TCP      35583 > commplex-main [ACK] Seq=5794 Ack=2 Win=65535 Len=1448 TSV=2177110827 TSER=2177070543
     24 0.332224    127.0.0.1             127.0.0.1             TCP      35583 > commplex-main [ACK] Seq=7242 Ack=2 Win=65535 Len=1448 TSV=2177130917 TSER=2177090667
     25 0.333204    127.0.0.1             127.0.0.1             TCP      35583 > commplex-main [ACK] Seq=8690 Ack=2 Win=65535 Len=1448 TSV=2177130921 TSER=2177090667
     26 0.352364    127.0.0.1             127.0.0.1             TCP      35583 > commplex-main [ACK] Seq=8690 Ack=2 Win=65535 Len=1448 TSV=2177130921 TSER=2177090667
     27 0.353338    127.0.0.1             127.0.0.1             TCP      commplex-main > 35583 [ACK] Seq=2 Ack=5794 Win=65535 Len=0 TSV=2177151006 TSER=2177110823
     28 0.373040    127.0.0.1             127.0.0.1             TCP      commplex-main > 35583 [ACK] Seq=2 Ack=5794 Win=65535 Len=0 TSV=2177151006 TSER=2177110823
     29 0.373470    127.0.0.1             127.0.0.1             TCP      commplex-main > 35583 [ACK] Seq=2 Ack=7242 Win=65535 Len=0 TSV=2177186679 TSER=2177110827
     30 0.392616    127.0.0.1             127.0.0.1             TCP      commplex-main > 35583 [ACK] Seq=2 Ack=7242 Win=65535 Len=0 TSV=2177186679 TSER=2177110827
     31 0.393607    127.0.0.1             127.0.0.1             TCP      commplex-main > 35583 [ACK] Seq=2 Ack=8690 Win=65535 Len=0 TSV=2177205829 TSER=2177130917
     32 0.412789    127.0.0.1             127.0.0.1             TCP      commplex-main > 35583 [ACK] Seq=2 Ack=8690 Win=65535 Len=0 TSV=2177205829 TSER=2177130917
     33 0.413747    127.0.0.1             127.0.0.1             TCP      commplex-main > 35583 [ACK] Seq=2 Ack=10138 Win=65535 Len=0 TSV=2177225971 TSER=2177130921
     34 0.432908    127.0.0.1             127.0.0.1             TCP      commplex-main > 35583 [ACK] Seq=2 Ack=10138 Win=65535 Len=0 TSV=2177225971 TSER=2177130921
     35 0.433823    127.0.0.1             127.0.0.1             TCP      35583 > commplex-main [ACK] Seq=10138 Ack=2 Win=65535 Len=1448 TSV=2177246691 TSER=2177151006
     36 0.452987    127.0.0.1             127.0.0.1             TCP      35583 > commplex-main [ACK] Seq=10138 Ack=2 Win=65535 Len=1448 TSV=2177246691 TSER=2177151006
     37 0.453962    127.0.0.1             127.0.0.1             TCP      35583 > commplex-main [ACK] Seq=11586 Ack=2 Win=65535 Len=1448 TSV=2177246695 TSER=2177151006
     38 0.473136    127.0.0.1             127.0.0.1             TCP      35583 > commplex-main [ACK] Seq=11586 Ack=2 Win=65535 Len=1448 TSV=2177246695 TSER=2177151006
     39 0.474039    127.0.0.1             127.0.0.1             TCP      35583 > commplex-main [ACK] Seq=13034 Ack=2 Win=65535 Len=1448 TSV=2177266303 TSER=2177186679
     40 0.493203    127.0.0.1             127.0.0.1             TCP      35583 > commplex-main [ACK] Seq=13034 Ack=2 Win=65535 Len=1448 TSV=2177266303 TSER=2177186679
     41 0.494116    127.0.0.1             127.0.0.1             TCP      35583 > commplex-main [ACK] Seq=14482 Ack=2 Win=65535 Len=1448 TSV=2177266308 TSER=2177186679
     42 0.513291    127.0.0.1             127.0.0.1             TCP      35583 > commplex-main [ACK] Seq=14482 Ack=2 Win=65535 Len=1448 TSV=2177266308 TSER=2177186679
     43 0.514191    127.0.0.1             127.0.0.1             TCP      35583 > commplex-main [ACK] Seq=15930 Ack=2 Win=65535 Len=1448 TSV=2177286523 TSER=2177205829
     44 0.533353    127.0.0.1             127.0.0.1             TCP      35583 > commplex-main [ACK] Seq=15930 Ack=2 Win=65535 Len=1448 TSV=2177286523 TSER=2177205829
     45 0.534268    127.0.0.1             127.0.0.1             TCP      35583 > commplex-main [ACK] Seq=17378 Ack=2 Win=65535 Len=1448 TSV=2177286528 TSER=2177205829
     46 0.553429    127.0.0.1             127.0.0.1             TCP      35583 > commplex-main [ACK] Seq=17378 Ack=2 Win=65535 Len=1448 TSV=2177286528 TSER=2177205829
     47 0.554345    127.0.0.1             127.0.0.1             TCP      35583 > commplex-main [ACK] Seq=18826 Ack=2 Win=65535 Len=1448 TSV=2177306572 TSER=2177225971
     48 0.573466    127.0.0.1             127.0.0.1             TCP      35583 > commplex-main [ACK] Seq=18826 Ack=2 Win=65535 Len=1448 TSV=2177306572 TSER=2177225971
     49 0.574421    127.0.0.1             127.0.0.1             TCP      35583 > commplex-main [ACK] Seq=20274 Ack=2 Win=65535 Len=1448 TSV=2177306576 TSER=2177225971
     50 0.594507    127.0.0.1             127.0.0.1             TCP      commplex-main > 35583 [ACK] Seq=2 Ack=11586 Win=65535 Len=0 TSV=2177326604 TSER=2177246691
     51 0.613609    127.0.0.1             127.0.0.1             TCP      commplex-main > 35583 [ACK] Seq=2 Ack=11586 Win=65535 Len=0 TSV=2177326604 TSER=2177246691
     52 0.614644    127.0.0.1             127.0.0.1             TCP      commplex-main > 35583 [ACK] Seq=2 Ack=13034 Win=65535 Len=0 TSV=2177346742 TSER=2177246695
     53 0.633806    127.0.0.1             127.0.0.1             TCP      commplex-main > 35583 [ACK] Seq=2 Ack=13034 Win=65535 Len=0 TSV=2177346742 TSER=2177246695
     54 0.634779    127.0.0.1             127.0.0.1             TCP      commplex-main > 35583 [ACK] Seq=2 Ack=14482 Win=65535 Len=0 TSV=2177366818 TSER=2177266303
     55 0.653940    127.0.0.1             127.0.0.1             TCP      commplex-main > 35583 [ACK] Seq=2 Ack=14482 Win=65535 Len=0 TSV=2177366818 TSER=2177266303
     56 0.654855    127.0.0.1             127.0.0.1             TCP      commplex-main > 35583 [ACK] Seq=2 Ack=15930 Win=65535 Len=0 TSV=2177386900 TSER=2177266308
     57 0.673961    127.0.0.1             127.0.0.1             TCP      commplex-main > 35583 [ACK] Seq=2 Ack=15930 Win=65535 Len=0 TSV=2177386900 TSER=2177266308
     58 0.674929    127.0.0.1             127.0.0.1             TCP      commplex-main > 35583 [ACK] Seq=2 Ack=17378 Win=65535 Len=0 TSV=2177406958 TSER=2177286523
     59 0.694038    127.0.0.1             127.0.0.1             TCP      commplex-main > 35583 [ACK] Seq=2 Ack=17378 Win=65535 Len=0 TSV=2177406958 TSER=2177286523
     60 0.695004    127.0.0.1             127.0.0.1             TCP      commplex-main > 35583 [ACK] Seq=2 Ack=18826 Win=65535 Len=0 TSV=2177427036 TSER=2177286528
     61 0.714103    127.0.0.1             127.0.0.1             TCP      commplex-main > 35583 [ACK] Seq=2 Ack=18826 Win=65535 Len=0 TSV=2177427036 TSER=2177286528
     62 0.715138    127.0.0.1             127.0.0.1             TCP      commplex-main > 35583 [ACK] Seq=2 Ack=20274 Win=65535 Len=0 TSV=2177447070 TSER=2177306572
     63 0.734300    127.0.0.1             127.0.0.1             TCP      commplex-main > 35583 [ACK] Seq=2 Ack=20274 Win=65535 Len=0 TSV=2177447070 TSER=2177306572
     64 0.735278    127.0.0.1             127.0.0.1             TCP      35583 > commplex-main [ACK] Seq=21722 Ack=2 Win=65535 Len=1448 TSV=2177487317 TSER=2177326604
     65 0.754430    127.0.0.1             127.0.0.1             TCP      35583 > commplex-main [ACK] Seq=21722 Ack=2 Win=65535 Len=1448 TSV=2177487317 TSER=2177326604
     66 0.755412    127.0.0.1             127.0.0.1             TCP      35583 > commplex-main [ACK] Seq=23170 Ack=2 Win=65535 Len=1448 TSV=2177487361 TSER=2177326604
     67 0.774517    127.0.0.1             127.0.0.1             TCP      35583 > commplex-main [ACK] Seq=23170 Ack=2 Win=65535 Len=1448 TSV=2177487361 TSER=2177326604
     68 0.775495    127.0.0.1             127.0.0.1             TCP      35583 > commplex-main [ACK] Seq=24618 Ack=2 Win=65535 Len=1448 TSV=2177507461 TSER=2177346742
     69 0.794652    127.0.0.1             127.0.0.1             TCP      35583 > commplex-main [ACK] Seq=24618 Ack=2 Win=65535 Len=1448 TSV=2177507461 TSER=2177346742
     70 0.795631    127.0.0.1             127.0.0.1             TCP      35583 > commplex-main [ACK] Seq=26066 Ack=2 Win=65535 Len=1448 TSV=2177507465 TSER=2177346742
     71 0.814791    127.0.0.1             127.0.0.1             TCP      35583 > commplex-main [ACK] Seq=26066 Ack=2 Win=65535 Len=1448 TSV=2177507465 TSER=2177346742
     72 0.815768    127.0.0.1             127.0.0.1             TCP      35583 > commplex-main [ACK] Seq=27514 Ack=2 Win=65535 Len=1448 TSV=2177527609 TSER=2177366818
     73 0.834930    127.0.0.1             127.0.0.1             TCP      35583 > commplex-main [ACK] Seq=27514 Ack=2 Win=65535 Len=1448 TSV=2177527609 TSER=2177366818
     74 0.835904    127.0.0.1             127.0.0.1             TCP      35583 > commplex-main [ACK] Seq=28962 Ack=2 Win=65535 Len=1448 TSV=2177527613 TSER=2177366818
     75 0.855070    127.0.0.1             127.0.0.1             TCP      35583 > commplex-main [ACK] Seq=28962 Ack=2 Win=65535 Len=1448 TSV=2177527613 TSER=2177366818
     76 0.856038    127.0.0.1             127.0.0.1             TCP      35583 > commplex-main [ACK] Seq=30410 Ack=2 Win=65535 Len=1448 TSV=2177547623 TSER=2177386900
     77 0.875191    127.0.0.1             127.0.0.1             TCP      35583 > commplex-main [ACK] Seq=30410 Ack=2 Win=65535 Len=1448 TSV=2177547623 TSER=2177386900
     78 0.876173    127.0.0.1             127.0.0.1             TCP      35583 > commplex-main [ACK] Seq=31858 Ack=2 Win=65535 Len=1448 TSV=2177547627 TSER=2177386900
     79 0.895337    127.0.0.1             127.0.0.1             TCP      35583 > commplex-main [ACK] Seq=31858 Ack=2 Win=65535 Len=1448 TSV=2177547627 TSER=2177386900
     80 0.896305    127.0.0.1             127.0.0.1             TCP      35583 > commplex-main [ACK] Seq=33306 Ack=2 Win=65535 Len=1448 TSV=2177567690 TSER=2177406958
     81 0.915463    127.0.0.1             127.0.0.1             TCP      35583 > commplex-main [ACK] Seq=33306 Ack=2 Win=65535 Len=1448 TSV=2177567690 TSER=2177406958
     82 0.916439    127.0.0.1             127.0.0.1             TCP      35583 > commplex-main [ACK] Seq=34754 Ack=2 Win=65535 Len=1448 TSV=2177567694 TSER=2177406958
     83 0.935546    127.0.0.1             127.0.0.1             TCP      35583 > commplex-main [ACK] Seq=34754 Ack=2 Win=65535 Len=1448 TSV=2177567694 TSER=2177406958
     84 0.936521    127.0.0.1             127.0.0.1             TCP      35583 > commplex-main [ACK] Seq=36202 Ack=2 Win=65535 Len=1448 TSV=2177587755 TSER=2177427036
     85 0.955677    127.0.0.1             127.0.0.1             TCP      35583 > commplex-main [ACK] Seq=36202 Ack=2 Win=65535 Len=1448 TSV=2177587755 TSER=2177427036
     86 0.956653    127.0.0.1             127.0.0.1             TCP      35583 > commplex-main [ACK] Seq=37650 Ack=2 Win=65535 Len=1448 TSV=2177587759 TSER=2177427036
     87 0.975807    127.0.0.1             127.0.0.1             TCP      35583 > commplex-main [ACK] Seq=37650 Ack=2 Win=65535 Len=1448 TSV=2177587759 TSER=2177427036
     88 0.976788    127.0.0.1             127.0.0.1             TCP      35583 > commplex-main [ACK] Seq=39098 Ack=2 Win=65535 Len=1448 TSV=2177607954 TSER=2177447070
     89 0.995895    127.0.0.1             127.0.0.1             TCP      35583 > commplex-main [ACK] Seq=39098 Ack=2 Win=65535 Len=1448 TSV=2177607954 TSER=2177447070
     90 0.996922    127.0.0.1             127.0.0.1             TCP      35583 > commplex-main [ACK] Seq=40546 Ack=2 Win=65535 Len=1448 TSV=2177607958 TSER=2177447070
     91 1.016076    127.0.0.1             127.0.0.1             TCP      35583 > commplex-main [ACK] Seq=40546 Ack=2 Win=65535 Len=1448 TSV=2177607958 TSER=2177447070
     92 1.017055    127.0.0.1             127.0.0.1             TCP      commplex-main > 35583 [ACK] Seq=2 Ack=20274 Win=64087 Len=0 TSV=2177628034 TSER=2177487317
     93 1.036214    127.0.0.1             127.0.0.1             TCP      commplex-main > 35583 [ACK] Seq=2 Ack=20274 Win=64087 Len=0 TSV=2177628034 TSER=2177487317
     94 1.037189    127.0.0.1             127.0.0.1             TCP      commplex-main > 35583 [ACK] Seq=2 Ack=20274 Win=62639 Len=0 TSV=2177648115 TSER=2177487361
     95 1.056355    127.0.0.1             127.0.0.1             TCP      commplex-main > 35583 [ACK] Seq=2 Ack=20274 Win=62639 Len=0 TSV=2177648115 TSER=2177487361
     96 1.057322    127.0.0.1             127.0.0.1             TCP      commplex-main > 35583 [ACK] Seq=2 Ack=20274 Win=61191 Len=0 TSV=2177668266 TSER=2177507461
     97 1.076464    127.0.0.1             127.0.0.1             TCP      commplex-main > 35583 [ACK] Seq=2 Ack=20274 Win=61191 Len=0 TSV=2177668266 TSER=2177507461
     98 1.077452    127.0.0.1             127.0.0.1             TCP      commplex-main > 35583 [ACK] Seq=2 Ack=20274 Win=59743 Len=0 TSV=2177688401 TSER=2177507465
     99 1.096611    127.0.0.1             127.0.0.1             TCP      commplex-main > 35583 [ACK] Seq=2 Ack=20274 Win=59743 Len=0 TSV=2177688401 TSER=2177507465
    100 1.097536    127.0.0.1             127.0.0.1             TCP      commplex-main > 35583 [ACK] Seq=2 Ack=20274 Win=58295 Len=0 TSV=2177708546 TSER=2177527609
    101 1.116700    127.0.0.1             127.0.0.1             TCP      commplex-main > 35583 [ACK] Seq=2 Ack=20274 Win=58295 Len=0 TSV=2177708546 TSER=2177527609
    102 1.117667    127.0.0.1             127.0.0.1             TCP      commplex-main > 35583 [ACK] Seq=2 Ack=20274 Win=56847 Len=0 TSV=2177728678 TSER=2177527613
    103 1.136820    127.0.0.1             127.0.0.1             TCP      commplex-main > 35583 [ACK] Seq=2 Ack=20274 Win=56847 Len=0 TSV=2177728678 TSER=2177527613
    104 1.137800    127.0.0.1             127.0.0.1             TCP      commplex-main > 35583 [ACK] Seq=2 Ack=20274 Win=55399 Len=0 TSV=2177748800 TSER=2177547623
    105 1.156965    127.0.0.1             127.0.0.1             TCP      commplex-main > 35583 [ACK] Seq=2 Ack=20274 Win=55399 Len=0 TSV=2177748800 TSER=2177547623
    106 1.157939    127.0.0.1             127.0.0.1             TCP      commplex-main > 35583 [ACK] Seq=2 Ack=20274 Win=53951 Len=0 TSV=2177768943 TSER=2177547627
    107 1.177099    127.0.0.1             127.0.0.1             TCP      commplex-main > 35583 [ACK] Seq=2 Ack=20274 Win=53951 Len=0 TSV=2177768943 TSER=2177547627
    108 1.178069    127.0.0.1             127.0.0.1             TCP      commplex-main > 35583 [ACK] Seq=2 Ack=20274 Win=52503 Len=0 TSV=2177789072 TSER=2177567690
    109 1.197228    127.0.0.1             127.0.0.1             TCP      commplex-main > 35583 [ACK] Seq=2 Ack=20274 Win=52503 Len=0 TSV=2177789072 TSER=2177567690
    110 1.198203    127.0.0.1             127.0.0.1             TCP      commplex-main > 35583 [ACK] Seq=2 Ack=20274 Win=51055 Len=0 TSV=2177809145 TSER=2177567694
    111 1.217360    127.0.0.1             127.0.0.1             TCP      commplex-main > 35583 [ACK] Seq=2 Ack=20274 Win=51055 Len=0 TSV=2177809145 TSER=2177567694
    112 1.218281    127.0.0.1             127.0.0.1             TCP      commplex-main > 35583 [ACK] Seq=2 Ack=20274 Win=49607 Len=0 TSV=2177829281 TSER=2177587755
    113 1.237451    127.0.0.1             127.0.0.1             TCP      commplex-main > 35583 [ACK] Seq=2 Ack=20274 Win=49607 Len=0 TSV=2177829281 TSER=2177587755
    114 1.238354    127.0.0.1             127.0.0.1             TCP      commplex-main > 35583 [ACK] Seq=2 Ack=20274 Win=48159 Len=0 TSV=2177849411 TSER=2177587759
    115 1.257465    127.0.0.1             127.0.0.1             TCP      commplex-main > 35583 [ACK] Seq=2 Ack=20274 Win=48159 Len=0 TSV=2177849411 TSER=2177587759
    116 1.258429    127.0.0.1             127.0.0.1             TCP      commplex-main > 35583 [ACK] Seq=2 Ack=20274 Win=46711 Len=0 TSV=2177869486 TSER=2177607954
    117 1.277590    127.0.0.1             127.0.0.1             TCP      commplex-main > 35583 [ACK] Seq=2 Ack=20274 Win=46711 Len=0 TSV=2177869486 TSER=2177607954
    118 1.278504    127.0.0.1             127.0.0.1             TCP      commplex-main > 35583 [ACK] Seq=2 Ack=20274 Win=45263 Len=0 TSV=2177889688 TSER=2177607958
    119 1.297660    127.0.0.1             127.0.0.1             TCP      commplex-main > 35583 [ACK] Seq=2 Ack=20274 Win=45263 Len=0 TSV=2177889688 TSER=2177607958
    120 1.298576    127.0.0.1             127.0.0.1             TCP      35583 > commplex-main [ACK] Seq=20274 Ack=2 Win=65535 Len=1448 TSV=2177970308 TSER=2177688401
    121 1.317736    127.0.0.1             127.0.0.1             TCP      35583 > commplex-main [ACK] Seq=20274 Ack=2 Win=65535 Len=1448 TSV=2177970308 TSER=2177688401
    122 1.337978    127.0.0.1             127.0.0.1             TCP      commplex-main > 35583 [ACK] Seq=2 Ack=41994 Win=65535 Len=0 TSV=2178191380 TSER=2177970308
    123 1.357146    127.0.0.1             127.0.0.1             TCP      commplex-main > 35583 [ACK] Seq=2 Ack=41994 Win=65535 Len=0 TSV=2178191380 TSER=2177970308
    124 1.377460    127.0.0.1             127.0.0.1             TCP      35583 > commplex-main [ACK] Seq=41994 Ack=2 Win=65535 Len=1448 TSV=2178230845 TSER=2178191380
    125 1.396574    127.0.0.1             127.0.0.1             TCP      35583 > commplex-main [ACK] Seq=41994 Ack=2 Win=65535 Len=1448 TSV=2178230845 TSER=2178191380
    126 1.397540    127.0.0.1             127.0.0.1             TCP      35583 > commplex-main [ACK] Seq=43442 Ack=2 Win=65535 Len=1448 TSV=2178230849 TSER=2178191380
    127 1.416642    127.0.0.1             127.0.0.1             TCP      35583 > commplex-main [ACK] Seq=43442 Ack=2 Win=65535 Len=1448 TSV=2178230849 TSER=2178191380
    128 1.417633    127.0.0.1             127.0.0.1             TCP      commplex-main > 35583 [ACK] Seq=2 Ack=43442 Win=65535 Len=0 TSV=2178270194 TSER=2178230845
    129 1.436797    127.0.0.1             127.0.0.1             TCP      commplex-main > 35583 [ACK] Seq=2 Ack=43442 Win=65535 Len=0 TSV=2178270194 TSER=2178230845
    130 1.437769    127.0.0.1             127.0.0.1             TCP      commplex-main > 35583 [ACK] Seq=2 Ack=44890 Win=65535 Len=0 TSV=2178290242 TSER=2178230849
    131 1.456936    127.0.0.1             127.0.0.1             TCP      commplex-main > 35583 [ACK] Seq=2 Ack=44890 Win=65535 Len=0 TSV=2178290242 TSER=2178230849
    132 1.457906    127.0.0.1             127.0.0.1             TCP      35583 > commplex-main [ACK] Seq=44890 Ack=2 Win=65535 Len=1448 TSV=2178310491 TSER=2178270194
    133 1.477068    127.0.0.1             127.0.0.1             TCP      35583 > commplex-main [ACK] Seq=44890 Ack=2 Win=65535 Len=1448 TSV=2178310491 TSER=2178270194
    134 1.478042    127.0.0.1             127.0.0.1             TCP      35583 > commplex-main [ACK] Seq=46338 Ack=2 Win=65535 Len=1448 TSV=2178310498 TSER=2178270194
    135 1.497203    127.0.0.1             127.0.0.1             TCP      35583 > commplex-main [ACK] Seq=46338 Ack=2 Win=65535 Len=1448 TSV=2178310498 TSER=2178270194
    136 1.498120    127.0.0.1             127.0.0.1             TCP      35583 > commplex-main [ACK] Seq=47786 Ack=2 Win=65535 Len=1448 TSV=2178330595 TSER=2178290242
    137 1.517279    127.0.0.1             127.0.0.1             TCP      35583 > commplex-main [ACK] Seq=47786 Ack=2 Win=65535 Len=1448 TSV=2178330595 TSER=2178290242
    138 1.518252    127.0.0.1             127.0.0.1             TCP      35583 > commplex-main [ACK] Seq=49234 Ack=2 Win=65535 Len=1448 TSV=2178330600 TSER=2178290242
    139 1.537407    127.0.0.1             127.0.0.1             TCP      35583 > commplex-main [ACK] Seq=49234 Ack=2 Win=65535 Len=1448 TSV=2178330600 TSER=2178290242
    140 1.538329    127.0.0.1             127.0.0.1             TCP      commplex-main > 35583 [ACK] Seq=2 Ack=46338 Win=65535 Len=0 TSV=2178350680 TSER=2178310491
    141 1.557464    127.0.0.1             127.0.0.1             TCP      commplex-main > 35583 [ACK] Seq=2 Ack=46338 Win=65535 Len=0 TSV=2178350680 TSER=2178310491
    142 1.558465    127.0.0.1             127.0.0.1             TCP      commplex-main > 35583 [ACK] Seq=2 Ack=47786 Win=65535 Len=0 TSV=2178370818 TSER=2178310498
    143 1.577630    127.0.0.1             127.0.0.1             TCP      commplex-main > 35583 [ACK] Seq=2 Ack=47786 Win=65535 Len=0 TSV=2178370818 TSER=2178310498
    144 1.578569    127.0.0.1             127.0.0.1             TCP      commplex-main > 35583 [ACK] Seq=2 Ack=49234 Win=65535 Len=0 TSV=2178390888 TSER=2178330595
    145 1.597730    127.0.0.1             127.0.0.1             TCP      commplex-main > 35583 [ACK] Seq=2 Ack=49234 Win=65535 Len=0 TSV=2178390888 TSER=2178330595
    146 1.598654    127.0.0.1             127.0.0.1             TCP      commplex-main > 35583 [ACK] Seq=2 Ack=50682 Win=65535 Len=0 TSV=2178411018 TSER=2178330600
    147 1.617816    127.0.0.1             127.0.0.1             TCP      commplex-main > 35583 [ACK] Seq=2 Ack=50682 Win=65535 Len=0 TSV=2178411018 TSER=2178330600
    148 1.618789    127.0.0.1             127.0.0.1             TCP      35583 > commplex-main [ACK] Seq=50682 Ack=2 Win=65535 Len=1448 TSV=2178431118 TSER=2178350680
    149 1.637948    127.0.0.1             127.0.0.1             TCP      35583 > commplex-main [ACK] Seq=50682 Ack=2 Win=65535 Len=1448 TSV=2178431118 TSER=2178350680
    150 1.638872    127.0.0.1             127.0.0.1             TCP      35583 > commplex-main [ACK] Seq=52130 Ack=2 Win=65535 Len=1448 TSV=2178431157 TSER=2178350680
    151 1.658035    127.0.0.1             127.0.0.1             TCP      35583 > commplex-main [ACK] Seq=52130 Ack=2 Win=65535 Len=1448 TSV=2178431157 TSER=2178350680
    152 1.658948    127.0.0.1             127.0.0.1             TCP      35583 > commplex-main [ACK] Seq=53578 Ack=2 Win=65535 Len=1448 TSV=2178451283 TSER=2178370818
    153 1.678110    127.0.0.1             127.0.0.1             TCP      35583 > commplex-main [ACK] Seq=53578 Ack=2 Win=65535 Len=1448 TSV=2178451283 TSER=2178370818
    154 1.679026    127.0.0.1             127.0.0.1             TCP      35583 > commplex-main [ACK] Seq=55026 Ack=2 Win=65535 Len=1448 TSV=2178451305 TSER=2178370818
    155 1.698188    127.0.0.1             127.0.0.1             TCP      35583 > commplex-main [ACK] Seq=55026 Ack=2 Win=65535 Len=1448 TSV=2178451305 TSER=2178370818
    156 1.699105    127.0.0.1             127.0.0.1             TCP      35583 > commplex-main [ACK] Seq=56474 Ack=2 Win=65535 Len=1448 TSV=2178471381 TSER=2178390888
    157 1.718263    127.0.0.1             127.0.0.1             TCP      35583 > commplex-main [ACK] Seq=56474 Ack=2 Win=65535 Len=1448 TSV=2178471381 TSER=2178390888
    158 1.719182    127.0.0.1             127.0.0.1             TCP      35583 > commplex-main [ACK] Seq=57922 Ack=2 Win=65535 Len=1448 TSV=2178471404 TSER=2178390888
    159 1.738341    127.0.0.1             127.0.0.1             TCP      35583 > commplex-main [ACK] Seq=57922 Ack=2 Win=65535 Len=1448 TSV=2178471404 TSER=2178390888
    160 1.739254    127.0.0.1             127.0.0.1             TCP      35583 > commplex-main [ACK] Seq=59370 Ack=2 Win=65535 Len=1448 TSV=2178491485 TSER=2178411018
    161 1.758409    127.0.0.1             127.0.0.1             TCP      35583 > commplex-main [ACK] Seq=59370 Ack=2 Win=65535 Len=1448 TSV=2178491485 TSER=2178411018
    162 1.759331    127.0.0.1             127.0.0.1             TCP      35583 > commplex-main [ACK] Seq=60818 Ack=2 Win=65535 Len=1448 TSV=2178491511 TSER=2178411018
    163 1.778463    127.0.0.1             127.0.0.1             TCP      35583 > commplex-main [ACK] Seq=60818 Ack=2 Win=65535 Len=1448 TSV=2178491511 TSER=2178411018
    164 1.779406    127.0.0.1             127.0.0.1             TCP      commplex-main > 35583 [ACK] Seq=2 Ack=52130 Win=65535 Len=0 TSV=2178511565 TSER=2178431118
    165 1.798516    127.0.0.1             127.0.0.1             TCP      commplex-main > 35583 [ACK] Seq=2 Ack=52130 Win=65535 Len=0 TSV=2178511565 TSER=2178431118
    166 1.799488    127.0.0.1             127.0.0.1             TCP      commplex-main > 35583 [ACK] Seq=2 Ack=53578 Win=65535 Len=0 TSV=2178531647 TSER=2178431157
    167 1.818637    127.0.0.1             127.0.0.1             TCP      commplex-main > 35583 [ACK] Seq=2 Ack=53578 Win=65535 Len=0 TSV=2178531647 TSER=2178431157
    168 1.819626    127.0.0.1             127.0.0.1             TCP      commplex-main > 35583 [ACK] Seq=2 Ack=55026 Win=65535 Len=0 TSV=2178551723 TSER=2178451283
    169 1.838790    127.0.0.1             127.0.0.1             TCP      commplex-main > 35583 [ACK] Seq=2 Ack=55026 Win=65535 Len=0 TSV=2178551723 TSER=2178451283
    170 1.839758    127.0.0.1             127.0.0.1             TCP      commplex-main > 35583 [ACK] Seq=2 Ack=56474 Win=65535 Len=0 TSV=2178571800 TSER=2178451305
    171 1.858912    127.0.0.1             127.0.0.1             TCP      commplex-main > 35583 [ACK] Seq=2 Ack=56474 Win=65535 Len=0 TSV=2178571800 TSER=2178451305
    172 1.859894    127.0.0.1             127.0.0.1             TCP      commplex-main > 35583 [ACK] Seq=2 Ack=57922 Win=65535 Len=0 TSV=2178591875 TSER=2178471381
    173 1.879053    127.0.0.1             127.0.0.1             TCP      commplex-main > 35583 [ACK] Seq=2 Ack=57922 Win=65535 Len=0 TSV=2178591875 TSER=2178471381
    174 1.880029    127.0.0.1             127.0.0.1             TCP      commplex-main > 35583 [ACK] Seq=2 Ack=59370 Win=65535 Len=0 TSV=2178611948 TSER=2178471404
    175 1.899189    127.0.0.1             127.0.0.1             TCP      commplex-main > 35583 [ACK] Seq=2 Ack=59370 Win=65535 Len=0 TSV=2178611948 TSER=2178471404
    176 1.900105    127.0.0.1             127.0.0.1             TCP      commplex-main > 35583 [ACK] Seq=2 Ack=60818 Win=65535 Len=0 TSV=2178632020 TSER=2178491485
    177 1.919263    127.0.0.1             127.0.0.1             TCP      commplex-main > 35583 [ACK] Seq=2 Ack=60818 Win=65535 Len=0 TSV=2178632020 TSER=2178491485
    178 1.920184    127.0.0.1             127.0.0.1             TCP      commplex-main > 35583 [ACK] Seq=2 Ack=62266 Win=65535 Len=0 TSV=2178652077 TSER=2178491511
    179 1.939342    127.0.0.1             127.0.0.1             TCP      commplex-main > 35583 [ACK] Seq=2 Ack=62266 Win=65535 Len=0 TSV=2178652077 TSER=2178491511
    180 1.940322    127.0.0.1             127.0.0.1             TCP      35583 > commplex-main [ACK] Seq=62266 Ack=2 Win=65535 Len=1448 TSV=2178672177 TSER=2178511565
    181 1.959461    127.0.0.1             127.0.0.1             TCP      35583 > commplex-main [ACK] Seq=62266 Ack=2 Win=65535 Len=1448 TSV=2178672177 TSER=2178511565
    182 1.960398    127.0.0.1             127.0.0.1             TCP      35583 > commplex-main [ACK] Seq=63714 Ack=2 Win=65535 Len=1448 TSV=2178692312 TSER=2178531647
    183 1.979505    127.0.0.1             127.0.0.1             TCP      35583 > commplex-main [ACK] Seq=63714 Ack=2 Win=65535 Len=1448 TSV=2178692312 TSER=2178531647
    184 1.980482    127.0.0.1             127.0.0.1             TCP      35583 > commplex-main [ACK] Seq=65162 Ack=2 Win=65535 Len=1448 TSV=2178712445 TSER=2178551723
    185 1.999592    127.0.0.1             127.0.0.1             TCP      35583 > commplex-main [ACK] Seq=65162 Ack=2 Win=65535 Len=1448 TSV=2178712445 TSER=2178551723
    186 2.000562    127.0.0.1             127.0.0.1             TCP      35583 > commplex-main [ACK] Seq=66610 Ack=2 Win=65535 Len=1448 TSV=2178732566 TSER=2178571800
    187 2.019720    127.0.0.1             127.0.0.1             TCP      35583 > commplex-main [ACK] Seq=66610 Ack=2 Win=65535 Len=1448 TSV=2178732566 TSER=2178571800
    188 2.020649    127.0.0.1             127.0.0.1             TCP      35583 > commplex-main [ACK] Seq=68058 Ack=2 Win=65535 Len=1448 TSV=2178752707 TSER=2178591875
    189 2.039809    127.0.0.1             127.0.0.1             TCP      35583 > commplex-main [ACK] Seq=68058 Ack=2 Win=65535 Len=1448 TSV=2178752707 TSER=2178591875
    190 2.040730    127.0.0.1             127.0.0.1             TCP      35583 > commplex-main [ACK] Seq=69506 Ack=2 Win=65535 Len=1448 TSV=2178772841 TSER=2178611948
    191 2.059896    127.0.0.1             127.0.0.1             TCP      35583 > commplex-main [ACK] Seq=69506 Ack=2 Win=65535 Len=1448 TSV=2178772841 TSER=2178611948
    192 2.060863    127.0.0.1             127.0.0.1             TCP      35583 > commplex-main [ACK] Seq=70954 Ack=2 Win=65535 Len=1448 TSV=2178792912 TSER=2178632020
    193 2.080017    127.0.0.1             127.0.0.1             TCP      35583 > commplex-main [ACK] Seq=70954 Ack=2 Win=65535 Len=1448 TSV=2178792912 TSER=2178632020
    194 2.080942    127.0.0.1             127.0.0.1             TCP      35583 > commplex-main [ACK] Seq=72402 Ack=2 Win=65535 Len=1448 TSV=2178812996 TSER=2178652077
    195 2.100104    127.0.0.1             127.0.0.1             TCP      35583 > commplex-main [ACK] Seq=72402 Ack=2 Win=65535 Len=1448 TSV=2178812996 TSER=2178652077
    196 2.101074    127.0.0.1             127.0.0.1             TCP      commplex-main > 35583 [ACK] Seq=2 Ack=63714 Win=65535 Len=0 TSV=2178833071 TSER=2178672177
    197 2.120232    127.0.0.1             127.0.0.1             TCP      commplex-main > 35583 [ACK] Seq=2 Ack=63714 Win=65535 Len=0 TSV=2178833071 TSER=2178672177
    198 2.121147    127.0.0.1             127.0.0.1             TCP      commplex-main > 35583 [ACK] Seq=2 Ack=65162 Win=65535 Len=0 TSV=2178853117 TSER=2178692312
    199 2.140251    127.0.0.1             127.0.0.1             TCP      commplex-main > 35583 [ACK] Seq=2 Ack=65162 Win=65535 Len=0 TSV=2178853117 TSER=2178692312
    200 2.141230    127.0.0.1             127.0.0.1             TCP      commplex-main > 35583 [ACK] Seq=2 Ack=66610 Win=65535 Len=0 TSV=2178873202 TSER=2178712445
    201 2.160315    127.0.0.1             127.0.0.1             TCP      commplex-main > 35583 [ACK] Seq=2 Ack=66610 Win=65535 Len=0 TSV=2178873202 TSER=2178712445
    202 2.161310    127.0.0.1             127.0.0.1             TCP      commplex-main > 35583 [ACK] Seq=2 Ack=68058 Win=65535 Len=0 TSV=2178893333 TSER=2178732566
    203 2.180456    127.0.0.1             127.0.0.1             TCP      commplex-main > 35583 [ACK] Seq=2 Ack=68058 Win=65535 Len=0 TSV=2178893333 TSER=2178732566
    204 2.181446    127.0.0.1             127.0.0.1             TCP      commplex-main > 35583 [ACK] Seq=2 Ack=69506 Win=65535 Len=0 TSV=2178913431 TSER=2178752707
    205 2.200551    127.0.0.1             127.0.0.1             TCP      commplex-main > 35583 [ACK] Seq=2 Ack=69506 Win=65535 Len=0 TSV=2178913431 TSER=2178752707
    206 2.201516    127.0.0.1             127.0.0.1             TCP      commplex-main > 35583 [ACK] Seq=2 Ack=70954 Win=65535 Len=0 TSV=2178933506 TSER=2178772841
    207 2.220682    127.0.0.1             127.0.0.1             TCP      commplex-main > 35583 [ACK] Seq=2 Ack=70954 Win=65535 Len=0 TSV=2178933506 TSER=2178772841
    208 2.221589    127.0.0.1             127.0.0.1             TCP      commplex-main > 35583 [ACK] Seq=2 Ack=72402 Win=65535 Len=0 TSV=2178953632 TSER=2178792912
    209 2.240751    127.0.0.1             127.0.0.1             TCP      commplex-main > 35583 [ACK] Seq=2 Ack=72402 Win=65535 Len=0 TSV=2178953632 TSER=2178792912
    210 2.241667    127.0.0.1             127.0.0.1             TCP      commplex-main > 35583 [ACK] Seq=2 Ack=73850 Win=65535 Len=0 TSV=2178973715 TSER=2178812996
    211 2.260833    127.0.0.1             127.0.0.1             TCP      commplex-main > 35583 [ACK] Seq=2 Ack=73850 Win=65535 Len=0 TSV=2178973715 TSER=2178812996
    212 2.261801    127.0.0.1             127.0.0.1             TCP      35583 > commplex-main [ACK] Seq=73850 Ack=2 Win=65535 Len=1448 TSV=2178993925 TSER=2178833071
    213 2.281942    127.0.0.1             127.0.0.1             TCP      35583 > commplex-main [ACK] Seq=75298 Ack=2 Win=65535 Len=1448 TSV=2178993942 TSER=2178833071
    214 2.302077    127.0.0.1             127.0.0.1             TCP      35583 > commplex-main [ACK] Seq=76746 Ack=2 Win=65535 Len=1448 TSV=2179013895 TSER=2178853117
    215 2.322210    127.0.0.1             127.0.0.1             TCP      35583 > commplex-main [ACK] Seq=78194 Ack=2 Win=65535 Len=1448 TSV=2179033951 TSER=2178873202
    216 2.342347    127.0.0.1             127.0.0.1             TCP      35583 > commplex-main [ACK] Seq=79642 Ack=2 Win=65535 Len=1448 TSV=2179054102 TSER=2178893333
    217 2.362475    127.0.0.1             127.0.0.1             TCP      35583 > commplex-main [ACK] Seq=81090 Ack=2 Win=65535 Len=1448 TSV=2179074217 TSER=2178913431
    218 2.382616    127.0.0.1             127.0.0.1             TCP      35583 > commplex-main [ACK] Seq=82538 Ack=2 Win=65535 Len=1448 TSV=2179094321 TSER=2178933506
    219 2.402755    127.0.0.1             127.0.0.1             TCP      35583 > commplex-main [ACK] Seq=83986 Ack=2 Win=65535 Len=1448 TSV=2179114394 TSER=2178953632
    220 2.422891    127.0.0.1             127.0.0.1             TCP      35583 > commplex-main [ACK] Seq=85434 Ack=2 Win=65535 Len=1448 TSV=2179134471 TSER=2178973715
    221 3.281388    127.0.0.1             127.0.0.1             TCP      35583 > commplex-main [ACK] Seq=73850 Ack=2 Win=65535 Len=1448 TSV=2180134765 TSER=2178973715
    222 3.300517    127.0.0.1             127.0.0.1             TCP      35583 > commplex-main [ACK] Seq=73850 Ack=2 Win=65535 Len=1448 TSV=2180134765 TSER=2178973715
    223 3.320739    127.0.0.1             127.0.0.1             TCP      commplex-main > 35583 [ACK] Seq=2 Ack=75298 Win=65535 Len=0 TSV=2180174141 TSER=2180134765
    224 3.339902    127.0.0.1             127.0.0.1             TCP      commplex-main > 35583 [ACK] Seq=2 Ack=75298 Win=65535 Len=0 TSV=2180174141 TSER=2180134765
    225 3.360168    127.0.0.1             127.0.0.1             TCP      35583 > commplex-main [ACK] Seq=75298 Ack=2 Win=65535 Len=1448 TSV=2180213573 TSER=2180174141
    226 3.379345    127.0.0.1             127.0.0.1             TCP      35583 > commplex-main [ACK] Seq=75298 Ack=2 Win=65535 Len=1448 TSV=2180213573 TSER=2180174141
    227 3.380305    127.0.0.1             127.0.0.1             TCP      35583 > commplex-main [ACK] Seq=76746 Ack=2 Win=65535 Len=1448 TSV=2180213576 TSER=2180174141
    228 3.399462    127.0.0.1             127.0.0.1             TCP      35583 > commplex-main [ACK] Seq=76746 Ack=2 Win=65535 Len=1448 TSV=2180213576 TSER=2180174141
    229 3.400390    127.0.0.1             127.0.0.1             TCP      commplex-main > 35583 [ACK] Seq=2 Ack=76746 Win=65535 Len=0 TSV=2180252965 TSER=2180213573
    230 3.419560    127.0.0.1             127.0.0.1             TCP      commplex-main > 35583 [ACK] Seq=2 Ack=76746 Win=65535 Len=0 TSV=2180252965 TSER=2180213573
    231 3.420474    127.0.0.1             127.0.0.1             TCP      commplex-main > 35583 [ACK] Seq=2 Ack=78194 Win=65535 Len=0 TSV=2180273072 TSER=2180213576
    232 3.439581    127.0.0.1             127.0.0.1             TCP      commplex-main > 35583 [ACK] Seq=2 Ack=78194 Win=65535 Len=0 TSV=2180273072 TSER=2180213576
    233 3.440611    127.0.0.1             127.0.0.1             TCP      35583 > commplex-main [ACK] Seq=78194 Ack=2 Win=65535 Len=1448 TSV=2180293224 TSER=2180252965
    234 3.459774    127.0.0.1             127.0.0.1             TCP      35583 > commplex-main [ACK] Seq=78194 Ack=2 Win=65535 Len=1448 TSV=2180293224 TSER=2180252965
    235 3.460690    127.0.0.1             127.0.0.1             TCP      35583 > commplex-main [ACK] Seq=79642 Ack=2 Win=65535 Len=1448 TSV=2180293230 TSER=2180252965
    236 3.479861    127.0.0.1             127.0.0.1             TCP      35583 > commplex-main [ACK] Seq=79642 Ack=2 Win=65535 Len=1448 TSV=2180293230 TSER=2180252965
    237 3.480824    127.0.0.1             127.0.0.1             TCP      35583 > commplex-main [ACK] Seq=81090 Ack=2 Win=65535 Len=1448 TSV=2180313231 TSER=2180273072
    238 3.499981    127.0.0.1             127.0.0.1             TCP      35583 > commplex-main [ACK] Seq=81090 Ack=2 Win=65535 Len=1448 TSV=2180313231 TSER=2180273072
    239 3.500960    127.0.0.1             127.0.0.1             TCP      35583 > commplex-main [ACK] Seq=82538 Ack=2 Win=65535 Len=1448 TSV=2180313238 TSER=2180273072
    240 3.520127    127.0.0.1             127.0.0.1             TCP      35583 > commplex-main [ACK] Seq=82538 Ack=2 Win=65535 Len=1448 TSV=2180313238 TSER=2180273072
    241 3.521092    127.0.0.1             127.0.0.1             TCP      commplex-main > 35583 [ACK] Seq=2 Ack=79642 Win=65535 Len=0 TSV=2180333382 TSER=2180293224
    242 3.540254    127.0.0.1             127.0.0.1             TCP      commplex-main > 35583 [ACK] Seq=2 Ack=79642 Win=65535 Len=0 TSV=2180333382 TSER=2180293224
    243 3.541226    127.0.0.1             127.0.0.1             TCP      commplex-main > 35583 [ACK] Seq=2 Ack=81090 Win=65535 Len=0 TSV=2180353466 TSER=2180293230
    244 3.560384    127.0.0.1             127.0.0.1             TCP      commplex-main > 35583 [ACK] Seq=2 Ack=81090 Win=65535 Len=0 TSV=2180353466 TSER=2180293230
    245 3.561358    127.0.0.1             127.0.0.1             TCP      commplex-main > 35583 [ACK] Seq=2 Ack=82538 Win=65535 Len=0 TSV=2180373587 TSER=2180313231
    246 3.580464    127.0.0.1             127.0.0.1             TCP      commplex-main > 35583 [ACK] Seq=2 Ack=82538 Win=65535 Len=0 TSV=2180373587 TSER=2180313231
    247 3.581471    127.0.0.1             127.0.0.1             TCP      commplex-main > 35583 [ACK] Seq=2 Ack=83986 Win=65535 Len=0 TSV=2180393736 TSER=2180313238
    248 3.600622    127.0.0.1             127.0.0.1             TCP      commplex-main > 35583 [ACK] Seq=2 Ack=83986 Win=65535 Len=0 TSV=2180393736 TSER=2180313238
    249 3.601525    127.0.0.1             127.0.0.1             TCP      35583 > commplex-main [ACK] Seq=83986 Ack=2 Win=65535 Len=1448 TSV=2180413913 TSER=2180333382
    250 3.620677    127.0.0.1             127.0.0.1             TCP      35583 > commplex-main [ACK] Seq=83986 Ack=2 Win=65535 Len=1448 TSV=2180413913 TSER=2180333382
    251 3.621661    127.0.0.1             127.0.0.1             TCP      35583 > commplex-main [ACK] Seq=85434 Ack=2 Win=65535 Len=1448 TSV=2180413919 TSER=2180333382
    252 3.640824    127.0.0.1             127.0.0.1             TCP      35583 > commplex-main [ACK] Seq=85434 Ack=2 Win=65535 Len=1448 TSV=2180413919 TSER=2180333382
    253 3.641798    127.0.0.1             127.0.0.1             TCP      35583 > commplex-main [ACK] Seq=86882 Ack=2 Win=65535 Len=1448 TSV=2180434029 TSER=2180353466
    254 3.660963    127.0.0.1             127.0.0.1             TCP      35583 > commplex-main [ACK] Seq=86882 Ack=2 Win=65535 Len=1448 TSV=2180434029 TSER=2180353466
    255 3.661873    127.0.0.1             127.0.0.1             TCP      35583 > commplex-main [ACK] Seq=88330 Ack=2 Win=65535 Len=1448 TSV=2180454108 TSER=2180373587
    256 3.681032    127.0.0.1             127.0.0.1             TCP      35583 > commplex-main [ACK] Seq=88330 Ack=2 Win=65535 Len=1448 TSV=2180454108 TSER=2180373587
    257 3.682011    127.0.0.1             127.0.0.1             TCP      35583 > commplex-main [ACK] Seq=89778 Ack=2 Win=65535 Len=1448 TSV=2180474286 TSER=2180393736
    258 3.701174    127.0.0.1             127.0.0.1             TCP      35583 > commplex-main [ACK] Seq=89778 Ack=2 Win=65535 Len=1448 TSV=2180474286 TSER=2180393736
    259 3.702143    127.0.0.1             127.0.0.1             TCP      commplex-main > 35583 [ACK] Seq=2 Ack=85434 Win=65535 Len=0 TSV=2180494284 TSER=2180413913
    260 3.721298    127.0.0.1             127.0.0.1             TCP      commplex-main > 35583 [ACK] Seq=2 Ack=85434 Win=65535 Len=0 TSV=2180494284 TSER=2180413913
    261 3.722277    127.0.0.1             127.0.0.1             TCP      commplex-main > 35583 [ACK] Seq=2 Ack=86882 Win=65535 Len=0 TSV=2180514445 TSER=2180413919
    262 3.741434    127.0.0.1             127.0.0.1             TCP      commplex-main > 35583 [ACK] Seq=2 Ack=86882 Win=65535 Len=0 TSV=2180514445 TSER=2180413919
    263 3.742351    127.0.0.1             127.0.0.1             TCP      commplex-main > 35583 [ACK] Seq=2 Ack=88330 Win=65535 Len=0 TSV=2180534575 TSER=2180434029
    264 3.761445    127.0.0.1             127.0.0.1             TCP      commplex-main > 35583 [ACK] Seq=2 Ack=88330 Win=65535 Len=0 TSV=2180534575 TSER=2180434029
    265 3.762425    127.0.0.1             127.0.0.1             TCP      commplex-main > 35583 [ACK] Seq=2 Ack=89778 Win=65535 Len=0 TSV=2180554648 TSER=2180454108
    266 3.781525    127.0.0.1             127.0.0.1             TCP      commplex-main > 35583 [ACK] Seq=2 Ack=89778 Win=65535 Len=0 TSV=2180554648 TSER=2180454108
    267 3.782499    127.0.0.1             127.0.0.1             TCP      commplex-main > 35583 [ACK] Seq=2 Ack=91226 Win=65535 Len=0 TSV=2180574786 TSER=2180474286
    268 3.801601    127.0.0.1             127.0.0.1             TCP      commplex-main > 35583 [ACK] Seq=2 Ack=91226 Win=65535 Len=0 TSV=2180574786 TSER=2180474286
    269 3.802577    127.0.0.1             127.0.0.1             TCP      35583 > commplex-main [ACK] Seq=91226 Ack=2 Win=65535 Len=1448 TSV=2180594958 TSER=2180494284
    270 3.821682    127.0.0.1             127.0.0.1             TCP      35583 > commplex-main [ACK] Seq=91226 Ack=2 Win=65535 Len=1448 TSV=2180594958 TSER=2180494284
    271 3.822654    127.0.0.1             127.0.0.1             TCP      35583 > commplex-main [ACK] Seq=92674 Ack=2 Win=65535 Len=1448 TSV=2180615092 TSER=2180514445
    272 3.841820    127.0.0.1             127.0.0.1             TCP      35583 > commplex-main [ACK] Seq=92674 Ack=2 Win=65535 Len=1448 TSV=2180615092 TSER=2180514445
    273 3.842791    127.0.0.1             127.0.0.1             TCP      35583 > commplex-main [ACK] Seq=94122 Ack=2 Win=65535 Len=1448 TSV=2180635092 TSER=2180534575
    274 3.861962    127.0.0.1             127.0.0.1             TCP      35583 > commplex-main [ACK] Seq=94122 Ack=2 Win=65535 Len=1448 TSV=2180635092 TSER=2180534575
    275 3.862924    127.0.0.1             127.0.0.1             TCP      35583 > commplex-main [ACK] Seq=95570 Ack=2 Win=65535 Len=1448 TSV=2180635099 TSER=2180534575
    276 3.882084    127.0.0.1             127.0.0.1             TCP      35583 > commplex-main [ACK] Seq=95570 Ack=2 Win=65535 Len=1448 TSV=2180635099 TSER=2180534575
    277 3.882997    127.0.0.1             127.0.0.1             TCP      35583 > commplex-main [ACK] Seq=97018 Ack=2 Win=65535 Len=1448 TSV=2180655165 TSER=2180554648
    278 3.902158    127.0.0.1             127.0.0.1             TCP      35583 > commplex-main [ACK] Seq=97018 Ack=2 Win=65535 Len=1448 TSV=2180655165 TSER=2180554648
    279 3.903073    127.0.0.1             127.0.0.1             TCP      35583 > commplex-main [ACK] Seq=98466 Ack=2 Win=65535 Len=1448 TSV=2180675261 TSER=2180574786
    280 3.922238    127.0.0.1             127.0.0.1             TCP      35583 > commplex-main [ACK] Seq=98466 Ack=2 Win=65535 Len=1448 TSV=2180675261 TSER=2180574786
    281 3.923206    127.0.0.1             127.0.0.1             TCP      commplex-main > 35583 [ACK] Seq=2 Ack=92674 Win=65535 Len=0 TSV=2180695291 TSER=2180594958
    282 3.942364    127.0.0.1             127.0.0.1             TCP      commplex-main > 35583 [ACK] Seq=2 Ack=92674 Win=65535 Len=0 TSV=2180695291 TSER=2180594958
    283 3.943339    127.0.0.1             127.0.0.1             TCP      commplex-main > 35583 [ACK] Seq=2 Ack=94122 Win=65535 Len=0 TSV=2180715428 TSER=2180615092
    284 3.962460    127.0.0.1             127.0.0.1             TCP      commplex-main > 35583 [ACK] Seq=2 Ack=94122 Win=65535 Len=0 TSV=2180715428 TSER=2180615092
    285 3.963470    127.0.0.1             127.0.0.1             TCP      commplex-main > 35583 [ACK] Seq=2 Ack=95570 Win=65535 Len=0 TSV=2180735569 TSER=2180635092
    286 3.982636    127.0.0.1             127.0.0.1             TCP      commplex-main > 35583 [ACK] Seq=2 Ack=95570 Win=65535 Len=0 TSV=2180735569 TSER=2180635092
    287 3.983554    127.0.0.1             127.0.0.1             TCP      commplex-main > 35583 [ACK] Seq=2 Ack=97018 Win=65535 Len=0 TSV=2180755689 TSER=2180635099
    288 4.002726    127.0.0.1             127.0.0.1             TCP      commplex-main > 35583 [ACK] Seq=2 Ack=97018 Win=65535 Len=0 TSV=2180755689 TSER=2180635099
    289 4.003694    127.0.0.1             127.0.0.1             TCP      commplex-main > 35583 [ACK] Seq=2 Ack=98466 Win=65535 Len=0 TSV=2180775764 TSER=2180655165
    290 4.022846    127.0.0.1             127.0.0.1             TCP      commplex-main > 35583 [ACK] Seq=2 Ack=98466 Win=65535 Len=0 TSV=2180775764 TSER=2180655165
    291 4.023827    127.0.0.1             127.0.0.1             TCP      commplex-main > 35583 [ACK] Seq=2 Ack=99914 Win=65535 Len=0 TSV=2180795842 TSER=2180675261
    292 4.042983    127.0.0.1             127.0.0.1             TCP      commplex-main > 35583 [ACK] Seq=2 Ack=99914 Win=65535 Len=0 TSV=2180795842 TSER=2180675261
    293 4.043961    127.0.0.1             127.0.0.1             TCP      35583 > commplex-main [ACK] Seq=99914 Ack=2 Win=65535 Len=1448 TSV=2180816015 TSER=2180695291
    294 4.063122    127.0.0.1             127.0.0.1             TCP      35583 > commplex-main [ACK] Seq=99914 Ack=2 Win=65535 Len=1448 TSV=2180816015 TSER=2180695291
    295 4.064098    127.0.0.1             127.0.0.1             TCP      35583 > commplex-main [ACK] Seq=101362 Ack=2 Win=65535 Len=1448 TSV=2180836099 TSER=2180715428
    296 4.083260    127.0.0.1             127.0.0.1             TCP      35583 > commplex-main [ACK] Seq=101362 Ack=2 Win=65535 Len=1448 TSV=2180836099 TSER=2180715428
    297 4.084233    127.0.0.1             127.0.0.1             TCP      35583 > commplex-main [ACK] Seq=102810 Ack=2 Win=65535 Len=1448 TSV=2180856274 TSER=2180735569
    298 4.103392    127.0.0.1             127.0.0.1             TCP      35583 > commplex-main [ACK] Seq=102810 Ack=2 Win=65535 Len=1448 TSV=2180856274 TSER=2180735569
    299 4.104309    127.0.0.1             127.0.0.1             TCP      35583 > commplex-main [ACK] Seq=104258 Ack=2 Win=65535 Len=1448 TSV=2180876385 TSER=2180755689
    300 4.123460    127.0.0.1             127.0.0.1             TCP      35583 > commplex-main [ACK] Seq=104258 Ack=2 Win=65535 Len=1448 TSV=2180876385 TSER=2180755689
    301 4.124386    127.0.0.1             127.0.0.1             TCP      35583 > commplex-main [ACK] Seq=105706 Ack=2 Win=65535 Len=1448 TSV=2180876391 TSER=2180755689
    302 4.143493    127.0.0.1             127.0.0.1             TCP      35583 > commplex-main [ACK] Seq=105706 Ack=2 Win=65535 Len=1448 TSV=2180876391 TSER=2180755689
    303 4.144470    127.0.0.1             127.0.0.1             TCP      35583 > commplex-main [ACK] Seq=107154 Ack=2 Win=65535 Len=1448 TSV=2180896475 TSER=2180775764
    304 4.163626    127.0.0.1             127.0.0.1             TCP      35583 > commplex-main [ACK] Seq=107154 Ack=2 Win=65535 Len=1448 TSV=2180896475 TSER=2180775764
    305 4.164605    127.0.0.1             127.0.0.1             TCP      35583 > commplex-main [ACK] Seq=108602 Ack=2 Win=65535 Len=1448 TSV=2180916632 TSER=2180795842
    306 4.183763    127.0.0.1             127.0.0.1             TCP      35583 > commplex-main [ACK] Seq=108602 Ack=2 Win=65535 Len=1448 TSV=2180916632 TSER=2180795842
    307 4.184682    127.0.0.1             127.0.0.1             TCP      commplex-main > 35583 [ACK] Seq=2 Ack=101362 Win=65535 Len=0 TSV=2180936738 TSER=2180816015
    308 4.203844    127.0.0.1             127.0.0.1             TCP      commplex-main > 35583 [ACK] Seq=2 Ack=101362 Win=65535 Len=0 TSV=2180936738 TSER=2180816015
    309 4.204822    127.0.0.1             127.0.0.1             TCP      commplex-main > 35583 [ACK] Seq=2 Ack=102810 Win=65535 Len=0 TSV=2180956873 TSER=2180836099
    310 4.223933    127.0.0.1             127.0.0.1             TCP      commplex-main > 35583 [ACK] Seq=2 Ack=102810 Win=65535 Len=0 TSV=2180956873 TSER=2180836099
    311 4.224955    127.0.0.1             127.0.0.1             TCP      commplex-main > 35583 [ACK] Seq=2 Ack=104258 Win=65535 Len=0 TSV=2180977005 TSER=2180856274
    312 4.244114    127.0.0.1             127.0.0.1             TCP      commplex-main > 35583 [ACK] Seq=2 Ack=104258 Win=65535 Len=0 TSV=2180977005 TSER=2180856274
    313 4.245088    127.0.0.1             127.0.0.1             TCP      commplex-main > 35583 [ACK] Seq=2 Ack=105706 Win=65535 Len=0 TSV=2180997070 TSER=2180876385
    314 4.264243    127.0.0.1             127.0.0.1             TCP      commplex-main > 35583 [ACK] Seq=2 Ack=105706 Win=65535 Len=0 TSV=2180997070 TSER=2180876385
    315 4.265221    127.0.0.1             127.0.0.1             TCP      commplex-main > 35583 [ACK] Seq=2 Ack=107154 Win=65535 Len=0 TSV=2181017103 TSER=2180876391
    316 4.284379    127.0.0.1             127.0.0.1             TCP      commplex-main > 35583 [ACK] Seq=2 Ack=107154 Win=65535 Len=0 TSV=2181017103 TSER=2180876391
    317 4.285354    127.0.0.1             127.0.0.1             TCP      commplex-main > 35583 [ACK] Seq=2 Ack=108602 Win=65535 Len=0 TSV=2181037239 TSER=2180896475
    318 4.304466    127.0.0.1             127.0.0.1             TCP      commplex-main > 35583 [ACK] Seq=2 Ack=108602 Win=65535 Len=0 TSV=2181037239 TSER=2180896475
    319 4.305470    127.0.0.1             127.0.0.1             TCP      commplex-main > 35583 [ACK] Seq=2 Ack=110050 Win=65535 Len=0 TSV=2181057376 TSER=2180916632
    320 4.324578    127.0.0.1             127.0.0.1             TCP      commplex-main > 35583 [ACK] Seq=2 Ack=110050 Win=65535 Len=0 TSV=2181057376 TSER=2180916632
    321 4.325606    127.0.0.1             127.0.0.1             TCP      35583 > commplex-main [ACK] Seq=110050 Ack=2 Win=65535 Len=1448 TSV=2181077517 TSER=2180936738
    322 4.344719    127.0.0.1             127.0.0.1             TCP      35583 > commplex-main [ACK] Seq=110050 Ack=2 Win=65535 Len=1448 TSV=2181077517 TSER=2180936738
    323 4.345739    127.0.0.1             127.0.0.1             TCP      35583 > commplex-main [ACK] Seq=111498 Ack=2 Win=65535 Len=1448 TSV=2181097580 TSER=2180956873
    324 4.364897    127.0.0.1             127.0.0.1             TCP      35583 > commplex-main [ACK] Seq=111498 Ack=2 Win=65535 Len=1448 TSV=2181097580 TSER=2180956873
    325 4.365872    127.0.0.1             127.0.0.1             TCP      35583 > commplex-main [ACK] Seq=112946 Ack=2 Win=65535 Len=1448 TSV=2181117757 TSER=2180977005
    326 4.384976    127.0.0.1             127.0.0.1             TCP      35583 > commplex-main [ACK] Seq=112946 Ack=2 Win=65535 Len=1448 TSV=2181117757 TSER=2180977005
    327 4.386015    127.0.0.1             127.0.0.1             TCP      35583 > commplex-main [ACK] Seq=114394 Ack=2 Win=65535 Len=1448 TSV=2181137887 TSER=2180997070
    328 4.405200    127.0.0.1             127.0.0.1             TCP      35583 > commplex-main [ACK] Seq=114394 Ack=2 Win=65535 Len=1448 TSV=2181137887 TSER=2180997070
    329 4.406096    127.0.0.1             127.0.0.1             TCP      35583 > commplex-main [ACK] Seq=115842 Ack=2 Win=65535 Len=1448 TSV=2181158024 TSER=2181017103
    330 4.425269    127.0.0.1             127.0.0.1             TCP      35583 > commplex-main [ACK] Seq=115842 Ack=2 Win=65535 Len=1448 TSV=2181158024 TSER=2181017103
    331 4.426233    127.0.0.1             127.0.0.1             TCP      35583 > commplex-main [ACK] Seq=117290 Ack=2 Win=65535 Len=1448 TSV=2181178115 TSER=2181037239
    332 4.445400    127.0.0.1             127.0.0.1             TCP      35583 > commplex-main [ACK] Seq=117290 Ack=2 Win=65535 Len=1448 TSV=2181178115 TSER=2181037239
    333 4.446289    127.0.0.1             127.0.0.1             TCP      35583 > commplex-main [ACK] Seq=118738 Ack=2 Win=65535 Len=1448 TSV=2181178121 TSER=2181037239
    334 4.465448    127.0.0.1             127.0.0.1             TCP      35583 > commplex-main [ACK] Seq=118738 Ack=2 Win=65535 Len=1448 TSV=2181178121 TSER=2181037239
    335 4.466364    127.0.0.1             127.0.0.1             TCP      35583 > commplex-main [ACK] Seq=120186 Ack=2 Win=65535 Len=1448 TSV=2181198220 TSER=2181057376
    336 4.485472    127.0.0.1             127.0.0.1             TCP      35583 > commplex-main [ACK] Seq=120186 Ack=2 Win=65535 Len=1448 TSV=2181198220 TSER=2181057376
    337 4.486440    127.0.0.1             127.0.0.1             TCP      commplex-main > 35583 [ACK] Seq=2 Ack=111498 Win=65535 Len=0 TSV=2181218328 TSER=2181077517
    338 4.505607    127.0.0.1             127.0.0.1             TCP      commplex-main > 35583 [ACK] Seq=2 Ack=111498 Win=65535 Len=0 TSV=2181218328 TSER=2181077517
    339 4.506526    127.0.0.1             127.0.0.1             TCP      commplex-main > 35583 [ACK] Seq=2 Ack=112946 Win=65535 Len=0 TSV=2181238501 TSER=2181097580
    340 4.525691    127.0.0.1             127.0.0.1             TCP      commplex-main > 35583 [ACK] Seq=2 Ack=112946 Win=65535 Len=0 TSV=2181238501 TSER=2181097580
    341 4.526659    127.0.0.1             127.0.0.1             TCP      commplex-main > 35583 [ACK] Seq=2 Ack=114394 Win=65535 Len=0 TSV=2181258592 TSER=2181117757
    342 4.545828    127.0.0.1             127.0.0.1             TCP      commplex-main > 35583 [ACK] Seq=2 Ack=114394 Win=65535 Len=0 TSV=2181258592 TSER=2181117757
    343 4.546792    127.0.0.1             127.0.0.1             TCP      commplex-main > 35583 [ACK] Seq=2 Ack=115842 Win=65535 Len=0 TSV=2181278814 TSER=2181137887
    344 4.565960    127.0.0.1             127.0.0.1             TCP      commplex-main > 35583 [ACK] Seq=2 Ack=115842 Win=65535 Len=0 TSV=2181278814 TSER=2181137887
    345 4.566924    127.0.0.1             127.0.0.1             TCP      commplex-main > 35583 [ACK] Seq=2 Ack=117290 Win=65535 Len=0 TSV=2181298875 TSER=2181158024
    346 4.586087    127.0.0.1             127.0.0.1             TCP      commplex-main > 35583 [ACK] Seq=2 Ack=117290 Win=65535 Len=0 TSV=2181298875 TSER=2181158024
    347 4.586998    127.0.0.1             127.0.0.1             TCP      commplex-main > 35583 [ACK] Seq=2 Ack=118738 Win=65535 Len=0 TSV=2181319008 TSER=2181178115
    348 4.606112    127.0.0.1             127.0.0.1             TCP      commplex-main > 35583 [ACK] Seq=2 Ack=118738 Win=65535 Len=0 TSV=2181319008 TSER=2181178115
    349 4.607135    127.0.0.1             127.0.0.1             TCP      commplex-main > 35583 [ACK] Seq=2 Ack=120186 Win=65535 Len=0 TSV=2181339065 TSER=2181178121
    350 4.626303    127.0.0.1             127.0.0.1             TCP      commplex-main > 35583 [ACK] Seq=2 Ack=120186 Win=65535 Len=0 TSV=2181339065 TSER=2181178121
    351 4.627269    127.0.0.1             127.0.0.1             TCP      commplex-main > 35583 [ACK] Seq=2 Ack=121634 Win=65535 Len=0 TSV=2181359080 TSER=2181198220
    352 4.646428    127.0.0.1             127.0.0.1             TCP      commplex-main > 35583 [ACK] Seq=2 Ack=121634 Win=65535 Len=0 TSV=2181359080 TSER=2181198220
    353 4.647403    127.0.0.1             127.0.0.1             TCP      35583 > commplex-main [ACK] Seq=121634 Ack=2 Win=65535 Len=1448 TSV=2181379281 TSER=2181218328
    354 4.666514    127.0.0.1             127.0.0.1             TCP      35583 > commplex-main [ACK] Seq=121634 Ack=2 Win=65535 Len=1448 TSV=2181379281 TSER=2181218328
    355 4.667874    127.0.0.1             127.0.0.1             TCP      35583 > commplex-main [ACK] Seq=123082 Ack=2 Win=65535 Len=1448 TSV=2181399329 TSER=2181238501
    356 4.687026    127.0.0.1             127.0.0.1             TCP      35583 > commplex-main [ACK] Seq=123082 Ack=2 Win=65535 Len=1448 TSV=2181399329 TSER=2181238501
    357 4.688007    127.0.0.1             127.0.0.1             TCP      35583 > commplex-main [ACK] Seq=124530 Ack=2 Win=65535 Len=1448 TSV=2181419465 TSER=2181258592
    358 4.707162    127.0.0.1             127.0.0.1             TCP      35583 > commplex-main [ACK] Seq=124530 Ack=2 Win=65535 Len=1448 TSV=2181419465 TSER=2181258592
    359 4.708143    127.0.0.1             127.0.0.1             TCP      35583 > commplex-main [ACK] Seq=125978 Ack=2 Win=65535 Len=1448 TSV=2181439596 TSER=2181278814
    360 4.727303    127.0.0.1             127.0.0.1             TCP      35583 > commplex-main [ACK] Seq=125978 Ack=2 Win=65535 Len=1448 TSV=2181439596 TSER=2181278814
    361 4.728220    127.0.0.1             127.0.0.1             TCP      35583 > commplex-main [ACK] Seq=127426 Ack=2 Win=65535 Len=1448 TSV=2181459728 TSER=2181298875
    362 4.747381    127.0.0.1             127.0.0.1             TCP      35583 > commplex-main [ACK] Seq=127426 Ack=2 Win=65535 Len=1448 TSV=2181459728 TSER=2181298875
    363 4.748296    127.0.0.1             127.0.0.1             TCP      35583 > commplex-main [ACK] Seq=128874 Ack=2 Win=65535 Len=1448 TSV=2181479773 TSER=2181319008
    364 4.767458    127.0.0.1             127.0.0.1             TCP      35583 > commplex-main [ACK] Seq=128874 Ack=2 Win=65535 Len=1448 TSV=2181479773 TSER=2181319008
    365 4.768370    127.0.0.1             127.0.0.1             TCP      35583 > commplex-main [ACK] Seq=130322 Ack=2 Win=65535 Len=1448 TSV=2181499951 TSER=2181339065
    366 4.787473    127.0.0.1             127.0.0.1             TCP      35583 > commplex-main [ACK] Seq=130322 Ack=2 Win=65535 Len=1448 TSV=2181499951 TSER=2181339065
    367 4.788447    127.0.0.1             127.0.0.1             TCP      35583 > commplex-main [ACK] Seq=131770 Ack=2 Win=65535 Len=1448 TSV=2181499957 TSER=2181339065
    368 4.807557    127.0.0.1             127.0.0.1             TCP      35583 > commplex-main [ACK] Seq=131770 Ack=2 Win=65535 Len=1448 TSV=2181499957 TSER=2181339065
    369 4.808523    127.0.0.1             127.0.0.1             TCP      35583 > commplex-main [ACK] Seq=133218 Ack=2 Win=65535 Len=1448 TSV=2181520073 TSER=2181359080
    370 4.827681    127.0.0.1             127.0.0.1             TCP      35583 > commplex-main [ACK] Seq=133218 Ack=2 Win=65535 Len=1448 TSV=2181520073 TSER=2181359080
    371 4.828658    127.0.0.1             127.0.0.1             TCP      commplex-main > 35583 [ACK] Seq=2 Ack=123082 Win=65535 Len=0 TSV=2181540129 TSER=2181379281
    372 4.847818    127.0.0.1             127.0.0.1             TCP      commplex-main > 35583 [ACK] Seq=2 Ack=123082 Win=65535 Len=0 TSV=2181540129 TSER=2181379281
    373 4.848792    127.0.0.1             127.0.0.1             TCP      commplex-main > 35583 [ACK] Seq=2 Ack=124530 Win=65535 Len=0 TSV=2181560639 TSER=2181399329
    374 4.867955    127.0.0.1             127.0.0.1             TCP      commplex-main > 35583 [ACK] Seq=2 Ack=124530 Win=65535 Len=0 TSV=2181560639 TSER=2181399329
    375 4.868930    127.0.0.1             127.0.0.1             TCP      commplex-main > 35583 [ACK] Seq=2 Ack=125978 Win=65535 Len=0 TSV=2181580772 TSER=2181419465
    376 4.888086    127.0.0.1             127.0.0.1             TCP      commplex-main > 35583 [ACK] Seq=2 Ack=125978 Win=65535 Len=0 TSV=2181580772 TSER=2181419465
    377 4.889063    127.0.0.1             127.0.0.1             TCP      commplex-main > 35583 [ACK] Seq=2 Ack=127426 Win=65535 Len=0 TSV=2181600919 TSER=2181439596
    378 4.908224    127.0.0.1             127.0.0.1             TCP      commplex-main > 35583 [ACK] Seq=2 Ack=127426 Win=65535 Len=0 TSV=2181600919 TSER=2181439596
    379 4.909196    127.0.0.1             127.0.0.1             TCP      commplex-main > 35583 [ACK] Seq=2 Ack=128874 Win=65535 Len=0 TSV=2181620994 TSER=2181459728
    380 4.928351    127.0.0.1             127.0.0.1             TCP      commplex-main > 35583 [ACK] Seq=2 Ack=128874 Win=65535 Len=0 TSV=2181620994 TSER=2181459728
    381 4.929330    127.0.0.1             127.0.0.1             TCP      commplex-main > 35583 [ACK] Seq=2 Ack=130322 Win=65535 Len=0 TSV=2181641070 TSER=2181479773
    382 4.948457    127.0.0.1             127.0.0.1             TCP      commplex-main > 35583 [ACK] Seq=2 Ack=130322 Win=65535 Len=0 TSV=2181641070 TSER=2181479773
    383 4.949463    127.0.0.1             127.0.0.1             TCP      commplex-main > 35583 [ACK] Seq=2 Ack=131770 Win=65535 Len=0 TSV=2181661087 TSER=2181499951
    384 4.968617    127.0.0.1             127.0.0.1             TCP      commplex-main > 35583 [ACK] Seq=2 Ack=131770 Win=65535 Len=0 TSV=2181661087 TSER=2181499951
    385 4.969597    127.0.0.1             127.0.0.1             TCP      commplex-main > 35583 [ACK] Seq=2 Ack=133218 Win=65535 Len=0 TSV=2181681177 TSER=2181499957
    386 4.988703    127.0.0.1             127.0.0.1             TCP      commplex-main > 35583 [ACK] Seq=2 Ack=133218 Win=65535 Len=0 TSV=2181681177 TSER=2181499957
    387 4.989682    127.0.0.1             127.0.0.1             TCP      commplex-main > 35583 [ACK] Seq=2 Ack=134666 Win=65535 Len=0 TSV=2181701293 TSER=2181520073
    388 5.008839    127.0.0.1             127.0.0.1             TCP      commplex-main > 35583 [ACK] Seq=2 Ack=134666 Win=65535 Len=0 TSV=2181701293 TSER=2181520073
    389 5.009820    127.0.0.1             127.0.0.1             TCP      35583 > commplex-main [ACK] Seq=134666 Ack=2 Win=65535 Len=1448 TSV=2181721495 TSER=2181540129
    390 5.028934    127.0.0.1             127.0.0.1             TCP      35583 > commplex-main [ACK] Seq=134666 Ack=2 Win=65535 Len=1448 TSV=2181721495 TSER=2181540129
    391 5.029901    127.0.0.1             127.0.0.1             TCP      35583 > commplex-main [ACK] Seq=136114 Ack=2 Win=65535 Len=1448 TSV=2181741600 TSER=2181560639
    392 5.049064    127.0.0.1             127.0.0.1             TCP      35583 > commplex-main [ACK] Seq=136114 Ack=2 Win=65535 Len=1448 TSV=2181741600 TSER=2181560639
    393 5.050040    127.0.0.1             127.0.0.1             TCP      35583 > commplex-main [ACK] Seq=137562 Ack=2 Win=65535 Len=1448 TSV=2181761733 TSER=2181580772
    394 5.069215    127.0.0.1             127.0.0.1             TCP      35583 > commplex-main [ACK] Seq=137562 Ack=2 Win=65535 Len=1448 TSV=2181761733 TSER=2181580772
    395 5.070178    127.0.0.1             127.0.0.1             TCP      35583 > commplex-main [ACK] Seq=139010 Ack=2 Win=65535 Len=1448 TSV=2181781866 TSER=2181600919
    396 5.089348    127.0.0.1             127.0.0.1             TCP      35583 > commplex-main [ACK] Seq=139010 Ack=2 Win=65535 Len=1448 TSV=2181781866 TSER=2181600919
    397 5.090270    127.0.0.1             127.0.0.1             TCP      35583 > commplex-main [ACK] Seq=140458 Ack=2 Win=65535 Len=1448 TSV=2181801993 TSER=2181620994
    398 5.109425    127.0.0.1             127.0.0.1             TCP      35583 > commplex-main [ACK] Seq=140458 Ack=2 Win=65535 Len=1448 TSV=2181801993 TSER=2181620994
    399 5.110349    127.0.0.1             127.0.0.1             TCP      35583 > commplex-main [ACK] Seq=141906 Ack=2 Win=65535 Len=1448 TSV=2181822097 TSER=2181641070
    400 5.129457    127.0.0.1             127.0.0.1             TCP      35583 > commplex-main [ACK] Seq=141906 Ack=2 Win=65535 Len=1448 TSV=2181822097 TSER=2181641070
    401 5.130427    127.0.0.1             127.0.0.1             TCP      35583 > commplex-main [ACK] Seq=143354 Ack=2 Win=65535 Len=1448 TSV=2181842258 TSER=2181661087
    402 5.149595    127.0.0.1             127.0.0.1             TCP      35583 > commplex-main [ACK] Seq=143354 Ack=2 Win=65535 Len=1448 TSV=2181842258 TSER=2181661087
    403 5.150507    127.0.0.1             127.0.0.1             TCP      35583 > commplex-main [ACK] Seq=144802 Ack=2 Win=65535 Len=1448 TSV=2181862415 TSER=2181681177
    404 5.169672    127.0.0.1             127.0.0.1             TCP      35583 > commplex-main [ACK] Seq=144802 Ack=2 Win=65535 Len=1448 TSV=2181862415 TSER=2181681177
    405 5.170645    127.0.0.1             127.0.0.1             TCP      35583 > commplex-main [ACK] Seq=146250 Ack=2 Win=65535 Len=1448 TSV=2181882502 TSER=2181701293
    406 5.189810    127.0.0.1             127.0.0.1             TCP      35583 > commplex-main [ACK] Seq=146250 Ack=2 Win=65535 Len=1448 TSV=2181882502 TSER=2181701293
    407 5.190779    127.0.0.1             127.0.0.1             TCP      35583 > commplex-main [ACK] Seq=147698 Ack=2 Win=65535 Len=1448 TSV=2181882508 TSER=2181701293
    408 5.209941    127.0.0.1             127.0.0.1             TCP      35583 > commplex-main [ACK] Seq=147698 Ack=2 Win=65535 Len=1448 TSV=2181882508 TSER=2181701293
    409 5.210863    127.0.0.1             127.0.0.1             TCP      commplex-main > 35583 [ACK] Seq=2 Ack=136114 Win=65535 Len=0 TSV=2181902534 TSER=2181721495
    410 5.229996    127.0.0.1             127.0.0.1             TCP      commplex-main > 35583 [ACK] Seq=2 Ack=136114 Win=65535 Len=0 TSV=2181902534 TSER=2181721495
    411 5.230940    127.0.0.1             127.0.0.1             TCP      commplex-main > 35583 [ACK] Seq=2 Ack=137562 Win=65535 Len=0 TSV=2181922684 TSER=2181741600
    412 5.250053    127.0.0.1             127.0.0.1             TCP      commplex-main > 35583 [ACK] Seq=2 Ack=137562 Win=65535 Len=0 TSV=2181922684 TSER=2181741600
    413 5.251076    127.0.0.1             127.0.0.1             TCP      commplex-main > 35583 [ACK] Seq=2 Ack=139010 Win=65535 Len=0 TSV=2181942823 TSER=2181761733
    414 5.270244    127.0.0.1             127.0.0.1             TCP      commplex-main > 35583 [ACK] Seq=2 Ack=139010 Win=65535 Len=0 TSV=2181942823 TSER=2181761733
    415 5.271159    127.0.0.1             127.0.0.1             TCP      commplex-main > 35583 [ACK] Seq=2 Ack=140458 Win=65535 Len=0 TSV=2181962956 TSER=2181781866
    416 5.290315    127.0.0.1             127.0.0.1             TCP      commplex-main > 35583 [ACK] Seq=2 Ack=140458 Win=65535 Len=0 TSV=2181962956 TSER=2181781866
    417 5.291293    127.0.0.1             127.0.0.1             TCP      commplex-main > 35583 [ACK] Seq=2 Ack=141906 Win=65535 Len=0 TSV=2181983031 TSER=2181801993
    418 5.310453    127.0.0.1             127.0.0.1             TCP      commplex-main > 35583 [ACK] Seq=2 Ack=141906 Win=65535 Len=0 TSV=2181983031 TSER=2181801993
    419 5.311375    127.0.0.1             127.0.0.1             TCP      commplex-main > 35583 [ACK] Seq=2 Ack=143354 Win=65535 Len=0 TSV=2182003061 TSER=2181822097
    420 5.330472    127.0.0.1             127.0.0.1             TCP      commplex-main > 35583 [ACK] Seq=2 Ack=143354 Win=65535 Len=0 TSV=2182003061 TSER=2181822097
    421 5.331468    127.0.0.1             127.0.0.1             TCP      commplex-main > 35583 [ACK] Seq=2 Ack=144802 Win=65535 Len=0 TSV=2182023203 TSER=2181842258
    422 5.350598    127.0.0.1             127.0.0.1             TCP      commplex-main > 35583 [ACK] Seq=2 Ack=144802 Win=65535 Len=0 TSV=2182023203 TSER=2181842258
    423 5.351520    127.0.0.1             127.0.0.1             TCP      commplex-main > 35583 [ACK] Seq=2 Ack=146250 Win=65535 Len=0 TSV=2182043279 TSER=2181862415
    424 5.370622    127.0.0.1             127.0.0.1             TCP      commplex-main > 35583 [ACK] Seq=2 Ack=146250 Win=65535 Len=0 TSV=2182043279 TSER=2181862415
    425 5.371596    127.0.0.1             127.0.0.1             TCP      commplex-main > 35583 [ACK] Seq=2 Ack=147698 Win=65535 Len=0 TSV=2182063414 TSER=2181882502
    426 5.390757    127.0.0.1             127.0.0.1             TCP      commplex-main > 35583 [ACK] Seq=2 Ack=147698 Win=65535 Len=0 TSV=2182063414 TSER=2181882502
    427 5.391676    127.0.0.1             127.0.0.1             TCP      commplex-main > 35583 [ACK] Seq=2 Ack=149146 Win=65535 Len=0 TSV=2182083558 TSER=2181882508
    428 5.410851    127.0.0.1             127.0.0.1             TCP      commplex-main > 35583 [ACK] Seq=2 Ack=149146 Win=65535 Len=0 TSV=2182083558 TSER=2181882508
    429 5.411814    127.0.0.1             127.0.0.1             TCP      35583 > commplex-main [ACK] Seq=149146 Ack=2 Win=65535 Len=1448 TSV=2182103663 TSER=2181902534
    430 5.430978    127.0.0.1             127.0.0.1             TCP      35583 > commplex-main [ACK] Seq=149146 Ack=2 Win=65535 Len=1448 TSV=2182103663 TSER=2181902534
    431 5.431952    127.0.0.1             127.0.0.1             TCP      35583 > commplex-main [ACK] Seq=150594 Ack=2 Win=65535 Len=1448 TSV=2182123703 TSER=2181922684
    432 5.451116    127.0.0.1             127.0.0.1             TCP      35583 > commplex-main [ACK] Seq=150594 Ack=2 Win=65535 Len=1448 TSV=2182123703 TSER=2181922684
    433 5.452086    127.0.0.1             127.0.0.1             TCP      35583 > commplex-main [ACK] Seq=152042 Ack=2 Win=65535 Len=1448 TSV=2182143888 TSER=2181942823
    434 5.471242    127.0.0.1             127.0.0.1             TCP      35583 > commplex-main [ACK] Seq=152042 Ack=2 Win=65535 Len=1448 TSV=2182143888 TSER=2181942823
    435 5.472221    127.0.0.1             127.0.0.1             TCP      35583 > commplex-main [ACK] Seq=153490 Ack=2 Win=65535 Len=1448 TSV=2182163960 TSER=2181962956
    436 5.491380    127.0.0.1             127.0.0.1             TCP      35583 > commplex-main [ACK] Seq=153490 Ack=2 Win=65535 Len=1448 TSV=2182163960 TSER=2181962956
    437 5.492357    127.0.0.1             127.0.0.1             TCP      35583 > commplex-main [ACK] Seq=154938 Ack=2 Win=65535 Len=1448 TSV=2182184087 TSER=2181983031
    438 5.511467    127.0.0.1             127.0.0.1             TCP      35583 > commplex-main [ACK] Seq=154938 Ack=2 Win=65535 Len=1448 TSV=2182184087 TSER=2181983031
    439 5.512443    127.0.0.1             127.0.0.1             TCP      35583 > commplex-main [ACK] Seq=156386 Ack=2 Win=65535 Len=1448 TSV=2182204110 TSER=2182003061
    440 5.531599    127.0.0.1             127.0.0.1             TCP      35583 > commplex-main [ACK] Seq=156386 Ack=2 Win=65535 Len=1448 TSV=2182204110 TSER=2182003061
    441 5.532522    127.0.0.1             127.0.0.1             TCP      35583 > commplex-main [ACK] Seq=157834 Ack=2 Win=65535 Len=1448 TSV=2182224230 TSER=2182023203
    442 5.551681    127.0.0.1             127.0.0.1             TCP      35583 > commplex-main [ACK] Seq=157834 Ack=2 Win=65535 Len=1448 TSV=2182224230 TSER=2182023203
    443 5.552596    127.0.0.1             127.0.0.1             TCP      35583 > commplex-main [ACK] Seq=159282 Ack=2 Win=65535 Len=1448 TSV=2182244257 TSER=2182043279
    444 5.571692    127.0.0.1             127.0.0.1             TCP      35583 > commplex-main [ACK] Seq=159282 Ack=2 Win=65535 Len=1448 TSV=2182244257 TSER=2182043279
    445 5.572730    127.0.0.1             127.0.0.1             TCP      35583 > commplex-main [ACK] Seq=160730 Ack=2 Win=65535 Len=1448 TSV=2182264432 TSER=2182063414
    446 5.591827    127.0.0.1             127.0.0.1             TCP      35583 > commplex-main [ACK] Seq=160730 Ack=2 Win=65535 Len=1448 TSV=2182264432 TSER=2182063414
    447 5.592817    127.0.0.1             127.0.0.1             TCP      35583 > commplex-main [ACK] Seq=162178 Ack=2 Win=65535 Len=1448 TSV=2182284508 TSER=2182083558
    448 5.611968    127.0.0.1             127.0.0.1             TCP      35583 > commplex-main [ACK] Seq=162178 Ack=2 Win=65535 Len=1448 TSV=2182284508 TSER=2182083558
    449 5.612953    127.0.0.1             127.0.0.1             TCP      35583 > commplex-main [ACK] Seq=163626 Ack=2 Win=65535 Len=1448 TSV=2182284514 TSER=2182083558
    450 5.632053    127.0.0.1             127.0.0.1             TCP      35583 > commplex-main [ACK] Seq=163626 Ack=2 Win=65535 Len=1448 TSV=2182284514 TSER=2182083558
    451 5.633029    127.0.0.1             127.0.0.1             TCP      commplex-main > 35583 [ACK] Seq=2 Ack=150594 Win=65535 Len=0 TSV=2182304597 TSER=2182103663
    452 5.652191    127.0.0.1             127.0.0.1             TCP      commplex-main > 35583 [ACK] Seq=2 Ack=150594 Win=65535 Len=0 TSV=2182304597 TSER=2182103663
    453 5.653106    127.0.0.1             127.0.0.1             TCP      commplex-main > 35583 [ACK] Seq=2 Ack=152042 Win=65535 Len=0 TSV=2182324734 TSER=2182123703
    454 5.672262    127.0.0.1             127.0.0.1             TCP      commplex-main > 35583 [ACK] Seq=2 Ack=152042 Win=65535 Len=0 TSV=2182324734 TSER=2182123703
    455 5.673181    127.0.0.1             127.0.0.1             TCP      commplex-main > 35583 [ACK] Seq=2 Ack=153490 Win=65535 Len=0 TSV=2182344858 TSER=2182143888
    456 5.692330    127.0.0.1             127.0.0.1             TCP      commplex-main > 35583 [ACK] Seq=2 Ack=153490 Win=65535 Len=0 TSV=2182344858 TSER=2182143888
    457 5.693314    127.0.0.1             127.0.0.1             TCP      commplex-main > 35583 [ACK] Seq=2 Ack=154938 Win=65535 Len=0 TSV=2182364997 TSER=2182163960
    458 5.712456    127.0.0.1             127.0.0.1             TCP      commplex-main > 35583 [ACK] Seq=2 Ack=154938 Win=65535 Len=0 TSV=2182364997 TSER=2182163960
    459 5.713448    127.0.0.1             127.0.0.1             TCP      commplex-main > 35583 [ACK] Seq=2 Ack=156386 Win=65535 Len=0 TSV=2182385077 TSER=2182184087
    460 5.732605    127.0.0.1             127.0.0.1             TCP      commplex-main > 35583 [ACK] Seq=2 Ack=156386 Win=65535 Len=0 TSV=2182385077 TSER=2182184087
    461 5.733530    127.0.0.1             127.0.0.1             TCP      commplex-main > 35583 [ACK] Seq=2 Ack=157834 Win=65535 Len=0 TSV=2182405212 TSER=2182204110
    462 5.752691    127.0.0.1             127.0.0.1             TCP      commplex-main > 35583 [ACK] Seq=2 Ack=157834 Win=65535 Len=0 TSV=2182405212 TSER=2182204110
    463 5.753663    127.0.0.1             127.0.0.1             TCP      commplex-main > 35583 [ACK] Seq=2 Ack=159282 Win=65535 Len=0 TSV=2182425292 TSER=2182224230
    464 5.772823    127.0.0.1             127.0.0.1             TCP      commplex-main > 35583 [ACK] Seq=2 Ack=159282 Win=65535 Len=0 TSV=2182425292 TSER=2182224230
    465 5.773797    127.0.0.1             127.0.0.1             TCP      commplex-main > 35583 [ACK] Seq=2 Ack=160730 Win=65535 Len=0 TSV=2182445304 TSER=2182244257
    466 5.792892    127.0.0.1             127.0.0.1             TCP      commplex-main > 35583 [ACK] Seq=2 Ack=160730 Win=65535 Len=0 TSV=2182445304 TSER=2182244257
    467 5.793873    127.0.0.1             127.0.0.1             TCP      commplex-main > 35583 [ACK] Seq=2 Ack=162178 Win=65535 Len=0 TSV=2182465434 TSER=2182264432
    468 5.813023    127.0.0.1             127.0.0.1             TCP      commplex-main > 35583 [ACK] Seq=2 Ack=162178 Win=65535 Len=0 TSV=2182465434 TSER=2182264432
    469 5.814007    127.0.0.1             127.0.0.1             TCP      commplex-main > 35583 [ACK] Seq=2 Ack=163626 Win=65535 Len=0 TSV=2182485582 TSER=2182284508
    470 5.833164    127.0.0.1             127.0.0.1             TCP      commplex-main > 35583 [ACK] Seq=2 Ack=163626 Win=65535 Len=0 TSV=2182485582 TSER=2182284508
    471 5.834141    127.0.0.1             127.0.0.1             TCP      commplex-main > 35583 [ACK] Seq=2 Ack=165074 Win=65535 Len=0 TSV=2182505661 TSER=2182284514
    472 5.853301    127.0.0.1             127.0.0.1             TCP      commplex-main > 35583 [ACK] Seq=2 Ack=165074 Win=65535 Len=0 TSV=2182505661 TSER=2182284514
    473 5.854276    127.0.0.1             127.0.0.1             TCP      35583 > commplex-main [ACK] Seq=165074 Ack=2 Win=65535 Len=1448 TSV=2182525855 TSER=2182304597
    474 5.873436    127.0.0.1             127.0.0.1             TCP      35583 > commplex-main [ACK] Seq=165074 Ack=2 Win=65535 Len=1448 TSV=2182525855 TSER=2182304597
    475 5.874356    127.0.0.1             127.0.0.1             TCP      35583 > commplex-main [ACK] Seq=166522 Ack=2 Win=65535 Len=1448 TSV=2182545906 TSER=2182324734
    476 5.893463    127.0.0.1             127.0.0.1             TCP      35583 > commplex-main [ACK] Seq=166522 Ack=2 Win=65535 Len=1448 TSV=2182545906 TSER=2182324734
    477 5.894429    127.0.0.1             127.0.0.1             TCP      35583 > commplex-main [ACK] Seq=167970 Ack=2 Win=65535 Len=1448 TSV=2182565975 TSER=2182344858
    478 5.913583    127.0.0.1             127.0.0.1             TCP      35583 > commplex-main [ACK] Seq=167970 Ack=2 Win=65535 Len=1448 TSV=2182565975 TSER=2182344858
    479 5.914506    127.0.0.1             127.0.0.1             TCP      35583 > commplex-main [ACK] Seq=169418 Ack=2 Win=65535 Len=1448 TSV=2182586096 TSER=2182364997
    480 5.933662    127.0.0.1             127.0.0.1             TCP      35583 > commplex-main [ACK] Seq=169418 Ack=2 Win=65535 Len=1448 TSV=2182586096 TSER=2182364997
    481 5.934583    127.0.0.1             127.0.0.1             TCP      35583 > commplex-main [ACK] Seq=170866 Ack=2 Win=65535 Len=1448 TSV=2182606269 TSER=2182385077
    482 5.953738    127.0.0.1             127.0.0.1             TCP      35583 > commplex-main [ACK] Seq=170866 Ack=2 Win=65535 Len=1448 TSV=2182606269 TSER=2182385077
    483 5.954730    127.0.0.1             127.0.0.1             TCP      35583 > commplex-main [ACK] Seq=172314 Ack=2 Win=65535 Len=1448 TSV=2182626333 TSER=2182405212
    484 5.973884    127.0.0.1             127.0.0.1             TCP      35583 > commplex-main [ACK] Seq=172314 Ack=2 Win=65535 Len=1448 TSV=2182626333 TSER=2182405212
    485 5.974868    127.0.0.1             127.0.0.1             TCP      35583 > commplex-main [ACK] Seq=173762 Ack=2 Win=65535 Len=1448 TSV=2182646469 TSER=2182425292
    486 5.994023    127.0.0.1             127.0.0.1             TCP      35583 > commplex-main [ACK] Seq=173762 Ack=2 Win=65535 Len=1448 TSV=2182646469 TSER=2182425292
    487 5.994952    127.0.0.1             127.0.0.1             TCP      35583 > commplex-main [ACK] Seq=175210 Ack=2 Win=65535 Len=1448 TSV=2182666533 TSER=2182445304
    488 6.014104    127.0.0.1             127.0.0.1             TCP      35583 > commplex-main [ACK] Seq=175210 Ack=2 Win=65535 Len=1448 TSV=2182666533 TSER=2182445304
    489 6.015031    127.0.0.1             127.0.0.1             TCP      35583 > commplex-main [ACK] Seq=176658 Ack=2 Win=65535 Len=1448 TSV=2182686665 TSER=2182465434
    490 6.034188    127.0.0.1             127.0.0.1             TCP      35583 > commplex-main [ACK] Seq=176658 Ack=2 Win=65535 Len=1448 TSV=2182686665 TSER=2182465434
    491 6.035168    127.0.0.1             127.0.0.1             TCP      35583 > commplex-main [ACK] Seq=178106 Ack=2 Win=65535 Len=1448 TSV=2182706807 TSER=2182485582
    492 6.054331    127.0.0.1             127.0.0.1             TCP      35583 > commplex-main [ACK] Seq=178106 Ack=2 Win=65535 Len=1448 TSV=2182706807 TSER=2182485582
    493 6.055244    127.0.0.1             127.0.0.1             TCP      35583 > commplex-main [ACK] Seq=179554 Ack=2 Win=65535 Len=1448 TSV=2182726944 TSER=2182505661
    494 6.074402    127.0.0.1             127.0.0.1             TCP      35583 > commplex-main [ACK] Seq=179554 Ack=2 Win=65535 Len=1448 TSV=2182726944 TSER=2182505661
    495 6.075380    127.0.0.1             127.0.0.1             TCP      commplex-main > 35583 [ACK] Seq=2 Ack=166522 Win=65535 Len=0 TSV=2182747043 TSER=2182525855
    496 6.094485    127.0.0.1             127.0.0.1             TCP      commplex-main > 35583 [ACK] Seq=2 Ack=166522 Win=65535 Len=0 TSV=2182747043 TSER=2182525855
    497 6.095466    127.0.0.1             127.0.0.1             TCP      commplex-main > 35583 [ACK] Seq=2 Ack=167970 Win=65535 Len=0 TSV=2182767065 TSER=2182545906
    498 6.114626    127.0.0.1             127.0.0.1             TCP      commplex-main > 35583 [ACK] Seq=2 Ack=167970 Win=65535 Len=0 TSV=2182767065 TSER=2182545906
    499 6.115599    127.0.0.1             127.0.0.1             TCP      commplex-main > 35583 [ACK] Seq=2 Ack=169418 Win=65535 Len=0 TSV=2182787195 TSER=2182565975
    500 6.134758    127.0.0.1             127.0.0.1             TCP      commplex-main > 35583 [ACK] Seq=2 Ack=169418 Win=65535 Len=0 TSV=2182787195 TSER=2182565975
    501 6.135733    127.0.0.1             127.0.0.1             TCP      commplex-main > 35583 [ACK] Seq=2 Ack=170866 Win=65535 Len=0 TSV=2182807274 TSER=2182586096
    502 6.154900    127.0.0.1             127.0.0.1             TCP      commplex-main > 35583 [ACK] Seq=2 Ack=170866 Win=65535 Len=0 TSV=2182807274 TSER=2182586096
    503 6.155867    127.0.0.1             127.0.0.1             TCP      commplex-main > 35583 [ACK] Seq=2 Ack=172314 Win=65535 Len=0 TSV=2182827348 TSER=2182606269
    504 6.175034    127.0.0.1             127.0.0.1             TCP      commplex-main > 35583 [ACK] Seq=2 Ack=172314 Win=65535 Len=0 TSV=2182827348 TSER=2182606269
    505 6.176000    127.0.0.1             127.0.0.1             TCP      commplex-main > 35583 [ACK] Seq=2 Ack=173762 Win=65535 Len=0 TSV=2182847495 TSER=2182626333
    506 6.195163    127.0.0.1             127.0.0.1             TCP      commplex-main > 35583 [ACK] Seq=2 Ack=173762 Win=65535 Len=0 TSV=2182847495 TSER=2182626333
    507 6.196083    127.0.0.1             127.0.0.1             TCP      commplex-main > 35583 [ACK] Seq=2 Ack=175210 Win=65535 Len=0 TSV=2182867640 TSER=2182646469
    508 6.215253    127.0.0.1             127.0.0.1             TCP      commplex-main > 35583 [ACK] Seq=2 Ack=175210 Win=65535 Len=0 TSV=2182867640 TSER=2182646469
    509 6.216218    127.0.0.1             127.0.0.1             TCP      commplex-main > 35583 [ACK] Seq=2 Ack=176658 Win=65535 Len=0 TSV=2182887716 TSER=2182666533
    510 6.235381    127.0.0.1             127.0.0.1             TCP      commplex-main > 35583 [ACK] Seq=2 Ack=176658 Win=65535 Len=0 TSV=2182887716 TSER=2182666533
    511 6.236353    127.0.0.1             127.0.0.1             TCP      commplex-main > 35583 [ACK] Seq=2 Ack=178106 Win=65535 Len=0 TSV=2182907803 TSER=2182686665
    512 6.255462    127.0.0.1             127.0.0.1             TCP      commplex-main > 35583 [ACK] Seq=2 Ack=178106 Win=65535 Len=0 TSV=2182907803 TSER=2182686665
    513 6.256469    127.0.0.1             127.0.0.1             TCP      commplex-main > 35583 [ACK] Seq=2 Ack=179554 Win=65535 Len=0 TSV=2182927946 TSER=2182706807
    514 6.275629    127.0.0.1             127.0.0.1             TCP      commplex-main > 35583 [ACK] Seq=2 Ack=179554 Win=65535 Len=0 TSV=2182927946 TSER=2182706807
    515 6.276602    127.0.0.1             127.0.0.1             TCP      commplex-main > 35583 [ACK] Seq=2 Ack=181002 Win=65535 Len=0 TSV=2182948017 TSER=2182726944
    516 6.295759    127.0.0.1             127.0.0.1             TCP      commplex-main > 35583 [ACK] Seq=2 Ack=181002 Win=65535 Len=0 TSV=2182948017 TSER=2182726944
    517 6.296736    127.0.0.1             127.0.0.1             TCP      35583 > commplex-main [ACK] Seq=181002 Ack=2 Win=65535 Len=1448 TSV=2182968156 TSER=2182747043
    518 6.315896    127.0.0.1             127.0.0.1             TCP      35583 > commplex-main [ACK] Seq=181002 Ack=2 Win=65535 Len=1448 TSV=2182968156 TSER=2182747043
    519 6.316781    127.0.0.1             127.0.0.1             TCP      35583 > commplex-main [ACK] Seq=182450 Ack=2 Win=65535 Len=1448 TSV=2182968162 TSER=2182747043
    520 6.335947    127.0.0.1             127.0.0.1             TCP      35583 > commplex-main [ACK] Seq=182450 Ack=2 Win=65535 Len=1448 TSV=2182968162 TSER=2182747043
    521 6.336857    127.0.0.1             127.0.0.1             TCP      35583 > commplex-main [ACK] Seq=183898 Ack=2 Win=65535 Len=1448 TSV=2182988259 TSER=2182767065
    522 6.356017    127.0.0.1             127.0.0.1             TCP      35583 > commplex-main [ACK] Seq=183898 Ack=2 Win=65535 Len=1448 TSV=2182988259 TSER=2182767065
    523 6.356938    127.0.0.1             127.0.0.1             TCP      35583 > commplex-main [ACK] Seq=185346 Ack=2 Win=65535 Len=1448 TSV=2183008399 TSER=2182787195
    524 6.376055    127.0.0.1             127.0.0.1             TCP      35583 > commplex-main [ACK] Seq=185346 Ack=2 Win=65535 Len=1448 TSV=2183008399 TSER=2182787195
    525 6.377025    127.0.0.1             127.0.0.1             TCP      35583 > commplex-main [ACK] Seq=186794 Ack=2 Win=65535 Len=1448 TSV=2183028534 TSER=2182807274
    526 6.396130    127.0.0.1             127.0.0.1             TCP      35583 > commplex-main [ACK] Seq=186794 Ack=2 Win=65535 Len=1448 TSV=2183028534 TSER=2182807274
    527 6.397109    127.0.0.1             127.0.0.1             TCP      35583 > commplex-main [ACK] Seq=188242 Ack=2 Win=65535 Len=1448 TSV=2183048667 TSER=2182827348
    528 6.416269    127.0.0.1             127.0.0.1             TCP      35583 > commplex-main [ACK] Seq=188242 Ack=2 Win=65535 Len=1448 TSV=2183048667 TSER=2182827348
    529 6.417187    127.0.0.1             127.0.0.1             TCP      35583 > commplex-main [ACK] Seq=189690 Ack=2 Win=65535 Len=1448 TSV=2183068814 TSER=2182847495
    530 6.436349    127.0.0.1             127.0.0.1             TCP      35583 > commplex-main [ACK] Seq=189690 Ack=2 Win=65535 Len=1448 TSV=2183068814 TSER=2182847495
    531 6.437328    127.0.0.1             127.0.0.1             TCP      35583 > commplex-main [ACK] Seq=191138 Ack=2 Win=65535 Len=1448 TSV=2183088894 TSER=2182867640
    532 6.456456    127.0.0.1             127.0.0.1             TCP      35583 > commplex-main [ACK] Seq=191138 Ack=2 Win=65535 Len=1448 TSV=2183088894 TSER=2182867640
    533 6.457464    127.0.0.1             127.0.0.1             TCP      35583 > commplex-main [ACK] Seq=192586 Ack=2 Win=65535 Len=1448 TSV=2183109017 TSER=2182887716
    534 6.476631    127.0.0.1             127.0.0.1             TCP      35583 > commplex-main [ACK] Seq=192586 Ack=2 Win=65535 Len=1448 TSV=2183109017 TSER=2182887716
    535 6.477598    127.0.0.1             127.0.0.1             TCP      35583 > commplex-main [ACK] Seq=194034 Ack=2 Win=65535 Len=1448 TSV=2183129092 TSER=2182907803
    536 6.496764    127.0.0.1             127.0.0.1             TCP      35583 > commplex-main [ACK] Seq=194034 Ack=2 Win=65535 Len=1448 TSV=2183129092 TSER=2182907803
    537 6.497676    127.0.0.1             127.0.0.1             TCP      35583 > commplex-main [ACK] Seq=195482 Ack=2 Win=65535 Len=1448 TSV=2183149266 TSER=2182927946
    538 6.516789    127.0.0.1             127.0.0.1             TCP      35583 > commplex-main [ACK] Seq=195482 Ack=2 Win=65535 Len=1448 TSV=2183149266 TSER=2182927946
    539 6.517753    127.0.0.1             127.0.0.1             TCP      35583 > commplex-main [ACK] Seq=196930 Ack=2 Win=65535 Len=1448 TSV=2183169388 TSER=2182948017
    540 6.536855    127.0.0.1             127.0.0.1             TCP      35583 > commplex-main [ACK] Seq=196930 Ack=2 Win=65535 Len=1448 TSV=2183169388 TSER=2182948017
    541 6.537886    127.0.0.1             127.0.0.1             TCP      commplex-main > 35583 [ACK] Seq=2 Ack=182450 Win=65535 Len=0 TSV=2183189506 TSER=2182968156
    542 6.557050    127.0.0.1             127.0.0.1             TCP      commplex-main > 35583 [ACK] Seq=2 Ack=182450 Win=65535 Len=0 TSV=2183189506 TSER=2182968156
    543 6.558020    127.0.0.1             127.0.0.1             TCP      commplex-main > 35583 [ACK] Seq=2 Ack=183898 Win=65535 Len=0 TSV=2183209558 TSER=2182968162
    544 6.577181    127.0.0.1             127.0.0.1             TCP      commplex-main > 35583 [ACK] Seq=2 Ack=183898 Win=65535 Len=0 TSV=2183209558 TSER=2182968162
    545 6.578154    127.0.0.1             127.0.0.1             TCP      commplex-main > 35583 [ACK] Seq=2 Ack=185346 Win=65535 Len=0 TSV=2183229627 TSER=2182988259
    546 6.597260    127.0.0.1             127.0.0.1             TCP      commplex-main > 35583 [ACK] Seq=2 Ack=185346 Win=65535 Len=0 TSV=2183229627 TSER=2182988259
    547 6.598233    127.0.0.1             127.0.0.1             TCP      commplex-main > 35583 [ACK] Seq=2 Ack=186794 Win=65535 Len=0 TSV=2183249671 TSER=2183008399
    548 6.617386    127.0.0.1             127.0.0.1             TCP      commplex-main > 35583 [ACK] Seq=2 Ack=186794 Win=65535 Len=0 TSV=2183249671 TSER=2183008399
    549 6.618367    127.0.0.1             127.0.0.1             TCP      commplex-main > 35583 [ACK] Seq=2 Ack=188242 Win=65535 Len=0 TSV=2183269740 TSER=2183028534
    550 6.637476    127.0.0.1             127.0.0.1             TCP      commplex-main > 35583 [ACK] Seq=2 Ack=188242 Win=65535 Len=0 TSV=2183269740 TSER=2183028534
    551 6.638466    127.0.0.1             127.0.0.1             TCP      commplex-main > 35583 [ACK] Seq=2 Ack=189690 Win=65535 Len=0 TSV=2183289876 TSER=2183048667
    552 6.657625    127.0.0.1             127.0.0.1             TCP      commplex-main > 35583 [ACK] Seq=2 Ack=189690 Win=65535 Len=0 TSV=2183289876 TSER=2183048667
    553 6.658598    127.0.0.1             127.0.0.1             TCP      commplex-main > 35583 [ACK] Seq=2 Ack=191138 Win=65535 Len=0 TSV=2183309962 TSER=2183068814
    554 6.677758    127.0.0.1             127.0.0.1             TCP      commplex-main > 35583 [ACK] Seq=2 Ack=191138 Win=65535 Len=0 TSV=2183309962 TSER=2183068814
    555 6.678732    127.0.0.1             127.0.0.1             TCP      commplex-main > 35583 [ACK] Seq=2 Ack=192586 Win=65535 Len=0 TSV=2183330064 TSER=2183088894
    556 6.697843    127.0.0.1             127.0.0.1             TCP      commplex-main > 35583 [ACK] Seq=2 Ack=192586 Win=65535 Len=0 TSV=2183330064 TSER=2183088894
    557 6.698818    127.0.0.1             127.0.0.1             TCP      commplex-main > 35583 [ACK] Seq=2 Ack=194034 Win=65535 Len=0 TSV=2183350236 TSER=2183109017
    558 6.717981    127.0.0.1             127.0.0.1             TCP      commplex-main > 35583 [ACK] Seq=2 Ack=194034 Win=65535 Len=0 TSV=2183350236 TSER=2183109017
    559 6.718951    127.0.0.1             127.0.0.1             TCP      commplex-main > 35583 [ACK] Seq=2 Ack=195482 Win=65535 Len=0 TSV=2183370369 TSER=2183129092
    560 6.738108    127.0.0.1             127.0.0.1             TCP      commplex-main > 35583 [ACK] Seq=2 Ack=195482 Win=65535 Len=0 TSV=2183370369 TSER=2183129092
    561 6.739087    127.0.0.1             127.0.0.1             TCP      commplex-main > 35583 [ACK] Seq=2 Ack=196930 Win=65535 Len=0 TSV=2183390394 TSER=2183149266
    562 6.758247    127.0.0.1             127.0.0.1             TCP      commplex-main > 35583 [ACK] Seq=2 Ack=196930 Win=65535 Len=0 TSV=2183390394 TSER=2183149266
    563 6.759220    127.0.0.1             127.0.0.1             TCP      commplex-main > 35583 [ACK] Seq=2 Ack=198378 Win=65535 Len=0 TSV=2183410464 TSER=2183169388
    564 6.778373    127.0.0.1             127.0.0.1             TCP      commplex-main > 35583 [ACK] Seq=2 Ack=198378 Win=65535 Len=0 TSV=2183410464 TSER=2183169388
    565 6.779300    127.0.0.1             127.0.0.1             TCP      35583 > commplex-main [ACK] Seq=198378 Ack=2 Win=65535 Len=1448 TSV=2183430717 TSER=2183189506
    566 6.798454    127.0.0.1             127.0.0.1             TCP      35583 > commplex-main [ACK] Seq=198378 Ack=2 Win=65535 Len=1448 TSV=2183430717 TSER=2183189506
    567 6.799379    127.0.0.1             127.0.0.1             TCP      35583 > commplex-main [ACK] Seq=199826 Ack=2 Win=65535 Len=176 TSV=2183450814 TSER=2183209558
    568 6.818502    127.0.0.1             127.0.0.1             TCP      35583 > commplex-main [ACK] Seq=199826 Ack=2 Win=65535 Len=176 TSV=2183450814 TSER=2183209558
    569 6.819467    127.0.0.1             127.0.0.1             TCP      commplex-main > 35583 [ACK] Seq=2 Ack=199826 Win=65535 Len=0 TSV=2183672076 TSER=2183430717
    570 6.838632    127.0.0.1             127.0.0.1             TCP      commplex-main > 35583 [ACK] Seq=2 Ack=199826 Win=65535 Len=0 TSV=2183672076 TSER=2183430717
    571 6.839559    127.0.0.1             127.0.0.1             TCP      commplex-main > 35583 [ACK] Seq=2 Ack=200002 Win=65535 Len=0 TSV=2183692109 TSER=2183450814
    572 6.858726    127.0.0.1             127.0.0.1             TCP      commplex-main > 35583 [ACK] Seq=2 Ack=200002 Win=65535 Len=0 TSV=2183692109 TSER=2183450814
    573 6.879440    127.0.0.1             127.0.0.1             TCP      35583 > commplex-main [FIN, ACK] Seq=200002 Ack=2 Win=65535 Len=0 TSV=2183732377 TSER=2183692109
    574 6.898605    127.0.0.1             127.0.0.1             TCP      35583 > commplex-main [FIN, ACK] Seq=200002 Ack=2 Win=65535 Len=0 TSV=2183732377 TSER=2183692109
    575 6.918814    127.0.0.1             127.0.0.1             TCP      commplex-main > 35583 [ACK] Seq=2 Ack=200003 Win=65535 Len=0 TSV=2183772220 TSER=2183732377
    576 6.937973    127.0.0.1             127.0.0.1             TCP      commplex-main > 35583 [ACK] Seq=2 Ack=200003 Win=65535 Len=0 TSV=2183772220 TSER=2183732377
    577 6.938949    127.0.0.1             127.0.0.1             TCP      commplex-main > 35583 [FIN, ACK] Seq=2 Ack=200003 Win=65535 Len=0 TSV=2183772338 TSER=2183732377
    578 6.958103    127.0.0.1             127.0.0.1             TCP      commplex-main > 35583 [FIN, ACK] Seq=2 Ack=200003 Win=65535 Len=0 TSV=2183772338 TSER=2183732377
    579 6.978212    127.0.0.1             127.0.0.1             TCP      35583 > commplex-main [ACK] Seq=200003 Ack=3 Win=65535 Len=0 TSV=2183831711 TSER=2183772338
    580 6.997365    127.0.0.1             127.0.0.1             TCP      35583 > commplex-main [ACK] Seq=200003 Ack=3 Win=65535 Len=0 TSV=2183831711 TSER=2183772338
