No.     Time        Source                Destination           Protocol Info
      1 0.000000    127.0.0.1             127.0.0.1             TCP      63409 > commplex-main [SYN] Seq=1 Win=65535 Len=0 TSV=2766123303 TSER=0
      2 0.000049    127.0.0.1             127.0.0.1             TCP      63409 > commplex-main [SYN] Seq=1 Win=65535 Len=0 TSV=2766123303 TSER=0
      3 0.000131    127.0.0.1             127.0.0.1             TCP      commplex-main > 63409 [SYN, ACK] Seq=1 Ack=2 Win=65535 Len=0 TSV=2766123447 TSER=2766123303
      4 0.000143    127.0.0.1             127.0.0.1             TCP      commplex-main > 63409 [SYN, ACK] Seq=1 Ack=2 Win=65535 Len=0 TSV=2766123447 TSER=2766123303
      5 0.000190    127.0.0.1             127.0.0.1             TCP      63409 > commplex-main [ACK] Seq=2 Ack=2 Win=65535 Len=0 TSV=2766123508 TSER=2766123447
      6 0.000203    127.0.0.1             127.0.0.1             TCP      63409 > commplex-main [ACK] Seq=2 Ack=2 Win=65535 Len=0 TSV=2766123508 TSER=2766123447
      7 0.000346    127.0.0.1             127.0.0.1             TCP      63409 > commplex-main [ACK] Seq=2 Ack=2 Win=65535 Len=1448 TSV=2766123658 TSER=2766123447
      8 0.000363    127.0.0.1             127.0.0.1             TCP      63409 > commplex-main [ACK] Seq=2 Ack=2 Win=65535 Len=1448 TSV=2766123658 TSER=2766123447
      9 0.000406    127.0.0.1             127.0.0.1             TCP      commplex-main > 63409 [ACK] Seq=2 Ack=1450 Win=65535 Len=0 TSV=2766123723 TSER=2766123658
     10 0.000460    127.0.0.1             127.0.0.1             TCP      commplex-main > 63409 [ACK] Seq=2 Ack=1450 Win=65535 Len=0 TSV=2766123723 TSER=2766123658
     11 0.000565    127.0.0.1             127.0.0.1             TCP      63409 > commplex-main [ACK] Seq=1450 Ack=2 Win=65535 Len=1448 TSV=2766123883 TSER=2766123723
     12 0.000571    127.0.0.1             127.0.0.1             TCP      63409 > commplex-main [ACK] Seq=2898 Ack=2 Win=65535 Len=1448 TSV=2766123886 TSER=2766123723
     13 0.000594    127.0.0.1             127.0.0.1             TCP      63409 > commplex-main [ACK] Seq=1450 Ack=2 Win=65535 Len=1448 TSV=2766123883 TSER=2766123723
     14 0.000604    127.0.0.1             127.0.0.1             TCP      63409 > commplex-main [ACK] Seq=2898 Ack=2 Win=65535 Len=1448 TSV=2766123886 TSER=2766123723
     15 0.000650    127.0.0.1             127.0.0.1             TCP      commplex-main > 63409 [ACK] Seq=2 Ack=2898 Win=65535 Len=0 TSV=2766123960 TSER=2766123883
     16 0.000655    127.0.0.1             127.0.0.1             TCP      commplex-main > 63409 [ACK] Seq=2 Ack=4346 Win=64087 Len=0 TSV=2766123966 TSER=2766123886
     17 0.000676    127.0.0.1             127.0.0.1             TCP      commplex-main > 63409 [ACK] Seq=2 Ack=2898 Win=65535 Len=0 TSV=2766123960 TSER=2766123883
     18 0.000685    127.0.0.1             127.0.0.1             TCP      commplex-main > 63409 [ACK] Seq=2 Ack=4346 Win=64087 Len=0 TSV=2766123966 TSER=2766123886
     19 0.000754    127.0.0.1             127.0.0.1             TCP      63409 > commplex-main [ACK] Seq=4346 Ack=2 Win=65535 Len=1448 TSV=2766124075 TSER=2766123960
     20 0.000760    127.0.0.1             127.0.0.1             TCP      63409 > commplex-main [ACK] Seq=5794 Ack=2 Win=65535 Len=1448 TSV=2766124078 TSER=2766123960
     21 0.000796    127.0.0.1             127.0.0.1             TCP      63409 > commplex-main [ACK] Seq=7242 Ack=2 Win=65535 Len=1448 TSV=2766124112 TSER=2766123966
     22 0.000806    127.0.0.1             127.0.0.1             TCP      63409 > commplex-main [ACK] Seq=4346 Ack=2 Win=65535 Len=1448 TSV=2766124075 TSER=2766123960
     23 0.000812    127.0.0.1             127.0.0.1             TCP      63409 > commplex-main [ACK] Seq=8690 Ack=2 Win=65535 Len=1448 TSV=2766124116 TSER=2766123966
     24 0.000837    127.0.0.1             127.0.0.1             TCP      63409 > commplex-main [ACK] Seq=5794 Ack=2 Win=65535 Len=1448 TSV=2766124078 TSER=2766123960
     25 0.000842    127.0.0.1             127.0.0.1             TCP      commplex-main > 63409 [ACK] Seq=2 Ack=5794 Win=64087 Len=0 TSV=2766124160 TSER=2766124075
     26 0.000874    127.0.0.1             127.0.0.1             TCP      63409 > commplex-main [ACK] Seq=7242 Ack=2 Win=65535 Len=1448 TSV=2766124112 TSER=2766123966
     27 0.000877    127.0.0.1             127.0.0.1             TCP      commplex-main > 63409 [ACK] Seq=2 Ack=7242 Win=64087 Len=0 TSV=2766124199 TSER=2766124078
     28 0.000912    127.0.0.1             127.0.0.1             TCP      commplex-main > 63409 [ACK] Seq=2 Ack=8690 Win=64087 Len=0 TSV=2766124238 TSER=2766124112
     29 0.000920    127.0.0.1             127.0.0.1             TCP      63409 > commplex-main [ACK] Seq=8690 Ack=2 Win=65535 Len=1448 TSV=2766124116 TSER=2766123966
     30 0.000952    127.0.0.1             127.0.0.1             TCP      commplex-main > 63409 [ACK] Seq=2 Ack=5794 Win=64087 Len=0 TSV=2766124160 TSER=2766124075
     31 0.000955    127.0.0.1             127.0.0.1             TCP      commplex-main > 63409 [ACK] Seq=2 Ack=10138 Win=64087 Len=0 TSV=2766124278 TSER=2766124116
     32 0.000971    127.0.0.1             127.0.0.1             TCP      commplex-main > 63409 [ACK] Seq=2 Ack=7242 Win=64087 Len=0 TSV=2766124199 TSER=2766124078
     33 0.001003    127.0.0.1             127.0.0.1             TCP      commplex-main > 63409 [ACK] Seq=2 Ack=8690 Win=64087 Len=0 TSV=2766124238 TSER=2766124112
     34 0.001027    127.0.0.1             127.0.0.1             TCP      commplex-main > 63409 [ACK] Seq=2 Ack=10138 Win=64087 Len=0 TSV=2766124278 TSER=2766124116
     35 0.001081    127.0.0.1             127.0.0.1             TCP      63409 > commplex-main [ACK] Seq=10138 Ack=2 Win=65535 Len=1448 TSV=2766124349 TSER=2766124160
     36 0.001087    127.0.0.1             127.0.0.1             TCP      63409 > commplex-main [ACK] Seq=11586 Ack=2 Win=65535 Len=1448 TSV=2766124351 TSER=2766124160
     37 0.001093    127.0.0.1             127.0.0.1             TCP      63409 > commplex-main [ACK] Seq=13034 Ack=2 Win=65535 Len=1448 TSV=2766124385 TSER=2766124199
     38 0.001099    127.0.0.1             127.0.0.1             TCP      63409 > commplex-main [ACK] Seq=14482 Ack=2 Win=65535 Len=1448 TSV=2766124388 TSER=2766124199
     39 0.001198    127.0.0.1             127.0.0.1             TCP      63409 > commplex-main [ACK] Seq=15930 Ack=2 Win=65535 Len=1448 TSV=2766124472 TSER=2766124238
     40 0.001203    127.0.0.1             127.0.0.1             TCP      63409 > commplex-main [ACK] Seq=17378 Ack=2 Win=65535 Len=1448 TSV=2766124475 TSER=2766124238
     41 0.001208    127.0.0.1             127.0.0.1             TCP      63409 > commplex-main [ACK] Seq=18826 Ack=2 Win=65535 Len=1448 TSV=2766124509 TSER=2766124278
     42 0.001215    127.0.0.1             127.0.0.1             TCP      63409 > commplex-main [ACK] Seq=20274 Ack=2 Win=65535 Len=1448 TSV=2766124512 TSER=2766124278
     43 0.001216    127.0.0.1             127.0.0.1             TCP      63409 > commplex-main [ACK] Seq=10138 Ack=2 Win=65535 Len=1448 TSV=2766124349 TSER=2766124160
     44 0.001244    127.0.0.1             127.0.0.1             TCP      63409 > commplex-main [ACK] Seq=11586 Ack=2 Win=65535 Len=1448 TSV=2766124351 TSER=2766124160
     45 0.001267    127.0.0.1             127.0.0.1             TCP      63409 > commplex-main [ACK] Seq=13034 Ack=2 Win=65535 Len=1448 TSV=2766124385 TSER=2766124199
     46 0.001286    127.0.0.1             127.0.0.1             TCP      63409 > commplex-main [ACK] Seq=14482 Ack=2 Win=65535 Len=1448 TSV=2766124388 TSER=2766124199
     47 0.001313    127.0.0.1             127.0.0.1             TCP      63409 > commplex-main [ACK] Seq=15930 Ack=2 Win=65535 Len=1448 TSV=2766124472 TSER=2766124238
     48 0.001319    127.0.0.1             127.0.0.1             TCP      commplex-main > 63409 [ACK] Seq=2 Ack=11586 Win=65535 Len=0 TSV=2766124607 TSER=2766124349
     49 0.001324    127.0.0.1             127.0.0.1             TCP      commplex-main > 63409 [ACK] Seq=2 Ack=13034 Win=64087 Len=0 TSV=2766124619 TSER=2766124351
     50 0.001338    127.0.0.1             127.0.0.1             TCP      63409 > commplex-main [ACK] Seq=17378 Ack=2 Win=65535 Len=1448 TSV=2766124475 TSER=2766124238
     51 0.001357    127.0.0.1             127.0.0.1             TCP      63409 > commplex-main [ACK] Seq=18826 Ack=2 Win=65535 Len=1448 TSV=2766124509 TSER=2766124278
     52 0.001389    127.0.0.1             127.0.0.1             TCP      commplex-main > 63409 [ACK] Seq=2 Ack=14482 Win=64087 Len=0 TSV=2766124668 TSER=2766124385
     53 0.001394    127.0.0.1             127.0.0.1             TCP      commplex-main > 63409 [ACK] Seq=2 Ack=15930 Win=62639 Len=0 TSV=2766124682 TSER=2766124388
     54 0.001408    127.0.0.1             127.0.0.1             TCP      commplex-main > 63409 [ACK] Seq=2 Ack=17378 Win=64087 Len=0 TSV=2766124693 TSER=2766124472
     55 0.001412    127.0.0.1             127.0.0.1             TCP      commplex-main > 63409 [ACK] Seq=2 Ack=11586 Win=65535 Len=0 TSV=2766124607 TSER=2766124349
     56 0.001449    127.0.0.1             127.0.0.1             TCP      commplex-main > 63409 [ACK] Seq=2 Ack=13034 Win=64087 Len=0 TSV=2766124619 TSER=2766124351
     57 0.001483    127.0.0.1             127.0.0.1             TCP      commplex-main > 63409 [ACK] Seq=2 Ack=14482 Win=64087 Len=0 TSV=2766124668 TSER=2766124385
     58 0.001503    127.0.0.1             127.0.0.1             TCP      commplex-main > 63409 [ACK] Seq=2 Ack=15930 Win=62639 Len=0 TSV=2766124682 TSER=2766124388
     59 0.001504    127.0.0.1             127.0.0.1             TCP      commplex-main > 63409 [ACK] Seq=2 Ack=18826 Win=62639 Len=0 TSV=2766124754 TSER=2766124475
     60 0.001509    127.0.0.1             127.0.0.1             TCP      commplex-main > 63409 [ACK] Seq=2 Ack=20274 Win=61191 Len=0 TSV=2766124768 TSER=2766124509
     61 0.001514    127.0.0.1             127.0.0.1             TCP      63409 > commplex-main [ACK] Seq=21722 Ack=2 Win=65535 Len=1448 TSV=2766124808 TSER=2766124607
     62 0.001524    127.0.0.1             127.0.0.1             TCP      commplex-main > 63409 [ACK] Seq=2 Ack=17378 Win=64087 Len=0 TSV=2766124693 TSER=2766124472
     63 0.001542    127.0.0.1             127.0.0.1             TCP      commplex-main > 63409 [ACK] Seq=2 Ack=18826 Win=62639 Len=0 TSV=2766124754 TSER=2766124475
     64 0.001564    127.0.0.1             127.0.0.1             TCP      commplex-main > 63409 [ACK] Seq=2 Ack=20274 Win=61191 Len=0 TSV=2766124768 TSER=2766124509
     65 0.001579    127.0.0.1             127.0.0.1             TCP      63409 > commplex-main [ACK] Seq=23170 Ack=2 Win=65535 Len=1448 TSV=2766124855 TSER=2766124607
     66 0.001586    127.0.0.1             127.0.0.1             TCP      63409 > commplex-main [ACK] Seq=21722 Ack=2 Win=65535 Len=1448 TSV=2766124808 TSER=2766124607
     67 0.001608    127.0.0.1             127.0.0.1             TCP      63409 > commplex-main [ACK] Seq=23170 Ack=2 Win=65535 Len=1448 TSV=2766124855 TSER=2766124607
     68 0.001781    127.0.0.1             127.0.0.1             TCP      63409 > commplex-main [ACK] Seq=24618 Ack=2 Win=65535 Len=1448 TSV=2766124892 TSER=2766124619
     69 0.001792    127.0.0.1             127.0.0.1             TCP      63409 > commplex-main [ACK] Seq=26066 Ack=2 Win=65535 Len=1448 TSV=2766124920 TSER=2766124619
     70 0.001798    127.0.0.1             127.0.0.1             TCP      63409 > commplex-main [ACK] Seq=27514 Ack=2 Win=65535 Len=1448 TSV=2766124956 TSER=2766124668
     71 0.001803    127.0.0.1             127.0.0.1             TCP      63409 > commplex-main [ACK] Seq=28962 Ack=2 Win=65535 Len=1448 TSV=2766124959 TSER=2766124668
     72 0.001807    127.0.0.1             127.0.0.1             TCP      63409 > commplex-main [ACK] Seq=30410 Ack=2 Win=65535 Len=1448 TSV=2766124991 TSER=2766124682
     73 0.001813    127.0.0.1             127.0.0.1             TCP      63409 > commplex-main [ACK] Seq=31858 Ack=2 Win=65535 Len=1448 TSV=2766124994 TSER=2766124682
     74 0.001818    127.0.0.1             127.0.0.1             TCP      63409 > commplex-main [ACK] Seq=33306 Ack=2 Win=65535 Len=1448 TSV=2766125032 TSER=2766124693
     75 0.001824    127.0.0.1             127.0.0.1             TCP      63409 > commplex-main [ACK] Seq=34754 Ack=2 Win=65535 Len=1448 TSV=2766125034 TSER=2766124693
     76 0.001829    127.0.0.1             127.0.0.1             TCP      63409 > commplex-main [ACK] Seq=36202 Ack=2 Win=65535 Len=1448 TSV=2766125065 TSER=2766124754
     77 0.001834    127.0.0.1             127.0.0.1             TCP      63409 > commplex-main [ACK] Seq=37650 Ack=2 Win=65535 Len=1448 TSV=2766125068 TSER=2766124754
     78 0.001839    127.0.0.1             127.0.0.1             TCP      63409 > commplex-main [ACK] Seq=39098 Ack=2 Win=65535 Len=1448 TSV=2766125098 TSER=2766124768
     79 0.001844    127.0.0.1             127.0.0.1             TCP      63409 > commplex-main [ACK] Seq=40546 Ack=2 Win=65535 Len=1448 TSV=2766125100 TSER=2766124768
     80 0.001873    127.0.0.1             127.0.0.1             TCP      commplex-main > 63409 [ACK] Seq=2 Ack=20274 Win=64087 Len=0 TSV=2766125188 TSER=2766124808
     81 0.001878    127.0.0.1             127.0.0.1             TCP      commplex-main > 63409 [ACK] Seq=2 Ack=20274 Win=62639 Len=0 TSV=2766125197 TSER=2766124855
     82 0.001894    127.0.0.1             127.0.0.1             TCP      63409 > commplex-main [ACK] Seq=24618 Ack=2 Win=65535 Len=1448 TSV=2766124892 TSER=2766124619
     83 0.001906    127.0.0.1             127.0.0.1             TCP      63409 > commplex-main [ACK] Seq=26066 Ack=2 Win=65535 Len=1448 TSV=2766124920 TSER=2766124619
     84 0.001913    127.0.0.1             127.0.0.1             TCP      63409 > commplex-main [ACK] Seq=27514 Ack=2 Win=65535 Len=1448 TSV=2766124956 TSER=2766124668
     85 0.001921    127.0.0.1             127.0.0.1             TCP      63409 > commplex-main [ACK] Seq=28962 Ack=2 Win=65535 Len=1448 TSV=2766124959 TSER=2766124668
     86 0.001927    127.0.0.1             127.0.0.1             TCP      63409 > commplex-main [ACK] Seq=30410 Ack=2 Win=65535 Len=1448 TSV=2766124991 TSER=2766124682
     87 0.001935    127.0.0.1             127.0.0.1             TCP      63409 > commplex-main [ACK] Seq=31858 Ack=2 Win=65535 Len=1448 TSV=2766124994 TSER=2766124682
     88 0.001941    127.0.0.1             127.0.0.1             TCP      63409 > commplex-main [ACK] Seq=33306 Ack=2 Win=65535 Len=1448 TSV=2766125032 TSER=2766124693
     89 0.001950    127.0.0.1             127.0.0.1             TCP      63409 > commplex-main [ACK] Seq=34754 Ack=2 Win=65535 Len=1448 TSV=2766125034 TSER=2766124693
     90 0.001956    127.0.0.1             127.0.0.1             TCP      63409 > commplex-main [ACK] Seq=36202 Ack=2 Win=65535 Len=1448 TSV=2766125065 TSER=2766124754
     91 0.001967    127.0.0.1             127.0.0.1             TCP      63409 > commplex-main [ACK] Seq=37650 Ack=2 Win=65535 Len=1448 TSV=2766125068 TSER=2766124754
     92 0.001973    127.0.0.1             127.0.0.1             TCP      63409 > commplex-main [ACK] Seq=39098 Ack=2 Win=65535 Len=1448 TSV=2766125098 TSER=2766124768
     93 0.001982    127.0.0.1             127.0.0.1             TCP      63409 > commplex-main [ACK] Seq=40546 Ack=2 Win=65535 Len=1448 TSV=2766125100 TSER=2766124768
     94 0.001988    127.0.0.1             127.0.0.1             TCP      commplex-main > 63409 [ACK] Seq=2 Ack=20274 Win=64087 Len=0 TSV=2766125188 TSER=2766124808
     95 0.001998    127.0.0.1             127.0.0.1             TCP      commplex-main > 63409 [ACK] Seq=2 Ack=20274 Win=62639 Len=0 TSV=2766125197 TSER=2766124855
     96 0.002111    127.0.0.1             127.0.0.1             TCP      commplex-main > 63409 [ACK] Seq=2 Ack=20274 Win=61191 Len=0 TSV=2766125353 TSER=2766124892
     97 0.002115    127.0.0.1             127.0.0.1             TCP      commplex-main > 63409 [ACK] Seq=2 Ack=20274 Win=59743 Len=0 TSV=2766125362 TSER=2766124920
     98 0.002120    127.0.0.1             127.0.0.1             TCP      commplex-main > 63409 [ACK] Seq=2 Ack=20274 Win=58295 Len=0 TSV=2766125370 TSER=2766124956
     99 0.002124    127.0.0.1             127.0.0.1             TCP      commplex-main > 63409 [ACK] Seq=2 Ack=20274 Win=61191 Len=0 TSV=2766125353 TSER=2766124892
    100 0.002129    127.0.0.1             127.0.0.1             TCP      commplex-main > 63409 [ACK] Seq=2 Ack=20274 Win=56847 Len=0 TSV=2766125378 TSER=2766124959
    101 0.002134    127.0.0.1             127.0.0.1             TCP      commplex-main > 63409 [ACK] Seq=2 Ack=20274 Win=55399 Len=0 TSV=2766125384 TSER=2766124991
    102 0.002138    127.0.0.1             127.0.0.1             TCP      commplex-main > 63409 [ACK] Seq=2 Ack=20274 Win=53951 Len=0 TSV=2766125391 TSER=2766124994
    103 0.002143    127.0.0.1             127.0.0.1             TCP      commplex-main > 63409 [ACK] Seq=2 Ack=20274 Win=52503 Len=0 TSV=2766125397 TSER=2766125032
    104 0.002149    127.0.0.1             127.0.0.1             TCP      commplex-main > 63409 [ACK] Seq=2 Ack=20274 Win=51055 Len=0 TSV=2766125406 TSER=2766125034
    105 0.002150    127.0.0.1             127.0.0.1             TCP      commplex-main > 63409 [ACK] Seq=2 Ack=20274 Win=59743 Len=0 TSV=2766125362 TSER=2766124920
    106 0.002154    127.0.0.1             127.0.0.1             TCP      commplex-main > 63409 [ACK] Seq=2 Ack=20274 Win=49607 Len=0 TSV=2766125412 TSER=2766125065
    107 0.002159    127.0.0.1             127.0.0.1             TCP      commplex-main > 63409 [ACK] Seq=2 Ack=20274 Win=48159 Len=0 TSV=2766125419 TSER=2766125068
    108 0.002164    127.0.0.1             127.0.0.1             TCP      commplex-main > 63409 [ACK] Seq=2 Ack=20274 Win=46711 Len=0 TSV=2766125425 TSER=2766125098
    109 0.002169    127.0.0.1             127.0.0.1             TCP      commplex-main > 63409 [ACK] Seq=2 Ack=20274 Win=45263 Len=0 TSV=2766125432 TSER=2766125100
    110 0.002171    127.0.0.1             127.0.0.1             TCP      commplex-main > 63409 [ACK] Seq=2 Ack=20274 Win=58295 Len=0 TSV=2766125370 TSER=2766124956
    111 0.002193    127.0.0.1             127.0.0.1             TCP      commplex-main > 63409 [ACK] Seq=2 Ack=20274 Win=56847 Len=0 TSV=2766125378 TSER=2766124959
    112 0.002216    127.0.0.1             127.0.0.1             TCP      commplex-main > 63409 [ACK] Seq=2 Ack=20274 Win=55399 Len=0 TSV=2766125384 TSER=2766124991
    113 0.002240    127.0.0.1             127.0.0.1             TCP      commplex-main > 63409 [ACK] Seq=2 Ack=20274 Win=53951 Len=0 TSV=2766125391 TSER=2766124994
    114 0.002245    127.0.0.1             127.0.0.1             TCP      63409 > commplex-main [ACK] Seq=20274 Ack=2 Win=65535 Len=1448 TSV=2766125547 TSER=2766125362
    115 0.002263    127.0.0.1             127.0.0.1             TCP      commplex-main > 63409 [ACK] Seq=2 Ack=20274 Win=52503 Len=0 TSV=2766125397 TSER=2766125032
    116 0.002271    127.0.0.1             127.0.0.1             TCP      commplex-main > 63409 [ACK] Seq=2 Ack=20274 Win=51055 Len=0 TSV=2766125406 TSER=2766125034
    117 0.002280    127.0.0.1             127.0.0.1             TCP      commplex-main > 63409 [ACK] Seq=2 Ack=20274 Win=49607 Len=0 TSV=2766125412 TSER=2766125065
    118 0.002286    127.0.0.1             127.0.0.1             TCP      commplex-main > 63409 [ACK] Seq=2 Ack=20274 Win=48159 Len=0 TSV=2766125419 TSER=2766125068
    119 0.002293    127.0.0.1             127.0.0.1             TCP      commplex-main > 63409 [ACK] Seq=2 Ack=20274 Win=46711 Len=0 TSV=2766125425 TSER=2766125098
    120 0.002299    127.0.0.1             127.0.0.1             TCP      commplex-main > 63409 [ACK] Seq=2 Ack=20274 Win=45263 Len=0 TSV=2766125432 TSER=2766125100
    121 0.002306    127.0.0.1             127.0.0.1             TCP      63409 > commplex-main [ACK] Seq=20274 Ack=2 Win=65535 Len=1448 TSV=2766125547 TSER=2766125362
    122 0.002355    127.0.0.1             127.0.0.1             TCP      commplex-main > 63409 [ACK] Seq=2 Ack=41994 Win=65535 Len=0 TSV=2766125680 TSER=2766125547
    123 0.002377    127.0.0.1             127.0.0.1             TCP      commplex-main > 63409 [ACK] Seq=2 Ack=41994 Win=65535 Len=0 TSV=2766125680 TSER=2766125547
    124 0.002463    127.0.0.1             127.0.0.1             TCP      63409 > commplex-main [ACK] Seq=41994 Ack=2 Win=65535 Len=1448 TSV=2766125778 TSER=2766125680
    125 0.002469    127.0.0.1             127.0.0.1             TCP      63409 > commplex-main [ACK] Seq=43442 Ack=2 Win=65535 Len=1448 TSV=2766125781 TSER=2766125680
    126 0.002477    127.0.0.1             127.0.0.1             TCP      63409 > commplex-main [ACK] Seq=41994 Ack=2 Win=65535 Len=1448 TSV=2766125778 TSER=2766125680
    127 0.002501    127.0.0.1             127.0.0.1             TCP      63409 > commplex-main [ACK] Seq=43442 Ack=2 Win=65535 Len=1448 TSV=2766125781 TSER=2766125680
    128 0.002533    127.0.0.1             127.0.0.1             TCP      commplex-main > 63409 [ACK] Seq=2 Ack=43442 Win=65535 Len=0 TSV=2766125854 TSER=2766125778
    129 0.002542    127.0.0.1             127.0.0.1             TCP      commplex-main > 63409 [ACK] Seq=2 Ack=44890 Win=64087 Len=0 TSV=2766125863 TSER=2766125781
    130 0.002563    127.0.0.1             127.0.0.1             TCP      commplex-main > 63409 [ACK] Seq=2 Ack=43442 Win=65535 Len=0 TSV=2766125854 TSER=2766125778
    131 0.002633    127.0.0.1             127.0.0.1             TCP      63409 > commplex-main [ACK] Seq=44890 Ack=2 Win=65535 Len=1448 TSV=2766125952 TSER=2766125854
    132 0.002647    127.0.0.1             127.0.0.1             TCP      63409 > commplex-main [ACK] Seq=46338 Ack=2 Win=65535 Len=1448 TSV=2766125954 TSER=2766125854
    133 0.002652    127.0.0.1             127.0.0.1             TCP      commplex-main > 63409 [ACK] Seq=2 Ack=44890 Win=64087 Len=0 TSV=2766125863 TSER=2766125781
    134 0.002711    127.0.0.1             127.0.0.1             TCP      63409 > commplex-main [ACK] Seq=47786 Ack=2 Win=65535 Len=1448 TSV=2766126032 TSER=2766125863
    135 0.002713    127.0.0.1             127.0.0.1             TCP      63409 > commplex-main [ACK] Seq=44890 Ack=2 Win=65535 Len=1448 TSV=2766125952 TSER=2766125854
    136 0.002716    127.0.0.1             127.0.0.1             TCP      63409 > commplex-main [ACK] Seq=49234 Ack=2 Win=65535 Len=1448 TSV=2766126036 TSER=2766125863
    137 0.002756    127.0.0.1             127.0.0.1             TCP      commplex-main > 63409 [ACK] Seq=2 Ack=46338 Win=65535 Len=0 TSV=2766126073 TSER=2766125952
    138 0.002761    127.0.0.1             127.0.0.1             TCP      63409 > commplex-main [ACK] Seq=46338 Ack=2 Win=65535 Len=1448 TSV=2766125954 TSER=2766125854
    139 0.002780    127.0.0.1             127.0.0.1             TCP      63409 > commplex-main [ACK] Seq=47786 Ack=2 Win=65535 Len=1448 TSV=2766126032 TSER=2766125863
    140 0.002807    127.0.0.1             127.0.0.1             TCP      63409 > commplex-main [ACK] Seq=49234 Ack=2 Win=65535 Len=1448 TSV=2766126036 TSER=2766125863
    141 0.002828    127.0.0.1             127.0.0.1             TCP      commplex-main > 63409 [ACK] Seq=2 Ack=47786 Win=65535 Len=0 TSV=2766126133 TSER=2766125954
    142 0.002830    127.0.0.1             127.0.0.1             TCP      commplex-main > 63409 [ACK] Seq=2 Ack=46338 Win=65535 Len=0 TSV=2766126073 TSER=2766125952
    143 0.002834    127.0.0.1             127.0.0.1             TCP      commplex-main > 63409 [ACK] Seq=2 Ack=49234 Win=64087 Len=0 TSV=2766126143 TSER=2766126032
    144 0.002853    127.0.0.1             127.0.0.1             TCP      commplex-main > 63409 [ACK] Seq=2 Ack=47786 Win=65535 Len=0 TSV=2766126133 TSER=2766125954
    145 0.002870    127.0.0.1             127.0.0.1             TCP      commplex-main > 63409 [ACK] Seq=2 Ack=50682 Win=62639 Len=0 TSV=2766126177 TSER=2766126036
    146 0.002884    127.0.0.1             127.0.0.1             TCP      commplex-main > 63409 [ACK] Seq=2 Ack=49234 Win=64087 Len=0 TSV=2766126143 TSER=2766126032
    147 0.002908    127.0.0.1             127.0.0.1             TCP      commplex-main > 63409 [ACK] Seq=2 Ack=50682 Win=62639 Len=0 TSV=2766126177 TSER=2766126036
    148 0.002946    127.0.0.1             127.0.0.1             TCP      63409 > commplex-main [ACK] Seq=50682 Ack=2 Win=65535 Len=1448 TSV=2766126263 TSER=2766126073
    149 0.002952    127.0.0.1             127.0.0.1             TCP      63409 > commplex-main [ACK] Seq=52130 Ack=2 Win=65535 Len=1448 TSV=2766126268 TSER=2766126073
    150 0.002989    127.0.0.1             127.0.0.1             TCP      63409 > commplex-main [ACK] Seq=53578 Ack=2 Win=65535 Len=1448 TSV=2766126302 TSER=2766126133
    151 0.002996    127.0.0.1             127.0.0.1             TCP      63409 > commplex-main [ACK] Seq=55026 Ack=2 Win=65535 Len=1448 TSV=2766126306 TSER=2766126133
    152 0.003004    127.0.0.1             127.0.0.1             TCP      63409 > commplex-main [ACK] Seq=50682 Ack=2 Win=65535 Len=1448 TSV=2766126263 TSER=2766126073
    153 0.003037    127.0.0.1             127.0.0.1             TCP      63409 > commplex-main [ACK] Seq=56474 Ack=2 Win=65535 Len=1448 TSV=2766126341 TSER=2766126143
    154 0.003043    127.0.0.1             127.0.0.1             TCP      63409 > commplex-main [ACK] Seq=57922 Ack=2 Win=65535 Len=1448 TSV=2766126344 TSER=2766126143
    155 0.003059    127.0.0.1             127.0.0.1             TCP      63409 > commplex-main [ACK] Seq=59370 Ack=2 Win=65535 Len=1448 TSV=2766126376 TSER=2766126177
    156 0.003065    127.0.0.1             127.0.0.1             TCP      63409 > commplex-main [ACK] Seq=60818 Ack=2 Win=65535 Len=1448 TSV=2766126380 TSER=2766126177
    157 0.003076    127.0.0.1             127.0.0.1             TCP      commplex-main > 63409 [ACK] Seq=2 Ack=52130 Win=65535 Len=0 TSV=2766126393 TSER=2766126263
    158 0.003113    127.0.0.1             127.0.0.1             TCP      63409 > commplex-main [ACK] Seq=52130 Ack=2 Win=65535 Len=1448 TSV=2766126268 TSER=2766126073
    159 0.003134    127.0.0.1             127.0.0.1             TCP      63409 > commplex-main [ACK] Seq=53578 Ack=2 Win=65535 Len=1448 TSV=2766126302 TSER=2766126133
    160 0.003163    127.0.0.1             127.0.0.1             TCP      63409 > commplex-main [ACK] Seq=55026 Ack=2 Win=65535 Len=1448 TSV=2766126306 TSER=2766126133
    161 0.003174    127.0.0.1             127.0.0.1             TCP      commplex-main > 63409 [ACK] Seq=2 Ack=53578 Win=65535 Len=0 TSV=2766126487 TSER=2766126268
    162 0.003178    127.0.0.1             127.0.0.1             TCP      commplex-main > 63409 [ACK] Seq=2 Ack=55026 Win=64087 Len=0 TSV=2766126497 TSER=2766126302
    163 0.003187    127.0.0.1             127.0.0.1             TCP      63409 > commplex-main [ACK] Seq=56474 Ack=2 Win=65535 Len=1448 TSV=2766126341 TSER=2766126143
    164 0.003211    127.0.0.1             127.0.0.1             TCP      63409 > commplex-main [ACK] Seq=57922 Ack=2 Win=65535 Len=1448 TSV=2766126344 TSER=2766126143
    165 0.003223    127.0.0.1             127.0.0.1             TCP      commplex-main > 63409 [ACK] Seq=2 Ack=56474 Win=64087 Len=0 TSV=2766126532 TSER=2766126306
    166 0.003239    127.0.0.1             127.0.0.1             TCP      63409 > commplex-main [ACK] Seq=59370 Ack=2 Win=65535 Len=1448 TSV=2766126376 TSER=2766126177
    167 0.003253    127.0.0.1             127.0.0.1             TCP      commplex-main > 63409 [ACK] Seq=2 Ack=57922 Win=62639 Len=0 TSV=2766126567 TSER=2766126341
    168 0.003259    127.0.0.1             127.0.0.1             TCP      commplex-main > 63409 [ACK] Seq=2 Ack=59370 Win=61191 Len=0 TSV=2766126576 TSER=2766126344
    169 0.003260    127.0.0.1             127.0.0.1             TCP      63409 > commplex-main [ACK] Seq=60818 Ack=2 Win=65535 Len=1448 TSV=2766126380 TSER=2766126177
    170 0.003277    127.0.0.1             127.0.0.1             TCP      commplex-main > 63409 [ACK] Seq=2 Ack=52130 Win=65535 Len=0 TSV=2766126393 TSER=2766126263
    171 0.003312    127.0.0.1             127.0.0.1             TCP      commplex-main > 63409 [ACK] Seq=2 Ack=53578 Win=65535 Len=0 TSV=2766126487 TSER=2766126268
    172 0.003318    127.0.0.1             127.0.0.1             TCP      commplex-main > 63409 [ACK] Seq=2 Ack=60818 Win=64087 Len=0 TSV=2766126634 TSER=2766126376
    173 0.003331    127.0.0.1             127.0.0.1             TCP      commplex-main > 63409 [ACK] Seq=2 Ack=55026 Win=64087 Len=0 TSV=2766126497 TSER=2766126302
    174 0.003352    127.0.0.1             127.0.0.1             TCP      commplex-main > 63409 [ACK] Seq=2 Ack=56474 Win=64087 Len=0 TSV=2766126532 TSER=2766126306
    175 0.003375    127.0.0.1             127.0.0.1             TCP      commplex-main > 63409 [ACK] Seq=2 Ack=57922 Win=62639 Len=0 TSV=2766126567 TSER=2766126341
    176 0.003393    127.0.0.1             127.0.0.1             TCP      commplex-main > 63409 [ACK] Seq=2 Ack=62266 Win=62639 Len=0 TSV=2766126660 TSER=2766126380
    177 0.003399    127.0.0.1             127.0.0.1             TCP      63409 > commplex-main [ACK] Seq=62266 Ack=2 Win=65535 Len=1448 TSV=2766126690 TSER=2766126393
    178 0.003410    127.0.0.1             127.0.0.1             TCP      commplex-main > 63409 [ACK] Seq=2 Ack=59370 Win=61191 Len=0 TSV=2766126576 TSER=2766126344
    179 0.003430    127.0.0.1             127.0.0.1             TCP      commplex-main > 63409 [ACK] Seq=2 Ack=60818 Win=64087 Len=0 TSV=2766126634 TSER=2766126376
    180 0.003452    127.0.0.1             127.0.0.1             TCP      commplex-main > 63409 [ACK] Seq=2 Ack=62266 Win=62639 Len=0 TSV=2766126660 TSER=2766126380
    181 0.003474    127.0.0.1             127.0.0.1             TCP      63409 > commplex-main [ACK] Seq=62266 Ack=2 Win=65535 Len=1448 TSV=2766126690 TSER=2766126393
    182 0.003556    127.0.0.1             127.0.0.1             TCP      63409 > commplex-main [ACK] Seq=63714 Ack=2 Win=65535 Len=1448 TSV=2766126768 TSER=2766126487
    183 0.003562    127.0.0.1             127.0.0.1             TCP      63409 > commplex-main [ACK] Seq=65162 Ack=2 Win=65535 Len=1448 TSV=2766126796 TSER=2766126497
    184 0.003568    127.0.0.1             127.0.0.1             TCP      63409 > commplex-main [ACK] Seq=66610 Ack=2 Win=65535 Len=1448 TSV=2766126822 TSER=2766126532
    185 0.003573    127.0.0.1             127.0.0.1             TCP      63409 > commplex-main [ACK] Seq=68058 Ack=2 Win=65535 Len=1448 TSV=2766126853 TSER=2766126567
    186 0.003590    127.0.0.1             127.0.0.1             TCP      63409 > commplex-main [ACK] Seq=69506 Ack=2 Win=65535 Len=1448 TSV=2766126897 TSER=2766126576
    187 0.003607    127.0.0.1             127.0.0.1             TCP      63409 > commplex-main [ACK] Seq=70954 Ack=2 Win=65535 Len=1448 TSV=2766126928 TSER=2766126634
    188 0.003630    127.0.0.1             127.0.0.1             TCP      63409 > commplex-main [ACK] Seq=63714 Ack=2 Win=65535 Len=1448 TSV=2766126768 TSER=2766126487
    189 0.003662    127.0.0.1             127.0.0.1             TCP      63409 > commplex-main [ACK] Seq=72402 Ack=2 Win=65535 Len=1448 TSV=2766126958 TSER=2766126660
    190 0.003667    127.0.0.1             127.0.0.1             TCP      commplex-main > 63409 [ACK] Seq=2 Ack=63714 Win=65535 Len=0 TSV=2766126969 TSER=2766126690
    191 0.003693    127.0.0.1             127.0.0.1             TCP      commplex-main > 63409 [ACK] Seq=2 Ack=65162 Win=64087 Len=0 TSV=2766127008 TSER=2766126768
    192 0.003704    127.0.0.1             127.0.0.1             TCP      63409 > commplex-main [ACK] Seq=65162 Ack=2 Win=65535 Len=1448 TSV=2766126796 TSER=2766126497
    193 0.003726    127.0.0.1             127.0.0.1             TCP      63409 > commplex-main [ACK] Seq=66610 Ack=2 Win=65535 Len=1448 TSV=2766126822 TSER=2766126532
    194 0.003763    127.0.0.1             127.0.0.1             TCP      commplex-main > 63409 [ACK] Seq=2 Ack=66610 Win=65535 Len=0 TSV=2766127063 TSER=2766126796
    195 0.003783    127.0.0.1             127.0.0.1             TCP      commplex-main > 63409 [ACK] Seq=2 Ack=68058 Win=64087 Len=0 TSV=2766127101 TSER=2766126822
    196 0.003787    127.0.0.1             127.0.0.1             TCP      63409 > commplex-main [ACK] Seq=68058 Ack=2 Win=65535 Len=1448 TSV=2766126853 TSER=2766126567
    197 0.003816    127.0.0.1             127.0.0.1             TCP      63409 > commplex-main [ACK] Seq=69506 Ack=2 Win=65535 Len=1448 TSV=2766126897 TSER=2766126576
    198 0.003854    127.0.0.1             127.0.0.1             TCP      commplex-main > 63409 [ACK] Seq=2 Ack=69506 Win=64087 Len=0 TSV=2766127154 TSER=2766126853
    199 0.003866    127.0.0.1             127.0.0.1             TCP      commplex-main > 63409 [ACK] Seq=2 Ack=70954 Win=64087 Len=0 TSV=2766127186 TSER=2766126897
    200 0.003874    127.0.0.1             127.0.0.1             TCP      63409 > commplex-main [ACK] Seq=70954 Ack=2 Win=65535 Len=1448 TSV=2766126928 TSER=2766126634
    201 0.003907    127.0.0.1             127.0.0.1             TCP      commplex-main > 63409 [ACK] Seq=2 Ack=72402 Win=64087 Len=0 TSV=2766127231 TSER=2766126928
    202 0.003922    127.0.0.1             127.0.0.1             TCP      63409 > commplex-main [ACK] Seq=72402 Ack=2 Win=65535 Len=1448 TSV=2766126958 TSER=2766126660
    203 0.003951    127.0.0.1             127.0.0.1             TCP      commplex-main > 63409 [ACK] Seq=2 Ack=73850 Win=65535 Len=0 TSV=2766127278 TSER=2766126958
    204 0.003966    127.0.0.1             127.0.0.1             TCP      commplex-main > 63409 [ACK] Seq=2 Ack=63714 Win=65535 Len=0 TSV=2766126969 TSER=2766126690
    205 0.004023    127.0.0.1             127.0.0.1             TCP      63409 > commplex-main [ACK] Seq=73850 Ack=2 Win=65535 Len=1448 TSV=2766127348 TSER=2766126969
    206 0.004037    127.0.0.1             127.0.0.1             TCP      63409 > commplex-main [ACK] Seq=75298 Ack=2 Win=65535 Len=1448 TSV=2766127359 TSER=2766126969
    207 0.004043    127.0.0.1             127.0.0.1             TCP      commplex-main > 63409 [ACK] Seq=2 Ack=65162 Win=64087 Len=0 TSV=2766127008 TSER=2766126768
    208 0.004097    127.0.0.1             127.0.0.1             TCP      63409 > commplex-main [ACK] Seq=76746 Ack=2 Win=65535 Len=1448 TSV=2766127419 TSER=2766127008
    209 0.004113    127.0.0.1             127.0.0.1             TCP      commplex-main > 63409 [ACK] Seq=2 Ack=66610 Win=65535 Len=0 TSV=2766127063 TSER=2766126796
    210 0.004124    127.0.0.1             127.0.0.1             TCP      commplex-main > 63409 [ACK] Seq=2 Ack=68058 Win=64087 Len=0 TSV=2766127101 TSER=2766126822
    211 0.004133    127.0.0.1             127.0.0.1             TCP      commplex-main > 63409 [ACK] Seq=2 Ack=69506 Win=64087 Len=0 TSV=2766127154 TSER=2766126853
    212 0.004139    127.0.0.1             127.0.0.1             TCP      commplex-main > 63409 [ACK] Seq=2 Ack=70954 Win=64087 Len=0 TSV=2766127186 TSER=2766126897
    213 0.004147    127.0.0.1             127.0.0.1             TCP      commplex-main > 63409 [ACK] Seq=2 Ack=72402 Win=64087 Len=0 TSV=2766127231 TSER=2766126928
    214 0.004153    127.0.0.1             127.0.0.1             TCP      commplex-main > 63409 [ACK] Seq=2 Ack=73850 Win=65535 Len=0 TSV=2766127278 TSER=2766126958
    215 0.004163    127.0.0.1             127.0.0.1             TCP      63409 > commplex-main [ACK] Seq=73850 Ack=2 Win=65535 Len=1448 TSV=2766127348 TSER=2766126969
    216 0.004169    127.0.0.1             127.0.0.1             TCP      63409 > commplex-main [ACK] Seq=75298 Ack=2 Win=65535 Len=1448 TSV=2766127359 TSER=2766126969
    217 0.004177    127.0.0.1             127.0.0.1             TCP      63409 > commplex-main [ACK] Seq=76746 Ack=2 Win=65535 Len=1448 TSV=2766127419 TSER=2766127008
    218 0.004233    127.0.0.1             127.0.0.1             TCP      63409 > commplex-main [ACK] Seq=78194 Ack=2 Win=65535 Len=1448 TSV=2766127554 TSER=2766127063
    219 0.004257    127.0.0.1             127.0.0.1             TCP      63409 > commplex-main [ACK] Seq=78194 Ack=2 Win=65535 Len=1448 TSV=2766127554 TSER=2766127063
    220 0.004283    127.0.0.1             127.0.0.1             TCP      63409 > commplex-main [ACK] Seq=79642 Ack=2 Win=65535 Len=1448 TSV=2766127589 TSER=2766127101
    221 0.004299    127.0.0.1             127.0.0.1             TCP      63409 > commplex-main [ACK] Seq=81090 Ack=2 Win=65535 Len=1448 TSV=2766127621 TSER=2766127154
    222 0.004325    127.0.0.1             127.0.0.1             TCP      63409 > commplex-main [ACK] Seq=79642 Ack=2 Win=65535 Len=1448 TSV=2766127589 TSER=2766127101
    223 0.004341    127.0.0.1             127.0.0.1             TCP      63409 > commplex-main [ACK] Seq=82538 Ack=2 Win=65535 Len=1448 TSV=2766127651 TSER=2766127186
    224 0.004366    127.0.0.1             127.0.0.1             TCP      63409 > commplex-main [ACK] Seq=83986 Ack=2 Win=65535 Len=1448 TSV=2766127689 TSER=2766127231
    225 0.004391    127.0.0.1             127.0.0.1             TCP      63409 > commplex-main [ACK] Seq=81090 Ack=2 Win=65535 Len=1448 TSV=2766127621 TSER=2766127154
    226 0.004407    127.0.0.1             127.0.0.1             TCP      63409 > commplex-main [ACK] Seq=85434 Ack=2 Win=65535 Len=1448 TSV=2766127722 TSER=2766127278
    227 0.004420    127.0.0.1             127.0.0.1             TCP      commplex-main > 63409 [ACK] Seq=2 Ack=75298 Win=65535 Len=0 TSV=2766127749 TSER=2766127348
    228 0.004443    127.0.0.1             127.0.0.1             TCP      commplex-main > 63409 [ACK] Seq=2 Ack=76746 Win=64087 Len=0 TSV=2766127767 TSER=2766127359
    229 0.004454    127.0.0.1             127.0.0.1             TCP      commplex-main > 63409 [ACK] Seq=2 Ack=78194 Win=62639 Len=0 TSV=2766127776 TSER=2766127419
    230 0.004463    127.0.0.1             127.0.0.1             TCP      commplex-main > 63409 [ACK] Seq=2 Ack=79642 Win=61191 Len=0 TSV=2766127782 TSER=2766127554
    231 0.004468    127.0.0.1             127.0.0.1             TCP      commplex-main > 63409 [ACK] Seq=2 Ack=81090 Win=59743 Len=0 TSV=2766127791 TSER=2766127589
    232 0.004488    127.0.0.1             127.0.0.1             TCP      63409 > commplex-main [ACK] Seq=82538 Ack=2 Win=65535 Len=1448 TSV=2766127651 TSER=2766127186
    233 0.004508    127.0.0.1             127.0.0.1             TCP      63409 > commplex-main [ACK] Seq=83986 Ack=2 Win=65535 Len=1448 TSV=2766127689 TSER=2766127231
    234 0.004518    127.0.0.1             127.0.0.1             TCP      commplex-main > 63409 [ACK] Seq=2 Ack=82538 Win=58295 Len=0 TSV=2766127833 TSER=2766127621
    235 0.004543    127.0.0.1             127.0.0.1             TCP      63409 > commplex-main [ACK] Seq=85434 Ack=2 Win=65535 Len=1448 TSV=2766127722 TSER=2766127278
    236 0.004563    127.0.0.1             127.0.0.1             TCP      commplex-main > 63409 [ACK] Seq=2 Ack=83986 Win=64087 Len=0 TSV=2766127879 TSER=2766127651
    237 0.004569    127.0.0.1             127.0.0.1             TCP      commplex-main > 63409 [ACK] Seq=2 Ack=85434 Win=62639 Len=0 TSV=2766127896 TSER=2766127689
    238 0.004605    127.0.0.1             127.0.0.1             TCP      commplex-main > 63409 [ACK] Seq=2 Ack=75298 Win=65535 Len=0 TSV=2766127749 TSER=2766127348
    239 0.004629    127.0.0.1             127.0.0.1             TCP      commplex-main > 63409 [ACK] Seq=2 Ack=86882 Win=64087 Len=0 TSV=2766127908 TSER=2766127722
    240 0.004698    127.0.0.1             127.0.0.1             TCP      63409 > commplex-main [ACK] Seq=86882 Ack=2 Win=65535 Len=1448 TSV=2766127994 TSER=2766127749
    241 0.004719    127.0.0.1             127.0.0.1             TCP      commplex-main > 63409 [ACK] Seq=2 Ack=76746 Win=64087 Len=0 TSV=2766127767 TSER=2766127359
    242 0.004729    127.0.0.1             127.0.0.1             TCP      commplex-main > 63409 [ACK] Seq=2 Ack=78194 Win=62639 Len=0 TSV=2766127776 TSER=2766127419
    243 0.004739    127.0.0.1             127.0.0.1             TCP      commplex-main > 63409 [ACK] Seq=2 Ack=79642 Win=61191 Len=0 TSV=2766127782 TSER=2766127554
    244 0.004746    127.0.0.1             127.0.0.1             TCP      commplex-main > 63409 [ACK] Seq=2 Ack=81090 Win=59743 Len=0 TSV=2766127791 TSER=2766127589
    245 0.004789    127.0.0.1             127.0.0.1             TCP      63409 > commplex-main [ACK] Seq=88330 Ack=2 Win=65535 Len=1448 TSV=2766128100 TSER=2766127767
    246 0.004795    127.0.0.1             127.0.0.1             TCP      63409 > commplex-main [ACK] Seq=89778 Ack=2 Win=65535 Len=1448 TSV=2766128102 TSER=2766127767
    247 0.004821    127.0.0.1             127.0.0.1             TCP      commplex-main > 63409 [ACK] Seq=2 Ack=82538 Win=58295 Len=0 TSV=2766127833 TSER=2766127621
    248 0.004840    127.0.0.1             127.0.0.1             TCP      63409 > commplex-main [ACK] Seq=91226 Ack=2 Win=65535 Len=1448 TSV=2766128161 TSER=2766127776
    249 0.004866    127.0.0.1             127.0.0.1             TCP      commplex-main > 63409 [ACK] Seq=2 Ack=83986 Win=64087 Len=0 TSV=2766127879 TSER=2766127651
    250 0.004883    127.0.0.1             127.0.0.1             TCP      63409 > commplex-main [ACK] Seq=92674 Ack=2 Win=65535 Len=1448 TSV=2766128206 TSER=2766127782
    251 0.004902    127.0.0.1             127.0.0.1             TCP      commplex-main > 63409 [ACK] Seq=2 Ack=85434 Win=62639 Len=0 TSV=2766127896 TSER=2766127689
    252 0.004921    127.0.0.1             127.0.0.1             TCP      commplex-main > 63409 [ACK] Seq=2 Ack=86882 Win=64087 Len=0 TSV=2766127908 TSER=2766127722
    253 0.004943    127.0.0.1             127.0.0.1             TCP      63409 > commplex-main [ACK] Seq=86882 Ack=2 Win=65535 Len=1448 TSV=2766127994 TSER=2766127749
    254 0.004967    127.0.0.1             127.0.0.1             TCP      63409 > commplex-main [ACK] Seq=88330 Ack=2 Win=65535 Len=1448 TSV=2766128100 TSER=2766127767
    255 0.004988    127.0.0.1             127.0.0.1             TCP      63409 > commplex-main [ACK] Seq=89778 Ack=2 Win=65535 Len=1448 TSV=2766128102 TSER=2766127767
    256 0.005010    127.0.0.1             127.0.0.1             TCP      63409 > commplex-main [ACK] Seq=91226 Ack=2 Win=65535 Len=1448 TSV=2766128161 TSER=2766127776
    257 0.005032    127.0.0.1             127.0.0.1             TCP      63409 > commplex-main [ACK] Seq=92674 Ack=2 Win=65535 Len=1448 TSV=2766128206 TSER=2766127782
    258 0.005066    127.0.0.1             127.0.0.1             TCP      63409 > commplex-main [ACK] Seq=94122 Ack=2 Win=65535 Len=1448 TSV=2766128266 TSER=2766127791
    259 0.005072    127.0.0.1             127.0.0.1             TCP      63409 > commplex-main [ACK] Seq=95570 Ack=2 Win=65535 Len=1448 TSV=2766128303 TSER=2766127833
    260 0.005084    127.0.0.1             127.0.0.1             TCP      63409 > commplex-main [ACK] Seq=97018 Ack=2 Win=65535 Len=1448 TSV=2766128329 TSER=2766127879
    261 0.005109    127.0.0.1             127.0.0.1             TCP      63409 > commplex-main [ACK] Seq=98466 Ack=2 Win=65535 Len=1448 TSV=2766128355 TSER=2766127896
    262 0.005128    127.0.0.1             127.0.0.1             TCP      63409 > commplex-main [ACK] Seq=99914 Ack=2 Win=65535 Len=1448 TSV=2766128386 TSER=2766127908
    263 0.005136    127.0.0.1             127.0.0.1             TCP      commplex-main > 63409 [ACK] Seq=2 Ack=88330 Win=65535 Len=0 TSV=2766128424 TSER=2766127994
    264 0.005140    127.0.0.1             127.0.0.1             TCP      commplex-main > 63409 [ACK] Seq=2 Ack=89778 Win=64087 Len=0 TSV=2766128453 TSER=2766128100
    265 0.005164    127.0.0.1             127.0.0.1             TCP      commplex-main > 63409 [ACK] Seq=2 Ack=91226 Win=62639 Len=0 TSV=2766128468 TSER=2766128102
    266 0.005179    127.0.0.1             127.0.0.1             TCP      commplex-main > 63409 [ACK] Seq=2 Ack=92674 Win=61191 Len=0 TSV=2766128474 TSER=2766128161
    267 0.005185    127.0.0.1             127.0.0.1             TCP      commplex-main > 63409 [ACK] Seq=2 Ack=94122 Win=59743 Len=0 TSV=2766128485 TSER=2766128206
    268 0.005190    127.0.0.1             127.0.0.1             TCP      63409 > commplex-main [ACK] Seq=94122 Ack=2 Win=65535 Len=1448 TSV=2766128266 TSER=2766127791
    269 0.005210    127.0.0.1             127.0.0.1             TCP      63409 > commplex-main [ACK] Seq=95570 Ack=2 Win=65535 Len=1448 TSV=2766128303 TSER=2766127833
    270 0.005236    127.0.0.1             127.0.0.1             TCP      commplex-main > 63409 [ACK] Seq=2 Ack=95570 Win=65535 Len=0 TSV=2766128561 TSER=2766128266
    271 0.005252    127.0.0.1             127.0.0.1             TCP      commplex-main > 63409 [ACK] Seq=2 Ack=97018 Win=64087 Len=0 TSV=2766128575 TSER=2766128303
    272 0.005265    127.0.0.1             127.0.0.1             TCP      63409 > commplex-main [ACK] Seq=97018 Ack=2 Win=65535 Len=1448 TSV=2766128329 TSER=2766127879
    273 0.005286    127.0.0.1             127.0.0.1             TCP      63409 > commplex-main [ACK] Seq=98466 Ack=2 Win=65535 Len=1448 TSV=2766128355 TSER=2766127896
    274 0.005314    127.0.0.1             127.0.0.1             TCP      commplex-main > 63409 [ACK] Seq=2 Ack=98466 Win=65535 Len=0 TSV=2766128639 TSER=2766128329
    275 0.005325    127.0.0.1             127.0.0.1             TCP      63409 > commplex-main [ACK] Seq=99914 Ack=2 Win=65535 Len=1448 TSV=2766128386 TSER=2766127908
    276 0.005337    127.0.0.1             127.0.0.1             TCP      commplex-main > 63409 [ACK] Seq=2 Ack=99914 Win=64087 Len=0 TSV=2766128660 TSER=2766128355
    277 0.005371    127.0.0.1             127.0.0.1             TCP      commplex-main > 63409 [ACK] Seq=2 Ack=101362 Win=64087 Len=0 TSV=2766128692 TSER=2766128386
    278 0.005387    127.0.0.1             127.0.0.1             TCP      commplex-main > 63409 [ACK] Seq=2 Ack=88330 Win=65535 Len=0 TSV=2766128424 TSER=2766127994
    279 0.005409    127.0.0.1             127.0.0.1             TCP      commplex-main > 63409 [ACK] Seq=2 Ack=89778 Win=64087 Len=0 TSV=2766128453 TSER=2766128100
    280 0.005428    127.0.0.1             127.0.0.1             TCP      commplex-main > 63409 [ACK] Seq=2 Ack=91226 Win=62639 Len=0 TSV=2766128468 TSER=2766128102
    281 0.005449    127.0.0.1             127.0.0.1             TCP      commplex-main > 63409 [ACK] Seq=2 Ack=92674 Win=61191 Len=0 TSV=2766128474 TSER=2766128161
    282 0.005461    127.0.0.1             127.0.0.1             TCP      63409 > commplex-main [ACK] Seq=101362 Ack=2 Win=65535 Len=1448 TSV=2766128786 TSER=2766128424
    283 0.005479    127.0.0.1             127.0.0.1             TCP      commplex-main > 63409 [ACK] Seq=2 Ack=94122 Win=59743 Len=0 TSV=2766128485 TSER=2766128206
    284 0.005498    127.0.0.1             127.0.0.1             TCP      commplex-main > 63409 [ACK] Seq=2 Ack=95570 Win=65535 Len=0 TSV=2766128561 TSER=2766128266
    285 0.005517    127.0.0.1             127.0.0.1             TCP      commplex-main > 63409 [ACK] Seq=2 Ack=97018 Win=64087 Len=0 TSV=2766128575 TSER=2766128303
    286 0.005530    127.0.0.1             127.0.0.1             TCP      63409 > commplex-main [ACK] Seq=102810 Ack=2 Win=65535 Len=1448 TSV=2766128843 TSER=2766128453
    287 0.005543    127.0.0.1             127.0.0.1             TCP      commplex-main > 63409 [ACK] Seq=2 Ack=98466 Win=65535 Len=0 TSV=2766128639 TSER=2766128329
    288 0.005565    127.0.0.1             127.0.0.1             TCP      commplex-main > 63409 [ACK] Seq=2 Ack=99914 Win=64087 Len=0 TSV=2766128660 TSER=2766128355
    289 0.005588    127.0.0.1             127.0.0.1             TCP      commplex-main > 63409 [ACK] Seq=2 Ack=101362 Win=64087 Len=0 TSV=2766128692 TSER=2766128386
    290 0.005612    127.0.0.1             127.0.0.1             TCP      63409 > commplex-main [ACK] Seq=101362 Ack=2 Win=65535 Len=1448 TSV=2766128786 TSER=2766128424
    291 0.005633    127.0.0.1             127.0.0.1             TCP      63409 > commplex-main [ACK] Seq=102810 Ack=2 Win=65535 Len=1448 TSV=2766128843 TSER=2766128453
    292 0.005687    127.0.0.1             127.0.0.1             TCP      63409 > commplex-main [ACK] Seq=104258 Ack=2 Win=65535 Len=1448 TSV=2766128881 TSER=2766128468
    293 0.005694    127.0.0.1             127.0.0.1             TCP      63409 > commplex-main [ACK] Seq=105706 Ack=2 Win=65535 Len=1448 TSV=2766128915 TSER=2766128474
    294 0.005699    127.0.0.1             127.0.0.1             TCP      63409 > commplex-main [ACK] Seq=107154 Ack=2 Win=65535 Len=1448 TSV=2766128917 TSER=2766128474
    295 0.005718    127.0.0.1             127.0.0.1             TCP      63409 > commplex-main [ACK] Seq=108602 Ack=2 Win=65535 Len=1448 TSV=2766128948 TSER=2766128485
    296 0.005724    127.0.0.1             127.0.0.1             TCP      63409 > commplex-main [ACK] Seq=110050 Ack=2 Win=65535 Len=1448 TSV=2766128983 TSER=2766128561
    297 0.005735    127.0.0.1             127.0.0.1             TCP      63409 > commplex-main [ACK] Seq=111498 Ack=2 Win=65535 Len=1448 TSV=2766129055 TSER=2766128575
    298 0.005767    127.0.0.1             127.0.0.1             TCP      63409 > commplex-main [ACK] Seq=104258 Ack=2 Win=65535 Len=1448 TSV=2766128881 TSER=2766128468
    299 0.005771    127.0.0.1             127.0.0.1             TCP      63409 > commplex-main [ACK] Seq=112946 Ack=2 Win=65535 Len=1448 TSV=2766129091 TSER=2766128639
    300 0.005799    127.0.0.1             127.0.0.1             TCP      63409 > commplex-main [ACK] Seq=105706 Ack=2 Win=65535 Len=1448 TSV=2766128915 TSER=2766128474
    301 0.005823    127.0.0.1             127.0.0.1             TCP      63409 > commplex-main [ACK] Seq=107154 Ack=2 Win=65535 Len=1448 TSV=2766128917 TSER=2766128474
    302 0.005827    127.0.0.1             127.0.0.1             TCP      63409 > commplex-main [ACK] Seq=114394 Ack=2 Win=65535 Len=1448 TSV=2766129149 TSER=2766128660
    303 0.005857    127.0.0.1             127.0.0.1             TCP      63409 > commplex-main [ACK] Seq=108602 Ack=2 Win=65535 Len=1448 TSV=2766128948 TSER=2766128485
    304 0.005881    127.0.0.1             127.0.0.1             TCP      63409 > commplex-main [ACK] Seq=110050 Ack=2 Win=65535 Len=1448 TSV=2766128983 TSER=2766128561
    305 0.005886    127.0.0.1             127.0.0.1             TCP      63409 > commplex-main [ACK] Seq=115842 Ack=2 Win=65535 Len=1448 TSV=2766129203 TSER=2766128692
    306 0.005915    127.0.0.1             127.0.0.1             TCP      commplex-main > 63409 [ACK] Seq=2 Ack=102810 Win=65535 Len=0 TSV=2766129231 TSER=2766128786
    307 0.005935    127.0.0.1             127.0.0.1             TCP      commplex-main > 63409 [ACK] Seq=2 Ack=104258 Win=64087 Len=0 TSV=2766129255 TSER=2766128843
    308 0.005940    127.0.0.1             127.0.0.1             TCP      commplex-main > 63409 [ACK] Seq=2 Ack=105706 Win=62639 Len=0 TSV=2766129261 TSER=2766128881
    309 0.005946    127.0.0.1             127.0.0.1             TCP      commplex-main > 63409 [ACK] Seq=2 Ack=107154 Win=61191 Len=0 TSV=2766129269 TSER=2766128915
    310 0.005951    127.0.0.1             127.0.0.1             TCP      commplex-main > 63409 [ACK] Seq=2 Ack=108602 Win=59743 Len=0 TSV=2766129278 TSER=2766128917
    311 0.005956    127.0.0.1             127.0.0.1             TCP      63409 > commplex-main [ACK] Seq=111498 Ack=2 Win=65535 Len=1448 TSV=2766129055 TSER=2766128575
    312 0.005971    127.0.0.1             127.0.0.1             TCP      commplex-main > 63409 [ACK] Seq=2 Ack=110050 Win=58295 Len=0 TSV=2766129290 TSER=2766128948
    313 0.005977    127.0.0.1             127.0.0.1             TCP      commplex-main > 63409 [ACK] Seq=2 Ack=111498 Win=56847 Len=0 TSV=2766129305 TSER=2766128983
    314 0.006003    127.0.0.1             127.0.0.1             TCP      commplex-main > 63409 [ACK] Seq=2 Ack=112946 Win=64087 Len=0 TSV=2766129320 TSER=2766129055
    315 0.006028    127.0.0.1             127.0.0.1             TCP      63409 > commplex-main [ACK] Seq=112946 Ack=2 Win=65535 Len=1448 TSV=2766129091 TSER=2766128639
    316 0.006061    127.0.0.1             127.0.0.1             TCP      63409 > commplex-main [ACK] Seq=114394 Ack=2 Win=65535 Len=1448 TSV=2766129149 TSER=2766128660
    317 0.006082    127.0.0.1             127.0.0.1             TCP      commplex-main > 63409 [ACK] Seq=2 Ack=114394 Win=65535 Len=0 TSV=2766129402 TSER=2766129091
    318 0.006104    127.0.0.1             127.0.0.1             TCP      commplex-main > 63409 [ACK] Seq=2 Ack=115842 Win=65535 Len=0 TSV=2766129424 TSER=2766129149
    319 0.006121    127.0.0.1             127.0.0.1             TCP      63409 > commplex-main [ACK] Seq=115842 Ack=2 Win=65535 Len=1448 TSV=2766129203 TSER=2766128692
    320 0.006131    127.0.0.1             127.0.0.1             TCP      commplex-main > 63409 [ACK] Seq=2 Ack=102810 Win=65535 Len=0 TSV=2766129231 TSER=2766128786
    321 0.006140    127.0.0.1             127.0.0.1             TCP      commplex-main > 63409 [ACK] Seq=2 Ack=104258 Win=64087 Len=0 TSV=2766129255 TSER=2766128843
    322 0.006146    127.0.0.1             127.0.0.1             TCP      commplex-main > 63409 [ACK] Seq=2 Ack=105706 Win=62639 Len=0 TSV=2766129261 TSER=2766128881
    323 0.006155    127.0.0.1             127.0.0.1             TCP      commplex-main > 63409 [ACK] Seq=2 Ack=107154 Win=61191 Len=0 TSV=2766129269 TSER=2766128915
    324 0.006161    127.0.0.1             127.0.0.1             TCP      commplex-main > 63409 [ACK] Seq=2 Ack=108602 Win=59743 Len=0 TSV=2766129278 TSER=2766128917
    325 0.006169    127.0.0.1             127.0.0.1             TCP      commplex-main > 63409 [ACK] Seq=2 Ack=110050 Win=58295 Len=0 TSV=2766129290 TSER=2766128948
    326 0.006175    127.0.0.1             127.0.0.1             TCP      commplex-main > 63409 [ACK] Seq=2 Ack=111498 Win=56847 Len=0 TSV=2766129305 TSER=2766128983
    327 0.006183    127.0.0.1             127.0.0.1             TCP      commplex-main > 63409 [ACK] Seq=2 Ack=112946 Win=64087 Len=0 TSV=2766129320 TSER=2766129055
    328 0.006189    127.0.0.1             127.0.0.1             TCP      commplex-main > 63409 [ACK] Seq=2 Ack=114394 Win=65535 Len=0 TSV=2766129402 TSER=2766129091
    329 0.006198    127.0.0.1             127.0.0.1             TCP      commplex-main > 63409 [ACK] Seq=2 Ack=115842 Win=65535 Len=0 TSV=2766129424 TSER=2766129149
    330 0.006231    127.0.0.1             127.0.0.1             TCP      commplex-main > 63409 [ACK] Seq=2 Ack=117290 Win=65535 Len=0 TSV=2766129555 TSER=2766129203
    331 0.006281    127.0.0.1             127.0.0.1             TCP      63409 > commplex-main [ACK] Seq=117290 Ack=2 Win=65535 Len=1448 TSV=2766129604 TSER=2766129231
    332 0.006312    127.0.0.1             127.0.0.1             TCP      63409 > commplex-main [ACK] Seq=118738 Ack=2 Win=65535 Len=1448 TSV=2766129632 TSER=2766129255
    333 0.006329    127.0.0.1             127.0.0.1             TCP      commplex-main > 63409 [ACK] Seq=2 Ack=117290 Win=65535 Len=0 TSV=2766129555 TSER=2766129203
    334 0.006359    127.0.0.1             127.0.0.1             TCP      63409 > commplex-main [ACK] Seq=120186 Ack=2 Win=65535 Len=1448 TSV=2766129679 TSER=2766129261
    335 0.006370    127.0.0.1             127.0.0.1             TCP      63409 > commplex-main [ACK] Seq=117290 Ack=2 Win=65535 Len=1448 TSV=2766129604 TSER=2766129231
    336 0.006399    127.0.0.1             127.0.0.1             TCP      63409 > commplex-main [ACK] Seq=118738 Ack=2 Win=65535 Len=1448 TSV=2766129632 TSER=2766129255
    337 0.006414    127.0.0.1             127.0.0.1             TCP      63409 > commplex-main [ACK] Seq=121634 Ack=2 Win=65535 Len=1448 TSV=2766129723 TSER=2766129269
    338 0.006435    127.0.0.1             127.0.0.1             TCP      63409 > commplex-main [ACK] Seq=120186 Ack=2 Win=65535 Len=1448 TSV=2766129679 TSER=2766129261
    339 0.006456    127.0.0.1             127.0.0.1             TCP      63409 > commplex-main [ACK] Seq=123082 Ack=2 Win=65535 Len=1448 TSV=2766129780 TSER=2766129278
    340 0.006462    127.0.0.1             127.0.0.1             TCP      63409 > commplex-main [ACK] Seq=124530 Ack=2 Win=65535 Len=1448 TSV=2766129787 TSER=2766129278
    341 0.006488    127.0.0.1             127.0.0.1             TCP      63409 > commplex-main [ACK] Seq=121634 Ack=2 Win=65535 Len=1448 TSV=2766129723 TSER=2766129269
    342 0.006505    127.0.0.1             127.0.0.1             TCP      63409 > commplex-main [ACK] Seq=125978 Ack=2 Win=65535 Len=1448 TSV=2766129827 TSER=2766129290
    343 0.006531    127.0.0.1             127.0.0.1             TCP      63409 > commplex-main [ACK] Seq=123082 Ack=2 Win=65535 Len=1448 TSV=2766129780 TSER=2766129278
    344 0.006545    127.0.0.1             127.0.0.1             TCP      63409 > commplex-main [ACK] Seq=127426 Ack=2 Win=65535 Len=1448 TSV=2766129868 TSER=2766129305
    345 0.006568    127.0.0.1             127.0.0.1             TCP      63409 > commplex-main [ACK] Seq=124530 Ack=2 Win=65535 Len=1448 TSV=2766129787 TSER=2766129278
    346 0.006595    127.0.0.1             127.0.0.1             TCP      63409 > commplex-main [ACK] Seq=125978 Ack=2 Win=65535 Len=1448 TSV=2766129827 TSER=2766129290
    347 0.006611    127.0.0.1             127.0.0.1             TCP      63409 > commplex-main [ACK] Seq=128874 Ack=2 Win=65535 Len=1448 TSV=2766129920 TSER=2766129320
    348 0.006636    127.0.0.1             127.0.0.1             TCP      63409 > commplex-main [ACK] Seq=127426 Ack=2 Win=65535 Len=1448 TSV=2766129868 TSER=2766129305
    349 0.006651    127.0.0.1             127.0.0.1             TCP      63409 > commplex-main [ACK] Seq=130322 Ack=2 Win=65535 Len=1448 TSV=2766129966 TSER=2766129402
    350 0.006688    127.0.0.1             127.0.0.1             TCP      63409 > commplex-main [ACK] Seq=128874 Ack=2 Win=65535 Len=1448 TSV=2766129920 TSER=2766129320
    351 0.006703    127.0.0.1             127.0.0.1             TCP      63409 > commplex-main [ACK] Seq=131770 Ack=2 Win=65535 Len=1448 TSV=2766130018 TSER=2766129424
    352 0.006742    127.0.0.1             127.0.0.1             TCP      63409 > commplex-main [ACK] Seq=133218 Ack=2 Win=65535 Len=1448 TSV=2766130058 TSER=2766129555
    353 0.006766    127.0.0.1             127.0.0.1             TCP      commplex-main > 63409 [ACK] Seq=2 Ack=118738 Win=65535 Len=0 TSV=2766130093 TSER=2766129604
    354 0.006783    127.0.0.1             127.0.0.1             TCP      commplex-main > 63409 [ACK] Seq=2 Ack=120186 Win=64087 Len=0 TSV=2766130102 TSER=2766129632
    355 0.006789    127.0.0.1             127.0.0.1             TCP      commplex-main > 63409 [ACK] Seq=2 Ack=121634 Win=62639 Len=0 TSV=2766130117 TSER=2766129679
    356 0.006799    127.0.0.1             127.0.0.1             TCP      commplex-main > 63409 [ACK] Seq=2 Ack=123082 Win=61191 Len=0 TSV=2766130125 TSER=2766129723
    357 0.006813    127.0.0.1             127.0.0.1             TCP      commplex-main > 63409 [ACK] Seq=2 Ack=124530 Win=59743 Len=0 TSV=2766130138 TSER=2766129780
    358 0.006818    127.0.0.1             127.0.0.1             TCP      commplex-main > 63409 [ACK] Seq=2 Ack=125978 Win=58295 Len=0 TSV=2766130147 TSER=2766129787
    359 0.006835    127.0.0.1             127.0.0.1             TCP      commplex-main > 63409 [ACK] Seq=2 Ack=127426 Win=56847 Len=0 TSV=2766130160 TSER=2766129827
    360 0.006840    127.0.0.1             127.0.0.1             TCP      commplex-main > 63409 [ACK] Seq=2 Ack=128874 Win=55399 Len=0 TSV=2766130169 TSER=2766129868
    361 0.006856    127.0.0.1             127.0.0.1             TCP      commplex-main > 63409 [ACK] Seq=2 Ack=130322 Win=53951 Len=0 TSV=2766130180 TSER=2766129920
    362 0.006898    127.0.0.1             127.0.0.1             TCP      63409 > commplex-main [ACK] Seq=130322 Ack=2 Win=65535 Len=1448 TSV=2766129966 TSER=2766129402
    363 0.006911    127.0.0.1             127.0.0.1             TCP      63409 > commplex-main [ACK] Seq=131770 Ack=2 Win=65535 Len=1448 TSV=2766130018 TSER=2766129424
    364 0.006918    127.0.0.1             127.0.0.1             TCP      63409 > commplex-main [ACK] Seq=133218 Ack=2 Win=65535 Len=1448 TSV=2766130058 TSER=2766129555
    365 0.006927    127.0.0.1             127.0.0.1             TCP      commplex-main > 63409 [ACK] Seq=2 Ack=118738 Win=65535 Len=0 TSV=2766130093 TSER=2766129604
    366 0.006933    127.0.0.1             127.0.0.1             TCP      commplex-main > 63409 [ACK] Seq=2 Ack=120186 Win=64087 Len=0 TSV=2766130102 TSER=2766129632
    367 0.006942    127.0.0.1             127.0.0.1             TCP      commplex-main > 63409 [ACK] Seq=2 Ack=121634 Win=62639 Len=0 TSV=2766130117 TSER=2766129679
    368 0.006948    127.0.0.1             127.0.0.1             TCP      commplex-main > 63409 [ACK] Seq=2 Ack=123082 Win=61191 Len=0 TSV=2766130125 TSER=2766129723
    369 0.006956    127.0.0.1             127.0.0.1             TCP      commplex-main > 63409 [ACK] Seq=2 Ack=124530 Win=59743 Len=0 TSV=2766130138 TSER=2766129780
    370 0.006962    127.0.0.1             127.0.0.1             TCP      commplex-main > 63409 [ACK] Seq=2 Ack=125978 Win=58295 Len=0 TSV=2766130147 TSER=2766129787
    371 0.006970    127.0.0.1             127.0.0.1             TCP      commplex-main > 63409 [ACK] Seq=2 Ack=127426 Win=56847 Len=0 TSV=2766130160 TSER=2766129827
    372 0.006976    127.0.0.1             127.0.0.1             TCP      commplex-main > 63409 [ACK] Seq=2 Ack=128874 Win=55399 Len=0 TSV=2766130169 TSER=2766129868
    373 0.006984    127.0.0.1             127.0.0.1             TCP      commplex-main > 63409 [ACK] Seq=2 Ack=130322 Win=53951 Len=0 TSV=2766130180 TSER=2766129920
    374 0.007028    127.0.0.1             127.0.0.1             TCP      commplex-main > 63409 [ACK] Seq=2 Ack=131770 Win=65535 Len=0 TSV=2766130342 TSER=2766129966
    375 0.007034    127.0.0.1             127.0.0.1             TCP      commplex-main > 63409 [ACK] Seq=2 Ack=133218 Win=64087 Len=0 TSV=2766130351 TSER=2766130018
    376 0.007046    127.0.0.1             127.0.0.1             TCP      commplex-main > 63409 [ACK] Seq=2 Ack=134666 Win=62639 Len=0 TSV=2766130369 TSER=2766130058
    377 0.007064    127.0.0.1             127.0.0.1             TCP      commplex-main > 63409 [ACK] Seq=2 Ack=131770 Win=65535 Len=0 TSV=2766130342 TSER=2766129966
    378 0.007083    127.0.0.1             127.0.0.1             TCP      commplex-main > 63409 [ACK] Seq=2 Ack=133218 Win=64087 Len=0 TSV=2766130351 TSER=2766130018
    379 0.007109    127.0.0.1             127.0.0.1             TCP      63409 > commplex-main [ACK] Seq=134666 Ack=2 Win=65535 Len=1448 TSV=2766130427 TSER=2766130093
    380 0.007115    127.0.0.1             127.0.0.1             TCP      commplex-main > 63409 [ACK] Seq=2 Ack=134666 Win=62639 Len=0 TSV=2766130369 TSER=2766130058
    381 0.007136    127.0.0.1             127.0.0.1             TCP      63409 > commplex-main [ACK] Seq=134666 Ack=2 Win=65535 Len=1448 TSV=2766130427 TSER=2766130093
    382 0.007159    127.0.0.1             127.0.0.1             TCP      63409 > commplex-main [ACK] Seq=136114 Ack=2 Win=65535 Len=1448 TSV=2766130477 TSER=2766130102
    383 0.007187    127.0.0.1             127.0.0.1             TCP      63409 > commplex-main [ACK] Seq=136114 Ack=2 Win=65535 Len=1448 TSV=2766130477 TSER=2766130102
    384 0.007204    127.0.0.1             127.0.0.1             TCP      63409 > commplex-main [ACK] Seq=137562 Ack=2 Win=65535 Len=1448 TSV=2766130524 TSER=2766130117
    385 0.007225    127.0.0.1             127.0.0.1             TCP      63409 > commplex-main [ACK] Seq=137562 Ack=2 Win=65535 Len=1448 TSV=2766130524 TSER=2766130117
    386 0.007249    127.0.0.1             127.0.0.1             TCP      63409 > commplex-main [ACK] Seq=139010 Ack=2 Win=65535 Len=1448 TSV=2766130563 TSER=2766130125
    387 0.007275    127.0.0.1             127.0.0.1             TCP      63409 > commplex-main [ACK] Seq=139010 Ack=2 Win=65535 Len=1448 TSV=2766130563 TSER=2766130125
    388 0.007298    127.0.0.1             127.0.0.1             TCP      63409 > commplex-main [ACK] Seq=140458 Ack=2 Win=65535 Len=1448 TSV=2766130611 TSER=2766130138
    389 0.007312    127.0.0.1             127.0.0.1             TCP      63409 > commplex-main [ACK] Seq=140458 Ack=2 Win=65535 Len=1448 TSV=2766130611 TSER=2766130138
    390 0.007334    127.0.0.1             127.0.0.1             TCP      63409 > commplex-main [ACK] Seq=141906 Ack=2 Win=65535 Len=1448 TSV=2766130648 TSER=2766130147
    391 0.007348    127.0.0.1             127.0.0.1             TCP      63409 > commplex-main [ACK] Seq=141906 Ack=2 Win=65535 Len=1448 TSV=2766130648 TSER=2766130147
    392 0.007366    127.0.0.1             127.0.0.1             TCP      63409 > commplex-main [ACK] Seq=143354 Ack=2 Win=65535 Len=1448 TSV=2766130688 TSER=2766130160
    393 0.007371    127.0.0.1             127.0.0.1             TCP      63409 > commplex-main [ACK] Seq=144802 Ack=2 Win=65535 Len=1448 TSV=2766130692 TSER=2766130160
    394 0.007386    127.0.0.1             127.0.0.1             TCP      63409 > commplex-main [ACK] Seq=143354 Ack=2 Win=65535 Len=1448 TSV=2766130688 TSER=2766130160
    395 0.007406    127.0.0.1             127.0.0.1             TCP      63409 > commplex-main [ACK] Seq=144802 Ack=2 Win=65535 Len=1448 TSV=2766130692 TSER=2766130160
    396 0.007420    127.0.0.1             127.0.0.1             TCP      63409 > commplex-main [ACK] Seq=146250 Ack=2 Win=65535 Len=1448 TSV=2766130741 TSER=2766130169
    397 0.007437    127.0.0.1             127.0.0.1             TCP      63409 > commplex-main [ACK] Seq=146250 Ack=2 Win=65535 Len=1448 TSV=2766130741 TSER=2766130169
    398 0.007498    127.0.0.1             127.0.0.1             TCP      63409 > commplex-main [ACK] Seq=147698 Ack=2 Win=65535 Len=1448 TSV=2766130793 TSER=2766130180
    399 0.007519    127.0.0.1             127.0.0.1             TCP      63409 > commplex-main [ACK] Seq=149146 Ack=2 Win=65535 Len=1448 TSV=2766130839 TSER=2766130342
    400 0.007524    127.0.0.1             127.0.0.1             TCP      63409 > commplex-main [ACK] Seq=147698 Ack=2 Win=65535 Len=1448 TSV=2766130793 TSER=2766130180
    401 0.007552    127.0.0.1             127.0.0.1             TCP      63409 > commplex-main [ACK] Seq=149146 Ack=2 Win=65535 Len=1448 TSV=2766130839 TSER=2766130342
    402 0.007571    127.0.0.1             127.0.0.1             TCP      63409 > commplex-main [ACK] Seq=150594 Ack=2 Win=65535 Len=1448 TSV=2766130891 TSER=2766130351
    403 0.007594    127.0.0.1             127.0.0.1             TCP      63409 > commplex-main [ACK] Seq=150594 Ack=2 Win=65535 Len=1448 TSV=2766130891 TSER=2766130351
    404 0.007611    127.0.0.1             127.0.0.1             TCP      63409 > commplex-main [ACK] Seq=152042 Ack=2 Win=65535 Len=1448 TSV=2766130930 TSER=2766130369
    405 0.007616    127.0.0.1             127.0.0.1             TCP      commplex-main > 63409 [ACK] Seq=2 Ack=136114 Win=64087 Len=0 TSV=2766130942 TSER=2766130427
    406 0.007627    127.0.0.1             127.0.0.1             TCP      commplex-main > 63409 [ACK] Seq=2 Ack=137562 Win=62639 Len=0 TSV=2766130951 TSER=2766130477
    407 0.007644    127.0.0.1             127.0.0.1             TCP      commplex-main > 63409 [ACK] Seq=2 Ack=139010 Win=61191 Len=0 TSV=2766130967 TSER=2766130524
    408 0.007652    127.0.0.1             127.0.0.1             TCP      commplex-main > 63409 [ACK] Seq=2 Ack=140458 Win=59743 Len=0 TSV=2766130976 TSER=2766130563
    409 0.007657    127.0.0.1             127.0.0.1             TCP      63409 > commplex-main [ACK] Seq=152042 Ack=2 Win=65535 Len=1448 TSV=2766130930 TSER=2766130369
    410 0.007667    127.0.0.1             127.0.0.1             TCP      commplex-main > 63409 [ACK] Seq=2 Ack=141906 Win=58295 Len=0 TSV=2766130987 TSER=2766130611
    411 0.007672    127.0.0.1             127.0.0.1             TCP      commplex-main > 63409 [ACK] Seq=2 Ack=143354 Win=56847 Len=0 TSV=2766131001 TSER=2766130648
    412 0.007685    127.0.0.1             127.0.0.1             TCP      commplex-main > 63409 [ACK] Seq=2 Ack=144802 Win=55399 Len=0 TSV=2766131009 TSER=2766130688
    413 0.007703    127.0.0.1             127.0.0.1             TCP      commplex-main > 63409 [ACK] Seq=2 Ack=146250 Win=53951 Len=0 TSV=2766131024 TSER=2766130692
    414 0.007729    127.0.0.1             127.0.0.1             TCP      commplex-main > 63409 [ACK] Seq=2 Ack=147698 Win=52503 Len=0 TSV=2766131033 TSER=2766130741
    415 0.007737    127.0.0.1             127.0.0.1             TCP      commplex-main > 63409 [ACK] Seq=2 Ack=149146 Win=64087 Len=0 TSV=2766131056 TSER=2766130793
    416 0.007746    127.0.0.1             127.0.0.1             TCP      commplex-main > 63409 [ACK] Seq=2 Ack=136114 Win=64087 Len=0 TSV=2766130942 TSER=2766130427
    417 0.007759    127.0.0.1             127.0.0.1             TCP      commplex-main > 63409 [ACK] Seq=2 Ack=150594 Win=62639 Len=0 TSV=2766131082 TSER=2766130839
    418 0.007765    127.0.0.1             127.0.0.1             TCP      commplex-main > 63409 [ACK] Seq=2 Ack=152042 Win=61191 Len=0 TSV=2766131093 TSER=2766130891
    419 0.007797    127.0.0.1             127.0.0.1             TCP      commplex-main > 63409 [ACK] Seq=2 Ack=153490 Win=59743 Len=0 TSV=2766131104 TSER=2766130930
    420 0.007802    127.0.0.1             127.0.0.1             TCP      commplex-main > 63409 [ACK] Seq=2 Ack=137562 Win=62639 Len=0 TSV=2766130951 TSER=2766130477
    421 0.007825    127.0.0.1             127.0.0.1             TCP      commplex-main > 63409 [ACK] Seq=2 Ack=139010 Win=61191 Len=0 TSV=2766130967 TSER=2766130524
    422 0.007849    127.0.0.1             127.0.0.1             TCP      63409 > commplex-main [ACK] Seq=153490 Ack=2 Win=65535 Len=1448 TSV=2766131168 TSER=2766130942
    423 0.007858    127.0.0.1             127.0.0.1             TCP      commplex-main > 63409 [ACK] Seq=2 Ack=140458 Win=59743 Len=0 TSV=2766130976 TSER=2766130563
    424 0.007879    127.0.0.1             127.0.0.1             TCP      commplex-main > 63409 [ACK] Seq=2 Ack=141906 Win=58295 Len=0 TSV=2766130987 TSER=2766130611
    425 0.007895    127.0.0.1             127.0.0.1             TCP      63409 > commplex-main [ACK] Seq=154938 Ack=2 Win=65535 Len=1448 TSV=2766131221 TSER=2766130951
    426 0.007922    127.0.0.1             127.0.0.1             TCP      commplex-main > 63409 [ACK] Seq=2 Ack=143354 Win=56847 Len=0 TSV=2766131001 TSER=2766130648
    427 0.007939    127.0.0.1             127.0.0.1             TCP      63409 > commplex-main [ACK] Seq=156386 Ack=2 Win=65535 Len=1448 TSV=2766131260 TSER=2766130967
    428 0.007966    127.0.0.1             127.0.0.1             TCP      commplex-main > 63409 [ACK] Seq=2 Ack=144802 Win=55399 Len=0 TSV=2766131009 TSER=2766130688
    429 0.007982    127.0.0.1             127.0.0.1             TCP      63409 > commplex-main [ACK] Seq=157834 Ack=2 Win=65535 Len=1448 TSV=2766131304 TSER=2766130976
    430 0.008007    127.0.0.1             127.0.0.1             TCP      commplex-main > 63409 [ACK] Seq=2 Ack=146250 Win=53951 Len=0 TSV=2766131024 TSER=2766130692
    431 0.008031    127.0.0.1             127.0.0.1             TCP      63409 > commplex-main [ACK] Seq=159282 Ack=2 Win=65535 Len=1448 TSV=2766131337 TSER=2766130987
    432 0.008058    127.0.0.1             127.0.0.1             TCP      63409 > commplex-main [ACK] Seq=160730 Ack=2 Win=65535 Len=1448 TSV=2766131371 TSER=2766131001
    433 0.008067    127.0.0.1             127.0.0.1             TCP      commplex-main > 63409 [ACK] Seq=2 Ack=147698 Win=52503 Len=0 TSV=2766131033 TSER=2766130741
    434 0.008082    127.0.0.1             127.0.0.1             TCP      63409 > commplex-main [ACK] Seq=162178 Ack=2 Win=65535 Len=1448 TSV=2766131405 TSER=2766131009
    435 0.008109    127.0.0.1             127.0.0.1             TCP      commplex-main > 63409 [ACK] Seq=2 Ack=149146 Win=64087 Len=0 TSV=2766131056 TSER=2766130793
    436 0.008137    127.0.0.1             127.0.0.1             TCP      commplex-main > 63409 [ACK] Seq=2 Ack=150594 Win=62639 Len=0 TSV=2766131082 TSER=2766130839
    437 0.008160    127.0.0.1             127.0.0.1             TCP      63409 > commplex-main [ACK] Seq=163626 Ack=2 Win=65535 Len=1448 TSV=2766131458 TSER=2766131024
    438 0.008173    127.0.0.1             127.0.0.1             TCP      63409 > commplex-main [ACK] Seq=165074 Ack=2 Win=65535 Len=1448 TSV=2766131462 TSER=2766131024
    439 0.008184    127.0.0.1             127.0.0.1             TCP      63409 > commplex-main [ACK] Seq=166522 Ack=2 Win=65535 Len=1448 TSV=2766131506 TSER=2766131033
    440 0.008218    127.0.0.1             127.0.0.1             TCP      commplex-main > 63409 [ACK] Seq=2 Ack=152042 Win=61191 Len=0 TSV=2766131093 TSER=2766130891
    441 0.008238    127.0.0.1             127.0.0.1             TCP      63409 > commplex-main [ACK] Seq=167970 Ack=2 Win=65535 Len=1448 TSV=2766131539 TSER=2766131056
    442 0.008266    127.0.0.1             127.0.0.1             TCP      commplex-main > 63409 [ACK] Seq=2 Ack=153490 Win=59743 Len=0 TSV=2766131104 TSER=2766130930
    443 0.008286    127.0.0.1             127.0.0.1             TCP      63409 > commplex-main [ACK] Seq=169418 Ack=2 Win=65535 Len=1448 TSV=2766131584 TSER=2766131082
    444 0.008320    127.0.0.1             127.0.0.1             TCP      63409 > commplex-main [ACK] Seq=153490 Ack=2 Win=65535 Len=1448 TSV=2766131168 TSER=2766130942
    445 0.008339    127.0.0.1             127.0.0.1             TCP      63409 > commplex-main [ACK] Seq=170866 Ack=2 Win=65535 Len=1448 TSV=2766131633 TSER=2766131093
    446 0.008368    127.0.0.1             127.0.0.1             TCP      63409 > commplex-main [ACK] Seq=154938 Ack=2 Win=65535 Len=1448 TSV=2766131221 TSER=2766130951
    447 0.008396    127.0.0.1             127.0.0.1             TCP      63409 > commplex-main [ACK] Seq=172314 Ack=2 Win=65535 Len=1448 TSV=2766131686 TSER=2766131104
    448 0.008402    127.0.0.1             127.0.0.1             TCP      commplex-main > 63409 [ACK] Seq=2 Ack=154938 Win=65535 Len=0 TSV=2766131712 TSER=2766131168
    449 0.008414    127.0.0.1             127.0.0.1             TCP      commplex-main > 63409 [ACK] Seq=2 Ack=156386 Win=64087 Len=0 TSV=2766131720 TSER=2766131221
    450 0.008430    127.0.0.1             127.0.0.1             TCP      63409 > commplex-main [ACK] Seq=156386 Ack=2 Win=65535 Len=1448 TSV=2766131260 TSER=2766130967
    451 0.008450    127.0.0.1             127.0.0.1             TCP      63409 > commplex-main [ACK] Seq=157834 Ack=2 Win=65535 Len=1448 TSV=2766131304 TSER=2766130976
    452 0.008478    127.0.0.1             127.0.0.1             TCP      commplex-main > 63409 [ACK] Seq=2 Ack=157834 Win=65535 Len=0 TSV=2766131791 TSER=2766131260
    453 0.008491    127.0.0.1             127.0.0.1             TCP      63409 > commplex-main [ACK] Seq=159282 Ack=2 Win=65535 Len=1448 TSV=2766131337 TSER=2766130987
    454 0.008526    127.0.0.1             127.0.0.1             TCP      commplex-main > 63409 [ACK] Seq=2 Ack=159282 Win=64087 Len=0 TSV=2766131830 TSER=2766131304
    455 0.008540    127.0.0.1             127.0.0.1             TCP      commplex-main > 63409 [ACK] Seq=2 Ack=160730 Win=64087 Len=0 TSV=2766131857 TSER=2766131337
    456 0.008555    127.0.0.1             127.0.0.1             TCP      63409 > commplex-main [ACK] Seq=160730 Ack=2 Win=65535 Len=1448 TSV=2766131371 TSER=2766131001
    457 0.008596    127.0.0.1             127.0.0.1             TCP      63409 > commplex-main [ACK] Seq=162178 Ack=2 Win=65535 Len=1448 TSV=2766131405 TSER=2766131009
    458 0.008603    127.0.0.1             127.0.0.1             TCP      commplex-main > 63409 [ACK] Seq=2 Ack=162178 Win=65535 Len=0 TSV=2766131912 TSER=2766131371
    459 0.008640    127.0.0.1             127.0.0.1             TCP      63409 > commplex-main [ACK] Seq=163626 Ack=2 Win=65535 Len=1448 TSV=2766131458 TSER=2766131024
    460 0.008650    127.0.0.1             127.0.0.1             TCP      commplex-main > 63409 [ACK] Seq=2 Ack=163626 Win=65535 Len=0 TSV=2766131957 TSER=2766131405
    461 0.008681    127.0.0.1             127.0.0.1             TCP      63409 > commplex-main [ACK] Seq=165074 Ack=2 Win=65535 Len=1448 TSV=2766131462 TSER=2766131024
    462 0.008691    127.0.0.1             127.0.0.1             TCP      commplex-main > 63409 [ACK] Seq=2 Ack=165074 Win=65535 Len=0 TSV=2766131999 TSER=2766131458
    463 0.008718    127.0.0.1             127.0.0.1             TCP      commplex-main > 63409 [ACK] Seq=2 Ack=166522 Win=65535 Len=0 TSV=2766132039 TSER=2766131462
    464 0.008736    127.0.0.1             127.0.0.1             TCP      63409 > commplex-main [ACK] Seq=166522 Ack=2 Win=65535 Len=1448 TSV=2766131506 TSER=2766131033
    465 0.008749    127.0.0.1             127.0.0.1             TCP      63409 > commplex-main [ACK] Seq=167970 Ack=2 Win=65535 Len=1448 TSV=2766131539 TSER=2766131056
    466 0.008794    127.0.0.1             127.0.0.1             TCP      commplex-main > 63409 [ACK] Seq=2 Ack=167970 Win=65535 Len=0 TSV=2766132101 TSER=2766131506
    467 0.008800    127.0.0.1             127.0.0.1             TCP      commplex-main > 63409 [ACK] Seq=2 Ack=169418 Win=64087 Len=0 TSV=2766132121 TSER=2766131539
    468 0.008803    127.0.0.1             127.0.0.1             TCP      63409 > commplex-main [ACK] Seq=169418 Ack=2 Win=65535 Len=1448 TSV=2766131584 TSER=2766131082
    469 0.008835    127.0.0.1             127.0.0.1             TCP      63409 > commplex-main [ACK] Seq=170866 Ack=2 Win=65535 Len=1448 TSV=2766131633 TSER=2766131093
    470 0.008878    127.0.0.1             127.0.0.1             TCP      commplex-main > 63409 [ACK] Seq=2 Ack=170866 Win=64087 Len=0 TSV=2766132185 TSER=2766131584
    471 0.008892    127.0.0.1             127.0.0.1             TCP      commplex-main > 63409 [ACK] Seq=2 Ack=172314 Win=64087 Len=0 TSV=2766132211 TSER=2766131633
    472 0.008908    127.0.0.1             127.0.0.1             TCP      63409 > commplex-main [ACK] Seq=172314 Ack=2 Win=65535 Len=1448 TSV=2766131686 TSER=2766131104
    473 0.008942    127.0.0.1             127.0.0.1             TCP      commplex-main > 63409 [ACK] Seq=2 Ack=173762 Win=64087 Len=0 TSV=2766132266 TSER=2766131686
    474 0.008950    127.0.0.1             127.0.0.1             TCP      commplex-main > 63409 [ACK] Seq=2 Ack=154938 Win=65535 Len=0 TSV=2766131712 TSER=2766131168
    475 0.009007    127.0.0.1             127.0.0.1             TCP      63409 > commplex-main [ACK] Seq=173762 Ack=2 Win=65535 Len=1448 TSV=2766132330 TSER=2766131712
    476 0.009012    127.0.0.1             127.0.0.1             TCP      commplex-main > 63409 [ACK] Seq=2 Ack=156386 Win=64087 Len=0 TSV=2766131720 TSER=2766131221
    477 0.009065    127.0.0.1             127.0.0.1             TCP      63409 > commplex-main [ACK] Seq=175210 Ack=2 Win=65535 Len=1448 TSV=2766132388 TSER=2766131720
    478 0.009070    127.0.0.1             127.0.0.1             TCP      commplex-main > 63409 [ACK] Seq=2 Ack=157834 Win=65535 Len=0 TSV=2766131791 TSER=2766131260
    479 0.009093    127.0.0.1             127.0.0.1             TCP      commplex-main > 63409 [ACK] Seq=2 Ack=159282 Win=64087 Len=0 TSV=2766131830 TSER=2766131304
    480 0.009123    127.0.0.1             127.0.0.1             TCP      63409 > commplex-main [ACK] Seq=176658 Ack=2 Win=65535 Len=1448 TSV=2766132447 TSER=2766131791
    481 0.009154    127.0.0.1             127.0.0.1             TCP      63409 > commplex-main [ACK] Seq=178106 Ack=2 Win=65535 Len=1448 TSV=2766132477 TSER=2766131830
    482 0.009157    127.0.0.1             127.0.0.1             TCP      commplex-main > 63409 [ACK] Seq=2 Ack=160730 Win=64087 Len=0 TSV=2766131857 TSER=2766131337
    483 0.009210    127.0.0.1             127.0.0.1             TCP      commplex-main > 63409 [ACK] Seq=2 Ack=162178 Win=65535 Len=0 TSV=2766131912 TSER=2766131371
    484 0.009215    127.0.0.1             127.0.0.1             TCP      63409 > commplex-main [ACK] Seq=179554 Ack=2 Win=65535 Len=1448 TSV=2766132532 TSER=2766131857
    485 0.009263    127.0.0.1             127.0.0.1             TCP      63409 > commplex-main [ACK] Seq=181002 Ack=2 Win=65535 Len=1448 TSV=2766132586 TSER=2766131912
    486 0.009268    127.0.0.1             127.0.0.1             TCP      commplex-main > 63409 [ACK] Seq=2 Ack=163626 Win=65535 Len=0 TSV=2766131957 TSER=2766131405
    487 0.009320    127.0.0.1             127.0.0.1             TCP      commplex-main > 63409 [ACK] Seq=2 Ack=165074 Win=65535 Len=0 TSV=2766131999 TSER=2766131458
    488 0.009326    127.0.0.1             127.0.0.1             TCP      63409 > commplex-main [ACK] Seq=182450 Ack=2 Win=65535 Len=1448 TSV=2766132643 TSER=2766131957
    489 0.009374    127.0.0.1             127.0.0.1             TCP      63409 > commplex-main [ACK] Seq=183898 Ack=2 Win=65535 Len=1448 TSV=2766132696 TSER=2766131999
    490 0.009379    127.0.0.1             127.0.0.1             TCP      commplex-main > 63409 [ACK] Seq=2 Ack=166522 Win=65535 Len=0 TSV=2766132039 TSER=2766131462
    491 0.009431    127.0.0.1             127.0.0.1             TCP      commplex-main > 63409 [ACK] Seq=2 Ack=167970 Win=65535 Len=0 TSV=2766132101 TSER=2766131506
    492 0.009436    127.0.0.1             127.0.0.1             TCP      63409 > commplex-main [ACK] Seq=185346 Ack=2 Win=65535 Len=1448 TSV=2766132754 TSER=2766132039
    493 0.009485    127.0.0.1             127.0.0.1             TCP      63409 > commplex-main [ACK] Seq=186794 Ack=2 Win=65535 Len=1448 TSV=2766132807 TSER=2766132101
    494 0.009494    127.0.0.1             127.0.0.1             TCP      commplex-main > 63409 [ACK] Seq=2 Ack=169418 Win=64087 Len=0 TSV=2766132121 TSER=2766131539
    495 0.009498    127.0.0.1             127.0.0.1             TCP      63409 > commplex-main [ACK] Seq=188242 Ack=2 Win=65535 Len=1448 TSV=2766132811 TSER=2766132101
    496 0.009542    127.0.0.1             127.0.0.1             TCP      63409 > commplex-main [ACK] Seq=189690 Ack=2 Win=65535 Len=1448 TSV=2766132865 TSER=2766132121
    497 0.009547    127.0.0.1             127.0.0.1             TCP      commplex-main > 63409 [ACK] Seq=2 Ack=170866 Win=64087 Len=0 TSV=2766132185 TSER=2766131584
    498 0.009595    127.0.0.1             127.0.0.1             TCP      63409 > commplex-main [ACK] Seq=191138 Ack=2 Win=65535 Len=1448 TSV=2766132918 TSER=2766132185
    499 0.009602    127.0.0.1             127.0.0.1             TCP      commplex-main > 63409 [ACK] Seq=2 Ack=172314 Win=64087 Len=0 TSV=2766132211 TSER=2766131633
    500 0.009660    127.0.0.1             127.0.0.1             TCP      63409 > commplex-main [ACK] Seq=192586 Ack=2 Win=65535 Len=1448 TSV=2766132974 TSER=2766132211
    501 0.009671    127.0.0.1             127.0.0.1             TCP      commplex-main > 63409 [ACK] Seq=2 Ack=173762 Win=64087 Len=0 TSV=2766132266 TSER=2766131686
    502 0.009720    127.0.0.1             127.0.0.1             TCP      63409 > commplex-main [ACK] Seq=194034 Ack=2 Win=65535 Len=1448 TSV=2766133043 TSER=2766132266
    503 0.009726    127.0.0.1             127.0.0.1             TCP      63409 > commplex-main [ACK] Seq=173762 Ack=2 Win=65535 Len=1448 TSV=2766132330 TSER=2766131712
    504 0.009756    127.0.0.1             127.0.0.1             TCP      commplex-main > 63409 [ACK] Seq=2 Ack=175210 Win=65535 Len=0 TSV=2766133083 TSER=2766132330
    505 0.009775    127.0.0.1             127.0.0.1             TCP      63409 > commplex-main [ACK] Seq=175210 Ack=2 Win=65535 Len=1448 TSV=2766132388 TSER=2766131720
    506 0.009801    127.0.0.1             127.0.0.1             TCP      commplex-main > 63409 [ACK] Seq=2 Ack=176658 Win=65535 Len=0 TSV=2766133129 TSER=2766132388
    507 0.009822    127.0.0.1             127.0.0.1             TCP      63409 > commplex-main [ACK] Seq=176658 Ack=2 Win=65535 Len=1448 TSV=2766132447 TSER=2766131791
    508 0.009847    127.0.0.1             127.0.0.1             TCP      commplex-main > 63409 [ACK] Seq=2 Ack=178106 Win=65535 Len=0 TSV=2766133175 TSER=2766132447
    509 0.009868    127.0.0.1             127.0.0.1             TCP      63409 > commplex-main [ACK] Seq=178106 Ack=2 Win=65535 Len=1448 TSV=2766132477 TSER=2766131830
    510 0.009894    127.0.0.1             127.0.0.1             TCP      commplex-main > 63409 [ACK] Seq=2 Ack=179554 Win=65535 Len=0 TSV=2766133221 TSER=2766132477
    511 0.009919    127.0.0.1             127.0.0.1             TCP      63409 > commplex-main [ACK] Seq=179554 Ack=2 Win=65535 Len=1448 TSV=2766132532 TSER=2766131857
    512 0.009949    127.0.0.1             127.0.0.1             TCP      commplex-main > 63409 [ACK] Seq=2 Ack=181002 Win=65535 Len=0 TSV=2766133276 TSER=2766132532
    513 0.009969    127.0.0.1             127.0.0.1             TCP      63409 > commplex-main [ACK] Seq=181002 Ack=2 Win=65535 Len=1448 TSV=2766132586 TSER=2766131912
    514 0.009995    127.0.0.1             127.0.0.1             TCP      commplex-main > 63409 [ACK] Seq=2 Ack=182450 Win=65535 Len=0 TSV=2766133322 TSER=2766132586
    515 0.010015    127.0.0.1             127.0.0.1             TCP      63409 > commplex-main [ACK] Seq=182450 Ack=2 Win=65535 Len=1448 TSV=2766132643 TSER=2766131957
    516 0.010041    127.0.0.1             127.0.0.1             TCP      commplex-main > 63409 [ACK] Seq=2 Ack=183898 Win=65535 Len=0 TSV=2766133368 TSER=2766132643
    517 0.010061    127.0.0.1             127.0.0.1             TCP      63409 > commplex-main [ACK] Seq=183898 Ack=2 Win=65535 Len=1448 TSV=2766132696 TSER=2766131999
    518 0.010088    127.0.0.1             127.0.0.1             TCP      commplex-main > 63409 [ACK] Seq=2 Ack=185346 Win=65535 Len=0 TSV=2766133414 TSER=2766132696
    519 0.010107    127.0.0.1             127.0.0.1             TCP      63409 > commplex-main [ACK] Seq=185346 Ack=2 Win=65535 Len=1448 TSV=2766132754 TSER=2766132039
    520 0.010133    127.0.0.1             127.0.0.1             TCP      commplex-main > 63409 [ACK] Seq=2 Ack=186794 Win=65535 Len=0 TSV=2766133460 TSER=2766132754
    521 0.010153    127.0.0.1             127.0.0.1             TCP      63409 > commplex-main [ACK] Seq=186794 Ack=2 Win=65535 Len=1448 TSV=2766132807 TSER=2766132101
    522 0.010181    127.0.0.1             127.0.0.1             TCP      commplex-main > 63409 [ACK] Seq=2 Ack=188242 Win=65535 Len=0 TSV=2766133507 TSER=2766132807
    523 0.010200    127.0.0.1             127.0.0.1             TCP      63409 > commplex-main [ACK] Seq=188242 Ack=2 Win=65535 Len=1448 TSV=2766132811 TSER=2766132101
    524 0.010229    127.0.0.1             127.0.0.1             TCP      commplex-main > 63409 [ACK] Seq=2 Ack=189690 Win=65535 Len=0 TSV=2766133554 TSER=2766132811
    525 0.010251    127.0.0.1             127.0.0.1             TCP      63409 > commplex-main [ACK] Seq=189690 Ack=2 Win=65535 Len=1448 TSV=2766132865 TSER=2766132121
    526 0.010282    127.0.0.1             127.0.0.1             TCP      commplex-main > 63409 [ACK] Seq=2 Ack=191138 Win=65535 Len=0 TSV=2766133608 TSER=2766132865
    527 0.010300    127.0.0.1             127.0.0.1             TCP      63409 > commplex-main [ACK] Seq=191138 Ack=2 Win=65535 Len=1448 TSV=2766132918 TSER=2766132185
    528 0.010330    127.0.0.1             127.0.0.1             TCP      commplex-main > 63409 [ACK] Seq=2 Ack=192586 Win=65535 Len=0 TSV=2766133658 TSER=2766132918
    529 0.010351    127.0.0.1             127.0.0.1             TCP      63409 > commplex-main [ACK] Seq=192586 Ack=2 Win=65535 Len=1448 TSV=2766132974 TSER=2766132211
    530 0.010377    127.0.0.1             127.0.0.1             TCP      commplex-main > 63409 [ACK] Seq=2 Ack=194034 Win=65535 Len=0 TSV=2766133704 TSER=2766132974
    531 0.010397    127.0.0.1             127.0.0.1             TCP      63409 > commplex-main [ACK] Seq=194034 Ack=2 Win=65535 Len=1448 TSV=2766133043 TSER=2766132266
    532 0.010422    127.0.0.1             127.0.0.1             TCP      commplex-main > 63409 [ACK] Seq=2 Ack=195482 Win=65535 Len=0 TSV=2766133750 TSER=2766133043
    533 0.010442    127.0.0.1             127.0.0.1             TCP      commplex-main > 63409 [ACK] Seq=2 Ack=175210 Win=65535 Len=0 TSV=2766133083 TSER=2766132330
    534 0.010488    127.0.0.1             127.0.0.1             TCP      63409 > commplex-main [ACK] Seq=195482 Ack=2 Win=65535 Len=1448 TSV=2766133811 TSER=2766133083
    535 0.010495    127.0.0.1             127.0.0.1             TCP      commplex-main > 63409 [ACK] Seq=2 Ack=176658 Win=65535 Len=0 TSV=2766133129 TSER=2766132388
    536 0.010544    127.0.0.1             127.0.0.1             TCP      63409 > commplex-main [ACK] Seq=196930 Ack=2 Win=65535 Len=1448 TSV=2766133866 TSER=2766133129
    537 0.010547    127.0.0.1             127.0.0.1             TCP      commplex-main > 63409 [ACK] Seq=2 Ack=178106 Win=65535 Len=0 TSV=2766133175 TSER=2766132447
    538 0.010596    127.0.0.1             127.0.0.1             TCP      63409 > commplex-main [ACK] Seq=198378 Ack=2 Win=65535 Len=1448 TSV=2766133919 TSER=2766133175
    539 0.010600    127.0.0.1             127.0.0.1             TCP      commplex-main > 63409 [ACK] Seq=2 Ack=179554 Win=65535 Len=0 TSV=2766133221 TSER=2766132477
    540 0.010646    127.0.0.1             127.0.0.1             TCP      63409 > commplex-main [ACK] Seq=199826 Ack=2 Win=65535 Len=176 TSV=2766133971 TSER=2766133221
    541 0.010652    127.0.0.1             127.0.0.1             TCP      commplex-main > 63409 [ACK] Seq=2 Ack=181002 Win=65535 Len=0 TSV=2766133276 TSER=2766132532
    542 0.010697    127.0.0.1             127.0.0.1             TCP      commplex-main > 63409 [ACK] Seq=2 Ack=182450 Win=65535 Len=0 TSV=2766133322 TSER=2766132586
    543 0.010722    127.0.0.1             127.0.0.1             TCP      commplex-main > 63409 [ACK] Seq=2 Ack=183898 Win=65535 Len=0 TSV=2766133368 TSER=2766132643
    544 0.010741    127.0.0.1             127.0.0.1             TCP      commplex-main > 63409 [ACK] Seq=2 Ack=185346 Win=65535 Len=0 TSV=2766133414 TSER=2766132696
    545 0.010767    127.0.0.1             127.0.0.1             TCP      commplex-main > 63409 [ACK] Seq=2 Ack=186794 Win=65535 Len=0 TSV=2766133460 TSER=2766132754
    546 0.010788    127.0.0.1             127.0.0.1             TCP      commplex-main > 63409 [ACK] Seq=2 Ack=188242 Win=65535 Len=0 TSV=2766133507 TSER=2766132807
    547 0.010810    127.0.0.1             127.0.0.1             TCP      commplex-main > 63409 [ACK] Seq=2 Ack=189690 Win=65535 Len=0 TSV=2766133554 TSER=2766132811
    548 0.010861    127.0.0.1             127.0.0.1             TCP      commplex-main > 63409 [ACK] Seq=2 Ack=191138 Win=65535 Len=0 TSV=2766133608 TSER=2766132865
    549 0.010876    127.0.0.1             127.0.0.1             TCP      commplex-main > 63409 [ACK] Seq=2 Ack=192586 Win=65535 Len=0 TSV=2766133658 TSER=2766132918
    550 0.010973    127.0.0.1             127.0.0.1             TCP      commplex-main > 63409 [ACK] Seq=2 Ack=194034 Win=65535 Len=0 TSV=2766133704 TSER=2766132974
    551 0.011016    127.0.0.1             127.0.0.1             TCP      commplex-main > 63409 [ACK] Seq=2 Ack=195482 Win=65535 Len=0 TSV=2766133750 TSER=2766133043
    552 0.011028    127.0.0.1             127.0.0.1             TCP      63409 > commplex-main [ACK] Seq=195482 Ack=2 Win=65535 Len=1448 TSV=2766133811 TSER=2766133083
    553 0.011056    127.0.0.1             127.0.0.1             TCP      63409 > commplex-main [ACK] Seq=196930 Ack=2 Win=65535 Len=1448 TSV=2766133866 TSER=2766133129
    554 0.011076    127.0.0.1             127.0.0.1             TCP      commplex-main > 63409 [ACK] Seq=2 Ack=196930 Win=65535 Len=0 TSV=2766134400 TSER=2766133811
    555 0.011116    127.0.0.1             127.0.0.1             TCP      commplex-main > 63409 [ACK] Seq=2 Ack=198378 Win=64087 Len=0 TSV=2766134424 TSER=2766133866
    556 0.011122    127.0.0.1             127.0.0.1             TCP      63409 > commplex-main [ACK] Seq=198378 Ack=2 Win=65535 Len=1448 TSV=2766133919 TSER=2766133175
    557 0.011134    127.0.0.1             127.0.0.1             TCP      63409 > commplex-main [ACK] Seq=199826 Ack=2 Win=65535 Len=176 TSV=2766133971 TSER=2766133221
    558 0.011168    127.0.0.1             127.0.0.1             TCP      commplex-main > 63409 [ACK] Seq=2 Ack=196930 Win=65535 Len=0 TSV=2766134400 TSER=2766133811
    559 0.011181    127.0.0.1             127.0.0.1             TCP      commplex-main > 63409 [ACK] Seq=2 Ack=199826 Win=65535 Len=0 TSV=2766134491 TSER=2766133919
    560 0.011198    127.0.0.1             127.0.0.1             TCP      commplex-main > 63409 [ACK] Seq=2 Ack=200002 Win=65359 Len=0 TSV=2766134506 TSER=2766133971
    561 0.011227    127.0.0.1             127.0.0.1             TCP      commplex-main > 63409 [ACK] Seq=2 Ack=198378 Win=64087 Len=0 TSV=2766134424 TSER=2766133866
    562 0.011252    127.0.0.1             127.0.0.1             TCP      commplex-main > 63409 [ACK] Seq=2 Ack=199826 Win=65535 Len=0 TSV=2766134491 TSER=2766133919
    563 0.011278    127.0.0.1             127.0.0.1             TCP      commplex-main > 63409 [ACK] Seq=2 Ack=200002 Win=65359 Len=0 TSV=2766134506 TSER=2766133971
    564 0.011343    127.0.0.1             127.0.0.1             TCP      63409 > commplex-main [FIN, ACK] Seq=200002 Ack=2 Win=65535 Len=0 TSV=2766134662 TSER=2766134506
    565 0.011360    127.0.0.1             127.0.0.1             TCP      63409 > commplex-main [FIN, ACK] Seq=200002 Ack=2 Win=65535 Len=0 TSV=2766134662 TSER=2766134506
    566 0.011402    127.0.0.1             127.0.0.1             TCP      commplex-main > 63409 [ACK] Seq=2 Ack=200003 Win=65535 Len=0 TSV=2766134718 TSER=2766134662
    567 0.011439    127.0.0.1             127.0.0.1             TCP      commplex-main > 63409 [FIN, ACK] Seq=2 Ack=200003 Win=65535 Len=0 TSV=2766134756 TSER=2766134662
    568 0.011445    127.0.0.1             127.0.0.1             TCP      commplex-main > 63409 [ACK] Seq=2 Ack=200003 Win=65535 Len=0 TSV=2766134718 TSER=2766134662
    569 0.011508    127.0.0.1             127.0.0.1             TCP      commplex-main > 63409 [FIN, ACK] Seq=2 Ack=200003 Win=65535 Len=0 TSV=2766134756 TSER=2766134662
    570 0.011552    127.0.0.1             127.0.0.1             TCP      63409 > commplex-main [ACK] Seq=200003 Ack=3 Win=65535 Len=0 TSV=2766134869 TSER=2766134756
    571 0.011572    127.0.0.1             127.0.0.1             TCP      63409 > commplex-main [ACK] Seq=200003 Ack=3 Win=65535 Len=0 TSV=2766134869 TSER=2766134756
